Pεο2ς	Pεο2ς
TAMTINIT RPHEE.	TAMTINIT RPHÉE.
SA DESCENTE aux Enfers, ſa Mort par les Bacchantes.	SA DESCENTE aux Enfers, sa Mort par les Bacchantes.
TRAGEDIE:	TRAGÉDIE:
Et entres œuures Poëtiques du ſieur DE LRSPINE, Pariſien.	Et entres œuvres Poétiques du sieur DE LRSPINE, Parisien.
A PARTS, Par HENRY SARA, ruë L.	À PARTS, Par HENRY SARA, rue L.
Iean de Latran, à l’enſeigne de l’Alde.	Jean de Latran, à l'enseigne de l'Alde.
M.	M.
DC.	DC.
XXIII.	XXIII.
AVBC PRIVILEGE DV ROT.	AUBC PRIVILÈGE DU ROT.
ſADAME, 5 Il y a quelque temps que mon eſprit ſ'eſt occupé à la compoſition de ceſte Tragedie d’Orphée:	sADAME, 5 Il y a quelque temps que mon esprit s'est occupé à la composition de cette Tragédie d'Orphée:
Layant acheuée, eu égard aux honneurs, & aux bien-faicts qu'autresfois il a pleu à voſtre Majeſté me faire, i'ay pris la hardieſſe de l'expoſer à la mercy des ondes, pour ſ'aller	Layant achevée, eu égard aux honneurs, et aux bienfaits qu'autresfois il a pleu à votre Majesté me faire, j'ai pris la hardiesse de l'exposer à la merci des ondes, pour s'aller
LA R A OYNE DE LA GRAND BRETAGNE.	LA R À OYNE DE LA GRAND BRETAGNE.
preſenter aux pieds de voſtre Majesté.	présenter aux pieds de votre Majesté.
Je ſçay bien, MADAME, que ſi peu de choſe n'eſt pas capable de payer le tribut d’vn ſi grand deuoir, mais il vous plaira d’auoir pluſtoſt égard à l'exrreme deſir que i'ay de plaire à voſtre Majeſté, qu'à mon peu de merite.	Je sais bien, MADAME, que si peu de chose n'est pas capable de payer le tribut d'un si grand devoir, mais il vous plaira d'avoir plutôt égard à l'exrème désir que j'ai de plaire à votre Majesté, qu'à mon peu de mérite.
I'ay tiré ce ſuject d’Ouide, ſous lequel ſe cache vne belle moralité, par laquelle il eſt ayſé à cognoiſtre, que comme l’ombre ſuit le corps, ainſi l’enuie ſuit la vertu, & reſſemble aux Cantharides, qui ſ'attachent touſiours aux plus belles fleurs:	J'ai tiré ce sujet d'Ouide, sous lequel se cache une belle moralité, par laquelle il est aisé à connaître, que comme l'ombre suit le corps, ainsi l'envie suit la vertu, et ressemble aux Cantharides, qui s'attachent toujours aux plus belles fleurs:
De ceſte façon les Bacchantes agitées des fureurs de Bacchus donnerent la mort à ce Poete Thracien, ialouſes de ſes perfections, où vous, MADAME, tout au contraire, par les rares vertus que le Ciel vous a departies, dés l'heure de voſtre naiſſance, & par vos liberalitez pouuez, reſeruer l’eſtre à vn million d’Orphées, ſ'ils ſe pouuoient trouuer.	De cette façon les Bacchantes agitées des fureurs de Bacchus donnèrent la mort à ce Poète Thracien, jalouses de ses perfections, où vous, MADAME, tout au contraire, par les rares vertus que le Ciel vous a départies, dès l'heure de vôtre naissance, et par vos libéralités pouvez, réserver l'être à un million d'Orphées, s'ils se pouvaient trouver.
Fauoriſez donc, MADAME, ce mien petit labeur, vous promettant (ſi i'ay la moindre cognoiſſance qu’il vous retourne à rré) que dans peu de temps ie vous feray voir quelque œuure de plus grande haleine, ſçachant combien la ſeule opinion de faire choſe qui ſoit aggreable a vostre Majesté, me hauſſe l’ame & le courage par deſſus mes forces ordinaires.	Favorisez donc, MADAME, ce mien petit labeur, vous promettant (si j'ai la moindre connaissance qu'il vous retourne à rré) que dans peu de temps je vous ferai voir quelque œuvre de plus grande haleine, sachant combien la seule opinion de faire chose qui soit agréable à votre Majesté, me hausse l'âme et le courage par -dessus mes forces ordinaires.
Cependant ie ſupplieray la ſouueraine Bonté du Tout-puiſſant, qu’il gratifie vostre Regne d’autant d’heur & de prosperité, qu’il a faict par cy-deuant de merueilles, attendant que ie vous puiſſe teſmoigner que ma fin ne me peut eſtre que trop de gloire, pourueu qu'elle vous puiſſe aſſeurer de mon inuiolable affection à voſtre ſeruice, comme	Cependant Seigneur supplierai la souveraine Bonté du Tout-puissant, qu'il gratifie votre Reine d'autant d'heur et de prospérité, qu'il a fait par cy-deuant de merveilles, attendant que je vous puisse témoigner que ma fin ne me peut être que trop de gloire, pourvu qu'elle vous puisse assurer de mon inviolable affection à votre service, comme
Le tres-humble, & tres- obeïſſant ſeruiteur,	Le très-humble, et très- obéissant serviteur,
CH.	CH.
DE LESPINE.	DE LÉPINE.
A LA ROYNE STANCES.	À LA ROYNE STANCES.
4 OYNE, l'honneur de l’Vniuers, Ie ne puis dire par mes Vers Ves graces qui ſont ſans pareilles;	4 OYNE, l'honneur de l'Univers, Je ne puis dire par mes Vers Ves grâces qui sont sans pareilles;
Lon ne ſçauroit les reciter, autaava tuua lese a dua ccasssee Eſtant ſi pleine de merueilles.	Lon ne saurait les réciter, autaava tva lesse à dua cassée Étant si pleine de merveilles.
Car qui voudroit dire le los Qui dedans voſtre ame eſt enclos, Il faudroit reſſembler aux Anges, Et auoir vn eſprit divin:	Car qui voudrait dire le los Qui dedans votre âme est enclos, Il faudrait ressembler aux Anges, Et avoir un esprit divin:
Autrement ce ſereit en vain De penſer dire ves loüanges.	Autrement ce sereit en vain De penser dire venge louanges.
Ariſtote finit ſes iours Dedans les flets, cherchant le cours Du grand flus & reftus de l’onde:	Aristote finit ses jours Dedans les flets, cherchant le cours Du grand flus et refus de l'onde:
Ainſi celuy-là ſe perdreit Qui par trop curieux vondroit Raconter vos Vertus au monde.	Ainsi celui-là se perdreit Qui par trop curieux vondrait Raconter vos Vertus au monde.
Et naiſſant le Ciel vous a faict En vos grandeurs l’eſprit parfaict,	Et naissant le Ciel vous a fait En vos grandeurs l'esprit parfait,
Et remply de ſageſſe extreme, Pour eſtre en ce rond ſpacieux Comme le Soleil dans les Cieux Qui n’eſt ſemblable qu’à ſoy-meſme.	Et rempli de sagesse extrême, Pour être en ce rond spacieux Comme le Soleil dans les Cieux Qui n'est semblable qu'à soi-même.
88 NIQVE ſoing du Ciel, miracle de nos iours, Dont les moindres regards font naiſtre mille amours, Receuez de bon cœur ceſte offrande petite, Et penſeZ en voſtre ame, ô gloire des ortels, Que s’il en faut-offrir ſelon voſtre merite Lon n'en veriu tamuu fumer ſur vos Autels.	88 NIQUE soing du Ciel, miracle de nos jours, Dont les moindres regards font naître mille amours, Recez de bon cœur cette offrande petite, Et pensez en votre âme, ô gloire des ortels, Que s'il en faut-offrir selon vôtre mérite Lon n'en veu tamu fumer sur vos Autels.
D	D
ea Mdeio 4.	ea Mdeio 4.
EPIGRAMMA.	EPIGRAMMA.
Vne cingunt geminis Diui tua tempora lauris, AY Et bene, qui meritis clarus, vtramque refers.	Une cingunt géminis Diva tu tempora lauris, AY Et bene, qui méritis clarus, vtramque refers.
Nam verſu ſuperas vates, dulciùs Orpheo.	Nam versu superas vates, dulciùs Orpho.
Noſti dulciſonæ tangere fila lyræ:	Nosti dulisonæ tangère fila lyræ:
Iure igitur ſpiſſis Orpheum demerſeris vmbris Dum verſu & cithara nomen in orbe refers.	Jure igitur spissis Orpheum demerseris vambris Dum versu et cithara nomen in orbe refers.
A MONSIEVR DE L’ESPINE.	À MONSIEUR DE L'ÉPINE.
’ESPINE deſcriuant la gloire & le trophées Qu’au Royaume des merts emporta ceſt.	Çà ÉPINE décrivant la gloire et le trophées Qu'au Royaume des merts emporta cet.
Orphée Iadis tant renommé pour ſon luih & ſes vers, Tu as pris vn ſubiect qui t’eſt fort conuenable:	Orphée Jadis tant renommé pour son luih et ses vers, Tu as pris un sujet qui t'est fort convenable:
Par tes vers comme luy tu te reuds remarquable, Et fais voler ton nom par tout ces Vniuers.	Par tes vers comme lui tu te reuds remarquable, Et fais voler ton nom par tout ces Univers.
Orphée par le ſon de ſa douce Muſique Attiroit bien à ſoy quelque Peuple ruſtique, On queiquis tnojens dex amnesœdis cons Mais toy tu fais bien plus, car par la reſonnance Des cordes de ton luth tu as telle puiſſance Que tu rauis les cœurs des Princes & des Roys.	Orphée par le son de sa douce Musique Athirait bien à soi quelque Peuple rustique, On queiquis tojents dex amnesœdis cons Mais toi tu fais bien plus, car par la résonnance Des cordes de ton luth tu as telle puissance Que tu ravis les cœurs des Princes et des Rois.
I.	I.
D.	D.
S.	S.
I.	I.
Source gallica.	Source galica.
bnf.	bnf.
fr ( Biblic è ancé	fr ( Biblic ancé
L ATRAIN.	L ATRAIN.
On priſera ton luth, l'autre te Pœëſie, Vn tiers ſe trouuera d’vn iugement diuers;	On prisera ton luth, l'autre te Pœuesie, Un tiers se trouvera d'un jugement divers;
Chacun en iugera ſelon ſa fantaiſie, toy uvumaneny pa len ddes o tes ouse	Chacun en jugera selon sa fantaisie, toi uvumaneny pay len ddes ô tes ouse
G.	G.
B.	B.
D.	D.
AV MESME AVTHEVR --	AU MÊME AUTHÉVR --
EPIGRAMME.	ÉPIGRAMME.
À terre dans ſon ſein enferme ſes treſors Et toy tu vas cachant au dedans de ton corps Plus de dens precieux que n'en a la Nature.	À terre dans son sein enferme ses trésors Et toi tu vas cachant au dedans de ton corps Plus de dents précieux que n'en a la Nature.
Iuplier en naiſſant t’en a voule combler N’eſpargnant du teut rien pour te voir reſſembler A ces deux puiſſants Dieux Apollon & Mercure.	Juplier en naissant t'en a voule combler N'épargnant du tut rien pour te voir ressembler À ces deux puissants Dieux Apollon et Mercure.
R.	R.
F.	F.
S N NET 2 L2 CLC.	S N NET 2 L2 CLC.
MICHEL I	MICHEL I
ANGELO LEFORT.	ANGELO LEFORT.
Rſee ſol Cantor frà mille cantori Con vago, e dolce paſtorale accento Della diuina Muſica, eſtromente, Vinſe la rabbis di leoni, e tori.	Ruse sol Cantor frà mille cantori Con vago, e dolce pastorale accento Della divina Musica, étromente, Vinse la rabbis le dioni, e tori.
Auce la moglie haueſſe tratta fuori Del regno de Pluione;	Auce la moglie havesse tratta fuori Del régno de Pluione;
ſe contente Non foſſe mai, per l’ameroſo ſtente, Voltato dietro, vnde perſe i lauori.	se contente Non fosse mai, per l'améroso stente, Voltato diétro, unde perse y juori.
Mà tu, L’Eſpine, con ſi ricce ſpoglie D’orſeo, e di ſuoi non vincibili àmori, Rendi ad amendue vitale aiute.	Mà tu, L'Espine, con si ricce spoglie D'orseo, eu di suoi non vincibili àmori, Rendi ad amendue vitale aiute.
.	.
Orpheo non diede de la vita à ſua moglie, Tu fai che l'vno, & l'altra maï non muori, Orfeo con carmi, Burydice cal luïto.	Orpheo non dide de la vita à sua moglie, Tu fay che l'vno, et l'altra maî non muori, Orfeo con carmi, Burydice cal luïto.
7	7
MV LESEEVN.	MU LESEUN.
My Lecteur, pour ſatisfaire au doubte que tu pourrois auoir ſi tu as autrefois ouy quelques vers de ces miennes conceptions, ie t’aduertis de ne les attribuer à dautres qu’à moy.	Mi Lecteur, pour satisfaire au doute que tu pourrais avoir si tu as autrefois oui quelques vers de ces miennes conceptions, ils t'avertis de ne les attribuer à dautres qu'à moi.
I'ay recueilly les minuttes d’icelles eſparſes ça & là, comme d’vn naufrage;	J'ai recueilli les minuttes d'icelles éparses ça et là, comme d'un naufrage;
non toutes, mais celles que le hazard ma peu conſeruer pour les expoſer au fugement d’vn chaſcun.	non toutes, mais celles que le hasard ma peu conserver pour les exposer au fugement d'un chacun.
Ce que i'en ay faict eſt pluſtoſt par prieres de quelques vns de mes amis que demon propre motif:	Ce que j'en ai fait est plutôt par prières de quelques uns de mes amis que démon propre motif:
toutefois afin que nul ne ſe trompe, mon intention n'eſt pas d'employer cecy pour excuſe contre vn tas de controlleurs, qui ne voyent iamais rien que pour y trouuer ſubiect de ſ'y deſ plaire.	toutefois afin que nul ne se trompe, mon intention n'est pas d'employer ceci pour excuse contre un tas de controlleurs, qui ne voient jamais rien que pour y trouver sujet de s'y des plaire.
Ie me contenteray ſeulement d’en laiſſer la cognoiſſance à ceux qui iugent des choſes ſainement & ſans paßion.	Je me contenterai seulement d'en laisser la connaissance à ceux qui jugent des choses sainement et sans passion.
OVYSPAR LA GRACE DE DIEV ROY DE FRANCE ET-DE NAVARRE, A nos amez & feaux Conſeillers les gens tenans nos Cours de Parlement de Paris, Toloze, Rouen, Bordeaux, Dijon, Aix, Grenoble, Bretaigne, Baillifs, Seneſchaux & Preuoſts deſdits lieux, & à tous nos autres Iuſticiers, Officiers & ſubiects quil appartiendra, Salut.	OUYSPAR LA GRACE DE DIEU ROY DE FRANCE ET-DE NAVARRE, A nos âmez et féaux Conseillers les gens tenants nos Cours de Parlement de Paris, Toloze, Ren, Bordeaux, Dijon, Aix, Grenoble, Bretaigne, Baillifs, Sénéchaux et Preuosts dédits lieux, et à tous nos autres Iusticiers, Officiers et sujets quil appartiendra, Salut.
Noſtre bien aymé HENRY SARA, Marchant Libraire en l'Vniuerſité de ceſte noſtre bonne ville de Paris, Nous a faict tres-humblement dire & remonſtrer qu’il luy a eſté mis en ſes mains vn liure intitulé, La Deſcente d’orphle aux Enfers, Tragedie Françoiſe compoſte par le sieur de L’Eſpine, Enſemble quelques Conceptions poetiques du meſme Autheur:	Notre bien aimé HENRY SARA, Marchant Libraire en l'Université de cette grande bonne ville de Paris, Nous a fait très-humblement dire et remonstrer qu'il lui a été mis en ses mains un livre intitulé, La Décente d'orphle aux Enfers, Tragédie Française compote par le sieur de L'Espine, Ensemble quelques Conceptions quelques du mesme Autheur:
Lequel liure il ſeroit volontiers imprimer & mettre en lumiere ſ'il nous plaiſoit luy permettre & luy octroyer nos lettres ſur ce neceſſaires:	Lequel livre il serait volontiers imprimer et mettre en lumière s'il nous plaisait quelque permettre et lui octroyer nos lettres sur ce nécessaires:
A ces cauſes deſirant fauoriſer l'expoſant, luy auons permis, accordé & octroyé, permettons, accordons & octroyons pat ces preſentes qu’il puiſſe & luy ſoit loiſible de l’imprimer du faire imprimer en tel volume & caractere que bon luy ſemblera;	À ces causes désirant favoriser l'exposant, lui avons permis, accordé et octroyé, permettons, accordons et octroyons pat ces présentes qu'il puisse et lui soit loisible de l'imprimer du faire imprimer en tel volume et caractère que bon lui semblera;
Iceluy vendre & debiter par tous les lieux & endroits de ceſtuy noſtre Royaume iuſques au terme de ſix ans prochains & conſecutifs, ſans que pendant ledict temps aucuns Libraires ny Imprimeurs le puiſſent imprimer, vendre ny diſtribuer en ceſtuy noſtre Royaume ſur peine de confiſcation deſdits liures & d’amande arbitraire.	Icelui vendre et débiter par tous les lieux et endroits de celui notre Royaume jusques au terme de six ans prochains et consécutifs, sans que pendant ledit temps aucuns Libraires ici Imprimeurs le puissent imprimer, vendre ni distribuer en celui notre Royaume sur peine de confiscation dédits livres et d'amande arbitraire.
Si vous mandons, & commettons, & enjoignons par ces preſentes que de noſtre preſent Congé & Permiſſion vous faciez & laiſſiez iouir plainement & paiſiblement ledict Sara?	Si vous mandons, et commettons, et enjoignons par ces présentes que de notre présent Congé et Permission vous fassiez et laissiez jouir plainement et paisiblement ledict Sara?
Et à ce que perſonne n’en pretende cauſe d’ignorãce, voulons qu’en mettant au commencement ou à la fin du dit Liure vn Extraict deſdites preſentes elles ſoient tenuës pour ſuſſiſantes & notifices;	Et à ce que personne n'en prétende cause d'ignorance, voulons qu'en mettant au commencement ou à la fin du dit Livre un Extrait desdites presentes elles soient tenues pour sussisantes et notifiées;
Car tel eſt noſtre plaiſir.	Car tel est notre plaisir.
Donné à Paris le vingt-ſixieſme iour d’Aouſt I’an de grace mil ſix cens vingt trois, & de noſtre regne le quatorzſeime.	Donné à Paris le vingt-sixième jour d'Août J'an de grâce mil six cens vingt trois, et de notre règne le quatorzseime.
Signé,	Signé,
Par le Conſeil,	Par le Conseil,
PIGRAY.	PIGRAY.
Et ſeellé en cire iaune.	Et seellé en cire jaune.
Caron,	Caron,
LA	LA
LA DESCENTE D'ORPHEE AVX ENFERS, TRAGEDIE.	LA DESCENTE D'ORPHÉE AUX ENFERS, TRAGÉDIE.
ACTÉ PREMIER.	ACT PREMIER.
Orphée, Iupiter, Mars, Cupidon, Phœbus, Mercure, Eurydice, Berger, Chaſſeur.	Orphée, Jupiter, Mars, Cupidon, Phœbus, Mercure, Eurydice, Berger, Chasseur.
Orphée.	Orphée.
VISSANTES Deitez, ô grands Dieux immorsels, Nous deuons bien offrir ſur vos diuins autels, Nous deuons bien tous deux vn ſas crifice rendre En ſigne des honneurs d’auoir daigné deſcendre De l'empire des Cieux, en nos humauitez Henorer ce beau iour de vos diuinitez.	VISANTES Ditez, ô grands Dieux immorsels, Nous devons bien offrir sur vos divins autels, Nous devons bien tous deux un sas crifice rendre En signe des honneurs d'avoir daigné descendre De l'empire des Cieux, en nos humavités Hénorer ce beau jour de vos divinités.
Ma chete eſpouſe & moy ne pouuons ſatisfaire Aux biens & aux honneurs qu’il vous a pleu nous Nous vous temercions d’vn cœur deuotieux (faire:	Ma chète épouse et moi ne pouvons satisfaire Aux biens et aux honneurs qu'il vous a pleu nous Nous vous témercions d'un cœur dévotieux (faire:
Ne pouuant vous offrir rien de plus precieux.	Ne pouvant vous offrir rien de plus précieux.
lupiter.	lupiter.
Or ſus viuez heureux, & que iamais l’enuie Ne vous puiſſe troubler au cours de voſtre vie, Que vous ne puißiez point tomber entre ſes mains.	Or sus vivez heureux, et que jamais l'envie Ne vous puisse troubler au cours de votre vie, Que vous ne puissiez point tomber entre ses mains.
Moy qui tiens deſſur tous l’empire des humains, Et qui regne au plus haut de la troupe diuine, Ie ne conſentiray iamais voſtre ruine:	Moi qui tiens dessur tous l'empire des humains, Et qui règne au plus haut de la troupe divine, Je ne consentirai jamais votre ruine:
Tant que ma deité deſſur tous regnera, Iamais le feu du Ciel ne vous offenſera.	Tant que ma deité dessur tous régnera, Iamais le feu du Ciel ne vous offensera.
Mars.	Mars.
Et moy qui ſous mes loix arme les braues Princes Aux furieux aſſauts dans leurs grandes Prouinces, Qui les belles citez fais renuerſer en bas, Par les rudes efforts des genereux combats, Et qui ſuis redouté pour l’effroy de mes armes, Ie vous exempteray des ſanglantes allirmes.	Et moi qui sous mes lois arme les braves Princes Aux furieux assauts dans leurs grandes Provinces, Qui les belles cités fais renverser en bas, Par les rudes efforts des généreux combats, Et qui suis redouté pour l'effroi de mes armes, Je vous exempterai des sanglantes allirmes.
On recognoiſt aſſez la force & le pouuoir Que ſous mes eſtendards ſans ceſſe ie fais voir.	On reconnaît assez la force et le pouvoir Que sous mes étendards sans cesse personne fais voir.
Cupidon.	Cupidon.
ViueZ d’vn bon accord le reſte de vos iours, Et contents ioüyſſez de cto:	Vivez d'un bon accord le reste de vos jours, Et contents jouissez de cto:
belles Amours, Ayant deſſous mes loix le Ciel, l’Enfer & l’onde, Et tout ce que l’on void ſur la machine ronde:	belles Amours, Ayant dessous mes lois le Ciel, l'Enfer et l'onde, Et tout ce que l'on voit sur la machine ronde:
Ie veux malgré le ſort, vous rendre deſormau En vos affections fidelles à iamais;	Je veux malgré le sort, vous rendre désormau En vos affections fidèles à jamais;
Vous ſerez ſi conſtans aux plaines Elyſées Que vos ames ſeront de mes feux embraſees:	Vous serez si constants aux plaines Elysées Que vos âmes seront de mes feux embrasée:
Si la mort a pouuoir de vos iours abreger, Elle ne pourra pas vos conſtances changer.	Si la mort a pouvoir de vos jours abréger, Elle ne pourra pas vos constances changer.
Phœbus.	Phœbus.
Moy qui rends des mortels la poitrine enflammee, Qui les rends à iamais heureux en renommee, Qui donne iour aux Cieux, à la terre, à la Mer, Qui puis de mes rarons ce bas monde enflammer, Ie feray quelque iour par la douce harmonte Du Luth & de la voix enſemblément vnie, Que le ſon rauiſſant de vos accords diuins Pour r'animer les morts vn iour ne ſeront vains.	Moi qui rends des mortels la poitrine enflammée, Qui les rends à jamais heureux en renommée, Qui donne jour aux Cieux, à la terre, à la Mer, Qui puis de mes rarons ce bas monde enflammer, Je ferai quelque jour par la douce harmonte Du Luth et de la voix ensemblément unie, Que le son ravissant de vos accords divins Pour ranimer les morts un jour ne seront vains.
Mercure.	Mercure.
D'vn eloquent parler voſtre ame genereuſe Obtiendra le laurier de la ſlimme amoureuſe, D’vne ſubtilité, d’vn parler gracieux Vous ſerez ſans pareil dans ce rond ſpacieux, Vos diſcours releuez forceront la mort meſme De vous preſter ſecours dans le riuage bleſme.	D'un éloquent parler votre âme généreuse Obtiendra le laurier de la slimme amoureuse, D'une subtilité, d'un parler gracieux Vous serez sans pareil dans ce rond spacieux, Vos discours relevez forceront la mort même De vous prêter secours dans le rivage blême.
Orphée.	Orphée.
Tant que nous vſerons le reſte de nos ans, Grâce nous vous rendrons de ces dinuins preſens, Et deſſur vos autels nos ames euflammees Seront à vous offrir nuict & iour animées.	Tant que nous userons le reste de nos ans, Grâce nous vous rendrons de ces dinuins presens, Et dessur vos autels nos âmes euflammées Seront à vous offrir nuit et jour animées.
Or ſus donc, mon eſpoir, il nous faut viure heureux, Cueillant les fruicts d’amour deſſur tous ſauoureux.	Or sus donc, mon espoir, il nous faut vivre heureux, Cueillant les fruits d'amour dessur tous savoureux.
Aſſeurez-vous de moy, ne penſeZ que mon ame Puiſſe iamais ſentir l’ardeur d’vne autre famme, Car pluſtoſt l’on verra tarir toute lu Mer Quinfaele ie manque A vous vouloir aymer,	Assurez-vous de moi, ne pensez que mon âme Puisse jamais sentir l'ardeur d'une autre famme, Car plutôt l'on verra tarir toute lu Mer Quinfaèle fait manque A vous vouloir aimer,
Eurydice.	Eurydice.
Tout de meſme, mon cœur, aſſeurez-vous, ma vie, Que ie n’auray iamais dans l’ame d’autre enuie;	Tout de même, mon cœur, assurez-vous, ma vie, Que ie n'aurai jamais dans l'âme d'autre envie;
Le Ciel n’a qu’vn Soleil, qui nous donne le iour, Ainſi ſeul vous ſereZ phare de mon amour.	Le Ciel n'a qu'Hô Soleil, qui nous donne le jour, Ainsi seul vous serez phare de mon amour.
Mais las!	Mais las!
ie crains beaucoup que le deſtin contraire De nos chaſtes amours taſche de nous diſtratre.	Ne crains beaucoup que le destin contraire De nos chastes amours tâche de nous distratre.
Helas!	Hélas!
helas!	hélas!
ie crains qu’vn ſiniſtre malheur Vienne pour empeſcher noſtre iore & noſtre heur?	Ne crains qu'un sinistre malheur Vienne pour empêcher notre jore et notre heur?
Hymen s’en eſt allé d’vn courroucé viſage Qui me faict ſoupçonner quelque mauuais preſage.	Hymen s'en est allé d'un courroucé visage Qui me fait soupçonner quelque mauvais présage.
et Dieunapuint monſre de omfigne en partant, Qui cauſe qu’en mon cœur ie le vay redoutant;	et Dieunappuint monsre de omfigne en partant, Qui cause qu'en mon cœur toujours le vais redoutant;
Car de luy ſeul deſpend noſtre heureux hrmenee.	Car de lui seul dépend notre heureux hrmène.
Orphée.	Orphée.
Non, non, ne craignez point puis que ceſte iournée Enſemble nous auons tant de preſens des Cieux Qui nous peut offencer en ce rond ſpacieux?	Non, non, ne craignez point puis que cette journée Ensemble nous avons tant de présents des Cieux Qui nous peut offenser en ce rond spacieux?
Iutin, l'Amour, Phœbus, & le Dieu des armees Ne deluiſſeront pas nos ames enflammées:	Jutin, l'Amour, Phœbus, et le Dieu des armées Ne déluisseront pas nos âmes enflammées:
Et ſi le Dieu nopcier nous veut abandonner, Par offrandes & vœux taſchons le destourner.	Et si le Dieu nopcier nous veut abandonner, Par offrandes et vœux tâchons le détourner.
Cependant, mon eſpoir, allons coeiſlir les roſes Qui ſur vos leures ſont nouxellement eſcloſes.	Cependant, mon espoir, allons coésislir les roses Qui sur vos lèvres sont nouxellement écloses.
Le Berger amoureux.	Le Berger amoureux.
Entre tous les malheurs auſquels nous ſommes ne!	Entre tous les malheurs auxquels nous sommes ne!
Où d’vn ſort rigoureux nous ſommes deſtinez, Las!	Où d'un sort rigoureux nous sommes destinez, Las!
ce n’eſt point d’offrlr ſa vie en ſacrifice, Ce n’eſt point de tomber au creux d’vn precipice, Ce n’eſt point de paſſer mille & mille dangers, En allant viſiter les pays eſtrangers, Ny d’eſtre ſur la mer à la mercy des ondes Quand par les vents émeus elles ſont vagabondes, Ny pour ſe voir iamais en priſon arreſté, Sans conſelation reduict en pauureté, Endurer de la faim & de la ſoif enſemble;	ce n'est point d'offrlr sa vie en sacrifice, Ce n'est point de tomber au creux d'un précipice, Ce n'est point de passer mille et mille dangers, En allant visiter les pays étrangers, Ny d'être sur la mer à la mercy des ondes Quand par les vents émus elles sont vagabondes, Ni pour se voir jamais en prison arrêté, Sans conselation réduit en pauvreté, Endurer de la faim et de la soif ensemble;
