Car l’homme doüé d’vn eſprit ſage-meur, Sçait bien qu’il l’a party d’vne volonté franche, Telle que la raiſon oncque-mais ne retranche.	Car l'homme doüé d'une esprit sage-meur, Sait bien qu'il l'a parti d'une volonté franche, Telle que la raison onc-mais ne retranche.
D’ailleurs ne voit-on pas que couſtumierement La ſubſtance, qui vit de brutal ſentiment, Penche deuers le litn comnenaoie u jon gurt, Tant pour ſ'y delecter, qu’en repos tousjours eſtre?	D'ailleurs ne voit-on pas que coutumièrement La substance, qui vit de brutal sentiment, Penche devers le litn comnenaoie jon gurt, Tant pour s'y délecter, en repos tousjours être?
Tout ainſi que l’oyſeau de plumage touffu Se plaiſt en l’air ſerein, la ſalemandre au feu;	Tout ainsi que l'oiseau de plumage touffu Se plaît en l'air serein, la salémandre au feu;
Le poiſſon dedans l'eau & la taupe en la terre, Dans quoy leur volupté les fait poſter grand erre.	Le poisson dedans l'eau et la taupe en la terre, Dans quoi leur volupté les fait poster grand erre.
Si Nature donna ce propre aux animaux, Dieu (qui en eſt l’ouurier ſans ſuer de trauaux) Auroit, tout-puiſſant, paraliſé les hommes Pour noz premiers parens, affamez mange-pommes, Qu’ils rampaſſent percluz d’encline volonté Les brutes ſ'en jouans par ſa chere bonté.	Si Nature donna ce propre aux animaux, Dieu (qui en est l'ouvrier sans suer de travaux) Aurait, tout-puissant, paralysé les hommes Pour nô premiers parents, affamés mange-pommes, Qu'ils rampassent percluz d'encline volonté Les brutes s'en jouants par sa chère bonté.
Tant s’en faut c’eſt celuy (dont les douces delices Repairent dans les cœurs des mortels ſans malices) Qui veut qu’ils ayent tous leurs inclinations Diuerſes, comme ils ſont diuers de nations.	Tant s'en faut c'est celui (dont les douces délices Répairent dans les cœurs des mortels sans malices) Qui veut qu'ils aient tous leurs inclinations Diverses, comme ils sont divers de nations.
Ainſi mon paſſe-temps en ce paſſable monde Comme au plaiſir à quoy Nature nous ſemonde ] Ceſt de viure ſeulet, aſſouuy de mon ſort Vuide d’authorité ſouuent moleſte fort.	Ainsi mon passe-temps en ce passable monde Comme au plaisir à quoi Nature nous semonde ] Cest de vivre seulet, assoui de mon sort Vuide d'autorité souvent moleste fort.
Vous m'excuferez dont ſi je vons remercie:	Vous m'excuserez dont si je vons remercie:
Gens plus dignes que moy ſe treuuent en lycie.	Gens plus dignes que moi se trouvent en lycie.
DION.	DION.
Quoy, Monſieur, voudriez-vous vous opiniaſtrer?	Quoi, Monsieur, voudriez-vous vous opiniâtrer?
S.	S.
NICOLAS.	NICOLAS.
Ie ne deſtre pomnt ue thurge mempguer.	Je ne dêtre pomnt ue thurge mempguer.
DION.	DION.
Vous meſpriſerez donc la volonté diuine.	Vous mépriserez donc la volonté divine.
S NICOLAS.	S NICOLAS.
Pluſtot ſoy-ie eſcaché d’vne gueule louuine.	Plutôt soi-je écaché d'une gueule louuine.
DION.	DION.
Tel qui veut, aheurté, quelque choſe de ſoy, Celuy ſe prend à Dieu, ſi je ne me deçoy.	Tel qui veut, aheurté, quelque chose de soi, Celui se prend à Dieu, si je ne me déçois.
Car ainſi qu’au Roy ſeul appartient la couronne:	Car ainsi qu'au Roi seul appartient la couronne:
La pure volonté au ſeul-vray Dieu ſe donne.	La pure volonté au seul-vrai Dieu se donne.
Volonté de qui ſourd vne exceßiue mer De biens ſpirituels par ſon immenſe aymer.	Volonté de qui sourd avoir excessiue mer De biens spirituels par son immense aimer.
Comme à contraire poinct vn je-le-veux de l’homme, S’accueille des mal-heurs ſus mal-heurs en grand' ſomme.	Comme à contraire point un je-le-veux de l'homme, S'accueille des malheurs sus malheurs en grand somme.
Donc j'infere qu’il faut que l’homme rende à Dieu Son emprunté vouloir auec vn bel adieu.	Donc j'infère qu'il faut que l'homme rende à Dieu Son emprunté vouloir apprendre un bel adieu.
D’auantage, Monſieur, je ne veux pas vous taire Quelque obſeruation de l’exploit militaire Pour vaincre glorieux, le gendarme s’eſmut Et par ſigne vocal, & mi-vocal, & mut, Qui ſont commandemens, clairons, drapeaux de Prince, Gardez, ouys, connuz par le fort, & le mince.	D'avantage, Monsieur, je ne veux pas vous taire Quelque observation de l'exploit militaire Pour vaincre glorieux, le gendarme s'émut Et par signe vocal, et mi-vocal, et mut, Qui sont commandements, clairons, drapeaux de Prince, Gardez, ouïs, connuz et le fort, et le mince.
Voulez-vous piaffer & voguer en credit, Obeïſſez à Dieu, ſa parole le dit.	Voulez-vous piaffer et voguer en crédit, Obéissez à Dieu, sa parole le dit.
Parole de Seigneur non pas moins redoutable, Qu'elle eſt en ſes effets de tout poinct veritable.	Parole de Seigneur non pas moins redoutable, Qu'elle est en ses effets de tout point véritable.
Les Prophetes obſcurs le ſonnent ſourdement;	Les Prophètes obscurs le sonnent sourdement;
Les exemples priuez l’enſeignent mutement.	Les exemples privés l'enseignent mutement.
He!	He!
ne voyons-nous pas que tout aſtre mobile Gyrant au firmament ſuit le premier Mobile?	ne voyons-nous pas que tout astre mobile Gyrant au firmament suit le premier Mobile?
Les planetes außi par les influxions Aſſeruiſſans la mer à leurs deuotions.	Les planètes aussi par les influxions Asseruissants la mer à leurs dévotions.
Elle f'enfle tantoſt, tantoſt elle ſ'abbaiſſe:	Elle s'enfle tantôt, tantôt elle s'abaisse:
Tantoſt eſt en couroux, tantoſt elle le laiſſe.	Tantôt est en courroux, tantôt elle le laisse.
L’oyſeau hymetien refractaire à ſon Roy, A force d’eſguillons eſt occy par leur Loy.	L'oiseau hymetien réfractaire à son Roi, À force d'éguillons est occi par leur Loi.
Soignez doncques à vous, & prenez cet offices Da Car vn prompt obeïr vaut mieux que ſacrifice.	Soignez donc à vous, et prenez cet offices Da Car un prompt obéir vaut mieux que sacrifice.
S.	S.
NICOLAS.	NICOLAS.
mon imperfection peut me deſobliger De l'office dequoy vous voulez me charger.	mon imperfection peut me désobliger De l'office dequoy vous voulez me charger.
DION.	DION.
Qu'elle imperfection?	Qu'elle imperfection?
S.	S.
NICOLAS.	NICOLAS.
Ma fragile jeuneſſe, Certain mal intermis, qui grieuement me bleſſe:	Ma fragile jeunesse, Certain mal intermis, qui grièvement me blesse:
Le funeſte danger pour la difficulté.	Le funeste danger pour la difficulté.
C’eſt que doit eſtre enfin le pouuoir conſulté.	C'est que doit être enfin le pouvoir consulté.
Le jeune faune cerf ne s’eſlance en la plaine Tant que ſa teſte ſoit de ſes ramures pleine:	Le jeune faune cerf ne s'élance en la plaine Tant que sa tête soit de ses ramures pleine:
L’homme ne doit außi s’émanciper, deuant Que s’eſtre dûment fait & puiſſant & ſçauant.	L'homme ne doit aussi s'émanciper, devant Que s'être dûment fait et puissant et savant.
Sçauant, pour deſpeßir l’ignorance vulgaire:	Savant, pour despessir l'ignorance vulgaire:
Puiſſant, pour chaſtier ceux qui ne valent guere.	Puissant, pour châtier ceux qui ne valent guère.
Moy, qui manque, pauuret, d’vn ſi real auoir, De telle dignité deuriez-vous me pouruoir?	Moi, qui manque, pauvret, d'un si real avoir, De telle dignité devriez-vous me pourvoir?
Comme d’vn corps complet la plus noble partie C’eſt la teſte (dit-on) eſtant la mieux partie De ſang pur, & ſubtil, que tout autre qui ſoit.	Comme d'un corps complet la plus noble partie C'est la tête (dit-on) étant la mieux partie De sang pur, et subtil, que tout autre qui soit.
De meſme le Prelat, ainſi qu'on apperçoit, Ayant à regenter vne troupe aſſeruie, Faut qu’il ſoit par ſus tous de bonne & ſaincte vie Si l’eſmeute du ſang cauſe du mal au chef, La fabrique du corps reſſent de ce meſcheſ:	De même le Prélat, ainsi qu'on aperçoit, Ayant à régenter une troupe asservie, Faut qu'il soit par sus tous de bonne et sainte vie Si l'émeute du sang cause du mal au chef, La fabrique du corps ressent de ce mèches:
Ainſi quand vn paſteur infirme ſe rencontre, Souuent arriue-t’il au troupeau mal-encontre:	Ainsi quand un pasteur infirme se rencontre, Souuent arrive-t-il au troupeau malencontre:
Ie croy que vous ſcachiez que les vertigineux Ne doiuent monter haut, peur de choir deuant euxDe fait à l’eſtourdy grimper en haute charge, Qu'on ne culbute en bas longuement on ne targe.	Je crois que vous sachiez que les vertigineux Ne doiuent monter haut, peur de choir deuant euxDe fait étourdi grimper en haute charge, Qu'on ne culbute en bas longuement on ne targe.
Quand à moy j'en ſuis là, mon debile cerueau Me deffend d’eſcheller ce dangereux coupeau.	Quand à moi j'en suis là, mon débile cerveau Me défend d'escheller ce dangereux coupeau.
La cheute pour certain n’en ſeroit moins mauuaiſe, Que du fol Phaëton, qui meit le monde en braiſe:	La chute pour certain n'en serait moins mauvaise, Que du fol Phaëton, qui meit le monde en braise:
Lors que, trop eſuclé, il rodoit à l’entour anedecetea tui quiiren tar qpler an joare La charge de Prelat vrayment eſt honorable, Mais conduite ſans frein c’eſt la plus miſerable.	Lors que, trop esuclé, il rodait à l'entour anedecetea tui quiiren tar qpler an joare La charge de Prelat vraiment est honorable, Mais conduite sans frein c'est la plus misérable.
EROS.	EROS.
Monſieur, permettez-moy vous donner des aduis, Qui vous abbecheront, s’ils ſont gayement ſuiuis.	Monsieur, permettez-moi vous donner des avis, Qui vous abécheront, s'ils sont gaiement suivis.
s NICOLAS.	s NICOLAS.
Tout ce qu’il vous plaira.	Tout ce qu'il vous plaira.
EROS.	EROS.
Vous auez ce me ſemble, Nous eſtallé, diſert, voz excuſes enſemble:	Vous avez ce me semble, Nous estallé, disert, z excuses ensemble:
Si vous faut-il pourtant de nous vous allier, Et à ce bel eſtat ſerrement vous lier.	Si vous faut-il pourtant de nous vous allier, Et à ce bel état serrement vous lier.
Vous eſtes trop foiblet, nous faites-vous accroire, Bien, je poſe qu’il ſoit aucunement notoire.	Vous êtes trop faiblet, nous faites-vous accroire, Bien, je pose qu'il soit aucunement notoire.
Mais vn mõt la deſſus, pour vous perſuader Comme vous ne pouuez oncques en euader.	Mais un mont la dessus, pour vous persuader Comme vous ne pouvez oncques en évader.
Au naturel deffaut l’artifice ſupplée.	Au naturel défaut l'artifice supplée.
Quand Titan mouille au ſoir ſa perruque ondelée Dans le bain de Thetis, lors s'embrunit le Ciel:	Quand Titan mouille au soir sa perruque ondelée Dans le bain de Thétis, lors s'embrunit le Ciel:
Si qu’on prend vn flambeau fait artificiel.	Si qu'on prend un flambeau fait artificiel.
Pour en l’aueugle nuict luire dans vne chambre Quelque homme qui ſeroit appeſanty de membre, Se pouuant s’eſleuer, où quelque autre atteindroit, Ceſtuy-la pour ſon mieux vn marche-pié prendroit:	Pour en l'aveugle nuit luire dans une chambre Quelque homme qui serait appesanti de membre, Se pouvant s'élever, où quelque autre atteindrait, Cestu-la pour son mieux un marche-pié prendrait:
Tel qui ne peut trancher vne riuiere à nage, Deſcend dans vn bachot, puis paſſe ſans domage.	Tel qui ne peut trancher une rivière à nage, Descend dans un bachot, puisse pas sans dommage.
Vulgairement ainſi me ſuiſ-je accommodé Pour vous encourager, eſtant incommodé Soit d’eſprit, ſoit de corps, comme vous nous le dittes.	Vulgairement ainsi me suis-je accommodé Pour vous encourager, étant incommodé Soit d'esprit, soit de corps, comme vous nous le dites.
S’il eſt vray, recourrez aux grates fauvrtes De celuy qui de rien feit le monde en ſix lours, Il vous fortifira, & par tout & toufrours.	S'il est vrai, recourrez aux grates fauvrtes De celui qui de rien feyt le monde en six lours, Il vous fortifira, et par tout et toufrours.
HERMES.	HERMES.
Plus outre ie pourſuy.	Plus outre ie poursui.
Les laboureurs champeſtres Diſent, ſelon leurs ſens, non par les ſages lettres, Que la pluye eſt vne eau plus propre pour les fruicts Arbres, graines, tremois, que de fons & de puys.	Les laboureurs champêtres Disent, selon leurs sens, non par les sages lettres, Que la pluie est une eau plus propre pour les fruits Arbres, graines, tremais, que de fons et de puis.
Car elle vient de l’air, qui eſt la prime cauſe D’abondance ça-bas, comme on croit, & l’on cauſe.	Car elle vient de l'air, qui est la prime cause D'abondance ça-bas, comme on croit, et l'on cause.
Meſme d’autant qu’elle a plus de ſubtilité, Dont la terre ſ'emboit auec facilité.	Même d'autant qu'elle a plus de subtilité, Dont la terre s'embait toujours facilité.
Pour parler en chreſtien, l’eau de diuine grace Principe vigoureux de fertilite graſſe) Roſinante du Ciel dans l’interne verger De l’homme deſſeiché!	Pour parler en chrétien, l'eau de divine grâce Principe vigoureux de fertilité grasse) Rosinante du Ciel dans l'interne verger De l'homme desseiché!
qui releue leger, Son eſperãce en Dieu] luy arrouſe ſon ame, L’aſſouplit & l’emplit de charitable flâme, Qui l'entre-met à tout & s'y fait plus puiſſant, Qu’au moindre ouurage ſien il eſtoit impuiſſant.	qui relève léger, Son espérance en Dieu] deux arrose son âme, L'assouplit et l'emplit de charitable flamme, Qui l'entre-met à tout et s'y fait plus puissant, Qu'au moindre ouvrage sien il était impuissant.
THEOPHILE.	THÉOPHILE.
Ie ne veux rebutter ces ſentences certaines, Des pluuieuſes eaux contre l’eau des fontaines, Deduittes au rapport de la viue chaleur, Dont la grace de Dieu ſeringue dans vn cœur:	Je ne veux rebuter ces sentences certaines, Des pluuieuses eaux contre l'eau des fontaines, Déduittes au rapport de la vive chaleur, Dont la grâce de Dieu seringue dans un cœur:
Mais la ſymboliſer par vne autre maniere, Pour plus vous inciter, ſelon noſtre proiet, A la luy requerir pour vn ſi beau ſuiet.	Mais la symboliser par une autre manière, Pour plus vous inciter, selon notre prois, À la vôtre requérir pour un si beau sujet.
Cette eau ſort-elle point pour quiconque en veut prendre, Le Soleil n'eſt-il pas pour au monde ſ'eſpandre?	Cette eau sort-elle point pour quiconque en veut prendre, Le Soleil n'est-il pas pour au monde s'épandre?
Si quelqu'vn manque d’eau, c’eſt faute qu’il n’en prend.	Si quelqu'un manque d'eau, c'est faute qu'il n'en prend.
Si l’on n’eſt allumé, c’eſt l’obſtacle qu’on tend.	Si l'on n'est allumé, c'est l'obstacle qu'on tend.
Ainſi qui n’eſt remply de la faueur commune, Que nous preſente à tous la Deite trine-vne, Cei qu'u ne ta veut poim.	Ainsi qui n'est rempli de la faveur commune, Que nous présente à tous la Déite trine-une, Ci qu'une ne ta veut poim.
Demanuez-ta pour voir, Plus à-coup l’aurez-vous que ne penſiez l’auoïr.	Demanuez-ta pour voir, Plus à-coup l'aurez-vous que ne pensiez l'auoïr.
Ouy:	Oui:
voire ie reſpon qu'elle eſt tant neceſſaire, Que ſans elle on ne peut bien mener vne affaire.	voire grande répon qu'elle est tant nécessaire, Que sans elle on ne peut bien mener une affaire.
POLIOCTE.	POLICTE.
Vous degenereriez de voſtre auguſte nom, (Autant myſterieux que d’inſigne renom Qui preſage de vous ce que vous deuez eſtre, Vinqueur porte-laurier, & du peuple le maiſtre.	Vous dégénéreriez de votre auguste nom, (Autant mystérieux que d'insigne renom Qui présage de vous ce que vous devez être, Vinqueur porte-lier, et du peuple le maître.
Pour comprendre vn ſujet ſeruent les accidens, Car l'on ſçait de par eux les cauſes au dedans:	Pour comprendre un sujet servent les accidents, Car l'on sait de par eux les causes au dedans:
Si que pour en auoir l’intelligence bonne, Suiuant les facultez le nom außi ſe donne.	Si que pour en avoir l'intelligence bonne, Suivant les facultés le nom aussi se donne.
Quand le monde fut fait, noſtre Dieu feit aller Les beſtes contre Adam, pour luy faire appeller, Qui toutes les nomma, comme elles ſont diuerſes, Par leurs conditions, ou probes, ou peruerſes.	Quand le monde fut fait, notre Dieu fit aller Les bêtes contre Adam, pour lui faire appeler, Qui toutes les nomma, comme elles sont diverses, Par leurs conditions, ou probes, ou perverses.
Deuant que vous fußiez Dieu vous predeſtina;	Devant que vous fussiez Dieu vous prédestina;
Dont en vous chreſtiennant ce nom l’on vous donna.	Dont en vous chrétiennant ce nom l'on vous donna.
Prenez donc l’Eueſché.	Prenez donc l'Évêché.
Les charges font les hommes, Taſchans s’en acquiter en ce ſiecle, où nous ſommes.	Les charges font les hommes, Taschans s'en acquitter en ce siècle, où nous sommes.
S.	S.
NICOLAS.	NICOLAS.
C’eſt fait, ie ſuis conquis.	C'est fait, Madame suis conquis.
Ie n’oſe refuſer Le grade ſpecieux, où Dieu me veut poſer.	Je n'ose refuser Le grade spécieux, où Dieu me veut poser.
Si c’eſt pour le ſalut de l’Egliſe chreſtienne Ie l’accepte, Seigneur, à cela qu’il ne tienne.	Si c'est pour le salut de l'Église chrétienne Je l'accepte, Seigneur, à cela qu'il ne tienne.
Mais ſource de bonté, d’où derriue tout bien, Grandeur enferme-tout, hors de qui nya rien, Abondance ſans fin, à comble rempliſſante Tous lieux, tous temps, tous cœurs, de ta vertu puiſſante:	Mais source de bonté, d'où derrive tout bien, Grandeur enferme-tout, hors de qui nia rien, Abondance sans fin, à comble remplissante Tous lieux, tous temps, tous cœurs, de ta vertu puissante:
Sans toy l’on ne peut rien, eſtant tout en ce tout, Qu’abſolu tu regis de l’vn à l’autre bout.	Sans toi l'on ne peut rien, étant tout en ce tout, Qu'absolu tu régis de l' a autre bout.
Partant aßiſte moy de ta grace benigne, Qui me face pasteur de tes oüailles digne.	Partant aussi moi de ta grâce bénigne, Qui me face pasteur de tes ouïrailles digne.
cur d’en estre priué, c’eſt voguer ſans nocher A la mercy de l’eau, ou de quelque rocher.	cur d'en être privé, c'est voguer sans nocher À la merci de l'eau, ou de quelque rocher.
C’eſt pourir en priſon ſans auoir qui conſole, C’eſt viellir en exil ſans amy ſous le Pole.	C'est pourir en prison sans avoir qui console, C'est viellir en exil sans ami sous le Pole.
Parmy ſes ennemis c'eſt ſe voir ſans ſetours,	Parmi ses ennemis c'est se voir sans setours,
C'eſt combattre ſans chef, c’est heberger touſiours Sans aucune clerté dans les tenebres ſombres:	C'est combattre sans chef, c'est héberger toujours Sans aucune clerté dans les ténèbres sombres:
C’'eſt mourir en viuant vaſſal à mille encombres.	Ç'est mourir en vivant vassal à mille encombres.
Pour me ſauuer des flots de la mondaine mer, Pour mon ame eſioüir en ſon cachot amer, Pour me tirer, banny, hors de la maſſe ronde, Pour abbatre mattez Satan, la chair, le monde:	Pour me sauver des flots de la mondaine mer, Pour mon âme esioüir en son cachot amer, Pour me tirer, banni, hors de la masse ronde, Pour abattre mattez Satan, la chair, le monde:
Pour ne plus barluder dedans l’obſcurité, Pour viure bien-heureux à la perennité.	Pour ne plus barluder dedans l'obscurité, Pour vivre bienheureux à la perennité.
Sois donc mon ſeur Patron, ma bonne compagnie, Mon amy ſingulier, mon lateral genie, Mon Capitaine fort, mon Soleil radieux Mon ambroiſin manger, & nectar precieux:	Sois donc mon sûr Patron, ma bonne compagnie, Mon ami singulier, mon latéral génie, Mon Capitaine fort, mon Soleil radieux Mon ambraisin manger, et nectar précieux:
Afin que tellement ie me range en ma charge, Qu'vn pandorin eſchec ſus moy ne ſe deſcharge;	Afin que tellement apprendre me range en ma charge, Qu'un pandorin échec sus moi ne se décharge;
Mais que iaye touſiours ta benediction, Pour bien executer cette commißion.	Mais que jaye toujours ta bénédiction, Pour bien exécuter cette commivion.
Où tout ne plus ne moins que le ieune Thobie Par l’Ange fut conduit à Rages en Medie, L’enſeignant au chemin ce qu’il failloit qu’il feit, Pour ſon egrege honneur, & commode profit.	Où tout ne plus ne moins que le jeune Thobie Par l'Ange fut conduit à Rages en Médie, L'enseignant au chemin ce qu'il fallait qu'il feyt, Pour son égrége honneur, et commode profit.
Ainſi ie puiſſe, moy, auec experience, Iuſtice, charité, addreſſe, patience Guider iuſques aux Cieux le troupeau lycien, Au repos eternel de moy, comme du ſien.	Ainsi ie puisse, moi, avec expérience, Justice, charité, adresse, patience Guider jusques aux Cieux le troupeau lycien, Au repos éternel de moi, comme du sien.
CLARIVS.	CLARIVS.
Allegreſſe, Meßieurs, geniale allegreſſe, Puis qu'ores il conſent au party, qu'on luy dreſſe.	Allegresse, Messieurs, géniale allégresse, Puis qu'ores il consent au parti, qu'on était dresse.
Ca de pareille voix entonnons à ce coup J'n cantique diuin recomment eucantonp.	Ça de pareille voix entonnons à ce coup J'n cantique divin recomment eucantonp.
Les Eueſques ſ'en vont bien joyeux chan ter ce Cantique, puis ſe diſpoſeront de ſacrer S.	Les Euesques s'en vont bien joyeux chan ter ce Cantique, puis se disposeront de sacrer S.
NICOLAS.	NICOLAS.
Lus on ſouffre de maux à pourſuiure ardemment ded pnrauiſſant obiect, plus à t’on de delices, Quand on peut l’emporter ſans fraudes ny malices, Pour en ioüir long-temps à ſon contentement.	Lus on souffre de maux à poursuivre ardemment de pénravissant objet, plus à t'on dé lices, Quand on peut l'emporter sans fraudes ni malices, Pour en jouir longtemps à son contentement.
Ores graces à Dieu nous arriue ce bien, Apres auoit puumis at purune preſpante La roide volonté de cette ame innocente De gouuerner, diſcret, vn grand troupeau chreſtien.	Ores grâces à Dieu nous arrive ce bien, Après avait puumis at urune prespante La roide volonté de cette âme innocente De gouverner, discret, un grand troupeau chrétien.
Ce qu’ayant entrepris ſous la ſaincte faueur De celuy qui maintient ce beau terrestre Empire:	Ce qu'ayant entrepris sous la sainte faveur De celui qui maintient ce beau terrestre Empire:
Rien ne nous reſte plus qu'Archeueſque de Myre Nous le ſacrions bien toſt, pour combler ce bon-heur.	Rien ne nous reste plutôt qu'Archeuesque de Myre Nous le sacrions bien tôt, pour combler ce bonheur.
88 4 5 2t 23 42 LE SACRE DE SAINCT NICOLAS, ET LES BONS prerag oe quonos muuiques conçoiuẽt de luy par ſa phyſionomie.	88 4 5 2t 23 42 LE SACRE DE SAINCT NICOLAS, ET LES BONS prrag oe quonos muiques conçoivent de Seigneur par sa physionomie.
CLARIVS.	CLARIVS.
Vatre principes beaux en l'integre ſtructure D'vn chef-d’œuure ordõné par la ſage Nature Se recontrent touſiours:	Vatre principes beaux en l'intère structure D'un chef-d'œuvre ordonné par la sage Nature Se contrent toujours:
celuy-la qui le fait, L’estoffe, la façon, & la fin qui parfait.	celui-la qui le fait, L'étoffe, la façon, et la fin qui parfait.
Ainſi qu’au baſtiment d’vne maiſon de pierres Le Maſſon eſt agent, les pierres les matieres:	Ainsi qu'au bâtiment d'une maison de pierres Le Masson est agent, les pierres les matières:
Le pourpris la façon, la demeure la fin:	Le pourpris la façon, la demeure la fin:
Comme en tout art außi cela ſe voit en fin.	Comme en tout art aussi cela se voit en fin.
Cuidez-vous qu'en ait moins l’œuure ſpirituelle, Que Dieu, maiſtre iuré, commande telle, ou telle?	Cuidez-vous qu'en ait moins l'œuvre spirituelle, Que Dieu, maître juré, commande telle, ou telle?
Comme ſans eſplucher d’autre exemple ſacré, Ce Sacre epiſcopal d’vn qui luy eſt ſacré:	Comme sans éplucher d'autre exemple sacré, Ce Sacre épiscopal d'un qui lui est sacré:
Où les Eueſques ſont la cauſe miniſtrante, Celuy qui eſt eſleu la matiere recente:	Où les Évêques sont la cause ministrante, Celui qui est élev la matière récente:
L’habit pontifical l’excellente jaçons La fin iuger, offrir, & bien faire à foiſon.	L'habit pontifical l'excellente jaçons La fin juger, offrir, et bien faire à foison.
Deuant que commencer il faut que l’on pratique Des rigoureux Sindics l’accouſtumance antique, Qui, fins, examinoient l’ordonnable Prelat Des meurs, & de la foy, qui concernent l'eſtat:	Devant que commencer il faut que l'on pratique Des rigoureux Sindics l'accoutumance antique, Qui, fins, examinaient l'ordonnable Prelat Des meurs, et de la foi, qui concernent l'état:
Afin qu’il ſ'y maintint ſi bien de corps, & d’ame, Que qui l’auroient ſacré n’en receuſſent de blaſme.	Afin qu'il s'y maintint si bien de corps, et d'âme, Que qui l'auraient sacré n'en reçussent de blâme.
Mon frere fauory uont ques respondez-moy Voulez-vous vous former à la diuine Loy.	Mon frère favori uont ques répondez-moi Voulez-vous vous former à la divine Loi.
S.	S.
NICOLAS.	NICOLAS.
Ce que vous demandez entalenté i’accorde, Promettant que iamais ie n’y ſeray diſcorde.	Ce que vous demandez entalenté j'accorde, Promettant que jamais été n'y serai discorde.
CLARIVS.	CLARIVS.
Vous catechiſerez voſtre peuple commis, Comme amiablement les amus leurs amis?	Vous catéchiserez votre peuple commis, Comme amiablement les amus leurs amis?
S.	S.
NICOLAS.	NICOLAS.
Ouy, tant que ie pourray.	Oui, tant que Seigneur pourrai.
DION.	DION.
Suturez ious pas ſans feinte L’ortodoxe decret, & l’Eſcriture ſaincte?	Suturez jours pas sans feinte L'ortodoxe décret, et l'Écriture sainte?
S.	S.
NICOLAS.	NICOLAS.
Ce ſeront mes garants.	Ce seront mes garants.
EROS.	EROS.
N’obeïrez-vous pas Aux Pontifes Romains iuſqu’à voſtre irespas?	N'obéiriez-vous pas Aux Pontifes Romains jusqu'à votre irespas?
S.	S.
NICOLAS.	NICOLAS.
