Pεο2ς	Pεο2ς
J Enus qui dans les Cieux eſt plus belle Deeſſe, Et qui peut gouuerner les amours en tous lieux, N'a point tant de beauté que vous, belle Princeße, Qui pouueZ captiner les hommes & les Dieux.	 JNus qui dans les Cieux est plus belle Déesse, Et qui peut gouverner les amours en tous lieux, N'a point tant de beauté que vous, belle Princesie, Qui pouvez captiner les hommes et les Dieux.
De meſmie que Phœbus commençant ſa carriere Pour nous donner le iour de ſa grande clarté, Fait cacher außi toſt ceſte brune courriere, Venus ſe cache außt deuant voſtre beauté.	De mémie que Phœbus commençant sa carrière Pour nous donner le jour de sa grande clarté, Fait cacher aussi tôt cette brune courrière, Venus se cache aussitôt devant votre beauté.
Vous deuez ſeule auoir ceſte pomme doree MEELENEE Qu'il ſiſt l’ayant des trois la plus belle honoree, Car vous les ſurpaſſeZ toules eſgallement.	Vous devez seule avoir cette pomme dorée MELENENE Qu'il zist l'ayant des trois la plus belle honorée, Car vous les surpassez toules également.
CONSOLATION A FEV Madame de MAYENNE, ſur la mort de Monſeigneur le Comte de Sommeriue ſon fils.	CONSOLATION A FEU Madame de MAYENNE, sur la mort de Monseigneur le Comte de Sommerive son fils.
Eſſez, ceſſez ce dueil dont voſtre ame eſtatteinte, Et ne vous perdez point dans ce torrent de pleurs:	Essez, cessez ce deuil dont votre âme étatteinte, Et ne vous perdez point dans ce torrent de pleurs:
Contre vn tel accident de rien ne ſert la plainte, Vos larme ne ſçauroient alleger vos douleurs.	Contre un tel accident de rien ne sert la plainte, Votre larme ne sauraient alléger vos douleurs.
Voſtre fils a ſuiuy la belle & ſaincte voye, Il eſt bien plus heureux qu’il n’eſtoit icy bas:	Votre fils a suivi la belle et sainte voie, Il est bien plus heureux qu'il n'était ici bas:
Pleurer de ſon bon-heur c’eſt offencer ſa ioye, Il faut pour viure au Ciel endurer le treſpas.	Pleurer de son bonheur c'est offenser sa joie, Il faut pour vivre au Ciel endurer le trépas.
Sen ame qui d’en-haut icy bas vint deſcendre Pour habiter ſon corps ſur ce terreſtre lieu, N’eſtoit que pour vn temps, il falloit bien la rendre, Puis qu’il ne la tenoit que par emprunt de Dieu.	Sen âme qui d'en-haut ici bas vint descendre Pour habiter son corps sur ce terrestre lieu, N'était que pour un temps, il fallait bien la rendre, Puis qu'il ne la tenait que par emprunt de Dieu.
Doncques conſolez-vous, vertueuſe Princeſſe, Vous reuerreZ au Ciel ce Prince genereux:	Donc consolez-vous, vertueuse Princesse, Vous réverrez au Ciel ce Prince généreux:
Ne regretteZ en vain la fin de ſa ieuneſſe, L’on ne meurt point trop toſt pour viure biẽheureux.	Ne regrettez en vain la fin de sa jeunesse, L'on ne meurt point trop tôt pour vivre bienheureux.
A RCMMMMGMMR 1.	À RCMMMMGMMR 1.
Cheualier aux Dames.	Chevalier aux Dames.
Vidé de vos beaux jeux dans le Camp des guerriers, Ie ne veux que moy ſeul pour dompter l’arrogance De tous les Cheualiers, dont la ſoible puiſſance Ne leur pourra ſeruir qu'à croistre mes lauriers;	Vidé de vos beaux jeux dans le Camp des guerriers, Je ne veux que moi seul pour dompter l'arrogance De tous les Chevaliers, dont la soible puissance Ne leur pourra servir qu'à croître mes lauriers;
Si vos beauteZ, mes Dames, Ne conſeruent leurs ames.	Si vos beautés, mes Dames, Ne conservent leurs âmes.
Ie ne redoute rien aux perilleux haZards, La victoire me ſuit au milieu des alarmes:	Je ne redoute rien aux périlleux hasards, La victoire me suit au milieu des alarmes:
I’ay tant acquis d’honneur par la pointe des armes, Que ie ſuis recogneu pour eſtre fils de Mars, Qui n'a d’autre exercice Qu'à combattre en la lice, Fauoriſez-moy donc d’vn preſent amoureux, Admirables beauteZ qui de corez la France:	J'ai tant acquis d'honneur par la pointe des armes, Que je suis reconnus pour être fils de Mars, Qui n'a d'autre exercice Qu'à combattre en la lice, Favorisez-moi donc d'un présent amoureux, Admirables beautés qui de coris la France:
Anßi teſt vous verreZ l’adreſſe & l’aſſeurance Que i’auray combattant ces guerriers valeureux, Qui me rendront hommage Eſprouuant mon tourage.	Anssi test vous verrez l'adresse et l'assurance Que j'aurai combattant ces guerriers valeureux, Qui me rendront hommage Éprouvant mon tourage.
L’INQVIETVDE d’Amour.	L'INQUIÉTUDE d'Amour.
E ſemble au Roßſignolqui dedans les buiſſons Sur l’eſpine ſe met pour chanter ſes chanſons, Où eſtant endormy ſe va picquant ſoy-meſme.	E semble au Rosssignolqui dedans les buissons Sur l'épine se met pour chanter ses chansons, Où étant endormi se va piquant soi-même.
Ainſi dedans les bois que ie treuue a propos Souuent ie me retire, ou prenant mon repos Ie m’éueille picqué de ma douleur extreme.	Ainsi dedans les bois que sans trouve à propos Souvent un me retire, ou prenant mon repos Je m'éveille piqué de ma douleur extrême.
Mais c’eſt pour endurer vn million d’ennuis, Et paſſer en pleurant tout le reſte des nuicts Des rigueurs que me fait la beauté que i’adore:	Mais c'est pour endurer un million d'ennuis, Et passer en pleurant tout le reste des nuits Des rigueurs que me fait la beauté que j'adore:
Outuputeencutnninoemen culoytux, S’endermant de ſon chant ſur tout melodieux, S’il s’éueille picqué c’eſt pour chanter encore.	Outuputeencutninoemen culoytux, S'endermant de son chant sur tout mélodieux, S'il s'éveille piqué c'est pour chanter encore.
L’AMOVR VAINQVEVR.	L'AMOUR VAINQVEVR.
Dieu mon beas Soleil, adieu chere Syluie, A Il me faut deſormats abſenter de vos jeex, Abſence qui me fait naiſtre cent fous l’ennie De perdre en vous perdant la lumiere des Cieux.	Dieu mon beas Soleil, adieu chère Sylvie, À Il me faut désormats absenter de vos jeex, Absence qui me fait naître cent fous l'ennie De perdre en vous perdant la lumière des Cieux.
Ie ſereis bien-heureux ayant perdu la vie, I’irois boire außi toſt du fleuue Stygieux;	Je sereis bienheureux ayant perdu la vie, J'irais boire aussi tôt du fleuve Stygieux;
Car en ayant gouſté, la memoire eſt rauie De ce qui s’eſt paſſé dans ce reail ſpacieux.	Car en ayant goûté, la mémoire est ravie De ce qui s'est passé dans ce reail spacieux.
Ne m’abuſé-ie point?	Ne m'abusé-je point?
Rodomont plein de gloire En gouſtant de ce fleuue oublia ſa victoire, Mais non pas les amours d’Iſabelle ſon cœur:	Rodomont plein de gloire En goûtant de ce fleuve oublia sa victoire, Mais non pas les amours d'Isabelle son cœur:
Car le fleuue d’oubly contre amour n’a puiſſance, Il me faut donc ſouffrir, & prendre patience, Puis que dans les Enfers l’Amour ſe rend vainqueur.	Car le fleuve d'oubli contre amour n'a puissance, Il me faut donc souffrir, et prendre patience, Puis que dans les Enfers l'Amour se rend vainqueur.
L’AMOVR VAINCV.	L'AMOUR VAINCV.
A Madame la Ducheſſe de Neuers.	A Madame la Duchesse de Neuers.
Vßi toſt que l’Amour apperceut que mon ame Reſiſtoit aux ardeurs de l’amoureuſe ſlame, En decochant ſes traicts il me viſoit au cœur:	Vsi tost que l'Amour aperçut que mon âme Résistait aux ardeurs de l'amoureuse slame, En décochant ses traits il me visait au cœur:
Mais ſans en faire cas tout d’vn coup ie m’auance, Tout beau, luy dy-ie, Amour, iu n'as pas la puiſſance De captiuer mes ſens, ny d’eſtre mon vainqueur.	Mais sans en faire cas tout d'un coup ie m'avance, Tout beau, tu dis-je, Amour, ju n'as pas la puissance De captiver mes sens, ni d'être mon vainqueur.
Ie meſpriſe l’ardeur de l’antoureuſe rage, Puis redoublant l’effort de mon chaſte courage, Ie luy tire à l’inſtant des mains ce dard pointu, Dont ie vous fais preſent, Princeſſe genereuſe, Digne de conſeruer ma priſe glorieuſe, Arant deſſoubs mes pieds Cupidon abbatu.	Je méprise l'ardeur de l'antoureuse rage, Puisse redoublant l'effort de mon chaste courage, Je lui tire à l'instant des mains ce dard pointu, Dont pu vous fais présent, Princesse généreux, Digne de conserver ma prise glorieuse, Arant dessoubs mes pieds Cupidon abattu.
A L'AMOVR ENFLAME.	À L'AMOUR ENFLAME.
Mant, puis qu’ainſi eſt que vous ſentez en l’ame La cuiſante chaleur d’une eternelle flame, Et que vous n’eſtes plus qu’une ardeur & qu’vn feu, Ie m’eſtoigne de vous, car n’eſtant que de glace, Et puis que la froideur dans montturryiu place, diie i'en approchou te fondroi peu a peu.	Mant, puis qu'ainsi est que vous sentez en l'âme La cuisante chaleur d'une éternelle flamme, Et que vous n'êtes plus qu'une ardeur et qu'un feu, Je m'étoigne de vous, car n'étant que de glace, Et puis que la froideur dans montturryiu place, diie j'en approchou te fondroi peu a peu.
L'AMOVR REFROIDY.	L'AMOUR REFROIDY.
Tous ſemblez au caillou plein de froideurextreme;	Tous semblez au caillou plein de froideurextre;
Duquel en le frappant on tire quelque ardeur, Qui n’en peut tontesſois eſchauffer ſa froideur, Mais bien eſchauffe autruy ſans s’eſchauffer ſoymeſme.	Duquel en le frappant on tire quelque ardeur, Qui n'en peut tontessais échauffer sa froideur, Mais bien échauffe autrui sans s'échauffer soymesme.
Mais vous l’eſtes bien plus, ô beauté que i’honore, Car mettant le caillou tout aupres de ſon feu Vous le verreZ alors s’eſchanffer peu à peu, Où vous aupres de moy reſtez plus froide encore.	Mais vous l'êtes bien plus, ô beauté que j'honore, Car mettant le caillou tout auprès de son feu Vous le verrez alors s'échanffer peu à peu, Où vous auprès de moi restez plus froide encore.
PVISSANCE D’AMOVR.	PUISANCE D'AMOUR.
Jous reſſemblez à la Tortuë Qui donne vie par ſa veuë A ſes fetits pres de ſon bord.	Jous ressemblez à la Tortue Qui donne vie par sa vue À ses fétits pres de son bord.
Que dy-ie, ô beaniez que i’adore?	Que dis-je, ô beaniez que j'adore?
Vos beaux yeux font bien plus entore, Ils donnent la vie & la mort.	Vos beaux yeux font bien plus entore, Ils donnent la vie et la mort.
LE FLAMBEAV D'AMOVR.	LE FLAMBEAU D'AMOUR.
RElle, ne penſez pas que i’aye dans le cœur Aucune affection qu’à voſtre œil mõ vainqueur, Encores que ſouuent ie viſite les belles:	RElle, ne pensez pas que j'aie dans le cœur Aucune affection qu'à votre œil mon vainqueur, Encores que souvent avoir visite les belles:
Car lors que le Soleil ne paroiſt plus aux Cieux Et qu’il nous a caché ſes rayons gracieux, Il faut tout außi toſt allumer les chandelles.	Car lors que le Soleil ne paraît plus aux Cieux Et qu'il nous a caché ses rayons gracieux, Il faut tout aussi tôt allumer les chandelles.
De meſme eſtant abſent de vos yeux enflamez, Si de quelqu’autre amour mes eſprits ſont charmeZ Las ce n’eſt qu’au defaut de ma clarté premiere:	De même étant absent de vos yeux enflamés, Si de quelqu'autre amour mes esprits sont charmés Las ce n'est qu'au défaut de ma clarté première:
Car ſi toſt que Phœbus nous redonne le iour L’on eſteint les ſlambeaux, & moy iouſ autre amour, Reuypant les rayons de vos yeux ma lumiere.	Car si tôt que Phœbus nous redonne le jour L'on éteint les slambeaux, et moi jou autre amour, Reuypant les rayons de vos yeux ma lumière.
L'AMO.	L'AMO.
VR COVRAGEVX.	VR COURAGEUX.
1quuocouupaimenquumpin umie chuige, Et plus haut vers le Ciel il ſe va ſouſleuant:	1quuocouupaimenquumpin umie chuige, Et plus haut vers le Ciel il se va soulevant:
Außi plus ie reçois d’ennuis en vous ſeruant.	Aussi plus grands reçois d'ennuis en vous servant.
Plus mon cœur genereux reſiſte à ſon dommage.	Plus mon cœur généreux résiste à son dommage.
L'AMOVR AVARE.	L'AMOUR AVARE.
DOur auoir ton amour il me faudroit deſcendte En groſſes goulles d’orcomme ſit Iupites, C’eſt là le ſeul moyen qu’il faut pour t’arreſter, Car par autre moyen tu ne te laiſſes prendre.	DOur avoir ton amour il me faudrait descendte En grosses goulles d'orcomme sit Jupites, C'est là le seul moyen qu'il faut pour t'arrêter, Car par autre moyen tu ne te laisses prendre.
A L'AMOVR OFFICIEVX.	À L'AMOUR OFFICIEUX.
Vßi toſt que ie ſceu que ma belle Siluie Deſiroit mon treſpas, Ie ſaiſi mon poignard pour m’arracher la vie Priué de ſes appas:	V tôt que je su que ma belle Silvie Désirait mon trépas, Je saisi mon poignard pour m'arracher la vie Privé de ses appas:
Mais comme i’eſtois preſt de trauerſer la riue Du fleuue Singieux, Ie m’aduiſe & luy dis, Belle il faut que ie viue Pour ſeruir vos beaux yeux.	Mais comme j'étais prêt de traverser la rive Du fleuue Singieux, Je m'avise et lui dis, Belle il faut que je vive Pour servir vos beaux yeux.
Car la crainte que i’ay qu’vn autre ne vous ſerue Comme vous meriteZ, M empeſche de mourir, & ſeul ie me reſerue Pour ſeruir vos beautez.	Car la crainte que j'ai qu'un autre ne vous serve Comme vous méritez, M empêche de mourir, et seul grande me réserve Pour servir vos beautés.
L'AMOVR HOMICIDE.	L'AMOUR HOMICIDE.
TE reſſemble an Soucy qui perdant le Soleil Si beau ne paroiſt plus, & enſor ſe retire:	TE ressemble an Souci qui perdant le Soleil Si beau ne paraît plus, et ensor se retire:
De meſme dans mon cœur mille douleurs i’attire, Außi toſt que ie ſuis eſloigné de voſtre œil.	De même dans mon cœur mille douleurs j'attire, Aussi tôt que tu suis éloigné de votre œil.
Que dr-ie maintenant?	Que dr-je maintenant?
ie ne luy ſemble pas, Car lors que le Soucy recouure ſa lumiere, Il relourne außi toſt en ſa forme premiere, Où mij voyant vos yeux ie reçois le treſpas.	Ne ne lui semble pas, Car lors que le Souci recouvre sa lumière, Il relourne aussi tôt en sa forme première, Où mij voyant vos yeux Seigneur reçois le trépas.
L'AMOVR LEGITIME.	L'AMOUR LÉGITIME.
Out ainſi que l’on voit l’oyſeau de Iupiter *Qui porte ſes petits vers la voute aZuree, Pour veoir s’ils pourront bien la chileur ſupporte, Du flambeau radieux à la face doree.	Out ainsi que l'on voit l'oiseau de Jupiter *Qui porte ses petits vers la voute aZurée, Pour voir s'ils pourront bien la chileur supporte, Du flambeau radieux à la face dorée.
Ainſi mon beau Soleil, ayant patiemment Supporté vos rigueurs tout le temps de ma vie, Vous cognoiſſeZ aſſeZ que ie ſuis voſtre amant, Et que ie ne ſuis né que pour vous, ma Siluie.	Ainsi mon beau Soleil, ayant patiemment Supporté vos rigueurs tout le temps de ma vie, Vous connaissez asseZ que je suis votre amant, Et que ma ne suis né que pour vous, ma Silvie.
LE VRAY PYRAVSTE.	LE VRAI PYRAUSTE.
Stant trop pres du feu l’on ſe bruſle außi toſt, E Et ſentant ceſt ardeur alors on ſe retire:	Stant trop pres du feu l'on se brûle aussi tôt, E Sent Étant cet ardeur alors on se retire:
Mais quoy que la chaleur de vos yeux ſoit bien pire, Au lieu d’en reculer l’on approche pluſtoſt.	Mais quoi que la chaleur de vos yeux soit bien pire, Au lieu d'en reculer l'on approche plutôt.
L'AMOVR SVBTIL.	L'AMOUR SUBTIL.
IEneZ Muſe venez d’une viſteſſe prompte, Et ne delaiſſez pas un amant au beſoing:	IEneZ Muse venez d'une vite prompte, Et ne délaissez pas un amant au besoin:
AyeZ de mon amour quelque fidelle ſoing, Et faictes que bien toſt ma Maiſtreſſe ie dompte.	Ayez de mon amour quelque fidèle soin, Et faites que bien tôt ma Maîtresse toujours dompte.
Mais helas maintenant en vain ie vous appelle, Ie ne puis receuoir de vous aucun ſecours, Ie ne ſçaurois gaigner ma Belle par diſcours, Carles plus beaux eſprits peuuent apprendre d'elle.	Mais hélas maintenant en vain ie vous appelle, Je ne puis recevoir de vous aucun secours, Je ne saurais gagner ma Belle par discours, Carles plus beaux esprits peuvent apprendre d'elle.
I ii Dieux que ſeray-ie donc?	I Ji Dieux que serai-je donc?
ſembleray-ie à Tantale?	semblerai-je à Tantale?
Verray-ie deuant moy le fruict ſans y gouſter?	Verrai-je devant moi le fruit sans y goûter?
Ou Siſiphe qui veut ſa roche remonter, Et plus haut la meitant plus bas elle deuale?	Ou Sisiphe qui veut sa roche remonter, Et plus haut la meitant plus bas elle devale?
Mais pour mõter trop haut, & pour trop entreprẽdre Ne ſembleroy-ie point Icare ambitieux?	Mais pour monter trop haut, et pour trop entreprendre Ne semblerai-je point Jcare ambitieux?
Non pluſtoſt que tomber ie monterois aux Cieux, Carn'erani que de feu te ne puis pas deſcendre.	Non plutôt que tomber ici monterais aux Cieux, Carn'ani que de feu te ne puis pas descendre.
LA CRVAVTE' D'AMOVR.	LA CRVAUTE' D'AMOUR.
IN perfide remply de toute tyrannie, Apres vn peu de temps quittant ſa felonnie, Se faute cognoiſſant ii en deuient plus doux:	IN perfide rempli de toute tyrannie, Après un peu de temps quittant sa félonnie, Se faute connaissant ji en devient plus doux:
Mais tant plus que vos reux s’adouciſſent, me Belle, Is ſont bienplus de tori à mon ame fidelle, Cur ſans ceſſe ils la font mourir aupres de vous.	Mais tant plus que vos reux s'adoucissent, me Belle, Is sont bienplus de tori à mon âme fidèle, Cur sans cesse ils la font mourir auprès de vous.
L’AMOVR ABVSE'.	L'AMOUR ABUSE'.
COmme un enfant Romain dans ſon lict repoſoit, Vn ſeu ſi violent deſſur ſon chef luiſoit, Qu'on l’euſt preſque iugé du tout reduit en cendre:	COmme un enfant Romain dans son lit reposait, Un seu si violent dessur son chef luisait, Qu'on l'eût presque jugé du tout réduit en cendre:
Mais comme il apperceut la lumiere des Cieux, Ceſte ardeur s’amortiſt, & decharmant ſes jeux, On luy vit ſans danger tous ſes eſprits reprendre.	Mais comme il aperçut la lumière des Cieux, Cette ardeur s'amortît, et décharmant ses jeux, On lui vit sans danger tous ses esprits reprendre.
Et mor par le recit qu’vn chacun m’auoit fait D'vne que l’on diſoit auoir l’eſprit parfait, Enſtamt́ ie dormois aſſonpy d’ignorance:	Et mór ma le récit qu'une chacun m'avait fait D'une que l'on disait avoir l'esprit parfait, Enstamt ie dormais assonpi d'ignorance:
Mais voyant ſa beauté ſurpaſſer ſes eſprits, La vertu cheriſſant i'en fis vn tel meſpris, Que mon amour finiſt eſtant en ſa preſence.	Mais voyant sa beauté surpasser ses esprits, La vertu chérissant j'en fis un tel mépris, Que mon amour finît étant en sa présence.
L’AMOVR NVISIBLE A SOYmeſme.	L'AMOUR NUISIBLE À SOYmesme.
IE reſſemble le bois que l’on met dans le feu, Où par un de ſes bouts on voit vne eau s’eſpandre;	JE ressemble le bois que l'on met dans le feu, Où par un de ses bouts on voit quelque eau s'épandre;
Que la grande chaleur fait ſortir peu à peu, Et lors qu’il n’en a plus il ſe reduit en cendre.	Que la grande chaleur fait sortir peu à peu, Et lors qu'il n'en a plus il se réduit en cendre.
De meſme apres auoir tout reſpandu mes pleurs, Et que ie n'auray plus qu’vn feu dedans mon ame, Atbis le ſihay mapeme Cmmts donſenls, Et ſeray conſommé par l’ardeur de ma flame.	De même après avoir tout répandu mes pleurs, Et que je n'aurai plus qu'un feu dedans mon âme, Atbis le sihai maîme Cmts donsenls, Et serai consommé par l'ardeur de ma flamme.
L’AMANT ADVISE'.	L'AMANT ADVISE'.
Eſt fait, il faut mourir, puis que ceſte beauté Qui tenoit dans ſes las mon eſprit arreſté, Ne paroiſt plus au monde:	Est fait, il faut mourir, puis que cette beauté Qui tenait dans ses las mon esprit arrêté, Ne paraît plus au monde:
Il faut pour la reuoir aller trouuer Caron, Afin de me paſſer le fleuue d’Acheron, Et boire de ſon onde.	Il faut pour la revoir aller trouver Caron, Afin de me passer le fleuve d'Acheron, Et boire de son onde.
Que dis-ie maintenant ?	Que dis-je maintenant ?
ie m’abeſe ô bons Dieux, Elle a ſi bien veſeu qu’elle iouyt aux Cieux De la vie eternelle.	On m'abée ô bons Dieux, Elle a si bien veseu qu'elle jouit aux Cieux De la vie éternelle.
Où ſi pour la reuoir ie cauſoü mon treſpas, Mon ame d vn inſtant deualleroit là-bas;	Où si pour la revoir ie causoü mon trépas, Mon âme d' int instant devallerait là-bas;
Coulpable & criminelle.	Coulpable et criminelle.
Et lors ie receurois deux enfers rigoureux;	Et lors ici recevrais deux enfers rigoureux;
L’abſence de ſes yeux, & l’Enfer malheureux, Digne d’vn parritide.	L'absence de ses yeux, et l'Enfer malheureux, Digne d'un parritide.
Il faut donc que ie viue, attendant que la mort Me face pour la voir reſſentir ſon effort, Et ſon dard homicide.	Il faut donc que personne vive, attendant que la mort Me face pour la voir ressentir son effort, Et son dard homicide.
I L'AMANT PARFAICT.	I J'AMANT PARFAICT.
PElle;	PElle;
ſi le deſtin de noſtre heur enuieux Vous faiſoit deualler aux Enfers Stigieux, Ainſi que fiſt iadis ceſte chaſte Burydice, I'irois ſans redouter les plus cruels tourments Vous monſtrer que ie ſuis la perle des amants, Et ie vous y rendrois preuue de mon ſeruice.	si le destin de notre heur envieux Vous faisait devaller aux Enfers Stigieux, Ainsi que fît jadis cette chaste Burydice, J'irais sans redouter les plus cruels tourments Vous montrer que je suis la perle des amants, Et Seigneur vous y rendrais preuve de mon service.
Orphée eut le pouuoir par ſes diuins accords, D’eſmouuoir à pitié le Royaume des morts:	Orphée eut le pouvoir par ses divins accords, D'esmouuoir à pitié le Royaume des morts:
En ioüant de mon Luih ie ſerois tout de meſme, Ie charmerois Pluton & Proſerpine auſii, Et vous r’amenerois du Royaume noircy, Vous faiſant repaſſer ſur le riuage bleſme.	En jouant de mon Luihommes serais tout de même, Je charmerais Pluton et Proserpine aussi, Et vous ramènerais du Royaume noirci, Vous faisant repasser sur le rivage blême.
Mais ſi pour le deſir que i’aurois de vous voir Ie me tournois vers vous, manquant à mon deuoir, Ainſi que fiſt orphée en perdant ſa chere ame, Vous perdant ie ſerois plus fidelle en amour, Car il veit de rechef la lumiere du iour, Et moy ie vous ſuiurois dans l’infernalle flame.	Mais si pour le désir que j'aurais de vous voir Je me tournais vers vous, manquant à mon devoir, Ainsi que fît orphée en perdant sa chère âme, Vous perdant ie serois plus fidèle en amour, Car il vit de rêches la lumière du jour, Et moi quelque vous suivrais dans l'infernalle flamme.
L'AMANT	L'AMANT
L'AMANT MAL RECOMPENSE.	L'AMANT MAL RECOMPENSE.
M A Maiſtreſſe voudroit que ie fuſſe au tombeau, Perdant de ſes béaux yeux l'vn & l'autre flambeaut, Ie le voidrois außi, c’eſt ioute mon enuie, Ce qu’elle veut me plaiſt, ce qui luy plaiſt ie veoxs Ie ſuis preſt de quitter l’or de ſes beaux cheueux, Conſacrant à ſes pieds mon honneur & ma vie.	M A Maîtresse voudrait que sans fusse au tombeau, Perdant de ses béaux yeux l'un et l'autre flambeaut, Je le voidrais aussi, c'est joute mon envie, Ce qu'elle veut me plaît, ce qui lui plaît donc véoxs Je suis prêt de quitter l'or de ses beaux cheveux, Consacrant à ses pieds mon honneur et ma vie.
Meſme i’aurois deſia contenté ſon deſir, Mais d’autant que mourant ie luy ferois plaiſir, Elle ne le veut pas, & me dit à toute heure;	Même j'aurais déjà contenté son désir, Mais d'autant que mourant ie luy ferais plaisir, Elle ne le veut pas, et me dit à toute heure;
Non non ie ne veux point que tu meures pour mey, Ie ne venx netensirantan pain ar1y, Vis donc ſans eſperer ta fortune meilleure.	Non non seulement ne veux point que tu meures pour mey, Je ne venx netensirantan pain ar1i, Vis donc sans espérer ta fortune meilleure.
I L'AMOVR RENAISSANT.	I J'AMOUR RENAISSANT.
E ſuis en vous aimant comme l’unique oyſeau, Qui de viure laßé ſe bruſle pour renaiſtre:	E suis en vous aimant comme l'unique oiseau, Qui de vivre lassé se brûle pour renaître:
Car aupres de vos jeux ie reçois le tombeau, Puis eſtant conſommé ie reuiens en mon eſtre.	Car auprès de vos jeux était reçois le tombeau, Puis étant consommé homme reviens en mon être.
Mais c'eſt pour endorer vneternel tourment, Que ie renais ſi toſt que i’ay perdu la vie;	Mais c'est pour endorer unéternel tourment, Que tu renais si tôt que j'ai perdu la vie;
Où luy tout au contraire il ſe va conſommant, Afin de voir du tout ſa vieilleſſe rauie.	Où notre tout au contraire il se va consommant, Afin de voir du tout sa vieillesse ravie.
L’AMANT REGRETTE.	L'AMANT REGRETTE.
V es-tu, mon eſpoir, lumiere de ma vie?	V es-tu, mon espoir, lumière de ma vie?
Quoy?	Quoi?
oeus-tu bien abſent viure encore tãs moy?	œus-tu bien absent vivre encore tenants moi?
Ha reuiens mon amour, reuiens approche-toy, Ma fidelle amitté maintenant t’y conuie.	Ha reviens mon amour, reviens approche-toi, Ma fidèle amitté maintenant t'y convie.
Quoy?	Quoi?
voudrois-tu ſembler vn pariure Theſee, Vn Iaſon remarquable en inffdelité?	voudrais-tu sembler un parjure Thesee, Un Iason remarquable en inffelité?
Pluſtoſt dans vn tombe au mon corps ſoit appreſté, Qu’vn autre plus bel œil t’are l’ame embraſee.	Plutôt dans un tombe au mon corps soit apprêté, Qu'un autre plus bel œil t'are l'âme embrasée.
Le tourment qu’en mon cœur à toute heure t’endure, Eſt mille fois plus grand qu’vn rigoureux treſpas, Car ſans ceſſe ie ſouffre, & ſi ie ne puis pas Voir mon malheur enclos deſſoubs la ſepulture.	Le tourment qu'en mon cœur à toute heure t'endure, Est mille fois plus grand qu'un rigoureux trépas, Car sans cesse apprendre souffre, et si personne ne puis pas Voir mon malheur enclos dessoubs la sépulture.
