Ce rusé Politique, Le cache aux yeux de Rome & de la Republique, Son amitié trauaille à le faire oublier, De l’azile qu’il donne il ſe fait le Geolier, Et vous des-vniſſant à faux tiltre de Pere, Oſte la mere au fils & le fils à la mere.	Ce rusé Politique, Le cache aux yeux de Rome et de la République, Son amitié travaille à le faire oublier, De l'asile qu'il donne il se fait le Geolier, Et vous des-unissant à faux titre de Père, Oste la mère au fils et le fils à la mère.
Ah!	Ah!
Madame, il eſt temps de faire agir la main, Dont le coup doit vn Maiſtre à l’Empirè Romain, Allez, deſcendre au Camp, mutineZ les Gensdarmes Faites-les ſouuenir d’auoir porté les armes, D’auoir en cent climats planté nos pauillons, Et fauché par la mort tant d’affreux Bataillons,	Madame, il est temps de faire agir la main, Dont le coup doit un Maître à l'Empiré Romain, Allez, descendre au Camp, mutinés les Gensdarmes Faites-les souvenir d'avoir porté les armes, D'avoir en cent climats planté nos pavillons, Et fauché par la mort tant d'affreux Bataillons,
Sans qu’il reſte à pas vn pour vingt ans de ſeruices, Que des cheueux blanchis, de larges cicatrices, Des cadaures antez deſſus des membres morts, Et des troncs ſuruiuans la moitié de leurs corps:	Sans qu'il reste à pas un pour vingt ans de services, Que des cheveux blanchis, de larges cicatrices, Des cadaures antez dessus des membres morts, Et des troncs surviant la moitié de leurs corps:
Pour les picquer d’honneur, vous direz de leurs Peres, Que vous les auez veus parmy nos aduerſaires, Peſle-meſle entaſſez, & ſanglants qu’ils eſtoient, S’enterrer ſous le poids des corps qu’ils abatoient, Percer des eſcadrons les murailles ferrées, Faire auec vn bras ſeul plus que deux Briarées, Et qu’au lict de la mort ces vaincus triomphans, Vous ont recommandé leurs malheureux enfans:	Pour les piquer d'honneur, vous direz de leurs Pères, Que vous les avez vus parmi nos adversaires, Pêle-mêle entassés, et sanglants qu'ils étaient, S'enterrer sous le poids des corps qu'ils abataient, Percer des escadrons les murailles ferrées, Faire avec un bras seul plus que deux Briarées, Et qu'au lit de la mort ces vaincus triomphants, Vous ont recommandé leurs malheureux enfants:
Que c’eſt bien la raiſon que vous ſeruiez de mere A ceux dont voſtre Eſpoux eſtoit iadis le Pere, Que tout ſon patrimoine il leur auoit laißé, Mais que le Teſtament par Ceſar fut caßé.	Que c'est bien la raison que vous serviez de mère À ceux dont votre Époux était jadis le Père, Que tout son patrimoine il leur avait laisse, Mais que le Testament par César fut cassé.
Allez, cela finy, de rang en rang paroiſtre, Flater chaque ſoldat, feindre de le connoiſtre, Et iettant à la foule vne ſomme d’argent, Proteſtés qu’au Palais d’vn œil ſi diligent, On veille vos diſcours, vos penſers, voſtre vie, Qu’vn don plus genereux attireroit l’enuie:	Allez, cela fini, de rang en rang paraître, Flatter chaque soldat, feindre de le connaître, Et jetant à la foule une somme d'argent, Protestés qu'au Palais d'un œil si diligent, On veille vos discours, vos pensers, votre vie, Qu'un don plus généreux attirerait l'envie:
Mais qu’en vn grand deſſein, s’ils vous veulent ayder, Et vous metire en eſtat de pouuoir commander, Vous leur reſtiturez ce fameux heritage, Que leur Pere mourant leur laiſſoit en partage,	Mais qu'en un grand dessein, s'ils vous veulent aider, Et vous metire en état de pouvoir commander, Vous leur restiturez ce fameux héritage, Que leur Père mourant leur laissait en partage,
CORNELIE.	CORNELIE.
Si leur ame en ſuſpens ſemble encor heſiter, Vous ſçaurez par ces mots leur courage exciter;	Si leur âme en suspens semble encor hésiter, Vous sçaurez par ces mots leur courage exciter;
Quoy vous, mes compagnons, dont l’ardente colere Fit trembler autrefois le Thrône de Tibere, Qui diſpenſieZ la vie & la mort aux humains, Qui portiez des combats la Fortune en vos mains;	Quoi vous, mes compagnons, dont l'ardente colère Fit trembler autrefois le Thrône de Tibère, Qui dispensieZ la vie et la mort aux humains, Qui portiez des combats la Fortune en vos mains;
Qui vouliez au Tyran arracher la Couronne Pour des crimes legers dont le couuroit ſon Thrône, Vous ſembleZ l’adorer deſſus ſon Thrône aßis, Quand il eſt deuenu le bourreau de ſes fils?	Qui vouliez au Tyran arracher la Couronne Pour des crimes légers dont le couvrait son Thrône, Vous semblez l'adorer dessus son Thrône aussi, Quand il est devenu le bourreau de ses fils?
Où s’en eſt donc allé cette noble furie, Et ce feu qui veilloit au bien de la Patrie?	Où s'en est donc allé cette noble furie, Et ce feu qui veillait au bien de la Patrie?
Le Ciel d’vn coup de foudre eſpargneroit vos mains, S’il oſoit vſurper la charge des.	Le Ciel d'un coup de foudre épargnerait vos mains, S'il osait usurper la charge des.
Romains;	Romains;
MarcheZ donc ſans tremblerſur les pas d’vne femme, Eſpuiſez d’vn Vieillard ce qui luy reſte d’ame, Que ſi d’vn eſprit foible en cet illuſtre employ, Vous craignez le peril, ne frappez qu’apres moy.	Marchez donc sans tremblersur les pas d'une femme, Espuisez d'un Vieillard ce qui lui reste d'âme, Que si d'un esprit faible en cet illustre emploi, Vous craignez le péril, ne frappez qu'après moi.
Ce diſcours acheué, du haut de leur Tribune, Auec vn front égal attendez la fortune.	Ce discours achevé, du haut de leur Tribune, Avec un front égal attendez la fortune.
AGRIPPINE à Sejanus.	AGRIPINE à Séjanus.
Mais ſans que de l’Eſtat nous déchirions le flanc, Que le ſang de Tibere eſpargne tant de ſan 8	Mais sans que de l'État nous déchirions le flanc, Que le sang de Tibère épargne tant de san 8
R Umpu-moy l’attaquer ſeule en face de Rome, Il ne merite pas de tomber ſous vn homme.	 Umpu-moi l'attaquer seule en face de Rome, Il ne mérite pas de tomber sous un homme.
SEIANVS.	SEIANUS.
Madame, en ma faueur ne vous expoſez point;	Madame, en ma faveur ne vous exposez point;
Attendons au party le ſoldat qui ſe joint;	Attendons au parti le soldat qui se joint;
Du plus ſeur au plus prompt ne faites point d’eſchangé.	Du plus sûr au plus prompt ne faites point d'échangé.
AGRIPPINE.	AGRIPINE.
Periſſe l’Vniuers pourueu que ie me vange.	Périsse l'Univers pourvu que ie me venge.
SEIANVS.	SEIANUS.
Ouy vous ſerez vengée, ouy, Madame, & bien-toſt, Voſtre Ayeul dans le Ctel le demande aſſez haut, Et du fonds des Enfers voſtre Eſpoux vous le crie:	Oui vous serez vengée, oui, Madame, et bientôt, Votre Ayeul dans le Ctel le demande assez haut, Et du fond des Enfers votre Époux vous le crie:
Atatiis poun om mnuinoutemte vonfennes voſtre vie, Vous me l’aueZ promis.	Attatis poun om mnuinoutemte vonfennes votre vie, Vous me l'avez promis.
AGRIPPINE.	AGRIPINE.
Ouy, va, ie m'en ſouuiens, Mais vne Ombre qui crie empeſche nos liens;	Oui, va, Madame m'en souviens, Mais une Ombre qui crie empêche nos liens;
SEIANVS.	SEIANUS.
Hé quoy!	Hé quoi!
Germanicus peut-il trouuer eſtrange Que ſa Veufue ſe donne à celuy qui le vange?	Germanicus peut-il trouver étrange Que sa Veuve se donne à celui qui le venge?
LIPPINE.	LIPPINE.
Non, ſa Veufue à ſon gré te fera ſon Eſpoux;	Non, sa Veufue à son gré te fera son Époux;
Tu ſeras ſon Riual ſans qu’il en ſoit jaloux;	Tu seras son Rival sans qu'il en soit jaloux;
Il joindra de ſon nom la force à ton audace, Pourueu qu’en le vengeant tu merites ſa place.	Il joindra de son nom la force à ton audace, Pourvu qu'en le vengeant tu mérites sa place.
A ces conditions que ie paſſe auec toy,.	À ces conditions que personne passe avec toi,.
Deſſous le ſceau d’Hymen te t’engage ma foy:	Dessous le sceau d'Hymen te t'engage ma foi:
Maïs il faut, ſi tu veux que le contract s’obſerue, Vengeant Germanicus le venger ſans reſerue, Et quand ton bras aura ſes Manes conſolés, Et tous ſes meurtriers a ſon Ombre immolez, Mes faueurs enuers toy pour lors ſeront ſi grandes, Que ie t’eſpouſeray ſi tu me le demandes.	Maïs il faut, si tu veux que le contrat s'observe, Vengeant Germanicus le venger sans réserve, Et quand ton bras aura ses Manes consolés, Et tous ses meurtriers à son Ombre immolés, Mes faveurs envers toi pour lors seront si grandes, Que tu t'épouserai si tu me le demandes.
SEIANVS.	SEIANUS.
Quoy vous m’aymeZ, Madame, & ie l’aprens de vous?	Quoi vous m'aimez, Madame, et notre l'apprends de vous?
Quoy ie puis eſperer d’eſtre vn iour voſtre Eſpoux?	Quo ie puis espérer d'être un jour votre Époux?
Et l’excez du plaiſir dont mes ſens ſont la proye, Ne me ſçauroit encor faire expirer de ioye:	Et l'excès du plaisir dont mes sens sont la proie, Ne me saurait encor faire expirer de joie:
Si le ſort ne veut pas que ie meure d’amour.	Si le sort ne veut pas que ici meure d'amour.
Ny que ſans voſtre aueu ie ſois priué du iour, Du moins ie vous diray iuſqu’au ſouſpir extréme, Poyez mourir d’amour Sejanus qui vous ayme.	Ni que sans votre aveu mot sois privé du jour, Du moins ie vous jirai jusqu'au soupir extrême, Poyez mourir d'amour Séjanus qui vous aime.
AGRIPPINE.	AGRIPINE.
Adieu ma ſœur, approche, oſte-luy les ſoupçons Qu'elle pourroit auoir que nous la trahiſſons.	Adieu ma sœur, approche, ôte-lui les soupçons Qu'elle pourrait avoir que nous la trahissons.
SEIANVS.	SEIANUS.
Ah!	Ah!
Madame, elle peut nous auoir eſcoutée, Elle marche à grands pas & paroiſt tranſportée.	Madame, elle peut nous avoir écoutée, Elle marche à grands pas et paraît transportée.
K iij	§ jijà
S SRATE IV SEIANVS, LIVILLA.	 SRATE IV SEIANUS, LIVILA.
LIVILLA.	LIVILA.
le ſort ne veut pas que ie meure d’amour, Ny que ſans voſtre aueu ie ſois priué du iour Du moins ie vous diray iuſqu’au ſoupir extréme, Voyez mourir d’amour Sejanus qui vous ayme:	le sort ne veut pas que nous meure d'amour, Ni que sans votre aveu je sois privé du jour Du moins toute vous dirai jusqu'au soupir extrême, Voyez mourir d'amour Séjanus qui vous aime:
Mais toy me haïs-tu, laſche, autant que ie te hays Et que veut ma fureur te hayr deſormais?	Mais toi me haïs-tu, lâche, autant que ie te hais Et que veut ma fureur te haïr désormais?
Tu l’as priſe pour moy, cette aymable Princeſſe, Tu penſois me parler & me faire careſſe:	Tu l'as prise pour moi, cette aimable Princesse, Tu pensais me parler et me faire caresse:
Comme ie ſuis pour toy de fort mauuaiſe humeur, Tu prenois des leçons à fléchir ma rigueur;	Comme ici suis pour toi de fort mauvaise humeur, Tu prenais des leçons à fléchir ma rigueur;
Ingrat tu punis bien ce que fit mon courage, Quand ie ſacriſiay mon Eſpoux à ta rage.	Ingrat tu punis bien ce que fit mon courage, Quand mot sacrisiai mon Époux à ta rage.
Eſt-ce trop peu de choſe, & pour te meriter, Aides crimes plus grands faut-il encor monter?	Est-ce trop peu de chose, et pour te mériter, Aides crimes plus grands faut-il encor monter?
I’ay.	J'ai.
tué mes Neveux, i’ay fait perir mon Frere, Et ie ſuis ſur le poinct d’égorger mon Beaupere:	tué mes Neveux, j'ai fait périr mon Frère, Et tu suis sur le point d'égorger mon Beaupère:
Du creux de ton neant ſors, Sejanus, & voy Le Tbrône où mes forfaits t’ont eſleué ſans toy?	Du creux de ton néant sors, Séjanus, et vois Le Tbrône où mes forfaits t'ont élevé sans toi?
Si pour des coups ſi grands, tu te ſens trop timide.	Si pour des coups si grands, tu te sens trop timide.
Rends-moy l’Aſſaßinat, rends-moy le Parricide, Et pour me rendre vn crime encor plus deſplaiſant, Traiſtre, rends-moy l’amour dont ie t’ay fait preſent?	Rends-moi l'Assassinat, rends-moi le Parricide, Et pour me rendre un crime encor plus déplaisant, Traître, rends-moi l'amour dont grands t'ai fait présent?
SEIANVS.	SEIANUS.
Comment agir, Madame, auec vne Princeſſe, Dont il faut meſnager l’eſprit auec adreſſe?	Comment agir, Madame, avec une Princesse, Dont il faut ménager l'esprit a presse?
A qui tous nos deſſeins paroiſtroient furieux, Sans le bandeau d’Amour qui luy couure les yeux.	À qui tous nos desseins paraîtraient furieux, Sans le bandeau d'Amour qui te couvre les yeux.
Helas!	Hélas!
ſi dans mon ſein vous voyeZ la contrainte, Dont deſchire mon cœur, cette cruelle feinte;	si dans mon sein vous voyeZ la contrainte, Dont déchire mon cœur, cette cruelle feinte;
Quand lai haine me force à trahir l’amitié, Peut-eſtre en cet eſtat vous ferois-ie pitié:	Quand lai haine me force à trahir l'amitié, Peut-être en cet état vous ferais-je pitié:
Les larmes dont ie feins vouloir prendre ſon ame, Luy montrent ma douleur bien pluſtoſt que ma flame.	Les larmes dont grande feins vouloir prendre son âme, Lui montrent ma douleur bien plutôt que ma flamme.
LIVILLA.	LIVILA.
O Dieux!	Ô Dieux!
qu’on a de peine à prononcer l’arreſt Quand on veut condamner vn ennemy qui plaiſt?	qu'on a de peine à prononcer l'arrêt Quand on veut condamner un ennemi qui plaît?
auumneyomime ,Omuruponvonfuſe, Comme vn luge irrité ſoy-meſme ſe recuſe, Ton crime parle en vain, ie n’oſc l'eſcouster ?	auomneiomime ,Omuruponvonfuse, Comme un luge irrité soi-même se recuse, Ton crime parle en vain, je n'osc l'escouster ?
ias I'ay peur qu’il ne me force à n'en hoiruoir donter:	jas J'ai peur qu'il ne me force à n'en hoir donter:
Quoy que ſenſiblement ta trahiſon m'offenſe;	Quoi que sensiblement ta trahison m'offense;
Ie mne la cache afin d’arreſter ma vengeance, Ou ſi plus clairement il' me faut exprimer, Ie me la cache afin de te pouuoir aymer.	Je mène la cache afin d'arrêter ma vengeance, Ou si plus clairement il me faut exprimer, Je me la cache afin de te pouvoir aimer.
C’en eſt trop, Sejanus, ma douleur eſt contenté, La plus foible raiſon ſuffit pour vne Amante, Et malgré mon ſoupçon contre toy ſi puiſſant, Parce que ie t’aymay ie te crois innocent.	C'en est trop, Séjanus, ma douleur est contenté, La plus faible raison suffit pour une Amante, Et malgré mon soupçon contre toi si puissant, Parce que sans t'aima ie te crois innocent.
Adieu, voy l'Empereur, aßiege ſa Perſonne, Qu'en tous lieux ton aſpect l’eſpouuente & l’eſtonne.	Adieu, vois l'Empereur, asiège sa Personne, Qu'en tous lieux ton aspect l'épouvante et l'étonne.
SEIANVS.	SEIANUS.
Ie ſçay que l'Empereur ne peut eſtre aduerty Du nom des conjurez qui forment le party, Cependant plus ma courſe approche la barriere, Timo mou tunoveoute (y mo turc en untneif.	Je sais que l'Empereur ne peut être averti Du nom des conjurés qui forment le parti, Cependant plus ma course approche la barrière, Timo mou tunoveoute (y mo turc en untneif.
LIVILLA.	LIVILA.
Va, va, ne tremble point, aucun ne te trahit.	Va, va, ne tremble point, aucun ne te trahit.
SEIANVS.	SEIANUS.
Vne ſecrette horreur tout mon ſang.	Une secrète horreur tout mon sang.
enuahit:	envahit:
Ie ne ſçay quoy me parle, & ie ne puïs l’entendre, Ma raiſon dans.	Je ne sais quoi me parle, et Seigneur ne pu l'entendre, Ma raison dans.
mon cœur s’efforce de deſcendre, Mais encor que re'bruict ſoit vn bruict mal diſtinct, Ie ſons que ma raiſon de cede à mon inſtinct;	mon cœur s'efforce de descendre, Mais encor que rebruit soit un bruit mal distinct, Je sons que ma raison de cède à mon instinct;
Cette raiſon pourtans redeuient la Maiſtreſſe, Frappons, voyla l’hoſtie, & l’occaſion preſſe, Auſsi bien quand le coup me pourroit accabler, Dejuna, peur mouen;	Cette raison pourrait redevient la Maîtresse, Frappons, voilà l'hostie, et l'occasion presse, Aussi bien quand le coup me pourrait accabler, Déjuna, peur mouen;
mmi, in ne peut trembler.	mémi, in ne peut trembler.
CCEAVE	CCEUE
LIVILLA.	LIVILA.
Intrigue eſt découuert, les laſchẽs m’ont trahie:	Intrigue est découvert, les laschẽs m'ont trahie:
Ils m’en ont fait l’affront, ils en perdront la vie;	Ils m'en ont fait l'affront, ils en perdront la vie;
D’vn eſprit ſatisfait ie les verray mourir, Et periray contente en les faiſant perir.	D'autre esprit satisfait ieles rai mourir, Et périrai contente en les faisant périr.
O vous, mes chers nepueux, mon eſpoux & mon frere, Ma fureur a trouué le moyen de vous plaire, Pour vous rendre le faix du tombeau plus leger De tous vos aſſaſsins, elle va vous vanger;	Ô vous, mes chers neveux, mon époux et mon frère, Ma fureur a trouvé le moyen de vous plaire, Pour vous rendre le faix du tombeau plus léger De tous vos assassins, elle va vous venger;
Et par des coups ſi grands, ſi pleins, ſi legitimes, Que ie ſeruy vompripoun uuuibre des victimes:	Et par des coups si grands, si pleins, si légitimes, Que je servi vompripoun uuuibre des victimes:
Mais le temps que ma bouche employe à ſoûpirer, Preſte à nos criminels, celuy de reſpirer:	Mais le temps que ma bouche emploie à soupirer, Preste à nos criminels, celui de respirer:
Haſtons-nous, car enfin du iour qu’ils me trahiſſent, Ils me l’ont dérobé cét air dont ils jouyſſent.	Hâtons-nous, car enfin du jour qu'ils me trahissent, Ils me l'ont dérobé cet air dont ils jouissent.
Fin du quatrieſme Acte.	Fin du quatrième Acte.
A.	A.
SCENE PREMIERETIBERE, LIVILLA, FVRNIE.	SCÈNE PREMIÈRETIBERE, LIVILA, FURNIE.
TIBERE.	TIBERE.
T Nhomme qu'en dormant la fortune élena	 Thomme qu'en dormant la fortune élena
LIVILLA.	LIVILA.
Que de l’obſcurité ton amitié ſauus,	Que de l'obscurité ton amitié savus,
TIBERE.	TIBERE.
Sejanus, dont la teſte, vnie à ma perſonne, Empliſſoit auec moy le rond de ma Couronne, En vouloir à mes iours?	Séjanus, dont la tête, unie à ma personne, Emplissait avec moi le rond de ma Couronne, En vouloir à mes jours?
Il en mourra l’ingrat;	Il en mourra l'ingrat;
LIVILLA.	LIVILA.
Par ſa punition, aſſeure ton Eſtat.	Par sa punition, assure ton État.
TIBERE.	TIBERE.
Ie veux qu’en ſon trépas la Parque s’étudie, A prolonger ſa peine au delà de ſa vie:	Je veux qu'en son trépas la Parque s'étudie, À prolonger sa peine au delà de sa vie:
Qu’il meure & qu’vn ſanglot ne luy ſoit point permis,  mivarreſte tes jeuivat tons jes Blnemss;	Qu'il meure et qu'eau sanglot ne lui soit point permis, mivarrête tes jeuivat tons j' Blnemss;
Et qu’il ſoit trop peu d’vn pour la douleur entieré, Dont il doit ſeruir ſeul d’eſpace & de matiere.	Et qu'il soit trop peu d'espace pour la douleur entieré, Dont il doit servir seul d'espace et de matière.
LIVILLA.	LIVILA.
A quelque extremité qu'aille ſon chaſtiment, Tu te vanges d’vn traiſtre encor trop doucement:	À quelque extrémité qu'aille son châtiment, Tu te venge d'un traître encor trop doucement:
Mais!	Mais!
Seigneur, ſans peril le pourras-tu détruire, Et n’eſt-il plus, le laſche, en eſtat de te nuire.	Seigneur, sans péril le pourras-tu détruire, Et n'est-il plus, le lâche, en état de te nuire.
TIBERE.	TIBERE.
Il eſt pris le ſuperbe, on inſtruit ſon procez, Et ie le voy trembler de ſon dernier accez;	Il est pris le superbe, on instruit son procès, Et je le vois trembler de son dernier accès;
Auſsi-toſt que ta bouche à l’eſtat ſecourable, M'eut découuert l’Auteur de ce crime execrable, Pour l’éloigner des ſiens auecque moins d’éclat, I’ay fait dans mon Palais aſſembler le Senat;	Aussitôt que ta bouche à l'état secourable, M'eût découvert l'Auteur de ce crime exécrable, Pour l'éloigner des siens auecque moins d'éclat, J'ai fait dans mon Palais assembler le Sénat;
Mais c’eſt auec deſſein d’attirer ce perfide, Et pouuoir en ſes yeux lire ſon parricide.	Mais c'est avec dessein d'attirer ce perfide, Et pouvoir en ses yeux lire son parricide.
Les conuocquez, ſont gens à ma deuotion:	Les convocqués, sont gens à ma dévotion:
Le Conſul eſt inſtruit de mon intention:	Le Consul est instruit de mon intention:
On fait garde par tout, & par tout ſous les armes Le Soldat tient la Ville, & le peuple en allarmes:	On fait garde par tout, et par tout sous les armes Le Soldat tient la Ville, et le peuple en alarmes:
Cependant au Palais le coupable arreſté, Et du rang de Tribun par ma bouche flatté, Vient d’entrer au Senat pour ſortir au ſuplice;	Cependant au Palais le coupable arrêté, Et du rang de Tribun par ma bouche flatté, Vient d'entrer au Sénat pour sortir au supplice;
Il n’a plus d’autres lieux à voir qu’vn precipice.	Il n'a plus d'autres lieux à voir qu'un précipice.
LIVILLA.	LIVILA.
beigneur, &re dagrippint en uecon reſolu?	beigneur, être dagripint en évecon résolu?
Tu dois l’exterminer de pouuoir abſolu:	Tu dois l'exterminer de pouvoir absolu:
Cét eſprit inſolent d’vn trop heureux menſonge, Croit t’auoir ſur ſon crime endormy par vn ſonge.	Cet esprit insolent d ' Heureux mensonge, Croit t'avoir sur son crime endormi par un songe.
TIBERE.	TIBERE.
Ce ſonge fabuleux ne ma point endormy, Au deſſein de la perdre, il m’a plus affermy:	Ce songe fabuleux ne ma point endormi, Au dessein de la perdre, il m'a plus affermi:
De l’attentat qui trouble vne ame embaraſſée, La parole eſt toüjours auprés de la penſée, Et le cœur agité par quelque grand deſſein, Esbranle malgré ſoy la bouche auec le ſein.	De l'attentat qui trouble une âme embarrassée, La parole est toujours auprès de la pensée, Et le cœur agité par quelque grand dessein, Ébranle malgré soi la bouche avec le sein.
Non, ma fille, elle court à ſon heure derniere, Et ſans qu’elle le ſçache, on la tient prìſonniere:	Non, ma fille, elle court à son heure dernière, Et sans qu'elle le sache, on la tient prìsonniere:
I’ay corrompu ſes gens, dont l’eſcorte ſans foy La garde iour & nuit non de moy, mais pour moy;	J'ai corrompu ses gens, dont l'escorte sans foi La garde jour et nuit non de moi, mais pour moi;
Et ſes plus confidents que mon eſpargne arreſte, A mes pieds ſi ie veux apporteront ſa teſte:	Et ses plus confidents que mon épargne arrête, À mes pieds si belle veux apporteront sa tête:
Mais ie la flatte afin que ſon Arreſt fatal, Quand il la ſurprendra luy faſſe plus de mal.	Mais ici la flatte afin que son Arrêt fatal, Quand il la surprendra homme fasse plus de mal.
SEBEVN RY NERVA, TIBERE, LIVILLA.	SEBEUN RY NERVA, TIBERE, LIVILA.
ERVA.	ERVA.
Eigneur, il eſt iugé;	Eigneur, il est jugé;
quand on a leu ta lettre, Sans que pour luy perſonne ayt oſe s’entremettre, Comme ſi ſon mal-heur eſtoit contagieux, Chacun de ſon viſage a détourné les yeux;	quand on a lu ta lettre, Sans que pour Elle personne ait ose s'entremettre, Comme si son malheur était contagieux, Chacun de son visage a détourné les yeux;
Ce puiſſant Sejanus, ſi grand, ſi craint n’aguiere, Cette Diuinité du noble & du vulgaire,	Ce puissant Séjanus, si grand, si craint n'aguière, Cette Divinité du noble et du vulgaire,
L iij A qui le peuple au Temple appendoit des Tableaux, A qui l’on decernoit des triomphes nouueaux, Qu’on regardoit au thrône auec idolatrie.	 Lijà À qui le peuple au Temple appendait des Tableaux, À qui l'on décernait des triomphes nouveaux, Qu'on regardait au trône avec idolâtrie.
Nommé par le Senat, Pere de la Patrie, Dans vn corps où pour tel chacun l’auoit tenu, N'a point trouué d’enfans qui l’ayent reconnu;	Nommé par le Sénat, Père de la Patrie, Dans un corps où pour tel chacun l'avait tenu, N'a point trouvé d'enfants qui l'aient reconnu;
Ils l’ont condamné tous d’vne voix vnanime, Ais ſupplice du roc pour expier ſon crime:	Ils l'ont condamné tous d'une voix unanime, Ais supplice du roc pour expier son crime:
Ce coupable eſt deja dans la court deſcendis, Où par l’Executeur ton ordre eſt attendu.	Ce coupable est déjà dans la court descendis, Où par l'Exécuteur ton ordre est attendu.
LIVILLA.	LIVILA.
Cœſar au nomdes Dieux, commande qu’on l’ameine, Il importe à ta vie, il importe à ma haine, Qu'auant le coup fatal nous puiſsions nous parler;	Cœsar au nomdes Dieux, commande qu'on l'amène, Il importe à ta vie, il importe à ma haine, Qu'avant le coup fatal nous puissions nous parler;
Car i’ay d’autres ſecrets encor à reueller.	Car j'ai d'autres secrets encor à reveler.
TIBERE.	TIBERE.
Fais qu’il monte, Nerua.	Fais qu'il monte, Nerva.
2 R12	2 R12
S LENVDIII TIBERE, LIVILLA.	 SENVDIII TIBERE, LIVILA.
LIVILLA.	LIVILA.
CEtte haute indulgence nidt juiprvna & m'oblige à la recomnoiſſance;	CEtte haute indulgence nidt juiprès et m'oblige à la recomnaissance;
Aſin donc que Cœſar demeure ſatisfait, Et que ma courtoiſie eſgale ſon bien-fait, Ie luy veux découurir le plus grand des complices.	Asin donc que Cœsar demeure satisfait, Et que ma courtoisie égale son bienfait, Je lui veux découvrir le plus grand des complices.
TIBERE.	TIBERE.
Par ſon nom, Liuilla, couronne tes ſeruices:	Par son nom, Livilla, couronne tes services:
LIVILLA.	LIVILA.
Ouure les yeux ſur moy tyran, c’eſt Liuilla;	Ouvre les yeux sur moi tyran, c'est Livilla;
TIBERE.	TIBERE.
La fureur de ma bru paſſeroit iuſques là?	La fureur de ma bru passerait jusques -là?
LIVILLA.	LIVILA.
Appelle-tu fureur vn acte de Juſtice?	Appelle-tu fureur un acte de Justice?
L.	L.
Lni re Es Donc de mon aſſaſsin, ma fille eſt la complice?	Lni re Es Donc de mon assassin, ma fille est la complice?
LIVILLA.	LIVILA.
Non, ie ne la ſuis pas, Tibere, il eſt le mien;	Non, Seigneur ne la suis pas, Tibère, il est le mien;
