Las	Las
Ie ne te promets rien ſinon quand ie verray L'effect de ton diſcourt, lori ie ſatiſſeray Ace que tu requitri, fay dont que it cognoiſſe Si Phelidon cherit vne autre pour maiſtreſſe Qnm)ja reaeeut.	Je ne te promets rien sinon quand belle verrai L'effet de ton discourt, lori ie aptisserai Ace que tu requitri, fais dont que it connaisse Si Phelidon chérit une autre pour maîtresse Qnm)jà reçut.
Roſetin.	Rosétin.
Helaità mon ſeceurs Bergers accourez toſt en vous i’ay mon recours.	Hélaità mon seceurs Bergers accourez tôt en vous j'ai mon recours.
Helas!	Hélas!
qu’elle pitié, helas!	qu'elle pitié, hélas!
e eelle riſere De voir ainſi ſouffrir vne pauure bergere.	 celle risère De voir ainsi souffrir une pauvre bergère.
Bonicel.	Bonicel.
deyſontnn, Cuaxſm aming Le mal, qui de meuuoir cette fille a priué?	deysontnn, Cuaxsm ing Le mal, qui de meuvoir cette fille a privé?
Roſerin.	Roserin.
Voyant ſon Phelidon pres vn autre bergere Dormir en ce taillis ſur la verte fougere, Elle a print ce ſincope, & le crains que ſes iours Arriuent à leur fin pour me geſner touſiburs.	Voyant son Phélidon pres un autre bergère Dormir en ce taillis sur la verte fougère, Elle a prit ce syncope, et le crains que ses jours Arrivent à leur fin pour me gêner tousiburs.
Bonicel.	Bonicel.
Voila comme l’amour enfante di:	Voilà comme l'amour enfante di:
mariyre, Quand on ne peutt auoir l'obiect que lon deſire, Il la faut ſecourir de tout noſtre pounoir, Compagnen rendez luy des bergers le deuoir, La prenant doucement comme demie morie, Afin de l'emporter dant la premiere grotte Que vous pourreZ trouuer, quelles extremitt L’ameur va produiſent par les ſatalitez:	marire, Quand on ne peut avoir l'objet que lon désire, Il la faut secourir de tout pr pounoir, Compagnen rendez Seigneur des bergers le devoir, La prenant doucement comme demie morie, Afin de l'emporter dant la première grotte Que vous pourrez trouver, quelles extrémités L'ameur va produisent par les satalités:
Les vns ſont de doucer, les autret d’amertume, L’vn ſe veit toſt perir, l’autre plus fort s’allumt.	Les uns sont de doucer, les autret d'amertume, L'un se vit tôt périr, l'autre plus fort s'allumt.
O le grand creuecœeur, bella tr.	Ô le grand crévecœeur, bella tr.
ride pirié Que la mort ſoit le guess d'uet let vcamitié, Ie ne me puis tenir voyant ce flraiageme De ieitpr des ſouſpirs, que ton ſort eſl extreme:	ride pirié Que la mort soit le gués d'uet let vécamitié, Je ne me puis tenir voyant ce flraiageme Dé ieitpr des soupirs, que ton sort él extrême:
Amoir, amour, ameur, iu es trop rigoureux De ſaufrir tes cliens eſtre ainſi langoureux, Tout eſt ſubiect à toy, tout te doit rendre hommage, Et perſonne ne peut finir ton eſclauage.	Amoir, amour, ameur, ju es trop rigoureux De saufrir tes cliens être ainsi langoureux, Tout est sujet à toi, tout te doit rendre hommage, Et personne ne peut finir ton esclauage.
Roſerin.	Roserin.
Le mal-beur a ſur moy ſen venin incité.	Le malheur a sur moi sen venin incité.
dioſneci.	diôneci.
Le ſincope berger ta bille a il quitté?	Le syncope berger ta bille a il quitté?
Roſerin.	Roserin.
Ouy, mals elle vit d’vne vie dolente, Car le ſpaſine axant fait ſa force violente, Elle a ouuert ſes yeux ſeulement à demy, Eemamit eciay qus aprqunaunans dama), Et proſere ces mott, las!	Oui, mals elle vit d'une vie dolente, Car le spasine axant fait sa force violente, Elle a ouvert ses yeux seulement à demi, Eemamit eciai qu' aprqunaunans dama), Et prosère ces mott, las!
c’eſl ion inconstance, Phelidon qui me fait ſerue de la ſouffrante.	c'él ion inconstance, Phélidon qui me fait serve de la souffrante.
Boniecl.	Boniecl.
Elle ne mourra pas, ouis que las paſmoiſon Luy laſſſe eneor voir naſire b'el horiſon:	Elle ne mourra pas, ouïs que las pâmoison Lui lassse enseor voir nasire b'el horizon:
Ie n’ay iamais ſentz d’auoir aucune flame, Mais en voyant ſes maux, ie jotthaitte en mon ame La mort finir mes iours, plulloſt que d’endurer Vn mel ſi gangrentux que lon ne ptus curer, Que ſert de tant aimerſoui touyr ce qu’on dime Sinon entretenir ſa vie d’vn dilemme?	Je n'ai jamais sentz d'avoir aucune flamme, Mais en voyant ses maux, ie jotthaite en mon âme La mort finir mes jours, plullôt que d'endurer Un mel si gagnrentux que lon ne pûtus curer, Que sert de tant aimersoui touir ce qu'on dîme Sinon entretenir sa vie d'un dilemme?
Et puis vemint Au beut qu’on dont eſire contant, La mert va noſtre amour, & noz iours emportan:	Et puis vemint Au bient qu'on dont esire contant, La mert va notre amour, et noz jours emportan:
Jaime mieux tout pauuret mnener mes camuſettes Picorer par les champt les tendres herbeletles, Que de m’aſſubiettir au dieu Ciprinien, Et le ſeruant me voir d’Atropos le clien.	Jaime mieux tout pauvret méner mes camusettes Picorer par les champt les tendres herbletles, Que de m'assubiettir au dieu Ciprinien, Et le servant me voir d'Atropos le clien.
Viue la liberté, arriere le ſeruage, Viue d’eſtre contant en ſon petit village, Viue vn cay paſteurau viuant champeſtrement, Qui n’apoint de ſoucy d’vn siuil ornement:	Vive la liberté, arrière le servage, Vive d'être contant en son petit village, Vive un cai pasteurau vivant champêtrement, Qui n'appoint de souci d'un siuil ornement:
Les riches citadins auec leur grand richeſſe Nont pas tant de plaiſir, de ioye & d’alegreſſe Que le campin berger, le muſc & les odeurs Dans les louures dorez ſont auec let grandeurs, Et nout autres auont la liuande odorante, Le romarix, le thin, & l’œillet, & la niente, Qui ornent noZ paſtis beauccup plut.	Les riches citadins avec leur grand richesse Nont pas tant de plaisir, de joie et d'allégresse Que le campin berger, le musc et les odeurs Dans les louvres dorés sont avec let grandeurs, Et nout autres avont la livande odorante, Le romarix, le trente, le trente, et la niente, Qui ornent noZ pastis beauccup plut,
i friſer, Que tant d’inuentieni ſeru.	y friser, Que tant d'inventience servi.
ias à deguiſer, Le aetifice dinin paſſe caiby aes homuies, Nout nous en contentons en l'estat où nous ſommes, Sans:	jas à déguiser, Le aétifice din passe caibi âmes homvies, Nout nous en contentons en l'état où nous sommes, Sans:
flechir ſous le ioug du petit Cupidon,	fléchir sous le joug du petit Cupidon,
Roſerin.	Roserin.
uamtmiaje maifemumapaumeuden, Il fera contre moy eſclorre ſa ſurie.	uamtmiaje maifemumapaumeuden, Il fera contre moi esclorre sa surie.
Panglonne.	Panglonne.
Cemment tu luy as donc fait quelque tromperie.	Cemment tu lui as donc fait quelque tromperie.
Roſerin.	Roserin.
C'eſt moy ſeul qui a fait Alcione venir Pour du tort qu’il m'a fait is mon gré le punir.	C'est moi seul qui a fait Alcione venir Pour du tort qu'il m'a fait is mon gré le punir.
noincuucep maguuva didenm ve prediie	noincucep magua didenm vu prédiie
Roſerin.	Roserin.
Le tourment eternelqui Promethes afflige Eſt trop petit pour moy, ie merite d’auoir Tous les maux que Minos retient en ſon pouuoir:	Le tourment éternelqui Promethes afflige Est trop petit pour moi, ie mérite d'avoir Tous les maux que Minos retient en son pouvoir:
Ie ne pouuois ſouf rir qu’vn reſus honorable, Ou le contentement de mon vœu amiable Tuſpevautoucaten e ten o cuune jpon, Pour mettre Phelidon & moy au deſeſpoir.	Je ne pouvais sous rir qu'un ressus honorable, Ou le contentement de mon vœu amiable Tuspevautoucaten een een ô cuune jpon, Pour mettre Phelidon et moi au désespoir.
Paugionne.	Paugionne.
Si iu as du tourment, ion ame le merite, Et te repentiras d’vne telle pourſuite.	Si ju as du tourment, ion âme le mérite, Et te repentiras d'une telle poursuite.
Helas!	Hélas!
as tu o:	as tu ô:
cennier le repos De celuy que tu veux loger chez Atropos?	cennier le repos De celui que tu veux loger chez Atropos?
Que dira-il pauuret abandonnant Morphee, Alcions voyant pres luy faire trephee, Chacun te doit hayr, tuis que ta laſcheté Crayonne le pourtrait d’vn mal-heur appreſte.	Que dira-il pauvret abandonnant Morphe, Alcions voyant pres lui faire trephée, Chacun te doit haïr, tuis que ta lâcheté Crayonne le pourtrait d'un malheur apprête.
O deſtin que tit es en ton cours vuriable, Et ton amour qui rend vn amant miſerable.	Ô destin que tit es en ton cours vuriable, Et ton amour qui rend un amant misérable.
aunquey nalonine il queaejasiariss Vers ceux que tu cognois pleint de grande amitié?	aunquey nalonine il queajasiariss Vers ceux que tu connais pleins de grande amitié?
Las i’ay le cœur glacé voyant le triſte encombre Appresté peur loger dedant l'infernale vmbre Phelidon le courteis.	Las j'ai le cœur glacé voyant le triste encombre Apprêté peur loger dedant l'infernale vambre Phelidon le courteis.
Bonicel.	Bonicel.
Son mal-heur changera, Et peut eſtre à la fin content il iouyra Du ſubiect qu’il cherit.	Son malheur changera, Et peut -être à la fin content il jouira Du sujet qu'il chérit.
Roſcrin.	Roscrin.
Ce bien ie luy procure cibubrrantmih Mait anemJojenuie.	Ce bien imaires procure cibubrantmih Mait anémojenuie.
Pangionne.	Pangionne.
Tit n’at pas touſiours eu cette inelination, Ains nourr) daus ton cœur vne autre intention, Tu te dis ſon amy maintenant & parforce, Apres que tu luy at faut ſentir la ſecauſſe D'vnt grand trahiſen, he!	Tit n'at pas toujours eu cette inelination, Ains nourr) daus ton cœur une autre intention, Tu te dis son ami maintenant et parforse, Après que tu lui at faut sentir la secausse D'unt grand trahisen, hé!
tu as merlté De porter ſur ton cbef le ſoudre deſpité, Dant lupiter panit de Pelion l’audace:	tu as merlté De porter sur ton ces le soudre dépité, Dant lupiter panit de Pélion l'audace:
Ne cuide pas auſſi auoir aucunt erace De ton dire menttur, ains plaſtoſt de ſouſſrir Le malheur que le temps te viendr.	Ne cuide pas aussi avoir aucunt erace De ton dire menttur, ains plastost de soussir Le malheur que le temps te viendr.
i tosteffrir.	y tôteffrir.
Roſerin.	Roserin.
Ie regrette durs moy ſon mal en ſu deſtreſſe.	Je regrette durs moi son mal en su détresse.
Pangionne.	Pangionne.
Si tu n’auris, oin ut voir tou ame traistreſſe, Il ſeroit coreſe Luoré, & chery, Aſais il ne ſera plus maintenant fauory Qu'oux champs Eliſeens, où ſera ſa demeure, Sil te rençontre icy, iu auras mauuaiſe heure, Eſtant bun dangereux, cognoiſſant tenorgueil:	Si tu n'auris, oin ut voir tou me traîtresse, Il serait corée Luoré, et chéri, Asais il ne sera plus maintenant favori Qu'oux champs Eliseens, où sera sa demeure, Sil te renontre ici, ju auras mauvaise heure, Étant bun dangereux, connaissant tenorgueil:
Que tu ailles là bas de Pluton veir l'eſcueil:	Que tu ailles là bas de Pluton vuir l'écueil:
Retire toy bien toſt, cu ie crains qu’il arriue, Evvuruumnt dcservaa de Mateurrdapiine.	Retire toi bien tôt, cv ie crains qu'il arrive, Evvuruumnt dcservaa de Mateurrdapiine.
Bonicel.	Bonicel.
Furie ventz toſt, venez pour emmtner Ce nilleux corcodil, & là bat le trainer, Donnez le pour butin à la dent cerberinne, Qu quelaue plut grand mallancez pour lit ruyne De te mauuais terger tout bouſſi de poiſon, Ce ſerpent amphiſb.	Furie vents tost, venez pour emmîtner Ce nilleux corcodil, et là bat le trainer, Donnez le pour butin à la dent cerberinne, Qu quelaue plut grand mallancez pour lit ruine De te mauvais terger tout boussy de poison, Ce serpent amphisb.
tin auide de raiſon.	tin auide de raison.
Pangionne.	Pangionne.
Faites luy, faites luy danie aux couleures torſer Di vos flambeaux noirc is ſecourir les emterſes, Qui cernerent le lit de la pauure Pregné Eſpouſe à Tereut d’inceſtę condamni.	Faites -moi, faites lui danie aux couleures torser Di vos flambeaux noirc is secourir les emterses, Qui cernèrent le lit de la pauvre Pregné Espouse à Tèreut d'incest condamni.
Va ſeceurir ailleurs, & prens pour compagitie Les poſtillons aislez d’vne Atropoi bleſmit:	Va seceur ailleurs, et prends pour compagitie Les postillons aisés d'une Atropoi blêmit:
Ce ſera le hibou, la huppe, & le corbeus, Quit ſuront nomnit intant aanſle minbeau:	Ce sera le hibou, la huppe, et le corbeus, Quit suront nomnit intant aanle minbeau:
Et ſi les dieux encor exaucent ma priere Dant le lethé ſera ta demeure dernitre.	Et si les dieux encor exaucent ma prière Dant le lethé sera ta demeure dernitre.
Roſerin.	Roserin.
Eſt il rien de pareil voir lut hommes les dieux Me priuer à iamais de paroiſtre à leurs yeux, Celu ſero:	Est il rien de pareil voir lut hommes les dieux Me priver à jamais de paraître à leurs yeux, Celu zéro:
t-il pas ſouffiſant peur me faire Tirer l’ame dit corpt d’vne main ſanguinaire, Tes iours pauure berger, en donnt pour butin A la diſcretion de l’infernal maſtii?	t-il pas souffisant peur me faire Tirer l'âme dit corpt d'une main sanguinaire, Tes jours pauvre berger, en donnât pour butin A la discrétion de l'infernal masti?
Ouy cela ſeroit ſuffiſant & capable De tirer de mon corps la vit abominable, Mais il n’eſt pas beſcing d’enfanter du mal-heur, Il y en a aſſez, i’ay pur trop de deuleur.	Oui cela serait suffisant et capable De tirer de mon corps la vit abominable, Mais il n'est pas bécing d'enfanter du malheur, Il y en a assez, j'ai pur trop de uleur.
Il faut, helas Hil faut ex faire penitence, Et quitier des bergers l’agreable preſence.	Il faut, hélas Hil faut ex faire pénitence, Et quitier des bergers l'agréable présence.
Adicu donc pour iamtis, ò champeſtre plaiſir, Puis qu’vn autre ſeiour il me eonuient choiſir.	Adicu donc pour jamtis, champêtre plaisir, Puis autre seiour il me eonuient choisir.
Aditu mon chien baillet, mon biſſac, ma heulette, Mla fute, mon ſlageche ma douce avuſetie.	Aditu mon chien baillet, mon bissac, ma heulette, Mla futé, mon slageche ma douce avusetie.
Aditit mon griis trouppeaiu, i dieu gentils bergers PuiſiuZ vous eftre exempts de courir mes duigers:	Adit mon griis troupeaiu, y dieu gentils bergers PuisiuZ vous être exempts de courir mes duigers:
Mfait à dieu Phelidon remply d’amitié grande, Craintif de i’iipprocher p.	Mfait à dieu Phélidon rempli d'amitié grande, Craintif de j'ipprocher p.
irdon ie ie demande.	irdon rien rien demande.
Ie t'ay bien eſſenſé, men crime eſt infiny, Alais s’ilfaut m’abſenter comme pauure bam Eppreuue mon depart, ô nymphe Polibelle Nemonire paſton amt ehre vnt amt crlle Enueciion Puelidon, vineZ enſemblement, Mais i’ir ay vagabond ſuiure mon chaſtiment.	Je trouve mon bien essensé, men crime est infini, Alais s'ilfaut m'absenter comme pauvre bam Épreuve mon départ, ô nymphe Polibelle Némonire pâton am ehre crlle Enueciion Puelidon, vineZ ensemblement, Mais ay vagabond suiure mon châtiment.
Phelidon.	Phélidon.
Phol'etor m’a tenn aſſez dedans ſa couche, Le ſoiu de mon trouptau tour le garder me touche:	Phol'étor m'a tenn assez dedans sa couche, Le soiv de mon trouptau tour le garder me touche:
Mat, ò dieu qu’eſt cecz, ſeroit-il bien moyen Que ina belle ait eſté de ſon cœur gardien?	Mat, dieu est cecz, seroit-il bien moyen Que ina belle ait esté de son cœur Mat,
Ouy certainemente, c'est ma douce bergere, Celle que ie cheris, que i’aime, ie rauere:	Oui certainemente, c'est ma douce bergère, Celle que je chéris, que j'aime, Seigneur ravère:
Aptroche toy ma belle, approche ce ttion, Ou ie voy allaché vn roſerin bouton, Il fant que ic t’acolle, & puit que ie butine vn amoureux u.	Aptroche toi ma belle, approche ce ttion, Ou tu vois allaché un roserin bouton, Il fant que ic t'acole, et puit que je butine un amoureux .
bſer ſur ntupic pomipnune,	bser sur nupic pomipnune,
Alcione.	Alcione.
Mon cœur veicy le tempi que iu dois t'eneliner Vers moy, puis que le ciel l'a voulu deſtiner:	Mon cœur victi le tempi que ju dois t'enéliner Vers moi, puis que le ciel l'a voulu destiner:
11ni touſieur;	11ni tousieur;
ſuy, maintenant il eſt heure De cognoiſtre le ſeu de dant lequel i'endure.	zvi, maintenant il est heure De connaître le seu de dant lequel j'endure.
Phelidon.	Phélidon.
Seroit-il bien moyen que ie fuſſe trompé, Et que d’vn vain eſprir i’ie eſté attrappé:	Serait-il bien moyen que ainsi fusse trompé, Et que d'un vain éprir j'ie été attrapé:
Quel gain t’arriuera d’eſtie diuſi deceuante?	Quel gain t'arrivera d'étie diusi décevante?
Rien, tu chaſſe plustoſt le fruiet de ton attante, Tu at eti vn baiſer garde le cherement, Ie ne veux violer le iant fainct iurement, Quevayſau ſatentrue te pens pontrqut, icopduis dej amuns la floflotanis barque, Polibelle eſſ montout,	Rien, tu chasse plutôt le fruiet de ton attante, Tu at eti un baiser garde le chèrement, Je ne veux violer le jant saint jurement, Quevaysau satentrue te pens ontrquit, icopduis dej uns la floflotanis barque, Polibelle ès mont,
A luet.	À luet.
2 Alcions.	2 Alcions.
u.	u.
ve pitié, de moy.	ve pitié, de moi.
on.	on.
Enfaſjamonnqareme a xi in, Ie ne le feray pas, mets aillennt ta fi.	Enfasjamonnareme a âme in, Je ne le ferai pas, mets aillennt ta fi.
ince.	ince.
1	1
Alolone.	Alolone.
Helas!	Hélas!
fuy moy ce biin d’abreger ma ſeuffrance.	fuis -moi ce biin d'abréger ma seuffrance.
te nuon.	te nuon.
Ie m'en garderay bien, à dieu bergere, à dieu.	Je m'en garderai bien, à dieu bergère, à dieu.
3.	3.
73.	73.
Ole tu me lai ler en ce ſanu ege litu?	Ole tu me lai ler en ce sanu ége litu?
eAhlt eir troy inhum.	EAhlt eir trois inhum.
uit, amt par trop bourrelle Plus ai ceaindee que n'eſi la hõnne cruelle,  qui on toſté le petit honceau, Qui avroiς tani.	Ouit, amout par trop bourrelle Plus ai ceainée que n'esi la honnne cruelle, qui on tosté le petit honceau, Qui auroive tani.
iis creu vn ieune iouueneeau, Dont le faug dit looüillir eſtre freid comine glace, Et ne rec!	jis cru un jeune iouueneeau, Dont le faug dit looüillir être fréid comine glace, Et ne reç!
erçher pas la Cipriennt tracs.	erçher pas la Cipriennt tracs.
O ctel, oterre, ô mner, bref te qui fitit rouler Les gleïes aZurtz, que Oieu voulut moitler, Au-Z vous comploité de redui:	Ô ctel, oterre, ô méner, bref te qui fit rouler Les gleïes aZurtz, que Oieu voulut moitler, AuEZ -vous comploité de rédui:
eAlcione Au centre des malheurs que ſon destin ordonne?	éLcione Au centre des malheurs que son destin ordonne?
Ouz, vous le voulez, c’eſt voſtes ſeul vouloir, Et voſtre vuelſera ſuiuy de mon pouuoir.	Ouz, vous le voulez, c'est vostes seul vouloir, Et votre vuelsera suivi de mon pouvoir.
Lie!	Lie!
pauuis Roſerin ie deplort ta peine, Et ſi tu es vid int prent pitie de lu m'enne:	pauvis Roserin ie déplort ta peine, Et si tu es vit int pren pitié de lu m'enne:
Tu asmoit Polipelle, & moy vii Plulidon, Alais tooz ameiles p’autont que lis mort pour gedon, Ie neregretierien que ma cherd t.	Tu asmait Polipelle, et moi vii Plulidon, Alais toz âmeiles p'auton que lis mort pour gédon, Je neregretierien que ma cherd s.
llinne, ;	lynne, ;
Craignant, ſçachant mil morl que le dueil la ruint, Lelce enuert moy elle mi ploręra, Et ded.	Craignant, sachant mil morl que le deuil la ruint, Lelce envert moi elle mi plorra, Et ded.
int le tombtau ſun amour durera:	int le tombtau sun amour durera:
A dien belle Lilinne.	À dien belle Lilinne.
6 Lilinne.	6 Lilinne.
2	2
Ahltompagns mamie Me voulez vous priuer de tioſtre compagnie?	Ahltompagns mamie Me voulez -vous priver de tiostre compagnie?
Vout ay ie ſait offenſe en quelqul occaſion, Pour me laiſſer' ainſi pleine d’affliction?	Vout ai assez sait offense en quelqul occasion, Pour me laisser' ainsi pleine d'affliction?
Ne precipitez put vot ieunet dns ma belle, Le temps les fauche aſſez auec ſa faulx cruille.	Ne précipitez put vot jeunet dns ma belle, Le temps les fauche assez auec sa faulx cruille.
Ne faites pai m’ameur hommage au deſeſpeir, Uous n’en pourriez vn iour que du meſprii duoir, MetteZ deuant vez yeux tant de deſiſperees, Qui ont banm l'honneur ſe ſeut vituferees, N’ont ſait aucun eſtat de la riche vertu, Aint auec leurs deliti ſes threſori combatu.	Ne faites pai m'ameur hommage au désespéir, Uous n'en pourriez un jour que du mesprii duoir, Montés devant vez yeux tant de desisperees, Qui ont banm l'honneur se seut vituferees, N'ont sait aucun état de la riche vertu, Aint avec leurs déliti ses trésori combattu.
Mirrha ſeule ſaffit dans les hiſtoires vaintt, Sant celles que lon veit, o malheur, trop certa Au ſiecle ou nous vluons, & partant reiettez Tous les mauuais deſſtins qui tlennent arreſtez Voi ſent, voſtre raiſon, rendant ausſi perie Cette flame qui n’a que fard & trompirie, Et ſuiueZ mon conſeil.	Mirrha seule saffit dans les histoires vaint, Sant celles que lon vit, ô malheur, trop certa Au siècle ou nous veuluons, et partant rejettez Tous les mauvais desstins qui tennent arrêtez Voi sent, votre raison, rendant aussi périe Cette flamme qui n'a que fard et trompirie, Et suivez mon conseil.
Alcione.	Alcione.
Lamour n'unroit il riin Que du mal en tout tempt ſans produire aucun bitn, Ne croitz pas cela ſans eneſtre allumee.	Lamour n'unrait il rivin Que du mal en tout tempît sans produire aucun bitn, Ne croîts pas cela sans enêtre allumée.
Lilinne.	Lilinne.
Il a it ne ſçay quoy paſſant comme fumee.	Il a it ne sais quoi passant comme fumée.
Alcione.	Alcione.
Soit qu’il ait, eu n’ait pat do ſon mal ie monrraf.	Soit qu'il ait, eu n'ait pat do son mal On monraf.
Lilinne.	Lilinne.
Cela ne ſerapat tant que ie le pourray, Que dira on de vous & de voſtre martyre, St le ſeu de l'ameur vout fait la mort eilire?	Cela ne serapat tant que je le pourrai, Que dira on de vous et de votre martyre, St le seu de l'ameur vout fait la mort eilire?
Uous ſerez le ioulet, It diſcouri couſtumitr, l.	Où serez le joulet, It discouri coutumitr, l.
opprebre, le reiect, le meſprit iourtalier Des nations qui ſont ſous l’eſtieu des deux peles:	oprebre, le rejet, le méprit jourtalier Des nations qui sont sous l'estieu des deux peles:
Mais prenant mon conſeil & ſuiuant mes paroles AbandonneZ ce feu, pour moy ſi ie viuois Surpriſe d’vn tel malainſi que ie vous voit, Et qu’on me meſpriſuſt comms lon voui meſpriſe, Tel deſdain ſeruiroit pour me mettre en francbiſe:	Mais prenant mon conseil et suivant mes paroles Abandonnés ce feu, pour moi si ici vivais Surprise d' tel malainsi que je vous voit, Et qu'on me mesprisust comms lon voui méprise, Tel dédain servirait pour me mettre en francise:
Affranchiſez vous donc prur viure mamienant Seruant Diane & Pan qui nous vont ſouſtenant, Aleſpriſant tous les feuz de la belle Ciprinne, Et rendez eſtouſſé le mal qui vous ruine, Noſtre exercice eil beau, ſi agreble en ſoy Qu'il n’a rien d’inegail aux plaiſirs d’vn grand Roy:	Affranchisez -vous donc prur vivre mamienant Servant Diane et Pan qui nous vont soutenant, Alesprisant tous les feuz de la belle Ciprinne, Et rendez estoussé le mal qui vous ruine, Notre exercice eil beau, si agréble en soi Qu'il n'a rien d'inegail aux plaisirs d'un grand Roi:
Neus auons les foresls pour aller à la chaſſe, Et les petits ruiſſeaux pour prendre la becaſſe, dres prinen ju puapmn ay toguur Q uurltr, Et mut, vous nourriſſons let gros chieni mastiniers, Que çeut on deſirer qui ſoit plut agreable?	Nus avons les formesls pour aller à la chasse, Et les petits ruisseaux pour prendre la bécasse, dres prinen ju puapmn ai toguur Q uurltr, Et mut, vous nourrissons let gros chien mastiniers, Que çeut on désirer qui soit plut agréable?
Aſcione.	Ascione.
Voſtre diſcours Lilinne eſt vers moi charitabls Enclin à deſteu ruer mit tristes accidents.	Votre discours Lilinne est vers moi charitabls Enclin à desteu ruer mit tristes accidents.
Lilinne.	Lilinne.
Pracliquez le m'amour, uoz cheurettes gardans.	Pracliquez le m'amour, z cheurettes gardents.
Ie vay me retirer pour faire mon meſnage.	Je vais me retirer pour faire mon ménage.
Alcione.	Alcione.
Que ſert il de m’auoir tenu ſi grand langage, Puis que i'ay reſolu d’aller finir mes iours D.	Que sert -il de m'avoir tenu si grand langage, Puis que j'ai résolu d'aller finir mes jours D.
ins les bois pour ſeruir de paſturage aux eurt, Aux luus, & aux loups, & aiux beſles feroces, Qui me ſerout ſentir de Clothon les amorces?	ins les bois pour servir de pâturage aux eurt, Aux luus, et aux loups, et aiux bêles féroces, Qui me serout sentir de Clothon les amorces?
Fi ſi lei animaux oni trop d’humatité, C’eſt vn decret fatal dedaint moy arreſté, Que le voiageray pluſloſt lattrre ronde, Peur trouuer unyocher pres de la marine onde Lanceant moy, mes ennuis, dans cei flotantes eau*.	Fi si lei animaux oni trop d'humatité, C'est un décret fatal dedaint moi arrêté, Que le voyagerai pluslôt lattrère ronde, Peur trouver uniocher pres de la marine onde Lanceant moi, mes ennuis, dans ce flotantes eau*.
ACTE VATRIESME ET DERNIER Lilinne, Pangionne, Bonicel, Phelidon, Polibelle, Odifleur.	ACTE VATRIESME ET DERNIER Lilinne, Pangionne, Bonicel, Phélidon, Polibelle, Odifleur.
Lilinne.	Lilinne.
Leione vie?	Léione vie?
s voir mes iolit cheureaux, R Hleltu n'et pas icy Alcione, Alcione, le crains que le malheur de bien pres te lsdleislasy Reſpondi moy Alciont, Alcione eù es tut	s voir mes jolit cheureaux, R Hleltu n'et pas ici Alcione, Alcione, le crains que le malheur de bien pres te lsdleislasy Répondi moi Alciont, Alcione élu es tut
Pangionne.	Pangionne.
D’vn extreme regret i’ay le cœur reueſtu.	D'un extrême regret j'ai le cœur revêtu.
Lilinne.	Lilinne.
