A MADAME VLAE .	À MADAME VLAE .
LE ROY, A puiſſance des Rois n’a rien qui ſoit plaiſant, LComme le Sceptre eſt d’or il faut qu’il ſoit peſan Et quelque Maieſté, qui le Thrône enuironne, L’Eſpine ſuit la fleur dont on fait la Couronne.	LE ROY, A puissance des Rois n'a rien qui soit plaisant, LComme le Sceptre est d'or il faut qu'il soit péan Et quelque Majesté, qui le Thrône environne, L'Espine suit la fleur dont on fait la Couronne.
Vn bon Prince eſt Tyran de ſes propres deſirs, Le plaiſir de ſon peuple empeſche ſes plaiſirs;	Un bon Prince est Tyran de ses propres désirs, Le plaisir de son peuple empêche ses plaisirs;
Et dans les ſoins diuers, où l’Eſtat veut qu’il viue, Pour le mettre en repos le Monarque s’en priue.	Et dans les soins divers, où l'État veut qu'il vive, Pour le mettre en repos le Monarque s'en prive.
C’eſt vn Eſclaue illuſtre, auec des fers dorez:	C'est un Esclave illustre, avec des fers dorés:
Car ie veux que les Rois paroiſſent adorez, Que leur iuſte bonté ſe faſſe àymer & craindre, Touſiours mille broüillons trouuent dequoy ſe plaindi Qu’vn Prince recompenſe vn homme qui fait bien, L’enuieux en murmure, & croit que c’eſt ſon bien;	Car ie veux que les Rois paraissent adorés, Que leur juste bonté se fasse àymer et craindre, Toujours mille brouillons trouvent dequoy se plaindi Qu'Un Prince récompense un homme qui fait bien, L'envieux en murmure, et croit que c'est son bien;
Sa mediſance éclatte, & dans ſes laſches vices, Il perd le ſouuenir de tous les bons ſeruices;	Sa médisance éclatte, et dans ses lâches vices, Il perd le souvenir de tous les bons services;
Ses infames diſcours ne vont qu’à le blaſmer, MIj jaaarm ja quemaet,	Ses infâmes discours ne vont qu'à le blâmer, MIj jaaarm que jet,
TN COVRTTSAN.	TN COURTTTSAN.
Reiettez ce penſer, qu’il ne vous importune, Chacun eſtime Alcandre autant que ſa fortune, Et les plus meſdiſans ſont forceZ d’aduoüer, Que ſa rare vertu ne ſe peut trop loüer:	Rejettez ce penser, qu'il ne vous importune, Chacun estime Alcandre autant que sa fortune, Et les plus médisants sont forcés d'aduoüer, Que sa rare vertu ne se peut trop louer:
Qu'il merite l’honneur d'eſtre aymé de vous, Sire, Et qu’il a ce qu’il doit, ayant ce qu’il defire.	Qu'il mérite l'honneur d'être aimé de vous, Sire, Et qu'il a ce qu'il doit, ayant ce qu'il désire.
LE ROY.	LE ROY.
Ceux qui ne l’aiment pas ſont tous mes ennemis, Ie ſçay que le combat que nous auons permis, Fera cauſer le peuple, & que ſon inſolence Peſera mes raiſons d’vne iniuſte balance, N'importe, laiſſons dire, & creuer l'enuieux, Car pour iuger des Rois, il faut eſtre des Dieux.	Ceux qui ne l'aiment pas sont tous mes ennemis, Je sais que le combat que nous avons permis, Fera causer le peuple, et que son insolence Pesera mes raisons d'une injuste balance, N'importe, laissons dire, et crèver l'envieux, Car pour juger des Rois, il faut être des Dieux.
Mais où peut eſtre Alcandre?	Mais où peut être Alcandre?
VN COVRTISAN.	UN COURTISAN.
aupres de ce qu’il ayme:	auprès de ce qu'il aime:
Aßiſtant l'Eſtranger, ence peril extreme, Il monſtre ſa bonté par des ſoins continus:	Assistant l'Étranger, ence péril extrême, Il montre sa bonté par des soins continus:
Mais voicy les Guerriers qui nous ſont inconnus, G iiij	Mais voici les Guerriers qui nous sont inconnus, Guijà
LE ROY.	LE ROY.
Le port haut & ſuperbe, & la graue démarche.	Le port haut et superbe, et la grave démarche.
Me fait croire voir Mars, quand l'vn ou l’autre marche;	Me fait croire voir Mars, quand l'un ou l'autre marche;
Ils teſmoignent auoir des courages boüillans, Et ſi ie ne me trompe ils ſont tous deux vaillans.	Ils témoignent avoir des courages bouillants, Et si tu ne me trompe ils sont tous deux vaillants.
SCENE CINQVIESME.	SCÈNE CINQUIÈME.
ARSIDOR, ALCANDRE, LE ROY IES COVRTISANS.	ARSIDOR, ALCANDRE, LE ROY JES COURTISANS.
ARSIDOR.	ARSIDOR.
E Ciel me ſoit teſmoin, que ma main criminelle L Se noircit malgré ſoy d’vne tache eternelle, Et que ie ſuis contraint de combattre en ce iour, N'eſtant point d’amitié qui ne cede à l’Amour.	E Ciel me soit témoin, que ma main criminelle L Se noircit malgré soi d'une tache éternelle, Et que sans suis contraint de combattre en ce jour, N'étant point d'amitié qui ne cède à l'Amour.
A LCANDRE.	À LCANDRE.
Le Ciel me ſoit teſmoin que cette ſeruitude Eſt l’vnique motif de mon ingratitude, Et que ie ne combats qu’à deſſein de finir, Si vous eſtes vainqueur, gardez ce ſouuenin, An nom de samiite que ie vom ay iurée.	Le Ciel me soit témoin que cette servitude Est l'opique motif de mon ingratitude, Et que ie ne combats qu'à dessein de finir, Si vous êtes vainqueur, gardez ce souvenin, An nom de samiite que je vom ai jurée.
ARSIDOR.	ARSIDOR.
V oyons ce que le ſort ordonne de Neree.	V Voyons ce que le sort ordonne de Nère.
LE ROY.	LE ROY.
C’eſticy que l’adreſſe égalle la valeur;	C'étici que l'adresse égale la valeur;
Mon esprit pour tous deux apprehende vn malheur:	Mon esprit pour tous deux appréhende un malheur:
Helas!	Hélas!
l’vn eſt tombé, ſa trame eſt ia coupee.	l'un est tombé, sa trame est ja coupée.
ARSIDOR.	ARSIDOR.
Leuez vous Caualier, ie vous rends voſtre eſpee, Ie ne veux rien deuoir aux faueurs du haZard.	Levez -vous Cavalier, je vous rends votre espée, Je ne veux rien devoir aux faveurs du hasard.
ALCANDRE, Et ie ne veux vn bien où ie n’ay point de part.	ÀLCANDRE, Et ainsi ne veux un bien où tu n'ai point de part.
Non, non, à la raiſon ie ne ſuis plus rebelle, le demanat la vie, & vom cede la belle:	Non, non, à la raison ie ne suis plus rebelle, le demanat la vie, et vom cède la belle:
C’eſt par trop m’obliger, & ie me fais horreur, V oyant ou m'a porté mon amoureuſe erreur.	C'est par trop m'obliger, et ainsi me fais horreur, V oyant ou m'a porté mon amoureuse erreur.
LE ROY.	LE ROY.
Ha bons Dieux c’eſt Alcandre!	Ha bons Dieux c'est Alcandre!
ALCANDRE.	ÀLCANDRE.
ouy Sire, qui confeſſe Qu'Arſidor ſeulement doit auoir ſa Maiſtreſſe:	oui Sire, qui confesse Qu'Arsidor seulement doit avoir sa Maîtresse:
Qui coniure l’esprit de voſtre Maieſte, De vouloir eſtimer ſa generoſité:	Qui conjure l'esprit de votre Majest, De vouloir estimer sa générosité:
Il m'a ſauué deux fois, & deſormais ſans crime, Ie ne pourrois chocquer ſon deſſein legitime;	Il m'a sauvé deux fois, et désormais sans crime, Je ne pourrais chocquer son dessein légitime;
Car ſçachez que Neree ayme ce Cauâlier, Außi grand de Maiſon, qu'en armes ſingulier.	Car sçachez que Nère aime ce Cauâlier, Aussi grand de Maison, qu'en armes singulier.
DOR.	DOR.
Prince dont la vertu n’a rien qui la ſeconde, Ie ſçay que mon peche me doit oſter du monde, Ie merite vnſuppuiet, & n Jrcende pus;	Prince dont la vertu n'a rien qui la seconde, Je sais que mon pèche me doit ôter du monde, Je mérite unsuppuiet, et n' Encende pus;
Pourueu qu'en pardonnant vous voyez mon trespas.	Pourvu qu'en pardonnant vous voyez mon trépas.
LE ROY.	LE ROY.
Puis qu'vn mauuais principe enfin a bonne iſſuë, Ma colere eſt ia morte, außi toſt que conceuë;	Puis qu'autre mauvais principe enfin a bonne issue, Ma colère est ja morte, aussi tôt que conçue;
e uit ce qui s’eſt paße, ie le veux ignorer, Ou ne m'en ſouuenir que pour vous honnorer.	 évit ce qui s'est passée, ils le veux ignorer, Ou ne m'en souvenir que pour vous honorer.
Mais que veut Alleran, dans ſa courſe legere?	Mais que veut Alleran, dans sa course légère?
CENE SIXIESME.	CÈNE SIXIÈME.
ALLERAN, ALCANDRE, ARSIDOR DE NOY, SES COVRTISANS,	ÀLLERAN, ALCANDRE, ARSIDOR DE NOY, SES COURTISANS,
ALLERAN.	ÀLLERAN.
Rgante eſt reuenu, qui meine vne Eſtrangere.	Rgante est revenu, qui mène une Étrangère.
A IAußibelle que triſte, & pleine de ſoucy;	À IAussibelle que triste, et pleine de souci;
Ie viens de les quitter à quatre pas d’icy.	Je viens de les quitter à quatre pas d'ici.
A LCANDRE.	À LCANDRE.
Pour auoir vn plaiſir, tel que ie l’imagine, Abhaiſſez la viſiere, & teneZ bonne mine.	Pour avoir un plaisir, tel que sans l'imagine, Abhaitsez la visière, et teneZ bonne mine.
SCENE SEPTIESME.	SCÈNE SEPTIÈME.
ARGANTE, ALCANDRE, NEREE, CLARINE, ARSIDOR, ALLERAN, LEROIJIESA SVITE,	ARGANTE, ALCANDRE, NEREE, CLARINE, ARSIDOR, ALLERAN, LEROIESA SVITE,
ARGANTE.	ARGANTE.
IE remets en vos mains ce threſor precieux, d Eu merueille du monde, & l’ouurage des Cieux:	JE remets en vos mains ce trésor précieux, d' Une merveille du monde, et l'ouvrage des Cieux:
Sire, receuez-le, ma charge execuree, Arriue ce me ſemble à la fin ſouhaittee.	Sire, recevez-le, ma charge exécure, Arrive ce me semble à la fin souhaite.
ALCANDRE Ie m'eſtonne de voir, en ſa paſle couleur, Les marques d'vn eſprit où regne la douleur:	ÀLCANDRE Je m'étonne de voir, en sa pâle couleur, Les marques d'un esprit où règne la douleur:
Ie m'eſtonne de voir qu’en pleurs elle ſe noye, Ayant tant de ſuiet de nager dans la ioye:	Je m'étonne de voir qu'en pleurs elle se noie, Ayant tant de sujet de nager dans la joie:
Elle qui doit auoir vn Eſpoux auiourd’huy, Dont le rare merite eſt ſeul ſemblable à luy.	Elle qui doit avoir un Espoux aujourd'hui, Dont le rare mérite est seul semblable à lui.
NEREE.	NERE.
Qu’il ſoit außi parfait que ie le crois infame, Il-eſpouſe vne morte en me prenant pour femme:	Qu'il soit aussi parfait que tu le crois infâme, Il-épouse une morte en me prenant pour femme:
Megere, & mon Hymen, allume ſon flambeau, Grient veuxtounei que dedans ie tombeau.	Megère, et mon Hymen, allume son flambeau, Grient veuxounei que dedans toujours tombeau.
A LCANDRE.	À LCANDRE.
Vn lict eſt bien plus doux que n’eſt la ſepulture:	Un lit est bien plus doux que n'est la sépulture:
La mort eſt effroyable en ſa ſimple peinture, Au lieu que cet Amant, qui vous cherit encor, A le viſage aymable, & reſſemble Arſidor.	La mort est effroyable en sa simple peinture, Au lieu que cet Amant, qui vous chérit encor, A le visage aimable, et ressemble Arsidor.
ENEE.	ENE.
Dieux!	Dieux!
Arſidor eſt mort.	Arsidor est mort.
ALCANDRE.	ÀLCANDRE.
4 ouy, c’eſt choſe certaine:	4 oui, c'est chose certaine:
Il vient de rendre vne ame außi laſche que vaine, Il eſt mort pour l’obiet qui le tenoit charmé, Voyez-vous pas Alcandre, il eſt encore armé.	Il vient de rendre une âme aussi lâche que vaine, Il est mort pour l'objet qui le tenait charmé, Voyez-vous pas Alcandre, il est encore armé.
EREE.	ÈRE.
Ha Tygre!	Ha Tigre!
c’eſt donc toy, dont la main carnaßiere, A du ſang de mon cœur arrose la poußiere?	c'est donc toi, dont la main carnassiere, A du sang de mon cœur arrose la passion?
Ha barbare!	Ha barbare!
c’eſt toy qui parois en ces lieux?	c'est toi qui parais en ces lieux?
Il faut qu’en ma fureur ie t’arrache les yeux.	Il faut qu'en ma fureur armé t'arrache les yeux.
MIDOR.	MIDOR.
Non pas cela, mon Aſtre, ils veulent voir ma Dame.	Non pas cela, mon Astre, ils veulent voir ma Dame.
Mon ſoucy, NEREE.	Mon souci, NERE.
RSIDOR.	RSIDOR.
mon espoir,	mon espoir,
NEREE.	NERE.
mon vray cœur,	mon vrai cœur,
ARSIDOR.	ARSIDOR.
machere ame:	machère âme:
Ent toſtre Maieſté pardonne ce tranſport;	Ent totre Majesté pardonne ce transport;
Mon reſpect eſt bien grand, mais l’amour eſt plus fort.	Mon respect est bien grand, mais l'amour est plus fort.
LE ROY.	LE ROY.
Ie ſçay comme ce Dieu maiſtrije te tourage, Et comme enfin le calme eſt doux apres l'orage.	Je sais comme ce Dieu maîtrije te tourage, Et comme enfin le calme est doux après l'orage.
ALCANDRE.	ÀLCANDRE.
Alcandre, pour le mal qu’il vous a fait ſentir, i on qprejon ſeruice, auec ſon repentir;	Alcandre, pour le mal qu'il vous a fait sentir, y on qprejon service, avec son repentir;
AccepteZ l’vn & l’autre, & ſelon ſon enuie, Dispoſez de ſon vien, aiſpoſez de ſa vie.	AccepteZ l'amour et l'autre, et selon son envie, Disposez de son vien, aisposez de sa vie.
ARSIDOR.	ARSIDOR.
Pour ne vous pas aymer elle a trop de bonté.	Pour ne vous pas aimer elle a trop de bonté.
NEREE.	NERE.
Et trop de complaiſance à voſtre volonté.	Et trop de complaisance à votre volonté.
LE ROY.	LE ROY.
Ie veux vous r’enuoyer dedans voſtre contree.	Je veux vous renvoyer dedans votre contrée.
ARSIDOR.	ARSIDOR.
La colere du Roy nous en defend l’entree.	La colère du Roi nous en défend l'entre.
NEREE.	NERE.
Etlamort d’vn Riual cauſeroit ſon trespas,	Élamort d'un Rival causerait son trépas,
E Y.	E Y.
Ma priere au beſoin ne s’eſpargnera pas Pour vous remettre en grace aupres du Roy mon frere;	Ma prière au besoin ne s'épargnera pas Pour vous remettre en grâce auprès du Roi mon frère;
Rarement mon deſir trouue le ſien contraire:	Rarement mon désir trouve le sien contraire:
Mais s’il me refuſoit, n'en reſtez esbahis;	Mais s'il me refusait, n'en restez ébahis;
Par tout les gens de bien rencontrent leur païs:	Par tout les gens de bien rencontrent leur pays:
Viuez dedans ma Cour, viuez en ma Prouince, Auec le cœur d’Alcandre, & celuy de ſon Prince;	Vivez dedans ma Cour, vivez en ma Province, Ajec le cœur d'Alcandre, et celui de son Prince;
Et ſoyeZ vn exemple à la Poſterité, De trauerſes, d’amour, & de proſperité.	Et soyeZ un exemple à la Postérité, De traverses, d'amour, et de prospérité.
E R L’IMMACVLEE CONCEPTION DE 2 al Vla le d ki	E R L'IMMACVLEE CONCEPTION DE 2 al Vl le le d
& Expoſe au iour vne peinture, Où l’on voit des traits ſi hardis, MNNNN Que tous les pinceaux de iadis Ont moins imité la Nature:	et Expose au jour une peinture, Où l'on voit des traits si hardis, MNN Que tous les pinceaux de jadis Ont moins imité la Nature:
Si le paſle monſtre d’enfer Qui ronge auec ſes dents de fer Pretend y trouuer dequoy mordre, Son eſpoir eſt ſans iugement, Car ie fay meſme regner l’ordre Dans l’horreur d’vn debordement.	Si le pâle montre d'enfer Qui ronge avec ses dents de fer Rettend y trouver dequoy mordre, Son espoir est sans jugement, Caronc fais même régner l'ordre Dans l'horreur d'un débordement.
Lors que le crime & l’inſolence D’vne abominable Cite, Dedans la main de l’equité Eurent fait pancher la balance, Le fleuue qui l’enſeuelit, Courut au ſortir de ſon lit Contre la nouuelle Niniue, Et faiſant crouler ſes ramparts, L’orgueilleux qui n’a plus de riue La rauage de toutes parts.	Lors que le crime et l'insolence D'une abominable Cite, Dedans la main de l'équité Eurent fait pencher la balance, Le fleuve qui l'ensévelit, Courut au sortir de son lit Contre la nouvelle Ninive, Et faisant crouler ses remparts, L'orgueilleux qui n'a plus de rive La ravage de toutes parts.
Il roule, il bondit, il emporte Mille baſtimens renuerſez, Que ſon choc a bouleuerſeZ Des lucarnes iuſqu’à la porte.	Il roule, il bondit, il emporte Mille bâtiments renversez, Que son choc a bouleuerseZ Des lucarnes jusqu'à la porte.
L’ire qui le fait écumer, Monſtre qu’il eſt fils de la mer, Il tient de ſa faueur natale, Et parmy des flots murmurans Ce fleuue impitoyable eſtale Cent triſtes obiets differens.	L'ire qui le fait écumer, Montre qu'il est fils de la mer, Il tient de sa faveur natale, Et parmi des flots murmurants Ce fleuve impitoyable étale Cent tristes objets différents.
Hommes, femmes, cheuaux, carroſſes, Peſle-meſle engloutis de l’eau Font vn effroyable tableau Qu'il efface apres dans ſes boſſes, Et glorieux de ce mechef, Le cruel ſe pare le chef De coffres, de bancs & de tables Qu'il briſe, en augmentant le bruit Dertris aiu QuMemueses De tour vn monde qu’il deſtruit.	Hommes, femmes, chevaux, carrosses, Pêle-mêle engloutis de l'eau Font un effroyable tableau Qu'il efface après dans ses bosses, Et glorieux de ce mechef, Le cruel se pare le chef De coffres, de bancs et de tables Qu'il brise, en augment le bruit Dertris aiu QuMemueses De tour un monde qu'il détruit.
L’vn grimpe deſſus les murailles, L’autre y voulant monter außi, S’attache au pied de cettuy-cy, Pour eſuiter ſes funerailles:	L'un grimpe dessus les murailles, L'autre y voulant monter aussi, S'attache au pied de celui-cy, Pour éviter ses funérailles:
Ils ſont quelque temps ſuspendus Le corps en l’air, les bras tendus, Mais leur eſperance eſt trompee, Car l’eau pour les mettre d’accord Fait que la muraille ſappee Tombe ſur eux auec la mort.	Ils sont quelque temps suspendus Le corps en l'air, les bras tendus, Mais leur espérance est trompe, Car l'eau pour les mettre d'accord Fait que la muraille sapée Tombe sur eux avec la mort.
Lors en vain le peuple s’exclame, Dans la peur dont il eſt touché, Le chemin du Ciel eſt bouché Par les ondes & par la flamme:	Lors en vain le peuple s'exclame, Dans la peur dont il est touché, Le chemin du Ciel est bouché Par les ondes et par la flamme:
Car Dieu leur iuſte puniſſeur, Dont l’incomparable douceur Prefere la paix à la guerre, Voulant auancer leur treſpas, Afin de ne les ouïr pas.	Car Dieu leur juste punisseur, Dont l'incomparable douceur Préfère la paix à la guerre, Voulant avancer leur trépas, Afin de ne les ouïr pas.
Bref on n’apperçoit plus Veronne Que par la pointe des clochers, Dont le fleuue au lieu de rochers, Semble ſe mettre vne couronne:	Bref on n'aperçoit plus Veronne Que par la pointe des clochers, Dont le fleuve au lieu de rochers, Semble se mettre une couronne:
Tel qu’vn Tyran victorieux Il fait en ſon cœur furieux Mille eſtranges metamorphoſes Rien ne ſçauroit le retenir, Et ſon flot traine toutes choſes, Parce qu’il n'y peut reuenir.	Tel qu'un Tyran victorieux Il fait en son cœur furieux Mille étranges métamorphoses Rien ne saurait le retenir, Et son flot traine toutes choses, Parce qu'il n'y peut revenir.
Dans cette miſerable ville La vague n'eſpargne qu’vn lieu Où la chaſte Mere de Dieu D'vne Egliſe ſe fait vne Iſle, Atheſis à ce ſeul aspect Change ſa colere en respect, Il recule de ceſte place, 12 Et le Temple en ce iour fatal de van cemndesmpare de guet, Et fermé de murs de criſtal.	Dans cette misérable ville La vague n'épargne qu'un lieu Où la chaste Mère de Dieu D'une Église se fait une Isle, Athésis à ce seul aspect Change sa colère en respect, Il recule de cette place, 12 Et le Temple en ce jour fatal de van cemndesmpare de guet, Et fermé de murs de cristal.
Vierge, grande Reine des Anges, Cet effect de voſtre pouuoir A ſollicité mon deuoir De s'employer à vos loüanges;	Vierge, grande Reine des Anges, Cet effet de votre pouvoir A sollicité mon devoir De s'employer à vos louanges;
Ie m’en acquitte, & par ces vers Ie veux dire à tout l’vniuers Vne merueille ſans ſeconde, C’eſt qu’vn Temple fut en ce iour Preſerué du peril de l’onde Par vne fontaine d’amour.	Je m'en acquitte, et par ces vers Je veux dire à tout l'univers V merveille sans seconde, C'est qu'un Temple fut en ce jour Preservé du péril de l'onde Par une fontaine d'amour.
H iiij Bien que vous ſoyez ſans exemple, C’eſt pourtant auecques raiſon Que ie fay ma comparaiſon Si vous-meſmes eſtes vn Temple:	H Hijà Bien que vous soyez sans exemple, C'est pourtant avec raison Que ie fais ma comparaison Si vous-mêmes êtes un Temple:
Temple ſacré du Sainct Eſprit, Où logea neuſ mois Ieſus Chriſt, Pour vaincre Sathan plein derage, Temple excellent, Temple eternel, Qui ſeul eſt exempt de l’orage De noſtre enme originel.	Temple sacrè du Sainct Temple, Où logea neus mois Jésus Christ, Pour vaincre Sathan plein derage, Temple excellent, Temple éternel, Qui seul est exempt de l'orage De notre enme originel.
E SVR LE MESME SVIET.	 EUR LE MÊME SVIET.
Sprits de feu, Demons viſibles, E De qui la gloire eſt l’element, Vous qui reſteZ au iugement Comme le Cedre, incor ruptibles:	Sprits de feu, Demons visibles, E De qui la gloire est l'élément, Vous qui reste au jugement Comme le Cette, incor ruptibles:
Prenez pour la feconde fois, Auec l’ouurage de mes dois, Les plus humbles vœux de mon ame:	Prenez pour la féconde fois, Avec l'ouvrage de mes dois, Les plus humbles vœux de mon âme:
Et faites que par vn tableau, Ie triomphe dedans la flamme, Comme i'ay deſia fait dans l’eau.	Et faites que par un tableau, Je triomphe dedans la flamme, Comme j'ai déjà fait dans l'eau.
Si par voſtre equité premiere Mes enuieux ſont eſcartez, Mon ode aura plus de clartez, Que ſon ſuiet n’a de lumiere:	Si par votre équité première Mes envieux sont écartés, Mon ode aura plus de clartés, Que son sujet n'a de lumière:
Et ie me promets aisément 4 De ſauuer de l’embraſement Mon nom, ma peinture & ma gloire.	Et personne me promets aisément 4 De sauver de l'embrasement Mon nom, ma peinture et ma gloire.
Si vos yeux ſe daignent ouurir, Sur les peaux ueſſeins a 'vne Hiſtoire, Que ie m'en vay vous deſcouurir.	Si vos yeux se daignent ouvrir, Sur les peaux ouvesseins à 'une Histoire, Que ie m'en vais vous découvrir.
Ma main va tirer la courtine;	Ma main va tirer la courtine;
En ce lieu Rhodes ſe fait voir Tant orgueilleuſe en ſon pouuoir, Que celuy du Ciel s’en mutine:	En ce lieu Rhodes se fait voir Tant orgueilleuse en son pouvoir, Que celui du Ciel s'en mutine:
VoyeZ vn gros de tourbillons, Que comme autant de bataillons, Semblent s’aduancer vers la terre, Où deſia l'eſclair eſt lancé, Qui vient de la part du tonnerre Menacer vn peuple inſensé.	VoyeZ un gros de tourbillons, Que comme autant de bataillons, Semblent s'avancer vers la terre, Où déjà l'éclair est lancé, Qui vient de la part du tonnerre Menacer un peuple insensé.
Icy mon pinceau continuë;	Ici mon pinceau continue;
Remarquez le iour qui s'enfuit, Et comme la flamme & le bruit, Ont creué le flanc de la nuë:	Remarquez le jour qui s'enfuit, Et comme la flamme et le bruit, Ont creué le flanc de la nue:
Le ſouphre, la mort, & la peur, Accompagnent cette vapeur, Qui briſe, rompt, & met en poudre:	Le souphre, la mort, et la peur, Accompagnent cette vapeur, Qui brise, rompt, et met en poudre:
Et ſi voſtre œil s’abbaiſſe vn peu, Il verra les pointes du foudre Tomber en trois ſerpents de feu.	Et si votre œil s'abaisse un peu, Il verra les pointes du foudre Tomber en trois serpents de feu.
Iamais vne ſi belle proye, N'eut cet Element (que ie croy) Depuis la nuict pleine d’effroy.	Jamais une si belle proie, N'eût cet Élément (que tu crois) Depuis la nuit pleine d'effroi.
Qui fut la derniere de Troye:	Qui fut la dernière de Troie:
Il court de quartiers en quartiers, Il mange des Palais entiers, Il deracine tous les arbres;	Il court de quartiers en quartiers, Il mange des Palais entiers, Il deracine tous les arbres;
Et par tout ſe rendant fatal, Il calcine iuſques aux marbres, Et fait des fleuues de metal,	Et par tout se rendant fatal, Il calcine jusques aux marbres, Et fait des fleuves de métal,
Voſtre œil ſera-t’il bien capable, D’approcher de ce beau Rampart, Qu'il a miné de part en part, Sans redouter qu'il vous accable?	Votre œil sera-t-il bien capable, D'approcher de ce beau Rempart, Qu'il a miné de part en part, Sans redouter qu'il vous accable?
VoyeZ comme il eſt tout panché, Et que cét Elementcaché, S’exhale en vn corps de fumee, A deſſein de faire mourir R1A Mny fun (s Qu'on ne peut aller ſecourir.	VoyeZ comme il est tout penché, Et que cet Elementcaché, S'exhale en un corps de fumée, A dessein de faire mourir R1A Ni fun (s Qu'on ne peut aller secourir.
Eſloignez-vous de ma peinture, I’en veux retirer les rideaux;	Éloignez-vous de ma peinture, J'en veux retirer les rideaux;
Vos yeux n’auroiẽt point aſſez d'eaux, Pour vn feu de cette nature:	Vos yeux n'auraient point assez d'eaux, Pour feu de cette nature:
Corps, teſtes, bras, iambes, & mains, Sont les obiets les plus humains:	Corps, têtes, bras, jambes, et mains, Sont les objets les plus humains:
Et l'on y voit dedam tapreyerDe tous ces memhres fraquaſſez, D’vn Amant, & d'vne Maiſtreſſe, Les deux Squelettes embraſſez.	Et l'on y voit dédam tapreyerDe tous ces mémhres fraquassez, D'un Amant, et d'une Maîtresse, Les deux Squelettes embrassez.
Bref, tout cede parmy la ville A l’inſolence du vainqueur, Qui porte encore fa rancœur Aux deux extremitez de l’Iſle:	Bref, tout cède parmi la ville A l'insolence du vainqueur, Qui porte encore fa rancœur Aux deux extrémités de l'Île:
Et là, plein d’ire & de courroux, Il s’attaque a tous les cailloux, N’oſant ſur la mer entreprendres De ſa froideur vient ſon ſalut;	Et là, plein d'ire et de courroux, Il s'attaque a tous les cailloux, N'osant sur la mer entreprendrez De sa froideur vient son salut;
Et Rnroces meſe paun que ad cendre De ce que iadis elle fut.	Et Rnroces me paun que ad cendre De ce que jadis elle fut.
Mais (ô merueille ſans exemple) Au milieu de tant de douleurs, Vn peu de toile & de couleurs, Sont plus durables que le Temple:	Mais (ô merveille sans exemple) Au milieu de tant de douleurs, Un peu de toile et de couleurs, Sont plus durables que le Temple:
Vn Alcide repreſenté, Garde ſon tiltre d’indompté, A l'inſtant que moins on l’eſpere:	Un Alcide représenté, Garde son titre d'indompté, A l'instant que moins on l'espère:
Et dans le braſier triomphant On voit que le foudre du Pere, Sauue le portraict de l’enfant.	Et dans le brasier triomphant On voit que le foudre du Père, Sauve le portrait de l'enfant.
