ARGVMENT.	ARGUMENT.
O 7 MMAA IOMEDE, Berger le plus conſiderable de la contree d’Arcadie, degouſté de ſa condition champeſtre, inquiet du repos du village, & touché d’vn deſir ambitieux de rendre à la poſterité ſa memoire glorieuſe, commande à ſon fils Thyrſis, de quitter le ſoc & la houlette, pour prendre l’eſpee & le bouclier, afin que par ſes actions heroïques, ſon nom s’eterniſaſt dans la memoire des hommes.	Ô 7 MA IOMEDE, Berger le plus considérable de la contrée d'Arcadie, dégoûté de sa condition champêtre, inquiet du repos du village, et touché d'un désir ambitieux de rendre à la postérité sa mémoire glorieuse, commande à son fils Tirs, de quitter le soc et le houlette, pour prendre l'épée et le bouclier, afin que par ses actions héroïques, son nom s'éternisât dans la mémoire des hommes.
Ce que le Magicien Philandre cognoiſſant par les ſecrets de ſon Art, aymant cherement & de longue main la famille de Diomede, il reſolut d’en arreſter & diſſiper le deſſein;	Ce que le Magicien Philandre connaissant par les secrets de son Art, aimant chèrement et de longue main la famille de Diomede, il résolut d'en arrêter et dissiper le dessein;
faiſant ſortir de deux rochers deux fontaines , dont l’eau de l'vne faiſoit perdre le ſens, celle de l’autre le faiſoit reuenir.	faisant sortir de deux rochers deux fontaines , dont l'eau de l'une faisait perdre le sens, celle de l'autre le faisait revenir.
Mais Thyrſisobeyſſant au commandement de ſon pere, ſon amour pour Syluie n’y peut conſentir, dont ceſte Bergere eſtant aduertie, continua en ſa reſolution, luy donnant aſſeurance d’eſtre compagne de ſa fortune comme de ſa perſonne.	Mais Thyrsisobéissant au commandement de son père, son amour pour Syluie n'y peut consentir, dont cette Bergère étant avertie, continua en sa résolution, lui donnant assurance d'être compagne de sa fortune comme de sa personne.
Et afin que ſon hõneur fuſt à couuert, & ſon amour en ſeureté;	Et afin que son honneur fût à couvert, et son amour en sûreté;
elle l’oblige par ſerment, de luy promettre, qu’il viura auec elle comme auec ſa ſœur.	elle l'oblige par serment, de Seigneur promettre, qu'il vivra avec elle comme avec sa sœur.
Et que la modeſtie reglera ſes deſirs, iuſques à ce qu’vn legitime mariage les accompliſſe, ce qu’à genoux Thyrſis luy accordant, le Satyre Alacrin les ſurprend en ceſte poſture, & les arreſte tous deux:	Et que la modestie réglera ses désirs, jusqu' à ce qu'un légitime mariage les accomplisse, ce qu'à genoux Tirsis était accordant, le Satire Alacrin les surprend en cette posture, et les arrête tous deux:
mais Syluie s’en eſtant deſgagee, Thyrſis y reſta ſeul, lequel ſous de feintes promeſſes, ayant arreſté la fureur de ce bouquin, irritee -– par la fuite de la Bergere, luy fait croire que reueſtu de ſes armes il pourroit reuoir Syluie, & reparer la perte qu’il auoit faite.	mais Syluie s'en étant dégagee, Thyrs y resta seul, lequel sous de feintes promesses, ayant arrêté la fureur de ce bouquin, irritée par la fuite de la Bergere, lui fait croire que reuestu de ses armes il pourroit reuoir Syluie, et réparer la perte il auoit faite.
Dans ceſte eſperance il ameine Thyrſis dans ſa cauerne, d’où, apres l’auoir bien traitté, il ſort reueſtu des armes de ce nouueau guerrier, à deſſein de ſurprendre Syluie:	Dans cette espérance il âme Thyrsis dans sa caverne, d'où, après l'avoir bien traité, il sort revêtu des armes de ce nouveau guerrier, à dessein de surprendre Syluie:
mais le deſir de contempler ſa bonne mine, le portant à ietter la veuë dans la fontaine qui bleſſoit la raiſon, ce regard luy cauſa le ſommeil:	mais le désir de contempler sa bonne mine, le portant à jeter la vue dans la fontaine qui blessait la raison, ce regard lui causa le sommeil:
Et Thyrſis le trouuant endormy, reprint ſes armes, & auec la maſſuë de ce bouquin l’eſueilla ſi rudemẽt, qu’il l’obligea à la fuite, & d’aller continuer ſon ſommeil ailleurs.	Et Thyrsis le trouvant endormi, reprint ses armes, et avec la massue de ce bouquin l'éveilla si rudement, qu'il l'obligea à la fuite, et d'aller continuer son sommeil ailleurs.
Thyrſis ayant recouuré ſes armes, auec ſa liberté, mais non pas ſa Bergere, ſe diſpoſa d’aller à la guerre & d’expoſer ſa vie aux plus dangereux combats:	Thyrs ayant recouvré ses armes, avec sa liberté, mais non pas sa Bergère, se disposa d'aller à la guerre et d'exposer sa vie aux plus dangereux combats:
ſe voyant ſeparé de ſa chere Syluie;	se voyant séparé de sa chère Syluie;
& dans l’excez de ſes regrets, l’ardeur en eſt ſi extréme, qu’e-------- -- -- - ––.	et dans l'excès de ses regrets, l'ardeur en est si extrême, qu'est-elle -même- -- - là
ſtant preſſé de la ſoif pour en eſteindre la violence, il beut, mais dans la fontaine, qui mettant en deſordre ſa raiſon, luy fit oublier le deſſein de la guerre;	stant pressé de la soif pour en éteindre la violence, il but, mais dans la fontaine, qui mettant en désordre sa raison, lui fit oublier le dessein de la guerre;
& changer ſes reſolutions en extrauagances & en folies, qui l’ayant fait longuement roder à l’entour de ces fontaines enchantees;	et changer ses résolutions en extravagances et en folies, qui l'ayant fait longuement roder à l'entour de ces fontaines enchantées;
enfin, laſſé du trauail de ſes courſes, & abbatu par ſes violences, il s’aſſied heureuſement aupres de la fontaine qui donnoit la raiſon, où beuuant il y recouure ce qu’il auoit perdu dans l’autre.	enfin, lassé du travail de ses courses, et abattu par ses violences, il s'assied heureusement auprès de la fontaine qui donnait la raison, où buant il y recouvre ce qu'il avait perdu dans l'autre.
Et conſiderant ſon aduanture auec eſtonnement, le Magicien Philandre le trouuant en ceſte peine mit en repos ſon eſprit comme il auoit fait ſa raiſon, l’ayant informé de tout, & redonné ſes armes qu’il auoit iettees pendant ſa folie.	Et considérant son aventure avec étonnement, le Magicien Philandre le trouvant en cette peine mit en repos son esprit comme il avait fait sa raison, l'ayant informé de tout, et redonné ses armes qu'il avait jettees pendant sa folie.
Ces Aduantures ſont meſlees de l’inconſtance du Berger Amyntor pour la Bergere Doris, & de l’indifference de Daphnis pour la belle Daphnide.	Ces Aduantures sont mêlées de l'inconstance du Berger Amintor pour la Bergère Doris, et de l'indifférence de Daphnis pour la belle Daphnide.
Le premier aymé cherement de Doris, ne vouloit aymer que Syluie (apres auoir teſmoigné ſa legereté & ſon inconſtance à beaucoup d’autres Bergeres ) laquelle dans l’abſence de ſon Berger Thyrſis, s’eſtoit reſoluë à receuoir pluſtoſt la mort que cét inconſtant Berger pour amant;	Le premier aimé chèrement de Doris, ne voulait aimer que Syluie (après avoir témoigné sa légèreté et son inconstance à beaucoup d'autres Bergères ) laquelle dans l'absence de son Berger Thyrsis, s'était résolue à recevoir plutôt la mort que cet inconstant Berger pour amant;
& ny les perſuaſions, ny les menaces d’Anthonin ſon oncle ne peurent changer ſa reſolution, ny eſbranſler la fermeté de l’amour qu’elle auoit promiſe à Thyrſis.	et ni les persuasions, ni les menaces d'Anthonin son oncle ne peurent changer sa résolution, ni ébranler la fermeté de l'amour qu'elle avait promise à Tirsis.
Et Doris voulant faire voir par vn iuſte reſſentiment ce que peut le meſpris auec la ialouſie ſur l’eſprit d’vne femme, feignit vn iour d’eſtre bleſſee par le deſeſpoir de ſon inconſtance, & ſuppliant Amyntor de ſe baiſſer pour luy donner ceſte conſolation auant que de mourir, laiſſant ſa vie ſur ſa bouche, elle luy donna vn coup de poignard dans le ſein.	Et Doris voulant faire voir par un juste ressentiment ce que peut le mépris avec la jalousie sur l'esprit d'une femme, feignit un jour d'être blessée par le désespoir de son inconstance, et suppliant Amyntor de se baisser pour lui donner cette consolation avant que de mourir, laissant sa vie sur sa bouche, elle lui donna coup de poignard un le sein.
A ce bruit le Magicien Philandre eſtant accouru, fit em----- ----- –.	À ce bruit le Magicien Philandre étant accouru, fit em- -à--là.
22 porter dans ſa grotte Amyntor, où il le guerit & de la bleſſeure de ſon corps que Doris luy auoit faite, & de celle de l’eſprit dont Syluie eſtoit cauſe.	22 porter dans sa grotte Amintor, où il le guérit et de la blessure de son corps que Doris lui avait faite, et de celle de l'esprit dont Syluie était cause.
L’autre Berger changea ſon indifference en amour pour la belle Daphnide:	L'autre Berger changea son indifférence en amour pour la belle Daphnide:
mais Thyrſis ne pouuant flechir Anthonin oncle de Syluie à conſentir à leur mariage, ny par les prieres de Diomede ſon pere, ny par celles d’Amyntor ſon amy, & autresfois ſon riual;	mais Thyrsis ne pouvant fléchir Anthonin oncle de Syluie à consentir à leur mariage, ni par les prières de Diomède son père, ni par celles d'Amintor son ami, et autrefois son rival;
Philandre Magicien fut appellé pour regler leurs diſputes & terminer leurs differents:	Philandre Magicien fut appelé pour régler leurs disputes et terminer leurs différents:
& comme il auoit eſté l’autheur de leurs deſordres, il fut auſſi celuy de leur repos, en ordonnant que Thyrſis auroit Syluie, Amyntor Doris, & Daphnide Daphnis.	et comme il avait été l'auteur de leurs désordres, il fut aussi celui de leur repos, en ordonnant que Thyrs aurait Syluie, Amintor Doris, et Daphnide Daphumis.
Et ces Bergers obeyſſans auec plaiſir à la volonté ce Philandre , ſe retirerent auec ioye & contentement en leurs hameaux pour y cueillir le fruict de leurs amours, & la recompenſe de leurs trauaux.	Et ces Bergers obéissants était plaisir à la volonté ce Philandre , se retirent avec joie et contentement en leurs hameaux pour y cueillir le fruit de leurs amours, et la récompense de leurs travaux.
	
Ay 2--	Ai 2-
AV LECTEVR, OAIDV Ie	AU LECTEUR, AIDU Je
MI Lecteur, le bon-heur que i'ay eu à recouurer ces aduantures, m’a fait naiſtre le deſir de leur faire voir le jour, & celuy de te donner le plaiſir de les lire, ſi tu n'es du nombre de ceux qui n’agréent que leurs ouurages, & n’approuuent que ce qu’ils font.	MI Lecteur, le bonheur que j'ai eu à recouvrer ces aventures, m'a fait naître le désir de leur faire voir le jour, et celui de te donner le plaisir de les lire, si tu n'es du nombre de ceux qui n'agréent que leurs ouvrages, et n'approuvrent que ce qu'ils font.
Si elles paroiſſent ſous le nom de l’Incogneu, c'eſt pour n’auoir peu ſçauoir celuy de leur Autheur, ce qui t'obligera, comme je t’en prie, d’excuſer les fautes que tu y trouueras, puis qu’il n’a peu voir ce qu'à ſon deſceu je te donne, Adieu.	Si elles paraissent sous le nom de l'Inconnu, c'est pour n'avoir pu voir ce de son Auteur, ce qui t'obligera, comme je t'en prie, t'excuser les fautes que tu y trouveras, puis qu'il n'a pu voir ce qu'à son déçu je te donne, Adieu.
LES ADVANTVRES DE THYRSIS, Tragr-Comeuie Tartorale.	LES ADVANTURES DE -THYRSIS, Tragr-Comeuie Tartorale.
Ale Lu l leulrraRao.	Ale Lu l eulraRao.
SCENE PREMIERE.	SCÈNE PREMIÈRE.
PHILANDRE.	PHILANDRE.
ANDIS que le ſommeil tient tout dans le ſilence, Dans ces ſombres foreſts à par lents ie m’aduance, Non, pour venir troubler la demeure des morts, Faire paſlir la Lune, en magiques efforts;	ANDIS que le sommeil tient tout dans le silence, Dans ces sombres forêts à par lentsrit m'avance, Non, pour venir troubler la demeure des morts, Faire pâlir la Lune, en magiques efforts;
Mon innocente humeur hait ces noires penſées, Où ſe laiſſent aller les ames inſenſees.	Mon innocente humeur hait ces noires pensées, Où se laissent aller les âmes insensées.
Ie cognois tous les temps, mon ſçauoir ſans pareil, Sçait, combien doit durer la ciarté du Soleil, Quand l’eſprit des mortels acquiert cét aduantage, De ſçauoir l’aduenir, d’vn aſſeuré preſage, Les Cieux dont les ſecrets luy ſont tous découuerts Tiennent à ces deſſeins tant de chemins ouuerts, Qu'vſant de ſon bon ſens, & de ſon induſtrie Il eſt l’appuy des ſiens, l’honneur de ſa patrie.	Je connais tous les temps, mon savoir sans pareil, Sçait, combien doit durer la ciarté du Soleil, Quand l'esprit des mortels acquiert cet avantage, De savoir l'avenir, d'un assuré presage, Les Cieux dont les secrets lui ont tous découverts Tiennent à ces desseins tant de chemins ouverts, Qu'usitant de son bon sens, et de son industrie Il est l'appui des siens, l'honneur de sa patrie.
L’interprete des Dieux, qui d’vn parler fatal Aduertit les mortels, & du bien, & du mal:	L'interprète des Dieux, qui d'un parler fatal Aduertit les mortels, et du bien, et du mal:
Moy de ieuneſſe inſtruit en ces ſainctes eſcoles, Les effects me ſont moins, qu’aux autres les paroles, Separé des Bergers, dans ces arides monts Ma puiſſance commande à celle des Demons.	Moi de jeunesse instruit en ces saintes écoles, Les effets me sont moins, qu'aux autres les paroles, Séparé des Bergers, dans ces arides monts Ma puissance commande à celle des Demons.
Non pour faire greſler les preſens de la terre, Eſtouffer les enſans, dans les bras de la mere;	Non pour faire grêler les présents de la terre, Étouffer les ensants, dans les bras de la mère;
Compoſer des poiſons, & nourrir des crapaux, D’vn eſprit infernal ne ſe plaire qu’aux maux, Aux troupeaux des Bergers donner la maladie, D’vn concert des Demons aymer la melodie;	Composer des poisons, et nourrir des crapaux, D'un esprit infernal ne se plaire qu'aux maux, Aux troupeaux des Bergers donner la maladie, D'un concert des Demons aimer la mélodie;
Mais bien pour conſeruer dans nos fertiles champs, L’eſpoir des Laboureurs deſſus le ſoc penchans, Faire, que leur trauail bien-heureux les guerdonne D’vne moiſſon d’eſpics, que la terre leur donne, Que les greniers remplis esbranlent le plancher, Que les empoiſonneurs ne les puiſſent toucher, Que leurs ieunes agneaux, ne craignent la roſée, Qu'ils trouuent à leurs vœux la terre diſpoſée;	Mais bien pour conserver dans nos fertiles champs, L'espoir des Laboureurs dessus le soc enchants, Faire, que leur travail bienheureux les guerdonne D'une moisson d'épics, que la terre leur donne, Que les greniers remplis ébranlent le plancher, Que les empoisonneurs ne les puissent toucher, Que leurs jeunes agneaux, ne craignent la rosée, Qu'ils trouvent à leurs vœux la terre disposée;
C’eſt à quoy mon eſprit occupe ſon ſçauoir.	C'est à quoi mon esprit occupe son Savoir.
Or;	Or;
comme ſçachant tout, & pouuant tout preuoir;	comme sachant tout, et pouvant tout prévoir;
Ie ſçay, que des Bergers, le premier du village, Qui comme le plus vieil, deuroit eſtre plus ſage Laſſe de l’innocence, & du repos des bois, Deſtine ſon enfant à la ſuitte des Roys.	Je sais, que des Bergers, le premier du village, Qui comme le plus vieil, devrait être plus sage Lasse de l'innocence, et du repos des bois, Destine son enfant à la suite des Rois.
Moy, qui veux empeſcher que ſon deſſein ſuccede, Ie me ſuis aduisé d’vn excellent remede Qui paroiſſant d’abord, eſtrange, & furieux Son effect à ma gloire en reüſſira mieux.	Moi, qui veux empêcher que son dessein succède, Je me suis avisé d'un excellent remède Qui paraissant d'abord, étrange, et furieux Son effet à ma gloire en réussira mieux.
Ie veux faire ſortir de ces roches prochaines Pour ſuiure mon deſſein, deux liquides fontaines De ma verge ſans plus, ne faiſant que toucher, Vn flot d’eau coulera du ſein de ce rocher.	Je veux faire sortir de ces roches prochaines Pour suivre mon dessein, deux liquides fontaines De ma verge sans plus, ne faisant que toucher, Un flot d'eau coulera du sein de ce rocher.
C’eſt celuy, qui rauit de la raiſon l’vſage, Peruertit le bon ſens, le conuertit en rage, A ce prochain rocher il faut faire vn effort, Pour leur monſtrer comment ie diſpoſe du ſort.	C'est celui, qui ravit de la raison l'usage, Pervertit le bon sens, le convertit en rage, À ce prochain rocher il faut faire un effort, Pour leur montrer comment ainsi dispose du sort.
Ne ſens-tu pas ma verge?	Ne sens-tu pas ma verge?
ouure donc tes entrailles?	ouvre donc tes entrailles?
Et malgré tes durtez, eſclatte tes murailles?	Et malgré tes durtés, éclatte tes murailles?
Ce breuuage eſt plus doux, & n’a point de poiſon, Il donne le bon ſens, & refait la raiſon, Ces ruiſſeaux deſormais, en leurs effects contraires Cauſeront aux Bergers des biens tres-neceſſaires.	Ce breuage est plus doux, et n'a point de poison, Il donne le bon sens, et refait la raison, Ces ruisseaux désormais, en leurs effets contraires Causeront aux Bergers des biens très-nécessaires.
SCENE II.	SCÈNE II.
THYRSIS.	THYRSIS.
TTLLE aiſnée du iour, incomparable Aurore, TRedonne les couleurs aux campagnes de Flore, Reſuſcite le monde, & vien d'vn doux accueil, Deſpoüiller l’Vniuers de ſon habit de dueil.	TTLLE aînée du jour, incomparable Aurore, TRédonne les couleurs aux campagnes de Flore, Résuscite le monde, et vien d'une doux accueil, Despouiller l'Univers de son habit de deuil.
Le Chaſſeur ja debout, en maniant ſes toilles, Regarde auec deſpit, le Ciel ſemé d’eſtoilles, Le Meſſager preſſé t’aduertit humblement, Que la nuict a duré deſia trop longuement.	Le Chasseur ja debout, en maniant ses toilles, Regarde avec dépit, le Ciel semé d'étoilles, Le Messager pressé t'avertit humblement, Que la nuit a duré déjà trop longuement.
Moy, dont l’eſprit ſouſpire vne iniuſte contrainte, Le cœur bruſlant d’amour, & tout gelé de crainte, Ie te prie Deeſſe!	Moi, dont l'esprit soupire une injuste contrainte, Le cœur brûlant d'amour, et tout gelé de crainte, Je te prie Déesse!
ameine la clarté Qui formant les objets ſait viure la beauté.	âme la clarté Qui formant les objets sait vivre la beauté.
Le ſilence, & la nuict, dedans ma reſuerie, Font, d’vn excez d’amour, vn tranſport defurie;	Le silence, et la nuit, dedans ma rêverie, Font, d'un excès d'amour, un transport défurie;
Ie ſens de tous coſtez mon cœur percé des dards, L’objet de mes ennuis me ſuit en toutes parts;	Je sens de tous côtés mon cœur percé des dards, L'objet de mes ennuis me suit en toutes parts;
Ceſte rare beauté, qui tient ma fantaiſie, M'apparoiſt, non d’amour, mais de honte ſaiſie Comme vne criminelle accablée des fers, Si bien que ceſte nuict ie ſuis dans les enfers;	Cette rare beauté, qui tient ma fantaisie, M'apparaît, non d'amour, mais de honte saisie Comme une criminelle accablée des fers, Si bien que cette nuit ie suis dans les enfers;
Les moindres de mes maux ſont pires que des peſtes, Mon eſprit ne voit plus que viſions funeſtes, Que fantoſmes volans, que corps courans ſans brait, Paſles obets formez des ombres de la nuit.	Les moindres de mes maux sont pires que des pestes, Mon esprit ne voit plus que visions funestes, Que fantômes volants, que corps courants sans brait, Pâles objets formés des ombres de la nuit.
Deeſſe!	Déesse!
ſi ton ame eſt eſmeuë à mes plaintes, En diſſipant la nuit tu finiras mes craintes, Mais non, ne me croy pas, trop toſt viendra le iour, Puis qu’il me faut quitter l’objet de mon amour.	si ton âme est émue à mes plaintes, En dissipant la nuit tu finiras mes craintes, Mais non, ne me crois pas, trop tôt viendra le jour, Puis qu'il me faut quitter l'objet de mon amour.
Le deſſein, que mon pere a fait pour mon martire, Me fait craindre, l’octroy du bien que ie deſire;	Le dessein, que mon père a fait pour mon martyre, Me fait craindre, l'octroi du bien que ie desire;
Il veut, que delaiſſant les brebis & les bois, Ie me tranſporte au camp, du grand Roy des Gaulois.	Il veut, que délaissant les brebis et les bois, Je me transporte au camp, du grand Roi des Gaulois.
Ce changement d’eſtat importune ma vie:	Ce changement d'état importune ma vie:
Car ie ne verray plus les beaux yeux de Syluie;	Car Ne ne verrai plus les beaux yeux de Sylvie;
Chers ſoleils de mon cœur!	Chers soleils de mon cœur!
roys de ma liberté!	rois de ma liberté!
Ie ne verray donc plus voſtre douce clarté!	Je ne verrai donc plus votre douce clarté!
Ie ne vous verray plus!	Je ne vous verrai plus!
lumineuſes planettes Qui conſumez mon cœur en des flames ſi nettes.	lumineuses planètes Qui consumés mon cœur en des flammes si nettes.
Helas!	Hélas!
que les deſtins ont des ſeueres loys, Pour les ſimples Paſteurs, cõme pour les grands Roys!	que les destins ont des sévères lois, Pour les simples Pasteurs, comme pour les grands Rois!
Loing de ces vanitez;	Loing de ces vanités;
le repos du village Borne tous mes plaiſirs dans ce ſacré bocage, Sans regret du paſſé, ny ſoing de l’aduenir, Ie me plais au ſeul bien, que ie puis retenir, I’adore nos coſtaux, i’idolatre nos plaines, Et n’ayme que le bruit du courant des fontaines.	le repos du village Borne tous mes plaisirs dans ce sacré bocage, Sans regret du passé, ni soin de l'avenir, Je me plais ce seul bien, que sans puis retenir, J'adore nos costaux, j'idolatre nos plaines, Et n'aime que le bruit du courant des fontaines.
Les oyſelets des champs en leurs mignardes voix Excellent à mon gouſt la muſique des Roys:	Les oiselets des champs en leurs mignardes voix Excellent à mon goût la musique des Rois:
Les fleurs dont le Printemps enrichit nos prairies, Me plaiſent beaucoup plus, que leurs tapiſſeries.	Les fleurs dont le Printemps enrichit nos prairies, Me plaisent beaucoup plus, que leurs tapisseries.
Ces grãds iardins qu’ils font pour diuertir leurs yeux Imitent de bien loing les beautez de ces lieux,	Ces grands jardins qu'ils font pour divertir leurs yeux Imitent de bien loin les beautés de ces lieux,
Vne grotte qu'a fait la main de la nature, Paſſe tous les efforts de leur architecture, Et tout cela que l’art peutinuenter de beau, Eſt de repreſenter nos champs dans vn tableau;	Une grotte qu'a fait la main de la nature, Passe tous les efforts de leur architecture, Et tout cela que l'art peutinventer de beau, Est de représenter nos champs dans un tableau;
Leurs cabinets ſont peints des prez & des montagnes, Ils n’ont que les portraits de nos larges campagnes.	Leurs cabinets sont peints des prés et des montagnes, Ils n'ont que les portraits de nos larges campagnes.
Et nous qui iouyſſons de leur fertilité, En poſſedons le fruict auecques la beauté;	Et nous qui jouissons de leur fertilité, En possédons le fruit toujours la beauté;
Pourquoy dõc recercher plus d’heur, ou plus de gloire?	Pourquoi dont recercher plus d'heur, ou plus de gloire?
Sans doute, pour laiſſer nos noms dedans l’hiſtoire, Ridicules penſers, monſtres de vanité, Mortels, mal aſſeurez d'un moment de ſanté, De qui le lendemain n'eſt pas en la puiſſance D’vn orgueil effronté, qui tient de l’inſolence, Roulans des grands deſſeins en nos eſprits reclus, Nous cerchõs de l’honneur quand nous ne sõmes plus.	Sans doute, pour laisser nos noms dedans l'histoire, Ridicules pensers, monstres de vanité, Mortels, mal assurés d'un moment de santé, De qui le lendemain n'est pas en la puissance D'un orgueil effronté, qui tient de l'insolence, Roulants des grands desseins en nos esprits reclus, Nous cerchons de l'honneur quand nous ne sommes plus.
Enfant, quand ie voyois dedans le cimetiere Pluſieurs tombeaux formez d'vne riche matiere, Ie croyois que les corps de ces marbres couuerts, Comme ceux du commun n’eſtoient mangez des vers.	Enfant, quand je voyais dedans le cimetière Plusieurs tombeaux formés d'une riche matière, Je croyais que les corps de ces marbres couverts, Comme ceux du commun n'étaient mangés des vers.
Mais mon pere en ces mots, détrompa mon enfance, Me diſant, c’eſt du Ciel la fatale ordonnance, Que tout cela qui vit, eſclairé du Soleil, Se doit reduire en poudre auec vn ſort pareil, Les brebis & les Roys, dedans la ſepulture Aux vers eſgalement ſeruent de nourriture.	Mais mon père en ces mots, détrompa mon enfance, Me disant, c'est du Ciel la fatale ordonnance, Que tout cela qui vit, éclairé du Soleil, Se doit réduire en poudre avec un sort pareil, Les brebis et les Rois, dedans la sépulture Aux vers également servent de nourriture.
Quand nous ſommes venus à ce grand rendez-vous, La terre ne met plus de difference en nous:	Quand nous sommes venus à ce grand rendez-vous, La terre ne met plus de différence en nous:
Par ce ſage diſcours il m’apprit à cognoiſtre Que ce n’eſt, qu’vn eſclat tout ce qu’on voit paroiſtre, Qu'vn faux luſtre d’honneur, esbloüiſſant nos ſens:	Par ce sage discours il m'apprit à connaître Que ce n'est, qu'un éclat tout ce qu'on voit paraître, Qu'un faux lustre d'honneur, éblouissant nos sens:
Mais que le vray repos de ces lieux innocens Approche de bien pres, de l’heur qu’on deuroit ſuiure, Où nos premiers parens, commencerent de viure.	Mais que le vrai repos de ces lieux innocents Approche de bien près, de l'heur qu'on devrait suivre, Où nos premiers parents, commencèrent de vivre.
