Lors que ie veux qu’il viue, & qu’il veut le trépas;	Lors que tu veux qu'il vive, et qu'il veut le trépas;
Lors que ie veux qu’il m’aime, & qu’il ne le veut pas;	Lors que tu veux qu'il m'aime, et qu'il ne le veut pas;
ii	ji
Que c’eſt luy qui refuſe, & que c'eſt moy qui prie;	Que c'est rien qui refuse, et que c'est moi qui prie;
Que ie demande vn cœur, & qu’il me le dénie.	Que était demande un cœur, et qu'il me le dénie.
Eſt-ce-là ce triomphe, eſt-ce là ce bonheur?	Est-ce-là ce triomphe, est-ce là ce bonheur?
Viuez & partageons enſemble tout l’honneur:	Vivez et partageons ensemble tout l'honneur:
Amy, vous le pouuez ſans perdre voſtre gloire, Et daignez ſeulement teſmoigner ma victoire En allant preſenter voſtre Eſpée à des pieds, Ou ſouuent vos deſirs ſe ſont humilieZ Entrez deſſus mon Char, & ſalüez la Reine, Ce n’eſt pas vn affront, ce n'eſt pas vne peine;	Ami, vous le pouvez sans perdre votre gloire, Et daignez seulement témoigner ma victoire En allant présenter votre Espée à des pieds, Ou souvent vos désirs se sont humiliés Entrez dessus mon Char, et saluer la Reine, Ce n'est pas un affront, ce n'est pas une peine;
Allez, ſi vous m'aimez, vous offrir à ſes yeux, C’est eſtre plus heureux que le Victorieux, Et ie n'estime pas que la gloire en ſoit moindre;	Allez, si vous m'aimez, vous offrir à ses yeux, C'est être plus heureux que le Victorieux, Et un n'estime pas que la gloire en soit moindre;
Allez donc, luy dit il, ie vais vous y reioindre.	Allez donc, Seigneur dit -il, Seigneur vais vous y rejoindre.
Traſonte ne veut point accepter cette loy, Pluſtoſt que viure en laſche, il veut mourir en Roys Mais enfin l’amitié plus forte que la rage.	Trasonte ne veut point accepter cette loi, Plustôt que vivre en lâche, il veut mourir en Rois Mais enfin l'amitié plus forte que la rage.
Meſle vn peu de tendreſſe à ſon trop de courage, Par ſes ſoumiſſions que n'obtient vn Vainqueur?	Mêle un peu de tendresse à son trop de courage, Par ses soumissions que n'obtient un Vainqueur?
Il le touche, il l’embraſſe, il luy gagne le cœur.	Il le touche, il l'embrasse, il lui gagne le cœur.
SCENE CINQVIESME.	SCÈNE CINQUIÈME.
6 S arcο ADOLPHE.	6 S arcο ADOLPHE.
DITDDE.	DITDE.
Eſt aſſez:	Est assez:
mais.	mais.
ADOLPHE.	ADOLPHE.
Les Dieux vous ont eſté propices, Madame, vous deuez haſter vos Sacrifices:	Les Dieux vous ont été propices, Madame, vous devez hâter vos Sacrifices:
Voſtre vœu leur a pleü.	Votre vœu leur a pleue.
BALDE.	BALDE.
Comment l’auez vous ſçeu, Ny que i'ay fait vn vœu, ny qu’aux Dieux il a pleû.	Comment l'avez -vous sçeu, Ni que j'ai fait un vœu, ni qu'aux Dieux il a pleu.
ADOLPHE.	ADOLPHE.
Madame, i’ay ſuiuy-voſtre Eſpoux dans le Temple, Où par vne vertu qui n'eut iamais d’exemple Ce Prince eſtoit allé ſacrifier à Mars, Qui l’a ſi bien ſeruy dans ces derniers haſards:	Madame, j'ai suivi-vôtre Espoux dans le Temple, Où par une vertu qui n'eut jamais d'exemple Ce Prince était allé sacrifier à Mars, Qui l'a si bien servi dans ces derniers hasards:
La Victime a donné des preſages ſiniſtres, En vain nous auons fait conſulter les Miniſtres;	La Victime a donné des présages sinistres, En vain nous avons fait consulter les Ministres;
Ils ne nous ont promis que miſere & qu’horreur, Si les Dieux irriteZ n’appaiſent leur fureur:	Ils ne nous ont promis que misère et qu'horreur, Si les Dieux irrités n'appaisent leur fureur:
Ils taſchoient d’en donner quelque raiſon certaine, Quand vne voix confuſe a parlé de la Reine, Du ſalut du pais, des vœux qu'elle auoit faits, Que ſouuent on oublie en ſuitte du ſuccés.	Ils tâchaient d'en donner quelque raison certaine, Quand un voix confuse a parlé de la Reine, Du salut du pais, des vœux qu'elle avait faits, Que souvent on oublie en suite du succès.
Chacun dans ſa frayeur l’a crû ſans plus d’indices, Et chacun auec ioye attend vos Sacrifices.	Chacun dans sa frayeur l'a cru sans plus d'indices, Et chacun avec joie attend vos Sacrifices.
BALDE.	BALDE.
C ignorance fondoit vn vœu que i'auois fait, Vn vœu ſans fondement demeure ſans effet;	Ç ignorance fondait un vœu que j'avais fait, Un vœu sans fondement demeure sans effet;
I’ay voüé ſans peril ſur vne fauſſe crainte, Et mon illuſion vaut bien vne contrainte.	J'ai voüé sans péril sur une fausse crainte, Et mon illusion vaut bien une contrainte.
ADOLPHE.	ADOLPHE.
Le Ciel les approuuant a confirmé vos vœux.	Le Ciel les approuvant a confirmé vos vœux.
BALDE.	BALDE.
Les vœux n’ont eſté faits que pour les malheureux;	Les vœux n'ont été faits que pour les malheureux;
Mais lors que i’ay voüé, i’ay voüe ſans miſere;	Mais lors que j'ai vendre, j'ai vue sans misère;
Sans en auoir beſoin ie faiſois des prieres;	Sans en avoir besoin ici faisais des prières;
Voltare eſtoit vainqueur, & deſia poſſedoit Ce que mon trop de zele à vos Dieux demandoit.	Voltare était vainqueur, et déjà possédait Ce que mon trop de zèle à vos Dieux demandait.
ADOL	ADOL
Madame, de nos Dieux les faueurs ſont plus grandes, Que les dons qu’ils vous font preuiennent vos demandes:	Madame, de nos Dieux les faveurs sont plus grandes, Que les dons qu'ils vous font préviennent vos demandes:
Outre que voſtre Peuple ayant appris vos vœux, Dés qu’il s’eſt veù ſauué, l’a crù deuoir aux Dieux;	Outre que votre Peuple ayant appris vos vœux, Dès qu'il s'est véù sauvé, l'a crù devoir aux Dieux;
Et reſpirant à peine il veut qu’on les acquitte, Craignant par vn delay que le Ciel ne s’irrite.	Et respirant à peine il veut qu'on les acquitte, Craignant par un délai que le Ciel ne s'irrite.
Or ce Peuple zelé fait d’autant plus d’éclat, Qu'il ſe croit appuyé par les Loix de l’Eſtat;	Or ce Peuple zélé fait d'autant plus d'éclat, Qu'il se croit appuyé par les Lois de l'État;
Que ſa Religion luy donne ce ſcrupule, Et que c’eſt ſa façon ou bonne ou ridicule.	Que sa Religion Seigneur donne ce scrupule, Et que c'est sa façon ou bonne ou ridicule.
Madame, ie ne puis repeter ſans horreur L’effet de cette ſainte ou brutale fureur;	Madame, Seigneur ne puis répéter sans horreur L'effet de cette sainte ou brutale fureur;
Car comment appeller de ſainte ou de brutale) Celle qui viola la Maieſté Royale;	Car comment appeler de sainte ou de brutale) Celle qui viola la Majesté Royale;
Celle qui par le ſang d’vn Roy de vos Ayeux Eſtablit cette loy d’immoler tout aux Dieux;	Celle qui par le sang d'un Roi de vos Aïeux Établit cette loi d'immoler tout aux Dieux;
uand ce Peuple voulut d’vn zele illegitime, Qu'vn Roy d’vn vœu qu’il fit, fut pris pour la Victime.	uand ce Peuple voulut d’vn zele illegitime, Qu'vn Roy d’vn vœu qu’il fit, fut pris pour la Victime.
BALDE.	BALDE.
Qu'on me donne du temps, ie ſçay ce que ie doy.	Qu'on me donne du temps, ie maire ce que Rome dois.
Apres auoir reſvé quelque temps.	Apres avoir rêvé quelque temps.
Grands Dieux, ſauuez Voltare, & vangez vous ſur moy.	Grands Dieux, sauvez Voltare, et vengez -vous sur moi.
Ie tremble, ie fremis.	Je tremble, Seigneur frémis.
ADOLPHE.	ADOLPHE.
Pardonnez moy Madame.	Pardonnez -moi Madame.
Si ie ne connois pas ce qui trouble voſtre ame;	Si ici ne connais pas ce qui trouble votre âme;
Pour vous auoir parlé de ce qu’on doit aux Dieux, De la Religion qu’on profeſſe en ces lieux?	Pour vous avoir parlé de ce qu'on doit aux Dieux, De la Religion qu'on professe en ces lieux?
BALDE.	BALDE.
Tu m’as parlé de vœu, tu le ſçais & tu doutes D'où viennent mes frayeurs quand ce vœu les fait toutes.	Tu m'as parlé de vœu, tu le sais et tu doutes D'où viennent mes frayeurs quand ce vœu les fait toutes.
Adolphe eſcoute moy, i’ay voüé le trépas D'vne Victime illuſtre.	Adolphe écoute -moi, j'ai voüé le trépas D'une Victime illustre.
ADOLPHE.	ADOLPHE.
Et qui?	Et qui?
BALDE.	BALDE.
Ie ne ſçay pas.	Je ne sais pas.
Mais.	Mais.
ADOLPHE.	ADOLPHE.
Mais voſtre eſprit craint ce qu’il ne ſçait encore?	Mais votre esprit craint ce qu'il ne sait encore?
BALDE.	BALDE.
Peut-eſtre qu’il le ſçait, peut-eſtre qu’il l’ignore, Peut-eſtre que l’amour l’empeſche de le voir.	Peut-être qu'il le sait, peut-être qu'il l'ignore, Peut-être que l'amour l'empêche de le voir.
ADOLPHE.	ADOLPHE.
Et peut-eſtre que deux le pourront mieux ſçauoir.	Et peut-être que deux le pourront mieux savoir.
Madame, expliquez vous.	Madame, expliquez -vous.
BALDE.	BALDE.
Ie crains de le connoiſtre, I’ay voisé d’immoler tout ce qui ſçauroit eſtre Entre tout mon Eſtat, de meilleur, de plus cher, Adolphe le nommant, le condamne au bûcher.	Je crains de le connaître, J'ai voisé d'immoler tout ce qui saurait être Entre tout mon État, de meilleur, de plus cher, Adolphe le nommant, le condamne au bûcher.
Ie le dois aux Autels par vn vœu trop barbare, Et le doute où ie ſuis, c'eſt que:	Je le dois aux Autels par un vœu trop barbare, Et le doute où tu suis, c'est que:
mais ie m'égare.	mais ici m'égare.
ADOLPHE.	ADOLPHE.
I'entens & ie ſuccombe à ce coup de malheur, Tout ce qu’eut voſtre Eſtat de cher & de meilleur;	J'entends et et succombe à ce coup de malheur, Tout ce qu'eût votre État de cher et de meilleur;
Eſt promis aux Autels par vn vœu trop barbare;	Est promis aux Autels par un vœu trop barbare;
C’eſt auoir autant dit qu'auoir nommé Voltare.	C'est avoir autant dit qu'avoir nommé Voltare.
BALDE.	BALDE.
Adoſphe, as-tu deſſein de me donner la mort?	Adosphe, as-tu dessein de me donner la mort?
ADOLPHE.	ADOLPHE.
Que croire de meilleur ſi l’on ne luy fait tort?	Que croire de meilleur si l'on ne lui fait tort?
BALDE.	BALDE.
Ah!	Ah!
c’eſt ce que ie crains, ô vœu qui m’aſſaſſine!	c'est ce que ieromains, ô vœu qui m'assassine!
Qui fait pour me ſauuer auance ma ruine;	Qui fait pour me sauver avance ma ruine;
Uoltare n'eſt-il rien qui ſoit meilleur que vous?	OUoltare n'est-il rien qui soit meilleur que vous?
Pourquoy valeZ vous tant, Voltare mon Eſpoux?	Pourquoi valez -vous tant, Voltare mon Époux?
Adolphe, il vaut beaucoup:	Adolphe, il vaut beaucoup:
mais l'Eſtat en a d’autres;	mais l'État en a d'autres;
Moy meſme.	Moi -même.
A DOLPHE.	À DOLPHÉ.
Preferant ſes intereſts aux vostres, C’eſt monſtrer en voulant conſeruer voſtre Eſpoux, Qu'il vous eſt le plus cher puis qu’il l’eſt plus que vous.	Préférant ses intérêts aux vôtres, C'est montrer en voulant conserver votre Époux, Qu'il vous est le plus cher puis qu'il l'est plus que vous.
SCENE SIXIESME.	SCÈNE SIXIÈME.
pon nirlen, ertant dena entre ſans eſtre apperçeu.	pon nirlen, ertant dena entre sans être aperçu.
& BALDE.	et BALDE.
Iel reçoy d’autres vœux ou quelqu’autre victime,  Et ſi ie ne ſçaurois te plaire ſans vn crime.	Jel reçois d'autres vœux ou quelque autre victime, Et si apprendre ne saurais te plaire sans un crime.
VOLTARE.	VOLTARE.
Non non, ie la ſeray, prononcez-en l’Arreſt, Du reſte vous verrez, ſi voſtre Eſpoux eſt preſt.	Non non, Seigneur la serai, prononcez-en l'Arrest, Du reste vous verrez, si votre Époux est prêt.
BALDE.	BALDE.
Moy, prononcer l’Arreſt, ie te ſuis peu connuë:	Moi, prononcer l'Arrêt, Elle te suis peu connue:
Moy, ie ferois tomber ceux qui m'ont ſouſtenuë!	Moi, Seigneur ferais tomber ceux qui m'ont soutenue!
Que i'eſprouue pluſtost & les fers & les feux, Periſſe mon Eſtat, & s’il faut à mes vœux Immoler vn Eſpoux de qui ie tiens la vie, Perdons tout, ie crains plus d’eſtre ingratte qu’impie.	Que j'éprouve plutôt et les fers et les feux, Périsse mon État, et s'il faut à mes vœux Immoler un Époux de qui tu tiens la vie, Perdons tout, je crains plus d'être ingrate qu'impie.
G iij	G jijà
JOLTARE.	JOLTARE.
Madame, on doit tenir ce que l’on a promis.	Madame, on doit tenir ce que l'on a promis.
BALDE.	BALDE.
On ne doit point tenir ce qui n’eſt pas permis;	On ne doit point tenir ce qui n'est pas permis;
Immoler ce qui ſeul meriteroit de viure, Ainſi l’impieté de tous ſe feroit ſuiure, Perſonne ne voulant ſe parer de vertu, Qui perdroit le ſuiet qu’elle auroit reueſta.	Immoler ce qui seul mériterait de vivre, Ainsi l'impiété de tous se ferait suivrer, Personne ne voulant se parer de vertu, Qui perdrait le sujet qu'elle aurait reuesta.
Non non, ne croyez pas qu’on tienne vne parole Quand elle est temeraire, & qu’il faut qu’on immole D’vn Estat floriſſant tout ce qui vaut le mieux, Si l’on veut la garder & contenter les Dieux;	Non non, ne croyez pas qu'on tienne une parole Quand elle est téméraire, et qu'il faut qu'on immole D'un État florissant tout ce qui vaut le mieux, Si l'on veut la garder et contenter les Dieux;
Quand on n'eſt criminel que par trop de merite;	Quand on n'est criminel que par trop de mérite;
Quand la Vertu s’oppoſe, & que le ſang s’irrite:	Quand la Vertu s'oppose, et que le sang s'irrite:
Quand le Ciel a regret me la verroit tenir, Et ſi i’eſtois fidelle, il m’en voudroit punir.	Quand le Ciel a regret me la verrait tenir, Et si j'étais fidèle, il m'en voudrait punir.
Eſgorger vn Eſpoux, ſacrifice execrable, Quelle loy verſe vn ſang lors qu’il n’eſt pas coupable?	Égorger un Époux, sacrifice exécrable, Quelle loi verse un sang lors qu'il n'est pas coupable?
Le Ciel ne fut iamais l’autheur de cette loy.	Le Ciel ne fut jamais l'auteur de cette loi.
OLTARE.	OLTARE.
Le Ciel l’a confirmée.	Le Ciel l'a confirmée.
BALDE.	BALDE.
Ah!	Ah!
deſabuſe toy;	désabuse toi;
Les vœux ſont inuentez pour vaincre ſa iuſtice, Et celuy que i’ay fait haſteroit mon ſupplice.	Les vœux sont inventés pour vaincre sa justice, Et celui que j'ai fait hâterait mon supplice.
Vn crime eſt touſiours crime, encor qu’on l’ait promis A tous les Dieux enſemble, il n'eſt iamais permis:	Un crime est toujours crime, encor qu'on l'ait promis À tous les Dieux ensemble, il n'est jamais permis:
Qui l’execute, adiouſte à ſon extrauagance, Et ſa fidelité n’oſte rien de l’offence.	Qui l'exécute, ajoute à son extravagance, Et sa fidélité n'ôte rien de l'offense.
Mais quand ie le pourrois ſans violer la loy, Ie ne puis pas donner ce qui n'eſt pas à moy;	Mais quand ici le pourrais sans violer la loi, Je ne puis pas donner ce qui n'est pas à moi;
Ccite jeute raijon faſpal pour me deſendre, Que ie n'ay pù voüer ce que ie n'ay pù rendre.	Ccite jeute raijon faspal pour me désendre, Que tu n'ai pu voüer ce que ici n'ai pù rendre.
Eſt-il à moy Voltare?	Est-il à moi Voltare?
VOLIANL Ouy, Uoltare eſt à vous, Ne m’oſteZ pas Madame, vn nom qui m'eſt ſi doux.	VOLIANL Oui, Uoltare est à vous, Ne m'ôtez pas Madame, un nom qui m'est si doux.
BALDE.	BALDE.
I'oſe me le promettre, & i’oſe bien le croire, Que Voltare eſt à moy:	J'ose me le promettre, et j'ose bien le croire, Que Voltare est à moi:
mais il eſt à ſa gloire;	mais il est à sa gloire;
Il eſt à ſa Patrie, à l’Eſtat, & ie croy Qu'il ſe doit à l’Eſtat du moins autant qu’à moy.	Il est à sa Patrie, à l'État, et ie croy Qu'il se doit à l'État du moins autant qu'à moi.
Grands Dieux qui penetrez les ſecrets de noſtre ame, I'allois vous le donner, le païs le reclame;	Grands Dieux qui pénétrez les secrets de notre âme, J'allais vous le donner, le pays le réclame;
C’eſt vn gage commun que Balde ne peut pas Pour ſon intereſt ſeul, oſter à ſes Eſtats.	C'est un gage commun que Balde ne peut pas Pour son intérêt seul, ôter à ses États.
YOLTARE.	YOLTARE.
Il importe à l’Estat que vous teniez parole, Dittes ſi vous vouleZ qu’à luy ſeul on m’immoles Quo io cume u uumun pumda ſuui ue toys.	Il importe à l'État que vous teniez parole, Dittes si vous voulez qu'à lui seule on m'immoles Quo Quo jume ume umun pumda suiv ue tois.
Mais non, vous m’oſteriez l’heur de mourir pourvous.	Mais non, vous m'ôteriez l'heur de mourir pourvous.
BALDE.	BALDE.
Seigneur, dittes pluſtoſt que l’Eſtat & vous meſme Ne voulez pas que Balde immole ce qu'elle aime;	Seigneur, dites plutôt que l'État et vous même Ne voulez pas que Balde immole ce qu'elle aime;
Que tout s’eſt oppoſé contre ſa pieté, Qu'elle alloit plaire aux Dieux ſi l’on n’euſt reſiſté.	Que tout s'est opposé contre sa piété, Qu'elle allait plaire aux Dieux si l'on n'eût résisté.
VOLTARE.	VOLTARE.
Madame, il faut mourir, vos vœux me le cõmandent, C’est les trahir.	Madame, il faut mourir, vos vœux me le commandent, C'est les trahir.
BALDE.	BALDE.
Ie ſçay que les Dieux te demandent, Que ma fidelité leur deuroit ton trépas;	Je sais que les Dieux te demandent, Que ma fidélité leur devrait ton trépas;
Ie le ſçay:	Je le sais:
mais enfin mon amour ne veut pas.	mais enfin mon amour ne veut pas.
Deffends toy cher Eſpoux.	Défends toi cher Époux.
OLIARE.	OLIARE.
Contre voſtre parole?	Contre votre parole?
BALDE.	BALDE.
BALDE.	BALDE.
Et contre tous les Dieux, & contre vn vœu friuole.	Et contre tous les Dieux, et contre un vœu frivole.
OLTARE.	OLTARE.
Ie ne preſume pas d’eſtre agreable aux Dieux, Ny d’eſtre en tout l’Eſtat celuy qui vaut le mieux.	Je ne présume pas d'être agréable aux Dieux, Ni d’être en tout l'État celui qui vaut le mieux.
Madame, ſeulement ie veux auec franchiſe, Liberal de ſi peu que i’ay de gloire acquiſe, La donner pour le Ciel, pour vous & pour l’Estat.	Madame, seulement belle veux avec franchise, Libéral de si peu que j'ai de gloire acquise, La donner pour le Ciel, pour vous et pour l'État.
Si i’ay quelque deſir, c’eſt qu'elle eut plus d’eſclat, Aafem ue en pouuonr fairt ont prus uigne offrande;	Si j'ai quelque désir, c'est qu'elle eut plus d'éclat, Afém ève en pouvonr ait ont prus uigne offrande;
Ie la donne auec ioye au Ciel qui la demande, Et ie m'eſtime heureux en mourant vne fois, D’apprendre qu’vne mort m’acquitte enuers vous trois.	Je la donne avec joie au Ciel qui la demande, Et Elle m'estime heureux en mourant une fois, D'apprendre qu'une mort m'acquitte envers vous trois.
BALDE.	BALDE.
Deuſt le Ciel me punir par vn coup de Tonnerre;	Devût le Ciel me punir par un coup de Tonnerre;
Deust ſouffrir mon Eſtat, peſte, famine & guerre;	Devût souffrir mon État, peste, famine et guerre;
Deust mon Peuple enragé m'immoler à ſes Dieux, Comme il fit autrefois vn Roy de mes ayeux, Pluſtoſt que.	Devût mon Peuple enragé m'immoler à ses Dieux, Comme il fit autrefois un Roi de mes aïeux, Plutôt que.
OLTARE.	OLTARE.
Mais le Ciel qui veut que ie periſſe.	Mais le Ciel qui veut que personne périsse.
BALDE.	BALDE.
Il s’expliquera mieux s’il veut que i’obeïſſe;	Il s'expliquera mieux s'il veut que j'obéisse;
Non non, le Ciel encor ne vous a pas nommé, Et ie n’aurois pas craint ſi ie n'auois aimé.	Non non, le Ciel encor ne vous a pas nommé, Et ici n'aurais pas craint si grande n'avais aimé.
Mais helas ie vous aime, & plus ie vous eſtime, Plus vous me paroiſſez, cette chere victime:	Mais hélas Seigneur vous aime, et plus grands vous estime, Plus vous me paraissez, cette chère victime:
Voyant voſtre merite & ce que i’ay voüé, Voltare ie crains plus, plus ie vous ay loüé.	Voyant votre mérite et ce que j'ai voüé, Voltare tu crains plus, sans ie vous ai loué.
OLTARE.	OLTARE.
Accordez moy la mort puiſque ie la deſire, Et ne m'enuteæ pus te vonnenn omtuſpire.	Accordez -moi la mort puisque ieans désire, Et ne m'enuteæ pus te vonnenn omptuspire.
BALDE.	BALDE.
Quoy, m'aimes-tu ſi peu?	Quoi, m'aimes-tu si peu?
OLTARE.	OLTARE.
Vous ſçauez mon amour.	Vous savez mon amour.
BALDE.	BALDE.
L'infidelle, il me laiſſe.	L'infidèle, il me laisse.
OLTARE.	OLTARE.
Ouy, mais auec le iour.	Oui, mais avec le jour.
Paima) lliqaalamori.	Paima) liqaalamori.
BALDE.	BALDE.
Omimeme qui doit ſuiure Ne pourra-t'elle pas, ingrat te faire viure?	Omimeme qui doit suivre Ne pourra-t'-elle pas, ingrat te faire vivre?
VOLTARE.	VOLTARE.
Vous attaquez ma gloire auecque ces ſoupirs, Ma conſtance ſe perd parmy vos deſplaiſirs:	Vous attaquez ma gloire avec ces soupirs, Ma constance se perd mi vos déplaisirs:
Ie ſens bien que mon cœur a peine à ſe deffendre, Eſuitons des beaux yeux qui le pourroient ſurprendre:	Je sens bien que mon cœur a peine à se défendre, Esuitons des beaux yeux qui le pourraient surprendre:
Fuyons vn ennemy qui.	Fuyons un ennemi qui.
Voltare ſort.	Voltare sort.
BALDE.	BALDE.
Cruel demeurez, Negligez les ſoupirs d’vne femme, & moureZ:	Cruel demeurez, Négligez les soupirs d'une femme, et mourez:
Et i'iray cependant loin de vostre preſence Avlenenen u aunreo nenna om uemt qui vous offencé:	Et j'irai cependant loin de votre présence Avlenenen à sonreo nenna om emt qui vous offensé:
Là ie ſoupireray tant qu’il plaiſe à nos Dieux De dire expreſſément celuy qui vaut le mieux;	Là grande soupirerai tant qu'il plaise à nos Dieux De dire expressément celui qui vaut le mieux;
Et ſi leur cruauté vous veut pour la Victime, Ie ſçauray preuenir ma douleur & mon crime.	Et si leur cruauté vous veut pour la Victime, Je saurai prévenir ma douleur et mon crime.
Adolphe, que dis-tu de ce cœur obſtiné?	Adolphe, que dis-tu de ce cœur obstiné?
ADOLPHE.	ADOLPHE.
Ie ne crains rien pour vous qu’vn Peuple mutiné, Dont la deuotion ſcrupuleuſe & friuole, Si vous t'auez voue, vouara que i'on l'immole.	Je ne crains rien pour vous qu'un Peuple mutiné, Dont la dévotion scrupuleuse et frivole, Si vous t'avez voue, vouara que j'on l'immole.
BALDE.	BALDE.
Mais apres tout, les Dieux ne l’ayant point nommé, Peut-eſtre moneſprit s’eſt en vain allarmé.	Mais après tout, les Dieux ne l'ayant point nommé, Peut-être monesprit s'est en vain alarmé.
ADOLPHE.	ADOLPHE.
Hé bien pour mettre fin à ces frayeurs extrémes, Allons Madame, allons l’apprendre des Dieux meſmes;	Hé bien pour mettre fin à ces frayeurs extrêmes, Allons Madame, allons l'apprendre des Dieux mêmes;
Peut-eſtre que honteux de parler deuant vous, Ils ne vous oſeront demander voſtre Eſpoux.	Peut-être que honteux de parler devant vous, Ils ne vous oseront demander votre Époux.
Fin du troiſieſme Acte.	Fin du troisième Acte.
TET A P H I.	TET A P . I.
SCLNE INEMIENL.	SCLNE INEMIENL.
JOLTARE ſeul.	JOLTARE seul.
22888 & Alheureux Throſnes de ce monde, Que vos plaiſirs ſont incertains, Min Et que le Prince qui s'y fonde Sçait peu le pouuoir des Deſtins?	22888 et Alheureux Thrônes de ce monde, Que vos plaisirs sont incertains, Min Et que le Prince qui s'y fonde Sait peu le pouvoir des Destins?
L’eſclat de cette grande pompe Qui l’ébloüit & qui le trompe;	L'éclat de cette grande pompe Qui l'éblouit et qui le trompe;
N'eſt qu’vn faux iour meſlé de tant d’obſcurité, Que tout ce qu’en à crû l’ignorance vulgaire, Fut vn bonheur imaginaire, Et non pas vne verité.	N'est qu'un faux jour mêlé de tant d'obscurité, Que tout ce qu'en a cru l'ignorance vulgaire, Fut un bonheur imaginaire, Et non pas une vérité.
BALDE, REINE	BALDE, REINE
Vn Roy qui prend vne Couronne, Se charge de beaucoup de ſoins:	Un Roi qui prend une Couronne, Se charge de beaucoup de soins:
Dans cette Cour qui l’enuironne Il ſouffre d’importuns teſmoins;	Dans cette Cour qui l'environne Il souffre d'importuns témoins;
L’heur qui le ſuit ou qui le laiſſe, ui le hauſſe ou qui le rabaiſſe, S’il porte quelquefois ſon nom par l’Uniuers, Vn accident ſoudain eſtouffera ſa gloire;	L'heur qui le suit ou qui le laisse, ui le hausse ou qui le rabaisse, S'il porte quelquefois son nom par l'Univers, Un accident soudain étouffera sa gloire;
Li voſons nons pus daus i'Tfiſoire ue les Grands ont les grands reuers.	Li vosons nons pus daus j'Tisoire ue les Grands ont les grands revers.
Balde fut aſſez longtemps Reine, D’vn Pais tres grand & tres beau;	Balde fut assez longtemps Reine, D'un Pais très grand et très beau;
En ſuitte elle a veû ſon Domaine Renfermé dans vn ſeul Chaſteau:	En suite elle a vu son Domaine Renfermé dans un seul Château:
Ainſi ſes fortunes diuerſes, Ou de plaiſirs ou de trauerſes La porterent tantoſt dans la felicité, Et la firent tantoſt vn tableau de miſere, Touſiours dans l’heur ou ſon contraire, Iamais dans la ſtabilité.	Ainsi ses fortunes diverses, Ou de plaisirs ou de traverses La portèrent tantôt dans la félicité, Et la firent tantôt un tableau de misère, Toujours dans l'heur ou son contraire, Jamais dans la stabilité.
Vn vœu qu'elle a fait la ſoulage;	Un vœu qu'elle a fait la soulage;
Elle recouure ſes Eſtats:	Elle recouvre ses États:
Ce vœu qui l’oblige, l’outrage, Il la ſeri & ne la ſert pas:	Ce vœu qui l'oblige, l'outrage, Il la sery et ne la sert pas:
Le el doux pour elle,& barbare, Qui pour la ſauuer perd Voltare, Veut qu'elle ſacrifie vn Vainqueur à ſes Dieux:	Le elle doux pour elle, barbare, Qui pour la sauver perd Voltare, Veut qu'elle sacrifie un Vainqueur à ses Dieux:
Eſgorger ſon Eſpoux, elle croit faire vn crime, El donsans ene auire y tesssse, Eſpargner ce qui vaut le mieux.	Égorger son Époux, elle croit faire un crime, Él dons ene avire y tesssse, Épargner ce qui vaut le mieux.
Dans vn estat ſi deplorable, De quel coſté pancher des deux?	Dans un état si déplorable, De quel côté pencher des deux?
Accompliſſant elle eſt coupable, Et n'accompliſſant pas ſes vœux;	Accomplissant elle est coupable, Et n'accomplissant pas ses vœux;
S’il faut encore d’autres marques De la miſere des Monarques;	S'il faut encore d'autres marques De la misère des Monarques;
