Les Eueſques ſe leuent de leurs chaires ſ'en vont remercier Dieu de l’heureux aduertiſſement, qu’ils ont reçeu de ſa part, touchant la nominatiõ d’vn Archeueſque de ſi belle eſperance.	Les Euesques se lèvent de leurs chaires s'en vont remercier Dieu de l'heureux avertissement, qu'ils ont reçu de sa part, touchant la nomination d'être Archeuesque de si belle espérance.
Tandis Dion, ſecond Eueſque du Synode fera la ſentinelle à la porte de l’Egliſe, pour demander le nom à tous qui viendront y faire leurs prieres.	Tandis Dion, second Évêque du Synode fera la sentinelle à la porte de l'Église, pour demander le nom à tous qui viendront y faire leurs prières.
ODE D’ACTION DE GRACES.	ODE D'ACTION DE GRACES.
’Eſt bien à juſte occaſion,  Enfemvit que ue teur e dâme Chacun de nous ores ſ'enflamme De loüer Dieu d’affection.	Ut bien à juste occasion, Enfémit que ue teur e âme Chacun de nous ores s'enflamme De louer Dieu d'affection.
Les ingrats des bien-faits reģeuz Sont tousjours de blaſme coupables:	Les ingrats des bienfaits reģeuz Sont toujours de blâme coupables:
Comme de loüange capables Ceux qui rendent grace à qui plus.	Comme de lange capables Ceux qui rendent grâce à qui plus.
Maintenant doncques, ô Seigneur, Cette troupe te remercie;	Maintenant donc, ô Seigneur, Cette troupe te remercie;
L’ayant d’vne charge obſcurcie Deliuré à ſon tres-bon heur.	L'ayant d'une charge obscurcie Délivré à son très-bon heur.
Noz prieres & vœus ſacrez Offert au deuant de ta face Sont enterinez de ta grace, Comme l’on les a deſirez.	Noz prières et vœus sacrés Offert au devant de ta face Sont entérinez de ta grâce, Comme l'on les a désirez.
Ils ont reſſemblé proprement La coulombe au rinceau d’oliue, Nous donnant par vne voix viue Ioye & repos en vn moment.	Ils ont ressemblé proprement La coulombe au rinceau d'olive, Nous donnant par une voix vive Joie et repos en un moment.
L’EXCVSE, ET LE REFVS QVE FAIT S.	L'EXCUSE, ET LE REFUS QUE FAIT S.
NICOLAS D’ACCEPTER la charge Archiepiſcopale, & les raiſons perſuaſiues des Eueſques qui le flechirent à la fin.	NICOLAS D'ACCEPTER la charge Archiepiscopale, et les raisons persuasives des Euesques qui le fléchirent à la fin.
DION.	DION.
E chaſſeur boccager allouuy de la proye (Cõme de beau butin le ſoldat qui guerroye) Retient court enleſſez ſes alans, ſes limiers, Qu'ils ne vaucrent, errants, au galop de couLes gardant ſouple-frais pour la beſte l’ancée, Deſcouuerte au matin au pié de ſa paſſée, Ne leur permettant pas de mordre ny flairer Iriers, Tout ce qu’ils pourroient bien gloutonnement bauffer.	 chasseur bocager allouir de la proie (Comme de beau butin le soldat qui guerroie) Retient court enlessez ses alants, ses limiers, Qu'ils ne vaucrent, errants, au galop de couLes gardant souple-frais pour la bête l'ancée, Découverte au matin au pié de sa passée, Ne leur permettant pas de mordre ici flairer Iers, Tout ce qu'ils pourraient bien gloutonnement bauffer.
Ainſi l’homme commis en charge demettable Pour mieux dire autrement en office contable] Ne doit ailleurs tourner ſa veuë, ny ſon cœur Que là, ſ'il eſt jaloux d’eſtre titré d’honneur:	Ainsi l'homme commis en charge demettable Pour mieux dire autrement en office contable] Ne doit ailleurs tourner sa vue, ni son cœur Que là, s'il est jaloux d'être titré d'honneur:
Ny, volage, preſter ſon oreille aymt ehange Sinon à ce qu’il faut, où ſujet il ſe range.	Ni, volage, prêter son oreille aimt ehange Sinon à ce qu'il faut, où sujet il se range.
Ce paquet eſt à moy, qui, garanti d’aueu, Dois eſpier chacun, qui vient rendre ſon vœu, Pour en faire rapport, & mener la perſonne Vers ce pourpré Senat, d’vn, de qui le nom ſonne Clairement Nicolas, dans le Ciel renommé, Puis qu’Eueſque d’icy Dieu meſme l’a nommé.	Ce paquet est à moi, qui, garanti d'aveu, Dois épier chacun, qui vient rendre son vœu, Pour en faire rapport, et mener la personne Vers ce pourpré Sénat, d'un, de qui le nom son Clairement Nicolas, dans le Ciel renommé, Puis qu'Euesque d'ici Dieu même l'a nommé.
Doncques pour m’aſſeruir à ce ſainct Ministere Bien qu’vn hymne diuin nostre chœur reitere, Ie me captiueray, circonſpect, tellement Que mes ſens ne pourront ſ'eſgarer follement.	Donc pour m'asservir à ce saint Ministe Bien qu'un hymne divin nôtre chœur reitere, Je me captiverai, circonspect, tellement Que mes sens ne pourront s'égarer follement.
Ie jetteray tendu mon œil droit à la porte, Mon oreille au loquet, & ma double main forte Sur qui, voulant entrer, ſe dira Nicolas, Le menant, bien-venu, vers ces graues Prelats.	Je jetterai tendu mon œil droit à la porte, Mon oreille au loquet, et ma double main forte Sur qui, voulant entrer, se dira Nicolas, Le menant, bienvenu, vers ces graves Prelats.
Ioy quelqu’vn fretiller, & ſi je voy de l’ombre, Qui rend meſme le ſueil des-ja comme tout ſombre.	Joi quelqu'avoir frétiller, et si je vois de l'ombre, Qui rend même le seuil déjà comme tout sombre.
L’on buque je l’entens.	L'on buque je l'entends.
Pleuſt à Dieu que ce fut Celuy qui m'eſt preſcrit pour le noir de mon but.	Plût à Dieu que ce fut Celui qui m'est prescrit pour le noir de mon but.
Il me luy faut ouurir.	Il me lui avait ouvrir.
S.	S.
NICOLAS.	NICOLAS.
O Dieu:	Ô Dieu:
Dieuineſjaolé, Quel portier eſt-cy, qui d’vn regard affable Me rit humainement?	Dieuinesjaolé, Quel portier est-cy, qui d'un regard affable Me rit humainement?
Bon augure pour moy De ne retourner pas encheueſtré d’eſmoy.	Bon augure pour moi De ne retourner pas encheuestré d'émoi.
DION.	DION.
Qui eſtes vous, Monſieur, quel adextre Genie Vous fait en ce lieu ſainct ſi matin compagnie?	Qui êtes -vous, Monsieur, quel adextré Génie Vous fait en ce lieu saint si matin compagnie?
S NICOLAS.	S NICOLAS.
Vous n’ignorez, je croy, qu’vn vergongneux debteur, Pour ſe capter l’amour de ſon libre preſteur, Pretend au terme pris d'aller le ſatisfaire, Pour eſtre recouuré en fortuite affaire.	Vous n'ignorez, je crois, qu'un vergongneux débteur, Pour se capter l'amour de son libre prêteur, Pretend au terme pris d'aller le satisfaire, Pour chang recouvré en fortuite affaire.
Car celuy rend deux fois qui, ſoigneux, rend bien toſt, Faiſant qu’on eſt enclin de l’aßiſter pluſtoſt.	Car celui rend deux fois qui, soigneux, rend bien tôt, Faisant qu'on est enclin de l'assister plutôt.
Moy, qui ſuis à mon Dieu de beaucoup redeuable (Ce qu'en mon en-bon-poinct eſt bien apperçeuable) C’eſt pourquoy, matineux, arriué de nouueau, Meu par le vif inſtinct de mon jeune cerueau, Ie vien luy deſplier mon ame, ma puiſſance, Qu’humblement je ſommets à ſon obeïſſance:	Moi, qui suis à mon Dieu de beaucoup redevable (Che qu'en mon en-bon-point est bien apperçeuable) C'est pourquoi, matineux, arrivé de nouveau, Meu par le vif instinct de mon jeune cerveau, Je vien lui déplier mon âme, ma puissance, Qu'humblement je sommets à son obéissance:
De la meſme façon que le pauure Eſchinés, Ne poſſedant que ſoy pour treſors fortunez, S’offrit, tel qu’il eſtoit, à ſon maiſtre Socrate, Craignant d’eſtre cenſé d’vne nature ingrate.	De la même façon que le pauvre Échinez, Ne possédant que soi pour trésors fortunés, S'offrit, tel qu'il était, à son maître Socrate, Craignant d'être centsé d'une nature ingrate.
Preſent qu’il accepta de front außi riant, Que ſ'il l’eut eſtrenné de lapis d’orient.	Présent qu'il accepta de front aussi riant, Que s'il l'eut étrenné de lapis d'orient.
Loüable volonté, precieux honoraire, D’Eſchinés, & de vous, de creance aduerſaire:	Louable volonté, précieux honoraire, D'Échinés, et de vous, de créance adversaire:
De vous, comechreſtien, a voſtre Piaſmaient, Du payen Eſchinés enuers ſon precepteur.	De vous, comechrestien, a votre Piâmaient, Du païen Échinez envers son précepteur.
Mais faites moy ce bien, cette faueur humaine De dire voſtre nõ, voſtre eſtat, qui vous menc.	Mais faites -moi ce bien, cette faveur humaine De dire votre nôtre, votre état, qui vous menc.
S.	S.
NICOEIO.	NICOEIO.
Pour l'vn, je vous l’ay dit:	Pour l'un, je vous l'ai dit:
mais quoy qu’importera De ſçauoir qui je ſuis?	mais quoi qu’importera De sçauoir qui je suis?
DION.	DION.
Bien en ſuccedera.	Bien en succédera.
S.	S.
NICOLAS.	NICOLAS.
De rien l'on ne fait rien au meſtier de Nature, Moy, qui ſuis vn neant, vne orde creature, L’eſgout empuanty d’execrables pechez, Qui couuent, renaiſſans, dans mon ame nichez:	De rien l'on ne fait rien au métier de Nature, Moi, qui suis un néant, une orde créature, L'égout empuanti d'exécrables péchés, Qui couvent, renaissants, dans mon âme nichez:
Quoysqu'en eſperez-Pousscar pouxte la matiere La forme doit touſiours luy conuenir entiere.	Quoisqu'en espérez-Pousscar pouxte la matière La forme doit toujours toujours convenir entière.
D ION.	 DON.
Ne vous ſouciez pas:	Ne vous souciez pas:
Dieu eſt tel artiſan Que de riẽ il fait tout, d’vn ruſtre vn courtiſan, Du ſale, le plus beau, du feble la puiſſance Du bas te releué, au crime tinndtente.	Dieu est tel artisan Que de rion il fait tout, d'un rustre un courtisan, Du sale, le plus beau, du feble la puissance Du bas te relevé, au crime tindtente.
S.	S.
NICOLAS.	NICOLAS.
Ie le ſçay, Dieu mercy.	Je le sais, Dieu merci.
DION.	DION.
Ne reſte plus finon Qu'ores vous m'appreniez voſtre myſtique nom.	Ne reste plus sinon Qu'ores vous m'appreniez votre mystique nom.
S.	S.
ARCOLAS.	ARCOLAS.
Le deſirez-vous tant?	Le désirez-vous tant?
ION.	JON.
Tant que i’en meurs d'enuie.	Tant que j'en meurs d'envie.
S.	S.
NICOLAS.	NICOLAS.
Scachez donc que ſi toſt que l'Autheur de la vie M’eut fait aſpirer l’air hors du clos maternel:	Scachez donc que si tôt que l'Auteur de la vie M'eut fait aspirer l'air hors du clos maternel:
Pom me tuueri punais, du vnce originel.	Pom me tuueri punais, du vnce originel.
Mes luſtriques parens me porterent au Preſtre, Qui me verſant de l’eau, qui chreſtien nous fait eſtre, Pour me deſempieger des diaboliques laqs, Et me voüer à Dieu, me nomment Nicolas.	Mes lustriques parents me portèrent au Prêtre, Qui me versant de l'eau, qui chrétien nous fait être, Pour me désempieger des diaboliques laqs, Et me voûer à Dieu, me nomment Nicolas.
Nicolas!	Nicolas!
DION.	DION.
Nicolas.	Nicolas.
DION.	DION.
O Dieul quete ſus utgePermettez moy, Monſieur, qu'en amy ie vous baiſe.	Ô Dieul quete sus utgePermettez moi, Monsieur, qu'en ami après vous baise.
S.	S.
NICOLAS.	NICOLAS.
D'où vient ce cher amour, ce ſoulas ſi toſt pru?	D'où vient ce cher amour, ce soûlas si tôt pru?
D I.	D I.
Du Ciel, & du bon-heur de voſtre nom appris De grace, baillez moy voſtre main ambroiſine.	Du Ciel, et du bonheur de votre nom appris De grâce, baillez moi votre main ambroisine.
mart nons uutriemn d’vne allure voifine.	mart nons utriemn d'une allure voifine.
Voyez-vous ces Prelats retirez à reçoy?	Voyez-vous ces Prêlats retirez à reçois?
Là vous attendent-ils.	Là vous attendent-ils.
S.	S.
NICOLAS.	NICOLAS.
Qu’ils m’attendent!	Qu'ils m'attendent!
pourquoy?	pourquoi?
ous me diſpenſerez de le vous faire entendre.	ous me dispenserez de le vous faire entendre.
Ie n'estois deſeigné ſinon que pour prendre Sur ce paſſage ouuert, & vous mener vers eux.	Je n'étais deseigné sinon que pour prendre Sur ce passage ouvert, et vous mener vers eux.
Allons donc, ſ’il vous plaist.	Allons donc, s'il vous plaît.
S.	S.
NICOLAS.	NICOLAS.
Bien, allons:	Bien, allons:
ie le veux.	ie Le veux.
Vous ne meritez pas vn retif hoche-teſte:	Vous ne méritez pas un rétif hoche-teste:
Ioint que qui obeït vne gloire il ſ'appreſte.	Joint que qui obéit une gloire il s'apprête.
Meßieurs, claquez des mains, & vous eſiouïſſez:	Messieurs, claquez des mains, et vous esiouïssez:
Car de voſtre talent ores vous iouïſſez.	Car de votre talent ores vous jouissez.
D'vn viſage roſin regardez, voila l’homme, L'homme benit des Cieux, que Nicolas on nomme.	D'un visage rosin regardez, voilà l'homme, L'homme bénit des Cieux, que Nicolas on nomme.
Mais comme Dieu nous rit:	Mais comme Dieu nous rit:
comme il eſt attentif Au celeſte ſalut de ſon peuple adoptif.	comme il est attentif Au celeste salut de son peuple adoptif.
On dit, que diſ-ie?	On dit, que dis-je?
on dit:	on dit:
il est trop oculaire, Voire au plus chaßieux du ſimple populaire, Que remontant en haut vn nuage fumant Bien toſt aprés on voit pleuuoir eſpeſſement.	il est trop oculaire, Voire au plus chassieux du simple populaire, Que remontant en haut un nuage fumant Bien tôt après on voit pleuvoir épessement.
Ainſi volant au Ciel l’oraiſon meritoire, Comme l’encens gommeux en l’ardent encenſoire) Dieu rayonnant deſſus la conuertit en eau:	Ainsi volant au Ciel l'oraison méritoire, Comme l'encens gommeux en l'ardent encensoire) Dieu rayonnant dessus la convertit en eau:
Eau de ſaincte faueur, & d'effet außi beau, Qu’il eſcliſſe aux prians preſques à la meſme heure:	Eau de sainte faveur, et d'effet aussi beau, Qu'il éclisse aux priants presques à la même heure:
Meſme autant dru, menu que d’vne chante-pleure.	Même autant dru, menu que d'une chante-pleure.
Comme nons l’eſprouuons, en ce que ſur le chant Nous ſentons exaucé noſtre hymne ſonne-chant.	Comme nons l'éprouvons, en ce que sur le chant Nous sentons exaucé notre hymne sonne-chant.
Car voyez le bon-heur dequoy Dieu nous careſſe, Pour n’auoir ſommeillé ſur le lict de pareſſe, Quand il eſt queſtion de negoces vrgents.	Car voyez le bonheur dequoy Dieu nous caresse, Pour n'avoir sommeillé sur le lit de paresse, Quand il est question de négoces vrgents.
Ainſi que par deux fois nous fuſmes diligens D’appeller au ſecours ſon pouuoir admirable:	Ainsi que par deux fois nous fûmes diligents D'appeler au secours son pouvoir admirable:
Luy de meſme nous fut promptement ſecourable.	Lui de même nous fut promptement secourable.
L’vne, estans au plus-fort de cette eſlection:	L'une, étant au plus-fort de cette élection:
L’autre, au premier venu de ma commißion.	L'autre, au premier venu de ma commission.
Parlez-luy, le voila:	Parlez-lui, le voilà:
ſa Phyſionomie Agtome piumement one gruntt preudhommie.	sa Physionomie Agtome piumement one grunt prudhommie.
CLARIVS.	CLARIVS.
Monſieur, nous croyons tous qu'vn zephir' gratieux, Ventellant du toſté du concaue des Cieux, Vous a pouſſé, leger, juſqu'à ce riche fane, Dans quoy Dieu n'eſt ſeruy à la mode prophane.	Monsieur, nous croyons tous qu'ils zéphir' gratieux, Ventellant du tosté du concave des Cieux, Vous a poussé, léger, jusqu'à ce riche fane, Dans quoi Dieu n'est servi à la mode prophane.
Me licenciriez-vous de vous conter deux mots?	Me licenciriez-vous de vous conter deux mots?
S.	S.
NICOLAS.	NICOLAS.
Ha!	Ha!
que ce mot ſucré me bleſſe, & fait de maux.	que ce mot sucré me blesse, et fait de maux.
CLARIVS.	CLARIVS.
Vous bleſſe!	Vous blesse!
mais pourquoy?	mais pourquoi?
S.	S.
NICOLAS.	NICOLAS.
Me demandant licence De ce, dont vous auez vne telle puiſſance, Que quand vous le feriez je ne puis l’empeſcher, Et quand je le pourroy ce ſeroit vous faſcher.	Me demandant licence De ce, dont vous avez un telle puissance, Que quand vous le feriez je ne puis l'empêcher, Et quand je le pourrais ce serait vous fâcher.
CLARIVS.	CLARIVS.
Ie les vous diray donc.	Je les vous dirai donc.
Le feure de Nature (De qui ce vuide eſpars eſt la verbe-facture) Pestrit l’homme mortel du boüeux element, Pour chef-d’œuure dernier parfait abſolument, Mortel par le peché, qu’il commit, volontaire, Rendant ainſi chacun à la mort tributaire.	Le fure de Nature (De qui ce vide épars est la verbe-facture) Pétrit l'homme mortel du boüeux élément, Pour chef-d'œuvre dernier parfait absolument, Mortel par le péché, qu'il commit, volontaire, Rendant ainsi chacun à la mort tributaire.
Mort, implacable mort, que Dieu luy preſcriuit Sans reuocation dés le moment qu’il vit.	Mort, implacable mort, que Dieu lui prescrivit Sans révocation dès le moment qu'il vit.
Ayant borné ſes ans, ſes mois, ſes jours, ſon heure, Qu'il ne peut allonger tant qu’au monde il demeure.	Ayant borné ses ans, ses mois, ses jours, son heure, Qu'il ne peut allonger tant qu'au monde il demeure.
Religieuſe foy du chreſtien baptizé.	Religieuse foi du chrétien baptisé.
Or' qu’on prouuaſt cecy d’vn poinct authorizé De ceux qui ont eſcrit de la Philoſophie:	Or' on prouvât ceci d'un point autorisé De ceux qui ont écrit de la Philosophie:
Si que qui l’entendra faut qu’il le ratifie.	Si que qui l'entendra faut qu'il le ratifie.
Ie conſens auec eux qu’on meurt par le deffaut Du principe vital, qu'on dit humide-chaud,	Je consens était eux qu'on meurt par le défaut Du principe vital, qu'on dit humide-chaud,
Qui iournalierement dedans nous ſ'appetiſſe, Bien que boire & manger nous fomente & nourriſſe.	Qui journalièrement dedans nous s'appétisse, Bien que boire et manger nous fomente et nourrisse.
L’exemple eſt triuial.	L'exemple est trival.
Car comme nous voyons Vne lampe lumer la-part où nous ſoyons Tant que l’huile y croupit ramoitiſſant la meſche, Qui luy fait flamboyer vne viue flammeſche.	Car comme nous voyons Une lampe lumer la-part où nous soyons Tant que l'huile y croupit ramoitissant la mèche, Qui lui fait flamboyer une vive flammes.
Lampe, où ſi l’on mettoit à meſure autant d’eau, Que l’huile ſ'amoindrit, comme en poreux vaiſſeau, La liqueur juſqu’au bord ſ'entretiendroit de meſme:	Lampe, où si l'on mettait à mesure autant d'eau, Que l'huile s'amoindrit, comme en poreux vaisseau, La liqueur jusqu'au bord s'entretiendrait de même:
Mais de l’huile non pas, tariſſant à l’extreſme:	Mais de l'huile non pas, tarissant à l'extrême:
De ſorte que verſer tant d’eau l’on y pourroit Que l’huile deffaillant la lampe ſ'eſteindroit.	De sorte que verser tant d'eau l'on y pourrait Que l'huile défaillant la lampe s'éteindrait.
Ainſi du corps humain le radical humide Peut bien ſe reſtaurer, quand d’vne faim auide.	Ainsi du corps humain le radical humide Peut bien se restaurer, quand d'une faim aujde.
L’on prend à temps heuré ſes principaux repas.	L'on prend à temps heuré ses principaux repas.
Mais d’humide eſtranger qu’ils ſont, ne peuuent pas Se tranſmuer vrayment en celuy de Nature:	Mais d'humide étranger qu'ils sont, ne peuvent pas Se transmuer vraiment en celui de Nature:
Si qu’on tire à la mort certainement future.	Si qu'on tire à la mort certainement future.
Car, eſtant conſommé par le chaud naturel, La lumiere ſ'eſteint du viure temporel.	Car, étant consommé par le chaud naturel, La lumière s'éteint du vivre temporel.
Les peintres anciens, ayans cette franchiſe D’oſer ce qu’ils vouloient, par leur regle preciſe Peignoient artiſtement l’ineuitable mort Sous vn corps virginal, pour monſtrer ſon effort.	Les peintres anciens, ayant cette franchise D'oser ce qu'ils voulaient, par leur règle précise Peignaient artistement l'inévitable mort Sous un corps virginal, pour montrer son effort.
D'vn voile calendré luy maſquant le viſage, Son front d’aloeſne ceint, & ſon joly cor-ſage Tauelé ça-dela de ſang noir tout figé, Qui d’vn moite pinceau luy eſtoit affigé.	D'un voile calendré même masquant le visage, Son front d'aloène ceint, et son joli cor-sage Tauelé ça-dela de sang noir tout figé, Qui d'un moite pinceau lui avait affigé.
Qu'entendent-ils par là?	Qu'entendent-ils par là?
quel mal, ou bon augure Couue tapy ſous ſoy cette platte figure?	quel mal, ou bon augure Couve tapi sous soi cette platte figure?
C’eſt vne vierge en-fin au jugement des yeux, Ie vay la deſuoiler.	C'est assez vierge en-fin au jugement des yeux, Je vais la dévoiler.
Comme il faut en tous lieux Qu'vne nymphe d’eſprit, pour ſ'affranchir de blaſme, Soit ſans corruption tant du corps que de l’ame:	Comme il faut en tous lieux Qu'une nymphe d'esprit, pour s'affranchir de blâme, Soit sans corruption tant du corps que de l'âme:
Tout de meſme la mort jamais ne ſe corrompt Par menaces, preſent, ny vœu tardif, ou prompt:	Tout de même la mort jamais ne se corrompt Par menaces, présent, Seigneur vœu tardif, ou prompt:
Ains de ſon dard fatal enfonce dans ſa barque Sans eſgard jeune, viel, rustaut bourgeois, Monarque, L’on lit aux gestes preux d’Alexandre le grand Que comme il ſ'en alloit par les Indes trollant, Dans des deſerts cauez il treuua les Brachmanes, Philoſophes deffaits, haüres comme des Manes Deſquels il ſ'informa ce qu’ils voudroient de luy, Leur jurant que d’entr'-eux il ny auroit celuy Qui librement n’obtint toute choſe requiſe, Fut elle de valeur extremement exquiſe.	Ain de son dard fatal enfonce dans sa barque Sans égard jeune, viel, rustaut bourgeois, Monarque, L'on lit aux gestes preux d'Alexandre le grand Que comme il s'en allait par les Indes trollant, Dans des déserts cavés il trouva les Branges, Philosophes défaits, haïrez comme des Manes Desquels il s'informa ce qu'ils voudraient de Seigneur, Leur jurant que il allant-eux il il aurait celui Qui librement n'obtint toute chose requise, Fait elle de valeur extrêmement exquise.
Sire, reſpondent-ils, à la pluralité, Nous ne demandons rien que l’immortalité.	Sire, répondent-ils, à la pluralité, Nous ne demandons rien que l'immortalité.
Quoy?	Quoi?
l’immortalité!	l'immortalité!
je ne ſcache perſonne, Qui ce qu’il n’aura pas à d’autres gens le donne.	je ne sache personne, Qui ce qu'il n'aura pas à d'autres gens le donne.
Ie ſuis Roy, mais mortel:	Je suis Roi, mais mortel:
mortel ainſi que vous.	mortel ainsi que vous.
Vous ne pouuez auoir donc ce bien-là ut nom.	Vous ne pouvez avoir donc ce bien-là ut nom.
Mes erres je reprens.	Mes erres je reprends.
Le front de la pucelle D’abſinthe enchapellé (plante dont la parcelle Retient du fiel amer de degouſtable gouſt) Monſtre combien la mort est aſpre juſqu'au bout	Le front de la pucelle D'absinthe enchapellé (plante dont la parcelle Retient du fiel amer dé degoustable goût) Montre combien la mort est âpre jusqu'au bout
Et ces taſches de ſang, qui la rendent difforme, Sont des vices d’aucuns la monſtrueuſe forme.	Et ces tâches de sang, qui la rendent difforme, Sont des vices d'aucuns la monstrueuse forme.
Quoy que ce ſoit en bloc, on a beau ſ'enfierir, Deffendre, dilayer, il nous faut tous mourir.	Quo que ce soit en bloc, on a beau s'enfierir, Défendre, dilayer, il nous faut tous mourir.
Naguere nous auions vn perſonnage rare, Que la felonne mort taquinement auare, Rauit à nostre dam (Dieu luy ayant permis, Afin qu’il fut au Ciel de la terre tranſmis) C’eſtoit le Parangon des reuerends Antifles, Que nous pleurons au cœur, tant nous en ſommes triſtes.	Naguère nous avions un personnage rare, Que la félonne mort taquinement avare, Ravit à notre dam (Dieu était ayant permis, Afin qu'il fut au Ciel de la terre transmis) C'était le Parangon des révérends Antifles, Que nous pleurons au cœur, tant nous en sommes tristes.
Crainte que ſon ſainct parc ne ſ'en aille perdant, Orphelin de berger en ſon parc reſident, Nous ſommes conuoquez pour en creer vn autre, Nous y portans reſouts, ſuiuant la charge noſtre.	Crainte que son saint parc ne s'en aille perdant, Orphelin de berger en son parc résident, Nous sommes convoquez pour en créer un autre, Nous y portant résouts, suivant la charge notre.
Tel troupeau ſans paſteur encourroit grand danger Que Satan impiteux ne vint le rauager, Tournoyant (tout-ainſi qu'vn lion trotte-voye) Pour trainer aux Enfers vne ſi chere proye.	Tel troupeau sans pasteur encourrait grand danger Que Satan impiteux ne vint le ravager, Tournoyant (tout-ainsi qu'un lion trotte-voie) Pour trainer aux Enfers une si chère proie.
Dieu preuoyant cela, comme il ayme les ſiens, Pour noüer en la foy les peuples lyciens, Vn Ange deſcendit deſſus noz arbitrages, Qui nomma rondement, ſans friuolles ambages, Celuy que Dieu vouloit qui ſuccedaſt aprés, Signe vray qu’au deſtroit il ſoulage de prés.	Dieu prévoyant cela, comme il aime les siens, Pour noüer en la foi les peuples lyciens, Un Ange descendit dessus nos arbitrages, Qui nomma rondement, sans frivoles ambages, Celui que Dieu voulait qui succédât après, Signe vrai qu'au détroit -il soulage de près.
Ie croy que ce ſoit vous.	Je crois que ce soit vous.
S.	S.
NICOLAS.	NICOLAS.
Qu'elle nouuelle!	Qu'elle nouvelle!
CLARIVS.	CLARIVS.
Heureuſe au prejugé de ma lourde ceruelle.	Heureuse au préjugé de ma lourde cervelle.
Comment auez-vous nom?	Comment avez-vous nom?
Nicolas.	Nicolas.
S.	S.
NICOLAS.	NICOLAS.
dutulas.	dutulas.
CLARIVS.	CLARIVS.
Nicolas.	Nicolas.
S.	S.
NICOLAS.	NICOLAS.
CLARIVS Ceſt donc vous.	CLARIVS Cest donc vous.
S.	S.
NICOLAS.	NICOLAS.
Pourquoy?	Pourquoi?
nobles Prelats.	nobles Prélats.
CLARIVS.	CLARIVS.
Pour ce que Dieu le veut.	Pour ce que Dieu le veut.
Scachez qu’il nous feit dire, Que tel entrant premier, il le failloit eſlire.	Scachez qu'il nous feyt dire, Que tel entrant premier, il le fallait élire.
S.	S.
NICOLAS.	NICOLAS.
Mais Dieu veut-il forcer noſtre nariue humeur?	Mais Dieu veut-il forcer notre narive humeur?
Non.	Non.
