Mais je ne trouve rien de plus ſenſible aux hommes, Que lors que s’efforçant de faire de tels choix, Qu'ils puiſſent à leur gré regler ſelon leurs loix, Et franchir les premiers ce chu touilleux paſſage, Où, comme dans un fort, ſe tient le pucelage, Ils ſentent, mais trop tard, en ſe voyant deçüs, Qu’ils marchent à grands pas dans des chemins battus.	Mais je ne trouve rien de plus sensible aux hommes, Que lors que s'efforçant de faire de tels choix, Qu'ils puissent à leur gré régler selon leurs lois, Et franchir les premiers ce chu touilleux passage, Où, comme dans un fort, se tient le pucelage, Ils sentent, mais trop tard, en se voyant de, Grails marchent à grands pas dans des chemins battus.
Regardés Polidor, Menandre & Damon meſme;	Regardez Polidor, Ménandre et Damon même;
D'où leur vient ſi ſoudain un teint triste & ſi bleſme?	D'où leur vient si soudain un teint triste et si blême?
Yvant leur mariage, ils l'avoient ſi fleuri:	Yvant leur mariage, ils l'avaient si fleuri:
Eſt-ce un effet en eux, de ce nom de mari?	Est-ce un effet en eux, de ce nom de mari?
Non, mais penſant cueillir cette fleur eſtimable, Qui nous rend le beau fexe attraiant & aimable, Ils ne l’ont plus trouvée;	Non, mais pensant cueillir cette fleur estimable, Qui nous rend le beau sexe attrayant et aimable, Ils ne l'ont plus trouvée;
Et leur eſprit trompé, Craignant d’eſtre toüjours de plus en plus dupé, Leur donne ce chagrin & cette inquietude, Qu’ils tâchent, mais en vain, de cacher par étude.	Et leur esprit trompé, Craignant d'être toujours de plus en plus dupé, Leur donne ce chagrin et cette inquiétude, Qu'ils tâchent, mais en vain, de cacher par étude.
Interrogés Menandre, à qui tout recemment, Un fâcheux meſſager, redoublant ſon tourment, Lui vient de ſa moitié dé couvrir une acrõche.	Interrogez Ménandre, à qui tout récemment, Un fâcheux messager, redoublant son tourment, Lui vient de sa moitié de couvrir une acrõche.
Avec certain crochet ſon voiſin de la Proche, Helas!	Avec certain crochet son voisin de la Proche, Hélas!
nous direit-il, d’un ton de complaignant S’il oſoit entre nous parler ingenſment:	nous direit-il, d'un ton de complaignant S'il osait entre nous parler ingentsment:
He!	He!
qui me l’auroit dit, & qui l’auroit pû croire, Que l'on pût de ſes mœurs ſi bien cacber l’hiſtoiQu'ont * Ce crochet eſt un certain Cuiſinier avec lequel la femme de Menandre ceu grannes pamme.	qui me l'aurait dit, et qui l'aurait pu croire, Que l'on pût de ses mœurs si bien cacber l'histoiQu une * Ce crochet est un certain Cuisinier avec lequel la femme de Ménandre ceu nés pamme.
Qu’on prît pour innocente un femme en amours.	Qu'on prît pour innocente un femme en amours.
Qui par experience en ſavoit les détours?	Qui par expérience en savait les détours?
Voilà, pauvres maris, comment on nous afronte, En chargeant nôtre front d’un bois pour nostre honte, Qui du plus grand honneur pourroit ternir l'éclat.	Voilà, pauvres maris, comment on nous afronte, En chargeant notre front d'un bois pour notre honte, Qui du plus grand honneur pourrait ternir l'éclat.
Coquine!	Coquine!
falloit-il me joüer ce tour-là?	fallait-il me jouer ce tour-là?
On me l’avoit bien dit que ces filles errantes De pais en païs, & chez les Grands ſervantes;	On me l'avait bien dit que ces filles errantes De pais en pays, et chez les Grands servantes;
Donnoient lieu de douter de leur integrité:	Donnaient lieu de douter de leur integrité:
Mais, mon eſprit bouché ne l’a point écouté.	Mais, mon esprit bouché ne l'a point écouté.
Jeunes gens, profités de l’avis qu’on vous donne, eux-tu que ta mottie joii houners perſonne :	Jeunes gens, profités de l'avis qu'on vous donne, eux-tu que ta mottie joi houners personne :
Il faut la prendre telle, & ſon honnêteté Maintiendra ton honneur, toûjours en ſeureté.	Il faut la prendre telle, et son honnêteté Maintiendra ton honneur, toujours en sûreté.
BELISE.	BELIZE.
l'en trouve la fin bien morale, & ne ruis rien la dedauis dont nous puiſſions nous offenſer.	l'en trouve la fin bien morale, et ne ruis rien la dédavis dont nous puissions nous offenser.
C’eſt une Satire tontre l’infidelité des femmes, & nous ne ſommes pas encore dans ce rang-là Climene ni moi.	C'est une Satire tontre l'infidélité des femmes, et nous ne sommes pas encore dans ce rang-là Climène ni moi.
DORINE.	DORINE.
Ni moi non plus;	Ni moi non plus;
mais j’y vois pourtant je ne ſçai quelle invective contre nôtre Sexe en general de l’alliance duquel il tâche de dégoûter les hommes, & une injuſtice en particulier qu’on nous fait contre laquelle il faut nous récrier.	mais j'y vois pourtant je ne sais quelle invective contre notre Sexe en général de l'alliance duquel il tâche de dégoûter les hommes, et une injustice en particulier qu'on nous fait contre laquelle il faut nous récrier.
Et c’eſt que les hommes qui en toute autre occaſion pouſſent leur complaiſance pour nous juſques à l’excés, en manquent dans le le ſeul point où ils en devroient le plus avoir, je veux dire en ce qui regarde nôtre honneur.	Et c'est que les hommes qui en toute autre occasion poussent leur complaisance pour nous jusques à l'excès, en manquent dans le le seul point où ils en devraient le plus avoir, je veux dire en ce qui regarde notre honneur.
Si une pauvre fille ſuccombe aux foibleſſes de la chair, tout le monde s’éleve contre elle, & perſonne ne lui pardonne, & ſous pretexte qu’elle n’a plus ce je ne ſçai quoi où l’on attache mal à propos ſon honneur, la voilà perduë, c’eſt fait de ſa fortune.	Si une pauvre fille succombe aux faiblesses de la chair, tout le monde s'élève contre elle, et personne ne lui pardonne, et sous prétexte qu'elle n'a plus ce je ne sais quoi où l'on attache mal à propos son honneur, la voilà perdue, c'est fait de sa fortune.
Et les hommes franchiſſent le même pas, ſans qu’on leur diſe rien.	Et les hommes franchissent le même pas, sans qu'on leur dise rien.
De dix ou douze qui ſe marient, peut-être qu’il y en aplus des deux tiers qui ſe ſont divertis avec les filles de joye;	De dix ou douze qui se marient, peut-être qu'il y en applus des deux tiers qui se sont divertis avec les filles de joie;
Et cependant bien loin de les blâmer, on les regarde comme de Vaillans Athletes, qui ont déja acquis quelque expérience dans la carriere qu’ils doivent fournir, eſt-ce pas là la plus grande de toutes les injuſtices?	Et cependant bien loin de les blâmer, on les regarde comme de Vaillants Athlètes, qui ont déjà acquis quelque expérience dans la carrière qu'ils doivent fournir, est-ce pas là la plus grande de toutes les injustices?
Et ſi les fautes qui viennent de foibleſſe, ſont pardonnables, je ne vois pas que nous loyons plus coupables que les hommes, qui ont ſans contredit, beaucoup plus de force que nous, pour reſiſter à la tentation.	Et si les fautes qui viennent de faiblesse, sont pardonnables, je ne vois pas que nous loyons plus coupables que les hommes, qui ont sans contredit, beaucoup plus de force que nous, pour résister à la tentation.
CELIMENE.	CELIMENE.
Vous avés raiſon, ma Couſine, vous le prenés fort-bien.	Vous avez raison, ma Cousine, vous le prenés fort-bien.
Je n’avois point encore fait reflexion là-deſſus, & ſi ces Dames m’en veulent croire, nous apellerons de cette injuſte Sentence, qui condamne ſans raiſon nôtre honneur.	Je n'avais point encore fait réflexion là-dessus, et si ces Dames m'en veulent croire, nous appelerons de cette injuste Sentence, qui condamne sans raison notre honneur.
CLI	CLI
CLIMENE.	CLIMENE.
Pour moi, je ne ſuis pas d’avis qu’on en faſſe le moindre éclat.	Pour moi, je ne suis pas d'avis qu'on en fasse le moindre éclat.
On diroit que hous teutant coupables, nous voulons nous excuſer.	On dirait que hous teutant coupables, nous voulons nous excuser.
De.	De.
SUZON.	SÙZON.
Tout ce qu’il y a â faire, c’eſt de ſçavoir qui eſt l’Auteur de ces vers là, pour Iui rendre la pareille.	Tout ce qu'il y a ât faire, c'est de savoir qui est l'Auteur de ces vers là, pour Jui rendre la pareille.
On m’a dit que c’étoit Ariſte, & je croi que l’on dit vrai, car ils ont du raport à ceux que ma Soeur nous a déja lûs de ſa facon.	On m'a dit que c'était Ariste, et je crois que l'on dit vrai, car ils ont du rapport à ceux que ma Soeur nous a déjà lus de sa façon.
BCEANCMONO Sans doute, c’eſt lui;	BCENCONO Sans doute, c'est lui;
je ſçai qu’il eñ ſcait faire.	Je sais qu'il eût sait faire.
DORINE.	DORINE.
Qui Ariſte?	Qui Ariste?
Ah!	Ah!
vraîment je ne ſçay comment il s’avife de mordre ſur les autres, lui qui donne plus de priſe que pas un, ſur ſa conduite.	vraîment je ne sais comment il s'avisse de mordre sur les autres, lui qui donne plus de prise que pas un, sur sa conduite.
CELIMENE.	CELIMENE.
Ma Couſine, vous qui le connoiſtés, faites-nous un peu ſon portrait, & nous Ie lui enverrons par forme d’avis.	Ma Cousine, vous qui le connoistés, faites-nous un peu son portrait, et nous Je lui enverrons par forme d'avis.
DORINE.	DORINE.
Vraîment, ſi je voulois le faire paſſer par l'étamine, je trouverois ſon chapitre aſſés abondant pour fournir à une ample Satire.	Vraîment, à une voulois le faire passer par l'étamine, je trouverais son chapitre assez abondant pour fournir à une ample Satire.
Qu’il y auroit un beau champ à diſcourir de ſon enluminure, de ſes frequentes beuvetes, de ſa delicateſſe, & de ſon eſprit capricieux & contrariant.	Qu'il y aurait un beau champ à discourir de son enluminure, de ses fréquentes buvetes, de sa délicatesse, et de son esprit capricieux et contrariant.
BELISE.	BELIZE.
On m’a dit que c’étoit un aſſés joli eſpit en converfation.	On m'a dit que c'était un assez joli épit en conversation.
DORINE.	DORINE.
Cela eſt vrai;	Cela est vrai;
mais dans le dérail de ſa conduite, il fait pitié, Et avec ſon bel eſprit il n’a pû encore rien faire:	mais dans le dérail de sa conduite, il fait pitié, Et avec son bel esprit il n'a pu encore rien faire:
les coups de rungue qu’il domne au tiers & au quart, lui ont fait manquer deux ou trois fois ſa for	les coups de rungue qu'il domne au tiers et au quart, lui ont fait manquer deux ou trois fois sa for
tune.	tune.
CELIMENE.	CELIMENE.
Qu’il exerce ſon eſprit Satirique ſur d’autres que ſur nous.	Qu'il exerce son esprit Satirique sur d'autres que sur nous.
D’où vient qu’il n’a encore rien dit d’Eliante, qui s’eſt fait un merite de ſon garçon marchand, & qui ſe plaît dans ſa compagnie, tandis que ſon pauvre mari eſt renvoyé à l’écart comme un ſaint que perſonne ne reclâme.	D'où vient qu'il n'a encore rien dit d'Éliante, qui s'est fait un mérite de son garçon marchand, et qui se plaît dans sa compagnie, tandis que son pauvre mari est renvoyé à l'écart comme un saint que personne ne réclame.
Elle lui affait prendre depuis peu, une Perruque à la Cavaliére, mais ſon air nonchalant & ſa mine niaiſe le rendent encore plus ſot.	Elle lui affait prendre depuis peu, une Perruque à la Cavaliére, mais son air nonchalant et sa mine niaise le rendent encore plus sot.
Le pauvre garçon ne ſcait pas que ce n’eſt pas un labit qui donne de l’air à un homme, mais-une certaine bonne grace qui eſt naturelle à certaines gens qui donne bon air à tout ce qu’ils porrent.	Le pauvre garçon ne sait pas que ce n'est pas un labit qui donne de l'air à un homme, mais-une certaine bonne grâce qui est naturelle à certaines gens qui donne bon air à tout ce qu'ils porrent.
De.	De.
SUZON.	SÙZON.
Et la petite Liſette, Madame, qu’en dites-vous?	Et la petite Lisette, Madame, qu'en dites-vous?
CELIMENE.	CELIMENE.
Helas!	Hélas!
la pauvreté, elle eſt bien chagrine de voir que ſon Dandin de mari ne ſcauroit plus répondre à ſes deſirs, encoIe, re, ſi Valere ce bon garçon, qui pouvoit lui rendre de grands ſe rvices, n’étoit point abſent, elle auroit dequoi ſe conſoler.	la pauvreté, elle est bien chagrine de voir que son Dandin de mari ne saurait plus répondre à ses désirs, encoIe, re, si Valère ce bon garçon, qui pouvait lui rendre de grands se rices, n'était point absent, elle aurait dequoi se consoler.
De.	De.
FANCHON.	FANCHON.
Mais que pentés-vous de Daphné, Madame?	Mais que pentez-vous de Daphné, Madame?
CELIMENE.	CELIMENE.
Son nouvel époux lui fait porter la Fontange en forme de tour, & qui fait une reſſexion de la lumiere ſur ſon front, fort propre à faire lire à un chacun ſon humeur fâcheuſe, & ſon apetit inſatiable ſur l’article.	Son nouvel époux lui fait porter la Fontange en forme de tour, et qui fait une ressexion de la lumière sur son front, fort propre à faire lire à un chacun son humeur fâcheuse, et son apétit insatiable sur l'article.
DORINE.	DORINE.
Et Belinde, ma Couſine, qu’en dites-	Et Bélinde, ma Cousine, qu'en dites-
vous.	vous.
CELIMENE.	CELIMENE.
Elle fait bien la matrone, avec ces airs de gravité qu’elle ſe donne.	Elle fait bien la matrone, avec ces airs de gravité qu'elle se donne.
je ris de voir cette ſuite de Poupées bazanées qu’elle traîne aprés elle.	je ris de voir cette suite de Poupées basanées qu'elle traîne après elle.
DORINE.	DORINE.
Ne nous moquons pas, ma Couſine, de cette couleur, elſe leur ſed blen.	Ne nous moquons pas, ma Cousine, de cette couleur, else le zed eur,
Ne contés vous pour rien l’avantage qu’elles ont d’apartenir par là au Soleil, & de porter les livrées de ce bel Aſtre.	Ne comptez -vous pour rien l'avantage qu'elles ont d'appartenir par là au Soleil, et de porter les livrées de ce bel Astre.
De.	De.
SUZON.	SÙZON.
Mais à propos de Belinde, que dites- vous, Madame, de ce nouveau venu qu’on voit avec ſon fils, dans nos aſſemblées?	Mais à propos de Bélinde, que dites- vous, Madame, de ce nouveau venu qu'on voit avec son fils, dans nos assemblées?
CLIMENE.	CLIMENE.
Il fait bien le beau Narciſſe.	Il fait bien le beau Narcisse.
On le voit de temps en temps ſe mirer dans ſa beauté comme dans un miroir, par ces frequens 2.	On le voit de temps en temps se mirer dans sa beauté comme dans un miroir, par ces fréquents 2.
avtane retours qu’il fait ſur ſoi.	autane retours qu'il fait sur soi.
Et les ſoins étudiés qu’il ſe donne, pour agencer ſa longue Perruquequi le coife en Conſeiller, lui qui eſt un marchand, font croire qu’il aime à ſe faire regarder.	Et les soins étudiés qu'il se donne, pour agencer sa longue Perruquequi le coise en Conseiller, lui qui est un marchand, font croire qu'il aime à se faire regarder.
Il ſe campe tont vis à -vis de nos Dames & ſe tient quelquefois de bout plus d’une demi-heure, comme s’il vouloit s’en faire admirer.	Il se campe tont vis à -vis de nos Dames et se tient quelquefois de bout plus d'une demi-heure, comme s'il voulait s'en faire admirer.
Je ſuis fort trompée, ou je lecrois être de l’humeur de cet amoureux de ſoi-même dont je lui ai donné le nom, qui vouloit être aimé, ſans aimer, tous ces beaux mignons en ſont logés là, ce ſont de grands admirateurs de leur propre beauté, mais de pauvres Amans.	Je suis fort trompée, ou je lecrais être de l'humeur de cet amoureux de soi-même dont je lui ai donné le nom, qui voulait être aimé, sans aimer, tous ces beaux mignons en sont logez là, ce sont de grands admirateurs de leur propre beauté, mais de pauvres Amants.
Ce n'eſt pas ce qu’il nous faut, on veut des gens qui nous aiment, & qui nous faſſent un ſacrifice de leurs cœurs, pour gagner le nôtre.	Ce n'est pas ce qu'il nous faut, on veut des gens qui nous aiment, et qui nous fassent un sacrifice de leurs cœurs, pour gagner le nôtre.
BELISE.	BELIZE.
Nous vous avons laiſſé parler, Meſdames, ſans prendre part à vôtre entretien, parce que nous ne connoiſſons pas aſſés celles ſur qui vous exercés vôtre critique.	Nous vous avons laissé parler, Mesdames, sans prendre part à votre entretien, parce que nous ne connaissons pas assez celles sur qui vous exercès votre critique.
Mais nous ſommes ſurpriſes de vous voir ainſiprendre le change, & porter à d’autres des coups que nous aurions ſouhaitté voir tomber ſur Ariſte.	Mais nous sommes surprises de vous voir ainsiprendre le change, et porter à d'autres des coups que nous aurions souhaité voir tomber sur Ariste.
DORINE.	DORINE.
Nous ne l’oublions pas, Madame;	Nous ne l'oublions pas, Madame;
Il nous eſt bien aiſé de retourner à ſon portrait & de l’achever, en diſant que c’eſt un petit Miſantrope qui trouve à redire à tout tout, & lors que les autres ne lui en donnent point de matiere, il ſe dit à ſoi même ſes propres verités.	Il nous est bien aisé de retourner à son portrait et de l'achever, en disant que c'est un petit Misantrope qui trouve à redire à tout tout, et lors que les autres ne lui en donnent point de matière, il se dit à soi même ses propres vérités.
CLIMENE.	CLIMENE.
On m’a dit qu’Aminte étoit de ſes amies, & qu’elle prenoit volontiers ſon parti:	On m'a dit qu'Aminte était de ses amies, et qu'elle prenait volontiers son parti:
ſi elle étoit ici, peut-être qu’on ne ſeroit pas ſi hardi à parler contre lui.	si elle était ici, peut-être qu'on ne serait pas si hardi à parler contre lui.
Ha !	Ha !
quand on parle du Loup, on en voit la queuë.	quand on parle du Loup, on en voit la queue.
SCENE.	SCÈNE.
V.	V.
AMINTE, CLORINE, BELISE, CLIMEME, CELIMENE, DORINE, De.	AMINTE, CLORINE, BELIZE, CLIMEME, CÉLIMENE, DORINE, De.
SUZON De.	SÙZON De.
FANCHON, GILETE.	FANCHON, GILÉTE.
AMINTE.	AMINTE.
Eſdames, nous ſommes vos trésNThumbles ſervantes.	Édames, nous sommes vos trèsNThumbles servantes.
Nous avons trouvé la porte ouverte.	Nous avons trouvé la porte ouverte.
& n’ayant vu perſonne nous avons pris la liberté d’entrer ſans lacon.	et n'ayant vu personne nous avons pris la liberté d'entrer sans lacon.
BELISE.	BELIZE.
Ho la, Gilete, ou étes-vous dohc?	Ho la, Gilète, ou êtes-vous dohc?
GILETE dans le logis.	GILETE dans le logis.
Dans la Cauiſine, Mademoiſelle,	Dans la Cavisine, Mademoiselle,
BELISE.	BELIZE.
Hé que faites-vous là ?	Hé que faites-vous là ?
DO GI.	DO GY.
GILETE.	GILÉTE.
Je prens garde au pot, de peur qu’il ne s’enfuie.	Je prends garde au pot, de peur qu'il ne s'enfuie.
BELISE.	BELIZE.
Venés ici donner des chaiſes à ces Dames.	Venez ici donner des chaises à ces Dames.
CLORINE.	CLORINE.
Madame, ne vous Incommodés pas pour l’amour de nous.	Madame, ne vous Incommodez pas pour l'amour de nous.
BELI SE à Gilette- Ne voyés-vous pas bien, Groſſiére, que ces chaiſes ſont trop petites, & qu’entre amies, on doit avoir des chaiſes égales.	BELI SE à Gilette- Ne voyez-vous pas bien, Grossière, que ces chaises sont trop petites, et qu'entre amies, on doit avoir des chaises égales.
Demeurés dans l’Antichambre, & ſi quelqu’un nous demande, venés nous avertir avant que de le faire entrer.	Demeurez dans l'Antichambre, et si quelqu'un nous demande, venez nous avertir avant que de le faire entrer.
Aprenés une bonne.	Apprenez une bonne.
fois en vôtre vie la belle maniere de ſervir Allons, Meſdames, aſſeyons nous s’il voussplaît.	fois en votre vie la belle manière de servir Allons, Mesdames, asseyons nous s'il voussplaît.
CLORINE.	CLORINE.
Aparemment, Meidames, vous étiés en entretien ſur une matiere qui vous tient au cœur, car nous vous avons vûës fort échaufées en entrant.	Aparemment, Meidames, vous étiez en entretien sur une matière qui vous tient au cœur, car nous vous avons vues fort échauffées en entrant.
CLIMENE.	CLIMENE.
Nous étions ſur le chapitre d’Ariſte, & llous ecuutions avec piaim ie panegirique que Dorine nous en faiſoit en abregé.	Nous étions sur le chapitre d'Ariste, et loulous ecutions avec piaim ie panégyrique que Dorine nous en faisait en abrégé.
Et pour moi, je leur ai dit, qu’elles ne parleroient peut-être pas ſi librement, ſi Aminte étoit ici.	Et pour moi, je leur ai dit, qu'elles ne parleraient peut-être pas si librement, si Aminte était ici.
AMINTEPourquoi, Madame!	AMINTÉPourquoi, Madame!
CLI	CLI
CLIMENE.	CLIMENE.
Parce qu’on nous a dit que vous preniés ſon parti.	Parce qu'on nous a dit que vous preniez son parti.
AMINTE.	AMINTE.
Moi, Madame, je prens le parti de la verité, & c’eſt auſſi le ſien lors qu’elle eſt de ſon côté.	Moi, Madame, je prends le parti de la vérité, et c'est aussi le sien lors qu'elle est de son côté.
Je ſçai bien qu’on accuſe Ariſte de pluſieurs choſes, mais depuis que j’ai eu ſa converſation, j’ai remarqué que c’étoit calomnie.	Je sais bien qu'on accuse Ariste de plusieurs choses, mais depuis que j'ai eu sa conversation, j'ai remarqué que c'était calomnie.
Je puis dire en effet que je n’ai vû que franchiſe & honnéteté dans ſa compagnie.	Je puis dire en effet que je n'ai vu que franchise et honnêteté dans sa compagnie.
Il eſt vrai que quand il ſe trouve parmi des Façonnieres, des Intriguantes & des Coquetres, il m’a avoüé qu’il ſe plaiſoit à les chagriner, parce qu’il eſt ennemi de leurs guimaces;	Il est vrai que quand il se trouve parmi des Façonnières, des Intriguantes et des Coquetres, il m'a avoué qu'il se plaisait à les chagriner, parce qu'il est ennemi de leurs guimaces;
Mais quand il ſe trouve parmi d’honnêtes Dames, j’ai remarqué qu’il a pour elles toute l’eſtime & le reſpect qu’on doit à leur Sexe.	Mais quand il se trouve parmi d'honnêtes Dames, j'ai remarqué qu'il a pour elles toute l'estime et le respect qu'on doit à leur Sexe.
Son plus grand malheur eſt de ſe rencontrer quelquefoisavec de certaines gens qui parlent à tort & à travers, ſans aſcvoir ce qu’ils diſent, & lui qui fait profeſſion de ſuivre en toutes choſes la raiſon & la verité, voyant que ce ſont des gens qui ne lui ſont en rien Superieurs, ne ſauroit s’empêcher de leur rompre en viſiére;	Son plus grand malheur est de se rencontrer quelquefoisavec de certaines gens qui parlent à tort et à travers, sans ascevoir ce qu'ils disent, et lui qui fait profession de suivre en toutes choses la raison et la vérité, voyant que ce sont des gens qui ne lui sont en rien Supérieurs, ne saurait s'empêcher de leur rompre en visiére;
& c’eſt-là ce qui luy fait tant d’ennemis.	et c'est-là ce qui avait fait tant d'ennemis.
Mais je vous laiſſe à penſer, Meſdames, ſi le ſilence d’un honnête homme dans ces occaſions ne paſſeroit pas plûtôt pour une lâcheté, que pour une juſte complaiſance;	Mais je vous laisse à penser, Mesdames, si le silence d'un honnête homme dans ces occasions ne passerait pas plutôt pour une lâcheté, que pour une juste complaisance;
Et ſi les corrections qu’on doit à ceux qui s’égarent, ſur tout lors qu’ils ſont nos inferieurs & nos égaux, ne ſont pas moins des marques d’un eſprit de contradiction, que des effeis d’un amour ſicere qu’on a pour la verité.	Et si les corrections qu'on doit à ceux qui s'égarent, sur tout lors qu'ils sont nos inférieurs et nos égaux, ne sont pas moins des marques d'un esprit de contradiction, que des effis d'un amour sicère qu'on a pour la vérité.
CLORINE.	CLORINE.
Je croi auſſi que cette grande ſincerité d’Ariſte, & cette liberté qui lui eſt comme naturelle, de diré ouvert ment ce qu’il penſe, ſont la cauſe de vous ces faux bruits qu’on fait courir de lui.	Je crois aussi que cette grande sincérité d'Ariste, et cette liberté qui lui est comme naturelle, de diré ouvert ment ce qu'il pense, sont la cause de vous ces faux bruits qu'on fait courir de lui.
Car dans le fondil n’a point de malice, mais nous ſommes dans un ſiécle où il ya ſi peu de ſincéresamis de la verité, qu’on ne doit pas trouver étrange ſi elle nous fait tant d’ennemis.	Car dans le fondil n'a point de malice, mais nous sommes dans un siècle où il ya si peu de sincéresamis de la vérité, qu'on ne doit pas trouver étrange si elle nous fait tant d'ennemis.
C’elt un vice des mœurs de tous les ſiécles, & non pas un defaut qui lui ſoit perſonnel.	C'ellet un vice des mœurs de tous les siècles, et non pas un défaut qui lui soit personnel.
DORINE, Ha!	DORINE, Ha!
Meſdames, Ariſte eſt bien-heureux de vous avoir poul Tiotcetnees a pour Avocates.	Mesdames, Ariste est bienheureux de vous avoir poul Tiotcetnees a pour Avocates.
Vous deffendés ſes inté êts mieux qu’il ne feroit luy-même, quoi qu’il ſoit demi.	Vous défendez ses inté êts mieux qu'il ne ferait beau-même, quoi qu'il soit demi.
Avocat.	Avocat.
CLORINE.	CLORINE.
Je vous puis dire, Meſdames, que nous ne ſommes pas les ſeules qui en parlons avantageuſement.	Je vous puis dire, Mesdames, que nous ne sommes pas les seules qui en parlons avantageusement.
Cleante & Florimont en diſent force bien;	Cléante et Florimont en disent force bien;
Et Per iandre, qui eſt ſi reſervé, quand il s’agit de loûer, nous a dit qu’il en faiſoit cas.	Et Per jandre, qui est si réservé, quand il s'agit de louer, nous a dit qu'il en faisait cas.
