TRAGICOMEDIE PASTORALLE,	TRAGICOMEDIE PASTORALLLE,
Peut on meſme dans le bon heur Payer auecques plus d’honneur Ce que l’on doit à la Nature?	Peut on même dans le bon heur Payer avec plus d'honneur Ce que l'on doit à la Nature?
Que rainqueut, mouru renuerſe Par vne honorable aduanture Deſſus le Mur qu’on a forcé.	Que rainqueut, mouru renverse Par une honorable aventure Dessus le Mur qu'on a forcé.
O que ces fortunes ſont belles, Et que les plus ambitieux Ont raiſon de prier les cieux De leur en enuoyer de telles!	Ô que ces fortunes sont belles, Et que les plus ambitieux Ont raison de prier les cieux De leur en voyer de telles!
Iamais leur nom ne perira, Leur gloire ſe conſeruera Parmy la durée des âages, Et tout ce qui ſera de beau,	Jamais leur nom ne périra, Leur gloire se conservera Parmi la durée des âages, Et tout ce qui sera de beau,
La memoire de leurs courages La cachera dans le tombeau.	La mémoire de leurs courages La cachera dans le tombeau.
En fin Grand Prince, quoy que face Le Rebelle pour reſiſter, Il ne peuſt ſa perte eſuiter, S’il n’a recours à voſtre grace:	En fin Grand Prince, quoi que face Le Rebelle pour résister, Il ne pût sa perte éviter, S'il n'a recours à votre grâce:
Dans la faßine, & les gazons, Qu'il hauſſe plus que les maiſons, Il trouuera ſa ſepulture, Et ſa foible rebellion Nous ramnera laabaniale, Qui mit Oſſe ſur Pelion.	Dans la fassine, et les gazons, Qu'il hausse plus que les maisons, Il trouvera sa sépulture, Et sa faible rébellion Nous ramnera laabaniale, Qui mit Osse sur Pélion.
Deſia l’excez de cette audace Qui les auoit faict mutiner, Commence de ſe ruiner, Leur orgueil peu à peu ſe paſſe:	Déjà l'excès de cette audace Qui les avait fait mutiner, Commence de se ruiner, Leur orgueil peu à peu se passe:
Ils n’vſent plus de ce propos Dont ils menaçoient le repos, Qu’ils ont troublé dans voſtre France, Vous les ſçauez ſi bien preſſer, Qu'ils n'onſt pas vn lieu de deffence, Qu'ils ne ſoient contraints de laiſſer.	Ils n'usent plus de ce propos Dont ils menaçaient le repos, Qu'ils ont troublé dans votre France, Vous les savez si bien presser, Qu'ils n'ont pas un lieu de défense, Qu'ils ne soient contraints de laisser.
Niſmes, Caſtres, & les Seuenes Où toute leur ſource s’eſtend, Quand vous les menerez batant,	Nîmes, Castres, et les Seuenes Où toute leur source s'étend, Quand vous les mènerez bâtant,
Leur ſeront des retraictes vaines, A vôtre abord tous les foſſez S’empliront de murs renuerſez Et ces rochers inacceßibles, Qu’ils diſent qu’on ne peut forcer, Fendront leurs maſſes inſenſibles, Afin de vous laißser paſſer.	Leur seront des retraites vaines, À votre abord tous les fossés S'empliront de murs renversez Et ces rochers inaccessibles, Qu'ils disent qu'on ne peut forcer, Fendront leurs masses insensibles, Afin de vous laisse passer.
Allez donc, inuincible Prince, Acheuer de les ruyner, Et par leur perte redonner Le repos à cette Prouince:	Allez donc, invincible Prince, Achever de les ruiner, Et par leur perte redonner Le repos à cette Province:
C'eſt à vous que gardent les cieux, La fin de ces ſeditieux;	C'est à vous que gardent les cieux, La fin de ces séditieux;
Les pardons ſeront inutiles Au ſalut de ces obſtinez, Si vous n'allez perdre les villes Qui retirent ces mutinez.	Les pardons seront inutiles Au salut de ces obstinez, Si vous n'allez perdre les villes Qui retirent ces mutinez.
Tant de paix qu’ils ont demandees, Et roceu de voſtre bonté, N'ont eſté qu’infidelité, Sous des aparences fardees, Apres la paix de Montpellier Ne les a t’on pas veu veiller, L’eſtoignement de voſtre armee, Pour aller prendre vos vaiſſeaux Dont la flotte eſtoit enfermee	Tant de paix qu'ils ont demandées, Et rocue de votre bonté, N'ont été qu'infidélité, Sous des apparences fardes, Après la paix de Montpelier Ne les a -t-on pas vu veiller, L'étoignement de votre armée, Pour aller prendre vos vaisseaux Dont la flotte était enfermée
Dans vn petit deſtroit des eaux?	Dans un petit détroit des eaux?
Et depuis la prace obtenuë D'vne telle meſchanceté, A quel poinct de temerité N’eſt leur inſolence venuë?	Et depuis la prace obtenue D'une telle méchanceté, À quel point de témérité N'est leur insolence venue?
Ils ont appellé l’eſtranger, Et fait effort de le loger Dedans vos ports & dans vos Iſles, Et ſans vos ſoins laborieux, Et ta vaitbrut vosdreile, Ils y ſeroient victorieux.	Ils ont appellé l'étranger, Et fait effort de le loger Dedans vos ports et dans vos Îles, Et sans vos soins laborieux, Et ta vaitbrut vosdreile, Ils y seraient victorieux.
Mais ce grand homme dont les veilles Ne ſont que pour vôtre grandeur, De qui la genereuſe ardeur Nous a fait voir tant de merueilles.	Mais ce grand homme dont les veilles Ne sont que pour votre grandeur, De qui la généreuse ardeur Nous a fait voir tant de merveilles.
RICHELIEV l’appny des autels, Et les delices des mortels, D’vne prudence plus qu’humaine Sçeuſt ſi bien ſecourir vos forts, Qu’il repdit leur deſcente vaine, Et les chaſſa loin de vos ports.	RICHELIEU l'apni des autels, Et les délices des mortels, D'une prudence plus qu'humaine Sut si bien secourir vos forts, Qu'il repdit leur descente vaine, Et les chassa loin de vos ports.
Le Ciel qui deuoit à noſtre âge Vos merueilleuſes actions, Vous deuoient les perfections De cet excellent perſonnage:	Le Ciel qui devait à notre âge Vos merveilleuses actions, Vous devaient les perfections De cet excellent personnage:
Außi nous faut il aduoüer, Qu'on ne le peut aßez loüer, Que ſes conſeils ſont des oracles, Qui donnent de l’eſtonnement, Et qui font faire des miracles Duſai l in e vanre etement.	Aussi nous faut il avouer, Qu'on ne le peut assez louer, Que ses conseils sont des oracles, Qui donnent de l'étonnement, Et qui font faire des miracles Dusai l' ai l' on etement.
Acquerez donc par la vengeance Des torts qu’ils vous ont procurez Le repos que vous deſirez De redorner à, voſtre France, Tout tremble au nom d’vn ſi grand Roy, Et le ſultan auec effroy Oyt le ſuccez de vos conqueſtes, Qui ſans nulle doute promet, Que vous deuez briſer les teſtes Des ſeruiteurs de Mahomet.	Accès donc par la vengeance Des torts qu'ils vous ont procurés Le repos que vous désirez De redorner à, votre France, Tout tremble au nom d'un si grand Roi, Et le sultan appris effroi Oit le succès de vos conquêtes, Qui sans nulle doute promet, Que vous devez briser les têtes Des serviteurs de Mahomet.
Grand Prince que les deſtinees Vous filent des iours bien-heureux, Et que vos actes genereux Vous feront des longues annees:	Grand Prince que les destinées Vous filent des jours bienheureux, Et que vos actes généreux Vous feront des longues années:
O que les races à venir Auront cher de ſe ſouuenir, De vos armes victorieuſes, Et qu’auec raiſon le diſcours, De vos conqueſtes glorieuſes Paſſera iuſqu'aux derniers iours.	Ô que les races à venir Auront cher de se souvenir, De vos armes victorieuses, Et qu'avec raison le discours, De vos conquêtes glorieuses Passera jusqu'aux derniers jours.
Außi toſt qu’on verra calmee La fureur qui trouble le corps, L’on vous verra couurir de morts Les campagnes de l’Idumes:	Aussi tôt qu'on verra calmée La fureur qui trouble le corps, L'on vous verra couvrir de morts Les campagnes de l'Idumes:
Les deſtins qui vous ſont amis Nous ont depuis long-temps promis;	Les destins qui vous sont amis Nous ont depuis longtemps promis;
Que c’eſt par voſtre ſeule eſpée, Malgré tous les empeſchements, Qu'vn iour l’on verra dißipee La puiſſance des Othomans.	Que c'est par votre seule épée, Malgré tous les empêchements, Qu'un jour l'on verra dissipee La puissance des Othomans.
O grand Roy le premier du monde Suiuez donc les loix du deſtin, Et d’où Phebus ſort le matin Iuſqu’au lieu qu’il rentre dans l’onde, Faites voir les Lys & la Croix, Et recognoiſtre aux plus grands Roys Qui commandent deſſus la terre, Qu'außsi puißsant que lupumVous auez de traits de tonnerre, Qui ne ſe peuuent eſuiter.	Ô grand Roi le premier du monde Suivez donc les lois du destin, Et d'où Phebus sort le matin Jusqu'au lieu qu'il rentre dans l'onde, Faites voir les Lys et la Croix, Et reconnaître aux plus grands Rois Qui commandent dessus la terre, Qu'avez puisssant que lupumous avez de traits de tonnerre, Qui ne se peuvent éviter.
Ainſi ne puiſſe point la Parque De vos longs iours trouuer la fin, Que de vous ne naiſſe vn Dauphin, Digne fils d’vn ſi grand Monarque:	Ainsi ne puisse point la Parque De vos longs jours trouver la fin, Que de vous ne naisse un Dauphin, Digne fils d'un si grand Monarque:
Et deuant qu’en vn age vieux, Vous alliez boire dans les Cieux	Et devant qu'en Un age vieux, Vous alliez boire dans les Cieux
Le nectar auecques vos peres, Vous nous laißiez vn heritier, Que paiſible auec pluſieurs freres, Leur partage le monde entier.	Le nectar De vos pères, Vous nous laissiez un héritier, Que paisible toujours plusieurs frères, Leur partage le monde entier.
STANCES A DAMON eontre la vanité du temps.	STANCES A DAMON être la vanité du temps.
Combien inſenſez nous ſommes, ODamon, de nous rompre l’eſprit A tracer quelque docte eſcrit, Qui paſſe iuſqu’aux derniers hommes, Et pour ce ſoin mal à propos	Combien insensés nous sommes, ODamon, de nous rompre l'esprit A tracer quelque docte écrit, Qui passe jusqu'aux derniers hommes, Et pour ce soin mal à propos
o que noſtre foibleſſe eſt grande D'esperer inutilement, De nous dreſſer vn monument, Qui contre la mort nous deffende:	ô que notre faiblesse est grande D'espérer inutilement, De nous dresser un monument, Qui contre la mort nous défende:
Elle eſt plus ſourde qu’vn rocher, Et rien ne la ſçauroit toucher.	Elle est plus sourde qu'Hommes rocher, Et rien ne la saurait toucher.
Les plus poltrons & les plus braues Sont emportez d’elle ſans choix, Et d’vn meſme coup que les Roys, Elle fait mourir les eſclaues.	Les plus poltrons et les plus braves Sont emportés d'elle sans choix, Et d'un autre coup que les Rois, Elle fait mourir les esclaves.
Les Dieux meſmes ne peuuent pas Exempter quelqu'vn du trespas.	Les Dieux mêmes ne peuvent pas Exempter quelqu'un du trépas.
Tout tombe ſous ſa dent meurtrie:	Tout tombe sous sa dent meurtrie:
Homere & Virgile ſont morts, Et leurs eſcripts comme leurs corp Yront vn iour deſſous la biere:	Homère et Virgile sont morts, Et leurs écripts comme leurs corp Yront un jour dessous la bière:
L’homme n’eſtant point immortel, Ne ſçauroit faire rien de tel.	L'homme n'étant point immortel, Ne saurait faire rien de tel.
Et toutesfois noſtre folie, Nous fait vainement eſperer Vne gloire qui doit durer Sans iamais eſtre enſeuelie, Si nous acquerons quelque bruit, En nous trauaillant iour & nuict.	Et toutefois notre folie, Nous fait vainement espérer Une gloire qui doit durer Sans jamais être ensevelie, Si nous acquérons quelque bruit, En nous travaillant jour et nuit.
Non, non, quand bien les deſtinees Amoureuſes des beaux eſprits Feroient paſſer tous leurs eſcripts Iuſques aux dernieres annees, Enfermez dans le monument, Ils n'en ont point de ſentiment.	Non, non, quand bien les destinées Amoureuses des beaux esprits Feraient passer tous leurs écripts Jusques aux dernières années, Enfermés dans le monument, Ils n'en ont point de sentiment.
Et la gloire que l’on ottroye Aux vers de l’aueugle eſcriuain, Eſt vn payement auſſi vain, Que les noms d’Helene & de Troye, Ou ce qu’il dict des dieux bleſſez Et par vn ſeul homme chaſſez Il n'en a point de cognoiſſance, Non plus que des debats fameux, Dont les Grecs ſe virent émeus Touchant le lieu de ſa naiſſance, Et ne luy chaut point, en repos, Ou que ſoint enterrez ſes os.	Et la gloire que l'on ottroie Aux vers de l'aveugle écrivain, Est un payement aussi vain, Que les noms d'Hélène et de Troie, Ou ce qu'il dit des dieux blessés Et par un seul homme chassés Il n'en a point de connaissance, Non plus que des débats fameux, Dont les Grecs se virent émus Se virent émus de sa naissance, Et ne lui chaut point, en repos, Ou que soint enterrez ses os.
Viuons loin de ces ſoins eſtranges, Les plus aiſes que nous pourrons, Que ſi tandis que nous viurons, L’on nous donne quelques loüanges, Iouiſſons allors de ce bien, Car apres nous n’en ſentons rien.	Vivons loin de ces soins étranges, Les plus aises que nous pourrons, Que si tandis que nous vivrons, L'on nous donne quelques louanges, Jouissons allors de ce bien, Car après nous n'en sentons rien.
Sur le paſſage de l’autheur par le haut Viuarés.	Sur le passage de l'auteur par le haut Viuarés.
STANCES.	STANCES.
Es chemins par où i’ay paßé, ESont des montagnes heriſſees De grands rocs, dont le front glacé Porte iuſques au ciel ſes cornes verniſſees.	Es chemins par où j'ai passé, ESont des montagnes hérissées De grands rocs, dont le front glacé Porte jusques au ciel ses cornes vernissées.
e	Je
Là contre l’ordre des climats Ou chaque ſaiſon eſt bornee, Les bruines & les frimats De nege & de glarons forment toute l’annee.	Là contre l'ordre des climats Ou chaque saison est bornée, Les bruines et les frimats De nege et de glarons forment toute l'année.
Bacchus s'y cache des paſſants, Dans le ventre velu d’vn outre, Ceres ſans temple & ſans encens Ny voit iamais vſer de faucille, ou de coutre.	Bacchus s'y cache des passants, Dans le ventre velu d'un outre, Ceres sans temple et sans encens Ny voit jamais user de faucille, ou de coutre.
Quelques raues ſont la moiſſon, La plus riche que l’on y cueille, Les logis y ſont de façon,  nioict fait de genet y couure vn lict de fueit	Quelques raves sont la moisson, La plus riche que l'on y cueille, Les logis y sont de façon, niait fait de genet y couvre un lit de fueit
A CALLISTE.	À CALISTE.
N Alliſte ſi iamais tu trouuas rien en mon  Qui meritaſt l’honneur d’eſtre eſtimé de tu Si iamais mon genie a rien eu qui te plaiſe, Les dieux dedans le ciel enuieront mon aiſe, Ma fortune au deſſus du reſte des mortels Me feroit meſpriſer l’encens & les autels, Ton accueitus eſt plus cher, t'efttine plus ta è	 Nlliste si jamais tu trouvas rien en mon Qui méritât l'honneur d'être estimé de tu Si jamais mon génie a rien eu qui te plaise, Les dieux dedans le ciel envieront mon aise, Ma fortune au dessus du reste des mortels Me ferait mépriser l'encens et les autels, Ton accueitus est plus cher, t'efletine plus ta 
Que ſi i’eſtois ſorti d’vne Royale race, Vne heure d'entretien auec toy me vaut mieux Que d’eſtre vn ſiecle entier à l’entretien des Dieux, C’eſt là que cette ardeur, qui nous eſchauffe l’ame Trouue de nourriture à r'auiuer ſa flame, C’eſt là que mon eſprit ſe deslie & s’eſtend, Et trouue aupres de toy ce qu’il a cherché tant, Ce Demon vigoureux que l’on voit dans l’ouurage Du plus puiſſant eſprit qui ſoit né de noſtre àge, Ce genie autrefois incognu dans les vers, A-il quelques ſecrets qui ne te ſoient ouuerts?	Que si j'étais sorti d'une Royale race, Une heure d'entretien se toi me vaut mieux Que d'être siècle entier à l'entretien des Dieux, C'est là que cette ardeur, qui nous échauffe l'âme Trouve de nourriture à rauiuer sa flamme, C'est là que mon esprit se délie et s'étend, Et trouve auprès de toi ce qu'il a cherché tant, Ce Démon vigoureux que l'on voit dans l'ouvrage Du plus puissant esprit qui soit né de notre propre, Ce génie autrefois incognu Acon nu vers, A-il les secrets qui ne te soient ouuerts?
Les meilleurs ſentimens partent de ton eſcole, Tu donne l’ame aux mots, la force à la parole, En fin tout ce qui doit eſtre franc du tombeau, Tout ce qu’vn long trauail peut produire de beau, Et tout ce que l’on voit de ces fameux genies, Dont les vieux ſiecles ont les trames des-vnies, N’ont nien de comparable au moindre des diſcours Où l’entretien commun t’engage tous les iours:	Les meilleurs sentiments partent de ton école, Tu donne l'âme aux mots, la force à la parole, En fin tout ce qui doit être franc du tombeau, Tout ce qu'un long travail peut produire de beau, Et tout ce que l'on voit de ces fameux génies, Dont les vieux siècles ont les trames des-je, N'ont nien de comparable au moindre des discours Où l'entretien commun t'engage tous les jours:
Bien heureux ſi i’auoy durant mon infortune Auecques tes valets cette grace commune, Que ie les peuſſe ouïr auecques liberté, Et iouïr de l’obiect de ta rare beauté, Dans tes raiſonements ie formeroy mon ame, Mais le deſtin m’a fait vne plus dure trame.	Bien heureux si j'avais durant mon infortune Avecques tes valets cette grâce commune, Que ie les pusse ouïr auecques liberté, Et jouir de l'objet de ta rare beauté, Dans tes raisonements ie formerai mon âme, Mais le destin m'a fait une plus dure trame.
Ennemy coniuré qu’il eſt de mes plaiſirs, Il choque en cent façons mes ſoins & mes deſirs:	Ennemi conjuré qu'il est de mes plaisirs, Il choque en cent façons mes soins et mes désirs:
Des qu'vn petit rayon de bon heur me veut luire:	Des qu'un petit rayon de bon heur me veut luire:
Il ſemble qu’il ait pris à tache de me nuire, Quoy qu’il face pourtant il ne peut me rauir Le deſſein que mon ame a faict de te ſeruir Ta beauté qui n’eſt point ſubiette aux loix mortellet Ne fait point naiſtre auſsi des affections telles, Et ce vieil aſaſsin qui doit perdre les cieux N’aura iamais de droict ſur les coups de tes yeux.	Il semble qu'il ait pris à tache de me nuire, Quoi qu'il face pourtant il ne peut me ravir Le dessein que mon âme a fait de te servir Ta beauté qui n'est point sujet aux lois mortellet Ne fait point naître aussi des affections telles, Et ce vieil asassin qui doit perdre les cieux N'aura jamais de droit sur les coups de tes yeux.
Car cette opinion où le commun s’engage Iamais ſur ton esprit n’euſt aucun aduantage, La pompe des habits & la ſuite d’vn train Peuuent moins deſſus toy que le bois ſur l’airain, Et cet eſclat pipeur de l’or & de la ſoye Qui ſe faict en tous lieux vne facile voye, Qui rompt les amitiez, faict violer la foy, Calliſte n’euſt iamais aucun pouuoir ſur toy, Ton ame d’vne trempe entierement diume En tout ce qu’elle fait marque ſon origine, Et ie ſuis ſi certain de cette verité Que ie mettrois pluſtoſt en doute la clairté:	Car cette opinion où le commun s'engage Jamais sur ton esprit n'eût aucun avantage, La pompe des habits et la suite d'un train Peuvent moins dessus toi que le bois sur l'airain, Et cet éclat pipeur de l'or et de la soie Qui se fait en tous lieux une facile voie, Qui rompt les amitiés, fait violer la foi, Calite n'eût jamais aucun pouvoir sur toi, Ton âme d'une trempe entièrement diume En tout ce qu'elle fait marque son origine, Et ie suis si certain de cette vérité Que ie mettrois plustost en doute la clairté:
Ie cognoy des eſprits qui craindroient du reproche, Dés qu'auec deux valets, vn homme les aproche Qui leur parle d’amour & louë leur beauté, S’ils ne luy donnoient point vn peu de prluauté, Quand le ciel me verroit auec plus de diſgrace, Que dans vn hoſpital i’auroy toute ma race Que parmy le trauail auec mille remords Il me faudroit chercher dequoy nourrir le corps, Il me ſeroit plus doux de faire cette vie Que de me voir reduit à viure comme amant Auecques des eſprits d’vn ſi bas ſentiment.	Je connais des esprits qui craindraient du reproche, Dès qu'avec deux valets, un homme les approche Qui leur parle d'amour et loue leur beauté, S'ils ne pou donnoient point un peu de privauté, Quand le ciel me verrait avec plus de disgrâce, Que dans un hôpital j'aurais toute ma race Que parmi le travail avec mille remords Il me faudrait chercher dequoy nourrir le corps, Il me serait plus doux de faire cette vie Que de me voir réduit à vivre comme amant Avecques des esprits d'un si bas sentiment.
ONNET, Sur l’abſence de Calliſte.	ONNNET, Sur l'absence de Caliste.
I tandis que le Ciel à mes plaiſirs contraire D Veut à mon grand regret tes otaaiez mt cacher, La curioſité te faiſoit rechercher,	I tandis que le Ciel à mes plaisirs contraire D Eut à mon grand regret tes otaïez mt cacher, La curiosité te faisait rechercher,
Tu ſçaurois qu’on ne peuſt aux ennuis m’arracher, Que iefuy msums quimen peuant aſtraire, Et que ie ne vy plus qu'en vn lieu ſolitaire Où rien que la douleur n’oſeroit m’approcher.	Tu sçaurois qu'on ne pût aux ennuis m'arracher, Que cafui mums quimen peuant astraire, Et que sans ne vi plus qu'en un lieu solitaire Où rien que la douleur n'oserait m'approcher.
La de mes triſtes yeux vne eternelle ſource, Qui des ruiſſeaux voiſins rend plus forte la courſe, Auec mille ſouspirs diſtille inceſſamment.	La de mes tristes yeux était éternelle source, Qui des ruisseaux voisins rend plus forte la course, Avec mille soupirs distille incessamment.
Et ſi tume voyois Calliſte en ceſte peine De quelque cruauté dont ton ame ſoit pleine, Ton retour me rendroit bien toſt heureux amant.	Et si tume voyais Calliste en cette peine De quelque cruauté dont ton âme soit pleine, Ton retour me rendrait bien tôt heureux amant.
Sur le meſme ſubiect.	Sur le même sujet.
Greables Nymphes des eaux TAHumides ſources des ruiſſeaux, Aidez moy dans ceſte aduanture, Car Calliſte en quittant ces lieux A mis en peine la Nature De fournir de pleurs à mes yeux.	Gréables Nymphes des eaux TAHumides sources des ruisseaux, Aidez moi dans cette aventure, Car Calliste en quittant ces lieux A mis en peine la Nature De fournir de pleurs à mes yeux.
Ouurez vous pour me ſecourir Rochers qui touſiours ſans tarir Humectez voſtre maſſe dure, Car Calliſte en quittant ces lieux A mis en peine la nature De fournir de pleurs a mes yeux.	Ouvrez -vous pour me secourir Rochers qui toujours sans tarir Humectez votre masse dure, Car Calliste en quittant ces lieux A mis en peine la nature De fournir de pleurs a mes yeux.
Peupliers, ſaules, pres verdoyans Dans l’eau vos racines noyans Preſtez moy vôtre nourriture Car Calliſte enquittant ées tieux A mis en peine la nature Do fournir de pleurs à mes yeux.	Peupliers, saules, pres verdoyan Dans l'eau vos racines noyant Prêtez moi votre nourriture Car Calliste enquittant ées tieux A mis en peine la nature Do fournir de pleurs à mes yeux.
Mais helas!	Mais hélas!
durant ces malheurs Qui me pourroit fournir les pleurs, Qu'il me faut verſer à toute heure, Puiſque Calliſte hors de ces lieux Amis en peine la nature D'an fournir aſſez à mes yeux.	durant ces malheurs Qui me pourrait fournir les pleurs, Qu'il me faut verser à toute heure, Puisque Calliste hors de ces lieux Amis en peine la nature D'an fournir assez à mes yeux.
Que ſi mon mal eſt à ce point, Demons he!	Que si mon mal est à ce point, Demons hé!
ne ſcauries vous point Pour mon ſecours quelque impoſture?	ne sauriez -vous point Pour mon secours quelque imposture?
Puiſque Calliſte hors de ces lieux Amis en peine la nature De fournir de pleurs à mes yeux.	Puisque Calliste hors de ces lieux Amis en peine la nature De fournir de pleurs à mes yeux.
Voila ce qu'Alcidon diſoit, Voila ce qu'Alcidon faiſoit, Ayant ſon ame à la torture, Quand Calliſte en quittant ces lieux Euſt mis en peine la nature De fournir de pleurs à ſes yeux.	Voilà ce qu'Alcidon disait, Voilà ce qu'Alcidon faisait, Ayant son âme à la torture, Quand Calliste en quittant ces lieux Eût mis en peine la nature De fournir de pleurs à ses yeux.
s La Nen ay	s La Nen ai
au ſieur de ſainct Leon.	au sieur de saint Léon.
Ainct Leon ſi les curieux O Veulent ſçauoir ou ie reſpire Dy leur qu’vne beauté m’arreſte en vn e empire Où i’ay pour cõpagnons, ou pour riuaux des dieux.	Ainct Léon si les curieux Ô Veulent savoir ou ie respire Dis leur qu'une beauté m'arrête en un e empire Où j'ai pour compagnons, ou pour rivaux des dieux.
Où de iour nous trouuons la nuict Deſſous les iaſmins & les roſes, Où l’ardeur du ſoleil qui bruſle toutes choſez N’oſe nous approcher que pour meurir le fruict	Où de jour nous trouvons la nuit Dessous les jasmins et les roses, Où l'ardeur du soleil qui brûle toutes chosez N'ose nous approcher que pour mûrir le fruit
Oû les myrthes & les roziers Preſtent leurs branches amoureuſes Aux laſciues douceurs de ces troupes heureuſes Qui ſans honte à nos yeux esteignent leurs buuſiers.	Ou les myrthes et les rocsiers Prêtent leurs branches amoureuses Aux lasciues douceurs de ces troupes heureuses Qui sans honte à nos yeux éteignent leurs buusiers.
Où des que le ſoleil paroit Les roßignols & les linotes Font vn ſi doux concert de leurs diuerſes nótes Qu'Orphee en les oyant de honte rougiroit.	Où des que le soleil parait Les roqignols et les linotes Font un si doux concert de leurs diverses notes Qu'Orphée en les oyant de honte rougirait.
Les fleurs y naiſſent ſous nos pas, Le fruict iuſqu’en nos mains s’y panche, Et l’arbre qui le porte en deſpoüille ſa branche Pour nous les faire offrir à la fin des repas.	Les fleurs y naissent sous nos pas, Le fruit jusqu'en nos mains s'y penche, Et l'arbre qui le porte en dépouille sa branche Pour nous les faire offrir à la fin des repas.
