y mourras, tu mourras, ô fils trop temeraire Dont les feux inſenſez ont osé me déplaire.	y mourras, tu mourras, ô fils trop téméraire Dont les feux insensés ont osé me déplaire.
DN Le ſort en eſt ietté;	DN Le sort en est jeté;
Riual audacieux Ton ſang effacera le crime de tes yeux.	Rival audacieux Ton sang effacera le crime de tes yeux.
Tous les chefs du Conſeil touchez par ma presẽce Sembloient d’abord pancher vn peu vers la clemence, Mais voyant ſon trépas, enfin, par moy conclu, D’vne commune voix ils l’ont tous reſolu:	Tous les chefs du Conseil touchés par ma présence Semblaient d'abord pencher un peu vers la clémence, Mais voyant son trépas, enfin, par moi conclu, D'une commune voix ils l'ont tous résolu:
Gouſte, gouſte à longs traits les fruits de ta conqueſte, A l’Abry des lauriers qui couronnent ta teſte, Mépriſe impunément l’effect de mon courroux Ton fragile bon-heur ne me rend plus ialoux Expoſe aux yeux d’Omphale vne grande victoire, Vente luy tes hauts faits, ton éclat & ta gloire, Ces funeſtes preſens de Bellonne & du ſort Comme le chant du cigne annoncera ta mort.	Goûte, goûte à longs traits les fruits de ta conquête, A l'Ari des lauriers qui couronnent ta tête, Méprise impunément l'effet de mon courroux Ton fragile bonheur ne me rend plus jaloux Expose aux yeux d'Omphale une grande victoire, Vente-même té hauts faits, ton éclat et ta gloire, Ces funestes presens de Bellonne et du sort Comme le chant du cigne annoncera ta mort.
Mais toy que me veux-tu, ridicule tendreſſe, Importun mouuement, lâche & molle foibleſſe:	Mais toi que me veux-tu, ridicule tendresse, Importun mouvement, lâche et molle faiblesse:
Pourquoy viens-tu troubler vn cœur enuenimé Qui ne voit dans mon fils qu’vn Riual trop aimé:	Pourquoi viens-tu troubler un cœur envenimé Qui ne voit dans mon fils qu'un Rival trop aimé:
Va, ne t’expoſe plus au feu qui me poſſede Où l’amour veut regner il faut que tout luy cede.	Va, ne t'expose plus au feu qui me possède Où l'amour veut régner il faut que tout quelque Cède.
Tendreſſe, tes efforts ſont icy ſuperflus, Mon fils eſt mon Riual, ie ne le connois plus.	Tendresse, tes efforts sont ici superflus, Mon fils est mon Rival, toujours ne le connais plus.
Ie ne le connois plus;	Je ne le connais plus;
mais puis-ie méconnoiſtre, Vn fils ſi glorieux & ſi digne de l’eſtre:	mais puis-je méconnaître, Un fils si glorieux et si digne de l'être:
Celuy que ie renonce auec tant de fureur, N’eſt-il pas des Latins le ſuperbe vainqueur:	Celui que Seigneur renonce avec tant de fureur, N'est-il pas des Latins le superbe vainqueur:
Mon ſacrilege bras peut-il reduire en poudre, Vn front que les lauriers deffendent de la foudre:	Mon sacrilège bras peut-il réduire en poudre, Un front que les lauriers défendent de la foudre:
Et dois-ie en répandant vn ſang ſi precieux, Vſurper vn pouuoir qui n’appartiẽt qu’aux Dieux:	Et dois-je en répandant un sang si précieux, Usurper un pouvoir qui n'appartiment qu'aux Dieux:
Ah!	Ah!
reſpecte Conſul, vne ſi belle vie, Que d’vn prompt repentir ta rage ſoit ſuiuie, Oppoſe Rome entiere à cette iniuſte amour Qui veut le rendre indigne & d’Omphale & du iour, Et malgré cette ardeur, rends à ce fils ſi rare, Ce qu’il arracheroit de l’ame d’vn barbare, Mais où m’emportez vous, ſentiment paternel?	respecte Consul, une si belle vie, Que d'un prompt repentir ta rage soit suivie, Oppose Rome entière à cette injuste amour Qui veut le rendre indigne et d'Omphale et du jour, Et malgré cette ardeur, rends à ce fils si rare, Ce qu'il arracherait de l'âme d'un barbare, Mais où m'emportez vous, sentiment paternel?
Auez-vous oublié que ce fils criminel, Trouue dans ſes vertus ſes plus cruelles armes:	Avez-vous oublié que ce fils criminel, Trouve dans ses vertus ses plus cruelles armes:
Qu’il ſeroit moins aimé, s’il auoit moins de charmes, Et que de ſes attraits l’ineuitable effort, Apporte dans mon cœur & la rage & la mort:	Qu'il serait moins aimé, s'il avait moins de charmes, Et que de ses attraits l'inévitable effort, Apporte dans mon cœur et la rage et la mort:
Ne conſultons donc plus vne vertu timide, qui donne à cette mort l’ombre d’vn parricide:	Ne consultons donc plus une vertu timide, qui donne à cette mort l'ombre d'un parricide:
Perdons ſans balancer, vn fils ſi dangereux, Eſteignons dans ſon ſang ſes temeraires feux:	Perdons sans balancer, un fils si dangereux, Éteignons dans son sang ses téméraires feux:
Executons du ſort l’arreſt irreuocable:	Exécutons du sort l'arrêt irrévocable:
C’eſt mon Riual, on l’aime, u tituner coupable.	C'est mon Rival, on l'aime, tituner coupable.
Ho là, quelqu’vn.	Ho là, quelqu'un.
SEigueur.	SÉigueur.
SCENE II.	SCÈNE II.
TORQ VATVS, CAMILLE.	TORQ VATUS, CAMILLE.
CAMILLE.	CAMILLE.
TORQVATVS.	TORQUATUS.
Qu’on auance, Mais, Dieux!	Qu'on avance, Mais, Dieux!
Quel obiet importun ſe preſente à mes yeux?	Quel objet importun se présente à mes yeux?
Madame, quel deſſein dans ce lieu vous ameine?	Madame, quel dessein dans ce lieu vous âmeine?
CAMILLE.	CAMILLE.
Le deſir de monſtrer que Camille eſt Romaine.	Le désir de montrer que Camille est Romaine.
I’attendois que le temps, ce tiltre, & voſtre foy Vous épargnaſt l’horreur du Senat & de moy;	J'attendais que le temps, ce titre, et votre foi Vous épargnât l'horreur du Sénat et de moi;
Et croyant vn reproche indigne de mon ame D’vn œil indifferent, ie voyois voſtre flâme, Sans que ce lâche feu qui me priue de vous, Excitaſt dans mon cœur vne ombre de courroux:	Et croyant un reproche indigne de mon âme D'un œil indifférent, ie voyois votre flamme, Sans que ce lâche feu qui me prive de vous, Excitt dans mon cœur une ombre de courroux:
Mais ſçachãt à quel point vous porte voſtre rage, Que Manlius eſt preſt d’en reſſentir l’outrage, Ie viens pour empeſcher vn ſi grand attentat, Expoſer à vos yeux Camille & le Senat;	Mais sachant à quel point vous porte votre rage, Que Manlius est prêt d'en ressentir l'outrage, Je viens pour empêcher un si grand attentat, Exposer à vos yeux Camille et le Sénat;
Ie croyois que le temps diſſipaſt le nuage Qui de voſtre raiſon vous dérobe l’vſage, Et que voſtre vertu briſant voſtre priſon, Voſtre cœur ſe deuroit ſa propre gueriſon:	Je croyais que le temps dissipât le nuage Qui de votre raison vous dérobe l'usage, Et que votre vertu brisant votre prison, Votre cœur se devrait sa propre guérison:
Mais puiſque voſtre mal s’aigrit quand on le flate, Ie voy bien qu’il eſt temps que ma colere éclate, Et que de mon courroux le trop ſincere trait D’vn Decius mourant vous faſſe le portrait:	Mais puisque votre mal s'aigrit quand on le flatte, Je vois bien qu'il est temps que ma colère éclate, Et que de mon courroux le trop sincère trait D'un Décius mourant vous fasse le portrait:
Quand à tous vos deſirs voſtre ame abandonnée Veut fauſſer vne foy ſi ſaintement donnée, Auez vous oublié que mon illuſtre Epoux, Mourant pour le public, mourut auſſi pour vous?	Quand à tous vos désirs votre âme abandonnée Veut fausser une foi si sainte donnée, Avez vous oublié que mon illustre Époux, Mourant pour le public, mourut aussi pour vous?
Qu’il eſtoit innocent & paya tous vos crimes, Que ſeul il a ſerui de cent mille victimes;	Qu'il était innocent et paya tous vos crimes, Que seul il a servi de cent mille victimes;
Et que ce grand Heros, eſtoit ſi cher aux Dieux, Que ſon ſang appaiſa tout le courroux des Cieux?	Et que ce grand Héros, était si cher aux Dieux, Que son sang apaisa tout le courroux des Cieux?
Il vous a conſerué vos iours, voſtre puiſſance, Et vous vous en ſeruez pour me faire vne offence;	Il vous a conservé vos jours, votre puissance, Et vous vous en servez pour me faire une offense;
Et comme ſi l’amour n’eſtoit pas ſatisfait D'eſtie I'vnque auteur d'an miuene londit, Il demande de vous encore vn Parricide, Et voſtre eſprit conduit par cet aueugle guide, A iuré le trépas d’vn heros innocent?	Et comme si l'amour n'était pas satisfait D'étie J'unque auteur d'an mivène londit, Il demande de vous encore un Parricide, Et votre esprit conduit par cet aveugle guide, A juré le trépas d'un héros innocent?
TORQVATVS.	TORQUATUS.
De grace, finiſſez ce diſcours offençeant:	De grâce, finissez ce discours offenséeant:
Si Decius eſt mort, il eſt mort pour ſa gloire;	Si Decius est mort, il est mort pour sa gloire;
Il n’a rien fait pour nous, & tout pour ſa memoire, Trop auroient à ce prix achepté parmy nous La gloire de mourir pour le ſalut de tous;	Il n'a rien fait pour nous, et tout pour sa mémoire, Trop auraient à ce prix acheté parmi nous La gloire de mourir pour le salut de tous;
Et le plus heureux cours de la plus longue vie Ne rauit pas l’honneur dont ſa mort eſt ſuibie.	Et le plus heureux cours de la plus longue vie Ne ravit pas l'honneur dont sa mort est sujet.
Si ſon nom vous eſt cher, rendez graces au ſort, Qui ſeul a prononcé l’Arreſt de cette mort.	Si son nom vous est cher, rendez grâces au sort, Qui seul a prononcé l'Arrest de cette mort.
Celuy qui par ſa mort ſe voit ainſi renaiſtre, Doit plus à ſon bourreau qu’à l’auteur de ſon eſtre.	Celui qui par sa mort se voit ainsi renaître, Doit plus à son bourreau qu'à l'auteur de son être.
De cét heureux deſtin ne murmurez donc pas;	De cet heureux destin ne murmurez donc pas;
Voſtre Epoux luy doit tout, s’il luy doit ſon trépas.	Votre Époux Seigneur doit tout, s'il lui doit son trépas.
CAMILLE.	CAMILLE.
Des ingrats tels que vous l’vnique recompenſe, C’eſt de charger le ſort de leur reconnoiſſance;	Des ingrats tels que vous l'unique récompense, C'est de charger le sort de leur reconnaissance;
Vn ſi beau ſentiment ſur tant de biens receus, Eſt digne des deſirs que vous auez conceus;	Un si beau sentiment sur tant de biens reçus, Est digne des désirs que vous avez conçus;
Et ie deuois attendre vne réponce égale, D’vn pariure public, & de l’Amant d’Omphale.	Et deux devais attendre une réponce égale, D'un parjure public, et de l'Amant d'Omphale.
Ingrat, n’impoſez point à mon iuſte courroux, Que le ſort a cauſé la mort de mon Epoux, Il ne voulut iamais ſoûmettre à ſon caprice Le ſens de cét Oracle à ſes vœux ſi propice;	Ingrat, n'imposez point à mon juste courroux, Que le sort a causé la mort de mon Époux, Il ne voulut jamais soumettre à son caprice Le sens de cet Oracle à ses vœux si propice;
Quand il dit, vn Conſul doit mourir auiourd’huy, Il s’appliqua ce nom, & prit ce ſens pour luy:	Quand il dit, un Consul doit mourir aujourd'hui, Il s'appliqua ce nom, et prit ce sens pour lui:
S’il eut à ſon trépas apporté quelque obſtacle, Ne voyant qu’vn Conſul condamné par l’oracle, Le ſort eut en effet décidé qui des deux Eſtoit le plus coupable, ou le plus mal-heureux:	S'il eut à son trépas apporté quelque obstacle, Ne voyant qu'un Consul condamné par l'oracle, Le sort eut en effet décidé qui des deux Était le plus coupable, ou le plus malheureux:
Il vous euſt fait alors partager ſa diſgrace;	Il vous eût fait alors partager sa disgrâce;
Et peut eſtre le ſort vous euſt mis à ſa place:	Et peut -être le sort vous eût mis à sa place:
Mais vne ardente ſoif d’acquerir de l’honneur Luy fit precipiter ſes iours & ſon malheur.	Mais une ardente soif d'acquérir de l'honneur Lui fit précipiter ses jours et son malheur.
Si tous les vains honneurs, dont ſa mort eſt ſuiuie, Dans le cœur des Romains excitoient de l’enuie, Il vous eſtoit permis d’auoir le meſme ſort;	Si tous les vains honneurs, dont sa mort est suivie, Dans le cœur des Romains excitaient de l'envie, Il vous était permis d'avoir le même sort;
Vous auiez meſme droit de courir à la mort:	Vous aviez même droit de courir à la mort:
Il euſt eſté plus beau d’imiter ce prund homme, Que de viure, & trahir ſa foy, ſa gloire, & Rome.	Il eût été plus beau d'imiter ce prund homme, Que de vivre, et trahir sa foi, sa gloire, et Rome.
TORQVATVS.	TORQUATUS.
De grace finiſſez:	De grâce finissez:
ma gloire & mon païs Iamais par Torquatuo ne le verrone tianis.	ma gloire et mon pays Jamais par Torquattuo ne le verrone tianis.
Diſpez la fureur dont voſtre ame eſt ſaiſie, Ces bouillans mouuemens de voſtre ialouſie.	Dispez la fureur dont votre âme est saisie, Ces bouillants mouvements de votre jalousie.
CAMILLE.	CAMILLE.
Moy ialouſe!	Moi jalouse!
Conſul, & ialouſe de toy!	Consul, et jalouse de toi!
Appren, que ie mépriſe & ton rang, & ta foy.	Appren, que ici méprise et ton rang, et ta foi.
N’eſpere pas de moy, que, quoy qu’il en arriue Ie veuille pour Epoux l’amant d’vne captiue:	N'espère pas de moi, que, quoi qu'il en arrive Je veuille pour Époux l'amant d'une captive:
Il faut eſtre vn Heros pour regner ſur mon cœur, Et Decius merite vn plus grand ſucceſſeur.	Il faut être un Héros pour régner sur mon cœur, Et Décius mérite un plus grand successeur.
Ceſſe donc de penſer, qu’aux biens que tu hazardes Ie prenne d’intereſt.	Cesse donc de penser, qu'aux biens que tu hasardes Je prenne d'intérêt.
SCENE III.	SCÈNE III.
TORQVATVS, CAMILLE, IVNIVS.	TORQUATUS, CAMILLE, IVNIUS.
MAnlius a des gardes;	MAnlius a des gardes;
Par voſtre ordre, Seigneur, ie l’ay fait arreſter:	Par votre ordre, Seigneur, ie l'ai fait arrêter:
Mais tout le camp murmure & ſemble s’irriter.	Mais tout le camp murmure et semble s'irriter.
Conitiitez la denus route voitre prudence;	Conititez la denus route voitre prudence;
Si l’on n’appaiſe vn mal auſſi-toſt qu’il commence, Les remedes, Seigneur, ſont ſouuent ſuperflus.	Si l'on n'apaise un mal aussitôt qu'il commence, Les remèdes, Seigneur, sont souvent superflus.
TORQVATVS.	TORQUATUS.
Le ſort en eſt ietté;	Le sort en est jeté;
qu’on ne m’en parle plus.	qu'on ne m'en parle plus.
CAMILLE.	CAMILLE.
Le lort en eſt lette.	Le lort en est lette.
quoy Laueugle lulle Qui te fait oublier Camille, ta patrie, Ta gloire, tes exploits, ta parole, & ton rang, Te fait encor trahir l’intereſt de ton ſang?	quoi Laveugle lulle Qui te fait oublier Camille, ta patrie, Ta gloire, tes exploits, ta parole, et ton rang, Te fait encor trahir l'intérêt de ton sang?
Il faut le ſang d’vn fils pour aſſouuir ta rage!	Il faut le sang d'un fils pour assouvir ta rage!
TORQVATVS.	TORQUATUS.
Ceſſez, encore vn coup, ce diſeours qui m’outrage;	Cessez, encore un coup, ce diseours qui m'outrage;
Reglez mieux les effets de vos ialoux ſoupçons, Et ne me donnez plus de friuoles leçons:	Reglez mieux les effets de vos jaloux soupçons, Et ne me donnez plus de frivoles leçons:
Ces reproches, enfin, laſſeroient ma clemence, Et pourroient me porter à quelque violence:	Ces reproches, enfin, lasseraient ma clémence, Et pourraient me porter à quelque violence:
Adicu, fetnel vous, ce nous luiſten en puix.	Adicu, fétnel vous, ce nous luisten en puix.
CAMILLE.	CAMILLE.
I’y conſens, va, Conſul, acheue tes forfaits Dans ton camp tu peux tout, oſe tout entreprendre;	J'y consens, va, Consul, achève tes forfaits Dans ton camp tu peux tout, ose tout entreprendre;
Mais crains que quelque iour on ne puiſſe t’appren.	Mais crains que quelque jour on ne puisse t'appren.
die, Ce que c’eſt que Camille:	die, Ce que c'est que Camille:
Adieu, penſes y bien.	Adieu, penses y -les.
SCENE IV.	SCÈNE IV.
TORQVATVS, IVNIVS.	TORQUATUS, IVNIUS.
TORQVATVS.	TORQUATUS.
Ieux!	Jeux!
l’horrible tourment qu’vn pareil entreD tien !	l'horrible tourment qu'un pareil entreD tien !
Sa raiſon eſt ſuiette à certaines alarmes, Dõt les noires vapeurs terniſſent bien ſes charmes;	Sa raison est suite à certaines alarmes, Dont les noires vapeurs ternissent bien ses charmes;
Et ie veux déſormais éuiter ſon courroux.	Et ici veux désormais éviter son courroux.
IVNIVS.	IUNIUS.
Camille ſur ce point ne fait rien que pour vous.	Camille sur ce point ne fait rien que pour vous.
Il n’eſt point de Romain dont le cœur ne ſoûpire, Qui n’en eut dit autant, s’il euſt osé le dire;	Il n'est point de Romain dont le cœur ne soupire, Qui n'en eut dit autant, s'il eût osé le dire;
Qui ſçachant qu’on eſt preſt d’immoler vn vainqueur, Pour ce cruel deſſein n’ait conceu de l’horreur, Et qui, pour dire tout, ſourdement ne s’appreſte Aux dépens de ſon ſang, à ſauuer cette teſte.	Qui sachant qu'on est prêt d'immoler un vainqueur, Pour ce cruel dessein n'ait conçu de l'horreur, Et qui, pour dire tout, sourdement ne s'apprête Aux dépens de son sang, à sauver cette tête.
Vous m’auez ordonné, Seigneur, expreſſément De vous dire touſiours quel eſt mon ſentiment;	Vous m'avez ordonné, Seigneur, expressément De vous dire toujours quel est mon sentiment;
De grace, pardonnez ce diſcours à mon zele;	De grâce, pardonnez ce discours à mon zèle;
Ie ſerois moins hardy, ſi i’eſtois moins fidelle;	Je serais moins hardi, si j'étais moins fidèle;
Mais deuſſay-ie expirer apres vous l’auoir dit;	Mais dussai-je expirer après vous l'avoir dit;
Tout eſt perdu, Seigneur, ſi Manlius perit.	Tout est perdu, Seigneur, si Manlius périt.
TORQVATVS.	TORQUATUS.
Ny la mort de cent fils, ny l’vniuers en armes, Ne ſont aſſez puiſſans pour donner des alarmes A l’ame d’vn Conſul, qui ne voit auiourd’huy Que les Dieux immortels plus éleuez que luy.	Ni la mort de cent fils, ni l'univers en armes, Ne sont assez puissants pour donner des alarmes A l'âme d'un Consul, qui ne voit aujourd'hui Que les Dieux immortels plus élevez que lui.
Ie ne m’ébranle pas pour vn ſimple murmure:	Je ne m'ébranle pas pour un simple murmure:
Quand ie n’aurois pour moy que la ſeule nature, Ie n’aurois pas beſoin du ſecours de la loy, Pour oſter à mon fils ce qu’il receut de moy:	Quand cause n'aurais pour moi que la seule nature, Je n'aurais pas besoin du secours de la loi, Pour ôter à mon fils ce qu'il reçut de moi:
Quand meſme il n’auroit pas merité ſa diſgrace, Pour apprendre aux ſoldats ce que peut ieur audæce, Et combien les Conſuls mépriſent leur pouuoir, Ie veux que cette mort leur montre leur deuoir.	Quand même il n'aurait pas mérité sa disgrâce, Pour apprendre aux soldats ce que peut jeur audæce, Et combien les Consuls méprisent leur pouvoir, Je veux que cette mort leur montre leur devoir.
IVNIVS.	IUNIUS.
Si l’ardeur des ſoldats n’eſt pas conſiderable, Craignez vn ennemy beaucoup plus redoutable, Apprehendez, Seigneur, vn rigoureux bourreau, Qui porte ſes fureurs au delà du tombeau;	Si l'ardeur des soldats n'est pas considérable, Craignez un ennemi beaucoup plus redoutable, Appréhendez, Seigneur, un rigoureux bourreau, Qui porte ses fureurs au delà du tombeau;
Vne flâme inuiſible, vn Demon domeſtique, Vn remors ( car il faut enſin que ie m’explique) Dont la ſecrette voix vous dira nuit & iour, Tu fis mourir ton fils, pour plaire à to’n Amour;	Une flamme invisible, un Démon domestique, Un remors ( car il faut ensin que ie éclique) Dont la secrète voix vous dira nuit et jour, Tu fis mourir ton fils, pour plaire à t'oût Amour;
Il fut de cette ardeur l’innocente vict:	Il fut de cette ardeur l'innocente vict:
me:	me:
Tremble, tremble, Conſul, les Dieux ont veu ton crime,	Tremble, tremble, Consul, les Dieux ont vu ton crime,
Le Sang de ce Heros iniuſtement versé Eleue des vapeurs, dont le Ciel eſt percé;	Le Sang de ce Héros injustement versé Elevue des vapeurs, dont le Ciel est percé;
Des champs Eliſiens il demande vengeance:	Des champs Élisiens il demande vengeance:
Tremble, encore vne fois, ton ſupplice s’auance.	Tremble, encore une fois, ton supplice s'avance.
Alors, pour étouffer cette tonnante voix Vous vous excuſerez ſur la rigueur des loix, Sur la neceſſité de punir ce coupable;	Alors, pour étouffer cette tonnante voix Vous vous excuserez sur la rigueur des lois, Sur la nécessité de punir ce coupable;
Mais vous aurez en vous vn iuge inexorable, Et quand vers le Public vous vous excuſerez, Malgré vous en ſecret, vous vous condamnerez:	Mais vous aurez en vous un juge inexorable, Et quand vers le Public vous vous excuserez, Malgré vous en secret, vous vous condamnerez:
Quand vous conſulterez voſtre ame toute nuë Sur vne intention qui vous eſt trop connuë, Fuſſiez vous mille fois le plus grand des Romains, Pour vaincre vos remors, vos titres ſeroient vains.	Quand vous consulterez votre âme toute nue Sur une intention qui vous est trop connue, Fussiez vous mille fois le plus grand des Romains, Pour vaincre vos remors, vos titres seraient vains.
Il n’eſt point de grandeur, de rang, de Diademes, Qui nous puiſſent, Seigneur, deffendre de nous meſmes, Et l’vniuers entier ne peut nous garentir Des traits empoiſonnez d’vn iuſte repentir.	Il n'est point de grandeur, de rang, de Diademes, Qui nous puissent, Seigneur, défendre de nous mêmes, Et l'univers entier ne peut nous garentir Des traits empoisonnés d'un juste repentir.
Pendant qu’il en eſt temps, éuitez donc l’orage:	Pendant qu'il en est temps, évitez donc l'orage:
On voit en vain l’écüeil, quand on a fait naufrages Il y va d’immoler, non pas des ennemis, Des Eſclaues aux fers, mais voſtre propre fils;	On voit en vain l'écueil, quand on a fait naufrages Il y va d'immoler, non pas des ennemis, Des Esclaues aux fers, mais votre propre fils;
Vn filu rietorieux, & uont le plus grand crime Eſt vn peu trop d’ardeur d’acquerir de l’eſtime.	Un filu riétorieux, et ouvont le plus grand crime Est un peu trop d'ardeur d'acquérir de l'estime.
Dieux!	Dieux!
eſt-ce donc ſi peu qu’vne telle action, Qu’on ne daigne y donner quelque reflection?	est-ce donc si peu qu'une telle action, Qu'on ne daigne y donner quelque réflection?
Re mettez au Senat à iuger cette affaire.	Re mettez au Sénat à juger cette affaire.
TORQVATVS.	TORQUATUS.
Ceſſe de tourmenter vn miſerable pere, Qui s’eſt dit mille fois en condamnant ſon fils, Les friuolles raiſons qu’auiourd’huy tu luy dis, Quand vn pere obligé de vaincre ſa foibleſſe s’efforce d’arracher vn fils à ſa tendreſſe,	Cesse de tourmenter un misérable père, Qui s'est dit mille fois en condamnant son fils, Les frivoles raisons qu'aujourd'hui tu lui dis, Quand un père obligé de vaincre sa faiblesse s'efforce d'arracher un fils à sa tendresse,
De l’amour paternel les ſecrets entretiens 57 Ne luy tiennent que trop les diſcours que tu tiens Ce ſont des nœuds ſi doux que ceux de la nature, Que quand on eſt contraint de ſouffrir leur rupture, Il n’eſt aucun moyen, qu’vne ame n’ait tenté, Pour ne pas ſe trouuer dans cette extremité.	De l'amour paternel les secrets entretiens 57 Ne sens tiennent que trop les discours que tu tiens Ce sont des nœuds si doux que ceux de la nature, Que quand on est contraint de souffrir leur rupture, Il n'est aucun moyen, qu'une âme n'ait tenté, Pour ne pas se trouver dans cette extrémité.
Quand on voit vn Romain amoureux de la gloire, Remporter ſur ſes ſens vne entiere victoire, Au bon heur de l’eſtat borner tous ſes plaiſirs, Et ſans ceſſe étouffer ſes plus preſſans deſirs, Ce n’eſt pas que ſon cœur en ſoit moins acceſſible A tout ce qui rendroit vn autre cœur ſenſible;	Quand on voit Romain Romain amoureux de la gloire, Remporter sur ses sens une entière victoire, Au bon heur de l'état borner tous ses plaisirs, Et sans cesse étouffer ses plus pressants désirs, Ce n'est pas que son cœur en soit moins accessible À tout ce qui rendrait autre cœur sensible;
Le plus foible mortel, le plus ferme Romain, Ont tous deux eſté faits par vne meſme main, Et cette fermeté, qui fait leur difference, A proprement parler, n’eſt que dans l’apparence:	Le plus faible mortel, le plus ferme Romain, Ont tous deux été faits par une même main, Et cette fermeté, qui fait leur différence, À proprement parler, n'est que dans l'apparence:
Leurs deux cœurs ſont ſuiets aux meſmes paſſiont;	Leurs deux cœurs sont sujets aux mêmes passiont;
Ils reçoiuent tous deux meſmes impreſſions:	Ils reçoivent tous deux mêmes impressions:
Mais l’vn cede d’abord aux efforts de l’orage, Et l’autre ſe deffend auec plus de courage;	Mais l'autre cède d'abord aux efforts de l'orage, Et l'autre se défend avec plus de courage;
Et le plus intrepide & le plus genereux Eſt ſouuent, en ſecret, le plus touché des deux.	Et le plus intrépide et le plus généreux Est souvent, en secret, le plus touché des deux.
Sçachant donc de mon fils la funeſte aduenture, I’ay ſenty ces tranſports que donne la nature, I’ay d’abord éprouué, que le cœur d’vn Romain, Pour eſtre illuſtre & grand, n’en eſt pas moins humain, qu’on n’en eſt pas plus dur, pour eſtre né dans Rome, qu’vn pere eſt touſiours pere, & qu’vn Conſul eſt homme:	Sachant donc de mon fils la funeste aventure, J'ai senti ces transports que donne la nature, J'ai d'abord éprouvé, que le cœur d'un Romain, Pour notre illustre et grand, n'en est pas moins humain, qu'on n'en est pas plus dur, pour être né dans Rome, qu'un père est toujours père, et qu'un Consul est homme:
Mais à tous ces effets des premiers mouuemens Ont enfin ſuccedé de plus grands ſentimens;	Mais à tous ces effets des premiers mouvements Ont enfin succédé de plus grands sentiments;
