DORINE.	DORINE.
Monſieur fait une aplication ingenieuſe des termes de ſon Art.	Monsieur fait une application ingénieuse des termes de son Art.
0 220 Mais, dites nous de quel ſecret, vous vous ſervés, pour réûſſir dans vos conquê	0 220 Mais, dites nous de quel secret, vous vous servez, pour réussir dans vos conquê
tes?	tes?
FLORIMONT.	FLORIMONT.
Madame, le plus grand ſecret que nous ayons, & qui eſt comme nôtre premier ingenieur, c’eſt de connoître l’heure du berger & d'enigavon pronter.	Madame, le plus grand secret que nous ayons, et qui est comme notre premier ingénieur, c'est de connaître l'heure du berger et d'enigavon pronter.
CELIMENE.	CELIMENE.
J’ai ouy ſouvent parler de ce proverbe, ſans ſçavoir d’où il vient, ny ce que c’eſt.	J'ai oui souvent parler de ce proverbe, sans savoir d'où il vient, ni ce que c'est.
FLORIMONT.	FLORIMONT.
Madame, l’heure du Berger n’eſt autre choſe que ce doux moment, & ce temps favorable, où l’on trouve une belle diſpoſée à écouter nôtre amour & à y répondre.	Madame, l'heure du Berger n'est autre chose que ce doux moment, et ce temps favorable, où l'on trouve une belle disposée à écouter notre amour et à y répondre.
c’eſt une Hiſtoire aſſés courte qui a donné lieu à ce Proverbe.	c'est une Histoire assez courte qui a donné lieu à ce Proverbe.
Vous connoiſſés ſans doute, Meſdames, un Prince qui s’eſt ſignalé gnalé dans nôtre Hiſtoire, autant par ſes amours, que par ſon courage & ſa bravoure.	Vous connaissez sans doute, Mesdames, un Prince qui s'est signalé gnalé dans notre Histoire, autant par ses amours, que par son courage et sa bravoure.
Un jour revenant de la chaſſe, il jetta les yeux ſur une petite Bergere, qui avoit peutêtre ce je ne ſçai quoi qui donne dans la vuë aux grands comme aux petits.	Un jour revenant de la chasse, il jeta les yeux sur une petite Bergère, qui avait peutêtre ce je ne sais quoi qui donne dans la vue aux grands comme aux petits.
Il en devint amoureux;	Il en devint amoureux;
& l’amour qui fait des égaux, lors qu’il n’en trouve point, abaiſſa ce Prince juſqu’à ſolliciter cette Bergere à repondre à ſa paſſion.	et l'amour qui fait des égaux, lors qu'il n'en trouve point, abaissa ce Prince jusqu'à solliciter cette Bergère à répondre à sa passion.
Mais cette pauvre fille épouvantée peut-être par la grandeur de ce Prince, ou ne ſentant point ce panchant pour lui, le refuſa pleinement;	Mais cette pauvre fille épouvantée peut-être par la grandeur de ce Prince, ou ne sentant point ce penchant pour lui, le refusa pleinement;
& lui dit que s’il vouloit uſer du pouvoir qu’il avoit entre les mains, pour la contraindre, elle aimeroit mieux perdre la vie, que de rien faire contre ſon honneur.	et lui dit que s'il voulait user du pouvoir qu'il avait entre les mains, pour la contraindre, elle aimerait mieux perdre la vie, que de rien faire contre son honneur.
Le Prince indigné de ce refus, changea ſon amour en mépris.	Le Prince indigné de ce refus, changea son amour en mépris.
Quelque tems aprés on lui vint dire que cettè Bergere étoit groſſe du Berger de ſon village.	Quelque temps après on lui vint dire que cettège Bergère était grosse du Berger de son village.
Ce Prince ſouhaita de la voir;	Ce Prince souhaita de la voir;
on la fait venir.	on la fait venir.
Hé bien, ma fille, lui dit il, d’où vient que vous avés accordé à un Berger ce que vous avés refuſé à un Prince?	Hé bien, ma fille, lui dit -il, d'où vient que vous avez accordé à un Berger ce que vous avez refusé à un Prince?
Si vous fuſſiés venu, mon Prince.	Si vous fiez venu, mon Prince.
Topohuldomanumueurequele vend nôtre Berger, vous auriés été reçû de la même maniere.	Topohuldomanumuurequele vend notre Berger, vous auriez été reçu de la même manière.
Et depuis ce temps là, on a toûjours appellé l'heure du Berger, ce doux moment ſi favorable à un amant.	Et depuis ce temps là, on a toujours appelé l'heure du Berger, ce doux moment si favorable à un amant.
CELIMENE.	CELIMENE.
*1 Ha!	*1 Ha!
certes je ne ſçavois pas encore cela.	certes je ne savais pas encore cela.
BELISE.	BELIZE.
Voici Cleante qui vient, il faut que nous aucritorio la denuo touuintiment.	Voici Cléante qui vient, il faut que nous aucritorio la denvo touvintiment.
SCENE DERNIERE.	SCÈNE DERNIÈRE.
CLEANTE, BELISE, CLIMENE, FLORIMONT, CELIMENE, DORINE, De.	CLEANTE, BELIZE, CLIMENE, FLORIMONT, CELIMENE, DORINE, De.
SUZON, De.	SÙZON, De.
FANCHON, AMMINIE, CLORINE, GILETE,	FANCHON, AMMINIE, CLORINE, GILETE,
CLEANTE.	CLÉANTE.
mnunirles, je farg-votle tres mimble NTſerviteur, je ne croyois pas trouyer iei une ſi nombreuſe compagnie.	munirles, je farg-votle très mimble NTserviteur, je ne croyais pas trou ier un si nombreuse compagnie.
DHHSUICVI	DHÉSUICUI
BELISE.	BELIZE.
Prenés y place, Monſieur, & ſoyés le Directeur de nôtre Academie.	Prenez y place, Monsieur, et soyez le Directeur de notre Académie.
CLIMENE.	CLIMENE.
e unar vuere uram venme, mrinultes nous vôtre ſentiment ſur une difficulté qui pous ocupe.	eu unar vere ouvram venme, mrinultes nous votre sentiment sur une difficulté qui pous ocupe.
CLEANTE.	CLÉANTE.
10 101	10 101
Quelle eſt-elle, Madame?	Quelle est-elle, Madame?
CLIMENE.	CLIMENE.
Nous voudrions ſçavoir ce que c’eſt que ce proverbe que l’on dit d’ordinaire l’heure du Berger, & d’où il vient.	Nous voudrions sçavoir ce que c'est que ce proverbe que l'on dit d'ordinaire l'heure du Berger, et d'où il vient.
Voilà Mr.	Voilà Mr.
qui vient de nous dire ſon ſentiment;	qui vient de nous dire son sentiment;
mais ces Dames ſouhaitreroient que vous y ajoutaſſiés auſſi le vôtre.	mais ces Dames souhaitreraient que vous y ajoutasiez aussi le vôtre.
10	10
CLEANTE.	CLÉANTE.
Je me feray un plaiſir & un honneur de vous dire ce que peuujuprisi mimone en eſt eſt aſſés galante.	Je me ferai un plaisir et un honneur de vous dire ce que peuvjuprisi mimone en est est assez galante.
Dans une des plus belles Contrées de France il y avoir un Berger & une Bergere, qui faiſoient paitre leurs troupeaux aſſés prés l’un de l’aurre, dans in lieu champêtre ſi agréable qu’il ſembloit que la nature eût pris plaiſir d’étaler à leurs yeux ce qu’elle a de plus charmant.	Dans une des plus belles Contrées de France il y avoir un Berger et une Bergère, qui faisaient paître leurs troupeaux assez près l'un de l'aurre, dans in lieu champ si agréable qu'il semblait que la nature eût pris plaisir d'étaler à leurs yeux ce qu'elle a de plus charmant.
Le voiſinage ayant donc formé le premier nœud de leur amour, le raport d’humeur & d’inclinations joint aux frequentes entrevues, conduiſit ces deux innocentes perſonnes à ce degré d’amour, où l’on n’aſpire qu’au mélange des deux ames, pour n’en former qu’une.	Le voisinage ayant donc formé le premier nœud de leur amour, le rapport d'humeur et d'inclinations joint aux fréquentes entrevues, conduisit ces deux innocentes personnes à ce degré d'amour, où l'on n'aspire qu'au mélange des deux âmes, pour n'en former qu'une.
Le Berger ſouhaittoit ardemment que cette union ſe fiſt, mais la Bergere deſiroit auparavant une preuve conſtante & fidelle de l’amour de ſon Berger.	Le Berger souhaitait ardemment que cette union se fît, mais la Bergère désirait auparavant une preuve constante et fidèle de l'amour de son Berger.
Elle lui dit donc que, s’il étoit aſſés heureux pour venir à une certaine heure qu’elle lui marqueroit, dans l’eſpace de cinq ou ſix jours, il ſeroit recû à bras ouverts dans ſa Cabane, & jouiroit du fruit de ſon amour;	Elle lui dit donc que, s'il était assez heureux pour venir à une certaine heure qu'elle lui marquerait, dans l'espace de cinq ou six jours, il serait reçu à bras ouverts dans sa Cabane, et jouirait du fruit de son amour;
Mais que s’il la manquoit, il n’y avoit plus d’eſperance de retour.	Mais que s'il la manquait, il n'y avait plus d'espérance de retour.
Le Berger ne perd point courage pour cela.	Le Berger ne perd point courage pour cela.
Il ſe leve tous les jours avec le Soleil, & vient devant la Cabane deſa Bergere, pour voirs’il n’ytrouveroit point quelque marque qui lui fiſt connoître cette heure favorable qu’elle lui avoit aſſignée.	Il se lève tous les jours avec le Soleil, et vient devant la Cabane des Bergère, pour voirs'il n'ytrouverait point quelque marque qui lui fît re cette heure favorable qu'elle lui avait assignée.
Il y demeuroit tout le jour ſans perdre patience, & ne ſe retiroit qu’avec le Soleil.	Il y demeurait tout le jour sans perdre patience, et ne se retirait qu'avec le Soleil.
Il continua ſes aſſiduités pendant e 2 ciq cinq jours, ſans rien voir qui le tirât de l’impatience où il étoit.	Il continua ses assiduités pendant e 2 ciq cinq jours, sans rien voir qui le tirât de l'impatience où il était.
Enfin le ſixiéme jour venu, ſa Bergere qui ne doutoit plus de l’amour fidele & conſtante de ſon Berger, car elle avoit été témoin de ſes aſſiduités, rentre en ſoi-même, repréſente à ſon Eſprit les graces de ſon Berger, les paroles tendres qu’elle en avoit ſi ſouvent ouies, la fidelité de ſon amour, & ce qu’il venoit de faire tout recemment pour elle;	Enfin le sixième jour venu, sa Bergère qui ne doutait plus de l'amour fidèle et constante de son Berger, car elle avait été témoin de ses assiduités, rentre en soi-même, représente à son Esprit les grâces de son Berger, les paroles tendres qu'elle en avait si souvent ouïes, la fidélité de son amour, et ce qu'il venait de faire tout récemment pour elle;
Et toute tranſportée d’ardeur pour luy, ha!	Et toute transportée d'ardeur pour lui, ha!
c’eſt trop tardé, s’écria-t-elle, nous avons aſſés mis ſa conſtance à l’épreuve, il eſt digne de goûter les fruits de ſon amour.	c'est trop tardé, s'écria-t-elle, nous avons assez mis sa constance à l'épreuve, il est digne de goûter les fruits de son amour.
Et voyant que le Soleil étoit ſur ſon declin écrivit ſur le ſablon devant ſa porte:	Et voyant que le Soleil était sur son déclin écrivit sur le sablon devant sa porte:
Berger, voici vôtre heure.	Berger, voici votre heure.
Je ne puis vous dire, Meſdames, la joye dont ce Berger fut tr anſporté en voyant ces paroles écrites.	Je ne puis vous dire, Mesdames, la joie dont ce Berger fut tr ansporté en voyant ces paroles écrites.
Il entre dans la Cabane de ſa Bergere, il en eſt reçû à bras ouverts;	Il entre dans la Cabane de sa Bergère, il en est reçu à bras ouverts;
& aprés mille témoignages réciproques de tendreſſe & d’amour, ils ſerrerent enfin le dernier nœud de cette union tant deſirée, qui couronna la conſtance & la fidelité de leur amour.	et après mille témoignages réciproques de tendresse et d'amour, ils serrèrent enfin le dernier nœud de cette union tant désirée, qui couronna la constance et la fidélité de leur amour.
Je croy, Meſdames, que c’eſt cette Hiſtoire qui a donné lieu au Proverbe dont vous m’avés parlé.	Je crois, Mesdames, que c'est cette Histoire qui a donné lieu au Proverbe dont vous m'avez parlé.
BELISE.	BELIZE.
Vous étes d’un ſentiment different de Mr.	Vous êtes d'un sentiment différent de Mr.
vôtre ami, car il a raporté l’origine de ce Proverbe à une autre Hiſtoire.	votre ami, car il a rapporté l'origine de ce Proverbe à une autre Histoire.
FLORIMONT.	FLORIMONT.
Madame, l’amitié ne détruit point entre nous la franchiſe, ni la liberté d’avoir chacun ſon ſentiment, & de le dire librement.	Madame, l'amitié ne détruit point entre nous la franchise, ni la liberté d'avoir chacun son sentiment, et de le dire librement.
CELIMENE.	CELIMENE.
Mais a faqueile de ces deua riltoires, nous en tiendrons-nous ?	Mais a faqueile de ces deva riltoires, nous en tiendrons-nous ?
DOAINE.	DOAINE.
Je croy la premiere, plûtôt que la ſeconde.	Je crois la première, plutôt que la seconde.
CLIMENE.	CLIMENE.
Je croy auſſi que Cleante ne nous l’a faïte que pour nous expliquer ce Proverbe.	Je crois aussi que Cléante ne nous l'a faïte que pour nous expliquer ce Proverbe.
A dire vray, je la trouve fort jolie;	À dire vrai, je la trouve fort jolie;
on & voit bien que Mr.	on et voit bien que Mr.
a une grande intelligence des myſteres de l’amour.	a une grande intelligence des mystères de l'amour.
Cela me donne envie de luy faire encore une queſtion ſur cette matiere.	Cela me donne envie de deux faire encore une question sur cette matière.
Je voudrois bien ſçavoir, Mr.	Je voudrais bien savoir, Mr.
ce que c’eſt que l’amabilité, c’eſt à dire cet attrait qui nous rend aimables.	ce que c'est que l'amabilité, c'est -à -dire cet attrait qui nous rend aimables.
CLEANTE.	CLÉANTE.
Madame, c’eſt une queſtion qui paroît fort aiſée d’abord, parce qu’il n’y a rien qui faſſe plus d’impreſſion ſur nos cœurs que l’amabilité;	Madame, c'est une question qui paraît fort aisée d'abord, parce qu'il n'y a rien qui fasse plus d'impression sur nos cœurs que l'amabilité;
mais on peut dire neanmoins qu’il n’y a peut-être rien de moins connu en ſoy-même.	mais on peut dire néanmoins qu'il n'y a peut-être rien de moins connu en soi-même.
Car chacun en voulant juger par raport à ſon inclination & à la ſimparie qu’il a avec ce qu’il juge aimable, il ſe trouve qu’il y a autant de differens ſentimens de l’amabilité, qu’il y a de differentes inclinations.	Car chacun en voulant juger par rapport à son inclination et à la symparie qu'il a avec ce qu'il juge aimable, il se trouve qu'il y a autant de différents sentiments de l'amabilité, qu'il y a de différentes inclinations.
C’eſt ce qui fait que nos beaux Eſprits, qui en ont parlé, Iont ſont ſi differens dans leurs ſentimens.	C'est ce qui fait que nos beaux Esprits, qui en ont parlé, Iont sont si différents dans leurs sentiments.
Mais on peut dire qu’ils ſe ſont tous accordés en ce point, c’eſt qu’aprés avoir fait leurs efforts pour l’expliquer, ils ont avoüé ingenûment que c’étoit un je ne ſçay quoy.	Mais on peut dire qu'ils se sont tous accordés en ce point, c'est qu'après avoir fait leurs efforts pour l'expliquer, ils ont avoué ingénument que c'était un je ne sais quoi.
Il eſt vray que quelques-uns d’eux ont tâché d’expliquer ce je ne ſçay quoy, en diſant que c’étoit un doux raport, une ſimpatie, un nœud ſecret, mais ils avoüent toûjours que ce n’eit rien diré autre choſe.	Il est vrai que quelques-uns d'eux ont tâché d'expliquer ce je ne sais quoi, en disant que c'était un doux rapport, une simpatie, un nœud secret, mais ils avouent toujours que ce n'éit rien diré autre chose.
Voici comment parle un de ces beaux Eſprits.	Voici comment parle un de ces beaux Esprits.
Il eſt des nœuds ſecrets, il eſt des ſimpaties, mene puito donn dupours vee umes eſforties, Se lient l’une à l’autre, & ſe laiſſent toucher, Par ce je ne ſçay quoy, qu’on ne peut expliquer.	Il est des nœuds secrets, il est des simpaties, mène puito donnée dupours vée umes éforties, Se lient l'une à l'autre, et se laissent toucher, Par ce je ne sais quoi, qu'on ne peut expliquer.
Un autre nous dit, que c’eſt une grace ſecrete, un certain air;	Un autre nous dit, que c'est une grâce secrète, un certain air;
mais il en revient toûjours au je ne ſçay quoy.	mais il en revient toujours au je ne sais quoi.
Il parle d’un beau jeune homme, en qui l’on voyoit ce puiſſant attrait de l’amabilité.	Il parle d'un beau jeune homme, en qui l'on voyait ce puissant attrait de l'amabilité.
Sur tout il avoit une grace, Un je ne ſçay quoy, qui ſurpaſſe De l’amour les plus doux apas;	Sur tout il avait une grâce, Un je ne sais quoi, qui surpasse De l'amour les plus doux appas;
Un air que les autres n’ont pas, Qu'on voit, & qu’on ne ſçauroit dire.	Un air que les autres n'ont pas, Qu'on voit, et qu'on ne saurait dire.
Mais de tous nos beaux Eſprits, il me ſemble que Moliere a le mieux caracteriſé cette amabilité.	Mais de tous nos beaux Esprits, il me semble que Molière a le mieux caractérisé cette amabilité.
C’eſt dans un endroit de ſes pieces, où il repréſente une aimable perſenne, en qui cette amabilité paroiſſoit comme ſur ſon trône.	C'est dans un endroit de ses pièces, où il représente une aimable persenne, en qui cette amabilité paraissait comme sur son trône.
Le doux charme qu’elle a pour attirer les cœurs, Eſt un air en tout tems deſarmé de rigueurs, Des regard careſſans que la bouche ſeconde;	Le doux charme qu'elle a pour attirer les cœurs, Est un air en tout temps désarmé de rigueurs, Des regard caressants que la bouche seconde;
Un rire chargé de douceurs, ANE 3.	Un rire chargé de douceurs, ANE 3.
Et ne promet que des faveurs.	Et ne promet que des faveurs.
FLORIMONT.	FLORIMONT.
Veritablement, Moliere a juſtement rencontré, c’eſt là le caractere le plus régulier qu’on puiſſe faire de l’amabilité.	Véritablement, Molière a justement rencontré, c'est là le caractère le plus régulier qu'on puisse faire de l'amabilité.
Et s’il m’étoit permis de juger de la diſpoſition du cœur des autres par celle, où je me crouve, je drrois que e cie la rumque attrait de l’amour.	Et s'il m'était permis de juger de la disposition du cœur des autres par celle, où je me crouve, je drais que ép cie la rumque attrait de l'amour.
Car il n’y en a point qui faſſe plus d’impreſſion ſur mon cœur.	Car il n'y en a point qui fasse plus d'impression sur mon cœur.
BELISE.	BELIZE.
Cela eſt vray, les hommes aiment ce qui leur rit.	Cela est vrai, les hommes aiment ce qui leur rit.
Et comme on prend ce regard favorable pour une marque de la bonne voſonce qu'Un a pour nous, il ne raut pas s’étonner ſi cela engage à aimer ceux en qui nous le voyons.	Et comme on prend ce regard favorable pour une marque de la bonne vosonce qu'Un a pour nous, il ne raut pas s'étonner si cela engage à aimer ceux en qui nous le voyons.
Car il eſt naturel d’aimer ceux qui nous aiment.	Car il est naturel d'aimer ceux qui nous aiment.
CLIMENE.	CLIMENE.
Vous dites, Cleante, le ſentiment des autres, & nous voudrions ſçavoir le vôtre, là deſſus.	Vous dites, Cléante, le sentiment des autres, et nous voudrions savoir le vôtre, là -dessus.
CLEANTE.	CLÉANTE.
Pour moi, Madame, je croy que cetteamabilité n’eſt autre choſe qu’une juſte proportion de toutes les parties d’un corps, jointe à une belle ame.	Pour moi, Madame, je crois que cetteamabilité n'est autre chose qu'une juste proportion de toutes les parties d'un corps, jointe à une belle âme.
Lors qu’une fois e 3Ceta cette double proportion étale à nos yeux ſes graces & ſes attraits, ce ſont comme de divins caractéres qui enlevent nos ames, & qui cauſent dans nos cœurs ces violents tranſports de l’amour, & ces ravinemenis de nos amey qui lemureut ne vivre plus que pour ce qui les a charmées.	Lors qu'une fois e 3Ceta cette double proportion étale à nos yeux ses grâces et ses attraits, ce sont comme de divins caractéres qui enlèvent nos âmes, et qui causent dans nos cœurs ces violents transports de l'amour, et ces ravinémenis de nos âme qui lemureut ne vivre plus que pour ce qui les a charmées.
CLIMENE.	CLIMENE.
Mais je voudrois bien ſçavoir ce que ſont ces tranſports, & ces raviſſemens dont vous parlés.	Mais je voudrais bien savoir ce que ces sont transports, et ces ravissements dont vous parlez.
CLEANTE.	CLÉANTE.
Comment pourrois-je vous les expliquer, puiſque ceux mêmes qui les reſſentent, ne ſauroient nous en rien dire.	Comment pourrais-je vous les expliquer, puisque ceux mêmes qui les ressent, ne sauraient nous en rien dire.
Ecoutons un de ces amans tranſporté à la vûe de ces divins caractéres.	Écoutons un de ces amants transporté à la vue de ces divins caractères.
Je ſens, de veine en veine, une ſubtile flamme, Courir par tout mon corps, ſi tôt que je vous vois;	Je sens, de veine en veine, une subtile flamme, Courir par tout mon corps, si tôt que je vous vois;
Et dans les doux tranſports, où s’égare mon ame, eae nonoetnes muy nparcte al vuixs	Et dans les doux transports, où s'égare mon âme, eae nonoétnes mui nparte al vits
BELISE.	BELIZE.
Croyés-vous, Meſdames, qu’on ſuive toûjours cette régle, quand il s’agit d’aimer?	Croyez-vous, Mesdames, qu'on suive toujours cette règle, quand il s'agit d'aimer?
AMINTE.	AMINTE.
Il me ſemble que les belles ames s’y attachent.	Il me semble que les belles âmes s'y attachent.
CLORINE.	CLORINE.
Je croy auſſi, que celles qui ſuivent en tout, les juſtes ſentimens de la nature, tâchent de ne pas s’en éloigner.	Je crois aussi, que celles qui suivent en tout, les justes sentiments de la nature, tâchent de ne pas s'en éloigner.
BE	BE
BELISE.	BELIZE.
Qu’en penſes-vous, Climene?	Qu'en penses-vous, Climène?
CLIMENE.	CLIMENE.
Pour moi, je croy, que ſi nous nous en tenions là, les Amans & les Amantes ſeroient auſſi rares que ces parfaits amis dont l’Hiſtoire ne nous parle que de deux ou trois exemples, en mille ans.	Pour moi, je crois, que si nous nous en tenions là, les Amants et les Amantes seraient aussi rares que ces parfaits amis dont l'Histoire ne nous parle que de deux ou trois exemples, en mille ans.
Mais, Monſieur nous a voulu dire ſeulement en general, ce que c’eſt que l’amabilité, & nous voudrions ſçavoir ce qu’il en penſe en particulier.	Mais, Monsieur nous a voulu dire seulement en général, ce que c'est que l'amabilité, et nous voudrions sçavoir ce il en pense en particulier ;
CLEANTE.	CLÉANTE.
Madame, il me ſemble, que pour bien decider cette queſtion, il faut entendre là deſſus les deux Sexes.	Madame, il me semble, que pour bien décider cette question, il faut entendre là -dessus les deux Sexes.
Si vous voulés nous dire quelles ſont ces graces & ces attraits qui nous rendent aimables aux belles, ſelon les impreſſions que vous en reſſentés, nous vous dirons auſſi quels ſont ces motifs qui nous rendent quel ques-unes de vôtre Sexe plus agréables que d’autres.	Si vous voulez nous dire quelles sont ces grâces et ces attraits qui nous rendent aimables aux belles, selon les impressions que vous en ressentés, nous vous dirons aussi quels sont ces motifs qui nous rendent quel ques-unes de votre Sexe plus agréables que d'autres.
CELIMENE.	CELIMENE.
Cela eſt juſte;	Cela est juste;
puiſque ces Meſſieurs ont bien voulu répondre aux queſtions qu’on leur a faites de nôtre part, il eſt raiſonnable de ne pas tefertencener quiiidnous font.	puisque ces Messieurs ont bien voulu répondre aux questions qu'on leur a faites de notre part, il est raisonnable de ne pas tefertencener quiiidnous font.
CLIMENE.	CLIMENE.
Pour moy, je le veux bion, pourvû que ces Dames y conſentent.	Pour moi, je le veux bion, pourvu que ces Dames y consentent.
Tout le monde en tombe-t-il d’accord ?	Tout le monde en tombe-t-il d'accord ?
AMINTE.	AMINTE.
Ie le ſouhaite de tout mon cœur.	Je le souhaite de tout mon cœur.
CLORINE.	CLORINE.
Ces tortes d’aveus n’ont rien qui me gêne.	Ces tortes d'aveus n'ont rien qui me gêne.
DORINE.	DORINE.
Pour moy, je ne m’y oppoſe pas.	Pour moi, je ne m'y oppose pas.
des co le Ro Ma Sœur & moy y conſentons.	des co le Ro Ma Sœur et moi y consentons.
CLIMENE.	CLIMENE.
Commences donc, Beliſe, puiſque vous étes la maîtreſſe ceans.	Commences donc, Bélise, puisque vous êtes la maîtresse céans.
BELISE.	BELIZE.
J’aimerois paſſionnément un homme, que je verrois dans une grande propreté.	J'aimerais passionnément un homme, que je verrais dans une grande propreté.
Je me plairois à le voir rechercher avec ſoin toutes les nouvelles modes & à les ſuivre le premier.	Je me plairais à le voir rechercher avec soin toutes les nouvelles modes et à les suivre le premier.
Je ne ſçaurois ſouffrir en luy la moindre négligence.	Je ne saurais souffrir en était la moindre négligence.
Enfin ſur ſon corps comme dans ſes habits, je voudrois qu’il n’y eût rien, qui pût choquer mes yeux.	Enfin sur son corps comme dans ses habits, je voudrais qu'il n'y eût rien, qui pût choquer mes yeux.
Je hai cette ſimplicité ruſtique, qui fait d’abord un aveu ingenu de ſon amour.	Je hai cette simplicité rustique, qui fait d'abord un aveu ingénu de son amour.
Je veux que celuy qui m’aime, ſe faſſe un myſtere du ſien, & que par de certains biais, & des detours étudiés, il tâche de me faire entendre ce que les autres diſent ouvertement.	Je veux que celui qui m'aime, se fasse un mystère du sien, et que par de certains biais, et des détours étudiés, il tâche de me faire entendre ce que les autres disent ouvertement.
CLIMENE.	CLIMENE.
