Incredule vulgaire arreſtez vous ſur moy:	Incredule vulgaire arrêtés -vous sur moi:
Vainqueur, Roy dans vn iour, & dans ce iour Victime, Mon ſort parfaitement exprime Les malheurs qui ſuiuent vn Roy.	Vainqueur, Roi dans un jour, et dans ce jour Victime, Mon sort parfaitement exprime Les malheurs qui suivent un Roi.
Ie vais Ie vais pour cét hymen faire vn dernier effort, On accorde aiſément ce qu’on veut à la mort;	Je vais Je vais pour cet hymen faire un dernier effort, On accorde aisément ce qu'on veut à la mort;
Que n’obtiendray-ie pas lors que ie meurs pour elle, Et lors que ſon refus la rendroit criminelle?	Que n'obtiendrai-je pas lors que sans meurs pour elle, Et lors que son refus la rendrait criminelle?
TRASONTE.	TRASONTE.
Moy, ie l’eſpouſerois?	Moi, Seigneur l'épouserais?
ah!	ah!
vous vous abuſeZ, Pauuovre tel oviei qui nons a dimijes, Amy, ie veux mourir ſi vous ceſſez de viure, L'Arreſt de voſtre mort me condamne à vous ſuiure.	vous vous abusez, Pauuovre tel oui qui nons a dimijà, Ami, Seigneur veux mourir si vous cessez de vivre, L'Arrest de votre mort me condamne à vous suivre.
VOLIIIRI.	VOLIIIRI.
Eſt-ce me conſoler?	Est-ce me consoler?
TRASONTE.	TRASONTE.
La mort n’eſt pas vn mal, Et ie la receurois auec vn front égal:	La mort n'est pas un mal, Et Seigneur la recevrais avec un front égal:
Uenez me conſoler quand ie vis miſerable, La douleur qui me ſuit, eſt ſeule pitoyable.	Uenez me consoler quand ici vis misérable, La douleur qui me suit, est seule pitoyable.
Dans l’eſtat ou ie ſuis, Amy, changeons de ſort, Ioüiſſez de la vie, & me laiſſez la mort.	Dans l'état ou autre suis, Ami, changeons de sort, Jouissez de la vie, et me laissez la mort.
Omort pour moy ſi douce, & pour luy ſi barbare, Pardonne ou prens enſemble & Traſonte & Voltare;	Omort pour moi si douce, et pour lui si barbare, Pardonne ou prends ensemble et Trasonte et Voltare;
Ou n’en rauy pas vn, ou rauy les tous deux, Ou ſi le ſang d’vn ſeul t’eſt promis par les vœux, Sauue vn ieune Vainqueur, prens moy pour ta Victime, Et tu feras iuſtice, ou tu ferois vn crime;	Ou n'en ravi pas un, ou ravi les tous deux, Ou si le sang d'un seul t'est promis par les vœux, Sauve un jeune Vainqueur, prends moi pour ta Victime, Et tu feras iustice, ou tu ferais un crime;
Vn acte de douceur pour vn acte inhumain, Et c'eſt touſiours vn Roy qui tombe ſous ta main.	Un acte de douceur pour un acte inhumain, Et c'est toujours un Roi qui tombe sous ta main.
JOLTARE.	JOLTARE.
Traſonte, cher amy, montrez moins de tendreſſe, Pour faire que ie meure auec moins de triſteſſe;	Trasonte, cher ami, montrez moins de tendresse, Pour faire que personne meure avec moins de tristesse;
Ne touchez plus ce cœur au nom des Immortels, Et rendeZ tout Voltare aux pieds de leurs Autels.	Ne touchez plus ce cœur au nom des Immortels, Et rendez tout Voltare aux pieds de leurs Autels.
Adieu, ie vais meirt orure auant te Sacrifice, Que les Trouppes que i’ay demeurent au ſeruice;	Adieu, Seigneur vais meirt orure avant te Sacrifice, Que les Troupes que j'ai demeurent au service;
Que pour l’Eſtat mes gens meurent comme ie fais, Vous pouuez cependant aller à mon Palais.	Que pour l'État mes gens meurent comme on fais, Vous pouvez cependant aller à mon Palais.
Traſonte ſort par vn coſté, & la Reine entre par l’autre.	Trasonte sort par un côté, et la Reine entre par l'autre.
SCENE TROISIESME.	SCÈNE -TROISIÈME.
BALDE, MELITE.	BALDE, MELITE.
Let A Victime, Seigneur, ne ſe dit pas encore, M Le Preſtre s’en excuſe, & le Peuple l’ignore:	Let À Victime, Seigneur, ne se dit pas encore, M Le Prestre s'en excuse, et le Peuple l'ignore:
Mais helas ie crains tout d’vn ſilence affecté;	Mais hélasrit crains tout d'un silence affecté;
Mon cœur en eſt eſmeu, loin d’en eſtre flatté:	Mon cœur en est ému, loin d'en être flatté:
Ie ſçay que ce doit eſtre vne choſe que i’aime, Et moins on me l’a dit, plus ma crainte eſt extréme:	Je sais que ce doit être une chose que j'aime, Et moins on me l'a dit, plus ma crainte est extrême:
Deſia chacun me vient conſoler, cher Eſpoux, On preuoit ma douleur, on ſçait donc que c’eſt vous Qui mourant me laiſſez en eſtat déplorable, Tel qu’on vient conſoler, encor qu’inconſolable, Excepté voſtre mort dont le coup ſeroit grand, Ie ne merite point ces deuoirs qu’on me rend.	Déjà chacun me vient consoler, cher Espoux, On prévoit ma douleur, on sait donc que c'est vous Qui mourant me laissez en état déplorable, Tel qu'on vient consoler, encor qu'inconsolable, Excepté votre mort dont le coup serait grand, Je ne mérite point ces devoirs qu'on me rend.
Dieux, perdeZ mon Païs, briſez mon Diadème, Si vous ſauueZ le Roy, ie ne perds rien que i’aime;	Dieux, perdez mon Pays, brisez mon Diadème, Si vous sauvez le Roi, je ne perds rien que j'aime;
Reprenez tous les biens que vos bontez m'ont faits, Et dans le pire eſtat où l’on me vit iamais Adiouſtez tous les maux & toutes les miſeres Qui venoient m'accabler ſans vos mains tutelaires;	Reprenez tous les biens que vos bontés m'ont faits, Et dans le pire état où l'on me vit jamais Adiousés tous les maux et toutes les misères Qui venaient m'accabler sans vos mains tutélaires;
Ne les retenez plus, pouuez vous refuſer De rappeller ce temps lors que pour m'eſpouſer	Ne les retenez plus, pouvez -vous refuser De rappeler ce temps lors que pour m'épouser
Vn Tyran m'aſſiegeoit, & lors que miſerable Ie ne vous eſtois pas encore redeuable?	Un Tyran m'assiègeait, et lors que misérable Je ne vous étais pas encore redevable?
Et toy touſiours cruel meſme en fauoriſant;	Et toi toujours cruel même en favorisant;
Deſtin, rends moy ma perte & reprens ton preſent;	Destin, rends -moi ma perte et reprends ton présent;
Ton ſoing m’est odieux qui des mains d’vn Barbare Dans le dernier combat a garanty Voltare.	Ton soing m'est odieux qui des mains d'un Barbare Dans le dernier combat a garanti Voltare.
Ciel dont la vigilance alors le ſecourut, Pourquoy l’as tu ſauué, s’il faloit qu’il mourust?	Ciel dont la vigilance alors le secourut, Pourquoi l'as tu sauvé, s'il fallait qu'il mourût?
Ie pouuois imputer au caprice, des armes, Son malheur & le mien, ſon trépas & mes larmes;	Je pouvais imputer au caprice, des armes, Son malheur et le mien, son trépas et mes larmes;
Et mes yeux auroient pû ſans crime le pleurer, Au lieu que l’immolant ie n’oſe ſoupirer.	Et mes yeux auraient pu sans crime le pleurer, Au lieu que l'immolant ie n'ose soupirer.
Mais en vain ie me plains, & le Ciel pour ma peine Veut que le ſang du Roy ſoit verſé par la Reine.	Mais en vain raison me plains, et le Ciel pour ma peine Veut que le sang du Roi soit versé par la Reine.
Il n'eut iamais pour moy de communes rigueurs, Par vn crime il me fait meriter mes douleurs;	Il n'eut jamais pour moi de communes rigueurs, Par un crime il me fait mériter mes douleurs;
Ie ne ſçaurois ſouffrir que ie ne ſois coupable, Etdés que ie la ſuis, ie deuiens miſerable;	Je ne saurais souffrir que ieans sois coupable, Etdés que je la suis, Seigneur deviens misérable;
Il me rend criminelle afin de me punir, Et m’impoſe des loix, que ie ne puis tenir.	Il me rend criminelle afin de me punir, Et m'impose des lois, que sans ne puis tenir.
Nouuelles cruautez.	Nouvelles cruautés.
VOLTARE.	VOLTARE.
Conſolez vous Madame, A ces coups de malheur montrez toute voſtre ame, Et ne me pleignez pas, le Ciel m'eſt aſſez doux Quãd ie meurs par sõ ordrees que ie meurs pour vous;	Consolez vous Madame, À ces coups de malheur montrez toute votre âme, Et ne me pleins pas, le Ciel m'est assez doux Quand ie meurs par son ordre que sans meurs pour vous;
Pourrois-ie cependant vous faire vne priere?	Pourrais-je cependant vous faire une prière?
BALDE.	BALDE.
La puis-ie refuſer, lors que c’eſt la derniere?	La puis-je refuser, lors que c'est la dernière?
YOLTARE.	YOLTARE.
Vous me l’accorderez?	Vous me l'accorderez?
BALDE.	BALDE.
Seigneur, vous en doutez, Vous le Maiſtre abſolu deſſus mes volontez?	Seigneur, vous en doutez, Vous le Maître absolu dessus mes volontés?
ue puis-ie dénier vous estant redeuable;	Que puis-je dénier vous étant redevable;
Et que puis-ie improuuer qui vous ſoit agreable?	Et que puis-je improuver qui vous soit agréable?
Ouy, i’atteſte les Dieux, vous ſerez ſatisfait.	Oui, j'atteste les Dieux, vous serez satisfaite.
VOLTARE ayant fait ſigne à vn Garde d’appeller Traſonte.	VOLTARE ayant fait signe à un Garde d'appeler Trasonte.
Apres cette faueur ie mourray ſans regret.	Après cette faveur On mourrai sans regret.
DemandeZ:	Demandez:
BALDE.	BALDE.
JOLTARE.	JOLTARE.
Si iamais ie vous fus agreable, Si vous croyez Madame, eſtre ma redeuable, Ie laiſſe vn cher Amy, i’oſe bien vous prier que de ce qui m'eſt deu vous vouliez le payer.	Si jamais ici vous fus agréable, Si vous croyez Madame, être ma redevable, Je laisse un cher Ami, j'ose bien vous prier que de ce qui m'est dev vous vouliez le payer.
Prenez-le pour Eſpoux.	Prenez-le pour Époux.
DALD Le Seigneur.	DALD Le Seigneur.
VOBEAIIC L.	VOBEAIC L.
Daignez m’entendre.	Daignez m'entendre.
le de tnye cis diin piutes Qle inenies	le de tnye cis diin piutes Qle inénies
Ie ne le puis.	Je ne le puis.
BALDE.	BALDE.
Moy, le prendre?	Moi, le prendre?
VOLTARE.	VOLTARE.
Forcez vostre inclination, A cherir cét obiet de mon affection.	Forcez votre inclination, A chérir cet objet de mon affection.
Vous le deueZ aimer puis qu’en mourant ie l’aime, C’eſt tout ce que ie puis vous laiſſer de moy meſme:	Vous le devez aimer puis qu'en mourant appris l'aime, C'est tout ce que ici puis vous laisser de moi -même:
Ie reſte dans ſon cœur & ne meurs qu’à demy, Cimes moy dans Prajonte.	Je reste dans son cœur et ne meurs qu'à demi, Cimes moi dans Prajonte.
Seigneur?	Seigneur?
BALDE.	BALDE.
Aimer mon ennemy.	Aimer mon ennemi.
VOLTARE.	VOLTARE.
Si c’eſt l’effet d’vne vertu bien rare, La voſtre n'eſt pas moindre en faueur de Voltare.	Si c'est l'effet d'une vertu bien rare, La vôtre n'est pas moindre en faveur de Voltare.
BALDE.	BALDE.
Ie n’en veux point de telle.	Je n'en veux point de telle.
VOLTARE.	VOLTARE.
Et quoy, vous reſiſtez?	Et quoi, vous résistez?
C eſt donc là ce pouuoir deſſus vos volontez?	Ç est donc là ce pouvoir dessus vos volontés?
BALDE.	BALDE.
Pardon pour cette fois ſi ie n’ay pû vous plaire, Le nom de ce Tyran r'allume ma colere.	Pardon pour cette fois si ici n'ai pu vous plaire, Le nom de ce Tyran rallume ma colère.
OLTARE, Si ſon nom vous aigrit, conſiderez le mien, C’eſt mon Amy, ce nom ne luy ſert-il de rien?	OLTARE, Si son nom vous aigrit, considérez le mien, C'est mon Ami, ce nom ne lui sert-il de rien?
Princeſſe, ma demande eſt aſſez legitime, Il vous faut vn Eſpoux apres vne Victime;	Princesse, ma demande est assez légitime, Il vous faut un Époux après une Victime;
Et ce fidelle Amy du moins par mon trépas Sera de voſtre hymen digne s’il ne l’eſt pas.	Et ce fidèle Ami du moins par mon trépas Sera de votre hymen digne s'il ne l'est pas.
BALDE.	BALDE.
Et c’eſt voſtre trépas qui le rend execrable, Peut-eſtre ſans cela le trouuerois-ie aimable:	Et c'est votre trépas qui le rend exécrable, Peut-être sans cela le trouverais-je aimable:
Mais que i’aime celuy qui vous rend malheureux, Et celuy qui fut ſeul la cauſe de mes vœux;	Mais que j'aime celui qui vous rend malheureux, Et celui qui fut seul la cause de mes vœux;
Cette loy, cher Eſpoux, eſt par trop inhumaine, Ie croy faire beaucoup luy remettant la peine:	Cette loi, cher Époux, est par trop inhumaine, Je crois faire beaucoup homme remettant la peine:
Si tu l’aimes, quel don luy fais-tu de mon cœur, Que ta mort va laiſſer en proye à la douleur?	Si tu l'aimes, quel don Seigneur fais-tu de mon cœur, Que ta mort va laisser en proie à la douleur?
L’Estat pourra-t’il voir ſa Couronne abatue, Remiſe entre les mains de celuy qui te tuë?	L'État pourra-t-il voir sa Couronne abattue, Remise entre les mains de celui qui te tue?
Mes ſoupirs & mes pleurs ne pourront te toucher?	Mes soupirs et mes pleurs ne pourront te toucher?
Qui de Traſonte ou moy te ſera le plus cher?	Qui de Trâonte ou moi te sera le plus cher?
JOLTARE.	JOLTARE.
Ma priere & ma mort vous teſmoignent que i’aime Traſonte comme moy, vous bien plus que moy meſme;	Ma prière et ma mort vous témoignent que j'aime Trâonte comme moi, vous bien plus que moi -même;
ViueZ auec ce Prince, & faites vn effort Pour payer au viuant les ſeruices du mort:	Vivez auec ce Prince, et faites un effort Pour payer au vivant les services du mort:
PenſeZ en ma faueur que s’il pût vous déplaire, Monſang le va lauer, & doit vous ſatisfaire:	PenseZ en ma faveur que s'il pût vous déplaire, Monsieur le va laver, et doit vous satisfaire:
Penſez PenſeZ que le bonheur de Traſonte & le mien Sont attachez fort prés par vn ſecret lien, Et ſouffrez que l’amour l’emporte ſur la haïne:	Pensez Pensez que le bonheur de Trasonte et le mien Sont attachés fort près par un secret lien, Et souffrez que l'amour l'emporte sur la haine:
Mais i’ay vostre parole & la foy d’vne Reine.	Mais j'ai votre parole et la foi d'une Reine.
BALDE.	BALDE.
Par vn ſi rude eſſay n'eſprouue point ma foy, Et tu ſçauras d’ailleurs ce que tu peux ſur moy.	Par un si rude essai n'éprouve point ma foi, Et tu sauras d'ailleurs ce que tu peux sur moi.
v eu Illla E.	 vu Illla E.
Et tu ſçauras d’ailleurs?	Et tu sauras d'ailleurs?
mais la mort nous ſepare, C’eſt le dernier eſſay que peut faire Voltare.	mais la mort nous sépare, C'est le dernier essai que peut faire Voltare.
BALDE.	BALDE.
Cher Eſpoux, c’eſt le ſeul qui ne t’eſt pas permis, Et ne m'allegue point que ie te l’ay promis:	Cher Espoux, c'est le seul qui ne t'est pas permis, Et ne m'allégue point que Ne te l'ai promis:
I'ay promis, il eſt vray, ie ne puis m’en deffendre, Mais de te donner tout, & non pas de rien prendre;	J'ai promis, il est vrai, on ne puis m'en défendre, Mais de te donner tout, et non pas de rien prendre;
Me faire vne telle offre, & moy la mépriſer, Eſt-ce rien demander, eſt-ce rien refuſer?	Me faire une telle offre, et moi la mépriser, Est-ce rien demander, est-ce rien refuser?
VOLTARE.	VOLTARE.
Un cœur pour mon amy.	Un cœur pour mon ami.
Y	Y
BALDE.	BALDE.
Ce preſent eſt funeſte;	Ce présent est funeste;
Sçais-tu pas, cher Eſpoux, que ce cœur qui conteſte, Et qui ſi puiſſamment s'oppoſe à ton deſſein, Fit le vœu qui te tuë, & fut ton aſſaſſin.	Sais-tu pas, cher Époux, que ce cœur qui conteste, Et qui si puissamment s'oppose à ton dessein, Fit le vœue qui te tue, et fut ton assassin.
Ouy, Traſonte l’auroit ſi tu voulois ſa perte, Ie veux bien à ce cœur laiſſer l’entrée ouuerte;	Oui, Trasonte l'aurait si tu voulais sa perte, Je veux bien à ce cœur laisser l'entrée ouuerte;
1 cj.	1 cy.
i qui voudra deuenir malheureux:	y qui voudra devenir malheureux:
Mais ce cœur qui te perd, peut faire encor des vœux.	Mais ce cœur qui te perd, peut faire encor des vœux.
VOLTARE.	VOLTARE.
Onſolez vous Amy, vous auez la Fortune 2.	Onsolez vous Ami, vous avez la Fortune 2.
Par delà vos deſirs.	Par delà vos désirs.
SCENE QVATRIESME.	SCÈNE QUATRIÈME.
TRASONTE.	TRASONTE.
TRASONTE.	TRASONTE.
Elle m’eſt importune;	Elle m'est importune;
Ie ris de ſes faueurs, & ie n’en connois pas Tant que ie vous ſçauray ſi proche du trépas.	Je ris de ses faveurs, et Seigneur n'en connais pas Tant que tu vous saurai si proche du trépas.
VOLTARE.	VOLTARE.
Que vous estes heureux?	Que vous êtes heureux?
TRASUNTE.	TRASUNTE.
Que ie ſuis miſerable?	Que ie suis misérable?
VOLTARE.	VOLTARE.
L’heur dont vous ioüiſſez n’eſt pas imaginable.	L'heur dont vous ioüissez n'est pas imaginable.
TRASONTE.	TRASONTE.
Mais ſi ie ſuis heureux, vous l’eſtes auec moy.	Mais si ici suis heureux, vous l'êtes avec moi.
JOLTARE.	JOLTARE.
Madame nomme en vous ſon Eſpoux & ſon Roy.	Madame nomme en vous son Époux et son Roi.
TRASONTE s’adreſſant à la Reine.	TRASONTE s'adressant à la Reine.
Combien i’ay ſouhaitté l’honneur que vous me faites, Ie prens pour mes teſmoins les malheurs où vous eſtes;	Combien j'ai souhaité l'honneur que vous me faites, Je prends pour mes témoins les malheurs où vous êtes;
Auiourd’huy cét honneur n'a plus pour moy d’appas, Celuy qui m'a fait viure eſt proche du trépas;	Aujourd'hui cet honneur n'a plus pour moi d'appas, Celui qui m'a fait vivre est proche du trépas;
Ainſi.	Ainsi.
BALDE.	BALDE.
L'aime Traſonte.	L'aime Trasonte.
TRASONTE.	TRASONTE.
Ie veux ſuiure Voltare.	Je veux suivre Voltare.
Et moy ie hay la vie,	Et moi ici haï la vie,
BALDE.	BALDE.
Et c’eſt ta belle enuie:	Et c'est ta belle envie:
Pumnuy dpummmmuprenois mal le ſens I’aime, mais non pas toy, i’aime tes ſentimens, Et les veux imiter puiſque ie les eſtime;	Pumnui dpummmmuprenois mal le sens J'aime, mais non pas toi, j'aime tes sentiments, Et les veux imiter puisque sans les estime;
Mourons, & que le Ciel au pius d vne Victime.	Mourons, et que le Ciel au pius d ' Victime.
RASONTE.	RASONTE.
Conſeruez vne Reine en immolant deux Rois.	Conservez une Reine en immolant deux Rois.
BALDE.	BALDE.
Le Ciel qui veut deux morts, en ſouffrira bien trois.	Le Ciel qui veut deux morts, en souffrira bien trois.
Q liixe m.	Q liixée m.
Non non, puiſque ie dois viure en voſtre memoire, DaigneZ rester tous deux, & reſter pour ma gloire.	Non non, puisque ainsi dois vivre en votre mémoire, Daignez rester tous deux, et rester pour ma gloire.
TRASONTE.	TRASONTE.
Vouloir que ie deuienne heureux par vos malheurs.	Vouloir que ie deuienne heureux par vos malheurs.
YOLTARE.	YOLTARE.
Vous en eſtes auſſi de mes perſecuteurs;	Vous en êtes aussi de mes persécuteurs;
Amy, c’eſt là l’effet d’vne amitié ſi rare De vouloir auiourd’huy triompher de Voltare?	Ami, c'est là l'effet d'une amitié si rare De vouloir aujourd'hui triompher de Voltare?
Ha!	Ha!
ceſſe d’accabler vn eſprit abbatu, Qui fait auec regret vn Acte de vertu.	cesse d'accabler un esprit abattu, Qui fait avec regret un Acte de vertu.
Enfin pour m’obliger aimez vous l’vn & l’autre, ue voſtre cœur ſoit ſien, & que le ſien ſoit voſtre;	Enfin pour m'obliger aimez -vous l'un et l'autre, ue votre cœur soit sien, et que le sien soit votre;
Diuiſé dans les deux, quand vous les aurez ioints Ce qui demeurera de moy, ſe perdra moins.	Divisé dans les deux, quand vous les aurez joints Ce qui demeurera de moi, se perdra moins.
ViueZ enſemble heureux.	Vivez ensemble heureux.
BALDE.	BALDE.
Quel heur apres mon crime?	Quel heur après mon crime?
Mais Adolphe reuient, nous ſçaurons la Victime.	Mais Adolphe revient, nous saurons la Victime.
BALD E.	BALD E.
Dolphe, hé bien ſçait-on la volonté des Dieux?	Dolphe, hé bien sais-on la volonté des Dieux?
SCENE CINQVIESME.	SCÈNE CINQUIÈME.
ADOLPHE.	ADOLPHE.
VOLTARE.	VOLTARE.
Pendant voſtre entretien nous ferons nos adieux.	Pendant votre entretien nous ferons nos adieux.
Voltare & Traſonte ſortent.	Voltare et Trasonte sortent.
ADOLPHE.	ADOLPHE.
Madame, tout le Peuple attend vos Sacrifices, Qui luy doiuent (dit-il)ronurene Dieux propices, Et vous coniurent tous auec meſme ferueur, Que voſtre Maieſté les haſte en leur faueur.	Madame, tout le Peuple attend vos Sacrifices, Qui sens doivent (dit-il)ronurene Dieux propices, Et vous conjurent tous de même ferveur, Que votre Majesté les hâte en leur faveur.
Mais pas vn ne comprend ce grand deüil qu’elle exNe ſçachant point encor qui ſera la Victime;	Mais pas un ne comprend ce grand deuil qu'elle exNe sachant point encor qui sera la Victime;
prin.	prin.
Meſme apres que le Prestre a fait tout ſon pouuoir Pour ſçauoir quelle elle eſt, & ne l’a pù ſçauoir.	Même après que le Prêtre a fait tout son pouvoir Pour sçauoir quelle elle est, et ne l'a pu sçauoir.
BALDE.	BALDE.
Luy ſeul ignore donc ce que le Ciel demande?	Lui seul ignore donc ce que le Ciel demande?
ADOLPHE.	ADOLPHE.
Et ie ne penſe pas que perſonne l’entende.	Et ici ne pense pas que personne l'entende.
BALDE.	BALDE.
Mon amour me l’a dit.	Mon amour me l'a dit.
ADOLPHE.	ADOLPHE.
Ce mauuais conſeiller, L’amour n'eſt pas l’Oracle ou vous deuez aller;	Ce mauvais conseiller, L'amour n'est pas l'Oracle ou vous devez aller;
C’eſt aux Dieux à parler, & c’eſt leur interprete Qui les doit expliquer quand leur reſponce est faite.	C'est aux Dieux à parler, et c'est leur interprète Qui les doit expliquer quand leur réponse est faite.
BALDE.	BALDE.
Voltare eſt la Victime, helas!	Voltare est la Victime, hélas!
ie le ſçay bien.	Hé le sais bien.
ADOLPHE.	ADOLPHE.
Ce n’eſt pas ſon aduis, & ce n’eſt pas le mien.	Ce n'est pas son avis, et ce n'est pas le mien.
Craignez pourtant.	Craignez pourtant.
BALDE.	BALDE.
Et qui?	Et qui?
ADOLPHE.	ADOLPHE.
Le Ciel.	Le Ciel.
BALDE.	BALDE.
Il me fait grace.	Il me fait grâce.
ADOLPHE.	ADOLPHE.
Il peut vous affliger.	Il peut vous affliger.
BALDE.	BALDE.
Il m’aime.	Il m'aime.
ADOLPHE.	ADOLPHE.
Il vous menace.	Il vous menace.
BALDE.	BALDE.
Il eſt de mon party s’il ſauue mon Eſpoux.	Il est de mon parti s'il sauve mon Époux.
ADOLPHE.	ADOLPHE.
Ie le ſouhaitte ainſi, mais ie crains ſon courroux.	Je le souhaite ainsi, mais ie crains son courroux.
Faites-le conſulter, & ſi dans ſon Oracle Difficile à comprendre il reſtoit quelque obſtacle, De ces De ces ſens ambigus qu’on ne peut aſſeurer, Aſſembie( le Conſeil pour en deuverer.	Faites-le consulter, et si dans son Oracle Difficile à comprendre il restait quelque obstacle, De ces De ces sens ambigus qu'on ne peut assurer, Assembie( le Conseil pour en deverer.
BALDE.	BALDE.
Ouy, ie vais le mander pour tirer aſſeurance, Ou de nostre ſalut, ou de noſtre ſouffrance.	Oui, Seigneur vais le mander pour tirer assurance, Ou de notre salut, ou de notre souffrance.
Melite, alleZ ſur l’heure, aſſembleZ mon Conſeil;	Mélite, allez sur l'heure, assemblez mon Conseil;
y ous airte que uenani le bouener au dorcil Ie veux abſolument ſortir d’inquietude, Redoutant moins le mal que ſon incertitude.	y ous airte que ouvenani le bouéner au dorcil Je veux absolument sortir d'inquiétude, Redoutant moins le mal que son incertitude.
Melite ſort.	Mélite sort.
Et toy Ciel qui paroiſt t’adoucir enuers moy, Pourueû que ta bonté daigne eſpargner le Roy, Nomme s’il eſt quelqu’vn que tu veüilles qu’il meure, Aſſeuré que ma main l’immolera ſur l’heure:	Et toi Ciel qui paraît t'adoucir envers moi, Pourvu que ta bonté daigne épargner le Roi, Nomme s'il est quelqu'un que tu veuilles qu'il meure, Assuré que ma main l'immolera sur l'heure:
Mais ſur tout ſauue moy dans cette extremité, Et de l’ingratitude, & de l’impieté.	Mais sur tout sauve moi dans cette extrémité, Et de l'ingratitude, et de l'impiété.
Balde ſort.	Balde sort.
SCLIVEOIXXIEOIVIE ADOLPHE ſeul.	SCLIVEOIXXIEOIVIE ADOLPHE seul.
Aroiſſe qui croit mieux ſeruir le Roy Traſonte, neeς Ou qui de ſes emplois luy rẽde vn meilleur cõpte;	Araisse qui croit mieux servir le Roy Iasonte, née Ou qui de ses emplois toujours rède un meilleur compte;
C’eſt auoir par adreſſe opprimé ſon Riual, Et mon inuention ne reüſſit pas mal.	C'est avoir par adresse opprimé son Rival, Et mon invention ne réussit pas mal.
De la Religion voiller vne iniuſtice, Du nom d’vne vertu couurir vn artifice;	De la Religion voiller une injustice, Du nom d'une vertu couvrir un artifice;
Sous des pretextes faux faire perir vn Roy, Traſonte, ce grand coup n'appartenoit qu’à moy;	Sous des prétextes faux faire périr un Roi, Trasonte, ce grand coup n'appartenait qu'à moi;
Moy ſeul en qui la Reine a quelque confiance, Puis faire que ſon bras aide à noſtre vangeance;	Moi seul en qui la Reine a quelque confiance, Puis faire que son bras aide à notre vengeance;
Et la faiſant reſoudre à perdre ſon Eſpoux, La mettre ainſi contr'elle, elle meſme pour nous:	Et la faisant résoudre à perdre son Époux, La mettre ainsi contre elle, elle -même pour nous:
On eſt deuant l’Oracle;	On est devant l'Oracle;
allons-en voir l’iſſuë, Sçachons ſi noſtre attente 'est remplie ou deçeuë:	allons-en voir l'issue, Sachons si notre attente 'est remplie ou deçeuë:
Au moins iuſques icy nous n’auons pas fait peu, Que Balde dans ce iour veuille accomplir ſon vœu;	Au moins jusques ici nous n'avons pas fait peu, Que Balde dans ce jour veuille accomplir son vœu;
Et l’ayant miſe au point de conſulter l’Oracle, Voltare ne peut plus ſe ſauuer ſans miracle:	Et l'ayant mise au point de consulter l'Oracle, Voltare ne peut plus se sauver sans miracle:
Il n’eſt rien que ſa mort qui puiſſe plaire aux Dieux, Et c'eſt en ce païs celuy qui vaut le mieux.	Il n'est rien que sa mort qui puisse plaire aux Dieux, Et c'est en ce pays celui qui vaut le mieux.
Fin du quatrieſme Acte.	Fin du quatrième Acte.
SCENE PREMIERE.	SCÈNE PREMIÈRE.
auis ADOLPHE, RVTILE P ADOLTIE.	avis ADOLPHE, RVTILE P DOLTIE.
MY, qu'auons nous fait, c’eſt la Reine elle meſmes Que demandent les Dieux?	MI, qu'avons nous fait, c'est la Reine elle mêmes Que demandent les Dieux?
TILE.	TILE.
Leur rigueur eſt extréme.	Leur rigueur est extrême.
ADOLPHE.	ADOLPHE.
I’auois crû iuſqu’icy que Voltare mourroit, Et qu'à Traſonte ainſi la Reine demeuroit;	J'avais crû jusqu'ici que Voltare mourrait, Et qu'à Trâonte ainsi la Reine demeurait;
L C’eſt moy qui la preſſois de tenir ſa parole:	 L'est moi qui la pressais de tenir sa parole:
