AVA DAMES.	AVA DAMES.
4 VOY que ie ne paroiſſe pas deuãt vous auec toute la pompe &toute la magnificẽce, qu’ont accouſtumé d’auoir, les perſonnes de macõdition:	4 VOY que je ne paraisse pas devant vous avec toute la pompe ettoute la magnificence, qu'ont accoutumé d'avoir, les personnes de maconcition:
j’eſpere que vous n’oublierez pas, que i’ay porté des Scẽptres & des Courennes;	j'espère que vous n'oublierez pas, que j'ai porté des Scẽptres et des Courennes;
que ie me ſuis veuë deux fois ſur le Thrône;	que ici me suis vue deux fois sur le Thrône;
& que les Princes dont ie ſuis ſortie, ont eſté les Maiſtres du monde.	et que les Princes dont toutes suis sortie, ont été les Maîtres du monde.
Mais, aimables & illuſtres Dames, ie ne vous fay pas ſouuenir de ma gloire, pour vous obliger au reſpect:	Mais, aimables et illustres Dames, je ne vous fais pas souvenir de ma gloire, pour vous obliger au respect:
il ſuffit que vous ayez quelque pitié de mes infortunes:	il suffit que vous ayez quelque pitié de mes infortunes:
& ie ne vous parle de l’eſtat olorieux où ie me ſuis veuë, que pour vous porter plus aiſément à cette pitié, quand vous verrez celuy où ie ſuis reduite.	et personne ne vous parle de l'état olorieux où arrête me suis vue, que pour vous porter plus aisément à cette pitié, quand vous verrez celui où je suis réduite.
Ie crains qu’il ne ſe trouue des eſprits aſſez injuſtes pour dire que i’ay merité mes diſgraces:	Je crains qu'il ne se trouve des esprits assez injustes pour dire que j'ai mérité mes disgrâces:
& des Cenſeurs aſſez ſeueres, pour blaſmer vne affection toute pure & & toute innocente.	et des Censeurs assez sévères, pour blâmer une affection toute pure et et toute innocente.
Il eſt des gens qui croyent qu’on ne peut iamais rien aymer ſans crime, parce qu’ils n’ont iamais rien aymé ſans cela:	Il est des gens qui croient qu'on ne peut jamais rien aimer sans crime, parce qu'ils n'ont jamais rien aimé sans cela:
& qui condamnent toute la terre, parce qu’ils en ſont condamnez.	et qui condamnent toute la terre, parce qu'ils en sont condamnés.
C’eſt contre cette dangereuſe eſpece d’hommes, que i’implore voſtre aſſiſtance:	C'est contre cette dangereuse espèce d'hommes, que j'implore votre assistance:
& c’eſt par voſtre propre gloire que ie vous coniure, de vouloir deffẽdre la mienne.	et c'est par votre propre gloire que je vous conjure, de vouloir défendre la mienne.
Dittes leur donc, en parlant pour vous & pour moy, que l’Amour & l’Honneur ſont touſiours enſemble, quand la Vertu les a joincts:	Dites leur donc, en parlant pour vous et pour moi, que l'Amour et l'Honneur sont toujours ensemble, quand la Vertu les a joints:
qu’il eſt des flames ſi pures, qu’elles n’ont iamais de fumée:	qu'il est des flammes si pures, qu'elles n'ont jamais de fumée:
& vn feu ſi detaché de la matiere, qu’il ſubſiſte touſiours ſans elle, auſſi bien que l’Elementaire.	et un feu si détaché de la matière, qu'il subsiste toujours sans elle, aussi bien que l'Elementaire.
Dittes leur que s’il ſe trouue des corps en la nature, que le feu ne deſtruit iamais;	Dittes leur que s'il se trouve des corps en la nature, que le feu ne détruit jamais;
il eſt de meſme des eſprits dont l’innocence eſt à l’eſpreuue, des plus ardentes affections.	il est de même des esprits dont l'innocence est à l'épreuve, des plus ardentes affections.
Dittes leur que ces elprits amoureux & purs, ſont dans le feu comme l’or:	Dittes leur que ces élprits amoureux et purs, sont dans le feu comme l'or:
mais qu’ils y ſont comme luy ſans alteration, & ſans que leur prix diminuë.	mais qu'ils y sont comme lui sans altération, et sans que leur prix diminue.
En fin, illuſtres & belles Dames, dirtes leur encor, que la flame que i allumay dans Cartage, iuſtifie celle qu’Vrſace auoit allumée en mon cœur:	En fin, illustres et belles Dames, dirtes leur encor, que la flamme que j' ai dans Carthage, justifie celle qu'Unsace avait allumée en mon cœur:
& qu’vne perſonne qui voulut mourir pour conſeruer ſa pureté, n’auoit garde de viure pour la ternir.	et qu'une personne qui voulut mourir pour conserver sa pureté, n'avait garde de vivre pour la ternir.
Que ſi leur courage inflexible ne ſe rend point, faites les ſouuenir qu’il eſt honteux, à des hommes de leur Nation, de m’eſtre plus inhumains que ne me le furent, & les Goths, & les Vandales:	Que si leur courage inflexible ne se rend point, faites les souvenir qu'il est honteux, à des hommes de leur Nation, de m'être plus inhumains que ne me le furent, et les Goths, et les Vandales:
& que ie ſerois bien malheureuſe, ſi ie trouuois des monſtres plus eruels en France, que ie n’en rencontray en Affrique:	et que ici serais bien malheureuse, si on trouvais des monstres plus ervels en France, que ie n'en rencontrai en Affrique:
puis que l’vne en eſt appellée la mere, & que quelques vns ont eſcrit, qu’il n’y en a iamais en l’autre.	puis que l'une en est appelée la mère, et que quelques uns ont écrit, qu'il n'y en a jamais en l'autre.
Si i’obtiens cette faueur de vous pour la reconnoiſtre en en quelque façon;	Si j'obtiens cette faveur de vous pour la reconnaître en en quelque façon;
ie publieray par tout l’Vniuers, que la ciuilité Françoiſe eſt incomparable;	aires publierai par tout l'Univers, que la civilité Française est incomparable;
que le merite des Dames y eſt ſans eſgal;	que le mérite des Dames y est sans égal;
& que les Beautez Greques cedent aux voſtres, encor qu’vne d’entr’elles, ait embraſé toute l’Aſie, & fait armer toute l’Europe.	et que les Beautés Greques cèdent aux vôtres, encor qu'une d'entr'elles, ait embrasé toute l'Asie, et fait armer toute l'Europe.
VRSACE, Cheualier Romain	VRSACE, Chevalier Romain
en habit d’Eſclaue.	en habit d'Esclave.
TRHGRCOMEDIE.	TRHGRCOMEDIE.
11 GCEI IELMIIERE.	11 GCEI IELMIIERE.
OLIMBRE, VRSACE, OLICHARSIS.	OLIMBRE, VRSACE, OLICHARSIS.
2 OLIMBRE.	2 OLIMBRE.
Nfin vous le voyez ce Palais glorieux, Où l’on retient l’objet qui plaiſt tant à vos yeux:	Nfin vous le voyez ce Palais glorieux, Où l'on retient l'objet qui plaît tant à vos yeux:
experience, Mais gardez de ſçauoir par voſtre Qu'on perd vn grãd deſſein par trop d’impatience:	expérience, Mais gardez de Savoir par votre Qu'on perd un grand dessein par trop d'impatience:
Vrſace en m’attendant ſuſpendez vos douleurs;	Vrsace en m'attendant suspendez vos douleurs;
Faites qu’Olicharſis apprenne vos mal-heurs;	Faites qu'Olicharsis apprenne vos malheurs;
Qu’il en ſçache le cours, qu’il enſçache les cauſes;	Qu'il en sache le cours, qu'il ensçache les causes;
Et i’iray cependant ſçauoir l’eſtat des choſes:	Et j'irai cependant savoir l'état des choses:
Nous voicy dans Cartage, où tendoient vos deſirs;	Nous voici dans Carthage, où tendaient vos désirs;
Nous voicy dãs Cartage, où ſentibio mes praiſirs;	Nous voici dans Carthage, où sentibio mes praisirs;
Et bien-toſt nous verrons auec vn peu d’adreſſe, La belle Imperatrice, & ma belle Maitreſſe.	Et bientôt nous verrons auecait peu d'adresse, La belle Impératrice, et ma belle Maitresse.
Demeurez inconnu, puis qu’il vous eſt aiſé, A Si vous n’vſez point mal-d’vn habit deſguiſé, Ne precipitons rien, moderez voſtre enuie, Et pour l’amour d’Eudoxe, allongez voſtre viez Sauuez-vous pour ſauuer cét Aſtre des beautez, Et conqueſtez vn bien que vous ſeul meritez:	Demeurez inconnu, puis qu'il vous est aisé, À Si vous n'usez point mal-d’un habit déguisé, Ne précipitons rien, modérez été envie, Et pour l'amour d'Eudoxe, allongez votre viez Sauvez-vous pour sauver cet Astre des beautés, Et conquêtez un bien que vous seul méritez:
Si grande eſt ſa vertu, la voſtre n’eſt pas moindre?	Si grande est sa vertu, la vôtre n'est pas moindre?
Rendez-vous ſur le port, où i’iray vous reioindre.	Rendez-vous sur le port, où j'irai vous rejoindre.
Vous, ne deſcouurez pas que nous ſoyons venus Pour agir d’autant mieux, n’eſtans point reconnus;	Vous, ne découvrez pas que nous soyons venus Pour agir d'autant mieux, n'étant point reconnus;
Mais eſtoignez vos pas, ainſi que vos triſteſſes, De cét appartement, où ſont les trois Princeſſes;	Mais étoignez vos pas, ainsi que vos tristesses, De cet appartement, où sont les trois Princesses;
Enfin voſtre deſir a ſatisfaict vos yeux.	Enfin votre désir a satisfait vos yeux.
VRSACE.	VRSACE.
Laiſſez-moy dans ce lieu que ie prefere aux Cieux, Allez, mon cher Olimbre, où l’amour vous appelle, Soyez autant heureux, que vous eſtes fidelle, Et ſi le ſort deſtruit mon deſſein hazardeux, Souffrez enfin ma mort, & viuez pour nous deux.	Laissez-moi dans ce lieu que ie préfère aux Cieux, Allez, mon cher Olimbre, où l'amour vous appelle, Soyez autant heureux, que vous êtes fidèle, Et si le sort détruit mon dessein hasardeux, Souffrez enfin ma mort, et vivez pour nous deux.
OLICHARSIS.	OLICHARSIS.
I’aborde comme vous aux riues Affricaines, Quinze ans m’ont retenu dans les terres lointaines, Où le defir d’apprendre auoit porté mes pas, Et ie plains vos mal-heurs, mais ie ne les ſçay pas.	J'aborde comme vous aux rives Africaines, Quinze ans m'ont retenu dans les terres lointaines, Où le désir d'apprendre avait porté mes pas, Et Seigneur plains vos malheurs, mais je ne les sais pas.
Puis que par mon bon-heur, ma ſoy vous eſt connuë, De grace, monſtrez-moy voſtre ame toute nuë;	Puis que par mon bonheur, ma soi vous est connue, De grâce, montrez-moi votre âme toute nue;
Que ie ſçahe vos maux, pour vous en ſoulager;	Que quelque sçahe vos maux, pour vous en soulager;
Ie voudrois vous ſeruir, vueillez donc m’obliger;	Je voudrais vous servir, veuillez donc m'obliger;
Vn bien-heureux Deſtin a fait noſtre rencontre;	Un bienheureux Destin a fait ton rencontre;
Ie vous montre mon cœur, que le voſtre ſe montre.	Je vous montre mon cœur, que le vôtre se montre.
Au poinct où vos vertus ont ſceu me le rauir.	Au point où vos vertus ont su me le ravir.
I’affronterois l'Affrique, afin de vous ſeruir:	J'affronterais l'Afrique, afin de vous servir:
Et dans les grands perils, rencontrant de, amorces Ie perdrois Genſerie au milieu de ſes forces.	Et dans les grands périls, rencontrant de, amorces Je perdrais Genserie au milieu de ses forces.
VRSACE.	VRSACE.
Cher & fidele Amy, ie n’ay pas le pouuoir De cacher à yeux l’objet qu’ils veulent voir:	Cher et fidèle Ami, je n'ai pas le pouvoir De cacher à yeux l'objet qu'ils veulent voir:
Ie deſcouure vn ſecret d'vne impotance extréme, Mais en vous le diſant, c’eſt le dire à moy-meſme:	Je découvre un secret d'une impotance extrême, Mais en vous le disant, c'est le dire à moi-même:
Et ce ſeroit pecher, voyant voſtre pitié, Contre le iugement, & contre l’amitié, Si ie ne vous contois la ſuite d'vne hiſtoire, Difficile à ſouffrir, & difficile à croire:	Et ce serait pécher, voyant votre pitié, Contre le jugement, et contre l'amitié, Si apprendre ne vous contais la suite d'une histoire, Difficile à souffrir, et difficile à croire:
Eſcoutez donc enfin les effects differens De l’Amour & du Sort, deux ſuperbes Tyrans.	Écoutez donc enfin les effets différents De l'Amour et du Sort, deux superbes Tyrans.
Romt a veu ma naiſſance, & par mes deſtinées, Conſtantinople a veu mes premieres années, Là ie ſuiuis mon Maiſtre, eſtant enfant d’honneur, Diray-ie pour ma perte, ou bien pour mõ bon-heur?	Romût a vu ma naissance, et par mes destinées, Constantinople a vu mes premières années, Là ie suiuis mon Maître, étant enfant d'honneur, Dirai-je pour ma perte, ou bien pour mon bonheur?
Olimhre aux meſmes lieux ſuinit le meſme Maiſtre;	Olimhre aux mêmes lieux suinit le Seigneur Maître;
Le Ciel nous fit aymer en nous faiſant connoiſtre;	Le Ciel nous fit aimer en nous faisant connaître;
Noſtre ſaincte amitié commença lors vn cours, Qui ne ſçauroit finir qu’en fintpant my iours;	Notre sainte amitié commença lors un cours, Qui ne saurait finir qu'en fintpant mi jours;
Et dans les meſmes lieux la ſupréme puiſſance, (O courtois Affricain) fit noſtre connoiſſance:	Et dans les mêmes lieux la suprême puissance, (O courtois Affricain) fit notre connaissance:
L’Empereur Theodoſe, accablé de langueur, Et pouſſé d’vn deſir qu’il cachoit en ſon cœur, Obtient d’Honorius, dans le mal qu’il le preſſe, Que Valentinian face vn voyage en Grece:	L'Empereur Théodose, accablé de langueur, Et poussé d'un désir qu'il cachait en son cœur, Obtient d'Honorius, dans le mal qu'il le presse, Que Valentinian face un voyage en Grèce:
L’Empereur d’Occident, afin de l’obliger, Conſent à ce depart, conſent à s’affliger;	L'Empereur d'Occident, afin de l'obliger, Consent à ce départ, consent à s'affliger;
Et dans le port d’Oſtie, auec beaucoup de peine, Il quitte ſon Neueu ſur la mer incertaine, Où le vent fauorable, & qui le fut touſiours, Nous mit dans le Boſphore en moins de quinze iours.	Et dans le port d'Ostie, avec beaucoup de peine, Il quitte son Neu sur la mer incertaine, Où le vent favorable, et qui le fut toujours, Nous mit dans le Bosphore en moins de quinze jours.
Ie ne vous diray point auec quelle allegreſſe Ce Prince fut receu des peuples de la Grece, Ny comme l’Empereur qui s’en alloit finir, A noſtre heureux abord, ſembla ſe rajeunir, Vous ne l’ignorez pas;	Je ne vous dirai point avec quelle allégresse Ce Prince fut reçu des peuples de la Grèce, Ni comme l'Empereur qui s'en allait finir, A que heureux abord, sembla se rajeunir, Vous ne l'ignorez pas;
& ma ſeule infortune, Dont le triſte recit n’a rien qui n’importune, Ne me fournit que trop, & dequoy diſcourir, Et de quoy n’eſtre plus, ſi ie pouuois mourir:	et ma seule infortune, Dont le triste récit n'a rien qui n'importune, Ne me fournit que trop, et dequoy discourir, Et de quoi n'être plus, si grands pouvais mourir:
Mais ie croy que le ſort dans ma peine eternelle Me fit naiſtre immortel, afin qu’elle fuſt telle;	Mais ie cy que le sort dans ma peine éternelle Me fit naître immortel, afin qu'elle fût telle;
Cur mon umncuuirement auroit rompu ſes fers, Pour s’exẽpter pluſtoſt des maux qu’elle a ſouffers.	Cur mon umncuirement aurait rompu ses fers, Pour s'expter plutôt des maux qu'elle a soufferts.
Pourſuiuez.	Poursuivez.
OLICHARSIS.	OLICHARSIS.
VRSACE.	VRSACE.
C’eſt icy qu’il faut que ie retrace Dedans mon ſouuenir, mon heur & ma diſgrace, Et que par vn mélange, & de bien & de mal, Ie monſtre les effets de mon Aſtre inegal:	C'est ici qu'il faut que je retrace Dedans mon souvenir, mon heur et ma disgrâce, Et que par un mélange, et de bien et de mal, Je montre les effets de mon Astre inégal:
Il m’éleua trop baut pour n’auoir rien à craindre;	Il m'éleva trop baut pour n'avoir rien à craindre;
Il m’a trop abaiſſé, pour ſouffrur ſans me plaindrez Il me fit plus heureux que les Roys ne le ſont, Et me fait plus ſouffrir que les damnez ne font;	Il m'a trop abaissé, pour souffrir sans me plaindrez Il me fit plus heureux que les Rois ne le sont, Et me fait plus souffrir que les damnés ne font;
Enfin ie vis Eudoxe, & contre l’apparence, Quoy qu’vn Sceptre entte nous miſt de la differẽce Que ſon rang, & le mien, n’euſſent aucun rapport, Il fallut obeir aux volontez du ſort.	Enfin ici vis Eudose, et contre l'apparence, Quoi qu'un Sceptre entte nous mît de la différence Que son rang, et le mien, n'eussent aucun rapport, Il fallut obéir aux volontés du sort.
I'oppoſay la raiſon à ſa force infinie;	J'opposai la raison à sa force infinie;
Ie taſchay d’empeſcher ſa fiere tyrannie;	Je tâchai d'empêcher sa fière tyrannie;
Ie combattis long-temps ce ſuperbe vainqueur;	Je combattis longtemps ce superbe vainqueur;
Mais il ſe fallut rendre.	Mais il se fallut rendre.
& pel dre enfin ſon cœur.	et pel dre enfin son cœur.
OLICHARSIS.	OLICHARSIS.
Quoy, vous aimaſtes donc Fudoxe?	Quoi, vous aimâtes donc Fudoxe?
VRSACE.	VRSACE.
Ie l'aduouë, Et ſoit que voſtre eſprit, ou me blâme, ou me louë;	Je l'avoue, Et soit que votre esprit, ou me blâme, ou me loue;
Qu’il approuue ou condamne vn eſtrange diſcours;	Qu'il approuve ou condamne un étrange discours;
Ie l’aimé, ie l’adore, & le feray touſiours.	Je l'aimé, Seigneur l'adore, et le ferai toujours.
Mun uepenpinuruenio puonenſpat amt atteinte, Le reſpect impoſa le filenee à ma plaimte;	Mun uepenpinuruenio puonenspat amt atteinte, Le respect imposa le silène à ma plaimte;
le urnſtay jans parter, daus mes feux innocens;	le ouvrnstai jans parter, daus mes feux innocents;
Et ie perdis mon cœur, mais non pas le bon ſens.	Et ici perdis mon cœur, mais non pas le bon sens.
OLICHARSIS.	OLICHARSIS.
Qui luy deſcouurit donc voſtre ſecrette flame?	Qui avait découvrit donc votre secrète flamme?
VRSACE.	VRSACE.
Ha!	Ha!
ce furent mes yeux qui trahirent mon ame:	ce furent mes yeux qui trahirent mon âme:
Le ſentimens du cœur s’y peignirent trop bien;	Le sentiments du cœur s'y peignirent trop bien;
La Princeſſe les vid, & ie n’en ſçauous rien.	La Princesse les vit, et ici n'en sçauous rien.
O le diuin objet qui s’offre à ma memoire!	Ô le divin objet qui s'offre à ma mémoire!
Ce temeraire cœur ſe vid comblé de gloire:	Ce téméraire cœur se vit comblé de gloire:
Il deſcouurit les pleurs dont i’auois l’œil noyé;	Il découvrit les pleurs dont j'avais l'œil noyé;
Mais quoy, cét lxion ne fut pas foudroyé;	Mais quoi, cet lxion ne fut pas foudroyé;
Car plus heureux que ſage, en ſa haute aduanture, Cét ohjet adoré de toute la Nature, Cette Princeſſe Illuſtre en ſes rares vertus, Fit voir quelque pitié des coups qu’il auoit eus, Et par certains regards obligeans, mais modeſtes, I'apris qu’elle ſouffroit ſes flames manifeſtes, Et que ce temeraire, en ſa preſomption Aet ferent pouut pauy par fonuuuer ſion.	Car plus heureux que sage, en sa haute aventure, Cet ohjet adoré de toute la Nature, Cette Princesse Illustre en ses rares vertus, Fit voir quelque pitié des coups qu'il avait eus, Et par certains regards obligéants, mais modestes, J'apris qu'elle souffrait ses flammes manifestes, Et que ce téméraire, en sa présomption Aet serent pouut pau ver fonuuuer sion.
OLICHARSIS.	OLICHARSIS.
Enfin elle aima donc?	Enfin elle aima donc?
VRSACE.	VRSACE.
Pour mon ame enflamée, Elle fit bien aſſez en ſouffrant d’eſtre aimée;	Pour mon âme enflammée, Elle fit bien assez en souffrant d'être aimée;
Elle fit hien aſſez, quand il me fut permis De parler de l’eſtat où ſes yeux m’auoient mis;	Elle fit hien assez, quand il me fut permis De parler de l'état où ses yeux m'avaient mis;
Et de luy faire voir, ſans meriter ſa haine, Mon amour, mes reſpects, mes deuoirs, & ma peine.	Et de jours faire voir, sans mériter sa haine, Mon amour, mes respects, mes devoirs, et ma peine.
Mais admirez icy les caprices du ſort!	Mais admirez ici les caprices du sort!
Cette Princeſſe aymable, & que i’aymois ſi fort, Ne fit aucun progrez dans l’eſprit de mon Maiſtre, Vne autre paßion en ſon cœur ſe vid naiſtre;	Cette Princesse aimable, et que j'aimais si fort, Ne fit aucun progrès dans l'esprit de mon Maître, Une autre passion en son cœur se vi naître;
I'aymay trop-hautement, & ſon cœur raualé, D’vn feu moins eſclatant voulut eſtre bruſlé:	J'aimai trophautement, et son cœur ravalé, D'un feu moins éclatant voulut être brûlé:
Car enfin, il eſtime, il cherit, il adore Vne fille au Palais, qui s’appelle Iſidores Qui ſeruoit la Princeſſe, & qui pour la beauté Ne luy cedoit pas moins que pour la qualité.	Car enfin, il estime, il chérit, il adore Vune fille au Palais, qui s'appelle Isidores Qui servait la Princesse, et qui pour la beauté Ne lui avait pas moins que pour la qualité.
OLICHARSIS.	OLICHARSIS.
Sans doute cét amour ne nuiſit pas au voſtre.	Sans doute cet amour ne nuisit pas au vôtre.
VRSACE.	VRSACE.
Ie tiray du profit de la faute d'vn autre:	Je tirai du profit de la faute d'Hô autre:
La Princeſſe parut ſenſible au dernier point;	La Princesse parut sensible au dernier point;
Comme il ne l’aimoit pas, elle ne l’aima point:	Comme il ne l'aimait pas, elle ne l'aima point:
Et comme ie l’aimois par vn bon-heur inſigne, Elle eut vn peu d’amour pour vn objet indigne.	Et comme ici l'aimais par un bonheur insigne, Elle eut un peu d'amour pour un objet indigne.
O momens glorieux, entretiens rauiſſans, Secrets teſmoins d’amour, qui charmiez toꝰ mes ſes?	Ô momens glorieux, entretiens ravissants, Secrets témoins d'amour, qui charmiez toujours mes?
O douceurs iuſqu’alors aux mortels inconnuës, Helas!	Ô douceurs jusqu'alors aux mortels inconnues, Hélas!
reſpondez-moy, qu’eſtes vous deuenuës?	répondez-moi, qu'êtes vous devenues?
Voicy le point fatal qui cauſa ma fureur:	Voici le point fatal qui causa ma fureur:
Le Prince eſtant Neueu de ce grand Empereur, Il luy promit ſa fille, afin qu’en vn ſeul homme, Et l’Empire de Grece, & l’Empire de Rome, Puiſſent n’auoir enfin qu’vn Maiſire quelque iour;	Le Prince étant Neu de ce grand Empereur, Il était promit sa fille, afin qu'en un seul homme, Et l'Empire de Grèce, et l'Empire de Rome, Puissent n'avoir enfin qu'un Maisire quelque jour;
Icy l’Ambition l’emporte ſur l’Amonr;	Ici l'Ambition l'emporte sur l'Amonr;
L’vn meſpriſe Iſidore, & l'autre m’ahandonne;	L'un méprise Isidore, et l'autre m'ahandonne;
Tous deux rompent leurs fers, pour prendre vne Couronne;	Tous deux rompent leurs fers, pour prendre un Couronne;
Et ſans auoir d’amour que pour la vanité, Du faiſte du bon-heur ie ſuis precipité.	Et sans avoir d'amour que pour la vanité, Du faîte du bonheur fait suis précipité.
OLICHARSIS.	OLICHARSIS.
Mais que luy dites-vous en cette conjencture?	Mais que lui dites-vous en cette conjencture?
VRSACE.	VRSACE.
Aprés auoir ſouffert en ſecret la torture, Aprés que le reſpect, le deſpit, la douleur, Le ſouuenir du bien, & l'objet du mal-heur, Eurent bien combattu dans mon ame offenſée.	Après avoir souffert en secret la torture, Après que le respect, le dépit, la douleur, Le souvenir du bien, et l'objet du malheur, Eurent bien combattu dans mon âme offensée.
Enfin le deſeſpoir exprima ma penſce.	Enfin le désespoir exprima ma pensée.
Quoy (luy dis-ie) Madame, ainſi vous me quittez, Et vous m’allez punir de mes temeritez;	Quoi (lui dis-je) Madame, ainsi vous me quittez, Et vous m'allez punir de mes témérités;
Mais bien que ie reçoiue vne ſenſible injure, Non, non, ne craignez pas le tiltre de parjure;	Mais bien que ici reçoive une sensible injure, Non, non, ne craignez pas le titre de parjure;
Ie lu dedans vos yeux la peur que vous auez, Ie n’en parleray point, puiſque vous le ſçauez, Et daus quelque douleur que mon ame s’abyſme, Ie diray qu’elle eſt iuſte, en puniſſant mon crime;	Je lu dedans vos yeux la peur que vous avez, Je n'en parlerai point, puisque vous le savez, Et daus quelque douleur que mon âme s'abîme, Je dirai qu'elle est juste, en punissant mon crime;
Que ma preſomption merite vn chaſtiment;	Que ma présomption mérite un châtiment;
Elle fut infinie, & tel eſt mon tourment:	Elle fut infinie, et tel est mon tourment:
Ie ſouffre des douleurs que ie ne ſçaurois dire;	Je souffre des douleurs que ici ne saurais dire;
Mille bourreaux ſecrets commencent mon martyre;	Mille bourreaux secrets commencent mon martyre;
Mon cœur eſt dechiré;	Mon cœur est déchiré;
la triſtęſſe & l’horreur, Le deſeſpoir, la mort, la rage, & la fureur, Tout cela m’enuironne, & tout cela s’approche!	la tristsse et l'horreur, Le désespoir, la mort, la rage, et la fureur, Tout cela m'environne, et tout cela s'approche!
Mais ie les receuray ſans vous faire vn reproche;	Mais ici les recevrai sans vous faire un reproche;
Touſiours, touſiours l’amour gardera ſon pouuoir, Et me tiendra touſiours aux termes du deuoir.	Toujours, toujours l'amour gardera son pouvoir, Et me tiendra toujours aux termes du devoir.
Ie ne vous diray point, qu’en bruſlant de ſes flames, L’amour malgré le ſort peut eſgaler les ames;	Je ne vous dirai point, qu'en brûlant de ses flammes, L'amour malgré le sort peut égaler les âmes;
Et que s’il agit bien ſur deux eſprits troublez, Le ſceptre & la houlette en ſeront aſſemblez Ie ne Ie ne vous diray point, que ſuiuant la Nature, Ceux qui veulent aymer la vertu toute pure, Ne conſiderent pas, aprés ce rare objet, Si celuy qui la monſtre, eſt Monarque, ou ſuiet.	Et que s'il agit bien sur deux esprits troublés, Le sceptre et la houlette en seront assemblez Je ne Je ne vous dirai point, que suivant la Nature, Ceux qui veulent aimer la vertu toute pure, Ne considèrent pas, après ce rare objet, Si celui qui la montre, est Monarque, ou sujet.
Ie ne vous dir ay point que voſtre ame royalle N’a iamais condamné ma flame ſans eſgale, Quelle approuua mes feux, mes fers & mes liens;	Je ne vous dir ai point que votre âme royale N'a jamais condamné ma flamné sans égale, Quelle approuva mes feux, mes fers et mes liens;
Et qu’en les approuuant, elle monſtra les ſiens.	Et qu'en les approuvant, elle montra les siens.
