Oüy puis que pour vous ſeule on brûleroit l’encens.	Oui puis que pour vous seule on brûlerait l'encens.
Si javois comme vous les mains dans ſes richeſſes, O que bien autrement je vous le punirois, Sans perdre comme vous le temps à chaque fois, A prendre trois ou quatre pieces?	Si javais comme vous les mains dans ses richesses, Ô que bien autrement je vous le punirais, Sans perdre comme vous le temps à chaque fois, À prendre trois ou quatre pièces?
Deux fois en un ſeul jour vous ne pouvés donner, Vôtre ménagement me fait bien ſoupçonner, Encor que vuns jojes une muin ceut & rure, Que vous eſtes la main du Dieu garde threſors, Qu'un ſouverain pouvoir fit couper de ſon corps, Pour être trop avare.	Deux fois en un seul jour vous ne pouvez donner, Votre ménagement me fait bien soupçonner, Encor que vœu des une muin ceut et rure, Que vous êtes la main du Dieu garde thresors, Qu'un souverain pouvoir fit couper de son corps, Pour être trop avare.
Neſtes vous point pluiôt la main de ce beau fleuve Qui ſur un ſable d’Or voit rouler ſon chriſtail, Qui ne glace ſes eaux que pour faire l'émail, Que ſur ſes bords le Marchand treuve:	Nêtes -vous point pluiôt la main de ce beau fleuve Qui sur un sable d'Or ait rouler son chistail, Qui ne glace ses eaux que pour faire l'émail, Que sur ses bords le Marchand trouve:
Enfin charmante main je ne ſçay qu'en penſer, Ie diray ſeulement pour vous recompenſer, Rien n’eſt égal à vous de l’un à l’autre Pole, On connoiſt à vôtre Or un pouvoir plus qu’humain, Et vous eſtes d’un Dieu la liberale main, Ou celle du Pactole.	Enfin charmante main je ne sais qu'en penser, Je dirai seulement pour vous récompenser, Rien n'est égal à vous de l'un à l'autre Pole, On connaît à votre Or un pouvoir plus qu'humain, Et vous êtes d'un Dieu la libérale main, Ou celle du Pactole.
SCENE HVITIEME.	SCÈNE HVITIEME.
LE CVISTRE.	LE CVISTRE.
FINE-EPICE,	FINE-ÉPICÉ,
E CVISTRE.	E CUISTRE.
Enfin vous ſuccombés à cette main funeſte, Que vous devés hayr cent fois plus que la peſte, L’Or qu’elle vous preſente a de ſi doux appas, Que tout autre party n’a plus rien que de bas.	Enfin vous succombez à cette main funeste, Que vous devez haïr cent fois plus que la peste, L'Or qu'elle vous présente a de si doux appas, Que tout autre parti n'a plus rien que de bas.
Vous aves moutne tunbre uu Royaume des Veſſes, Et Monſieur le Boureau n'a qu'à gratter ſes feſſes:	Vous avez moutne tunbre u Royaume des Vesses, Et Monsieur le Boureau n'a qu'à gratter ses fesses:
Ie ne m'explique point peut être des demain, Vous recevrés affront de cette infame main.	Je ne m'explique point peut être des demain, Vous recevrez affront de cette infâme main.
INE-EPICE.	INÉ-ÉPICÉ.
A te dire le vray je trouve icy mon compte, L’autre party trop bas m’auroit couvert de honte;	À te dire le vrai je trouve ici mon compte, L'autre parti trop bas m'aurait couvert de honte;
La fille du Boureau qu'eujfent uit mes parens.	La fille du Boureau qu'eujfent uit mes parents.
E CVISTRE.	E CUISTRE.
De cette autre Hymenée ils ſeront peu contens.	De cette autre Hyménée ils seront pu contents.
INE-EPICE.	INÉ-ÉPICÉ.
T'en auray quant à moy l’ame fort ſatisfaite.	T'en aurai quant à moi l'âme fort satisfaite.
La fille à mon avis eſt de belle defaite, Vous ne faites pas mal de la prendre à treize ans, Car avant qu’elle paſſe encor quatre Prin-temps, 1e ceus tionnt mu ieſte, & je veux qu’on me tonde, Si comme un autre Athlas elle ne porte un monde.	La fille à mon avis est de belle défaite, Vous ne faites pas mal de la prendre à treize ans, Car avant qu'elle passe encor quatre Printemps, 1e ceus tionnut mu jette, et je veux qu'on me tonde, Si comme un autre Athlas elle ne porte un monde.
FINE-EPICE.	FINE-ÉPICÉ.
Elle porte, il eſt vray, la poſſe jur te dos, Mais cette belle außi n’a point d’autres defauts.	Elle porte, il est vrai, la posse jur te dos, Mais cette belle aussi n'a point d'autres défauts.
LE CVISTRE, Elle n’en vaut pas moins pour être un peu voutée, Lue en uu jomtement la taille un peu gâtée:	LE CVISTRE, Elle n'en vaut pas moins pour être un peu voutée, Lue en u jomtement la taille un peu gâtée:
N'a-t’elle pas encor un bras court, l’autre long, Les deux yeux tnaßteux, i'un vvai tantre rond.	N'a-t-elle pas encor un bras court, l'autre long, Les deux yeux tnassteux, j'un vay tantre rond.
FINE-EPICE.	FINE-ÉPICÉ.
Qu'importe elle voit clair c’eſt ce que je demande.	Qu'importe elle voit clair c'est ce que je demande.
LE CVISTRE.	LE CVISTRE.
N'a t'elle pas außi la bouche horrible & grande, Le front étroit & court, & le menton pointu, La teſte en vray Therſite, & le pied droit tortu, L’eſtomach d’un chapon, la gorge noire & platte, Et juſques au jabot plus ſeiche qu’une latte, Quand à ſon inviſible on peut ſans deviner, Le croire encor plus laid, mêmes s’imaginer, A ſon corps mi-party qu’elle eſt Hermaphrodite, Mais je n’en parle plus ſi cela vous irrite.	N'a t'elle pas aussi la bouche horrible et grande, Le front étroit et court, et le menton pointu, La tête en vrai Thersite, et le pied droit tortu, L'estomac , L'un chapon, la gorge noire et platte, Et jusques au jabot plus seiche qu'une latte, Quand à son invisible on peut sans deviner, Le croire encor plus laid, mêmes s'imaginer, A son corps mi-parti qu'elle est Hermaphrodite, Mais je n'en parle plus si cela vous irrite.
F INE-EPICE.	 FNE-ÉPICÉ.
Non parles franchement.	Non parles franchement.
LE CVISTRE.	LE CVISTRE.
Enfin elle a tout laid, Et ſon corps eſt bâty pour monter un valet, Vous me deviés charger de cette marchandiſe:	Enfin elle a tout laid, Vous me corps est bâti pour monter un valet, Vous me deviez charger de cette marchandise:
dur pour un Gentu nomme elle n'eſt pas de miſe.	dur pour un Gentu nomme elle n'est pas de mise.
FINE-EPICE.	FINE-ÉPICÉ.
En recompenſe außi ſon eſprit eſt bien fait.	En récompense aussi son esprit est bien fait.
LE CVISTRE.	LE CVISTRE.
Vous n’avés pas ſujet d’en eſtre ſatisfait;	Vous n'avez pas sujet d'en être satisfait;
Et je conſens d’avoir le corps couvert de froncles, Si vous ne l’enfermés comme on a fait ſes oncles, Son eſprit s’evapore à tant de vantté, ’il court au grand galop à cette extremité:	Et je consens d'avoir le corps couvert de froncles, Si vous ne l'enfermez comme on a fait ses oncles, Son esprit s'évapore à tant de vanté, 'il court au grand galop à cette extrémité:
Elle va bien enfler autrement ſon courage, Par le nouvel éclat de ce beau mariage.	Elle va bien enfler autrement son courage, Par le nouvel éclat de ce beau mariage.
INEEPICE Son oncle eſt Menuiſier qui n’eſt point renfermé,	INEPICE Son oncle est Menuisier qui n'est point renfermé,
LE CVISTRE.	LE CVISTRE.
Ne connoiſſés vous pas celuy de Mortomé?	Ne connaissez -vous pas celui de Mortomé?
Ce Robin eſt ſon oncle, il traiſne une ſequelle, De neveux de couſins de folle parentelle, Qu’il pouroit avec eux, tant jeunes que griſons, Remplir du moins le tiers des petites maiſons.	Ce Robin est son oncle, il traîne une séquelle, De neveux de cousins de folle parentelle, Qu'il pourrait avec eux, tant jeunes que grisons, Remplir du moins le tiers des petites maisons.
I INE-EPICE.	I INNÉ-ÉPICÉ.
Ces fols de Mortomé ſont-ils de ſon lignâge?	Ces fols de Mortomé sont-ils de son lignâge?
LE CVISTRE Vous le ſçaurés bien mieux apres ce mariage.	LE CVISTRE Vous le saurez bien mieux après ce mariage.
Ce fol de Mortomé ſe trouve accompagné, D’un frere encor plus fol au bourg de Champagné.	Ce fol de Mortomé se trouve accompagné, D'un frère encor plus fol au bourg de Champagné.
Sans perdre le reſpect vous eſtes je l’âvouë, Vn mauvais ignorant, car je ſçay que la Nouë, Vous en a devant moy cent fois entretenu:	Sans perdre le respect vous êtes je l'âvouë, Un mauvais ignorant, car je sais que la Noue, Vous en a devant moi cent fois entretenu:
Rappelés le diſcours qu’il vous en a tenu.	Rappelez le discours qu'il vous en a tenu.
Ne vous a-il pas dit qu’on ſe rend miſerable, En prenant un party bas & deſ-honnorable:	Ne vous a-il pas dit qu'on se rend misérable, En prenant un parti bas et déshonorable:
Qu’il vaut mieux demeurer toûjours, en celibat;	Qu'il vaut mieux demeurer toujours, en célibat;
Que de faire un Himen que nôtre cœur combat.	Que de faire un Hymen que notre cœur combat.
C’eſt eſtre ſans honneur, lâche, & puſillanime, C’eſt avoir de ſoy même, ou point, ou peu d’eſtime, Que de ſoüiller ſon nom d’un reproche eternel:	C'est assez sans honneur, lâche, et pusillanime, C'est avoir de soi même, ou point, ou peu d'estime, Que de souriller son nom d'un reproche éternel:
Que d’épouſer des fols, par un vœu ſolemnel.	Que d'épouser des fols, par un vœu solennel.
S’il faut que Fine-epice avec ces fols ſe range, Il reſſemble au pourceau qui ſe veautre en la fange.	S'il faut que Fine-épicé avec ces fols se range, Il ressemble au pourceau qui se veautre en la fange.
Pour payer dignemenut l’effect de vôtre amour, Ie gage qu’on vous garde un aſſes mauvais tour.	Pour payer dignement l'effet de votre amour, Je gage qu'on vous garde un assure mauvais tour.
Ces fols de pere en fils pour parer au reproche, Que vous leurs en feriés vous dreſſent l’anicroche:	Ces fols de père en fils pour parer au reproche, Que vous leurs en feriez -vous dressent l'anicroche:
Tant fin puiſſiés vous eſtre, on vous affinera:	Tant fin puissiez vous être, on vous affinera:
Quelqu'un de võtre nom lon enſorcelera Soit Perrette, ou ſon fils ils vous la gardent belle:	Quelqu'un de vendre nom lon ensorcelera Soit Perrette, ou son fils ils vous la gardent belle:
Ils ſçavent des poiſons qui troublent la cervelle, Quicõque en eſt atteint, va, court parmy les champs, Sent un feu devorant qui luy broüille le ſens, Et ſans reflection s'emporte de maniere, Qu’il cherche à ſe jetter au fonds d’une riviere:	Ils savent des poisons qui troublent la cervelle, Quicõque en est atteint, va, court parmi les champs, Sent un feu dévorant qui avait brouille le sens, Et sans réflection s'emporte de manière, Qu'il cherche à se jeter au fonds d'une rivière:
Au plus fort des hyvers il quite ſes habits, Tant ſa raiſon eſt foible & ſes ſens interdits.	Au plus fort des hivers il quite ses habits, Tant sa raison est faible et ses sens interdits.
Ce funeſte poiſon qui rend fol le plus ſage, Perſeuere toüjours à faire ſon ravage, Tient toüjours la raiſon dans la captivité, Iuſqu’à ce que le cœur par ſon activité, Concentre au tour de ſoy la chaleur naturelle, Et conſommant l’humeur qui troubloit la cervelle;	Ce funeste poison qui rend fol le plus sage, Persévère tendre à faire son ravage, Tient toujours la raison dans la captivité, Jusqu'à ce que le cœur par son activité, Concentre au tour de soi la chaleur naturelle, Et consommant l'humeur qui troublait la cervelle;
Rétablit de l’eſprit les belles fonctions, Et remet en vainqueur l’ordre à ſes actions, Sans qu'aucun ſouvenir demeure en la memoire	Rétablit de l'esprit les belles fonctions, Et remet en vainqueur l'ordre à ses actions, Sans qu'aucun souvenir demeure en la mémoire
De ſon extravagance et de cette humeur noire:	De son extravagance et de cette humeur noire:
Il ne ſçauroit penſer que Jamais ſa raiſon, Ayt ſenty les efforts de ce cruel poiſon:	Il ne saurait penser que Jamais sa raison, Ait senti les efforts de ce cruel poison:
Comme apres que la fiévre ardente & frenetique, A quitté le mala de à quelque jour critique, Des mana uont fon eſprtt ſut ſi fert tourmeente, S’éfacent comme un ſonge aupres de ſa ſanté.	Comme après que la fièvre ardente et frénétique, A quitté le mala de à quelque jour critique, Des mana ouvont son éprît sut si sert tourmeente, S'éfacent comme un songe auprès de sa santé.
FINE-E PICE.	FINE-E PICE.
Vn fol à Champagné c’eſt noſtre voiſinage, Comment n’ay je rien ſceu de ce beau perſonnage.	Un fol à Champagné c'est notre voisinage, Comment n'ai je rien su de ce beau personnage.
LE CVISTRE.	LE CVISTRE.
lous te vonnopes cien ouna jalles tignorant.	lous te vonnopes cien ouna jales tignorant.
FINE-EPICE.	FINE-ÉPICÉ.
Ma foy ie ne ſçay rien de cet extravagant.	Ma foi ici ne sais rien de cet extravagant.
LE CVISTRE.	LE CVISTRE.
Pour vous en rafraiſchir tant ſoit peu la memoire, Je vous veux de ce fol raconter une hiſtoire.	Pour vous en rafraîchir tant soit peu la mémoire, Je vous veux de ce fol raconter une histoire.
Ce fol ſe croid le Dieu qui preſide aux enfers, Il traiſne autour de ſoy deux cens peſant de fers, Son col porte une chaiſne & l’autre ſa ceinture, Sans que ce mal-heureux ou s’en plaigne ou murmure, L’une au bras, l’autre au pied le tiennent attaché, Sans que pour ce grand poids il ſe trouve empêché, Comme Dieu de l’enfer ce perſonnage veille, Sans vouloir qu’un moment ſon maigre corps ſommeille, Et ſon corps à veiller ſi bien accouſtumé Fait & deffait ſans ceſſe un feu mal allumé Dont pour ne perdre pas un moment la lumiere, Luy-même de ſes yeux il coupa la paupiere, Son front étroit & court eſt chargé de cheveux, Le poil de ſes ſourcils eſt außi gros qu’affreux, Sa barbe à ſes genoux luy deſcend à poignée, (Et	Ce fol se croid le Dieu qui préside aux enfers, Il traîne autour de soi deux cents pesant de fers, Son col porte une chaîne et l'autre sa ceinture, Sans que ce malheureux ou s'en plaigne ou murmure, L'une au bras, l'autre au pied le tiennent attaché, Sans que pour ce grand poids il se trouve empêché, Comme Dieu de l'enfer ce personnage veille, Sans vouloir qu'un moment son maigre corps sommeille, Et son corps à veiller si bien accoutumé Fait et Fait sans cesse un feu mal allumé Dont pour ne perdre pas un moment la lumière, -même de ses yeux il coupa la paupière, Son front étroit et court est chargé de cheveux, Le poil de ses sourcils est aussi gros affreux, Sa barbe ses genoux lui descend poignée, 
Et je croy que iamais elle ne fut peignée:	Et je crois que jamais elle ne fut peignée:
Cette execrable barbe eſt de couleur d’airain, Et marque de ce fol le pouvoir ſouveraiu, Sa peruque fait peur, ſa graſſe chevelure, Semble un nid de corbeaux plutôt qu’une coëffure.	Cette exécrable barbe est de couleur d'air, Et marque de ce fol le pouvoir souveraiu, Sa pervque fait peur, sa grasse chevelure, Semble un nid de corbeaux plutôt qu'une coffre.
Il ſort de vilains poils de ſon nés court & plat Que juſqu’à ſon menton cet infame rabat, Ce bouquin eſt tout nud, il brave la froidure Et des plus grands hyvers, il mépriſe l’iniure, Ce beau Roy des enfers a pour ſceptre un tiſon, Dont en mille façons il noircit ſa maiſon, A ſes commandemens il appelle les diables, Il leur fait comme Roy cent diſcours effroyables, Les oblige à courir parmy tout l’univers Pour traiſner des méchans les ames aux enfers, Quand il les croid venus, il fait regner Iuſtice, Et de ſes mal-faicteurs il regle le ſupplice, Vn jour que ce vieux fol eſtoit en belle humeur, Vn Noble Limouſin, pourtant homme d’honneur, Avoit fait un employ pour enlever la fille, D’un quidam de ce Bourg d’aßés bonne famille, Qui retenoit caché dans ſa propre maiſon, Par excés de bonté, cet homme ſans raiſon, Et qui ſans le ſçavoir, s’eſtoit par mariage:	Il sort de vilains poils de son nés court et plat Que jusqu'à son menton cet infâme rabat, Ce bouquin est tout nu, il brave la froidure Et des plus grands hivers, il méprise l'injure, Ce beau Roi des enfers a pour sceptre un tison, Dont en mille façons il noircit sa maison, À ses commandements il appelle les diables, Il leur fait comme Roy cent discours effroyables, Les oblige à courir parmi tout l'univers Pour traîner des méchants les âmes aux enfers, Quand il les croid venus, il fait régner Iustice, Et de ses mal-faicteurs il regle le supplice, jour que ce vieux fol ait en belle humeur, Noble Limousin, ma homme honneur, y fait un emploi pour enlever la fille, un quidam de ce Bourg assés bonne famille, Qui retenoit caché dans sa es ma, Par excés de bonté, cethomme sans raison, Et qui sans de sçavoir, es par malh
Conjoint avec la ſœur de ce beau perſonnage, Ie ne vous diray pas le nom de l’enleveur, nt peur dt it commeitre avec ux chicanneur, Qui luy feroit ſentir qu’il n’eſt pas legitime, D'enlever ſa Maiſtreſſe & que c’eſt un grand crime, Qu'on châtie aujourd’huy fort rigoureuſement, Quiconque fait employ pour un enlevement,	Conjoint avec la sœur de ce beau personnage, Je ne vous dirai pas le nom de l'enlèveur, n' peur dt it commeitre avec ux chicanneur, Qui lui ferait sentir qu'il n'est pas légitime, D'enlever sa Maîtresse et que c'est un grand crime, Qu'on châtie aujourd'hui fort rigoureusement, Quiconque fait emploi pour un enlèvement,
Pourtant ce Limouſin ſe fait donner main-forte, Et prend de ſes amis une nombreuſe eſcorte, Et ſe voyant ainſi fort bien accompagne, Il meine ſa milice au Bourg de Champagné, Il diſpoſe ſes gens & guette ſa Maiſtreſſe, Pout s’en rendre le Maiſtre au ſortir de la Meſſe, Cette fille eut avis que ſon fier Limouſin.	Pourtant ce Limousin se fait donner main-forte, Et prend de ses amis une nombreuse escorte, Et se voyant ainsi fort bien accompagne, Il mi sa lice au Bourg de Champagné, Il dispose ses gens et guette sa Maîtresse, Pout s'en rendre le Maître au sortir de la Messe, Cette fille eut avis que son fier Limousin.
De la prendre par force avoit fait le deſſein, Elle ſe renferma dedans la Sacriſtie, D’où par le Preſbitere ayant fait ſa ſortie, D’un pas viſte & leger elle entre en ſa m'aiſon, uelqu’vn des Limouſins s’écria trahiſon Et dans cette maiſon ſe jettant avec elle, De ſes autres amis le ſecours il appelle, Cette fille éperduë entre en l’appartement, Ou plutôt dans l’enfer de cet extravagant, On m’enleve dit-t’elle & tombe à demy morte Dans ce lieu plein d’horreur, où ſans fermer la porte, Ce Roy viſionnaire attend ces enleveurs, Venés ſubir dit-t’il, en ce lieu de mal heurs, Le ſupplice eternel que meritent vos crimes, Venés de mes Boureaux les- infames victimes, Venés dans les enfers expier vos forfaits, Et brûler dans le feu qui ne moura jamais, Le bruit, l'étrange bruit qui ſortoit de ſes chaiſnes, Son parler étonnant qui menaçoit de peines, Les demons invoquës par cet extravagant Euſſent jetté la peur au cœur du plus conſtant, Le ſon, l’horrible ſon de ſa voix effroyable, Qui meſmes dans l’enfer euſt eſtonné le diable:	De la prendre par force avoit fait le dessein, Elle se renferma dedans la Sacristie, par le Presbitere ayant fait sa sortie, un pas viste et léger elle entre en sa m'aison, uelqu’ des Limousins écria trahison Et dans cette maison se jettant avec elle, De ses autres amis le secours il appelle, Cette fille éperduë entre en appartement, Ou plutôt dans enfer de cet extravagant, On enleve ditelle et tombe demi morte Dans ce lieu plein horreur, sans fermer la porte, Ce Roy visionnaire attend ces enleveurs, Venés subir ditil, en ce lieu de mal heurs, Le supplice éternel que méritent vos crimes, Venés De la Boureauxles- par force, Avait fait le desexpier vos forfaits, Et brûler dans le se quine moura dedans, La Sacristie, D'étrange où qui par le Prés bite, Son re ayant qui fait sa sortie, Les D' un pas vit extravagant Et lege la peur au cœur du plus constant, Le en, horrible en de sa voix effroyable, Qui m 'alenfer eût lon le diable,
Son corps noir & ſeiche joint au feu de ſes yeux,	Son corps noir et seiche joint au feu de ses yeux,
Et la ferocité de ſon viſage affreux, Eit à ces Limouſins prendre une prompte fuitte, Et comme ſi le diable euſt eſté à leur ſuitte, Ils furent iuſqu’au ſoir ſans pouvoir ſe parler, A peine oſerent-t’ils enfin ſe regarder, Ils ont depuis appris quel eſt ce perſonnnage, Et noſtre Limouſin fuyant ce mariage, A cent fois rendu grace aux bontés du Seigneur, De l’avoir preſerve de ce cruel mal-heur, Tant un homme d’honneur doit craindre la diſgrace Devoir des gens tarés entrer dedans ſa race.	Et la ferocité de son visage affreux, Eit à ces Limousins prendre une prompte fuite, Et comme si le diable eût été à leur suite, Ils furent jusqu'au soir sans pouvoir se parler, À peine osèrent-t-ils enfin se regarder, Ils ont depuis appris quel est ce personnage, Et notre Limousin fuyant ce mariage, A cent fois rendu grâce aux bontés du Seigneur, De l'avoir preserve de ce cruel malheur, Tant un homme d'honneur doit craindre la disgrâce Devoir des gens tarez entrer dedans sa race.
ICE.	ICE.
Enmtelle el Jeir piayamte a Ore?	Enmtelle él Ir piayamte à Ore?
E CVISTRE.	E CUISTRE.
Ce n'eſt pas tout	Ce n'est pas tout
FINE-EPICE.	FINE-ÉPICÉ.
Ie le ſçay mieux que toy de l’un à l’autre bout, Mais tu ſçais le beſoin que i'ay de mariage.	Je le sais mieux que toi de l'un à l'autre bout, Mais tu sais le besoin que j'ai de mariage.
E CVISTRE.	E CUISTRE.
Celuy-cy vous fait honte.	Celui-cy vous fait honte.
NE-EPICE.	NE-ÉPICÉ.
Et c'eſt de quoy i'enrage.	Et c'est de quoi j'enrage.
RCTE OCENVE INEMIEICE	RCTE OCENVE INEMIEICE
LA POINTVE ſeule.	LA POINTUE seule.
Lluſtre ambition, qui partage mon bien, TTu regne ſur mon ame avecques trop d’empire:	Llustre ambition, qui partage mon bien, TTu règne sur mon âme avec trop d'empire:
Donue moy tout entier ce que mon cœur deſire, Ou ne me donne rien.	Donve -moi tout entier ce que mon cœur désire, Ou ne me donne rien.
Ie consens à ce mariage, Ie l’approuve j’en fais eſtat Il eſt noble il eſt Magiſtrat:	Je consens à ce mariage, Je l'approuve j'en fais état Il est noble il est Magistrat:
Mais je n’y conſens plus quand je penſe à ſon âgéRenoncer aux plaiſirs pour eſtre en dignité:	Mais je n'y consens plus quand je pense à son âgéRenoncer aux plaisirs pour être en dignité:
Renoncer au bon-heur pour la Magiſtrature, C’eſt acheter bien cher, & même avec uſure, Vn peu de vanité.	Renoncer au bonheur pour la Magistrature, C'est acheter bien cher, et même avec usure, Un peu de vanité.
Fault-il êpouſant Fine-Epice, Eſtre Martyre de l’honneur, Non non évitons ce mal-heur, Que ma vanité cherche vn autre ſacrifice.	Fault-il êpousant Fine-Épice, Estre Martyre de l'honneur, Non non évitons ce malheur, Que ma vanité cherche un autre sacrifice.
Mais que dis-je inſensée, & quel eſt mon erreur?	Mais que dis-je insensée, et quel est mon erreur?
Marcher au premier rang des premiers de la ville Epouſer un mary d’une illuſtre famille, N'eſt-ce pas du bon heur.	Marcher au premier rang des premiers de la ville Épouser un mari d'une illustre famille, N'est-ce pas du bon heur.
Satisfait aßés mon deſir, Et me donne aßés de plaiſir:	Satisfait assez mon désir, Et me donne assés de plaisir:
Ie le veux pour êpoux puiſqu’il me veut pour femme.	Je le veux pour époux puisqu'il me veut pour femme.
Ie le veux pour époux, & jay du repentir, D’avoir tant balancé:	Je le veux pour époux, et jay du repentir, D'avoir tant balancé:
mais quand je conſidere, Qu'il a de l’âge aßés pour eſtre mon grand pere, Ie n'y puis conſentir.	mais quand je considère, Qu'il a de l'âge aussi pour être mon grand -père, Je n'y puis consentir.
Mepriſons la Magiſtrature, A peine ay-je atteint quatorze ans, Quand je ſeray dans mon printemps, Fine-Epice ſera preſque en la ſepulture.	Meprisons la Magistrature, À peine ai-je atteint quatorze ans, Quand je serai dans mon printemps, Fine-Épice sera presque en la sépulture.
Que me ſervira lors l’ardeur de mes amours?	Que me servira lors l'ardeur de mes amours?
Que ſerviront mes feux aupres d’un inſenſible, Me nous condemnons point à faire l’impoßible, Paſſons mieux nos beaux jours.	Que serviront mes feux auprès d'un insensible, Me nous condemnons point à faire l'imposible, Passons mieux nos beaux jours.
Renonçons au doux' nom de femme, Ce beau nom n’a plus rien de-doux, Si Fine-Epice eſt noſtre époux, Il n’a que des glaçons pour éteindre ma flame.	Renonçons au doux' nom de femme, Ce beau nom n'a plus rien dedoux, Si Fine-Épice est notre époux, Il n'a que des glaçons pour éteindre ma flamme.
Mais laiſſer Fine-Epice & prendre ſon valet:	Mais laisser Fine-Épice et prendre son valet:
N’eſt-ce pas faire un choix tout afaict des-honnête, Ce penſer ſenlement me fait mal à la tête;	N'est-ce pas faire un choix tout afaict des-honnête, Ce penser senlement me fait mal à la tête;
Ce mâtin eſt trop laid.	Ce mâtin est trop laid.
Que je ſens une étrange peine!	Que je sens une étrange peine!
Mon cœur à tous deux engagé, Ne ſçauroit eſtre partagé, Car je n’ay pour tous deux que colere & que hayne Ma grand'mere & ma mere ont trop de cruauté,	Mon cœur à tous deux engagé, Ne saurait être partagé, Car je n'ai pour tous deux que colère et que haine Ma grand'gère et ma mère ont trop de cruauté,
De condemner ainſi ma plus tendre jeuneſſe A vivre ſans plaiſir, ou parmy la baſſeſſe, O quelle lâchete.	De condemner ainsi ma plus tendre jeunesse A vivre sans plaisir, ou parmi la bassesse, Ô quelle lâchete.
