1x 2 223 OMEDIE.	1x 2 223 OMEDIE.
M DESDIEE AVX IEVNES Ueufnes, & ahx vitiſes Piues.	M MESDIE AUX JEUNES Ueufnes, et ahx vitises Pives.
.	.
	
A PARIS Chez IEAN GVIGNARD, au premier pillier de la grand' Salle du Palais.	À PARIS Chez IEAN GUIGNARD, au premier pillier de la grand Salle du Palais.
M.	M.
DC.	DC.
XXXVII.	XXXVII.
Auec Priuilege du Roy	Avec Privilège du Roi
ũ D M ELLES Dames, a qui la Nature & l'honneur ne peuuent & permettre de donner l'aliment S neceſſaire à vos contentemens, les vnes par la perte de vos maris, & les autres pour n’oſer gouſter l’excellence du fruict de vie qui donne naiſſance aux creatures raiſonnables.	ũ LES AUTRES POUR Dames, a qui les Nature et l'honneur ne peuvent et permettre de donner l'aliment S nécessaire à vos contentements, les vnes par la perte de vos maris, et les autres pour n'oser goûter l'excellence du fruit de vie qui donne naissance aux créatures raisonnables.
Uoicy AliZon Fleurie vefue, & ſa ſœur Vieux Thaudis, a ij	OUoici Alison Fleurie veue, et sa sœur Vieux Thaudis, a ici
AVX IEVNES VEVEVLO ET aux vieilles Filles.	AUX JEUNES VEUEULO ET aux vieilles Filles.
fille aagee de ſoixante ans, qui dans l’extremité des desplaiſirs que vous pouue:	fille âge de soixante ans, qui dans l'extrémité dé plaisirs que vous pouve:
conceuoir, faute d’auoir la joüiſſance de l’inſtrument le plus vtile à la conſtructure d'vn corps agiſſant ſous la figure, d’vn homme, viennent par l’exemple de leur vie & de leur patience, vous monſtrer le miroir ſur lequel il faut, Meſdames, que vos esprits ſe conforment, que vos vertus ſe reiglent, que voſtre prudence ſemire, & que vos actions ſe faſſent, afin de trouuer des partis dignes de voſtre longue attente.	concevoir, faute d'avoir la jouissance de l'instrument le plus utile à la constructure d'un corps agissant sous la figure, d'H homme, viennent par l'exemple de leur vie et de leur patience, vous montrer le miroir sur lequel il faut, Mesdames, que vos esprits se conforment, que vos vertus se règlent, que votre prudence semire, et que vos actions se fassent, afin de trouver des partis dignes de votre longue attente.
C’eſt le parfait modelle d’vne vieille & vertueuſe amitié, recherchee de la Nobleſſe, de la Iuſtice, & du tiers Eſtat:	C'est le parfait modèle d'une vieille et vertueuse amitié, recherchée de la Noblesse, de la Justice, et du tiers État:
Dans la contemplation de laquelle vous trouuerez la verité du prouerbe, qui dit, Que dans vn vieux pot on fait ſouuent de bonne ſouppe;	Dans la contemplation de laquelle vous trouverez la vérité du proverbe, qui dit, Que dans un vieux pot on fait souvent de bonne soupe;
veu qu’apres vne inſinité de trauerſes qui ont accompagné la ſuite de leurs annees, elles ont heureuſement rencontré le palais de la felicité, dans lequel elles ſont entrees par la poſſeſſion de deux parfaits Amans, qui les faiſans iouir du bien ſi long-temps attendu, ont encores fait naiſtre l’occaſion des aduantageux mariages des trois filles d’AliZon Fleurie.	vu qu'après une insinité de traverses qui ont accompagné la suite de leurs années, elles ont heureusement rencontré le palais de le felicité, dans lequel elles sont entrées par la possession de deux parfaits Amants, qui les faisant jouir du bien si longtemps attendu, ont encore fait naître l'occasion des avantageux mariages des trois filles d'Alison Fleurie.
Il faut, MESDAMES, que vous n’eſperiez pas vne moindre recompenſe de voſtre ennuyeuſe attente, & que vous croyeZ que ce temps qui court n'eſt que pour atteindre le bon-heur qui vous eſt reſerue, & dont quelque iour le Ciel vous donnera vne entiere iouyſſance.	Il faut, MESDAMES, que vous n'espériez pas une moindre récompense de votre ennuyeuse attente, et que vous croyez que ce temps qui court n'est que pour atteindre le bonheur qui vous est réserve, et dont quelque jour le Ciel vous donnera une entière jouissance.
C’eſt ce que joumo auecques paſſion,	C'est ce que joumo auecques passion,
MESDAMES,	MESDAMES,
Voſtre tres-humble & affectionné ſeruiteur, L.	Votre très-humble et affectionné serviteur, L.
C.	Ç.
DISCRET,	DISCRET,
Aduertiſſement important au Lecteur.	Aduertissement important au Lecteur.
29 ECTEVR, apres tant de rares & ſerieux Poëmes Tragiques, qui depuis quelques * 2uυgs mois ont paru ſur le theatre de nos Comediens auec tant d’éclat & d’admiration de chacun, que le ſeul bruit du Cid de Monſieur Corueille a fait ſouhaiter par toutes les bonnes villes de la France, qu’il y euſt autant de troupes de Mondory, qu’il y en a maintenant de gendarmes dans la Flandre, afin de ioüir du contentement de la repreſentation de leurs merueilleuſes Tragedies.	29 ECTEUR, après tant de rares et sérieux Poèmes Tragiques, qui depuis quelques * 2ugs mois ont paru sur le théâtre de nos Comédiens avec tant d'éclat et d'admiration de chacun, que le seul bruit du Cid de Monsieur Corueille a fait souhaiter par toutes les bonnes villes de la France, qu'il y eût autant de troupes de Mondori, qu'il y en a maintenant de gendarmes dans la Flandre, afin de ju du contentement de la représentation de leurs merveilleuses Tragédies.
I’ay creu qu’en ſuitte de ces ſujets ſi graues & ſi triſtes, il tefalloit donner quelque piece cuſe contre ſon foible iugement:	J'ai cru qu'en suite de ces sujets si graves et si tristes, il tefalloit donner quelque pièce cuse contre son faible jugement:
Auquel routesfois ie cederay touſiours l’honneur deub aux Poëtes de ſa qualité.	Auquel routefois on céderai toujours l'honneur devb aux Poètes de sa qualité.
Au ſurplus, Lecteur, ie t’aduertis, qu’encores que dans ceſte piece i’aye mis des Airs & des Chanſons à dãcer, les Acteurs qui la repreſenteront comme extrememet facile, en pourront chanter de celles qu’ils ſçaurc at, ſans s’abſtraindre à celles-là qui ne ſeruent à mon ſujet, que pour en faire voir l’ordre & la ſuitte:	Au surplus, Lecteur, ie t'avertis, qu'encores que dans cette pièce j'aie mis des Airs et des Chansons à dãcer, les Acteurs qui la représenteront comme extrêmemet facile, en pourront chanter de celles qu'ils saurc at, sans s'abstraindre à celles-là qui ne servent à mon sujet, que pour en faire voir l'ordre et la suite:
Que tu ne trouueras pourtant ny dans les regles des vingt-quatre heures, ny ſans rencontre de voyelles.	Que tu ne trouveras pourtantgez dans les règles des vingt-quatre heures, ni sans rencontre de voyelles.
Mais vn ſujet veritable eſt plus difficile à traicter, que les fabuleux des Autheurs du temps, Adieu.	Mais un sujet véritable est plus difficile à traicter, que les fabuleux des Auteurs du temps, Adieu.
AV SIEVR D, SVR SA Comedie v’AnEOII.	AU SIEUR D, SUR SA Comédie v'AnEOII.
Stime qui voudra tous les ſujets tragiques, AliZon qui fait rire à bien d’autres appas, Ceux-là font les humains ſi fort mellancoliques, Qu'il faut que celle-cy les tirent du treſpas.	Stime qui voudra tous les sujets tragiques, Alison qui fait rire à bien d'autres appas, Ceux-là font les humains si fort mélancoliques, Qu'il faut que celle-cy les tirent du trépas.
D.	D.
R.	R.
A luy-meſme.	A lui-même.
Ariane, le Cid, Ceſar, & Cleopatre, Paroiſſans au theatre, Ont rauy les esprits par l’oreille & les yeux:	Ariane, le Cid, César, et Cléopâtre, Paraissant au théâtre, Ont ravi les esprits par l'oreille et les yeux:
Mais qui preferera le plaiſir à triſteſſe, Doit cherir Alizon autant qu’vne Deeſſe Comme vn preſent des Cieux.	Mais qui préférer le plaisir à tristesse, Doit chérir Alison autant qu'une Deesse Comme présent des Cieux.
C.	Ç.
M.	M.
POLIANDRE,	POLYANDRE,
BELANGE,	BÉLANGE,
FLORIANE.	FLORIANE.
A 101 L 12 omedie.	À 101 L 12 omédie.
A ACTE PREMIER.	A ACTE PREMIER.
FLEVRIE.	FLEURIE.
LE COLPORTEVR.	LE COLPORTEUR.
MAISTRE IEREMIE.	MAÎTRE IEREMIE.
MR KAROLV.	MR AROLU.
POLTANDRE, ROSELIS.	POLTANDRE, ROSELIS.
BELANGE.	BÉLANGE.
SCENE PREMIERE.	SCÈNE PREMIÈRE.
3 FLEVRIE.	3 FLEURIE.
AE prouerbe dit vray, qui m'apprend M SIS qu'vne femme ame, Perd auec ſon mary la moitié de ſon Qu'and la mort ſeparãt leurs deux cœurs bien Luy laiſſe pour jamais des regrets infinis.	AE prouerbe dit vrai, qui m'apprend M SIS qu'une femme âme, Perd avec son mari la moitié de son Qu'and la mort séparant leurs deux cœurs bien Lui laisse pour jamais des regrets infinis.
ſunis --.	sunis --.
Ha!	Ha!
que la mort du mien ma fait de faſcherie;	que la mort du mien ma fait de fâcherie;
Le pauure homme mouroit s’il ne voyoit Fleurie Touſiours aupres de luy, rire, chanter, cauſer, Et n'eſtoit vn moment ſans me venir baiſer:	Le pauvre homme mourait s'il ne voyait Fleurie Toujours auprès de soins, rire, chanter, causer, Et n'était un moment sans me venir baiser:
I'eſtois ſon Alizon, ſon amour, ſon delice, I'eſtois ſa Penelope, il eſtoit mon Vlyſſe:	J'étais son Alison, son amour, son délice, J'étais sa Penelope, il était mon Vlysse:
Chez nous tous les plaiſirs eſtoiẽt à l’abandõ, Si i’eſtois ſon Aſtree, il eſtoit Celadon.	Chez nous tous les plaisirs étaient à l'abandion, Si j'étais son Astre, il était Céladon.
Bref toutes ces douceurs, ceſte amitié parfaite Fait qu'encor tous les iours mon esprit le regrette.	Bref toutes ces douceurs, cette amitié parfaite Fait qu'encor tous les jours mon esprit le regrette.
Mais helas!	Mais hélas!
ce plaiſir euſt eſté bien plus doux Si de mes actions il n'euſt eſté jaloux.	ce plaisir eût été bien plus doux Si de mes actions il n'eût été jaloux.
Ie ne ſçay quels appas j'auois en ma ieuneſſe, Mais chacun m'appelloit ſa petite maiſtreſſe.	Je ne sais quels appas j'avais en ma jeunesse, Mais chacun m'appelait sa petite maîtresse.
I'auois des ſeruiteurs en chacune ſaiſon Autãt que pas vn Prince en ait en ſa maiſon:	J'avais des serviteurs en chacune saison Autant que pas un Prince en ait en sa maison:
uiul.	Ouiul.
& uvaiſtre Hieremie Vous diroient biẽ encor que i'eſtois leur amie.	et aistre Hieremie Vous diraient biẽ encor que j'étais leur amie.
Mais quoy que nos diſcours fuſſent fort innocens, ſens;	Mais quoi que nos discours fussent fort innocents, sens;
COMEDIE.	COMÉDIE.
Iuſqu'au poinct quelquesfois de m'auoir condamnée A ne point voir le iour que par la cheminee, Ie ne voyois les champs que dans vn vieux tableau Où eſtoit peint Mõceaux auec Fõtainebleait:	Jusqu'au point quelquefois de m'avoir condamnée À ne point voir le jour que par la cheminée, Je ne voyais les champs que dans un vieux tableau Où était peint Mõceaux avec Faitainebleait:
Il n'auoit iamais mis ſon cœur à la verdure, Auſſi lay-je ſouuent appellé trop me dure.	Il n'avait jamais mis son cœur à la verdure, Aussi lai-je souvent appelé trop me dure.
En Hyuer, en Eſté, ie gardois le logis:	En Hiver, en Été, Seigneur gardais le logis:
I'ay cent fois ſouhaité d’eſtre Urgande ou Maugis Pour aller quelquesfois faire la promenade Quãd ſes goüttes au lict le retenoient malade:	J'ai cent fois souhaité d'être Urgande ou Maugis Pour aller quelquefois faire la promenade Quand ses goûtes au lit le retenaient malade:
Neaumoins auiourd’huy ſa ſeparation M'apporte en verité beaucoup d’affliction.	Neaumoins aujourd'hui sa séparation M'apporte en vérité beaucoup d'affliction.
Croyez, s’il faut vn iour que ie me remarie On me verra bien fort faire la rencherie:	Croyez, s'il faut un jour que je me remarie On me verra bien fort faire la renchérie:
1 I'ay deſia ſur les bras deux ou trois amoureux Qui du moindre regard s’eſtiment trop heux reux.	1 J'ai déjà sur les bras deux ou trois amoureux Qui du moindre regard s'estiment trop heux reux.
Mais combien que pour moy leur amour ſoit extreme, Ci aime.	Mais combien que pour moi leur amour soit extrême, Ci aime.
En voicy déja l’vn:	En voici déjà l'Hommes:
Or ſus vous diſ-je pas De moment en moment ils ſont deſſus mes pas.	Or sus vous dis-je pas De moment en moment ils sont dessus mes pas.
Ie me veux retirer au fond de mon allee:	Je me veux retirer au fond de mon allée:
Car ie ne me plaiſt pas d’eſtre tant cajollee;	Car ie ne me plaît pas d'être tant cajollée;
Encore celui-cy jargonne inceſſamment, Quoyqu’il faſſe ſans ceſſe vn meſme cõplimẽt.	Encore celui-cy jargonne incessamment, Quoiqu'il fasse sans cesse un même cõplimẽt.
LE COLPORTEVR.	LE COLPORTEUR.
Ay touſiours quelque choſe, & touſiours  quelque choſe, I'ay des liures icy tant en rime qu'en proſe, Le duel de deux gueux dedãs le pré aux Clers:	Ai toujours quelque chose, et toujours quelque chose, J'ai des livres ici tant en rime qu'en prose, Le duel de deux gueux dedans le pré aux Clers:
I'ay les noms des filloux, la miſere des Clers:	J'ai les noms des filloux, la misère des Clers:
I’ay les nouueaux Edits, les nouuelles gazetes:	J'ai les nouveaux Édits, les nouvelles gazètes:
I'ay la commodité des bottes & garſettes:	J'ai la commodité des bottes et garsettes:
I'ay le remede icy pour les paſles couleurs:	J'ai le remède ici pour les pâles couleurs:
I'ay l’amour des Sergens, la pitié des voleurs:	J'ai l'amour des Sergents, la pitié des voleurs:
I'ay tous les cõplimens de la langue Fraçoiſe, La perte depuis peu d’vne ieune Bourgeoiſe adu quartier que chacun m̃me des grauilliers:	J'ai tous les cõplimens de la langue Fraçoise, La perte depuis peu d'une jeune Bourgeoise aval quartier que chacun même des gravilliers:
.	.
.	.
.	.
.	.
.	.
*-	*-
I’ay le contract paſſé dans les hautberuilliers Entre Guillot Grand-jan & GilleteVẽtruë:	J'ai le contrat passé dans les hautbervilliers Entre Guillot Grand-jan et GilleteVẽtruë:
I’ay le cruel combat d’un cinge& d’vne gruë:	J'ai le cruel combat d'un cingeet d'une grue:
I'ay grande quãtité de bons liures nouueaux:	J'ai grande quantité de bons livres nouveaux:
Iay la maniere auſſi cõme on ſevre les veaux, Auec le teſtament du bon Gaultier-garguille:	Iais la manière aussi cõme on sèvre les veaux, Avec le testament du bon Gaulier-garguille:
I’ay le galland qu’il faut à une belle fille.	J'ai le gallant qu'il faut à une belle fille.
Voicyl inuẽtion pour prendre à toutes mains, Vtile aux Procureurs autant qu'aux Medecins:	Voicil inuẽtion pour prendre à toutes mains, Vtyle aux Procureurs autant qu'aux Médecins:
I'ay le pouuoir qu’on donne à chacune ſeruãte De coucher au grãd lictquand madame eſt abI'ay les perfectiõs de la dame AliZon (ſente.	J'ai le pouvoir qu'on donne à chacune servante De coucher au grand litquand madame est abI'ai les perfections de la dame Alizon (sente.
Pour captiuer chacun dans ſa belle priſon;	Pour captiver chacun dans sa belle prison;
Dans vn petit cahier i’ay la bõté des femmes:	Dans un petit cahier j'ai la bien des femmes:
I'aytoute leur malice en trois ouquatre rames:	J'aitoute leur malice en trois ouquatre rames:
I'ay la methode auſſi pour gaigner force eſcus:	J'ai la méthode aussi pour gagner force écus:
I'ay les liſtes icy des garces & cocus, [ternes:	J'ai les listes ici des garces et cocus, [ternes:
Et l’art de les trouuer iour & nuict ſans lanI'ay cõme il faut ſortir sãs payer auxtauernes:	Et l'art de les trouver jour et nuit sans lanIay cõme il faut sortir sans payer auxtavernes:
I'ay quelque choſe en fin pour tous les bons eſprits;	J'ai quelque chose en fin pour tous les bons esprits;
Voila le beau Palais ou loge ma Maiſtreſſe Qui ſurpáſſe en beauté la Romaine Lucrece;	Voilà le beau Palais ou loge ma Maîtresse Qui surpsse en beauté la Romaine Lucrece;
Ie ſçayque mõ humeur luy plaiſt extrememẽt, Que de ſes Amoureux ie ſuis le cher Amant:	Je sçayque mon humeur lui plaît extrêmement, Que de ses Amoureux ie suis le cher Amant:
ar dés qu'elle m'entẽd ievois ſon œil pareſtre, Si ce n’eſt à ſon huis, c'eſt à vne feneſtre.	ar dès qu'elle m'entẽd ievois son œil paraître, Si ce n'est à son huis, c'est à une fenêtre.
Puis qu'on ne luy void pas ſans doute elle eſt eul, aelrs;	Puis qu'on ne force voids pas sans doute elle est eul, aelrs;
Adieu belle priſon de mes vieilles amours.	Adieu belle prison de mes vieilles amours.
FLEVRIE.	FLEURIE.
En dépit du vilain, i’ay honte de vous dire Que i'ay laſché de l’eau à force de trop rire.	En dépit du vilain, j'ai honte de vous dire Que j'ai lâché de l'eau à force de trop rire.
Mõ Dieu qu’il eſt plaisãt, ſi i’auois biẽdequoy Et que ie le vouluſſe, il voudroit bien de moy:	Momme Dieu qu'il est plaisant, si j'avais biẽdequoy Et que ie le voulusse, il voudrait bien de moi:
Mais le proffit qu’il fait à crier des gazettes Ne pourroit en vn an no' fournir delunettes.	Mais le proffit qu'il fait à crier des gazettes Ne pourrait en un an no' fournir délunettes.
Non, ce n’eſt pas mon cas, i'ay des partis meilleurs, Ie ne veux empeſcher qu’il ſe pouruoye ailleurs:	Non, ce n'est pas mon cas, j'ai des partis meilleurs, Je ne veux empêcher qu'il se pourvoie ailleurs:
Que le bon homme donc y cnertne ja fortune.	Que le bon homme donc y cnertne ja fortune.
O dieux qu'en voicy vn qui ſouuent m'importune!	Ô dieux qu'en voici un qui souvent m'importune!
C’eſt maiſtre Hieremie:	C'est maître Hieremie:
En voila déja deux:	En voilà déjà deux:
Si l’on dit qu'à preſent ie ſuis ſans Amoureux Aduoüez maintenant que c’eſt bien ce m'éprendre.	Si l'on dit qu'à présent arrêt suis ans Amoureux Aduoüez maintenant que c'est bien ce m'éprendre.
tendre, Pour ne point m'amuſer ie ne veux pas l’atIoint que i’attends icy mon autre Seruiteur, Qui peut eſtre ialoux feroitquelque malheur.	tendre, Pour ne point m'amuser ici ne veux pas l'atIoint que j'attends ici mon autre Serviteur, Qui peut être jaloux ferait malheur.
SCENE TROISRIESME.	SCÈNE -TROISRIESME.
MAISTRE HIEREMIE.	MAÎTRE HIÈREMIE.
’Eſt grand cas qu’auiourd’huy dans le ſiecle où nous ſommes On ne fait plus eſtat de la vertu des hommes, Quelque belle action qu'ils puiſſent faire voir La recompenſe manque ou finit le deuoir:	Est fait cas qu'aujourd'hui dans le siècle où nous sommes On ne fait plus état de la vertu des hommes, Quelque belle action qu'ils puissent faire voir La récompense manque ou finit le devoir:
La thoiſon d’or n’eſt plus l’honneur de leur conqueſte;	La thoison d'or n'est plus l'honneur de leur conquête;
teſte Depuis quatre-vingts ans que i’ay deſſus la I'en ay pres de cinquante endoſſé le harnois Au ſeruice actuel de quatre de nos Roys.	tête Depuis quatre-vingts ans que j'ai dessus la J'en ai pres de cinquante endossé le harnais Au service actuel de quatre de nos Rois.
Ie me ſuis rencõtré en quarante eſcarmouch	Je me suis rencontré en quarante écarmouch
C ITETRON.	Ç CTETRON.
Où l’õ tuoit le mõde auſſi dru que des mouches I’ay veu deux cens aſſaux, trois cens combats rangez:	Où l'on tuait le monde aussi dru que des mouches J'ai vu deux cens assaux, trois cens combats rangez:
cagez I’ay veit des chaſteaux pris, & des bourgs ſacI'ay veugrãd nõbre auſſi devilles imprenables Miſes en des eſtats grandement deplorables Le Fer, le feu, le ſang, ſeruoit à les punir.	cagez J'ai vit des châteaux pris, et des bourgs sacI'ai vugrand nombre aussi devilles imprenables Mises en des états grandement déplorables Le Fer, le feu, le sang, seruoit à les punir.
Encore maintenant ce triſte ſouuenir Fait ſortir de mes yeux abondance de larmes.	Encore maintenant ce triste souvenir Fait sortir de mes yeux abondance de larmes.
En fin depuis le temps que ie porte les armes, Pour me recompenſer apres tant de tourment On ma fait Anſpeſade en vn vieux regimẽt;	En fin depuis le temps que ici porte les armes, Pour me récompenser après tant de tourment On ma fait Anspesade en un vieux règiment;
Quoy que sãs me vãter i’aye fait des proüeſſes Dont la moindre en effet meritoitdes largeſſes Telles qu’vn puiſſant Roy la fait à ſes ſujets Lorsqu’il adeuãt luy leurs vertus pour objets.	Quoi que sans me vãter j'aie fait des prousses Dont la moindre en effet méritaitdes largesses Telles qu'un puissant Roi la fait à ses sujets Lorsqu'il adeutant lui leurs vertus pour objets.
Car ie me reſouuiens que du temps du Roy Charles Ie fus preſque aſſommé deuãt la ville d’Arles.	Car personne me résouviens que du temps du Roi Charles Je fus presque assommé devant la ville d'Arles.
En ce temps ie n’eſtois qu'vn petit embrelin, Goujat ſuiuent la Cour, mais pourtant bien malin:	En ce temps ici n'étais qu'un petit embrelin, Goujat suivent la Cour, mais pourtant bien malin:
plaine Car trouuant vn corps mort eſtendu ſur la	plaine Car trouvant un corps mort étendu sur la
I'eſtois tout le premier à luy tirer la laine;	J'étais tout le premier à M tirer la laine;
Ie foüillois au gouſſet s’il auoit de l’argent:	Je fouillais au gousset s'il avait de l'argent:
De courir au butin ie n’eſtois negligent.	De courir au butin ie n'étais négligent.
les, Et meſme cegrãd iour que l’onditde ſaint Gil.	les, Et même cegrand jour que l'onditde saint Gil.
Iedemeuray tout ſeulde trois ouquatre milles.	Jedemeurai tout seul trois ouquatre milles.
Aux cõbats de Loudun, S.	Aux combats de Loudun, S.
Denis, & de Dreux I'eſtois couuert de ſang tout iuſques au cheueux, [chelle, En ceux de Moncontour, Donneau, de RoOn perça mon chapeau eſtant en ſentinelle:	Denis, et de Dreux J'étais couvert de sang tout jusques au cheveux, [chelle, En ceux de Moncontour, Donneau, de RoOn perça mon chapeau étant en sentinelle:
Et du tẽps d’Hẽry trois le dernier des Vallois On me nommoit par tout le grand Mars des François.	Et du temps d'Hienri trois le dernier des Vallois On me nommait par tout le grand Mars des Français.
Soudain qu’il ce faiſoit quelqu'hardie entrepriſe, Pour eſtre despremiers i’y courois en chemiſe.	Soudain qu'il ce faisait quelqu'hardie entreprise, Pour été dépremiers j'y courais en chemise.
Auſſi lors qu'on donna la bataille à Coutras Vn coup de faucõneau me perça les deux bras.	Aussi lors qu'on donna la bataille à Coutras Un coup de fauconneau me perça les deux bras.
Et du tẽps du feu Roy à la bataille d’Arques Ie fus bien pres d’aller au Royaume des Parques:	Et du temps du feu Roi à la bataille d'Arques Je fus bien pres d'aller au Royaume des Parques:
Meſme en celle d’Yury il y faiſoit ſi chaud, Qu'vn autre homme que moy, y fuſt mort à	Même en celle d'Yuri il y faisait si chaud, Qu'un autre homme que moi, y fût mort à
10 ATLIDON, Mais que diray-ie encor de Fõtaine Frãçoiſe, Où l’ennemy touſiours m'approchoit d’vne thoiſe Sans apprehenſion le coutelas au poing I’abbatois les ſoldats comme on fauche le foïn.	10 ATLIDON, Mais que dirai-je encor de Faitaine Frãçoise, Où l'ennemi toujours m'approchait d'une thoise Sans appréhension le coutelas au poing J'abatais les soldats comme on fauche le foïn.
En ſin l’on void touſiours que Maiſtre Hieremte N'a nõ plus qu’autrefois la vaillãce endormie En ces croubles derniers, en tous ceuxprecedès Les effets de mon bras ce ſont veus éuidens.	En sin l'on voit toujours que Maître Hieremte N'a nomme plus qu'autrefois la vaillance endormie En ces croubles derniers, en tous ceuxprecedès Les effets de mon bras ce sont vus évidents.
Mais quoy que i’aye acquis vne immortelle gloire, L’Amour a maintenãtdeſſus moy la victoire:	Mais quoi que j'aie acquis une immortelle gloire, L'Amour a maintenãtdessus moi la victoire:
Ce beau petit Archer rauiſſant mes lauriers, Peut dire auoir vaincu le premier des guerriers:	Ce beau petit Archer ravissant mes lauriers, Peut dire avoir vaincu le premier des guerriers:
Le feu, le fer, le plomb, la poudre, ny la meſche N'ont ſceu faire à mon cœur ce que ma fait ſa fleſche:	Le feu, le fer, le plomb, la poudre, ni la mèche N'ont su faire à mon cœur ce que ma fait sa flèche:
Les attraits de Fleurie ont eu ſeuls le pouuoir De ne ſaire oublier le martial deuoir;	Les attraits de Fleurie ont eu seuls le pouvoir De ne zaïre oublier le martial devoir;
Depuis que ſa beauté loge dans ma poitrine A pas vn autre object ie n’ay fait bõne mine:	Depuis que sa beauté loge dans ma poitrine A pas un autre object était n'ai fait bonne mine:
Ie n’en regarde aucun qu’auecques du meſpris Voyant que leurs appas n’eſgale ma Cypris.	Je n'en regarde aucun qu'avecques du mépris Voyant que leurs appas n'égale ma Cypris.
Mais i'ay tant de mal-heur qu’en cherchant l’inhumaine Ie ne la trouue point pour luy dire ma peine.	Mais j'ai tant de malheur qu'en cherchant l'inhumaine Je ne la trouve point pour luidire ma peine.
Tantoſt vn Preſident l’emmeine promener, Tantoſt vn Conſeiller vient chez elle diſner:	Tantôt un President l'emmeine promener, Tantôt un Conseiller vient chez elle dîner:
Souuent elle eſt au Cours ou à la Comedie.	Souvent elle est au Cours ou à la Comédie.
Ha!	Ha!
fi ſi de l’amour, il faut que ie le die Exprés ie viens icy pour trouuer gueriſon Lors que le Medecin n’eſt plus à la maiſon, Puisqu'unde mes amis ma dit qu'elle eſt ſortie Il me faut à demain remettre la partie.	fi si de l'amour, il faut que je le demain Exprès tu viens ici pour trouver guérison Lors que le Médecin n'est plus à la maison, Puisqu'unde mes amis ma dit qu'elle est sortie Il me faut à demain remettre la partie.
OCENE XYATRTESMIE.	OCENE XYATRTESMIE.
FLEVRIE ET KAROLV.	FLEURIE ET §AROLU.
FLEVRIE.	FLEURIE.
E bien!	E bien!
que dites-vous de ce braue AII moureux?	que dites-vous de ce brave AI moureux?
