I’allonge mon propos, & dy qu’il faut que l’ame Soit blanche purement en l’œuure qu’elle entame.	J'allonge mon propos, et dis qu'il faut que l'âme Soit blanche purement en l'œuvre qu'elle entame.
Ne recherche t’on pas pour la grace du corps La formoſe candeur tant dedans que dehors?	Ne recherche t'on pas pour la grâce du corps La formose candeur tant dedans que dehors?
Lauant ce qui eſt laid, dreſſant la flechiſſure, Les entrailles purgeant, & leur infecte ordure, Ne demande t’on pas ſur ſoy des linges blancs A tables des beaux mets, vin pur, miſtes ſeruants?	Lavant ce qui est laid, dressant la fléchissure, Les entrailles purgeant, et leur infecte ordure, Ne demande t'on pas sur soi des linges blancs A tables des beaux mets, vin pur, mises servants?
Ainſi deſirons-nous que noz actes ſoient mondes, Balions de noz cœurs les ſalettez immondes.	Ainsi désirons-nous que nous actes soient mondes, Balions de noz cœurs les saletés immondes.
Comme d’vn ord eſuier rien ne ſourd que vilain:	Comme d'un ord évier rien ne sourd ' vilain:
D’vn cœur cauterizé ne ne ſort que malin.	D'un cœur cauterizé ne ne sort que malin.
Ie ſuis au bout du fil, puis außi toſt je ceſſe.	Je suis au bout du fil, puis aussi tôt je cesse.
L'difice fondé de proſonde baſſeſſe S’eſtage tant plus haut que ſans bas fondement L’action faite ainſi accroiſt augustement.	L'élifice fondé de prosonde bassesse S'étage tant plus haut que sans bas fondement L'action faite ainsi accroît augustement.
I’oy quelqu'vn repartir que le verd ſicomore, Le freſne, le peuplier, & ſemblables encore Sont arbres grandiſſans de longueur & groſſeur.	J'ois quelqu'un répartir que le verd sycomore, Le frêne, le peuplier, et semblables encore Sont arbres grandissants de longueur et grosseur.
Vray:	Vrai:
mais quel est leur fruict acre, doux, vert, ou ſeur?	mais quel est leur fruit acre, doux, vert, ou sûr?
Ils ne s’en chargent point, ains ils meurent sterlles, Comme au contraire ſont les plus bas, plus fertiles.	Ils ne s'en chargent point, ains ils meurent sterlles, Comme au contraire sont les plus bas, plus fertiles.
Donc en noz actions (telles qu’en cet endroil) Qu'en Dieu ſoit noſtre cœur humble, candide, droict.	Donc en noz actions (telles qu'en cet endroil) Qu'en Dieu soit notre cœur humble, candide, droit.
ER S.	ER S.
I'accorde franchement vostre dire autentique, Sur quoy pas vn de nous pas vn mot ne replique.	J'accorde franchement vôtre dire autentique, Sur quoi pas un de nous pas un mot ne réplique.
Mais i’adiousteray bien pour, gays, nous eſmouuoir A ce qu’importe plus vn pastoral deuoir, Que comme au grand labeur le los eſt reciproque [De meſme qu’à peu pres on fait egal vn troque Qu’il ſiera bien außi en cette eſlection D’vſer conformement de grand' diſcretion.	Mais j'ajouterai bien pour, gais, nous émouvoir A ce qu'importe plus un pastoral devoir, Que comme au grand labeur le los est reciproque [De même qu'à peu pres on fait égal un troque Qu'il siéra bien aussi en cette élection D'user conformément de grand' discrétion.
Dautant que l’homme ſçait par l’argute prudence Ce qui eſt de raiſon, & de ſa dependence.	Dautant que l'homme sait par l'argute prudence Ce qui est de raison, et de sa dépendence.
Comment il faut choiſir, comment il faut laiſſer:	Comment il faut choisir, comment il faut laisser:
Ce qu’il faut croire, ou non, dire, faire, ou penſer.	Ce qu'il faut croire, ou non, dire, faire, ou penser.
Imhitant, ſoucieux, la fineſſe ſubtile Des croquillez ſerpens, dont Nature les ſtyle, Faiſant roidir leur corps à tout aſpre meſcbef Pour deſendre en ſiflant, leur eſcraſable chef.	Imhitant, soucieux, la finesse subtile Des croquillez serpens, dont Nature les style, Faisant roidir leur corps à tout âpre mescbef Pour desendre en siflant, leur écrasable chef.
Solertement ainſi nous faut-il prendre garde	Solertement ainsi nous faut-il prendre garde
D’employer noſtre effort en cela, qui regarde Le los de Ieſus Christ, chef, medecin, ſoustien, De nous, des langoureux, & du Peuple chreſticn.	D'employer notre effort en cela, qui regarde Le los de Jésus Christ, chef, médecin, soutien, De nous, des langoureux, et du Peuple chréticn.
Comme en ce beau ſujet, auquel il faut eſlire Succeſſeur au deffunct vn Eueſque de Myre:	Comme en ce beau sujet, auquel il faut élire Successeur au défunt un Euesque de Myre:
Qui, Nautonnier expert, ſillonne droitement La catholique Nef au cap du firmament.	Qui, Nautonnier expert, sillonne droitement La catholique Nef au cap du firmament.
Encor vn tour madré de ces beſtes fuyës, C’eſt qu’elles bouchent fort leurs obliques ouyës, L’vne auecques la queu', & l’autre d’vn caillou, Pour n’ouyr l’enchanteur filer vn doux glou-glou.	Encor un tour madré de ces bêtes fuyés, C'est qu'elles bouchent fort leurs obliques ouïs, L'une avec la queus, et l'autre d' caillou, Pour n'ouïr l'enchanteur filer un doux glouglou.
En cet acte public:	En cet acte public:
or' ſus que l’on ſ'empierre Les oreilles treſtous, l’vne de l’angle pierre Contre le mol appas des flateurs courtiſans, Taſchans nous allecher par leur langue, ou preſens, Afin qu’en ce parquet à leur gré l’on eſliſe Quelque cadet gorrier d’humeur fait à leur guiſe.	or' au que l'on s'empierre Les oreilles trestous, l'une de l'angle pierre Contre le mol as des flatteurs courtisans, Taschans nous allécher par leur langue, ou presens, Afin qu'en ce parquet à leur gré l'on élise Quelque cadet gorrier d'humeur fait à leur guise.
Plaſtrons l’autre du bout du mortel ſouuenir, Car la mort eſt le port, où nous faut tous venir, Pour rendre deuant Dieu en ſon bureau des comptes Compte de noz talens, paſlis d’infames hontes:	Plâtrons l'autre du bout du mortel souvenir, Car la mort est le port, où nous faut tous venir, Pour rendre devant Dieu en son bureau des comptes Compte de noz talents, pâlis d'infâmes hontes:
Par ainſi nous ferons iuſtement à propos Le tout à ſon honneur, comme à noſtre repos.	Par ainsi nous ferons justement à propos Le tout à son honneur, comme à notre repos.
HERMES.	HERMES.
O la docte leçon d’entendement ſublime!	Ô la docte leçon d'entendement sublime!
Que la mouliere dent ne moudra ſous ſa lime, Ny l’acier eſmolu d’vn babil mediſant Ne percera iamais pour luy estre nuiſant.	Que la moulière dent ne moudra sous sa lime, Ni l'acier émolu d' babil médisant Ne percera jamais pour lui être nuisant.
Doncques apprenons la, & que chacun ſ'applique De procurer le bien de la Choſe publique.	Donc apprenons la, et que chacun s'applique De procurer le bien de la Chose publique.
Vous auez apporté vn remarquable poinct Sur ce fait eſlectif, où ie ne touche point.	Vous avez apporté un remarquable point Sur ce fait électif, où ie ne touche point.
Mais oſeray-ie pas opiner à mon ordre, Pour estranger de nous le blaſmable deſordre?	Mais oserai-je pas opiner à mon ordre, Pour étranger de nous le blâme désordre?
Sous les rayons dorez de voz yeux bien-vueillans Deſſus moy, voſtre obiect, pointez estincellans, Et ſur le mien espoir que d'vn peu d’audiance Vous allez honorer ma preſente ſeance, Ie vous propoſeray les bizardes façons, Dont vſent en ce temps les folaſtres garçons.	Sous les rayons dorés de v yeux bien-vueillans Dessus moi, votre objet, pointez estincellans, Et sur le mien espoir que d'un peu d'audience Vous allez honorer ma présente séance, Je vous proposerai les bizardes façons, Dont usent en ce temps les folâtres garçons.
Veulent-ils ſ'accoupler au ioug indeliable D'vn long-estroit Hymen plaiſamment ſociable, Les aucuns pourſuiuront vne rare beauté:	Veulent-ils s'accoupler au joug indéliable D'uns longtempérait Hymen plaisamment sociable, Les aucuns poursuivront une rare beauté:
D’autres aymeront mieux la fimple honnesteté, Les autres conuoiteux de gluantes richeſſes Chercheront pour party des plus riches maiſtreſſes.	D'autres aimeront mieux la simple honnêteté, Les autres convoiteux de gluantes richesses Chercheront pour parti des plus riches maîtresses.
Mais que veux-ie puiſer de ce bel argument?	Mais que veux-je puiser de ce bel argument?
Sinon qu’il nous affiert nous preſſer temprement De, vefue, repouruoir à quelqu'vn d’apparence L’Egliſe de ce lieu pour la vefuer de tranſe.	Sinon qu'il nous affiert nous presser temprement De, veuve, répourvoir à quelqu'Homme d'apparence L'Église de ce lieu pour la veuve de transe.
Si des mondains amans l’vn embraſſe l’honneur, L’autre cherit les biens, l’autre veut la candeur;	Si des mondains amants l'autre embrasse l'honneur, L'autre chérit les biens, l'autre veut la candeur;
Faiſons que celuy-la, que nous penſons eſlire Pour eſpoux meſnager de l’Egliſe de myre, Soit opulent, ſoit beau, ſoit bon au principale:	Faisons que celui-la, que nous pensons élire Pour époux ménager de l'Église de mire, Soit opulent, soit beau, soit bon au principale:
Bon de meurs, beau de corps, riche d’art liberat.	Bon de meurs, beau de corps, riche d'art libérât.
Car comme il est certain que le nombre ternaire C’est le ſeul bien, à quoy Dieu ſe plait d’ordinaire;	Car comme il est certain que le nombre ternaire C'est le seul bien, à quoi Dieu se plaît d'ordinaire;
Si ce doüaire triplé gyt au futur pasteur, Dieu pour ce luy ſera prodigue bien-faicteur;	Si ce doüaire triplé gît au futur pasteur, Dieu pour ce même sera prodigue bienfaiteur;
Et ſon troupcau nourry du pain de ſa doctrine Viura des plus heureux de cette orbe machine.	Et son troupau nourri du pain de sa doctrine Vivra des plus heureux de cette orbe machine.
THEOPHILE.	THÉOPHILE.
Tant de praceptes ſainẽts, tant de conſeils prudens, A cette meſme fin profitables tendans, Nous pluuiſſent vrayment que tout ira conforme Selon l’octroy diuin à la romaine forme.	Tant de pronceptes sainẽts, tant de conseils prudents, À cette même fin profitables tends, Nous pluisent vraiment que tout ira conforme Selon l'octroi diuin à la romaine forme.
Pour-parlons du moyen de terminer parfait Ce que reſolument ia deuroit eſtre fait.	Pourparlons du moyen de terminer parfait Ce que résolument ja devrait été fait.
Prendrons-nous le ſcrutin deſcriture couuerte Pour cas approprié, ou bien la voix ouuerte?	Prendrons-nous le scrutin décriture couverte Pour cas approprié, ou bien la voix ouuerte?
Ie ſonge la deſſus.	Je songe la dessus.
C’est bien la verité Que du ſcrutin eſcrit ioliment cachetté, Mis dedans vn baßin, ou dedans vne coupe Peſle-meſle toüillé de quelqu'vn de la troupe Le ſuffrage donné ne peut eſtre apperçeu, Voire ny de celuy, qui meſme la reçeu:	C'est bien la vérité Que du scrutin écrit joliment cacheté, Mis dedans un bassin, ou dedans quelque coupe Pêle-mêle toüillé de quelqu'Un de la troupe Le suffrage donné ne peut être aperçu, Voire ni de celui, qui même la reçu:
Pour rayer le ſoubçon d’amere ialouſie, Qui pourroit ſ'imprimer dedans la fantaiſie, Son connoiſſoit l’autheur, ou pourquoy cestuy-la Plus fauorable à l’vn, qu’à l’autre a fait celaCe qui ſ'eſuenteroit par le verbal ſuffrage, Qui forgeroit à-coup vne mastine rage Parmy ceux, qui, deuant estans bien bons amis, Ayant ouy le mot, ſeroient fiers ennemis.	Pour rayer le soubçon d'âme jalousie, Qui pourrait s'imprimer dedans la fantaisie, Son connaissait l'auteur, ou pourquoi celui-la Plus favorable à l'un, qu'à l'autre a fait celaCe qui s'éventerait par le verbal suffrage, Qui forgerait à-coup une mâtine rage Parmi ceux, qui, devant estans bien bons amis, Ayant ouï le mot, seraient fiers ennemis.
Combien qu’on proteſtaſt le ſtyx, le feu, la terre, La mer, l’air, & le Ciel, & tout ce qu’il enſerre dedecupreence dadadt Minenezon Que le nommé tout-haut vaut cette eſlection.	Combien qu'on protestât le styx, le feu, la terre, La mer, l'air, et le Ciel, et tout ce qu'il enserre dedecupreence dadt Minenezon Que le nommé tout-haut vaut cette élection.
POLIOCTE.	POLICTE.
En l'eſtat policé de la Democratie, (Peu moins imperial que d’Aristocratie) Quiconque pretendoit à tel gouuernement N’auoit rien ſi certain pour eſtabliſſement Que l’infuyable ſort d’vne chance incertaine, Qui, tombant, luy bailloit la charge ſouueraine:	En l'état policé de la Demprocratie, (Pu moins impérial que d'Aristocratie) Quiconque prétendait à tel gouvernement N'avait rien si certain pour établissement Que l'infuyable sort d'une chance incertaine, Qui, tombant, lui baillait la charge souveraine:
Comme quand à quelqu’vn mauuaiſe elle eſcheoit, Patiemment honteux il ne ſ'en ſoucioit.	Comme quand à quelqu'Hô mauvaise elle escheoit, Patiemment honteux il ne s'en souciait.
Pourquoy donc tel, ou tel ſe promettroit-il d'eſtre Prelat à l’aduenir, or' qu’il fut noble d’eſtre, Si de triage meur on y va procedant?	Pourquoi donc tel, ou tel se promettrait-il d'être Prédat à l'avenir, or' il fut noble d'être, Si de triage meur on y va procédant?
Où le credit n’a lieu en ſe recommendant:	Où le crédit n'a lieu en se recommendant:
quinotemenite feut, tut, ſuſſiant, inppire De declarer paſteur tel, où moins il aſpire.	quinoteménite feut, tut, sussiant, inpire De déclarer pasteur tel, où moins il aspire.
Parquoy la viue voix, ny le ſcrutin ſecret N’arriuant opportun, n’en faut auoir regret.	Parquoi la vive voix, ni le scrutin secret N'arrivant opportun, n'en faut avoir regret.
CLARIVS.	CLARIVS.
Nous auons entendu voz injes tyaettiues, Qui ſont comme tableaux en belles perſpectiues, Que des yeux aquilins contemplent eſtonnez, Comme des bons eſprits voz vers apollinez.	Nous avons entendu vocés injà tyuettives, Qui sont comme tableaux en belles perspectiues, Que des yeux aquilins contemplent étonnés, Comme des bons esprits vocés vers apollinés.
Mais ſi nous deſerions à quelque homme de miſe, De ce College-cy, noſtre foy compromiſe, Que ret qju ti eſliroit, tel nous l’approuuerions, Meßieurs, je penſe moy qu’aſſez bien nous ferions.	Mais si nous déserions à quelque homme de mise, De ce Collège-cy, notre foi compromise, Que ret éju ty esliroit, tel nous l'approuverions, Messieurs, je pense mo qu’assez bien nous ferions.
N Il eſt à craindre fort que foy-mefine it f'eſliſe L’aueugle ambition à la vertu ne viſe	N Il est à craindre fort que foi-fine it s'élise L'aveugle ambition à la vertu ne vise
CLARIVS.	CLARIVS.
Prendrons-nous le ſcrutin ou ſecret, ou la voix, On lauurailon s	Prendrons-nous le scrutin ou secret, ou la voix, On lavrailon s
EROS.	EROS.
Faiſons en donc le chois.	Faisons en donc le chois.
HERMES.	HERMES.
Il ne me chault lequel.	Il ne me chault lequel.
TLLOTEETESE N’a moy non plus, j'en jure.	TLLOTETTESE N'a moi non plus, j'en jure.
POLIOCTE.	POLICTE.
Ieſus!	Jésus!
le bel enfant!	le bel enfant!
viendroit-il le conclure?	viendrait-il le conclure?
L’ANGE.	L'ANGE.
De la part du Tres-haut, Tres-puiſſant, & Tres-fort, Dieu des Dieux, Roy des Roys je deſcen de ſon fort.	De la part du Très-haut, Très-puissant, et Très-fort, Dieu des Dieux, Roi des Rois je descen de son fort.
Où cent mille eſprits d’vn aſſorty meſlange L’on le voit adoré.	Où cent mille esprits d'une assorti mélange L'on le voit adoré.
CLARIVS.	CLARIVS.
Sans doute c’est vn Ange.	Sans doute c'est un Ange.
L’ANGE.	L'ANGE.
Ie ſuis, agile moy, dés l’inſtant que je ſuis:	Je suis, agile moi, dès l'instant que je suis:
L’vn de ſes Palatins, prompt à ce que je puis:	L'un de ses Palatins, prompt à ce que je puis:
Or' il ma commandé de broſſer, jambe nuë, Par la freſche moiteur de toute eſpeſſe nuë, Pour m'en venir à vous, & vous faire ſçauoiz	Or' il ma commandé de brosser, jambe nue, Par la frêche moiteur de toute épesse nue, Pour m'en venir à vous, et vous faire sçauoiz
Qu’il vous veut à ce coup diſpenſer de pouruoir A l’Eueſché vaccant de la Cité de Myre, Vous deliurant par moy du ſoin, qui vous martyreTout ainſi que les Cieux en toupiant tousjours Prodiguent aux humains des effects tous les jours, Qui teſmoignent aſſez leur fatale influence, Tantoſt plus, tantoſt moins, ſelon la difference De leur benin aſpect, ſoit oblique, ſoit droit, Dardé plus en vn lieu que ſur quelque autre endroit.	Qu'il vous veut à ce coup dispenser de pourvoir À l'Évêché vaccant de la Cité de Myre, Vous délivrant par moi du soin, qui vous martyreTout ainsi que les Cieux en toupiant toujours Prodiguent aux humains des effets tous les jours, Qui témoignent assez leur fatale influence, Tantôt plus, tantôt moins, selon la différence De leur bénin aspect, soit oblique, soit droit, Dardé plus en un lieu que sur quelque autre endroit.
Ainſi Dieu verſe-t’il ſes faueurs en ce monde, Mais plus au Temple ſainct, où d’ame pure & monde L’on l’inuoque frequent:	Ainsi Dieu verse-t-il ses faveurs en ce monde, Mais plus au Temple saint, où d'âme pure et monde L'on l'invoque fréquent:
comme vous auez fait Pour le ſuccés heureux de ce malaiſé fait.	comme vous avez fait Pour le succès heureux de ce malaisé fait.
Dittes, eſt-il pas vray, par vn ſens raiſonnable, Que pour vn meilleur bien il eſt bien conuenable Qu'vne maiſon qui pend ſur ſa prochaine fin Vienne à ſe deſrocher & renuerſer enfin:	Dittes, est-il pas vrai, par un sens raisonnable, Que pour un meilleur bien il est bien convenable Qu'une maison qui pend sur sa prochaine fin Vienne à se dérocher et renverser enfin:
Afin qu’incontinent d’ingenieuſe addreſſe, Sus vn plan compaſſé, bien mieux on la redreſſe.	Afin qu'incontinent d'ingénieuse adresse, Sus un plan compassé, bien mieux on la redresse.
C’eſt pourquoy depuis peu vous auez veu mourir L’vn de voz Comprelats d’âge preſt à perir.	C'est pourquoi depuis peu vous avez vu mourir L'un de vo Comprelats d'âge prêt à périr.
Dieu diſpoſant de tout, comme il en eſt le Maiſtre, Limita ſon treſpas, pour en ſon ſiege mettre Celuy qu’il atrié dans ce riche pais, Qui rendra la plus-part de merueille eſbaïs:	Dieu disposant de tout, comme il en est le Maître, Limita son trépas, pour en son siège mettre Celui qu'il atrié dans ce riche pais, Qui rendra la plupart de merveille esbaïs:
Pour ce qu’en ſon apuril il eſt le plus capable, Le vous laiſſant juger de ſentiment palpable.	Pour ce qu'en son appuril il est le plus capable, Le vous laissant juger de sentiment palpable.
Ne vous geinez donc plus en cette eſlection.	Ne vous geinez donc plus en cette élection.
Voz eſlans charme-cœurs ont eu, ſans fiction, Telle force & vertu que deuant Aſſuere Profita pour le Iuifs la requeſte d’Heſtere.	Vofs élans charmés-cœurs ont eu, sans fiction, Telle force et vertu que devant Assuère Profita pour le Juifs la requête d'Histère.
Ce qu'ele demanta tut ceutunt de muye Ce que vous deſirez vous auient aujourd’huy.	Ce qu'elle demanta tut ceutunt de muie Cult de vous désirez vous avient aujourd'hui.
CLARIVS.	CLARIVS.
Vn bon vent quelquefois, ainſi qu'il ſingle-vire, Suruient ineſperé empoupper le Nauire.	Un bon vent quelquefois, ainsi qu'il single-vire, Surient inespéré empouper le Navire.
DION.	DION.
Mais l’eſpoir attendu ſ'offre quelque demain, Comme au plus empeſche t'ayde de main en main.	Mais l'espoir attendu s'offre quelque demain, Comme au plus empêche t'aide de main en main.
E F OS.	E F OS.
Nous n’auons donc perdu noſtre temps, ce me ſemble.	Nous n'avons donc perdu notre temps, ce me semble.
HERMES.	HERMES.
Voila que c’eſt de vœus, & d’oraiſons enſemble.	Voilà que c'est de vœus, et d'oraisons ensemble.
Fliſorlalde.	Flisorlalde.
Tout va bien, ſi pour Dieu l'on ſe peine à qui plus.	Tout va bien, si pour Dieu l'on se peine à qui plus.
POLIOCTE.	POLICTE.
Mais, meſſager feal, conte nous le ſur-plus.	Mais, messager féal, conte nous le surplus.
L’ANGE.	L'ANGE.
Scachez que l’Eternel (de qui la prouidence Reigle tout par compas, nombre, poix, & prudence.	Sachez que l'Éternel (de qui la providence Règle tout par compas, nombre, poix, et prudence.
Dés ſon eternité a deuant ſoy gyſant Le paſſé, le futur, comme le temps preſent.	Dès son éternité a devant soi gisant Le passé, le futur, comme le temps présent.
Or que connoiſſant tout, & voyant toute choſe, Tels qui luy ſont eſleuz, ſans deuanciere cauſe, Tels predestine-t’il, & ces predestinez Iustes renduz par luy, que pour luy ne ſont nez.	Or que connaissant tout, et voyant toute chose, Tels qui tu sont élevés, sans devancière cause, Tels prédestine-t-il, et ces prédestinez Justes renduz parfois, que pour lui ne sont nés.
Or aprés le decés de vostre bon Confrere, Pour changer d'vn meilleur, Dieu permet vous distraire De teſlection d’vn:	Or après le décès de votre bon Confrère, Pour changer d'un meilleur, Dieu permet vous distraire De teslection d'un:
nommant vn Nicolas, Qui doit estre ſur tous la perle des Prelats.	nommant un Nicolas, Qui doit être sur tous la perle des Prélats.
CLARIVS.	CLARIVS.
Atvins buutunen leariven terit pille Né de condition noble, bourgeoiſe ou vile?	Atvins butunen leariven terit pille Né de condition noble, bourgeoise ou vile?
L’ANGE.	L'ANGE.
Patience, laiſſez ce deſir curieux:	Patience, laissez ce des curieux:
Oyez le demeurant.	Oyez le demeurant.
Le Soleil radieux N’ayant demain encor commencé ſa carriere;	Le Soleil radieux N'ayant demain encor commencé sa carrière;
Le premier ſ'auanceant pour faire ſa priere Dans ce Temple vouté, qui portera ce nom, Prenez-le & le ſatrez, le vueille til, ou non.	Le premier s'avanceant pour faire sa prière Dans ce Temple vouté, qui portera ce nom, Prenez-le et le satrez, le veuille til, ou non.
Dieu ſe l’a reſerué.	Dieu se l'a réservé.
Moy, je vous en encharge.	Moi, je vous en charge.
La palte janamte domt olantus osm ma charge.	La palte janamte dompt olantus ôm ma charge.
CLARIVS.	CLARIVS.
Ha!	Ha!
que mon cœur bondit allaicté de plaiſir, Hat que je jun peureux content de mon deſir.	que mon cœur bondit allaicté de plaisir, Hat que je jun peureux content de mon désir.
DION.	DION.
Ce bon-heur eſt commun à nostre compagnie, Que tous n'en ſoyent joyeux, perſonne ne le nie.	Ce bonheur est commun à notre compagnie, Que tous n'en soient joyeux, personne ne le nie.
EROS.	EROS.
At fonts quan pupmne de tet tomentement.	At fonts quan pupine de tet tomentement.
HERMES.	HERMES.
Mes ſens ſont eſſorez d’vn eſbaiſſement.	Mes sens sont essorés d'un ébaissement.
THEOPHILE.	THÉOPHILE.
I'en loüray Dieu tousjours d'humble action de graces.	J'en louerai Dieu toujours d'humble action de grâces.
POLIOCTE.	POLICTE.
Nous le deuons, de peur de celeſtes diſ-graces.	Nous le devons, de peur de célestes dis-grâces.
CLARIVS.	CLARIVS.
Ouy:	Oui:
car nous-nous rendrions comme les porcs fangeux Qui croquettent les glans des cheſnes ombrageux Sans jetter toutefois ſus eux aucune œillade.	car nous-nous rendrions comme les porcs fangeux Qui croquettent les glans des chaînes ombrageux Sans jeter toutefois sus eux aucune œillade.
Sus donc la teste en haut, chantons vne Iliade De ſacré-ſaincts Paans en poëmes diuers, Soit en Alexandrins, ſoit en lyriques vers, Organiſez d’accords de chantre theorique, Qui n’ayme mieux l’accent de proſe rethorique.	Sus donc la tête en haut, chantons une Iliade De sacré-saincts Pays en poèmes divers, Soit en Alexandrins, soit en lyriques vers, Organisez d'accords de chantre théorique, Qui n'aime mieux l'accent de prose retorique.
L L’vne, & l’autre oraiſon eſt agreable à Dieu.	 L'une, et l'autre oraison est agréable à Dieu.
Mais poſons ce pendant vn Argus au milieu, Qui aßsis, au debout tellement ſe comporte, Qu’il ait tousjours les yeux fichez deſſus lu porte;	Mais posons ce point un Argus au milieu, Qui assis, au debout tellement se comporte, Qu'il ait toujours les yeux fichés dessus lu porte;
Pour ſ'enquerir du nom de quiconque hurtera.	Pour s'enquérir du nom de quiconque hurtera.
Et tel, qui Nicolas vrayment ſ'appellera, D’vn pas majeſtatif, & d’vn pourfil amene, Iaçoit que nous chantions fauara qu'il nous l’amene.	Et tel, qui Nicolas vraiment s'appellera, D'un pas majestatif, et d'un pourfil amène, Iaçoit que nous chantions favara qu'il nous l'amène.
EROS.	EROS.
Vous qui nous conſeillez de cet expedient Dons mtpme hettcez y tout à bon eſcient.	Vous qui nous conseillez de cet expédient Dons m hettcez y tout à bon escient.
HERMES.	HERMES.
Vous pouuez bien tela tant eftes-vous habile.	Vous pouvez bien tela tant eûtes-vous habile.
THEOPHILE.	THÉOPHILE.
Faite-le:	Faite-le:
l’action n'eſt baſſement ſeruile.	l'action n'est bassement servile.
POLIOCTÉ.	POLICTT.
Seruile!	Servile!
non pas, non:	non pas, non:
ains deû à voſtre rang.	ains deû à votre rang.
CLARIVS.	CLARIVS.
Ainſi qu'eux je conclu d’vn motif apte-franc.	Ainsi qu'eux je conclu d'un motif apprête-franc.
DION.	DION.
Doncques, je le feray, comme prouueu d'Office.	Donc, je le ferai, comme prouueu d'Office.
CLARIVS.	CLARIVS.
Ca, remercions Dieu de ce grand benefice Qu'il nous à departy, nous deſchargeant en bref D’vn atlhantique poix à nous aſprement gref.	Ça, remercions Dieu de ce grand bénéfice Qu'il nous à départi, nous déchargeant en bref D'un atlantique poix à nous âprement gref.
