TRAGICOMEDIE.	TRAGICOMEDIE.
Par le Sieur de MAGNON, Hiſtoriographe de ſa Majeſté tres-Chreſtienne.	Par le Sieur de MAGNON, Historiographe de sa Majesté très-Chrétienne.
ANATIESSE Royale de Sauoye.	ANATIESSE Royale de Savoie.
ARecrv P-ean I tu ne regnes pas ſur la Terre & ſur l'Onde, OTu regnes ſur les Cæurs, ils reçoiuent tes Loix, Et ta rare bonté par ſoy-meſme feconde Te fait plus de Sujets que n'en ont tous les Rois.	ARecrveAN-Jean I tu ne régnès pas sur la Terre et sur l'Onde, OTu régnès sur les Cæurs, ils reçoivent tes Lois, Et ta rare bonté par soi-même féonde Te fait plus de Sujets que n'en ont tous les Rois.
Ton regne eſt naturel, ton merite le fonde, Cent belles qualitez autoriſent ſes droits;	Ton règne est naturel, ton mérite le fonde, Cent belles qualités autorisent ses droits;
Et Tite ſurnommé les Delices du monde, Ne fut que ton Heraut, ton Organe, ou ta Voix.	Et Tite surnommé les Délices du monde, Ne fut que ton Héraut, ton Organe, ou ta Voix.
En vain en ſa faueur la Terre eſt preuenuë, Il ne fit en viuant que marquer ta venuë, 4 Le Ciel en fit ton ombre, & non pas ton pareil, Il ne fut qu’vn éclair qui traça ton merite, Ou, de l’air que l’Aurore annonce le Soleil, Charles Emanuel fut annoncé par Tite.	En vain en sa faveur la Terre est prévenue, Il ne fit en vivant que marquer ta venue, 4 Le Ciel en fit ton ombre, et non pas ton pareil, Il ne fut qu'un éclair qui traça ton mérite, Ou, de l'air que l'Aurore annonce le Soleil, Charles Emanuel fut annoncé par Tite.
ler, mais ſi extraordinairement, que quelque effort d’imagination que ie me faſſe pour me repreſenter ce que vous eſtes, ie ſuis encore à vous conceuoir ſous le portrait d’vn Heros qui fût appellé les Delices du genre humain.	ler, mais si extraordinairement, que quelque effort d'imagination que je me fasse pour me représenter ce que vous êtes, votre suis encore à vous concevoir sous le portrait d'être Héros qui fût appelé les Délices du genre humain.
C’eſt Tite, qui ſortant de ſon tombeau, au bruit que fait voſtre Renommée, a voulu voir, par vne curioſité digne de ſes intereſts, ſi vous l’approchez, ou ſi vous légalez, ou ſi vous le ſurpaſſez, & qui m’a commandé de me rendre à ſa ſuitte pour aller eſtre le teſmoin de l’eſtime, où de la jalouſie, ou de l’admiration qu’il a pour Vous.	C'est Ime, qui sortant de son tombeau, au bruit que fait votre Renommée, a voulu voir, par une curiosité digne de ses intérêts, si vous l'approchez, ou si vous légalez, ou si vous le surpassez, et qui m'a commandé de me rendre à sa suitte pour aller être le témoin de l'estime, où de la jalousie, ou de l'admiration qu'il a pour Vous.
Ce n’eſt pas, MONSEIGNEVR, que Tite, & moy, n’ayons pour Voſtre ALTESSE ROYALE, toute la foy qu’il faut auoir pour les choſes les plus aſſurées;	Ce n'est pas, MONSEIGNEUR, que Tite, et moi, n'ayons pour Votre ALTESSE ROYALE, toute la foi qu'il faut avoir pour les choses les plus assurées;
Mais ne nous aduoüerez vous pas qu’en matiere de miracles, vn peu d’incredulité, ou de ſuſpenſion ne ſied pas mal, & que qui croiroit tout ce que publie la Renommée, receuroit moins de veritez, que de menſonges.	Mais ne nous avouerez -vous pas qu'en matière de miracles, un peu d'incredulité, ou de suspension ne sied pas mal, et que qui croirait tout ce que publie la Renommée, recevrait moins de vérités, que de mensonges.
En effet, qui pourroit, où deuroit croire d’abord, que dans vn temps ou la vraye perfection ne paſſe que pour vne idée, la nature ait effectiuement reüny en Vous tout ce qu’elle auoit ſeparé dans ſes demy-Dieux de l’Antiquité;	En effet, qui pourrait, où devrait croire d'abord, que dans un temps ou la vraie perfection ne passe que pour une idée, la nature ait effectiuement réuni en Vous tout ce qu'elle avait séparé dans ses demi-Dieux de l'Antiquité;
& que par vn priuilege vnique Elle vous ait mis autant au deſſus de Tite, qu’elle auoit mis Tite au deſſus des autres hommes.	et que par un privilège unique Elle vous ait mis autant au dessus de Tite, qu'elle avait mis Tite au dessus des autres hommes.
Cependant, MONSEIGNEVR, tant de perſonnes le proteſtent ainſi, que nous ne voulons point nous oppoſer à la foy publique, & qu’eſtant preuenus par vne authorité vniuerſelle, nous allons dans voſtre Cour moins faire vn iugement particulier de Voſtre ALTESSE ROYALE, que joindre noſtre témoignage à ceſte glorieuſe reputation, que vous vous eſtes ſi eminemment, & ſi generalement acquiſe.	Cependant, MONSEIGNEUR, tant de personnes le protestent ainsi, que nous ne voulons point nous opposer à la foi publique, et qu'étant prévenus par une autorité universelle, nous allons dans votre Cour moins faire un jugement particulier de Votre ALTESSE ROYALE, que joindre notre témoignage à cette glorieuse réputation, que vous vous êtes si éminemment, et si généralement acquise.
Que i’ay de plaiſir par aduance d’entendre dire à la Renommée, que ce qu’elle fait penſer de vous cede encore à ce que vous en monſtrez, que vous découurez tant de merite à vos ſpectateurs, que vous ſurprenez moins les oreilles que les yeux, & qu’il eſt incomparablement plus difficile de croire tout ce qu’on voit de vous, que de croire tout ce que l’on en entend dire.	Que j'ai de plaisir par avance d'entendre dire à la Renommée, que ce qu'elle fait penser de vous cede encore à ce que vous en montrez, que vous découvrez tant de mérite à vos spectateurs, que vous surprenez moins les oreilles que les yeux, et qu'il est incomparablement plus difficile de croire tout ce qu'on voit de vous, que de croire tout ce que l'on en entend dire.
Tite, MONSEIGNEVR, à voſtre abord ne peut eſtre que tres ſurpris;	Tite, MONSEIGNEUR, à votre abord ne peut être que très surpris;
n’importe, il faut qu’il vous cede, & qu’il aduouë à toute la terre qu’il a merité le ſurnom des Delices du genre humain, auec moins de Iuſtice, que Voſtre ALTESSE ROYALE ne l’a fait, & que vous en eſtes d’autant plus digne, que n’ayant point d’empire comme luy, vous vous eſtes acquis par vous ſeul l’inclination de tous les hommes.	n'importe, il faut qu'il vous cede, et qu'il avoue à toute la terre qu'il a mérité le surnom des Délices du genre humain, Se moins de Justice, que Votre ALTESSE ROYALE ne l'a fait, et que vous en êtes d'autant plus digne, que n'ayant point d'empire comme lui, vous vous êtes acquis par vous seul l'inclination de tous les hommes.
Oüy, vous l’emportez touſiours ſur Tite, & de quelque façon que ce ſoit, voſtre politeſſe eſt plus touchante que la ſienne:	Oui, vous l'emportez toujours sur Tite, et de quelque façon que ce soit, votre politesse est plus touchante que la sienne:
Vous eſtes mieux fait & plus galant qu’il ne le fut iamais, & s’il n’auoit à conſiderer vos qualitez heroiques, ie larreſterois ſur ces charmans aduantages que vous poſſedez, & qui vous ont fait à l’envy les Delices des deux SeI xes.	Vous êtes mieux fait et plus galant qu'il ne le fut jamais, et s'il n'avait à considérer vos qualités héroïques, Seigneur larresterois sur ces charmands avantages que vous possédez, et qui vous ont fait à l'envi les Délices des deux SeI xes.
Ie luy ferois remarquer, MON 1 J31 SEIGNEVR, que iamais la nature n’a ODUL fait vn Prince plus aimable que vous:	Je avait ferais remarquer, MON 1 J31 SEIGNEUR, que jamais la nature n'a ODUL fait un Prince plus aimable que vous:
mais laiſſant à part ces aggreemens qui vous font donner plus damour que AVDIT vous n’en receuez, venons à ce qui rend 11 voſtre ALTESSE ROYALE, l’objet de 31111 noſtre admiration, & ce qui monſtre à 411 1 1 5 Tite qu’il ne vous a deuancé dans le 10 temps que comme vne Aurore qui deuoit preceder vn Soleil.	mais laissant à part ces agréments qui vous font donner plus damour que AUDIT vous n'en recevez, venons à ce qui rend 11 prit ALTESSE ROYALE, l'objet de 31111 notre admiration, et ce qui montre à 411 1 1 5 Tite qu'il ne vous a devancé dans le 10 temps que comme une Aurore qui devait précéder un Soleil.
N’eſtes vous pas, quoy que cette comparaiſon ſoit ſi commûne, tout éclatant de gloire, rien n’eſt de plus illuſtre que voſtre naiſſance, rien n’eſt de plus brillant que voſtre Eſprit, rien de plus ardant que voſtre Courage, rien de plus enflamé que voſtre Generoſité, & voſtre Ame n’eſt enfin qu’vne ſource perpetuelle de chaleur & de lumiere.	N'êtes vous pas, quoi que cette comparaison soit si commune, tout éclatant de gloire, rien n'est de plus illustre que votre naissance, rien n'est de plus brillant que votre Esprit, rien de plus ardant que votre Courage, rien de plus enflamé que votre Générosité, et votre Âme n'est enfin qu'une source perpétuelle de chaleur et de lumière.
Qu’on ne nous diſe point, MONSEIGNEVR, que voſtre Valeur n’a point paru comme celles des Alexandres & des Ceſars;	Qu'on ne nous dise point, MONSEIGNEUR, que votre Valeur n'a point paru comme celles des Alexandres et des Césars;
La Nature qui vous a fait le Prince le plus genereux du monde, n’a pas voulu que la Fortune vous ait rendu capable d’vne ambition déreglée, ny que voſtre ALTESSE ROYALE ait entrepris de conquerir le monde par la force, puiſque elle auoit dans ſon admirable bonté dequoy le conquerir par la douceur.	La Nature qui vous a fait le Prince le plus généreux du monde, n'a pas voulu que la Fortune vous ait rendu capable d'une ambition déréglée, ni que votre ALTESSE ROYALE ait entrepris de conquérir le monde par la force, puisque elle avait dans son admirable bonté dequoy le conquérir par la douceur.
Nous croyons cependant que voſtre courage eſt auſſi grand que celuy des plus fameux Conquerans, ou pluſtoſt que rien ne l’égale que cette extreme complaiſance que vous auez pour les tendreſſes d’vne Mere, qui prefere voſtre gloire à ſon repos, & qui ne peut ſouffrir que vous hazardiez vne vie qu’elle eſtime infiniment plus que toutes les grandeurs de la terre.	Nous croyons cependant que votre courage est aussi grand que celui des plus fameux Conquérants, ou plutôt que rien ne l'égale que cette extrême complaisance que vous avez pour les tendresses d'une Mère, qui préfère votre gloire à son repos, et qui ne peut souffrir que vous hasardiez une vie qu'elle estime infiniment plus que toutes les grandeurs de la terre.
C’eſt cette ſeule conſideration, MONSEIGNEVR, qui ſuſpend l’vſage de voſtre valeur, & qui donne inceſſamment a penſer aux plus redoutables de vos voiſins, que voſtre ALTESSE ROYALE eſtant libre les pourroit aſſujettir ſi elle le vouloit;	C'est cette seule considération, MONSEIGNEUR, qui suspend l'usage de votre valeur, et qui donne incessamment a penser aux plus redoutables de vos voisins, que votre ALTESSE ROYALE étant libre les pourrait assujettir si elle le voulait;
& que ſi dans vos ſimples diuertiſſemens de chaſſe, vous forcez tous les iours les Alpes, vous pourriez forcer les Pyrenées, & trouuer toute ſorte d’obſtacles bien au deſſous de voſtre courage.	et que si dans vos simples divertissements de chasse, vous forcez tous les jours les Alpes, vous pourriez forcer les Pyrénées, et trouver toute sorte d'obstacles bien au dessous de votre courage.
Que ne feriez vous pas dans cette ardante impetuoſité qui vous fait forcer les rochers, & franchir les precipices;	Que ne feriez vous pas dans cette ardante impétuosité qui vous fait forcer les rochers, et franchir les précipices;
les Ceſars & les Ambtus qurinettoient le paſſage des Alpes au rang des miracles de leur valeur, ne verroient aujourd huy qu’à leur confuſion, que vous les parcourez comme ſi c’eſtoient des plaines.	les Césars et les Ambtus qurinettaient le passage des Alpes au rang des miracles de leur valeur, ne verraient aujourd 'à leur confusion, que vous les parcourez comme si c'étaient des plaines.
Ce n’eſt donc pas touſiours que le meſtier della guerre eſt le plus perilleux, & qu’il ſuppoſe plus de courage que les autres:	Ce n'est donc pas toujours que le métier della guerre est le plus périlleux, et qu'il suppose plus de courage que les autres:
Cependant la iuſte contrainte où vous eſtes, par vne vie qu’elle vous conſerue, eſpargnant vn million de morts,ne peut ſouffrir que vous expoſiez dans des combats vn ſang-ſi precieux que le voſtre.	Cependant la juste contrainte où vous êtes, par une vie qu'elle vous conserve, épargnant un million de morts,ne peut souffrir que vous exposiez dans des combats un sangsi précieux que le vôtre.
C’eſt à quoy la Paix, dont l’Europe doit joüir, ſe veut oppoſer, auſſi bien que Madame voſtre Mere;	C'est à quoi la Paix, dont l'Europe doit jouir, se veut opposer, aussi bien que Madame votre Mère;
le Ciel meſme aime mieux conſeruer vos ennemis, ſi vous en auez, que de vous expoſer au peril de la guerré?	le Ciel même aime mieux conserver vos ennemis, si vous en avez, que de vous exposer au péril de la guerré?
Et-comme il ne fit que montrer vn peu de temps Tite à la terre, il veut vous y faire paroiſtre long temps, pour luy donner loiſir de voir tout ce qu’il a iamais fait de plus extraordinaire.	Et-comme il ne fit que montrer un peu de temps Tite à la terre, il veut vous y faire paraître long temps, pour lui donner loisir de voir tout ce qu'il a jamais fait de plus extraordinaire.
Ie n’en diray pas dauantage à voſtre gloire, tant parce que la Renommée en dit plus que moy, que parce que Tite commence à ſe rendre;	Je n'en dirai pas davantage à votre gloire, tant parce que la Renommée en dit plus que moi, que parce que Tite commence à se rendre;
& que n’attendantnvoſtre preſence que pour acheuer en luy ce que voſtre reputation y a commencé, il eſt dans limpatience de vous ceden la plus glorieuſe qualité du monde, pendant que ie ſuis en celle là de demander à voſtre extreme bonté la permiſſion de me dire auec autant de reſpect que de paſſion, oox voup	et que n'attendantnvôtre présence que pour achever en reste ce que votre réputation y a commencé, il est dans limpatience de vous céden la plus glorieuse qualité du monde, pendant que je suis en celle -là de demander à votre extrême bonté la permission de me dire avec autant de respect que de passion, oox voup
1Le tres-humble, le tres-obeîſſant, & le tres-ſoûmis ſeruiteur, SHAm AHldHH HE De MAGNONIJIIOI	1Le très-humble, le très-obeîssant, et le très-soûmis serviteur, SHAm AHldHH AH De MAGNONIIIIOI
NOMS DES ACTEVRS.	NOMS DES ACTEURS.
TITE, Empereur des Romains.	TITE, Empereur des Romains.
ANTOINE, Parent de Tite.	ANTOINE, Parent de Tite.
MTGIAN, Directeur de l’Empire.	MTGIAN, Directeur de l'Empire.
MVCIE, Fille de Mucian.	MUCIE, Fille de Mucian.
DITTIE, Confidente de Mucie.	DITTIE, Confidente de Mucie.
PIZON, Colonel des Gardes de Tite.	PIZON, Colonel des Gardes de Tite.
BERENICE, Reine de Iudée, & ſous le nom de Cleobule, Fauory de Tite.	BERENICE, Reine de Iudée, et sous le nom de Cléobule, Favori de Tite.
CLEONTE, Confident de Berenice.	CLÉONTE, Confident de Berenice.
La Scene eſt à Rome dans le Palais Imperial.	La Scène est à Rome dans le Palais Impérial.
TITE,	TITE,
TRAGI-COMEDIE.	TRAGI-COMÉDIE.
ACTE PREMIER.	ACTE PREMIER.
SCENE PREMIERE.	SCÈNE PREMIÈRE.
CLEONTE.	CLÉONTE.
BERENICE.	BERENICE.
CLEONTE.	CLÉONTE.
A Reine Berenice eſt ſous l'habit d’vn homme,	À Reine Berenice est sous l'habit d'un homme,
BERENICE.	BERENICE.
Tu ſçais, cher confident, ce qui m’ameine à Romme;	Tu sais, cher confident, ce qui m'amène à Romme;
Tu ſçais, comme en cachant, mon ſexe & ma grandeur, Ie fis monter l’audace où regnoit la pudeur.	Tu sais, comme en cachant, mon sexe et ma grandeur, Je fis monter l'audace où régnait la pudeur.
Ie pris malgré des loix que ſuit la bien-ſeance Auec vn habit d’homme vne maſle aſſeurance, Et voulus pardes traits dont i’armay mes regards Aſſujettirches, luy le plus grande des Ceſars.	Je pris malgré des lois que suit la bienséance Avec un habit d'homme une mâle assurance, Et voulus pardes traits dont j'armai mes regards Assujettirches, lui le plus grande des Césars.
OEBORTE.	ÔEBORTE.
De Reine des Hebreux, qu'eſtes-vous deuenuë?	De Reine des Hébreux, qu'êtes-vous devenue?
ICE.	ICE.
Le Soleil luit touſiours quoy qu’il ſoit ſous la nuë;	Le Soleil luit toujours quoi qu'il soit sous la nue;
Ce double changement & d’habit & de rang M’oſtant mes qualitez, n’oſte rien à mon ſang:	Ce double changement et d'habit et de rang M'ôtant mes qualités, n'ôte rien à mon sang:
Mon deſſein, dira-t'on, eſt comme inimitable, N'importe, dans mon ſort ie n’ay point de ſemblable;	Mon dessein, dira-t'-on, est comme inimitable, N'importe, dans mon sort éclair n'ai point de semblable;
Quelle gloire à vouloir ce qu’on peut imiter?	Quelle gloire à vouloir ce qu'on peut imiter?
I’ay quitté mon Royaume, il me pouuoit quitter.	J'ai quitté mon Royaume, il me pouvait quitter.
I’ay voulu rendre rare vne choſe commune Par vn nouueau deſdain ſurprendre la fortune, Et meſpriſant vn rang par moy-meſme abbatu Donner au lieu d’vn trône vn Temple à ma vertu;	J'ai voulu rendre rare une chose commune Par un nouveau dédain surprendre la fortune, Et méprisant un rang par moi-même abattu Donner au lieu d'un trône un Temple à ma vertu;
Le ſiecle à veu des Rois que le fort pût ſurprendre, Et contraindre à tomber d’où i’ay voulu deſcendre:	Le siècle à vu des Rois que le fort pût surprendre, Et contraindre à tomber d'où j'ai voulu descendre:
Ainſi i’ay mieux aimé m'eſpargnant leur douleur Deſcendre par vertu, que tomber par malheur.	Ainsi j'ai mieux aimé m'épargnant leur douleur Descendre par vertu, que tomber par malheur.
CLEONTE.	CLÉONTE.
Vous vous flattéz, Madame,	Vous vous flattéz, Madame,
BERENICE.	BERENICE.
En effet tu peux croire Que ie n'ay point agy par vn moiifde gloire.	En effet tu peux croire Que tu n'ai point agi par un moiifède gloire.
Faut-il qu'en laſche Reine abandonnant ma Cour I'impute à la vertu ce qu’a fait mon amour;	Faut-il qu'en lâche Reine abandonnant ma Cour J'impute à la vertu ce qu'a fait mon amour;
Luy qui veut qu’aux grandeurs l’on prefere les chaiſnes Ne m’a pû ſupporter dans le nombre des Reines:	Lui qui veut qu'aux grandeurs l'on préfère les chaînes Ne m'a pu supporter dans le nombre des Reines:
Il m’en a fait ſortir, & ne m’y laiſſant rien, Il m’oſta mon bandeau pour me donner le ſien.	Il m'en a fait sortir, et ne m'y laissant rien, Il m'ôta mon bandeau pour me donner le sien.
Ah!	Ah!
cher Tite, du monde adorables delices, Toy qui fais ſes plaiſirs, & qui fais mes ſupplices, Paut te, tuſque ene Stop reenerener mon vainqueur, Et rendre à mes regards le trouble de mon cœur.	cher Ite, du monde adorables délices, Toi qui fais ses plaisirs, et qui fais mes supplices, Paut te, tusque en Stop reénérener mon vainqueur, Et rendre à mes regards le trouble de mon cœur.
CLEONTE.	CLÉONTE.
Vous vous flattez encor,	Vous vous flattez encor,
BERENICE.	BERENICE.
Faut-il donc te redire Que mon Royaume eſt joint au corps de ſon Empire, Et que Tite autrefois ayant pris mes Eſtats, M’a luy-meſme arrachée au rang des Totentats;	Faut-il donc te redire Que mon Royaume est joint au corps de son Empire, Et que Tite autrefois ayant pris mes États, M'a lui-même arrachée au rang des Totentats;
Tu ſçais trop, qu’indigné de me voir ſans puiſſance, Mon peuple me chaſſa des lieux de ma naiſſance:	Tu sais trop, qu'indigné de me voir sans puissance, Mon peuple me chassa des lieux de ma naissance:
Que de mon malheur meſme il me voulut punir, Ah!	Que de mon malheur homme il me voulut punir, Ah!
qu’il me valloit mieux perdre cent fois la vie, Que de mille malheurs la reuoir pourſuiuie, Et me repreſentant tant de ſortes de maux, Nen voir point de paſſes ſans en voir de nouueaus Ie me ſuis donc pû voir ſur la terre & ſur l'onde Vn portrait animé des deſaſtres du monde;	qu'il me valait mieux perdre cent fois la vie, Que de mille malheurs la revoir poursuivie, Et me représentant tant de sortes de maux, Nen voir point de passes sans en voir de nouveaus Je me suis donc pu voir sur la terre et sur l'onde Un portrait animé des désastres du monde;
Et forçant les rochers, les bancs, & les eſcueils, I'ay vû deux Elemens m’ouurir mille cercueils, Toutesfois eſchapant de l'onde & de la terre, Ie me ſuis fait dans Romme vne nouuelle guerre Depuis trois mois entiers que m’y retient mon ſort, I’ay trouué la tempeſte, où ie cherchois le port.	Et forçant les rochers, les bancs, et les écueils, J'ai vu deux Éléments m'ouvrir mille cercueils, Toutefois échappant de l'onde et de la terre, Je me suis fait dans Romme une nouvelle guerre Depuis trois mois entiers que m'y retient mon sort, J'ai trouvé la tempête, où notre cherchais le port.
caundu C Tit ouineu par ouuxen uompiumta ludée,	caundu Ç It ouineu par ouuxen uompiumta ludée,
Ah!	Ah!
dis que ma conqueſte y fut trop mal gardée, Et que Romme & ſon Pere ayant ſçeu ſon amour Pour l'oſter de chez moy preſſerent ſon retour.	dis que ma conquête y fut trop mal gardée, Et que Romme et son Père ayant su son amour Pour l'ôter de chez moi pressèrent son retour.
C Veſpaſian eſt mort, IOIMIARE	Ç Vespasian est mort, JOIMIARE
CE.	CE.
Mais Romme eſt immortelle, Tite eſtant Empereur me peut eſtre infidelle;	Mais Romme est immortelle, Tite étant Empereur me peut être infidèle;
Sa Mere, & Mucian qui regleront ſon choix, Ne l’vniront iamais à des filles de Rois:	Sa Mère, et Mucian qui régleront son choix, Ne l'uniront jamais à des filles de Rois:
De leur intention ie ſuis trop éclaircie, Tout le Conſeil pretend qu'il épouze Mucie;	De leur intention Seigneur suis trop éclaircie, Tout le Conseil prétend qu'il épouze Mucie;
Puis-je donc empeſcher qu'un Miniſtre d'Eſtat Ne prefere ſon ſang au ſang d’vn Potentat.	Puis-je donc empêcher qu'un Ministre d'État Ne préfère son sang au sang d'un Potentat.
Ah!	Ah!
d’vn pere en faueur cette éclatante enuie M’enleue mes Eſtats, mon repos, & ma vie, Et par la nouueauté d'vn double changement M’ameine en inconnuë aux yeux de mon amant:	d'un père en faveur cette éclatante envie M'enlève mes États, mon repos, et ma vie, Et par la nouveauté d'un double changement M'amène en inconnue aux yeux de mon amant:
I’y ſuis depuis trois mois, mais en vain, ô merueille?	J'y suis depuis trois mois, mais en vain, ô merveille?
Mes yeux frapent les ſiens, & ma voix ſon oreille.	Mes yeux frappent les siens, et ma voix son oreille.
Se peut-il bien, Amour, toy qui fais nos portraits Qu’vn amant en vn an méconnoiſſe mes traits;	Se peut-il bien, Amour, toi qui fais nos portraits Qu'un amant en un an méconnaisse mes traits;
Oüy, c’eſt qu’on ne plaiſt plus en ceſſant de pareſtre.	Oui, c'est qu'on ne plaît plus en cessant de paraître.
Et qui ceſſe d’aimer, ceſſe de reconneſtre:	Et qui cesse d'aimer, cesse de reconnêtre:
Vn amour par l’abſence eſt bien-toſt affoibly, Et l’abandonnement degenere en oubly L’oubly paſſe d’abord iuſqu'à l’indifference.	Un amour par l'absence est bientôt affaibli, Et l'abandonnement dégénère en oubli L'oubli passe d'abord jusqu'à l'indifférence.
L’indifference porte à la méconnoiſſance.	L'indifférence porte à la méconnaissance.
Cette méconnoiſſance à l’infidelité, Et l'vn & l’autre font l'inſenſibilité.	Cette méconnaissance à l'infidélité, Et l'une et l'autre font l'insensibilité.
4 B MoiMo	4 B MoiMo
BERENICE.	BERENICE.
Ioignez à ces raiſons les trauaux d'vn voyage, Vn changement d’habit, & de cheueux, & d’âge, Meſme vn deſgui ſement d’actions & de voix, Et ſur tout que Ceſar ne vous vit qu’une fois, I	Joignez à ces raisons les travaux d'un voyage, Un changement d'habit, et de cheveux, et d'âge, Même un dégui sèment d'actions et de voix, Et sur tout que Jésar ne vous vit qu'une fois, I
CLEOBVLE.	CLEOBVLE.
Ne dis point que Ceſar ne ſoit point on volagés	Ne dis point que César ne soit point on volagés
A 3 Son cœur eſt plus changé que ne l’eſt mon viſage;	À 3 Son cœur est plus changé que ne l'est mon visage;
Si i’ay changé de lieux, il a changé de Cour, Si i’ay changé d’habits, il a changé d’amour:	Si j'ai changé de lieux, il a changé de Cour, Si j'ai changé d'habits, il a changé d'amour:
Non qu’en me reuoyant, toute ſon ame eſmeuë N’ait dés l’abord porté ſon deſordre à ma veuë;	Non qu'en me revoyant, toute son âme émue N'ait dès l'abord porté son désordre à ma vue;
A peine l’inconſtant me reuit en ces lieux Que ſes eſprits troublez paſſerent dans ſes yeux:	À peine l'inconstant me revit en ces lieux Que ses esprits troublés passèrent dans ses yeux:
Ie preſumay d’abord qu'il m’auoit reconnuë, Mais ſon ame en ce point ne fut que preuenuë;	Je présumai d'abord qu'il m'avait reconnue, Mais son âme en ce point ne fut que preuenuë;
Son cœur n’euſt pas le temps de ſe determiner, Et ſur vn tel penchant il ne fit qu’incliner.	Son cœur n'eût pas le temps de se déterminer, Et sur un tel penchant il ne fit qu'incliner.
En ce moment j’allay luy voüer mon ſeruice, Il en agrea l’offre au nom de Berenice;	En ce moment j'alla y mourer mon service, Il en agréa l'offre au nom de Berenice;
