I’aime trop la vertu pour vouloir la détruire, Et ſi de mes deſſeins vous daignez vous inſtruire, Bien loin d’en murmurer peut-eſtre verrez-vous, Que i’adore le vice autant ou plus que vous:	J'aime trop la vertu pour vouloir la détruire, Et si de mes desseins vous daignez vous instruire, Bien loin d'en murmurer peut-être verrez-vous, Que j'adore le vice autant ou plus que vous:
Ie voudrois épargner vn crime à voſtre pere Et ſçachant à quel poinct ſon humeur eſt ſelere, Par pitié pour tous deux ie tâche d’empeſcher Vne ſeuerité qu’il peut ſe reprocher;	Je voudrais épargner un crime à votre père Et sachant à quel point son humeur est selere, Par pitié pour tous deux grands tâche d'empêcher Une sévérité qu'il peut se reprocher;
Si vous auez beſoin de ſecours ou d’eſcorte, Ie veux vous en fournir, ie vous offre main forte.	Si vous avez besoin de secours ou d'escorte, Je veux vous en fournir, ie vous offre main forte.
Des traits de ſa fureur daignez vous garthtr;	Des traits de sa fureur daignez vous garthtr;
me graee cpaignez-ſuy I'norreur d’vn repentir;	me grace cpagnez-lui J'norreur d'une repentir;
Contre vn pere irrité la fuitte eſt ſalutaire, Et ſouuent la terreur eſt vn mal neceſſaire.	Contre un père irrité la fuite est salutaire, Et souvent la terreur est un mal nécessaire.
Seruez-vous des moyens que vous offre le ſort?	Servez-vous des moyens que vous offre le sort?
MANLIVS.	MANLIVS.
Moy fuïr?	Moi fuir?
moy me ſauuer pour éuiter la mort:	moi me sauver pour éviter la mort:
Que la poſterité reproche à ma memoire, Qu’vne honteuſe fuitte a ſoüillé ma victoire?	Que la postérité reproche à ma mémoire, Qu'une honteuse fuite a souillé ma victoire?
Non ſi ie dois mourir pour vn crime ſi beau, La gloire de ſa main me conduit au tombeau:	Non si ici dois mourir pour un crime si beau, La gloire de sa main me conduit au tombeau:
Sur la foy d’vn ter guide m'eſt doun d y deſcendre.	Sur la foi d'un ter de m'est doun d y descendre.
CAMILLE.	CAMILLE.
En vain ce fol eſpoir tâche de vous ſurprendre, Cette mort qui vous charme au milieu des combas, Dans les mains d’vn bourreau perdroit tous ſes appas.	En vain ce fol espoir tâche de vous surprendre, Cette mort qui vous charme au milieu des combas, Dans les mains d'un bourreau perdrait tous ses appas.
Iamais vn tel deſſein n’inſpira de l'enuie;	Jamais un tel dessein n'inspira de l'envie;
Auſſi n’auez-vous pas tant d’horreur pour la vie, Que ce genre de mort ne vous ſemble odieux.	Aussi n'avez-vous pas tant d'horreur pour la vie, Que ce genre de mort ne vous semble odieux.
Mais ne pouuant laiſſer Omphale dans ces lieux, Vous aimezmieux ſouffrir la mort la plus cruelle, Que de quitter le camp & de partir ſans elle.	Mais ne pouvant laisser Omphale dans ces lieux, Vous aimezmieux souffrir la mort la plus cruelle, Que de quitter le camp et de partir sans elle.
MANLIVS.	MANLIVS.
Moy, Madame?	Moi, Madame?
CAMILLE.	CAMILLE.
Ouy vous:	Oui vous:
ie ſçay tous vos ſecrets, Les regards des amans ſont touſiours indiſcrets, Ils ne peuuent ſentir vn grand teu dans leur ame, Sans donner au dehois quelque marque de flâme :	ici sais tous vos secrets, Les regards des amants sont toujours indiscrets, Ils ne peuvent sentir un grand teu dans leur âme, Sans donner au dehais quelque marque de flamme :
Et meſme ce qu’ils font pour cacher leurs ſoupirs, Eſt ſouuent ce qui fait deuiner leurs deſirs.	Et même ce qu'ils font pour cacher leurs soupirs, Est souvent ce qui fait deviner leurs désirs.
On ne remarque point vn ſoûpir ordinaire;	On ne remarque point un soupir ordinaire;
Mais quand on le retient, & qu’on craint de le faire, On deuine d’abord qu’vn peu de paſſion, Fait naiſtre dans vn cœur cette précaution Parlez Parlez donc, Manlius, bien que ie ſois Romaine, Et que touſiours mon ame ait conceu de la haine Pour cette illuſion que vous nommez amour;	Mais quand on le retient, et qu'on craint de le faire, On devine d'abord qu'un peu de passion, Fait naître dans un cœur cette précaution Parlez Parlez donc, Manlius, bien que sans sois Romaine, Et que toujours mon âme ait conçu de la haine Pour cette illusion que vous nommez amour;
Si pour vous conſeruer la lumiere du iour, Il faut enfraindre vn peu, les loix de la ſageſſe, Ie penſe que pour vous i’auray cette foibleſſe, Omphale a du merite, & ie veux vous ſauuer:	Si pour vous conserver la lumière du jour, Il faut enfraindre un peu, les lois de la sagesse, Je pense que pour vous j'aurai cette faiblesse, Omphale a du mérite, et Seigneur veux vous sauver:
Vous vous aymez, enfin, vous pouuez l’enleuer:	Vous vous aimez, enfin, vous pouvez l'enlever:
Voyez ce que pour vous auiourd’huy ie ſurmonte.	Voyez ce que pour vous aujourd'hui juste surmonte.
O Dieux!	Ô Dieux!
ce ſeul diſcours me fait rougir de honte:	ce seul discours me fait rougir de honte:
MANLIVS.	MANLIVS.
Moy, former des deſſeins pour vn enleuement?	Moi, former des desseins pour un enlèvement?
Me preſeruent les Dieux d’vn tel aueuglement.	Me préservent les Dieux d'un tel aveuglément.
Ie ſçay trop que la gloire eſt chere à ma Princeſſe Pour conceuoir iamais vn deſir qui la bleſſe;	Je sais trop que la gloire est chère à ma Princesse Pour concevoir jamais un désir qui la blesse;
Et mon cœur craint bien plus d’irriter ſes appas Qu’il ne craindroit les coups du plus cruel trépas.	Et mon cœur craint bien plus d'irriter ses appas Qu'il ne craindrait les coups du plus cruel trépas.
CAMILLE.	CAMILLE.
Ie vous l’ay dé-ja dit, on me fait iniuſtice, Quand on peut m’accuſer de conſeiller le vice;	Je vous l'ai déjà dit, on me fait injustice, Quand on peut m'accuser de conseiller le vice;
Cét outrageant ſoupçon me force à vous parler D’vn mal que par pitié, ie voulois vous celer;	Cet outrageant soupçon me force à vous parler D'un mal que par pitié, il voulais vous celer;
Il eſt temps d’éclatter:	Il est temps d'éclatter:
& c’eſt trop me contraindre?	et c'est trop me contraindre?
Sçachez que c’eſt icy qu’Omphale a tout à craindre, Que le Conſul épris de voſtre meſme mal Pour ſoulager ſes feux:	Sachez que c'est ici qu'Omphale a tout à craindre, Que le Consul épris de votre grande mal Pour soulager ses feux:
MANLIVS.	MANLIVS.
Mon Pere, mon Riual!	Mon Père, mon Rival!
O Dieux!	Ô Dieux!
que dites vous?	que dites -vous?
CAMILLE.	CAMILLE.
Ce qu’il faut vous apprendre:	Ce qu'il faut vous apprendre:
Ouy, le cœur du Conſul s’eſtant laiſſé ſurprendre, Aux indignes appas d’vn amoureux tranſport, Eſtant maiſtre abſolu d’Omphale & de ſon ſort Peut tout executer contre vous, & contfe-elle, Si vous ne profitez d’vn aduis ſi fidelle.	Oui, le cœur du Consul s'étant laissé surprendre, Aux indignes appas d'un amoureux transport, Étant maître absolu d'Omphale et de son sort Peut tout exécuter contre vous, et contest-elle, Si vous ne profitez d'un avis si fidèle.
Ne conſultez donc plus vn timide reipect, Et fuyez promptement vn iuge ſi ſuſpect.	Ne consultez donc plus un timide reipect, Et fuyez promptement un juge si suspect.
MANLIVS.	MANLIVS.
Quelque profond reſpect que vous doiue mon ame Dans cette occaſion pardonnez moy Madame, Si pour vn tel diſcours ie refuſe ma foy, Et ſi tous vos conſeils ne peuuent rien ſur moy.	Quelque profond respect que vous doive mon âme Dans cette occasion pardonnez moi Madame, Si pour un tel discours venir refuse ma foi, Et si tous vos conseils ne peuvent rien sur moi.
Ie ſçay, voſtre vertu;	Je sais, votre vertu;
mais ie connois mon Pere;	mais ici connais mon Père;
Et i’ay peine à penſer qu’vn Romain ſi ſeuere, Qui depuis ſi long-temps braue les paſſions vouiut amn ter cent belles actions.	Et j'ai peine à penser qu'une Romain si sévère, Qui depuis si longtemps brave les passions vouiut amn ter cent belles actions.
Diſſipez cette erreur dont voſtre ame eſt ſaiſie, Sans doute les vapeurs d’vn peu de ialouſie Ont ietté voſtre eſprit dans cét aueuglement.	Dissipez cette erreur dont votre âme est saisie, Sans doute les vapeurs d'un peu de jalousie Ont jeté votre esprit dans cet aveuglement.
CAMILLE.	CAMILLE.
Quoy?	Quoi?
vous me ſoupçonnez d’vn tel déreglement:	vous me soupçonnez d'un tel dérèglement:
Vous pouuez m’accuſer d’vne crainte ſi vile?	Vous pouvez m'accuser d'une crainte si vile?
Apprenez, apprenez à connoiſtre Camille, La vefue d’vn Conſul qui ſauua les Romains, Peut choiſir vn Epoux parmy tous les humains.	Apprenez, apprenez à connaître Camille, La veuve d'un Consul qui sauva les Romains, Peut choisir un Époux parmi tous les humains.
Entre nos Citoyens on n’affecte perſonne, Ils n’ont que le pouuoir que la Vertu leur donne, Ils montent à leur rang par leurs nobles trauaux, Et s’ils ſont tous vaillans, ils me ſont tous égaux.	Entre nos Citoyens on n'affecte personne, Ils n'ont que le pouvoir que la Vertu leur donne, Ils montent à leur rang par leurs nobles travaux, Et s'ils sont tous vaillants, ils me sont tous égaux.
Allez malgré mes ſoins, allez tendre la teſte Sous le tranchant mortel du couſteau qui s’apreſte, Voſtre ſeule iniuſtice a merité la mort, Et ie vous abandonne aux cruautez du ſort.	Allez malgré mes soins, allez tendre la tête Sous le tranchant mortel du couteau qui s'apprête, Votre seule injustice a mérité la mort, Et ainsi vous abandonne aux cruautés du sort.
SCENE III MANLIVS, ſeul.	SCÈNE III MANLIUS, seul.
Sort vrayement cruel!	Sort vraiment cruel!
ô funeſte auanture!	ô funeste aventure!
OO mortel accident!	OO mortel accident!
ô Triſte conioncture!	ô Triste conioncture!
Eſt-il rien icy-bas à ton mal-heur égal, Amant infortuné?	Est-il rien ici-bas à ton malheur égal, Amant infortuné?
ton Pere eſt ton Riual.	ton Père est ton Rival.
Quoy le cœur du Conſul ceſſe d’eſtre inſenſible?	Quoi le cœur du Consul cesse d'être insensible?
O Dieux!	Ô Dieux!
ce changement ſeroit-il donc poſſible?	ce changement serait-il donc possible?
As-tu bien entendu?	As-tu bien entendu?
ne t’a t’on point ſurpris?	ne t'a -t-on point surpris?
Rappelle Manlius, rappelle tes eſprits Ceſſe de te plonger dans cette peine extréme:	Rappelle Manlius, rappelle tes esprits Cesse de te plonger dans cette peine extrême:
Sans doute on t’a ſurpris:	Sans doute on t'a surpris:
Torquatus eſt le meſme:	Torquattus est le même:
Mais pourquoy m’accuſer de foibleſſe ou d’erreur?	Mais pourquoi m'accuser de faiblesse ou d'erreur?
Quoy pour eſtre vn Conſul en-a t’on moins vn cœur?	Quoi pour être un Consul en-a -t-on moins un cœur?
Eſt-ce vn ſi grand effort aux yeux de ma Princeſſe?	Est-ce un si grand effort aux yeux de ma Princesse?
Que de rendre vn Romain capable de tendreſſe?	Que de rendre un Romain capable de tendresse?
Ce qu’ont pû ſes appas, ne le peuuent-ils plus?	Ce qu'ont pu ses appas, ne le peuvent-ils plus?
Et n’a t’elle des traits que contre Manlius?	Et n'a -t-elle des traits que contre Manlius?
Helas pour mon mal-heur, ces adorables charmes, A qui mon cœur rendit ſi promptement les armes, Sur tous les cœurs mortels, ont le meſme pouuoir, Et pour les adorer, il ſuffit de les voir.	Hélas pour mon malheur, ces adorables charmes, À qui mon cœur rendit si promptement les armes, Sur tous les cœurs mortels, ont le même pouvoir, Et pour les adorer, il suffit de les voir.
Mon Pere les a veus, mon Pere a deû ſe rendre.	Mon Père les a vus, mon Père a deu se rendre.
Puiſqu’il auoit des yeux, qui pouuoit s’en deffendre?	Puisqu'il avait des yeux, qui pouvait s'en défendre?
Qui peut voir ſans tranſport tant de diuins appas?	Qui peut voir sans transport tant de divins appas?
Qui peut connoiſtre Omphale, & ne l’adorer pas?	Qui peut connaître Omphale, et ne l'adorer pas?
Amour, Nature, Dieux, qui la fiſtes ſi belle Faites donc par pitié qu’on n’ait plus d’yeux pour elle:	Amour, Nature, Dieux, qui la fîtes si belle Faites donc par pitié qu'on n'ait plus d'yeux pour elle:
He!	He!
ſi quand on la voit, on deuient mon riual Aueuglez les mortels pour ſoulager mon mal.	si quand on la voit, on devient mon rival Auglez les mortels pour soulager mon mal.
Seul ie ſçay bien porter mes glorieuſes chaînes On partage mes biens ſans partager mes peines.	Seul assez sais bien porter mes glorieuses chaînes On partage mes biens sans partager mes peines.
Seul ie ſçay bien aimer, & tu vois comme moy!	Seul ie sais bien aimer, et tu vois comme moi!
Ah, reuoquez grands Dieux cette barbare loy:	Ah, révoquez grands Dieux cette barbare loi:
Si ie ſçay ſeul aimer, faites s’il eſt poſſible Que ſeul ie puiſſe voir ce miracle viſible;	Si ici sais seul aimer, faites s'il est possible Que seul seul puisse voir ce miracle visible;
Mais i’apperçoy les yeux dont les traits m’ont bleſſé, Prens courage mon cœur tu feras crauce;	Mais j'aperçois les yeux dont les traits m'ont blessé, Prends courage mon cœur tu feras crauce;
Mais les Dieux attendris du tourment qui te preſſe Font exprés dans ce lieu rencontrer ta Princeſſe:	Mais les Dieux attendris du tourment qui te presse Font exprès dans ce lieu rencontrer ta Princesse:
R’anime en la voyant ton eſpoir abbatu.	R'anime en la voyant ton espoir abattu.
SCENE IV OMPHALE, MANLIVS, PHENICE.	SCÈNE IV OMPHALE, MANLIUS, PHENICE.
MANLIVS.	MANLIVS.
H, Madame, venez ſoûtenir ma Vertu H Accablé par le ſort, par l’amour, par moymeſme, I’ay beſoin de ſecours dans ce peril extréme.	H, Madame, venez soutenir ma Vertu H Accablé par le sort, par l'amour, par moymesme, J'ai besoin de secours dans ce péril extrême.
Dans quelque lieu fatal, où i’addreſſe mes pas, le ne trouue que maux, que uouleuis, qu’eihbarras Au milieu des aſſauts, que le deſtin me liure, Ie crains également de mourir & de viure, Dans vn mal ſi preſſant daignez me ſecourir.	Dans quelque lieu fatal, où j'adresse mes pas, le ne trouve que maux, que ouvleuis, qu'eihbarras Au milieu des assauts, que le destin me livre, Je crains également de mourir et de vivre, Dans un mal si pressant daignez me secourir.
OMPHALE.	OMPHALE.
Que peut noſtre ſecours, ſi vous voulez perir, Si vous voulez ayder à voſtre deſtinée?	Que peut notre secours, si vous voulez périr, Si vous voulez aider à votre destinée?
Si voſtre ame à ſa perte, eſt ſi fort obſtinée;	Si votre âme à sa perte, est si fort obstinée;
Qu’elle ſemble courir au deuant de la mort, Qui peut vous garentir des cruautez du ſort:	Qu'elle semble courir au devant de la mort, Qui peut vous garantir des cruautés du sort:
Pour quoy me demander vn conſeil inutile?	Pour quoi me demander un conseil inutile?
Ie viens preſentement d'apprendie de vuhille, Comme vous receuez ſes fideles auis, Et de quel air par vous ſes conſeils ſont ſuiuis.	Je viens présentement d'apprendie de vuhille, Comme vous recevez ses fidèles avis, Et de quel air par vous ses conseils sont suivis.
Vous offrir du ſecours, c’eſt vous faire vne offenſe Vos deſirs & le ſort ſemblent d’intelligence, D iij Vous aymez le trépas, vous y voulez courir, Apres cela, Seigneur, qui peut vous ſecourir?	Vous offrir du secours, c'est vous faire une offense Vos désirs et le sort semblent d'intelligence, D ij Vous aimez le trépas, vous y voulez courir, Après cela, Seigneur, qui peut vous secourir?
MANLIVS.	MANLIVS.
Vous, ma Princeſſe, vous, vn mot de voſtre bouche Peut ſauuer Manlius, ſi ſon trépas vous touche:	Vous, ma Princesse, vous, un mot de votre bouche Peut sauver Manlius, si son trépas vous touche:
Dites-moy, ne meurs point, & tu vas m’acquerir, Et rien n’eſt aſſez fort pour me faire mourir.	Dites-moi, ne meurs point, et tu vas m'acquérir, Et rien n'est assez fort pour me faire mourir.
Que trente legions me ferment le paſſage, Que l’Enfer animé s’oppoſe à mon courage, Que d’vn Pere irrité le courroux odieux, Arme contre mes iours la colere des Dieux;	Que trente légions me ferment le passage, Que l'Enfer animé s'oppose à mon courage, Que d' Hère irrité le courroux odieux, Arme contre mes jours la colère des Dieux;
Mon bras victorieux fera voir à leur honte Qu’il n’eſt rien icy bas, qu’vn amant ne ſurmonte, Quand l’adorable obiet dont ſon cœur eſt épris, De ſes nobles trauaux ſe veut rendre le pris.	Mon bras victorieux fera voir à leur honte Qu'il n'est rien ici bas, qu'un amant ne surmonte, Quand l'adorable objet dont son cœur est épris, De ses nobles travaux se veut rendre le pris.
Prononcez donc l’Aritit, ia diume rrinceſſe, Dois-ie viure ou mourir?	Prononcez donc l'Arit, ja divme rincesse, Dois-je vivre ou mourir?
parlez, le temps nous preſſe.	parlez, le temps nous presse.
Ménageons les momens que nous laiſſe le ſort.	Ménageons les moments que nous laisse le sort.
OMPHALE.	OMPHALE.
Cruel demandez-vous, ſi ie veux voſtre mort:	Cruel demandez-vous, si ici veux votre mort:
Ha!	Ha!
ne balancez point, quittez ce lieu funeſte:	ne balancez point, quittez ce lieu funeste:
mon cuur, ce mon amour tous ſepondent du reſte.	mon cuvr, ce mon amour tous sépondent du reste.
MANLIVS.	MANLIVS.
Moy, vous quitter:	Moi, vous quitter:
ô Dieux!	ô Dieux!
Ie n’y puis conſentir, Accompagnez ma fuite, où ie ne puis partir.	Je n'y puis consentir, Accompagnés ma fuite, où tu ne puis partir.
OMPHALE.	OMPHALE.
Gardez-vous, Manlius, d’attirer ma colere, Souuenez-vous ſur tout que la gloire m’eſt chere;	Gardez-vous, Manlius, d'attirer ma colère, Souuenez-vous sur tout que la gloire m'est chère;
Et que de quelques traits dont ie ſente les coups, La gloire & mon deuoir me touchent plus que vous.	Et que de quelques traits dont notre sente les coups, La gloire et mon devoir me touchent plus que vous.
MANLIVS.	MANLIVS.
Acheuez, acheuez, dites auſſi Madame, Que l’amour du Conſul, ſoûmet enfin voſtre ame;	Achevez, achevez, dites aussi Que, Que l'amour du Consul, soumet enfin notre âme;
Que ce rang eminent, ces titres glorieux, Toutes ces dignitez ont éblouy vos yeux:	Que ce rang éminent, ces titres glorieux, Toutes ces dignités ont ébloui vos yeux:
Si ce pompeux éclat vous auoit moins flatée, Mon diſcours vous auroit auſſi moins irritée, Connoiſſant du Conſul le pouuoir abſolu, Mon amoureux proiet peut-eſtre vous eut plû, Mais i’auois deû m’attendre à cette préference:	Si ce pompeux éclat vous avait moins flattée, Mon discours vous aurait aussi moins irritée, Connaissant du Consul le pouvoir absolu, Mon amoureux prois peut-être vous eut plu, Mais j'avais de m'attendre à cette préférence:
Ie n’en murmure point, c’eſt vn trait de prudence:	Je n'en murmure point, c'est un trait de prudence:
Torquatus vaut bien mieux, qu’vn Amant malheureux Qui ne peut vous offrir que d’inutiles feux.	Torquatus vaut bien mieux, qu'un Amant malheureux Qui ne peut vous offrir que d'inutiles feux.
Abandonnez au ſort les reſtes d’vne vre, Qui ſans doute dans peu me doit eſtre rauie:	Abandonnez au sort les restes d'une re, Qui sans doute dans peu me doit être ravie:
Et ne permettez pas, que mon cruel tourment Plouole vontle bon neur d'vn ſenois reulement, Si le bucher fatal où ie perdray la vie, Vous pouuoit éleuer au gré de voſtre enuie;	Et ne permettez pas, que mon cruel tourment Plouole vontle bon neur d'un senais revlement, Si le bûcher fatal où je perdrai la vie, Vous pouvait élever au gré de votre envie;
Ie mourrois ſatisfait & de vous & du ſort.	Je mourrais satisfait et de vous et du sort.
OMPHALE.	OMPHALE.
Acheue, acheue ingrat, de me donner la mort:	Achève, achève ingrat, de me donner la mort:
Pourſuis cét entretien dont la rigueur me tuë, Dlle ien vay drdercapler d d vede, Inhumain, parle donc, quoy tu ne dis plus rien?	Poursuis cet entretien dont la rigueur me tue, Dlle yen vay drdercapler d vède, Inhumain, parle donc, quoi tu ne dis plus rien?
Apres m’auoir tenu ce funeſte entretien:	Après m'avoir tenu ce funeste entretien:
Tu me laiſſes languir au milieu du ſupplice?	Tu me laisses languir au milieu du supplice?
Barbare par pitié, pourſuis ton iniuſtice	Barbare par pitié, poursuis ton injustice
MANLIVS.	MANLIVS.
Amoureux, tranſporté, confus, triſte, interdit:	Amoureux, transporté, confus, triste, interdit:
Ie n’oſe, ie ne puis:	Je n'ose, Madame ne puis:
OMPHALE.	OMPHALE.
Va, va, c’eſt aſſez dit.	Va, va, c'est assez dit.
C’eſt à mon deſeſpoir à finir cét ouurage;	C'est à mon désespoir à finir cet ouvrage;
Mon bras épargnera mon trépas à ta rage, Dé-ja par ce beau coup mon cœur eût éuité La honte, & les douleurs de la captiuité, Si le Ciel irrité pour comble de miſere, Ne t’auoit fait trouuer le ſecret de me plaire.	Mon bras épargnera mon trépas à ta rage, Déjà par ce beau coup mon cœur eût éuité La honte, et les douleurs de la captivité, Si le Ciel irrité pour comble de misère, Ne t'avait fait trouver le secret de me plaire.
Quand mes cruels mal-heurs me demandoient la mort, Vn tendre mouuement arreſtoit ce tranſport Vne ſecrette voix qui m’eſtoit inconnuë, Me diſoit, ſi tu meurs, tu vas perdre ſa veuë, Et ne connoiſſant rien de plus cruel pour moy, I’aymois mieux perdre tout, que me priuer de toy:	Quand mes cruels malheurs me demandaient la mort, Un tendre mouvement arrêtait ce transports Mieux perte voix qui m'était inconnue, Me disait, si tu meurs, tu vas perdre sa vue, Et ne connaissant rien de plus cruel pour moi, J'aimais mieux perdre tout, que me priver de toi:
Ie craignois par l’effet de la meſme tendreſſe;	Je craignais par l'effet de la même tendresse;
D’accabler ton eſprit d’vn excez de triſteſſe En t’apprenant les feux dont ton Pere eſt eſpris;	D'accabler ton esprit d'un excès de tristesse En t'apprenant les feux dont ton Père est épris;
Mais ie t’en vengeois bien par mes cruels mépris;	Mais quelque t'en vengeais bien par mes cruels mépris;
Et peut-eſtre le fer eût eu moins de puiſſance Que n’en auoit, ingrat, ma ſeule indifference, Cependant pour le prix de ma fidelité Ta rage me ſoupçonne auec impunité:	Et peut-être le fer eût eu moins de puissance Que n'en avait, ingrat, ma seule indifférence, Cependant pour le prix de ma fidélité Ta rage me soupçonne avec impunité:
Tu m’aceuſes d’auoir l’ame baſſe & commune De ſoûmettre mon cœur aux loix de la fortune:	Tu m'aceuses d'avoir l'âme basse et commune De soumettre mon cœur aux lois de la fortune:
Ah, i’eſpere cruel que bien-toſt mon trépas T apprenuianIe laſte à poul moy des appas, Sçachant alors mon prix, apres m’auoir perduë Tu mourras de regret de m’auoir mal connuë, Tu vengeras ma mort par ton propre tourment.	Ah, j'espère cruel que bientôt mon trépas T apprenuieanIe laste à poul moi des appas, Sachant alors mon prix, après m'avoir perdue Tues mourras de regret de m'avoir mal connue, Tues vengeras ma mort par ton propre tourment.
Adieu Baibare:	Adieu Baibare:
MANLIVS.	MANLIVS.
Helas!	Hélas!
arreſtez vn moment Pour venger voſtre offence & pour punir mon crime, Receuez s’il ſe peut tout mon ſang pour victime:	arrêtez un moment Pour venger votre offense et pour punir mon crime, Receuez s'il se peut tout mon sang pour victime:
Princeſſe, par l’effet d’vn trop iunte tranſport:	Princesse, par l'effet d'un trop junte transport:
ſe vays.	se vais.
OMPHALE.	OMPHALE.
Ha, Manlius, ie ne veux point ta mort, Quelque extréme douleur que ton ſoupçon me donne, – Malgré moy ie ſens bien que mon cœur te pardonne, Et que ſur les Amans l’amour eſt ſi puiſſant, Qu’vn obiet qu’on cherit eſt touſiours innocent, l’excuſe ton tranſport, vis ſi tu veux me plaire.	Ha, Manlius, Seigneur ne veux point ta mort, Quelque extrême douleur que ton soupçon me donne, Malgré moi ie sens bien que mon cœur te pardonne, Et que sur les Amans amour est si puissant, obiet on cherit est tousiours innocent, excuse ton transport, vis si tu veux me plaire.
run es plus de ton ſang que le dépoſitaire, Ce treſor m’appartient, l’amour me l’a donné.	run es plus de ton sang que le dépositaire, Ce trésor m'appartient, l'amour me l'a donné.
MANLIVS.	MANLIVS.
Qi jamu Prmeene, o Dieux!	Qui jamu Prmeene, ô Dieux!
m'auez- vous pardonné:	m'avez- vous pardonné:
1 Helas, eſt il donc vray, que mon remors vous touche?	1 Hélas, est -il donc vrai, que mon remors vous touche?
OMPHALE.	OMPHALE.
Crois mon cœur, Manlius, ſi tu ne croy ma bouche, S’il pouuoit ſans temoins s’exprimer dans ce lieu, Que ne diroit-il point?	Crois mon cœur, Manlius, si tu ne crois ma bouche, S'il pouvait sans témoins s'exprimer dans ce lieu, Que ne dirait-il point?
aime, & te ſauue.	aime, et te sauve.
Adieu.	Adieu.
S CENE MANLIVS, ſeul.	 SENE MANLIUS, seul.
Ime & te ſauue, helas!	Ime et te sauve, hélas!
dans vn ſort ſi conA traire, Princeſſe que me ſert cét ordre ſalutaire?	dans un sort si conA traire, Princesse que me sert cet ordre salutaire?
Comment puis-ie accorder dans ce funeſte iour, Les deſirs de ma gloire & ceux de mon amour:	Comment puis-je accorder dans ce funeste jour, Les désirs de ma gloire et ceux de mon amour:
Et que rvne uciene yrautre me le commande C’eſt trop long-temps ſouffrir vne peine ſi grande, Il faut y ſuccomber, c’en eſt fait & mon cœur Ne conſultera plus que ſa propre fureur.	Et que rune uciene yrautre me le commande C'est trop longtemps souffrir quelque peine si grande, Il faut y succomber, c'en est fait et mon cœur Ne consultera plus que sa propre ur.
Fin du troiſiéme Acte.	Fin du troisième Acte.
ACTE IV SOEND IREMILNE.	ACTE IV SOND JREMILNE.
7 TORQVATVS, ſeul.	7 TORQUATUS, seul.
