Et s’il veut tout ſoûmettre, il doit nous faire voir Qu’il eſt ſoûmis luy-meſme aux regles du deuoir, Cependant Manlius, le cœur plein d’arrogance, Mépriſe ouuertement noſtre expreſſe deffence.	Et s'il veut tout soumettre, il doit nous faire voir Qu'il est soumis m-même aux règles du devoir, Cependant Manlius, le cœur plein d'arrogance, Méprise ouuertement quelque expresse défense.
Sans reſpecter ny loix, ny Pere, ny Senat, De ſon ſeul mouuement il donne le combat, Vne telle inſolence & ſi démeſurée, Par ſa mort ſeulement peut eſtre reparée:	Sans respecter ainsi lois, ni Père, ni Sénat, De son seul mouvement il donne le combat, telle insolence et si démesurée, Par sa mort seulement peut être reparée:
L’audacieux mourra, c’en eſt fait;	L'audacieux mourra, c'en est fait;
IVNIVS.	IUNIUS.
Ha!	Ha!
Seigneur, Sur ce funeſte Arreſt conſultez voſtre cœur, Permettez qu’il conſerue vne teſte ſi chere, Que le nom de Conſul cede à celuy de pere, Manlius eſt vn fils.	Seigneur, Sur ce funeste Arrêt consultez votre cœur, Permettez qu'il conserve une tête si chère, Que le nom de Consul ède à celui de père, Manlius est un fils.
TORQVATVS.	TORQUATUS.
Ie ſçay bien ce qu’il eſt:	Je sais bien ce qu'il est:
Et i’ay tout conſulté ſur ce mortel Arreſt, Mon cœur m’a dit cent fois que c’eſt vn fils que i’aime, Mais ie dois au Seniat beaucoup plus qu'a moy-méme, Puis que mon fils l’offence il eſt mon ennemy, Et iamais il ne faut ſeruir Rome à demy, Ie luy dois Manlius, ie veux la ſatisfaire.	Et j'ai tout consulté sur ce mortel Arrêt, Mon cœur m'a dit cent fois que c'est un fils que j'aime, Mais sensible dois au Séniat beaucoup plus qu'a moi-même, Puis que mon fils l'offense il est mon ennemi, Et jamais il ne faut servir Rome à demi, Je lui dois Manlius, Madame veux la satisfaire.
IVNIVS.	IUNIUS.
Si ie pouuois, Seigneur, parler ſans vous déplaire, Ie vous prierois de voir ſi certain mouuement, N’eſt point de cette mort la cauſe ou l’inſtrument, Le precieux honneur que i’eus dés voſtre enfance, De prendre touſiours part à voſtre confidence Me fait vous coniurer de voir ſi ſur ce point, Quelque fauſſe clarté ne vous ébloüit point, Peut-eſtre qu’en cecy Rome agit la derniere, Conſultez là deſſus voſtre ame toute entiere:	Si personne pouvais, Seigneur, parler sans vous déplaire, Je vous prierais de voir si certain mouvement, N'est point de cette mort la cause ou l'instrument, Le précieux honneur que j'eus dès votre enfance, De prendre toujours part à votre confidence Me fait vous conjurer de voir si sur ce point, Quelque fausse clarté ne vous ébloüit point, Peut-être qu'en ceci Rome agit la dernière, Consultez là dessus votre âme toute entière:
Que diroiteon de vousTle cner du Senat, Meſloit ſon intereſt à celuy de l’Eſtat?	Que diroiteon de vousTle cner du Sénat, Mêlait son intérêt à celui de l'État?
TORQVATVS.	TORQUATUS.
Et de quel intereſt Rome accuſeroit elle, Celuy qui perd ſon fils, pour luy prouuer ſon zele?	Et de quel intérêt Rome accuserait -elle, Celui qui perd son fils, pour lui prover son zèle?
IVNIVS.	IUNIUS.
Si ie puis m’expliquer ſans ſortir du reſpect, Ie vous diray, Seigneur, que ce zele eſt ſuſpect:	Si personne puis m'expliquer sans sortir du respect, Je vous dirai, Seigneur, que ce zèle est suspect:
Omphale qui paroiſt moins captiue que Reyne, De tous vos ſentimens nous informe ſans peine, Quand on la voit icy, ſans gardes ſur ſa foy, L'on deuine aisement qu’enle donne la loy, On en parle tout haut;	Omphale qui paraît moins captive que Reine, De tous vos sentiments nous informe sans peine, Quand on la voit ici, sans gardes sur sa foi, L'on devine aisément qu'enle donne la loi, On en parle tout haut;
mais on adiouſte encore, Quelle aime Manlius, que voſtre fils l’adore, Iugez donc quel effect produiroit ſon trépas.	mais on ajoute encore, Quelle aime Manlius, que votre fils l'adore, Jugez donc quel effet produirait son trépas.
TORQVATVS.	TORQUATUS.
Vn bruit ſi mal fondé ne m’épouuente pas, Ma vertu, Iunius, eſt trop bien établie, Pour craindre les effets de cette calomnie, Depuis aſſez long-temps on en connoiſt l’éclat, Et i’ay pour mes témoins le Camp & le Senat.	Un bruit si mal fondé ne m'épouvante pas, Ma vertu, Junius, est trop bien établie, Pour craindre les effets de cette calomnie, Depuis assez longtemps on en connaît l'éclat, Et j'ai pour mes témoins le Camp et le Sénat.
Mais quand cette action ſeroit mal expliquée, Ma gloire ſur ce poinct ſeroit-elle attaquée?	Mais quand cette action serait mal expliquée, Ma gloire sur ce point serait-elle attaquée?
Si la beauté d’Omphale a pour moy des appas, Mon fils en a-t-il moins merité le trépas, Parce qu’inſolemment il ſera temeraire, Iuſqu’à porter ſes yeux au meſme lieu qu’vn Pere?	Si la beauté d'Omphale a pour moi des appas, Mon fils en a-t-il moins mérité le trépas, Parce qu'insolemment il sera téméraire, Jusqu'à porter ses yeux au même lieu qu'un Père?
Cét Cét amour qui le rend criminel enuers moy, Pourra-t’il l’exempter des rigueurs de la loy?	Cet Cet amour qui le rend criminel envers moi, Pourra-t-il l'exempter des rigueurs de la loi?
Appienez-moy comment, & par quelle puiſſance Deux crimes confondus font naiſtre l’innocence.	Apienez-moi comment, et par quelle puissance Deux crimes confondus font naître l'innocence.
IVNIVS.	IUNIUS.
Puis que vous permettez que i’oſe librement Vous dire ſur ce point quel eſt mon ſentiment;	Puis que vous permettez que j'ose librement Vous dire sur ce point quel est mon sentiment;
L’amour par vn effet de ſon pouuoir ſupréme, Fait les biens & les maux ſans ſortir de luy-meſme.	L'amour par un effet de son pouvoir suprême, Fait les biens et les maux sans sortir de M-même.
Souuent vn meſme trait par vn charme puiſſant Fait vn amant coupable & rend l’autre innocent.	Souvent un même trait par un charme puissant Fait un amant coupable et rend l'autre innocent.
C’eſt l’ordinaire effet des yeux d’vne maiſtreſſe, Que de remplir deux cœurs.	C'est l'ordinaire effet des yeux d'une maîtresse, Que de remplir deux cœurs.
Mais voicy la Princeſſe.	Mais voici la Princesse.
C’eſt mal prendre mon temps pour vn tel entretien:	C'est mal prendre mon temps pour un tel entretien:
TORQVATVS.	TORQUATUS.
Voyez ſi dans ce camp, il ne ſe paſſe rien:	Voyez si dans ce camp, il ne se passe rien:
Ie vous ſuy?	Je vous suis?
SCENE V.	SCÈNE V.
TORQVATVS, OMPHALE, PHENICE.	TORQUATUS, OMPHALE, PHENICE.
TORQVATVS.	TORQUATUS.
O Vel ſuiet dans ce lieu vous ameine?	Ô Vel sujet dans ce lieu vous âmeine?
Eſt-ce pitié, Madame, eſt-ce amour, eſt-ce haine ?	Est-ce pitié, Madame, est-ce amour, est-ce haine ?
OMPHALE.	OMPHALE.
C’eſt l’eſtime, Seigneur, que conſeruent entre eux Les plus grands ennemis, quand ils ſont genereux.	C'est l'estime, Seigneur, que conservent entre eux Les plus grands ennemis, quand ils sont généreux.
De l’iniuſte deſtin, la fiere Barbarie Me forçeant malgré moy d’eſtre voſtre ennemie, Voſtre vertu m’empeſche au moins de vous haïr Iuſqu’à vouloir vous perdre, ou iuſqu’à vous trahir.	De l'injuste destin, la fière Barbarie Me forçeant malgré moi d'être votre ennemie, Votre vertu m'empêche au moins de vous haïr Jusqu'à vouloir vous perdre, ou jusqu'à vous trahir.
mpprenez dont, Seigneur, que tout le Camp murmure, Et que de voſtre fils la funeſte auanture Iette tant de fureur dans l’ame des ſoldats, Que voſtre gloire & vous, ne s’en ſauueront pas.	mpprenez dont, Seigneur, que tout le Camp murmure, Et que de votre fils la funeste aventure Jette tant de fureur dans l'âme des soldats, Que quelque gloire et vous, ne s'en sauveront pas.
TORQVATVS.	TORQUATUS.
Quoy, la Princeſſe Omphale eſt ſenſible à ma gloire?	Quoi, la Princesse Omphale est sensible à ma gloire?
OMPHALE.	OMPHALE.
Ie l’ay toûjours eſté;	Je l'ai toujours été;
ſi i’en croy ma memoire, Et c’eſt par ce motif, que i’ay tant combatu, Vn amour dont l’effet bleſſoit voſtre vertu.	si j'en crois ma mémoire, Et c'est par ce motif, que j'ai tant combattu, Vn amour dont l'effet blessait votre vertu.
TORQVATVS.	TORQUATUS.
Peut-eſtre cét orgueil a t’il vne autre cauſe, Car de tous vos ſecrets, nous ſçauons quelque choIe3 Mon fils vous fait pitié, vous craignez ſon trépas.	Peut-être cet orgueil a -t-il une autre cause, Car de tous vos secrets, nous savons quelque choIe3 Mon fils vous fait pitié, vous craignez son trépas.
OMPHALE.	OMPHALE.
Il eſt vray, ie le crains;	Il est vrai, Seigneur le crains;
ie ne m’en deffens pas;	Ne ne m'en défends pas;
Si ie plains d’vn heros la triſte deſtinée, Vne pitié ſi noble, eſt d’vne ame bien née;	Si ici plains d'être héros la triste destinée, Une pitié si noble, est d'une âme bien née;
Et quand ce Motii leur me forceroit d'agir, Ce n’eſt pas vn ſecret dont ie deuſſe rougir:	Et quand ce Moti leur me forcerait d'agir, Ce n'est pas un secret dont après dusse rougir:
Vn ſi beau mouuement ne ſeroit pas vn crime.	Un si beau mouvement ne serait pas un crime.
TORQVATVS.	TORQUATUS.
Pourquoy donc le cacher, s’il eſt ſi legitime?	Pourquoi donc le cacher, s'il est si légitime?
Pourquoy l’enueloper d’vne feinte terreur, Et donner des aduis d’vne fauſſe rumeur?	Pourquoi l'envelopper d'une feinte terreur, Et donner des avis d'une fausse rumeur?
Que ne me dites vous, ie crains pour ce que i’ayme ?	Que ne me dites -vous, ie crains pour ce que j'aime ?
Accordez Manlius à mon amour extréme, Faites moy ce preſent.	Accordez Manlius à mon amour extrême, Faites -moi ce présent.
OMPHALE.	OMPHALE.
Pour conſeruer ſes iours Vne telle priere eſt vn foible ſecours:	Pour conserver ses jours Une telle prière est un faible secours:
La inort de ce Helos n’eſt que trop anurée, Mes mal-heurs, voſtre amour, & le ſort l’ont iurée, Ie vois bien que ie fais vn inutile effort.	La inort de ce Hélos n'est que trop anurée, Mes malheurs, votre amour, et le sort l'ont jurée, Je vois bien que je fais un inutile effort.
Helas!	Hélas!
il perira.	il périra.
TORQVATVS.	TORQUATUS.
Moderez ce tranſport.	Modérez ce transport.
Vous pourrez le ſauuer, ſi ſon trépas vous touche, Son arreſt luy ſera donné par voſtre bouche:	Vous pourrez le sauver, si son trépas vous touche, Son arrêt lui sera donné par votre bouche:
Tout mon Riual qu’il eſt, ſa mort dépend de vous Ie vous laiſſe y penſer.	Tout mon Rival qu'il est, sa mort dépend de vous Je vous laisse y penser.
Camille vient à nous, Vn pareil entretien doit finir aupres d’elle.	Camille vient à nous, Un pareil entretien doit finir auprès d'elle.
Il ſort.	Il sort.
SCENE VI.	SCÈNE VI.
CAMILE, OMPHALE, PHENTEE.	CAMILE, OMPHALE, PHENTE.
L OMPHALE.	L OMPHALE.
An, rencontre cruelle O Dieux n’auray-ie pas vn moment pour réuer?	An, rencontre cruelle Ô Dieux n'aurai-je pas un moment pour réuer?
Le moindre ordre, Madame, auroit pû me trouuer;	Le moindre ordre, Madame, aurait pu me trouver;
Mais pour vous obeïr, que faut-il que ie faſſe?	Mais pour vous obéir, que faut-il que mort fasse?
CAMILLE.	CAMILLE.
Il faut vous dérober au ſort qui vous menace;	Il faut vous dérober au sort qui vous menace;
Vous ſuiuez en aueugle vn penchant dangereux, Qui conduit dans le fonds d’vn précipice affreux, Vous me faites pitié, dans ce peril extréme, Vous aimez Manlius, vous ſouffrez qu’il vous aime;	Vous suivez en aveugle un penchant dangereux, Qui conduit dans le fonds d'un précipice affreux, Vous me faites pitié, dans ce péril extrême, Vous aimez Manlius, vous souffrez qu'il vous aime;
Et voſtre cœur ſeduit troublant voſtre raiſon Se remplit à longs traits d’vn funeſte poiſon, Remarquant à quel point vous eſtes ieune & belle, Ie voudrois vous tirer d’vne erreur ſi cruelle, Et par vn pur effet d’vne tendre amitié Pour vous meſme exciter vn peu voſtre pitié.	Et votre cœur séduit troublant votre raison Se remplit à longs traits d'une funeste poison, Remarquant à quel point vous êtes jeune et belle, Je voudrais vous tirer d'une erreur si cruelle, Et par un pur effet d'une tendre amitié Vous -vous rendre exciter un peu votre pitié.
On vous trompe, on vous donne vne eſperance vaine;	On vous trompe, on vous donne une espérance vaine;
Pour auoir Manlius, il faut eſtre Romaine;	Pour avoir Manlius, il faut être Romaine;
Et quoy qu’il vous promette, ou qu’il vous puiſſe offrir, Sans ce tiltre on ne peut iamais y paruenir.	Et quoi qu’il vous promette, ou qu'il vous puisse offrir, Sans ce titre on ne peut jamais y parvenir.
Princeſſe, profitez d’vn auis ſi ſincere, Receuez-le de moy, comme de voſtre mere:	Princesse, profitez d'un avis si sincère, Receuezle de moi, comme de votre mère:
Etouffez les deſirs de voſtre ieune eœur, Et n’expliquez pas mal, mon zele, & ma ferueur.	Étouffez les désirs de votre jeune eœur, Et n'expliquez pas mal, mon zèle, et ma ferveur.
OMPHALE.	OMPHALE.
Pour les mal expliquer, ils ſont trop ſalutaires;	Pour les mal expliquer, ils sont trop salutaires;
Mais pour moy grace au Ciel, ils ſont peu neceſſaires, Ie ne forme des vœux que pour briſer mes fers, Et bien loin d’écouter ceux qui me ſont offers Mon cœur du Conſul, meſme a mépriſé la flâme, Et ſeluic I'nomneur d’eſtle bien-toit la feine.	Mais pour moi grâce au Ciel, ils sont peu nécessaires, Je ne forme des vœux que pour briser mes fers, Et bien loin d'écouter ceux qui me sont offerts Mon cœur du Consul, Seigneur a méprisé la flamme, Et seluic J'nomneur d'estle bien-toit la feine.
CAMILLE.	CAMILLE.
Femme de Torquatus?	Femme de Torquatus?
OMPHALE.	OMPHALE.
Ouy femme aſſeurément, Il eſt en mon pouuoir, n’en doutez nullement, Mais n’apprehendez pas cét iniuſte hymenée:	Oui femme assurément, Il est en mon pouvoir, n'en doutez nullement, Mais n'appréhendez pas cet injuste hyménée:
Ie ſçay qu’à Torquatus vous eſtes deſtinée, Et que ſans ce grand deuil qu’à preſent vous portez Il vous auroit donné ce que vous meritez.	Je sais qu'à Torquatus vous êtes destinée, Et que sans ce grand deuil qu'à présent vous portez Il vous aurait donné ce que vous méritez.
S’il faut pour Torquatus commettre vne iniuſtice Deuenir d’vn forfait la cauſe ou le complice, Monter à ce haut rang par vne lâcheté, Torquatus à ce prix ſeroit trop achepté.	S'il faut pour Torquatus commettre une injustice Deuenir d'un forfait la cause ou le complice, Monter à ce haut rang par une lâcheté, Torquatus à ce prix serait trop acheté.
CAMILLE.	CAMILLE.
Mais auſſi par ce prix vous rachetez l’Epire.	Mais aussi par ce prix vous rachetez l'Epire.
OMPHALE.	OMPHALE.
Linnocence d'vn tœur vaut bien mieux qu’vn Empire.	Linnocence d'Hommes tœur vaut bien mieux qu'Han Empire.
CAMILLE.	CAMILLE.
Pour le bien des Eſtats tout ſemble eſtre permis.	Pour le bien des États tout semble avoir permis.
OMPHALE.	OMPHALE.
ne crams pruo vi remois que tous mnes ennemis.	ne cramps pruo vi rémois que tous mnes ennemis.
CAMILLE.	CAMILLE.
Vos peuples blameront ces ſentimens ſeueres.	Vos peuples blâmeront ces sentiments sûres.
OMPHALE.	OMPHALE.
Les Dieux ſans cét Hymen finiront nos miſeres.	Les Dieux sans cet Hymen finiront nos misères.
CAMILLE.	CAMILLE.
Les Dieux ſont tout-puiſſans, mais leur ſecours eſt lent, Quand fiaut appuyer vn trone chancelant.	Les Dieux sont tout-puissants, mais leur secours est lent, Quand fiaut appuyer un trone chancelant.
OMPHALE.	OMPHALE.
Où leur ſecours eſt vain, que peut celuy d’vn homme?	Où leur secours est vain, que peut celui d'un homme?
CAMILLE.	CAMILLE.
Sans mentir la vertu n’eſt pas toute dans Rome.	Sans mentir la vertu n'est pas toute dans Rome.
Vn ſi ſage diſcours qu’on ne peut trop loüer, A ma confuſion me force à l’aduouer.	Un si sage discours qu'on ne peut trop louer, À ma confusion me force à l'avouer.
Cultiuez auec ſoin cette vertu ſublime Qui m’inſpire pour vous vne ſi haute eſtime:	Cultivez avec soin cette vertu sublime Qui m'inspire pour vous une si haute estime:
Elle plaiſt au Conſul, ſans doute autant qu’à moy, Ie le connois trop bien, pour douter de ſa foy;	Elle plaît au Consul, sans doute autant qu'à moi, Je le connais trop bien, pour douter de sa foi;
S’il feint de vous aimer, ce feu qui vous abuſe, Eſt pour vous éprouuer vne innocente ruſe;	S'il feint de vous aimer, ce feu qui vous abuse, Est pour vous éprouver une innocente ruse;
Empeſchez-en l’effect, & vous verrez vn iour Que l’amour de la gloire eſt ſon vnique amour.	Empêchez-en l'effet, et vous verrez un jour Que l'amour de la gloire est son unique amour.
Mais pourrois-ie, Princeſſe, afin de mieux connoiſtre Cette haute vertu, que vous faites paroiſtre, En apprendre de vous iuſqu’aux moindres effets, Les feintes du Conſul, ſes ruſes, ſes proiets, De quels diſcours trompeurs, il hate voſtre attente.	Mais pourrais-je, Princesse, afin de mieux connaître Cette haute vertu, que vous faites paraître, En apprendre de vous jusqu'aux moindres effets, Les feintes du Consul, ses ruses, ses prois, De quels discours trompeurs, il hâte quelque attente.
OMPHALE.	OMPHALE.
Pour les apprendre mieux entrons dans voſtre tente.	Pour les apprendre mieux entrons dans votre tente.
CAMILLE.	CAMILLE.
I’y conſens auec ioye, allons, cet entretien Me rend voſtre intereſt auſſi cher que le mien.	J'y consens toujours joie, allons, cet entretien Me rend votre intérêt aussi cher que le mien.
Fin du Second Acte.	Fin du Second Acte.
ACTE III.	ACTE III.
SCLNE TREMTERE.	SCLNE TREMTERE.
CAMILLE, ſeule.	CAMILLE, seule.
AVay-ie entendu?	AUai-je entendu?
grands Dieux!	grands Dieux!
& que m’a dit Omphale?	et que m'a dit Omphale?
Croire que Torquatus à ce point ſe rauale?	Croire que Torquatus à ce point se ravale?
Torquatus, vn vainqueur, vn Conſul, vn Romain, De l’vniuers entier l’arbitre Souuerain, Cede aux foibles attraits d’vne ieune Eſtrangere?	Torquatus, un vainqueur, un Consul, un Romain, De l'Univers entier l'arbitre Souverain, Cède aux faibles attraits d'une jeune Étrangère?
Ce qu’on appelle amour, cette vaine chimere, Ce caprice des ſens, ce poiſon des Vertus, A rangé ſous ſes loix le cœur de Torquatus?	Ce qu'on appelle amour, cette vaine chimère, Ce caprice des sens, ce poison des Vertus, A rangé sous ses lois le cœur de Torquattus?
L’amour bleſſe vn Conſul?	L'amour blesse un Consul?
Mais c’eſt peu qu’il le bleſſe, Il le ſoumet encore aux loix d’vne Princeſſe, Dont le Pere a coûté pour le mal-heur de tous Au Senat Decius, à Camille vn Epoux.	Mais c'est peu qu'il le blesse, Il le soumet encore aux lois d'une Princesse, Dont le Père a coûté pour le malheur de tous Au Sénat Décius, à Camille un Époux.
Iniuſte Torquatus, tu ſçais que ce grand-homme A répandu ſon ſang pour le ſalut de Rome, A peine a-t-il receu les honneurs du tombean;	Injuste Torquatus, tu sais que ce grand-homme A répandu son sang pour le salut de Rome, À peine a-t-il reçu les honneurs du tombean;
Et tu veux t’allier au ſang de ſon bourreau?	Et tu veux t'allier au sang de son bourreau?
O vous qui le ſouffrez, Demons de la Patrie, Vous à qui s’immola cette ombre ſi cherie, Vous qui deuez vueiller ſur l’Eſtat des Romains;	Ô vous qui le souffrez, Demons de la Patrie, Vous à qui s'immola cette ombre si chérie, Vous qui devez veiller sur l'État des Romains;
Eſtes vous donc des Dieux ou des fantômes vains?	Êtes -vous donc des Dieux ou des fantômes vains?
Vos Eloges brillans ſont-ils des impoſtures?	Vos Éloges brillants sont-ils des impostures?
Voyez vous ſans horreur les crimes des pariures?	Voyez -vous sans horreur les crimes des parjures?
N’auez vous point de bras, ou ſi vous en auez A quel vſage, helas!	N'avez -vous point de bras, ou si vous en avez À quel usage, hélas!
ſont-ils donc reſeruez?	sont-ils donc réservez?
Quel plus noir attentat, merite le ſupplice?	Quel plus noir attentat, mérite le supplice?
Ah, ne retenez plus grands Dieux voſtre Iuſtice;	Ah, ne retenez plus grands Dieux votre Justice;
Il eſt temps d’éclater, montrez voſtre courroux, Et vangez d’vn ſeul coup, l’eſtat, Camille, & vous:	Il est temps d'éclater, montrez votre courroux, Et vengez d'un seul coup, l'état, Camille, et vous:
Mais, pourquoy battre l’air de ces vaines paroles?	Mais, pourquoi battre l'air de ces vaines paroles?
Que font à ma douleur tant de plaintes friuoles?	Que font à ma douleur tant de plaintes frivoles?
Ne puis-ie ſans les Dieux repouſſer vn affront;	Ne puis-je sans les Dieux repousser un affront;
Et mon bras n’eſt-il pas vn remede plus prompt?	Et mon bras n'est-il pas un remède plus prompt?
Ah, ne balançons point, la plainte eſt inutile, Armons nous d’vn poignard, courons;	Ah, ne balançons point, la plainte est inutile, Armons nous d'un poignard, courons;
Mais où Camille, Te charger de la mort, d’vn Conſul, d’vn Romain, Et dans vn ſi beau ſang oſer tremper ta main.	Mais où Camille, Te charger de la mort, d'un Consul, d'un Romain, Et dans un si beau sang oser tremper ta main.
Que plutoſt le Conſul te dõne au lieu d’Omphale, Vne Eſclaue;	Que plutôt le Consul te donne au lieu d'Omphale, Une Esclave;
vne Infame, vn Monſtre pour riualez Qu’il te rende pluſtoſt le rebut du Senat Que de ſoüiller ton nom d’vn ſi grand attentat.	Un Infâme, un Monstre pour rivalés Qu'il te rende plutôt le rebut du Sénat Que de soüiller ton nom d'un si grand attentat.
Les criminels deſirs, que t’inſpire ta rage, Te feroient meriter ta honte, & cét outrage;	Les criminels désirs, que t'inspire ta rage, Te feraient mériter ta honte, et cet outrage;
Cherche d’autres moyens pour t’on ſoulagement Manlius doit ſe rendre icy dans vn moment, Il eſt ieune & boüillant, il aime la Princeſſe, Et ſon propre ſalut dans mon mal l’intereſſe, Ie ſçay que le Conſul a iuré ſon trépas, Pour vn ieune vainqueur la vie a des appas, Offrons luy du ſecours embraſſons ſa deffence Tâchons de l’irriter:	Cherche d'autres moyens pour t'on soulagement Manlius doit se rendre ici dans un moment, Il est jeune et boüillant, il aime la Princesse, Et son propre salut dans mon mal l'intéresse, Je sais que le Consul a juré son trépas, Pour un jeune vainqueur la vie a des appas, Offrons contents du secours embrassons sa défense Tâchons de l'irriter:
Le voicy qui s’auance.	Le voici qui s'avance.
SCENE II.	SCÈNE II.
CAMILLE, MANLIVS,	CAMILLE, MANLIUS,
CAMILLE.	CAMILLE.
’Ay ſçeu ieune Heros qu’vn outrageant méT pris, D’vne grande victoire auoit eſté le prix;	Çà Peine su jeune Héros qu'un outrageant méT pris, D'une grande victoire avait été le prix;
Et que le noir venin du demon de l’enuie D’vn peril éuident menaſſoit voſtre vie:	Et que le noir venin du démon de l'envie D'un péril évident menaçait votre vie:
Ie vous ay donc mandé pour garantir vos iours Et dans ce mal preſſant vous offrir du ſecours;	Je vous ai donc mandé pour garantir vos jours Et dans ce mal pressant vous offrir du secours;
De mon illuſtre eſpoux la mort encore recente, Parmy tous les Romains rend ſa veuve puiſſane :	De mon illustre époux la mort encore récente, Parmi tous les Romains rend sa veuve puissane :
Tant de viuans portraits par la gloire tracez, Du cœur de nos ſoldats ne ſont pas effacez.	Tant de vivants portraits par la gloire tracés, Du cœur de nos soldats ne sont pas effacés.
Il leur ſouuient touſiours d’auoir veu ce grand homme, Chez les peuples voiſins planter l’aigle de Rome, Et par le noble effect de cent explois diuers, Rendre noſtre cité Reyne de l’vniuers Son ombre peut encore diſſiper la tempeſte, Dont la noire vapeur gronde ſur voſtre teſte.	Il leur souvient toujours d'avoir vu ce grand homme, Chez les peuples voisins planter l'aigle de Rome, Et par le noble effet de cent exploits divers, Rendre notre cité Reine de l'univers Son ombre peut encore dissiper la tempête, Dont la noire vapeur gronde sur votre tête.
D’entre les immortels il peut voir auiourd’huy, Que ſon nom glorieux n’eſt pas mort auec luy:	D'entre les immortels il peut voir aujourd'hui, Que son nom glorieux n'est pas mort avec quelque:
Pour éuiter les coups d’vne iniuſte furie, Faites-vous vn rempart de cette ombre cherie:	Pour éviter les coups d'une injuste furie, Faites-vous un rempart de cette ombre chérie:
A qui dans ce peril pourroit auoir recours Vn vainqueurinnocent?	À qui dans ce péril pourrait avoir recours Un vainqueurinnocent?
MANLIVS.	MANLIVS.
Ha, ceſſez ce diſcours, Ma vertu qui ue peut en permettre la ſuitte En conçoit trop d’horreur pour en eſtre ſeduite.	Ha, cessez ce discours, Ma vertu qui ue peut en permettre la suitte En conçoit trop d'horreur pour en être séduite.
Si mon pere & l’eſtat ont reſolu ma mort, I’en ſubiray l’arreſt ſans me plaindre du ſort.	Si mon père et l'état ont résolu ma mort, J'en subirai l'arrêt sans me plaindre du sort.
Des plus cruels deſtins ie puis ſentir la rage, Mais iamais ie ne puis en meriter l’outrage:	Des plus cruels destins ie puis sentir la rage, Mais jamais tu ne puis en mériter l'outrage:
Et de quelque mal-heur dont ie ſois combatu, L’on peut m’oſter le iour mais non pas la vertu.	Et de quelque malheur dont ici sois combattu, L'on peut m'ôter le jour mais non pas la vertu.
CAMILLE.	CAMILLE.
