AVA DAMES.	AVA DAMES.
Mourir dans les ardeurs d’vn braſier deuorant, Et donner à chacun de l’horreur en mourant.	Mourir dans les ardeurs d'un brasier dévorant, Et donner à chacun de l'horreur en mourant.
Tragique ſouuenir, effroyable penſée!	Tragique souvenir, effroyable pensée!
Qui deſchire mon ame, & la rend’inſenſée!	Qui déchire mon âme, et la rend'insensée!
Qui trouble mon eſprit, confond mon jugement, Et qui me fait ſentir le meſme embraſement.	Qui trouble mon esprit, confond mon jugement, Et qui me fait sentir le même embrasement.
Eudoxe bruſler viue ô deſtin quellę atteinte, Eudoxe n’eſtre plus que de la cendre eſteinte, Eudoxe dans le feu, pour fignaler ſa foy!	Eudoxe brûler vive ô destin quelle atteinte, Eudoxe n'être plus que de la cendre éteinte, Éudoxe dans le feu, pour signer sa foi!
Ton Eudoxe bruſlee, & pour l’amour de toy!	Ton Eudoxe brûlée, et pour l'amour de toi!
Vrſace peux-tu bien ſouffrir cette diſgrace?	Vrsace peux-tu bien souffrir cette disgrâce?
Vrſace, peux-tu viure, eſtant encor Vrſace?	Vrsace, peux-tu vivre, étant encor Vrsace?
71 Peux-tu viure & l’atmer, & l’aimer ſans mourir, L’ayant fait ſans te perdre, & ſans la ſecourir?	71 Peux-tu vivre et l'atmer, et l'aimer sans mourir, L'ayant fait sans te perdre, et sans la secourir?
Ha laſche, meurs cent fois, meurs cent fois infidelle;	Ha lâche, meurs cent fois, meurs cent fois infidèle;
Comme indigne du iour, & plus indigne d’elle.	Comme indigne du jour, et plus indigne d'elle.
Tu ne meritois pas de poſſeder ſon cœur;	Tu ne méritais pas de posséder son cœur;
Tu ne meritois pas d’en eſtre le wainqueur;	Tu ne méritais pas d'en être le wainqueur;
Ta naiſſance eſtoit baſſe, & bas eſt ton courage;	Ta naissance était basse, et bas est ton courage;
Tu la vois en danger, tu la vois dans l’orage, Tu preuois le mal-heur, qui luy peut arriuer, Et tu la vois perir, quand tu la peux ſauuer!	Tu la vois en danger, tu la vois dans l'orage, Tu vais le malheur, qui lui peut arriver, Et tu la vois périr, quand tu la peux auver!
Ha perfide, eſt-ce aſſez, en veux-tu d’auantage?	Ha perfide, est-ce assez, en veux-tu davantage?
Il falloit, ou te perdre, ou renuerſer Carthage;	Il fallait, ou te perdre, ou renverser Carthage;
Il falloit allumer le feu qu’elle alluma;	Il fallait allumer le feu qu'elle alluma;
Bref il falloit l’aymer, ainſi qu’elle t’ayma.	Bref il fallait l'aimer, ainsi qu'elle t'aima.
Il falloit que ta main plus forte & plus hardie, Donnaſt vne autre fin, à cette Tragedie;	Il fallait que ta main plus forte et plus hardie, Donnât une autre fin, à cette Tragédie;
Il falloit teſmoigner, qu’vn cœur qui ſe reſout, Quand il eſt genereux eſt capable de tout.	Il fallait témoigner, qu'un cœur qui se résout, Quand il est généreux est capable de tout.
Il falloit qu’vn Tyran, ſi digne du ſupplice, Eſprouuaſt ta valeur, qu’animoit la juſtice;	Il fallait qu'un Tyran, si digne du supplice, Éprouvât a valeur, qu'animait la justice;
Et par ſon chaſtiment, apprendre à tous les Roys, A ſe faire la loy, quand ils feront des loix:	Et par son châtiment, apprendre à tous les Rois, À se faire la loi, quand ils feront des lois:
Mais tu ne l’as pas fait, traiſtre, perfide, infame;	Mais tu ne l'as pas fait, traître, perfide, infâme;
Pardon, helas pardon, chere ombre de mon ame, Ie perdis la raiſen, te voyant en danger, Mais qui te ſeruit mal, te ſçaura mieux vanger:	Pardon, hélas pardon, chère ombre de mon âme, Je perdis la raisen, te voyant en danger, Mais qui te servit mal, te saura mieux venger:
Et ie ſçauray trouuer la prochaine iournée, V ne victime illuſtre, & toute couronnée.	Et ici sçauray trouver la prochaine journée, V ne victime illustre, et toute couronnée.
Ta cendre dans le ſang de ton perſecuteur, Verra tomber victime, & ſacrificateur;	Ta cendre dans le sang de ton persécuteur, Verra tomber victime, et sacrificateur;
Et ja mori, & ta titnne cu vorienaront ma grace, Si la bonté d’Eudoxe, a pû hair Vrſace.	Et ja mory, et ta titnne cv vorienaront ma grâce, Si la bonté d'Eudoxe, a pu haïr Orsace.
SCEED IE.	SCED IE.
VRSACE, OLIMBRE.	VRSACE, OLIMBRE.
VRSACE.	VRSACE.
T bien cruel amy, ſet as-tu ſatisfait?	T bien cruel ami, set as-tu satisfait?
&& l’ay ſuiuy ton conſeil, regardes-en l’effect:	et l'ai suivi ton conseil, regardes-en l'effet:
Vois ces triſtes monceaux, & de cẽdre, & de poudre;	Vois ces tristes monceaux, et de cendre, et de poudre;
Vois ce Palais, qui ſemble abbatu par la foudre;	Vois ce Palais, qui semble abattu par la foudre;
Vois ces murs entr’ouuerts, & ces grands baſtimens, Esbranlez par le feu iuſques aux fondemens.	Vois ces murs entr'ouverts, et ces grands bâtiments, Esbranlez par le feu jusqu' aux fondements.
C’eſt là cruel, c’eſt là, (faut-il que ie le die) Que l’vne & l’autre Eudoxe, auec ta Placidie, Dans l’effroyable flame, ont trouué leur tombeau:	C'est là cruel, c'est là, (faut-il queris le die) Que l'une et l'autre Eudoxe, avec ta Placidie, Dans l'effroyable flamme, ont trouvé leur tombeau:
Mais ton conſeil timide, en fournit le flambeau.	Mais ton conseil timide, en fournit le flambeau.
Ta voix retint monurus, furtes amon faunées;	Ta voix retint monurus, furtes amon saunées;
Noſtre Noſtre perte & leur mort, par toy ſont arriuées;	Notre Notre perte et leur mort, par toi sont arrivées;
Gouſte, gouſte le fruict de tes ſages aduis, Et vois ſi i’ay bien fait, de les auoir ſuiuis.	Goûte, goûte le fruit de tes sages avis, Et vois si j'ai bien fait, de les avoir suivis.
Icy tout mon bon-heur, icy tes allegreſſes;	Ici tout mon bonheur, ici tes allégresses;
Icy l’Imperatrice, icy les deux Princeſſes;	Ici l'Impératrice, ici les deux Princesses;
Icy toute ta ioye, icy tous mes plaiſirs;	Ici toute ta joie, ici tous mes plaisirs;
Icy tout noſtre eſpoir, icy tous nos deſirs;	Ici tout notre espoir, ici tous nos désirs;
Icy par tes conſeils, nos mal-heurs ſont extrémes, Icy nous perdons tout, & nous perdons nous meſmes.	Ici par tes conseils, nos malheurs sont extrêmes, Ici nous perdons tout, et nous perdons nous mêmes.
OLIMBRE.	OLIMBRE.
Helas n’augmente point de ſi cuiſants remords, Par l’objet d’vne mort, qui donne mille morts:	Hélas n'augmente point de si cuisants remords, Par l'objet d'une mort, qui donne mille morts:
Ie ne connois que trop, que moy ſeul l’ay cauſée;	Je ne connais que trop, que moi seul l'ai causée;
Ie n’apperçoy que trop, ta raiſon meſpriſée, Ie ne ſents que trop bien qu'elle fut mon erreur;	Je n'aperçois que trop, ta raison méprisée, Je ne sents que trop bien qu'elle fut mon erreur;
Et mon crime apperçeu, me donne aſſez d’horreur.	Et mon crime aperçu, me donne assez d'horreur.
Vrſace, ie voy trop, que ie ſuis trop coupable:	Vrsace, ie vois trop, que tu suis trop coupable:
Außi mon triſte cœur, de plaiſir incapable:	Aussi mon triste cœur, de plaisir incapable:
Ne murmurer a point, quand tu viendras touſiours Irriter ſa douleur, par le meſme diſcours.	Ne murmurer a point, quand tu viendras toujours Irriter sa douleur, par le même discours.
Continue en tout temps, a'offin a ma penſée;	Continue en tout temps, a'offin a ma pensée;
Et mon mal-heur preſent, & ma faute paſſée, Et bien que ce diſcours ſoit vn enfer pour moy, Ne crainds pas que mon cœur s’oſe plaindre de toy.	Et mon malheur présent, et ma faute passée, Et bien que ce discours soit un enfer pour moi, Ne crainds pas que mon cœur s'ose plaindre de toi.
VRSACE.	VRSACE.
Pardonne cher amy, pardonne à ma cholere;	Pardonne cher ami, pardonne à ma cholère;
Ie ſçay ton innocence, ainſi que mon mal-heur, mauis tey ma raiſon, te cede a ma doulenr.	Je sais ton innocence, ainsi que mon malheur, mavis tei ma raison, te cède à ma doulenr.
OLIMBRE.	OLIMBRE.
Mais icy ta douleur eſt iointe à la iuſtice;	Mais ici ta douleur est jointe à la justice;
Il n’eſt point de tourment, il n’eſt point de ſupplice;	Il n'est point de tourment, il n'est point de supplice;
Sous quelque affreux aſpect, qu’on vienne me l'offtir, Que ce cœur ne merite, & ne vueille ſouffrir,	Sous quelque affreux aspect, qu'on vienne me l'offtir, Que ce cœur ne mérite, et ne veuille souffrir,
VRONCE.	VRONCE.
Non, non, le ſeul deſtin, cauſe noſtre diſgrace.	Non, non, le seul destin, cause notre disgrâce.
OLIMBRE.	OLIMBRE.
1401 Non, non, Olimbre ſeul, a perdu ſon Vrſace.	1401 Non, non, Olimbre seul, a perdu son Vrsace.
VRSACE.	VRSACE.
Le crime n’eſt cauſé que par l’imtmien.	Le crime n'est causé que par l'imtmien.
OLIMBRE.	OLIMBRE.
Domoy fuoy qu'it en foit vient ton affliction.	Domoi fuoi qu'it en soit vient ton affliction.
VRSACE.	VRSACE.
On ne peut eſuiter, ce que le Ciel ordonne.	On ne peut éviter, ce que le Ciel ordonne.
OLIMBRE.	OLIMBRE.
Mais on peut eſuiter, vn conſeil que ie donne.	Mais on peut éviter, un conseil que Seigneur donne.
VRSACE.	VRSACE.
L’amitié le donnoit, l’amitié le receut,	L'amitié le donnait, l'amitié le reçut,
OLIMDRE.	OLIMDRE.
L’amitié me trompa, l’amitié te deceut.	L'amitié me trompa, l'amitié te déçut.
VRSACE.	VRSACE.
L’amitié parle en toy, l’amitié te replique.	L'amitié parle en toi, l'amitié te replique.
OLIMBRE.	OLIMBRE.
Et par cette amitié, tu pers tout en Affrique.	Et par cette amitié, tu perds tout en Afrique.
VRSACE.	VRSACE.
Helas que ferons-nous?	Hélas que ferons-nous?
OLIMBRE.	OLIMBRE.
Helas qu’auons nous fait:	Hélas qu'avons nous fait:
VRSACE.	VRSACE.
Tu commis vne erreur.	Tu commis Dieux erreur.
& Erasleo Tu flates vn forfait.	et Erasleo Tu flatte un forfait.
VROACE.	VROACE.
Tous deux eſgalement, le deſtin nous accable;	Tous deux également, le destin nous accable;
OLIMBRE.	OLIMBRE.
Tu n’es que mal-heureux, & moy ie ſuis coupable.	Tu n'es que malheureux, et moi je suis coupable.
1914me Cher amy, VRSACE.	1914me Cher ami, VRSACE.
ra aMr,	ra aMr,
OLIMBRE.	OLIMBRE.
Cher Prface,	Cher Prface,
VRSACE.	VRSACE.
O mes pleurs!	Ô mes pleurs!
OLIMBRE.	OLIMBRE.
Soupirons;	Soupirons;
TRORICE	TRORICE
Eudoxe,	Eudoxe,
OLIMBRE.	OLIMBRE.
Ne vit plus;	Ne vit plus;
VRSACE.	VRSACE.
Elle eſt morte;	Elle est morte;
OLIMBRE.	OLIMBRE.
Ha mourons!	Ha mourons!
VRSACE.	VRSACE.
Olimbre, ton conſeil ne ſe doit iamais ſuiure:	Olimbre, ton conseil ne se doit jamais suivre:
K Quand il faloit mourir, il me ferça de viure;	 Quand il fallait mourir, il me ferça de vivre;
Maintenant qu’il faut viure, il me porte à mourir Au lieu de m'aßiſter, & de me ſecourir.	Maintenant qu'il faut vivre, il me porte à mourir Au lieu de m'assister, et de me secourir.
OLIMBRE.	OLIMBRE.
Il faut viure (dis-tu) parmy tant de triſteſſes!	Il faut vivre (dis-tu) parmi tant de tristesses!
a leoncue Il faut viure vn ſeul iour, pour vãger les Princeſſes.	à leoncue Il faut vivre un seul jour, pour vãger les Princesses.
OLIMBRE I’appreuue ce deſſain, ie ſuy ton ſentiment.	ÔLIMBRE J'approuve ce dessain, ie tu ton sentiment.
VRSACE, Viuons, vãgeons nous viſte, & mourons promptemẽt.	VRSACE, Vivons, vengeons nous vite, et mourons promptemẽt.
2 Jaaer.	2 Jaer.
, OLIMBRE.	, OLIMBRE.
G	G
VRSACE.	VRSACE.
Cachons-nous dans quelque lieu plus ſombre;	Cachons-nous dans quelque lieu plus sombre;
OLIMBRE.	OLIMBRE.
Stie ne juts deceu par la lune ou par l’ombre, C’eſt Thraſimond;	Stie ne juts déçu par la lune ou par l'ombre, C'est Thrasimond;
DENEIII.	DENEIII.
THRASIMOND, VRSACE, OLIMBRE.	THRASIMOND, VRSACE, OLIMBRE.
THRASIMOND.	THRASIMOND.
Mis, eſtes -vous donc ioy?	Mis, êtes -vous donc joi?
VRSACE.	VRSACE.
Seigneur, pouuez-vous mit & nous parterumſis Quoy dans ce lieu funeſte & dans vne aduanture, Qui demande des pleurs à toute la nature, Où vous perdez autant, que nous auons perdi;	Seigneur, pouvez-vous mit et nous parterums Quoi dans ce lieu funeste et dans une aventure, Qui demande des pleurs à toute la nature, Où vous perdez autant, que nous avons perdi;
Où vous auez cauſé, ce mal non attendu;	Où vous avez causé, ce mal non attendu;
4 ous prominint.	4 ous prominint.
Belas dans ce mal-heur extréme.	Bélas dans ce malheur extrême.
Que fait voſtre vertu, voſtre amour, & vous-meſme?	Que fait votre vertu, votre amour, et vous-même?
TIMSIMOND.	TIMSIMOND.
Elles viuent encor,	Elles vivent encor,
VRSACE.	VRSACE.
O Dien que dites-vous!	Ô Dien que dites-vous!
Elles viuent!	Elles vivent!
OLIMBRE.	OLIMBRE.
TTIRAOIMIORD.	TTIRAOIMIORD.
Gardons ce ſecret entre nous, Elles viuent amis:	Gardons ce secret entre nous, Elles vivent amis:
VRSACE.	VRSACE.
O Ciel ie te rends grace;	Ô Ciel ie te rends grâce;
THRASIMOND.	THRASIMOND.
Vous demandez comment, que ie vous ſatisface.	Vous demandez comment, que ici vous satisface.
Lors que l’Imperatrice auecques ſon flambeau.	Lors que l'Impératrice apprendre son flambeau.
Eut embraſé ce lieu que l’on croit ſon tombeau, Elle ſe retira dans vne gallerie, Pendant que Genſeric exerçoit ſa furie, Que l’on rompoit la porte, & que d’autre coſté, Le feu iuſques au Dome, eſtoit deſia monté.	Eût embrasé ce lieu que l'on croit son tombeau, Elle se retira dans une gallérie, Pendant que Genseric exerçait sa furie, Que l'on rompait la porte, et que d'autre côté, Le feu jusques au Dome, était déjà monté.
Là, ſi prés de ſa fin, cette genereuſe ame, Regardoit approcher, & ſa mort, & la flame, Et ſans eſtonnement attendoit le treſpas.	Là, si près de sa fin, cette généreuse âme, Regardait approcher, et sa mort, et la flamme, Et sans étonnement attendait le trépas.
Que tout le monde craind, & qu'elle ne craind pas Lors que conſiderant, l’vne & l’autre Princeſſe Elle vit dans leurs yeux vne telle triſteſſe, Vne telle douleur d’aller ſi toſt mourir, Que ſon affection voulut les ſeceurir.	Que tout le monde craind, et qu'elle ne craind pas Lors que considérant, l'une et l'autre Princesse Elle vit dans leurs yeux une telle tristesse, Une telle douleur d'aller si tôt mourir, Que son affection voulut les seceurir.
La pitié la ſurmonte, & dans cette aduanture.	La pitié la surmonte, et dans cette aventure.
Sa generoſité, le cede à la nature:	Sa générosité, le cède à la nature:
Et ſentunt que ſon cœur ne pourroit acheuer, Ouy (dit-elle) il faut viure, afin de vous ſauuer.	Et sentunt que son cœur ne pourrait achever, Oui (dit-elle) il faut vivre, afin de vous sauver.
Ainſi dans ce peril, & dans cette rencontre, Elle prend vn tapis que le bon-heur luy monſtre, L’attache à la feneſtre, en ces extremitez;	Ainsi dans ce péril, et dans cette rencontre, Elle prend un tapis que le bonheur avait montre, L'attache à la fenêtre, en ces extrémités;
Fait deſcendre au iardin ces deux ieunes beautez, Les anime à cela, les ſoutient par derriere, Enfin les met à terre, & deſcend la derniere.	Fait descendre au jardin ces deux jeunes beautés, Les anime à cela, les soutient par derrière, Enfin les met à terre, et descend la dernière.
Là, les arbres touffus, & l’ombre de la nuit, En la fauoriſant font qu’elle les conduit, Iuſques au pauillon où Talerbal ſommeille, (C’eſt vn vieux iardinier ) elle appelle, il s’eſueille;	Là, les arbres touffus, et l'ombre de la nuit, En la favorisant font qu'elle les conduit, Jusques au pavillon où Talerbal sommeille, (C'est un vieux jardinier ) elle appelle, il s'éveille;
Il ouure, elle entre, il demeure eſtonné de la voir;	Il ouvre, elle entre, il demeure étonné de la voir;
Il luy promet pourtant, vn fidelle deuoir;	Il était promet pourtant, un fidèle devoir;
Elle luy iure außi, pourueu qu’elle me voye, De le recompenſer;	Elle avait jure aussi, pourvu qu'elle me voie, De le récompenser;
bref elle me l’enuoye:	bref elle me l'envoie:
Il me trouue, i’y vay, ie luy parle vn moment;	Il me trouve, j'y vay, ie luy parle un moment;
Ie retourne außi-toſt à mon appartement;	Je retourne aussitôt à mon appartement;
Afin de donner ordre aux choſes neceſſaires:	Afin de donner ordre aux choses nécessaires:
Ainſi voila l’eſtat où i’ay mis nos affaires;	Ainsi voilà l'état où j'ai mis nos affaires;
Iugez apres cela, ſi vous auez raiſon, D'accuſer vos amis, d'aucune trabiſon.	Jugez après cela, si vous avez raison, D'accuser vos amis, d'aucune trabison.
VRSACE.	VRSACE.
Pardonnez s’il vous plaiſt, à ma douleur trop forte.	Pardonnez s'il vous plaît, à ma douleur trop forte.
Vous ſçauez qu’vn torrẽt quelquesfois nous emporte, Et que ſa violence, en ſon commencement, Deſtruit, rauage, entraiſne, & perd tout ayſement.	Vous savez qu'un torrent quelquefois nous emporte, Et que sa violence, en son commencement, Détruit, ravage, entraîne, et perd tout aisément.
Enfin, ſi i'ay fanty, qu'un m'ordonne vn ſupplice;	Enfin, si j'ai fanti, qu'un m'ordonne un supplice;
Mais Seigneur, en quel lieu reſte l’Imperatrice?	Mais Seigneur, en quel lieu reste l'Impératrice?
THRASIMOND.	THRASIMOND.
Elle eſt ſous vne voûte aſſez proche d’icy:	Elle est sous une voûte assez proche d'ici:
A moy, Madame, à moy;	À moi, Madame, à moi;
VRSACE.	VRSACE.
Blaus.	Blaus.
SOEETDVT.	SOETDUT.
L'IMTERAIRICE, FLACIDIE, EVDO.	L'IMTERAIRICE, FLACIDE, EVDO.
OLIMBRE, THRASIMOND, VRSACE.	ÔLIMBRE, THRASIMOND, VRSACE.
QEigneur, nous voicy:	QEigneur, nous voici:
Mais auec tant de crainte, & tant d’inquietude, Que ie croy que la mort n’a rien qui ſoit plus rude.	Mais avec tant de crainte, et tant d'inquiétude, Que ie crois que la mort n'a rien qui soit plus rude.
THRASIMOND.	THRASIMOND.
A quelque extremité que ce mal puiſſe aller, Olimbre que voicy, vous pourra conſoler.	À quelque extrémité que ce mal puisse aller, Olimbre que voici, vous pourra consoler.
L’IMPERATRICE.	L'IMPÉRATRICE.
Olimbre dites-vous!	Olimbre dites-vous!
PLACIDIE.	PLACIDIE.
Ha ma ſœur, c’eſt luy-meſme;	Ha ma sœur, c'est lui-même;
Madame.	Madame.
OLmmibun.	ÔLmibun.
L’IMPERATRICE.	L'IMPÉRATRICE.
Vnique amy du ſeul homme que i’ayme, Ou pour mieux dire encor, de celuy que i’aymois, Puis qu’il n’eſt plus viuant;	Unique ami du seul homme que j'aime, Ou pour mieux dire encor, de celui que j'aimais, Puis qu'il n'est plus vivant;
helas, ie pers la voix.	hélas, Seigneur perd la voix.
Vrſace ne vit plus, & par toute l'orfrrque, Cette triſte nouuelle, eſt deſormais publique;	Vrsace ne vit plus, et par toute l'orfrèque, Cette triste nouvelle, est désormais publique;
Vrſace enfin eſt mori:	Vrsace enfin est mory:
OLIMBRE.	OLIMBRE.
Ouy Madame, & mourant, Ce pauure Cheualier me dit en ſoüpirant.	Oui Madame, et mourant, Ce pauvre Chevalier me dit en souirant.
D’vne voix languiſſante, & d’vn viſage haue, Que ie vinſſe en ſon nom vous offrir cét eſclaue.	D'une voix languissante, et d'un visage have, Que était vinsse en son nom vous offrir cet esclave.
L’IMPERATRICE.	L'IMPÉRATRICE.
Il le faut affranchir Olimbre.	Il le faut affranchir Olimbre.
OLIMBRE.	OLIMBRE.
Ha pour ce point, Madame, aſſeurez-vous, qu’il ne le voudra point.	Ha pour ce point, Madame, assurez-vous, qu'il ne le voudra point.
L’IMPERATRICE.	L'IMPÉRATRICE.
Sois libre mon amy,	Sois libre mon ami,
VRSACE.	VRSACE.
Ie vous feray connaiſtre Que ie voꝰ garde vn cœnt, qui ne veut tamats t'eſtre.	Je vous ferai connaître Que ainsi vœux garde un cœnt, qui ne veut tamats t'être.
OLIMBRE.	OLIMBRE.
OLIMBRE, Ie vous auois bien dit qu’il ne le voudroit pas,	ÔLIMBRE, Je vous avais bien dit qu'il ne le voudrait pas,
L’IMPERATRICE.	L'IMPÉRATRICE.
Que cette voix charmante, a de charmans apas!	Que cette voix charmante, a de charmants appas!
Qu'elle eſt puiſſante au cœur, qu'elle eſt douce à l'oreille.	Qu'elle est puissante au cœur, qu'elle est douce à l'oreille.
Conſirmez-moy mes yenx vne leuememeie.	Consirmez-moi mes yenx vne levie.
Eſt-ce vous cher Vrſace?	Est-ce vous cher Vrsace?
VRSACE.	VRSACE.
Ouy Madame, c’eſt moy, Trop content, trop heureux, puiſque ie vous reuoy.	Oui Madame, c'est moi, Trop content, trop heureux, puisque je vous revois.
L’IMPERATRICE.	L'IMPÉRATRICE.
metus que de matentuts, trauer ſent noſtre ioye!	mets que de matentuts, traver sent notre joie!
VRSACE.	VRSACE.
Ie les meſpriſe tous, pourueu que te vous voye.	Je les méprise tous, pourvu que te vous voit.
L’IMPERATRICE.	L'IMPÉRATRICE.
Nous ſommes en danger,	Nous sommes en danger,
VRSACE.	VRSACE.
Mais nous en ſortirons.	Mais nous en sortirons.
L’IMPERATRICE.	L'IMPÉRATRICE.
Ie crains pourtant beaucaup,	Je crains pourtant beaucaup,
VRSACE.	VRSACE.
Ha Madame eſperens, Au pis aller, ma mort vous tirera de peine:	Ha Madame espérents, Au pis aller, ma mort vous tirera de peine:
L’IMPERATRICE.	L'IMPÉRATRICE.
O que cette parolle, eſt encor inhumaine!	Ô que cette parole, est encor inhumaine!
VRSACE.	VRSACE.
Elle part de mon cœur, i'en atteſte les Cieux:	Elle part de mon cœur, j'en atteste les Cieux:
L	L
PLACIDIE.	PLACIDIE.
Madame il faut ſonger a ſortir de ces lieux:	Madame il faut songer a sortir de ces lieux:
VRSACE.	VRSACE.
En effect, en ces lieux le danger eſt extreſme:	En effet, en ces lieux le danger est extrême:
Et bien que dãs mon cœur l’amour le ſoit de meſme, Si ie vous en parlois en ce facheux moment, I’aurois beaucoup d’amour, & peu de iugement.	Et bien que dans mon cœur l'amour le soit de même, Si ie Vous en parlais en ce fâcheux moment, J'aurais beaucoup d'amour, et peu de jugement.
Ne nous engageons point dãs quelqu’autre diſgrace:	Ne nous engageons point dans quelqu'autre disgrâce:
Et puis, trop de teſmoins eſcouteroient Vrſace;	Et puis, trop de témoins écouteraient Vrsace;
La crainte & le reſpect, le feront taire icy;	La crainte et le respect, le feront taire ici;
Mais ſortons de ces lieux, & de Carthage außi.	Mais sortons de ces lieux, et de Carthage aussi.
EVDOXE.	EUDOXE.
dauu desvijnenbtea men femotent uffez fortes;	dauve desvijnenbtea men femotent uffez fortes;
Car le Roy fait garder, & le haure, & les portes;	Car le Roi fait garder, et le haure, et les portes;
Et dijpcilement pourra-t'on nous ſauuer.	Et dijpilement pourra-t'-on nous sauver.
L’IMPERATRICE.	L'IMPÉRATRICE.
Quel remede Seigneur, eſperez-vous trouuer?	Quel remède Seigneur, espérez-vous trouver?
THRASIMOND.	THRASIMOND.
Deſia le Roy touché d’vn repentir extréme, Deteſte ſon amour, ſa fureur, & ſoy-meſme.	Déjà le Roi touché d'autre repentir extrême, Deteste son amour, sa fureur, et soi-même.
Il a fait prendre Aſpar, il l’a fait enchaiſner, Il medite la mort, qu’il luy fera donner;	Il a fait prendre Aspar, il l'a fait enchaîner, Il médite la mort, qu'il lui fera donner;
Il le nomme la cauſe, & l’autheur de ſon crime;	Il le nomme la cause, et l'auteur de son crime;
Il dit que ſa douleur eſt forte, & legitime;	Il dit que sa douleur est forte, et légitime;
Que iamais ſes eſprits, ne ſeront conſolez:	Que jamais ses esprits, ne seront consolez:
L’on a trouué les os de ſes gardes bruſlez;	L'on a trouvé les os de ses gardes brûlés;
Et ne diſcernant pas les vns d’auec les autres, Il les garde, il les baiſe, il les prend pour les voſtre;	Et ne discernant pas les uns d'avec les autres, Il les garde, il les baise, il les prend pour les vôtre;
Et pour les conſeruer comme vn riche threſor, Il les met ſous vn Dais, & dans vne vrne d’or Car à peine (preſſé d vne mortelle atteinte) Par le coſté du parc la flame fut eſteinte, A peiné auec de l’eau ceffa l’embraſement, Qu’il fut chercher luy-mefme à voſtre apartement.	Et pour les conserver comme un riche thresor, Il les met sous un Dais, et dans une vraine d'or Car à peine (pressé d' une mortelle atteinte) Par le côté du parc la flamme fut éteinte, A peiné avec de l'eau cessa l'embrasement, Qu'il fut chercher h-même à votre appartement.
Enfin, plain de douleur, il ſoûpire & proteſte, Que d’vn iniuſte amour, aucun feune luy reſte;	Enfin, plain de douleur, il soupire et proteste, Que d'un injuste amour, aucun feune lui femme;
Et bref qu’il ne ſent plus que ce qu’il doit ſentir;	Et bref qu'il ne sent plus que ce qu'il doit sentir;
C’eſt à dire le trait, d'vn cuiſant repentir, Ainſi voſtre ſalut, n’eſt pas ſans apparence.	C'est -à -dire le trait, d'un cuisant repentir, Ainsi votre salut, n'est pas sans apparence.
OLIMBRE.	OLIMBRE.
Non Madame, & mon cœur en conçoit l’eſperance.	Non Madame, et mon cœur en conçoit l'espérance.
I’imagine vn deſſein, & ſeur, & bien conduit;	J'imagine un dessein, et sûr, et bien conduit;
Mais dans ce pauillon, allons paſſer la nuit, Et qu’on me laiſſe apres le ſoin de cette affaire;	Mais dans ce pavillon, allons passer la nuit, Et qu'on me laisse après le soin de cette affaire;
Le Ciel m’inſpirera, ce que ie deuray faire.	Le Ciel m'inspirera, ce que je devrai faire.
Vous verrez que le Roy me cherit uurefois, Et qu'en la main de Dieu, ſe voit le cœur des Roys.	Vous verrez que le Roi me chérit ouvrefois, Et qu'en la main de Dieu, se voit le cœur des Rois.
EMMTERATRICE.	EMTERATRICE.
I’y conſents, & ce Dieu redouble mon courage.	J'y consens, et ce Dieu redouble mon courage.
THRASIMOND.	THRASIMOND.
Soyez-donc le Pilote, en vn ſi grand orage,	Soyez-donc le Pilote, en un si grand orage,
VRSACE.	VRSACE.
S’il faut perdre quel qu’vn, pour le ſalut de tous, Ciel acceptez vn cœur qui ſe preſente à vous.	S'il faut perdre quel qu'Hôn, pour le salut de tous, Ciel acceptez un cœur qui se présente à vous.
L’IMPERATRICE.	L'IMPÉRATRICE.
E iour eſt deſia grand,	E jour est déjà grand,
L VRSACE.	L VRSACE.
Ouy Madame,	Oui Madame,
L’IMPERATRICE.	L'IMPÉRATRICE.
Il n'importe;	Il n'importe;
