A R 1.	À R 1.
Mais à terre, mon cher, je n’eus pas jetté l’œil, Que je connus le change, & ſentis un grand dueil.	Mais à terre, mon cher, je n'eus pas jeté l'œil, Que je connus le change, et sentis un grand deuil.
’ai beau lui faire voir toutes les differences Des pinces de mon Cerf & de ſes connoiſſances;	Ô beau lui faire voir toutes les différences Des pinces de mon Cerf et de ses connaissances;
Il me ſoûtient toûjours, en Chaſſeur ignorant, Que c’eſt le Cerf de meute, & par ce different Il donne temps aux chiens d’aller loin :	Il me soutient toujours, en Chasseur ignorant, Que c'est le Cerf de meute, et par ce différent Il donne temps aux chiens d'aller loin :
j’en enraEt peſtant de bon cœur contre le perſonnage:	j'en enraÉt pestant de bon cœur contre le personnage:
Je pouſſe mon cheval, & par haut, & par bas, Qui plioit des gaulis auſſi gros que les bras :	Je pousse mon cheval, et par haut, et par bas, Qui pliait des gaulis aussi gros que les bras :
Je ramene les chiens à ma premiere voye, Qui vont, en me donnant une exceſſive joye, Requerir nôtre Cerf, comme s’il l’euſſent veu :	Je ramène les chiens à ma première voie, Qui vont, en me donnant une excessive joie, Requérir notre Cerf, comme s'il l'eussent vu :
Ils le relancent;	Ils le relancent;
mais, ce coupert i preveu ?	mais, ce coup y jeu ?
A te dire le vrai, cher Marquis, il m’aſſomme.	À te dire le vrai, cher Marquis, il m'assomme.
Nôtre Cerf relancé va paſſer à nôtre homme, Qui croyant faire un trait de chaſſeur fort vanté, D’un piſtolet d’arçon qu’il avoit apporté, Eui donne juſtement au milieu de la tête;	Notre Cerf relancé va passer à notre homme, Qui croyant faire un trait de chasseur fort vanté, D'un pistolet d'arçon qu'il avait apporté, Eui donne justement au milieu de la tête;
Et de fortloin me crie, ab!	Et de fortloin me crie, ab!
j’ai mis bas la bête.	j'ai mis bas la bête.
A-t-on jamais parlé de piſtolets, bon Dieu !	A-t-on jamais parlé de pistolets, bon Dieu !
Pour courre un Cerf?	Pour courre un Cerf?
pour moi venant deſſus le lieu, l’ai trouvé l’action tellement hors d’uſage, Que j’ai donné des deux à mon cheval, de rage, Et m’en ſuis revenu chez moi toûjours courant, Sans vouloir dire un mot à ce ſot ignorant.	pour moi venant dessus le lieu, l'ai trouvé l'action tellement hors d'usage, Que j'ai donné des deux à mon cheval, de rage, Et m'en suis revenu chez moi toujours courant, Sans vouloir dire un mot à ce sot ignorant.
Tu ne pouvois mieux faire, & ta prudence eſt rare:	Tu ne pouvais mieux faire, et ta prudence est rare:
C’eſt ainſi, des Fâcheux, qu’il faut qu’on ſe ſepare;	C'est ainsi, des Fâcheux, qu'il faut qu'on se sépare;
Adieu.	Adieu.
RANTE.	RANTE.
Quand tu voudras, nous irons quelque part, Où nous ne craindrons point de chaſſeur Campagnard.	Quand tu voudras, nous irons quelque part, Où nous ne craindrons point de chasseur Campagnard.
4 STE.	4 SITE.
Fort bien.	Fort bien.
Je croi qu’enfin je perdrai patience.	Je crois qu'enfin je perdrai patience.
Cherchons à m’excuſer avecque diligence.	Cherchons à m'excuser avec diligence.
BAE	BAE
BALLE Du Second Acte.	BALLE Du Second Acte.
T	T
PREMIERE ENTRE’E.	PREMIÈRE ENTRE'E.
Es Joüeurs de Boule l'arrêtent pour mefurer un coup, dont ils ſont en diſpute.	Es Joüeurs de Le l'arrêtent pour mesurer un coup, dont ils sont en dispute.
Il ſe défait d’eux avec peine, & leur l'aiſſe dancer un pas, compoſe de toutes les poſtures qui ſont ordinaires à ce Jeu.	Il se défait d'eux avec peine, et leur l'aisse dancer un pas, compose de toutes les postures qui sont ordinaires à ce Jeu.
DEUXIE'ME ENTRE'E.	DEUXIE'ME ENTRE'E.
De petits Frondeurs les viennent interrompre, qui ſont chaſſez enſuite	De petits Frondeurs les viennent interrompre, qui sont chassés ensuite
TROISIE'ME ENTRE'E.	TROISIE'ME ENTRE'E.
Par des Savetiers, & des Savetieres, leurs peres, & autres, qui ſont ausſi chaſſez à leur tour	Par des Savetiers, et des Savetières, leurs pères, et autres, qui sont aussi chassés à leur tour
QUATRIE’ME ENTRE’E.	QUATRIE'ME ENTRE.
Par un Jardinier, qui dance ſeul, & ſe retire pour faire place au troiſiême Acte.	Par un Jardinier, qui dance seul, et se retire pour faire place au troisième Acte.
ACTE	ACTE
ACTE III.	ACTE III.
SCENE I.	SCÈNE I.
ERASTE, LA MONTAGNE.	ERASTE, LA MONTAGNE.
ERASTE.	ERASTE.
L eſt vrai, d’un côté mes ſoins ont reüſſi:	L est vrai, d'un côté mes soins ont réussi:
Cét adorable objet enfin s’eſt adouci:	Cet adorable objet enfin s'est adouci:
Mais d’un autre on m’accable, & les Aſtres ſeveres lOnt, contre mon amour, redoublé leurs coleres.	Mais d'un autre on m'accable, et les Astres sévères lOnt, contre mon amour, redoublé leurs colères.
Oui, Damis ſont tuteur, mon plus rude fâcheux, Tout de nouveau s’oppoſe aux plus doux de mes vœux, A ſon aimable niece a deffendu ma veuë, Et veut d’un autre Eſpoux la voir demain pourveuë.	Oui, Damis sont tuteur, mon plus rude fâcheux, Tout de nouveau s'oppose aux plus doux de mes vœux, À son aimable nièce a défendu ma vue, Et veut d'un autre Époux la voir demain pourvue.
Orphiſe toutefois, malgré ſon deſaveu, Daigne accorder ce ſoir une grace à mon feu;	Orphise toutefois, malgré son désaveu, Daigne accorder ce soir une grâce à mon feu;
Et j’ai fait conſentir l’eſprit de cette belle, A ſouffrir qu’en ſecret je la viſſe chez elleL’amour aime ſur tout les ſecrettes faveurs, Dans l’obſtacle, qu’on force, il trouve des douceurs;	Et j'ai fait consentir l'esprit de cette belle, A souffrir qu'en secret je la visse chez elleL'amour aime sur tout les secrètes faveurs, Dans l'obstacle, qu'on force, il trouve des douceurs;
Er le moindre entretien de la beauté qu’on aime, Lors qu’il eſt deffendu, devient grace ſupréme.	Er le moindre entretien de la beauté qu'on aime, Lors qu'il est défendu, devient grâce suprême.
Je vais au rendez-vous:	Je vais au rendez-vous:
c’en eſt l’heure à peu prés:	c'en est l'heure à peu près:
Puis, je veux m’y trouver plûtôt avant qu’aprés.	Puis, je veux m'y trouver plutôt avant qu'après.
LA MONTAGNE.	LA MONTAGNE.
Suivrai-je vos pas?	Suivrai-je vos pas?
ERA	ERA
ERASTE.	ERASTE.
Non, je craindrois que peut-étre A quelques yeux iuipects tu ine nſes connoître.	Non, je craindrais que peut-être À quelques yeux juipects tu iné nses connaître.
Mais.	Mais.
LA MONTAGNE.	LA MONTAGNE.
ERASTE.	ERASTE.
Je ne le veux pas.	Je ne le veux pas.
LA MONTAGNE.	LA MONTAGNE.
je dois luivie vox loix :	je dois luivie vox lois :
Mais au moins ſi de loin.	Mais au moins si de loin.
ERASTE.	ERASTE.
Te tairas-tu, vingt fois?	Te tairas-tu, vingt fois?
Et ne veux-tu jamais quitter cette methode, De te rendre, à toute heur?	Et ne veux-tu jamais quitter cette méthode, De te rendre, à toute heur?
, un valet incommode !	, un valet incommode !
SCENE II.	SCÈNE II.
CARITIDES, ERASTE.	CARITIDES, ERASTE.
M CARITIDES, Onſieur, le temps repugne à l’honneur de vous voir.	M MARITIDES, Onsieur, le temps répugne à l'honneur de vous voir.
Le matin eſt plus propre à rendre un tel devoir :	Le matin est plus propre à rendre un tel devoir :
Mais de vous rencontrer il n’eſt pas bien facile;	Mais de vous rencontrer il n'est pas bien facile;
Car vous dormez toûjours, ou vous étes en ville;	Car vous dormez toujours, ou vous êtes en ville;
Au moins, Meſſieurs vos gens me l’aſſeurent ainſi, Et j’ai, pour vous trouves, pris l’heure que voici.	Au moins, Messieurs vos gens me l'assurent ainsi, Et j'ai, pour vous trouves, pris l'heure que voici.
Encor eſt-ce un grand heur, dont le deſtin m’honnore;	Encor est-ce un grand heur, dont le destin m'honore;
Car deux momens plus caiu, jo vous manquois encore.	Car deux moments plus caiu, jo vous manquais encore.
RASTE.	RASTE.
Monſieur, ſouhaitez-vous quelque choſe de moi?	Monsieur, souhaitez-vous quelque chose de moi?
RITIDES.	RITIDES.
Je m’acquitte, Monſieur, de ce que je vous doi;	Je m'acquitte, Monsieur, de ce que je vous dois;
Et vous viens.	Et vous viens.
Excuſez l’audace, qui m’inſpire, Si.	Excusez l'audace, qui m'inspire, Si.
ERASTE.	ERASTE.
Sans tant de taçons, qu’avez-vous à me dire?	Sans tant de taçons, qu'avez-vous à me dire?
ARITIDES.	ARITIDES.
Comme le rang, l’eſprit, la géneroſité, Que chacun vante en vous.	Comme le rang, l'esprit, la générosité, Que chacun vante en vous.
ERASTE.	ERASTE.
Paſſons, Monſieur.	Passons, Monsieur.
Our je luis ſort vanté,	Our je luis sort vanté,
CARITIDES.	CARITIDES.
Monſieur, c’eſt une peine extréme, Lors qu’il faut à quelqu’un ſe produire ſoi-même, Et toûjours, prés des Grans on doit étre introduit, Par des gens, qui de nous faſſent un peu de bruit;	Monsieur, c'est une peine extrême, Lors qu'il faut à quelqu'un se produire soi-même, Et toujours, prés des Grans on doit être introduit, Par des gens, qui de nous fassent un peu de bruit;
Dont la bouche écoutée, avecque poids debite, Ce qui peut faire voir notre petit merite:	Dont la bouche écoutée, avec poids debite, Ce qui peut faire voir notre petit mérite:
Enfin j’aurois voulu que des gens bien inſtruits, Vous euſſent pû, Monſieur, dire ce que je ſuis,	Enfin j'aurais voulu que des gens bien instruits, Vous eussent pu, Monsieur, dire ce que je suis,
ERASTE.	ERASTE.
Je vois aſſez, Monfieur, ce que vous pouvez étre, Et vôtre ſeul abord le peut faire connoître.	Je vois assez, Monfieur, ce que vous pouvez être, Et votre seul abord le peut faire connaître.
ARITIDES.	ARITIDES.
Oui je ſuis un ſçavant charmé de vos vertus.	Oui je suis un Savant charmé de vos vertus.
Non pas de ces ſçavans, dont le nom n’eſt qu’en us:	Non pas de ces savants, dont le nom n'est qu'en us:
nin cierienn comman;	nin cierienn comman;
qu'an nom à la Latine.	qu'an nom à la Latine.
Ceux qu’on habille en Grec ont bien meilleure mine, Et pour en avoir un qui ſe termine en es, Je me fais appeller Monſieur Caritides.	Ceux qu'on habille en Grec ont bien meilleure mine, Et pour en avoir un qui se termine en es, Je me fais appeler Monsieur Caritides.
ERASTE.	ERASTE.
Monſieur Caritides ſoit, qu’avez-vous à dire?	Monsieur Caritides soit, qu'avez-vous à dire?
ARITIDES.	ARITIDES.
C’eſt un Placet, Monſieur, que je voudrois vous lire;	C'est un Placet, Monsieur, que je voudrais vous lire;
Et que dans la poſture, où vous met vôtre emploi, J’oſe vous conjurer de preſenter au Roi.	Et que dans la posture, où vous met votre emploi, J'ose vous conjurer de présenter au Roi.
ERASTE.	ERASTE.
Hé!	Hé!
Monſieur, vous pouvez le preſenter vousmême.	Monsieur, vous pouvez le présenter vousmême.
ARITIDES.	ARITIDES.
Il eſt vrai que le Roifait cette grace extréme:	Il est vrai que le Roifait cette grâce extrême:
Mais par ce même excés de ſes rares bontez, Tant de méchans Placets, Monſieur, ſont preſentez, Qu’ils étouffent les bons;	Mais par ce même excès de ses rares bontés, Tant de méchants Placets, Monsieur, sont présentez, Qu'ils étouffent les bons;
& l’eſpoir où je fonde, Eſt qu’on donne le mien, quand le l'rince eſt ſans monde.	et l'espoir où je fonde, Est qu'on donne le mien, quand le l'rince est sans monde.
RASTE.	RASTE.
Et bien vous le pouvez, & prendre vôtre temps.	Et bien vous le pouvez, et prendre votre temps.
t TIDES.	 TIDES.
Ah, Monſieur!	Ah, Monsieur!
les Huiſſiersſont de terribles geus.	les Huissierssont de terribles geus.
Ils traittent les Sçavans defaquins à naſardes;	Ils traitent les Savants défaquins à nasardes;
Et je n’en puis venir qu’à la ſalle des Gardes.	Et je n'en puis venir qu'à la salle des Gardes.
Les mauvais traitemens qu’il me faut endurer, a uui jamuie de lu dounme serdlancrourer, Si je n’avois conceu l’eſperance certaine, Qu’aupres de noue Rorvous lerez mon Mecene.	Les mauvais traitements qu'il me faut endurer, a u jamuie de lu dounme serdancrourer, Si je n'avais conçu l'espérance certaine, Qu'auprès de noue Rorvous lerez mon Mécène.
oui, vôtrecredit m’eſt un moyen aſſeuré.	oui, vôtrecredit m'est un moyen assuré.
RASTE.	RASTE.
Et bien donnez-moi donc, je le preſenterai.	Et bien donnez-moi donc, je le présenterai.
R I 1 D 2 s.	 I 1 D 2 s.
Le voici;	Le voici;
mais au moins oyez en la lecture	mais au moins oyez en la lecture
Non.	Non.
ERASTE.	ERASTE.
ARITIDRS.	ARITIDRS.
C’eſt pour étre inſtruit, Monſieur, je vous conjure.	C'est pour être instruit, Monsieur, je vous conjure.
PLA.	PLA.
LES TASCHEVX, PLACE AU ROY.	LES TASCHÉVX, PLACE AU ROY.
T	T
BIRE,	BIRE,
Vôtre tres-humble, tres-obeïſſant, tres-fidelle, & tres-ſçavant ſujet & ſerviteur Caritides, François de nation, Grec de profeſſion;	Votre très-humble, très-obeïssant, très-fidelle, et très-sçavant sujet et serviteur Caritides, Français de nation, Grec de profession;
Ayant conſideré les grands & notables abus, qui ſe commettent aux inſcriptions des Enſeignes des Maiſons, Boutiques, Cabarets, Jeux de Boule, & autres lieux de vôtre bonne Ville de Paris;	Ayant considéré les grands et notables abus, qui se commettent aux inscriptions des Enseignes des Maisons, Boutiques, Cabarets, Jeux de Boule, et autres lieux de votre bonne Ville de Paris;
en ce que certains ignorans tompoſiteurs deſdites inſcriptions, renverſent, par une barbare, pernicieu ſe & deteſtable ortographe toute ſorte de ſens & de r'niſon, ſans aucun égard d’Etimologie, Analogie, Energie, ni Alle.	en ce que certains ignorants tompositeurs dédites inscriptions, renversent, par une barbare, pernicieu se et détestable ortographe toute sorte de sens et de runison, sans aucun égard d'Étimologie, Analogie, Engie, ni Alle.
gorie quelconque;	gorie quelconque;
au grand ſcandale de la Republique des Lettres, & de la nation Françoiſe, qui pellécrie & des honore par leſaits abus, & fautes groſſieres, envert 2t Heruugera» & uorummenv ententes Muemans, curieux lecteurs & ſpectateurs deſdites inſcriptions.	au grand scandale de la République des Lettres, et de la nation Française, qui pellécrie et des honore par lesaits abus, et fautes grossières, envert 2t Heruugera» et uorummenv entes Muemants, curieux lecteurs et spectateurs dédites inscriptions.
ERASTE.	ERASTE.
Ce Placet eſt fort long, & pourroit bien fâcher.	Ce Placet est fort long, et pourrait bien fâcher.
ARITIDES.	ARITIDES.
Ah!	Ah!
Monſieur;	Monsieur;
pas un mot ne s’en peut retrancher.	pas un mot ne s'en peut retrancher.
ERASTE.	ERASTE.
Achevez promptement.	Achevez promptement.
ARIT IDES continuë.	ARIT IDES continue.
Supplie humblement Vôtre Majeſté de créer, pour le bien de ſon Etat, & la gloire de ſon Empire, une Charge de Controlleur, Intendant, Correcteur, Reviſeur & Reſtaurateur general deſdites Inſcriptions;	Supplie humblement Votre Majesté de créer, pour le bien de son État, et la gloire de son Empire, une Charge de Controlleur, Intendant, Correcteur, Revis et Restaurateur général dédites Inscrites;
& d’icelle honorer le ſuppliant, tant en conſideration de ſon rare & eminentſçavoir, que des grands & ſignalez ſervices qu’il a rendus à l’Etat, & à vôtre Majeſté, en ſaiſant l'Anagramme de Vôtre dite Majeſte en François, Latin, Grec, Hebreu, Syriaque, Caldéen, Arabe.	et d'icelle honorer le suppliant, tant en considération de son rare et eminentsçavoir, que des grands et signalés services qu'il a rendus à l'État, et à votre Majesté, en saisant l'Anagramme de Votre dite Majeste en Français, Latin, Grec, Hébreu, Syriaque, Caldéen, Arabe.
ERASTE l’interrompaut.	ERASTE l'interrompaut,
Fortbien:	Fortbien:
donnez le vîte, & faites la retraitte:	donnez le vite, et faites la retraite:
Il ſera veu du Roi, c’eſt une affaire faite.	Il sera vu du Roi, c'est une affaire faite.
ES.	ES.
Helas!	Hélas!
Monſieur, c’eſt tout que montrer mon Plaet.	Monsieur, c'est tout que montrer mon Plaet.
Si le Roi le peut voir, je ſuis ſeur de mon fait :	Si le Roi le peut voir, je suis sûr de mon fait :
Car comme ſa juſtice en toute choſe eſt grande, Il ne pourra jamais refuſer ma demande.	Car comme sa justice en toute chose est grande, Il ne pourra jamais refuser ma demande.
Au reſte, pour porter au Ciel vôtre renom, Donnez-moi par écrit vôtre nom, & ſurnom, mn rtontane unpoëme, eu tomie d'aeromtiche, Dans les deux bouts du Vers, & dans chaque hemiſtiche.	Au reste, pour porter au Ciel votre renom, Donnez-moi par écrit votre nom, et surnom, mont rontane unpoème, eu tomie d'aeromtiche, Dans les deux bouts du Vers, et dans chaque hémistiche.
ERASTE.	ERASTE.
Oui, vous l’aurez demain, Monſieur Caritides.	Oui, vous l'aurez demain, Monsieur Caritides.
Ma foi de tels Sçavans ſont des aſnes bien faits.	Ma foi de tels Savants sont des ânes bien faits.
J’aurois dans d’autres temps bien ri de ſa ſottiſe.	J'aurais dans d'autres temps bien ri de sa sottise.
SCENE III.	SCÈNE III.
ORMIN, ERASTE.	ORMIN, ERASTE.
ORMIN.	ORMIN.
3 Ien qu’une grande affaire en ce lieu me conduiJ’ai voulu qu’il ſortît, avant que vous parler.	3 Jen qu'une grande affaire en ce lieu me conduiJ’ai voulu qu'il sortît, avant que vous parler.
ERASTE.	ERASTE.
Fort bien, mais dépeſchons, car je veux m’en aller.	Fort bien, mais dépêchons, car je veux m'en aller.
ORMIN.	ORMIN.
Je me doute à peu pres que l’homme qui vous quitVous a fort ennuyé.	Je me doute à peu pres que l'homme qui vous quitVous a fort ennuyé.
Monſieur, par ſa viſite.	Monsieur, par sa visite.
C’eſt un vieux importun, qui n’a pas l’eſprit ſain, Et pour qui j’ai toûjours quelque défaite en main.	C'est un vieux importun, qui n'a pas l'esprit sain, Et pour qui j'ai toujours quelque défaite en main.
Au Mail, à Luxembourg, & dans les Thuilleries.	Au Mail, à Luxembourg, et dans les Thuilleries.
Il fatigue le monde, avec ſes reveries :	Il fatigue le monde, avec ses rêveries :
Et des gens, comme vous, doivent fuir l’entretien De tous ces ſçavans-là, qui ne ſont bons à rien.	Et des gens, comme vous, doivent fuir l'entretien De tous ces Savants-là, qui ne sont bons à rien.
Pour moi je ne crains pas, que je vous importune, Puiſque je viens, Monſieur, faire vôtre fortune.	Pour moi je ne crains pas, que je vous importune, Puisque je viens, Monsieur, faire votre fortune.
E d lo le.	E d lo le.
Voici quelque ſoufleur, de ces gens qui n’ont rien, Et vous viennent toûjours promettre tant de bien.	Voici quelque souleur, de ces gens qui n'ont rien, Et vous viennent toujours promettre tant de bien.
Vous avez fait, Monſieur, cette benite pierre, Qui peut, ſeule, enrichir tous les Rois de la terre.	Vous avez fait, Monsieur, cette bénite pierre, Qui peut, seule, enrichir tous les Rois de la terre.
ORMIN.	ORMIN.
La plaiſante penſée, helas, où vous voilà !	La plaisante pensée, hélas, où vous voilà !
Dieu me garde, Monſieur, d’étre de ces fous-là, Je ne me repais point de viſions frivoles, Et je vous porte ici les ſolides paroles D’un avis, que par vous je veux donner au Roi, Et que tout cacheté je conſerve ſur moi.	Dieu me garde, Monsieur, d'être de ces fous-là, Je ne me repais point de visions frivoles, Et je vous porte ici les solides paroles D'un avis, que par vous je veux donner au Roi, Et que tout cacheté je conserve sur moi.
Non de ces ſots projets, de ces chimeres vaines.	Non de ces sots projets, de ces chimères vaines.
Dont Dont les Surintendants ont les oreilles pleines;	Dont Dont les Surintendants ont les oreilles pleines;
Non de ces gueux d’avis, dont les pretentions Ne parlent que de vingt ou trente millions :	Non de ces gueux d'avis, dont les prétentions Ne parlent que de vingt ou trente millions :
Mais un, qui tous les ans, à ſi peu qu’on le monte, En peut donner au Roi quatre cens, de bon compAvec facilité, ſans riſque, ni ſoupçon, Et ſans fouler le peuple en aucune façon.	Mais un, qui tous les ans, à si peu qu'on le monte, En peut donner au Roi quatre cents, de bon compAvec facilité, sans risque, ni soupçon, Et sans fouler le peuple en aucune façon.
Enfin c’eſt un avis d’un gain inconcevable, Et que du premier mot on trouvera faiſâble.	Enfin c'est un avis d'un gain inconcevable, Et que du premier mot on trouvera faisâble.
Oui, pourveu que par vous je puiſſe étre pouſſé.	Oui, pourvu que par vous je puisse être poussé.
ERASTE.	ERASTE.
Soit, nous en parlerons, je ſuis un peu preſſé:	Soit, nous en parlerons, je suis un peu pressé:
1e, ll Iive Si vous me promettiez de garder le ſilence, Je vous decouvihoiscer avis a Mportances	1e, ll Iive Si vous me promettiez de garder le silence, Je vous découvihaiscer avis a Mportances
ERASTE.	ERASTE.
Non, non, je ne veux point ſçavoir vôtre ſecret.	Non, non, je ne veux point votre vôtre secret.
ORMIN.	ORMIN.
Monſieur, pour le trahir, je vous croy trop diſcret, Et veux, avec franchiſe, en deux mots vous l’apprendre.	Monsieur, pour le trahir, je vous crois trop discret, Et veux, avec franchise, en deux mots vous l'apprendre.
Il faut voir ſi quelqu’un ne peut point nous entendre.	Il faut voir si quelqu'un ne peut point nous entendre.
Cét avis merveilleux, dont je ſuis l’inventeur, Eſt que.	Cet avis merveilleux, dont je suis l'inventeur, Est que.
ERASTE.	ERASTE.
D’un peu plus loin, & pour cauſe, Monſieur.	D'un peu plus loin, et pour cause, Monsieur.
ORMIN.	ORMIN.
Vous voyez le grand gain, ſans qu’il faille le dire, &e ue cesports de mer le Roitous les ans tire.	Vous voyez le grand gain, sans qu'il faille le dire, été ue cesports de mer le Roitous les ans tire.
Or l’avis dont encor nul ne s’eſt aviſé, Eſt qu’il faut de la France, & c’eſt un coup aiſé, En fameux ports de mer mettre toutes lescôtes.	Or l'avis dont encor nul ne s'est avisé, Est qu'il faut de la France, et c'est un coup aisé, En fameux ports de me mettre toutes lescôtes.
Ce ſeroit pour monter à des ſommes tres-hautes.	Ce serait pour monter à des sommes très-hautes.
Et ſi.	Et si.
ERASTE.	ERASTE.
L’avis eſt bon, & plaira fort au Roi.	L'avis est bon, et plaira fort au Roi.
Adieu, nous nous verrons.	Adieu, nous nous verrons.
ORMIN.	ORMIN.
Au moins appuyez moi, Pour en avoir ouvert les premieres paroles.	Au moins appuyez -moi, Pour en avoir ouvert les premières paroles.
Oui, oui.	Oui, oui.
A le Ma Mu.	À le Ma Mu.
ORMIN.	ORMIN.
Si vous vouliez me prêter deux piſtoles, Que vous reprendriez ſur le droit de l’avis, Monſieur.	Si vous vouliez me prêter deux pistoles, Que vous reprendriez sur le droit de l'avis, Monsieur.
ERASTE.	ERASTE.
Oui volontiers.	Oui volontiers.
Plût à Dieu, qu’à ce prix, De tous les importuns je puſſe me voirquitte !	Plût à Dieu, qu'à ce prix, De tous les importuns je pusse me voirquitte !
Voyez quel contretemps prend ici leur viſite !	Voyez quel contretemps prend ici leur visite !
Je penſe qu’à la fin je pourrai bien ſortir.	Je pense qu'à la fin je pourrai bien sortir.
Viendra-t-il point quelqu’un encor me divertir?	Viendra-t-il point quelqu'un encor me divertir?
SCENE IV.	SCÈNE IV.
FILINTE, ERASTE,	FILINTE, ERASTE,
FILINTE.	FILINTE.
Arquis, je viens d’apprendre une étrange nouM velle.	Arquis, je viens d'apprendre une étrange nouve velle.
Quois ERASTE.	Quais ERASTE.
FILINTE.	FILINTE.
Qu’un homme, tantôt, t’a fait une querelle.	Qu'un homme, tantôt, t'a fait une querelle.
A moi ?	À moi ?
ERASTE.	ERASTE.
FILINTE.	FILINTE.
Que te ſert-il de le diſſimuler?	Que te sert-il de le dissimuler?
Je ſçai de bonne part qu’on t’a fait appeller;	Je sais de bonne part qu'on t'a fait appeler;
Et comme ton ami, quoi qu’il en reüſſiſſe, Je te viens, contre tous, faire offre de ſervice.	Et comme ton ami, quoi qu'il en réussisse, Je te viens, contre tous, faire offre de service.
ERASTE.	ERASTE.
Je te ſuis obligé;	Je te suis obligé;
mais croi que tu me fais.	mais crois que tu me fais.
LINTE.	LINTE.
Tu ne l’avoûras pas, mais tu ſors ſans valets :	Tu ne l'avouras pas, mais tu sors sans valets :
Demeure dans la ville, ou gagne la campag.	Demeure dans la ville, ou gagne la campag.
ne;	ne;
Tu n’iras nulle part que je ne t’accompagne.	Tu n'iras nulle part que je ne t'accompagne.
Ah!	Ah!
j’enrage.	j'enrage.
ERASTE.	ERASTE.
LINTE.	LINTE.
A quoi bon de te cacher de moi?	À quoi bon de te cacher de moi?
RASTE.	RASTE.
Jetejdie, Marquis, qu’ons eit moque de tole	Jetejdie, Marquis, qu'ons eit moque de tole
FLLINTE.	FLLINTE.
En vain tu t’en deffens.	En vain tu t'en défends.
ERASTE.	ERASTE.
Si d’aucun démêlé.	Si d'aucun démêlé.
qe le Cierme foudroye,	Oqe le Cierme foudroie,
FILINTE.	FILINTE.
Tu penſes qu’on te croye?	Tu penses qu'on te croie?
ERASTE.	ERASTE.
ei'iton Dieu:	éj'iton Dieu:
je te dis, & ne déguiſe point, Que.	je te dis, et ne déguise point, Que.
FIL'INTE.	FIL'INTE.
Ne me trois pas dupe, & crédule à ce point.	Ne me trois pas dupe, et crédule à ce point.
ERASTE.	ERASTE.
veux tu m’obliger ?	veux tu m'obliger ?
ILINTE.	ILINTE.
Non.	Non.
ERASTE.	ERASTE.
Laiſſe-moi, je te prie.	Laisse-moi, je te prie.
LINTE.	LINTE.
Point d’affaire, Marquis.	Point d'affaire, Marquis.
ERASTE.	ERASTE.
Une galanterie, En certaineu, ce loH.	Une galanterie, En certainu, ce loH.
FILINTE.	FILINTE.
Je ne te quitte pas:	Je ne te quitte pas:
En quel lieu que ce ſoit, je veux ſuivre tes pas,	En quel lieu que ce soit, je veux suivre tes pas,
ERASTE.	ERASTE.
Parbleu, puiſque tu veux que j’aye une querelle, Je conſens à l’avoir pour contenter ton zele :	Parbleu, puisque tu veux que j'aie une querelle, Je consens à l'avoir pour contenter ton zèle :
