TRAGICOMEDIE PASTORALLE,	TRAGICOMEDIE PASTORALLLE,
Il eſt vray que nos corps reſtans ſans ſepulture, Apres les droicts payez qu’on doit à la Nature, Nos ames ſont long-temps errantes à l’entour Des endroicts où les corps perdent le bien du iour, Et que le vieil Charon leur refuſe ſa barque, de ujant pount ie trtout qu'on doit u jon Monarque:	Il est vrai que nos corps restants sans sépulture, Après les droits payés qu'on doit à la Nature, Nos âmes sont longtemps errantes à l'entour Des endroits où les corps perdent le bien du jour, Et que le vieil Charon leur refuse sa barque, de ujant pount jours trtout qu'on doit é jon Monarque:
Mais apres ce detour nous voicy toutesfois Arriuez, grace aux Dieux à l’entree du bois, Ou nous voulions aller.	Mais après ce détour nous voici toutefois Arrivez, grâce aux Dieux à l'entre du bois, Ou nous voulions aller.
Hilas.	Hilas.
Berger tes réueries Nous vont faire coucher loin de nos bergeries.	Berger tes révériez Nous vont faire coucher loin de nos bergeries.
Siluandre.	Silvandre.
Prophane prens bien garde à n'irriter le Dieu, Qui montre ciatrement d'habiter en ca tieu,	Prophane prends bien garde à n'irriter le Dieu, Qui montre ciatrement d'habiter en ca tieu,
Siluandre.	Silvandre.
Et toy de ne te perdre aux detours du bocage, Puiſque toute la terre a changé de viſage, Et que deſia, la nuist a faict mourir le iour, Dont nous deuons attendre en ce lieu le retour, Ou iau moins que ta tunt ancunement eſclaire, Afin que nous voyons ce que nous deuons faire,	Et toi de ne te perdre aux détours du bocage, Puisque toute la terre a changé de visage, Et que déjà, la nuist a fait mourir le jour, Dont nous devons attendre en ce lieu le retour, Ou au moins que ta unt ancunément éclaire, Afin que nous voyons ce que nous devons faire,
Paris.	Paris.
Braue Hilas, voſtre aduis ſera ſuiui du mien,	Brave Hilas, votre avis sera suivi du mien,
Diane.	Diane.
Et nous ſuiurons le voſtre Paris.	Et nous suivrons le vôtre Paris.
At faut pour eftre bien, Que vous vous repoſies toutes deux ſur leur ſayes, Iandis que nous irons coucher pres de ces hayes.	At faut pour être bien, Que vous vous reposiez toutes deux sur leur sayes, Jandis que nous irons coucher pres de ces hayes.
Aſtree.	Astreée.
Ce qui vous ſemble bon est noſtre volonté:	Ce qui vous semble bon est notre volonté:
Paris.	Paris.
Nous allons donc tous trois prenart tantre coſté, Attenàant que la lune ait chaßé les tenebres,	Nous allons donc tous trois prenart tantre côté, Attenàant que la lune ait chassé les ténèbres,
Aſtree.	Astreée.
Helas!	Hélas!
ie ne voy rien que des objets funebres,	Ne ne vois rien que des objets funèbres,
Diane.	Diane.
le commence pour moy d’esperer vn peu mieux, Et croy qu’auparauant que nous quitions ces lieux Quelque bonne nouuelle apaiſera vos larmes:	le commence pour moi d'espérer un peu mieux, Et crois qu'auparavant que nous quitions ces lieux Quelque bonne nouvelle apaisera vos larmes:
Mais deſia le ſommeil me preſſe de ſes charmes, Repoſons nous vn peu,	Mais déjà le sommeil me presse de ses charmes, Reposons nous un peu,
Aſtree.	Astreée.
Ie le veux bien ma ſœur.	Je le veux bien ma sœur.
Celadon.	Céladon.
Cependant que la nuict auecques ſa noirceur Rend les plus beaux obiects a nos yeux effroyables Ie vien dire à ces bois, par mes cris pitoyables.	Cependant que la nuit avec sa noirceur Rend les plus beaux objets à nos yeux effroyables Je vien dire à ces bois, par mes cris pitoyables.
L’iniuſte coup du ciel qui finit mes plaiſirs, Et donnę vne contrainte a mes iuſtes deſirs;	L'injuste coup du ciel qui finit mes plaisirs, Et donn ait contrainte à mes justes désirs;
Mais ce petit croiſſant qui commence à parêtre, Fait malgré ces rameaux ſa lumire cognoétre, Les obiets ne ſont plus à mes yeux ſi cachez, Ie voy quelques bergers deſſus l’herbe couchés, Qui pour dormir ſe ſont ſeparez des bergeres, Qut repoſent plus loin ſoubs les feuilles lergeres:	Mais ce petit croissant qui commence à paraître, Fait malgré ces rameaux sa lumire connaître, Les objets ne sont plus à mes yeux si cachés, Je vois quelques bergers dessus l'herbe couchés, Qui pour dormir se sont séparez des bergères, Qut reposent plus loin sous les feuilles lergères:
Il faut ſçauoir qui c’eſt:	Il faut sçauoir qui c'est:
voila Paris qui dort Pres d’Hilas & Siluandre, ô cruauté du ſort, Ma bergere eſt icy, deſſus l’herbe endormie.	voilà Paris qui dort Pres d'Hilas et Silvandre, ô cruauté du sort, Ma bergère est ici, dessus l'herbe endormie.
Ah!	Ah!
quell' aura raiſon d’eſtre mon ennemie, Ie n’ay pourtant, rien faict qui choque mon deuoir, Car tandis qu’elle dort, elle ne me peut voir, Et ſans contreuenir a ſa regle importunc, Iepuis prendre aux cheueux cette bonne fortune;	quell et -elle d'être mon ennemie, Je n'ai pourtant, rien fait qui choque mon devoir, Car tandis qu'elle dort, elle ne me peut voir, Et sans contrevenir à sa règle importunc, Jepuis prendre aux cheveux cette bonne fortune;
Receceuons donc ce bien:	Recevons donc ce bien:
Ah mes ſens aueuglez Dans vn ſi grand bon-heur ſe trouuent dereglez, Et ie reſſenble à ceux qui ſortis des tenebres, Qu'vne priſon enferme en ſes cachots funebres, Lors qu’il reſpirent l'air auecques liberté, Se trouuent esbloüis d’vne grande clarté Dans ce bon-heur preſent i’ay peine à me reſpondre, Mais quand les dieux deuroient m'eſcraſer de leur foudre, Et que tout deuroit eſtre à ma confuſion, Ie ne laiſſeray point perdre l’occaſion, Que ſes yeux toutefois à trauers leur paupieres, En depit du ſommeil me monſtrent de lumieres, Temerere, oſeray-ie aprocher ce beau ſein;	Ah mes sens aveuglés Dans un si grand bonheur se trouvent déréglez, Et grands ressenble à ceux qui sortis des ténèbres, Qu'une prison enferme en ses cachots funèbres, Lors qu'il respirent l'air avec liberté, Se trouvent éblouis d'une grande clarté Dans ce bonheur présent j'ai peine à me répondre, Mais quand les dieux devraient m'écraser de leur foudre, Et que tout devrait être à ma confusion, Je ne laisserai point perdre l'occasion, Que ses yeux toutefois à travers leur paupières, En dépit du sommeil me montrent de lumières, Temerere, oserai-ie re ce beau sein,
Oſeray ie accomplir mon amoureux deſſein?	Oserai ici accomplir mon amoureux dessein?
Il me le faut oſer, ô douceur nompareille, Il faut baiſer encor ceſte bouche vermeille, Et prendre la deſſus plus de ſucre & de miel, Quimes tranaua paſſez te n'ay trouue dt fielReçoy donc ce baiſer, ô diuine merueille, Mais il me faut fuir, la voila qui s’éueille.	Il me le faut oser, ô douceur nompareille, Il faut baiser encor cette bouche vermeille, Et prendre la dessus plus de sucre et de miel, Quimes tranava passez te n'ai trouve dût fielReçoy donc ce baiser, ô divine merveille, Mais il me faut fuir, la voilà qui s'éveille.
Aſtrec.	Astrec.
A l’aide ma Diane:	À l'aide ma Diane:
Ah!	Ah!
ma ſœur ie me meurs, Bergers estes vous ſourds à mes triſtes clameurs?	ma sœur Seigneur me meurs, Bergers êtes -vous sourds à mes tristes clameurs?
Siluandre.	Silvandre.
Bergere qu’auez-vous, quel accident vous preſſe?	Bergère qu'avez-vous, quel accident vous presse?
Aſtree.	Astreée.
De mes ſens la douleur eſt tout à faict maiſtreſſe, L’ombre de Celadon apparu à mes yeux Se plaint que ſans honneur elle erre dans ces lieux	De mes sens la douleur est tout à fait maîtresse, L'ombre de Céladon apparu à mes yeux Se plaint que sans honneur elle erre dans ces lieux
Diane.	Diane.
Il la faut contenter.	Il la faut contenter.
Aſtree.	Astreée.
Ouy deuant que l’aurore Se montre encor trois fois jur te riuage more.	Oui devant que l'aurore Se montre encor trois fois jur te rivage more.
Paris.	Paris.
Bergere i’en prendray ſur moy tout le ſoucy, Car ie ſçay ce qu’il faut en cet affaire icy.	Bergère j'en prendrai sur moi tout le souci, Car tu sais ce qu'il faut en cet affaire ici.
Diane.	Diane.
Il ſera plus ſeant qu’autre qu’elle luy rende L’hõneur du vain tombeau que ſon ombre demande,	Il sera plus séant qu'autre qu'elle avait rende L'honneur du vain tombeau que son ombre demande,
ACTE SECOND.	ACTE SECOND.
Adamas, Leonide, Paris, Varris, Siluandre, Hilas, Chœur, Aileudey Dilc.	Adamas, Léonide, Paris, Varris, Silvandre, Hilas, Chœur, Aileude , Dilc.
SCENE PREMIERE.	SCÈNE PREMIÈRE.
Adamas, Leonide, Adamas.	Adamas, Léonide, Adamas.
Ve les ſecrets des dieux ſont iuſtement cachez A nous pauures humains, accablez de pechez, Qui retenans noſtre ame en ſa priſon mortelle L'empeſchent de penſer à ſa ſource eternelle:	Ve les secrets des dieux sont justement cachés À nous pauvres humains, accablez de péchés, Qui retenants notre âme en sa prison mortelle L'empêchent de penser à sa source éternelle:
De là viennent les maux que ſouffrent les mortels, Et le peu de profit que nous font les autels, I'ay depuis vn long temps par mon experience A mes propres despens apris ceſte ſcience;	De là viennent les maux que souffrent les mortels, Et le peu de profit que nous font les autels, J'ai depuis un long temps par mon expérience À mes propres dépens après cette science;
Mais les dieux ſoient loüez qu’en mon aduerſité Ie n’ay point murmuré contre leur Maieſté,	Mais les dieux soient louez qu'en mon aduersité Je n'ai point murmuré contre leur Majesté,
Et qu’alors qu’il leur pleust de m’oſter l’eſperance.	Et qu'alors qu'il leur plût de m'ôter l'espérance.
En m’ostant mon cher fils en ſa plus tendre enfance I’ay beny leur bonté croyant que quelque iour Ils me regarderoient auec vn œil d’amour.	En m'ôtant mon cher fils en sa plus tendre enfance J'ai béni leur bonté croyant que quelque jour Ils me regarderaient atte il d'amour.
De faict ils m'ont promis auec vn peu d’attante.	De fait ils m'ont promis homme un peu d'attante.
De rendre en peu de iours ma vieilleſſe contente, Par vn Oracle expres m’ordonnant cependant D’auoir pour Celadõn vn ſoin touſiours ardant Diſant que mon bon-heur dependoit de ſa ioye, Que ſon bien & le mien eſtoit en meſme voye;	De rendre en peu de jours ma vieillesse contente, Par un Oracle exprès m'ordonnant cependant D'avoir pour Céladon un soin toujours ardant Disant que mon bonheur dépendait de sa joie, Que son bien et le mien était en même voie;
Par ce commandement, qui me fait esperer, Que mes maux quelque iour ceſſeront de durer:	Par ce commandement, qui me fait espérer, Que mes maux quelque jour cesseront de durer:
Ils veulent m’obliger à chercher du remede A l’extreme douleur qui ſon ame poſſede, L’occaſions’en offre aſſez belle auiourd’huy Que ſa bergere meſme eſt en larmes pour luy, Et que le croyant mort chacun ſe met en peine De le mettre en repos par vne tombe vaine, Il vous faut, Leonide, aller tout de ce pas Où l’on pleint du berger l’imaginé trespas, Et de geste, & de voix auec vos;	Ils veulent m'obliger à chercher du remède À l'extrême douleur qui son âme possède, L'occasionsen offre assez belle aujourd'hui Que sa bergère même est en larmes pour lui, Et que le croyant mort chacun se met en peine De le mettre en repos par une tombe vaine, Il vous faut, Léonide, aller tout de ce pas Où l'on pleint du berger l'imaginé trépas, Et de geste, et de voix avec vos;
larmes feintes, De toute cette troupe accompagner les plaintes, Tandi--ie taſcheray de gaigner le berger, Et de le diſpoſer à l’habit menſonger, Dont ie voudrois cacher & ſon ſexe & ſa race, Ee bien tost le remettre auec Aſtree en grace, Et vous ferés courir diſcrettement le bruict Que ma fille Alexis doit venir ceste nuict.	larmes feintes, De toute cette troupe accompagner les plaintes, Tandi-je tâcherai de gagner le berger, Et de le disposer à l'habit mensonger, Dont ainsi voudrais cacher et son sexe et sa race, Ee bien tôt le remettre avec Astrée en grâce, Et vous ferez courir discrettement le bruit Que ma fille Alexis doit venir cette nuit.
Leoniide.	Léonide.
Ie taſcheray touſiours par tout de vous complaire, Et principalement en ceste bonne affaire, D’où depend le repos que les dieux vos amis Ont par leur ſainct Oracle à vos vieux iours promis,	Je tâcherai toujours par tout de vous complaire, Et principalement en cette bonne affaire, D'où dépend le repos que les dieux vos amis Ont par leur saint Oracle à vos vieux jours promis,
SCENE SECONDE, Paris, Vacie, Siluandre, Hilas, Aſtree.	SCÈNE SECONDE, Paris, Vacie, Siluandre, Hilas, Astre.
Diane, Leonide.	Diane, Léonide.
JOicy l’endroit choiſi pour la ceremonie, Que demande de nous cét amoureux genie, Voila le tombeau vain, & le laict preparé, Auecques l’agneau noir dont le front eſt doré:	JOici l'endroit choisi pour la cérémonie, Que demande de nous cet amoureux génie, Voilà le tombeau vain, et le lait préparé, Avecques l'agneau noir dont le front est doré:
Le Vacie eſt tout preſt pour le ſainct ſacrifice, Et n'attend qu’apres nous à faire ſon office.	Le Vacie est tout prêt pour le saint sacrifice, Et n'attend qu'après nous à faire son office.
Vacie.	Vacie.
Vous qu'vn pieux deſſein oblige à ce debuoir, Adreſſez tous vos vœux chez le monarque noir, Tandis que de ce laict, & de cette victime I’appaiſeray les dieux de l’infernal abiſme, Grands iuges de l’enfer, Eaque, & vous Minos, Qui là bas ordonnez la peine ou le repos, Suiuant que les eſpris ſont plus ou moins coulpables, Rendez vous maintenant à nos veux fauorables Et ne permertez plus que l’auare Charon, Refuſe à cét esprit de paſſer l’Acheron:	Vous qu'un pieux dessein oblige à ce débuoir, Adressez tous vos vœux chez le monarque noir, Tandis que de ce lait, et de cette victime J'apaiserai les dieux de l'infernal abîme, Grands juges de l'enfer, Éque, et vous Minos, Qui là bas ordonnez la peine ou le repos, Suivant que les esprit sont plus ou moins coulpables, Rendez vous maintenant à nos veux favorables Et ne permertez plus que l'auare Charon, Refuse à cet esprit de passer l'Acheron:
Que ce laict que ie verſe, & ce ſang que i’eſpãche, Du tribut qu’elle doit rendent cett' ame franche:	Que ce lait que Seigneur verse, et ce sang que j'épanche, Du tribut qu'elle doit rendent cet âme franche:
Et toy pour qui l’on faict ce tombeau ſolemnel, Va iouir chez les morts du repos eternel, N'erre plus deſormais en ces ueux folttaires, Y laiſſant en repos ſes hoſtes ordinaires.	Et toi pour qui l'on fait ce tombeau solennel, Va jouir chez les morts du repos éternel, N'erre plus désormais en ces ouveux foltaires, Y laissant en repos ses hôtes ordinaires.
Paris.	Paris.
Bell' ame hoſteſſe autresfois, Du plus beau corps du monde, Eſcoute les accents de nos plaintiues voix, Deuant que paſſer t’onde, Et receuoir le ioug des infernalles loix.	Bell' âme hôtesse autrefois, Du plus beau corps du monde, Escoute les accents de nos plaintives voix, Deuant que passer t'onde, Et recevoir le joug des infernales lois.
Siluandre.	Silvandre.
Reçoy de grace ces fleurs Eaupt'amitié ſaincte, Meſte ſur ceite tombt, auce Peau de nos pleurs Et parmi noſtre plainte, Voynos ſouſpirs teſmoins de nos iuſtes douleurs.	Reçois de grâce ces fleurs Éaupt-amitié sainte, Mête sur ceite tombt, auce Peau de nos pleurs Et parmi notre plainte, Voynos soupirs témoins de nos justes douleurs.
Hilas.	Hilas.
Quand tu viuois parmi nous, La plaine eſtoit plus verte, Le ciel nous regardoit auec vn œil plus doux, Mais depuis cette perte, Dãs l’eſclair & la foudre il marque sõ courroux.	Quand tu vivais parmi nous, La plaine était plus verte, Le ciel nous regardait toujours un œil plus doux, Mais depuis cette perte, Dans l'éclair et la foudre il marque sont courroux.
Chœur des Bergers.	Chœur des Bergers.
Nos miſerables brebis, Ont de la peine à pétre Les arbres de douleur quittent leurs verds habits, Et depuis l’on voit nétre Laurore tous les iours ſans perles, ny rubis.	Nos misérables brebis, Ont de la peine à pêtre Les arbres de douleur quittent leurs verds habits, Et depuis l'on voit naître Laurore tous les jours sans perles, ni rubis.
Aſtree.	Astreée.
Ma ſœur ie n'en puis plus, Diane.	Ma sœur ici n'en puis plus, Diane.
reprenez vos eſpris, Que losjensut juient pi, de cexcotets farpris, Faites voir maintenant auec voſtre conſtance, Que les malheurs chez vous trouuent de reſiſtance.	reprenez vos épris, Que losjensut juient pi, de cexcots farpris, Faites voir maintenant avec votre constance, Que les malheurs chez vous trouvent de résistance.
Vac.	Vac.
C’eſt aſſez mes amis, c’eſt aſſez ſouſpiré, L’on a ſur ce tombeau ſuffiſamment pleuré, Les dieux ſont ſatisfaits, faiſons ce qui nous reſte, Pour conduire à ſa fin cét office funeſte, Di jait jon Epltapne.	C'est assez mes amis, c'est assez soupiré, L'on a sur ce tombeau suffisamment pleuré, Les dieux sont satisfaits, faisons ce qui nous reste, Pour conduire à sa fin cet office funeste, Di jait jon Epltapne.
Sil.	Sil.
il me faut ſeulement D'vn couteau la grauer deſſus le monument.	il me faut seulement D'un couteau la graver dessus le monument.
Aſtree.	Astreée.
Dieux que n’eslancez vous ſur moy voſtre tõnerre!	Dieux que n'élancez -vous sur moi votre tõnerre!
Pourquoy pour m'engloutir n’ouurez vous point la terre ?	Pourquoi pour m'engloutir n'ouvrez -vous point la terre ?
Ant vous fertez encor pour mon crime trop doux	Ant vous fertez encor pour mon crime trop doux
Diane.	Diane.
Contraignez ces regrets on a les yeux ſur nous.	Contraignez ces regrets on a les yeux sur nous.
Leonide.	Léonide.
Celadon, Celadon, vois-tu point à cét heure Auec quels ſentiments ta bergere té pleure?	Céladon, Céladon, vois-tu point à cet heure Avec quels sentiments ta bergère té pleure?
Nvonta ne te von pas carjun aſſuctton, Sans doute amoliroit ton obſtination.	Névonta ne te von pas carjun assucton, Sans doute amolirait ton obstination.
Siluandre lit l’Epitaphe.	Silvandre lit l'Épitaphe.
Paſſant quand tu verras ce funeſte tombeau, Et le nom du berger pour qui l’on la fait faire, Tu ſçauras que l’Amour deuenu ſolitaire A de regret eſteint dans ſes pleurs ſon flambeat Pleure donc comme luy, La perte que nous auons faite, La mort de Celadon doit eſtre ſa defaite, Et le ſubiet de ton ennuy.	Passant quand tu verras ce funeste tombeau, Et le nom du berger pour qui l'on la fait faire, Tu sçauras que l'Amour devenu solitaire A de regret éteint dans ses pleurs son flambeat Pleure donc comme lui, La perte que nous avons faite, La mort de Céladon doit être sa défaite, Et le sujet de ton ennui.
Hilas.	Hilas.
Ie l’auois touſiours creu qu’à la fin ſa folie Mettroit là quelque traict de ſa melancholie.	Je l'avais toujours cru qu'à la fin sa folie Mettrait là quelque trait de sa mélancolie.
VaC.	VaC.
Tout est faict il eſt temps d’abandonner ce lieu, Et de ſe retirer.	Tout est fait il est temps d'abandonner ce lieu, Et de se retirer.
Chœur.	Chœur.
Leonide.	Léonide.
Puis que l’on a mis fin à la ceremonie, Ie vay prendre congé de cette compagnie, Fachee toutes fois de la quiter ſi toſt, Mais ma ſœur Alexis doit arriuer bien toſt, Qui me rend ce depart maintenant neceſſere, Ie laiſſeray pourtant auecques vous mon frere, Qui vous accompagnant vous dira la raiſon, Qui luy fait delaiſſer ceſte ſaincte maiſon, Où depuis ſi long temps elle eſtoit enfermee.	Puis que l'on a mis fin à la cérémonie, Je vais prendre congé de cette compagnie, Fachée toute fois de la quit si tôt, Mais ma sœur Alexis doit arriver bien tôt, Qui me rend ce départ maintenant necessere, Je laisserai pourtant auecques vous mon frère, Qui vous accompagnant vous dira la raison, Qui lui fait délaisser ceste sainte maison, Où depuis si long temps elle était enfermée.
Dianc.	Dianc.
Noſtre ſimplicité ne ſera point blaſmee, Madame, ſi ſuiuant voſtre commandement, Nous vſons auec vous de peu de compliment, Puis que vous deſirez de, viure en la franchiſe, Que dedans nos hameaux nous nous ſommes acquiſe, e ent ce qui vons peananen jermiadeloy.	Notre simplicité ne sera point blâme, Madame, si suivant votre commandement, Nous usons avec vous de peu de compliment, Puis que vous désirez de, vivre en la franchise, Que dedans nos hameaux nous nous sommes acquise, e u ce qui vons peananen jermiadelais.
Le onide.	Le onide.
Adieu ſouuenez vous l’vne & l’autre de moy,	Adieu souvenez vous l'une et l'autre de moi,
Aſtree.	Astreée.
Adieu Madame, adieu, nous demeurons confuſes, Et cét honneur nous rend tout à fait ſans excuſes.	Adieu Madame, adieu, nous demeurons confuses, Et cet honneur nous rend tout à fait sans excuses.
SCENE TROISIESME, Adamas, Celadon, Leonide,	SCÈNE -TROISIÈME, Adamas, Céladon, Léonide,
Adamas.	Adamas.
On fils ie veux ſur vous gaigner ce point icy IQue vous me remettiés du tout voſtre ſoucy, Et ſuis fort ſatisfaict de voir voſtre viſage, De qui la gayeté me donne vn bon preſage:	On fils de veux sur vous gagner ce point ici IQue vous me remetiez du tout votre souci, Et suis fort satisfait de voir votre visage, De qui la gaieté me donne un bon présage:
Mais ce n’eſt pas aſſez ie veux vous faire voir A la beauté qui tient voſtre ame en ſon pouuoir, Et iem uumt'entretien que vous receurez d’elle.	Mais ce n'est pas assez croire veux vous faire voir À la beauté qui tient votre âme en son pouvoir, Et iem uumt'entretien que vous recevrez d'elle.
Que vous la trouuiez douce à voſtre amour fidelle.	Que vous la trouviez douce à votre amour fidèle.
Celadon.	Céladon.
Ah mon pere pluſtoſt, ie ſouffriray la mort, Ie ferois à ma flamme vn trop ſenſible tort, Car lors que ſon courroux m’oſta de ſa preſence Elle me fit ouir cette expreſſe deffence.	Ah mon père plutôt, ie souffrirai la mort, Je ferais à ma flamme un trop sensible tort, Car lors que son courroux m'ôta de sa présence Elle me fit ouïr cette expresse défense.
Celadon ſi iamais tu te montres à moy, Que mon commandement ne t’en donne la loy, N'attends point de pouuoir apaiſer ma colere, Ny de faire pour moy rien qui me puiſſe plere, Et Celadon apres iroit deuant ſes yeux, Non, non facent de moy ce que voudront les dieux, Que ie perde à iamais pluſtoſt toute maioye.	Céladon si jamais tu te montres à moi, Que mon commandement ne t'en donne la loi, N'attends point de pouvoir apaiser ma colère, Ni de faire pour moi rien qui me puisse plere, Et Céladon après irait devant ses yeux, Non, non facent de moi ce que voudront les dieux, Que grande perde à jamais plutôt toute maie.
Adamas.	Adamas.
Ce n’eſt pas Celadon que ie veux qu’elle voye, Mais ma fille Alexis vne ieune beaute, Que i’auoy conſacree à la diuinité, Et qui comme Druide au temple retenuë, Ie veux feindre auiourd’huy toutesfois reuenuë.	Ce n'est pas Céladon que femme veux qu'elle voie, Mais ma fille Alexis une jeune beauté, Que j'avoi consacrée à la divinité, Et qui comme Druide au temple retenue, Je veux feindre aujourd'hui toutefois revenue.
Celadon.	Céladon.
Quel bien de tout cela me peuſt-il reuenir?	Quel bien de tout cela me pût-il revenir?
Adamas.	Adamas.
Qu'Aſtree autcques tons pourta s'entretenir, Celadot	Qu'Astre autcques tons pourta s'entretenir, Céladot
Celadon.	Céladon.
Sa defence pourtant y ſert touſiours d’obſtacle.	Sa défense pourtant y sert toujours d'obstacle.
Adamas.	Adamas.
vans y contrenemnte feumeummete, Croyez moy ſeulement.	vans y contrenemnte feumeumette, Croyez moi seulement.
Celadon.	Céladon.
Hetas mon pere dlors Vous redonnerez l’ame, & la ioye à ce corps.	Hélas mon père dlors Vous redonnerez l'âme, et la joie à ce corps.
Mais que faudra-il faire?	Mais que faudra-il faire?
Adamas.	Adamas.
Il faut prendre courage, Et ſortir auiourd’huy d’vn endroit ſi ſauuage, Où les dieux ont horreur de vous voir endurer, Pour prendre des habits que i’ay faict preparer, Et vous feinure ſi vien que tome la jamille 3 Vous prenne à mon logis pour Druide & pour fille, Et me laiſſez le ſoin du reſte abſolument.	Il faut prendre courage, Et sortir aujourd'hui d'un endroit si sauvage, Où les dieux ont horreur de vous voir endurer, Pour prendre des habits que j'ai fait préparer, Et vous feinure si viens que tome la jamille 3 Vous prenne à mon logis pour Druide et pour fille, Et me laissez le soin du reste absolument.
Celadon.	Céladon.
Quel bien dois-ie eſperer ſoubs ceſt habillement?	Quel bien dois-je espérer sous cet habillement?
diaulu De voir en peu de iours ſoulager voſtre flame.	diaulu De voir en peu de jours soulager votre flamme.
Celadon.	Céladon.
Ah!	Ah!
que i’ay de la peine à reſoudre mon ame.	que j'ai de la peine à résoudre mon âme.
Adamas.	Adamas.
Leonide reuient qui nous fera ſçauoir Tout ce que l’on a faict au funeſtre deuoir, Qu'Aſtree maintenant vient de vous faire rendre.	Léonide revient qui nous fera sçauoir Tout ce que l'on a fait au funêtre devoir, Qu'Astre maintenant vient de vous faire rendre.
Leonide.	Léonide.
Berger vous auriez tort de plus longtemps attendre A finir vos tourmens, en finiſſant les pleurs, Que voſtre Aſtree eſpand dans ſes iustes douleurs,	Berger vous auriez tort de plus longtemps attendre A finir vos tourments, en finissant les pleurs, Que votre Astre épand dans ses justes douleurs,
Celadon.	Céladon.
Elle m’a neantmoins commandé ceſte abſence,	Elle m'a néanmoins commandé cette absence,
Leonide.	Léonide.
Elle racheteroit bien cher voſtre preſence.	Elle rachèterait bien cher Roi présence.
