Ormin qui n’a que ſa Francine en teſte, & qui la cherche par tout, la rencontre fort empreſſée d’aller trouver le Roy.	Ormin qui n'a que sa Francine en tête, et qui la cherche par tout, la rencontre fort empressée d'aller trouver le Roi.
Il ne peut jouïr qu’un moment de ſon entretien, encore eſt-il forcé;	Il ne peut jouir qu'un moment de son entretien, encore est-il forcé;
ce moment toutefois qu’il paſſe avec elle, en fera paſſer de fort agreables à l’auditeur.	ce moment toutefois qu'il passe avec elle, en fera passer de fort agréables à l'auditeur.
Le Triomphe de Bélus, par terre, & de Timas en l’air, ſur des Gruës, ſe fait avec toute la pompe & toute la magnificence qui luy conviennent.	Le Triomphe de Bélus, par terre, et de Timas en l'air, sur des Grues, se fait avec toute la pompe et toute la magnificence qui avait conviennent.
Le ſpectacle en eſt d’autant plus curieux qu'ir ert rare & partieuner à ce Peuple.	Le spectacle en est d'autant plus curieux qu'ir ert rare et partieuner à ce Peuple.
Pluſieurs gens de qualité prevenans les réjoüiſſances publiques, dancent une Entrée de Balet tres-galante, aprés qu’un d’eux a chanté ce qui ſuit.	Plusieurs gens de qualité prévenants les réjouissances publiques, dancent une Entrée de Ballet très-galante, après qu'un d'eux a chanté ce qui suit.
CHANSON D'UNE PERSONNE DE ( VALITE’.	CHANSON D'UNE PERSONNE DE ( VALITE.
L’Amour a pour nous Des peines cruelles;	L'Amour a pour nous Des peines cruelles;
L’amour a pour nous Des plaiſirs bien doux:	L'amour a pour nous Des plaisirs bien doux:
Les Ames rebelles Souffrent ſes rigueurs;	Les Âmes rebelles Souffrent ses rigueurs;
Les Amans fidelles Goûtent ſes douceurs.	Les Amants fidèles Goûtent ses douceurs.
Fin du quatriéme Acte.	Fin du quatrième Acte.
ACIL CINVIESME.	ÀCIL CINVIESME.
V’EST dans un Palais beaucoup plus magnifique que le premier, enrichy de colomnes de lapis, de plumes d’oyſeaux de differentes couleurs, & autres choſes précieuſes, que ſe paſſe le dernier Acte.	V'EST dans un Palais beaucoup plus magnifique que le premier, enrichi de colomnes de lapis, de plumes d'oiseaux de différentes couleurs, et autres choses précieuses, que se passe le dernier Acte.
Sémiandre fait entendre au Roy, que ſon voyage aux Cieux eſt purement ſuppoſé, & que c’eſt une ruſe qu’il a pratiquée pour r’affermir le courage des Peuples, que les incidens fâcheux arrivez au Sacrifice avoient extrémement ébranlez;	Sémiandre fait entendre au Roi, que son voyage aux Cieux est purement supposé, et que c'est une ruse qu'il a pratiquée pour r'affermir le courage des Peuples, que les incidents fâcheux arrivez au Sacrifice avaient extrêmement ébranlez;
& pourtant que ſa machine luy a ſervy pour aller trouver Timas, avec qui il a toûjours eû commerce pendant ſon abſence, afin de le preſſer de s’approcher au plûtoſt, pour mettre au jour l’illuſtre entrepriſe dont le ſuccés eſt ſi favorable à la Patrie.	et pourtant que sa machine avoir a servi pour aller trouver Timas, avec qui il a toujours eû commerce pendant son absence, afin de le presser de s'approcher au plutôt, pour mettre au jour l'illustre entreprise dont le succès est si favorable à la Patrie.
Le Roy luy en ſçait bon gré, & commande à Microton de faire venir Pichonine.	Le Roi lui en sait bon gré, et commande à Microton de faire venir Pichonine.
Sémiandre s’entretient avec luy de la joye qu’il croit que cette Princeſſe doit reſſentir de ſon mariage avec Bélus, la croyant informée de la verité touchant le vainqueur & de la mort de Picolus:	Sémiandre s'entretient avec lui de la joie qu'il croit que cette Princesse doit ressentir de son mariage avec Bélus, la croyant informée de la vérité touchant le vainqueur et de la mort de Picolus:
mais il apprend que l’erreur de cette Princeſſe dure encore, & que le Roy l’y entretient exprés, pour la punir d’avoir eſté rebelle à ſes volontez, au ſujet de Picolus, qu’il luy parloit d’épouſer, dans le temps que luy-meſme le croyoit autheur de la victoire.	mais il apprend que l'erreur de cette Princesse dure encore, et que le Roi l'y entretient exprès, pour la punir d'avoir été rebelle à ses volontés, au sujet de Picolus, qu'il lui parlait d'épouser, dans le temps que lui-même le croyait auteur de la victoire.
Elle arrive avec Microton qui la conduit.	Elle arrive avec Microton qui la conduit.
Son pere la preſſe de préparer ſa main pour la donner au vainqueur;	Son père la presse de préparer sa main pour la donner au vainqueur;
elle y réſiſte autant qu’elle peut.	elle y résiste autant qu'elle peut.
Enfin, aprés avoir inutilement tenté les prieres 2 & les pleurs, elle luy préſente un poignard, & le conjure de le luy plonger dans le fein.	Enfin, après avoir inutilement tenté les prières 2 et les pleurs, elle lui prèsente un poignard, et le conjure de le vôtre plonger dans le sein.
Bélus ſe trouve à propos pour la déſarmer.	Bélus se trouve à propos pour la désarmer.
Ce n’eſt pas l’obliger dans le déſeſpoir où elle eſt, elle le fait bien connoître par les inſtances qu’elle fait à ce Prince de luy ravir le iour, ou de la délivrer d’un hymenée qui luy paroiſt plus terrible & plus cruel que la Mort.	Ce n'est pas l'obliger dans le désespoir où elle est, elle le fait bien connaître par les instances qu'elle fait à ce Prince de lui ravir le jour, ou de la délivrer d'un hyménée qui tu paraît plus terrible et plus cruel que la Mort.
Il eſt aiſé de penſer qu’il n’a point d’oreilles pour ces outrageantes prieres;	Il est aisé de penser qu'il n'a point d'oreilles pour ces outrageantes prières;
car comme il croit ſa maîtreſſe déſabuſée des faux bruits que Picolus avoit fait courre, & perſuadée de la verité, ainſi que toute la Cour, il s’applique toute la répugnance & toute l’averſion qu’elIe montre pour ce mariage, auquel il aſpire avec tant d’empreſſement, & ne peut conſentir à ſe trahir luy-meſme, en donnant les mains à la perfidie apparente qu’elle ſemble oppoſer à ſon ardeur fidele.	car comme il croit sa maîtresse désabusée des faux bruits que Picolus avait fait courre, et persuadée de la vérité, ainsi que toute la Cour, il s'applique toute la répugnance et toute l'aversion qu'élIe montre pour ce mariage, auquel il aspire avec tant d'empressement, et ne peut consentir à se trahir toujours-même, en donnant les mains à la perfidie apparente qu'elle semble opposer à son ardeur fidèle.
Pichonine prend ſon refus pour un ſenſible outrage, & le traite avec tout le mépris & toute l’indignation qu’elle croit luy devoir.	Pichonine prend son refus pour un sensible outrage, et le traite avec tout le mépris et toute l'indignation qu'elle croit lui devoir.
Il ne ſort point pour cela du reſpect;	Il ne sort point pour cela du respect;
il ſe plaint ſeulement de ce qu’elle n’a point eſté préſente au triomphe;	il se plaint seulement de ce qu'elle n'a point été présente au triomphe;
& en attribuë la cauſe au peu de cas qu’elle fait de ſa perſonne & de ſes feux.	et en attribue la cause au peu de cas qu'elle fait de sa personne et de ses feux.
Cette plainte l’oblige à luy faire valoir ce procedé comme une inſigne marque de ſon amour extrême;	Cette plainte l'oblige à lui faire valoir ce procédé comme une insigne marque de son amour extrême;
n’ayant pû, dit-elle, prendre plaiſir à voir ſon rival ( c’eſt Picolus dont elle entend parler) parmy les acclamations publiques, inſulter à leurs feux & dérober ſa gloire;	n'ayant pu, dit-elle, prendre plaisir à voir son rival ( c'est Polus dont elle entend parler) parmi les acclamations publiques, insulter à leurs feux et dérober sa gloire;
ny s’imaginer qu’il ait merité les honneurs qu’il a receus, & les lauriers dont on l’a couronné.	Ne s'imaginer qu'il ait mérité les honneurs qu'il a reçus, et les lauriers dont on l'a couronné.
Timas préſent à cét entretien, qui n’eſt point informé de l’erreur de cette Princeſſe, & qui vient de triompher avec Bélus, ſe fait une ſanglante injure de ce diſcours piquãt;	Timas présent à cet entretien, qui n'est point informé de l'erreur de cette Princesse, et qui vient de triompher avec Blus, se fait une sanglante injure de ce discours piquant;
il la traite auſſi, ſur tout, au ſujet de ce mot de rival, d’une maniere qu’on auroit peine à luy pardõner, ſi la préſence deParvulie ne l’excuſoit en quelque façon.	il la traite aussi, sur tout, au sujet de ce mot de rival, d'une manière qu'on aurait peine à nous pardonne, si la présence déParvulie ne l'excusait en quelque façon.
Pichonine en paroiſt toute ſurpriſe, d’autant plus qu’elle ne penſe point à ce Prince;	Pichonine en paraît toute surprise, d'autant plus qu'elle ne pense point à ce Prince;
& comme elle veut éclaircir toutes choſes, ſa ſœur l’entreprend & la pouſſe aſſez pour vanger ſon amour & ſes charmes qu’elle croit avoir eſté cruellement outragez.	et comme elle veut éclaircir toutes choses, sa sœur l'entreprend et la pousse assez pour venger son amour et ses charmes qu'elle croit avoir esté cruellement outragez.
Le Roy pouvoit épargner tous ces déplaiſirs à Pichonine;	Le Roi pouvait épargner tous ces déplaisirs à Pichonine;
mais il y ſemble prendre plaiſir.	mais il y semble prendre plaisir.
Elle en fait ceſſer une partie par la déclaration qu’elle fait, que ce qu’elle a dit juſqu’icy de déſobligeant, ne regarde ny ſa ſœur ny Timas, mais ſeulement Picolus;	Elle en fait cesser une partie par la déclaration qu'elle fait, que ce qu'elle a dit jusqu'ici de désobligeant, ne regarde ni sa sœur avait Timas, mais seulement Picolus;
& ſon pere la délivre de tous les autres en luy apprenant la mort de ce Prince, dont le nom ſeul luy a cauſé tant de maux & d’alarmes;	et son père la délivre de tous les autres en lui apprenant la mort de ce Prince, dont le nom seul lui a causé tant de maux et d'alarmes;
luy aſſûrant encore Bélus pour ſon époux.	Je assurant encore Bélus pour son époux.
Les tendres éclairciſſemens, les douces eſperances, la joye & les plaiſirs prennent la place des troubles, des chagrins, des larmes & des peines qui ont regné juſqu’à preſent.	Les tendres éclaircissements, les douces espérances, la joie et les plaisirs prennent la place des troubles, des chagrins, des larmes et des peines qui ont régné jusqu'à présent.
Le Roy ne veut plus entendre parler déſormais que de réjoüiſſance.	Le Roi ne veut plus entendre parler désormais que de réjoüissance.
Francine ſecondant ſes intentions, invite chacun à les ſuivre par ces paroles qu’elle chante.	Francine secondant ses intentions, invite chacun à les suivre par ces paroles qu'elle chante.
CHANSON DE FRANCINE.	CHANSON DE FRANCINE.
JoüiſſeZ, joüiſſez des charmes de la vie, Tandis qu’ils flatent vos deſirs;	JoüisseZ, jouissez des charmes de la vie, Tandis qu'ils flattent vos désirs;
Il n’eſt plus temps de goûter les plaiſirs, Lors qu'on en a paſſé l’envie:	Il n'est plus temps de goûter les plaisirs, Lors qu'on en a passé l'envie:
Les biens les plus charmãs perdent tous leurs appas, Du moment qu’ils ne plaiſent pas.	Les biens les plus charmands perdent tous leurs appas, Du moment qu'ils ne plaisent pas.
Si le Roy parle d’établir des jeux & des feſtes, c’eſt, ſur tout, pour y honorer le Monarque Dieu des François, & pour luy rendre grace de la glorieuſe protection, dont les Pygmées luy ſont redevables.	Si le Roi parle d'établir des jeux et des fêtes, c'est, sur tout, pour y honorer le Monarque Dieu des Français, et pour lui rendre grâce de la glorieuse protection, dont les Pygmées lui sont redevables.
Les Princes & les Princeſſes applaudiſſent ces nobles ſentimens.	Les Princes et les Princesses applaudissent ces nobles sentiments.
Mercure paroiſt en l’air, & leur témoigne que les Dieux les approuvent.	Mercure paraît en l'air, et leur témoigne que les Dieux les approuvent.
Voicy comme il s’explique.	Voici comme il s'explique.
DISCOURS DE MERCURE.	DISCOURS DE MERCURE.
Les Dieux viennent de tout entendre, Et je vous declare pour eux, Qu'ils ne prendront jamais pour une offence, Que vous inſtituiez, des feſtes & des jeux En l'honneur du Dieu?	Les Dieux viennent de tout entendre, Et je vous déclare pour eux, Qu'ils ne prendront jamais pour une offense, Que vous instituiez, des fêtes et des jeux En l'honneur du Dieu?
de la France;	de la France;
Que vous poußiez vers luy des vœux;	Que vous pouviez vers lui des vœux;
Et que vous l’adorieZ dan uet Fomptes fameux.	Et que vous l'adoriez dan uet Fomptes fameux.
Le Soleil traverſant le Ciel ſur ſon char, qu’il conduit en demi-cercle, le déclare en ſon particulier, avec des termes trés-obligeans.	Le Soleil traversant le Ciel sur son char, qu'il conduit en demi-cercle, le déclare en son particulier, avec des termes très-obligeans.
Ce ſont ceux qui ſuivent.	Ce sont ceux qui suivent.
DISCOURS DU SOLEIL.	DISCOURS DU SOLEIL.
Quant à moy, je luy céde en tout la préference;	Quant à moi, je croit cède en tout la préférence;
Et ſi les nuits, außi-bien que les jours, Ne ſervoient pas à ſon ardeur guerriere,	Et si les nuits, aussi-bien que les jours, Ne servaient pas à son ardeur guerrière,
D ij Dans le milieu de ma carriere, Souvent pour luy j’arreſterois mon cours.	 Déjà le milieu de ma carrière, Souvent pour lui j'arrêterais mon cours.
Le Soleil eſtant diſparu, Mercure recommence à parler de la ſorte.	Le Soleil étant disparu, Mercure recommence à parler de la sorte.
AUTRE DISCOURS DE MERCURE.	AUTRE DISCOURS DE MERCURE.
Quoy que de ma nature, Je ſois un peu fourbe & menteur, Le Soleil qui ne fût jamais un impoſteur, Fait voir que mon diſcours eſt la verité pure.	Quoi que de ma nature, Je sois un peu fourbe et menteur, Le Soleil qui ne fût jamais un imposteur, Fait voir que mon discours est la vérité pure.
Mars croit qu’il eſt de ſon devoir de faire la meſme choſe.	Mars croit qu'il est de son devoir de faire la même chose.
Il ſort du fonds de la Gloire, ſur ſon char, qu’il fait deſcendre à trois pieds de terre, & s’en acquite de fort bonne grace.	Il sort du fonds de la Gloire, sur son char, qu'il fait descendre à trois pieds de terre, et s'en acquite de fort bonne grâce.
Aprés quoy il remonte aux Cieux, vers le cintre, avec une telle rapidité, que la veuë a peine à la diſcerner.	Après quoi il remonte aux Cieux, vers le cintre, avec une telle rapidité, que la vue a peine à la discerner.
Jugez ſi Mars n’eſt pas pour le moins autant éloquent, qu’il eſt brave;	Jugez si Mars n'est pas pour le moins autant éloquent, qu'il est brave;
& conſultez pour cela les termes ſuivans, dont il ſe ſert.	et consultez pour cela les termes suivants, dont il se sert.
DISCOURS DE MARS.	DISCOURS DE MARS.
Moy pareillement je l’aßûre;	Moi pareillement je l'assure;
C’eſt bien à ma confuſion, Et je ſuis garant que Mercure Dit vray dans cette occaſion.	C'est bien à ma confusion, Et je suis garant que Mercure Dit vrai dans cette occasion.
Il peut encor plus dire;	Il peut encor plus dire;
Meſme, il en a permißion.	Même, il en a permission.
La France eſt à préſent un ſi célebre Empire, Que mes Co-éternels, s’il eſtoit queſtion De l'échanger ( par ſuppoſition) Contre leur ſejour qu’on admire, Ils recevroient bien-toſt la propoſition, T ſouſcrivãt, ſans doute, ils n’auroient pas du pire;	La France est à présent un si célèbre Empire, Que mes Co-éternels, s'il était question De l'échanger ( par supposition) Contre leur séjour qu'on admire, Ils recevraient bientôt la proposition, T souscrivãt, sans doute, ils n'auraient pas du pire;
Pour moy, je ne dirois pas non:	Pour moi, je ne dirais pas non:
Je me contenterois à moins ( l’oſay-je dire?	Je me contenterais à moins ( l'osai-je dire?
Je me contenterois de porter le grand nom Du Monarque Divin, qui.	Je me contenterais de porter le grand nom Du Monarque Divin, qui.
mais je me retire.	mais je me retire.
Mercure diſparoiſt au meſme inſtant que Mars, luy coupant chemin, par un vol hemi-ſphérique, tout contraire à celuy du Soleil.	Mercure disparaît au même instant que Mars, lui coupant chemin, par un vol hemi-sphérique, tout contraire à celui du Soleil.
Toute la Cour ſe retire pour aller joüir des plaiſirs qui luy ſont préparez.	Toute la Cour se retire pour aller jouir des plaisirs qui lui sont préparés.
Deux partis, l’un de Vignerons & l’autre de Bergers, font voir la part qu’ils prennent à la joye publique.	Deux partis, l'un de Vignerons et l'autre de Bergers, font voir la part qu'ils prennent à la joie publique.
Un des premiers chante ce qui ſuit.	Un des premiers chante ce qui suit.
CHANSON DES VIGNERONS.	CHANSON DES VIGNERONS.
ompagnons, guerre, guerre, guerre Contre l’amour & le chagrin;	ompagnons, guerre, guerre, guerre Contre l'amour et le chagrin;
Armons-nous du pot & du verre, Bachus conduit nôtre deſtin.	Armons-nous du pot et du verre, Bachus conduit notre destin.
Si quelque ſoin nous preſſe Dans ce combat divin, C’eſt qu’on tire ſans ceſſe Par tout des coups de vin.	Si quelque soin nous presse Dans ce combat divin, C'est qu'on tire sans cesse Par tout des coups de vin.
Les Vignerons dancent enſuite.	Les Vignerons dancent ensuite.
Le meſme chante ce ſecond couplet.	Le même chante ce second couplet.
SECOND GOOIEHI DA HI CHIANSON	SECOND GOIEHI DA HI CHIANSON
DES VIGNERONS.	DES VIGNERONS.
Combattons tous avec audace, Et cédons au nombre des coups;	Combattons tous avec audace, Et cédons au nombre des coups;
Il nous faut reſter ſur la place, Et demain nous revivrons tous:	Il nous faut rester sur la place, Et demain nous revivrons tous:
Quand il s’agit de boire, Les loix du Dieu Bachus Ne donnent la victoire Qu'à ceux qui ſont vaincus.	Quand il s'agit de boire, Les lois du Dieu Bachus Ne donnent la victoire Qu'à ceux qui sont vaincus.
Une lumiere toute ſurprenante, que la veuë ne peut preſque ſupporter, oblige le Roy & toute la Cour d’interrompre cette réjoüiſſance, pour chercher la cauſe de cette merveille.	Une lumière toute surprenante, que la vue ne peut presque supporter, oblige le Roi et toute la Cour d'interrompre cette réjouissance, pour chercher la cause de cette merveille.
Jupiter aſſis ſur ſon Trône, dans un ciel tout brillant de gloire, au milieu de tous les Dieux, la luy fait bien-toſt connoître, & luy confirme ce que Mereure luy a témoigné de leur part.	Jupiter assis sur son Trône, dans un ciel tout brillant de gloire, au milieu de tous les Dieux, la sens fait bientôt connaître, et lui confirme ce que Mère te a témoigné de leur part.
C’eſt ainſi qu’il en parle.	C'est ainsi qu'il en parle.
DISCOURS DE JUPITER.	DISCOURS DE JUPITER.
Tu vois au milieu de ſes Dieux Le Maître du Tonnerre.	Tu vois au milieu de ses Dieux Le Maître du Tonnerre.
Ils te confirment par ma voix, Ce que Mercure a dû te faire entendre Au ſujet du Dieu des François.	Ils te confirment par ma voix, Ce que Mercure a dû te faire entendre Au sujet du Dieu des Français.
Le Ciel prendroit le party qu’il faut prendre S’il ſe ſoûmettotr u jes tort.	Le Ciel prendrait le parti qu'il faut prendre S'il se soumettotr tort.
Ppies, Nous vous ſçaurons bon gré de luy bâtir des TemEt dans nos cœurs, au moins, nous ſuivrons vos exemples.	Ppies, Nous vous saurons bon gré de lui bâtir des TemEt dans nos cœurs, au moins, nous suivrons vos exemples.
N'ayeZ point de plus chers deſirs, Que de ſervir, tantoſt à ſes plaiſirs, Et tantoſt à chanter ſa gloire:	N'ayeZ point de plus chers désirs, Que de servir, tantôt à ses plaisirs, Et tantôt à chanter sa gloire:
Nous en ferons de meſme, & vous le devez croire.	Nous en serons de même, et vous le devez croire.
Que dans tout l’Univers, Et ſur la Terre, & dans les Airs, Cette nouvelle ſoit ſemée Par Mercure & la Renommée.	Que dans tout l'Univers, Et sur la Terre, et dans les Airs, Cette nouvelle soit semée Par Mercure et la Renommée.
Ces deux Divinitez obeïſſent incontinent à ſes ordres.	Ces deux Divinités obéissent incontinent à ses ordres.
Elles s’élancent, pour cét effet, du Ciel en terre;	Elles s'élancent, pour cet effet, du Ciel en terre;
s’élevent enſuite en l’air, formant un demy-rond, à l’oppoſite l’un de l’autre, & prennent enfin leur route, coſte à coſte, vers le Cintre, où elles ſe dérobent aux yeux des Spectateurs.	s'élevent ensuite en l'air, formant un demi-rond, à l'opposite l'un de l'autre, et prennent enfin leur route, côte à côte, vers le Cintre, où elles se dérobent aux yeux des Spectateurs.
Les Vignerons & les Bergers que la preſence du Roy & de la Coul avoit troublez dans leurs plaiſirs, recommencent leurs Jeux & leurs Chanſons, pour achever la réjoüiſſance publique & les divertiſſemens de la Piece.	Les Vignerons et les Bergers que la présence du Roi et de la Coul avait troublés dans leurs plaisirs, recommencent leurs Jeux et leurs Chansons, pour achever la réjouissance publique et les divertissements de la Pièce.
CHANSON DES VIGNERONS.	CHANSON DES VIGNERONS.
Heureux qui peut ſuivre Le Dieu des Tonneaux!	Heureux qui peut suivre Le Dieu des Tonneaux!
Le Vin ſeul nous livre Les biens ſans les maux.	Le Vin seul nous livre Les biens sans les maux.
Le plus doux Empire, Bachus, c’eſt le tien;	Le plus doux Empire, Bachus, c'est le tien;
Si l’on y ſoûpire, C’eſt d’eſtre trop bien.	Si l'on y soupire, C'est d'être trop bien.
Les Bergers jaloux des intereſts de leur Dieu, font chanter ſur le meſme air des Vignerons les paroles luivantes a la gloire de l’Amour.	Les Bergers jaloux des intérêts de leur Dieu, font chanter sur le même air des Vignerons les paroles luivantes à la gloire de l'Amour.
SECOND COUPLET CHANTE' PAR UN des Bergers ſur l’air des Vignerons.	SECOND COUPLET CHANTE PAR UN des Bergers sur l'air des Vignerons.
Soyons ſous les armes Du Dieu des amours;	Soyons sous les armes Du Dieu des amours;
Parlons de ſes charmes, Penſons-y toüjours:	Parlons de ses charmes, Pensons-y tendre:
Ainſi nôtre vie Dans tous ſes momens Se verra remplie De plaiſirs charmans.	Ainsi notre vie Dans tous ses moments Se verra remplie De plaisirs charmants.
Leuis agreables debats le teriiſient enfin par un heureux accord.	Levis agréables débats le teriisient enfin par un heureux accord.
Ces paroles qu’ils chantent d’un & d’autre party, en r’enferment les articles & les raiſons inconteſtables.	Ces paroles qu'ils chantent d'un et d'autre parti, en renferment les articles et les raisons incontestables.
TROISIESME COUPLET CHANTE' PAR LES Bergers & les Vignerons enſemble.	TROISIÈME COUPLET CHANTE PAR LES Bergers et les Vignerons ensemble.
Bachus ſur la terre Fût bien amoureux;	Bachus sur la terre Fût bien amoureux;
L’Amour & ſa Mere Boivent dans les Cieux:	L'Amour et sa Mère Boivent dans les Cieux:
Voulons-nous nous faire Un ſort plus heureux?	Voulons-nous nous faire Un sort plus heureux?
Ceſſons nôtre guerre, Et faiſons comme eux.	Cessons notre guerre, Et faisons comme eux.
L’entrée de Balet qu’ils dancent tous enſemble, eſt l’agrément qu’ils y donnent.	L'entrée de Ballet qu'ils dancent tous ensemble, est l'agrément qu'ils y donnent.
Fin du cinquiéme Acte	Fin du cinquième Acte
