PREFACE.	PRÉFACE.
Et je n’oſe vous dire a quelle cruauté Mithridate jaloux s’eſt ſouuent emporté.	Et je n'ose vous dire a quelle cruauté Mithridate jaloux s'est souvent emporté.
Peut-eſtre c’eſt moy ſeul que ſa fureur menaſſe.	Peut-être c'est moi seul que sa fureur menace.
Peut-eſtre en me perdant il veut vous faire grace.	Peut-être en me perdant il veut vous faire grâce.
Daignez, au nom des Dieux, daignez en profiter.	Daignez, au nom des Dieux, daignez en profiter.
Par de nouueaux refus n’allez point l’irriter.	Par de nouveaux refus n'allez point l'irriter.
Moins vous l’aimez, & plus taſchez de luy complaire.	Moins vous l'aimez, et plus tâchez de lui complaire.
Feignez.	Feignez.
Efforcez-vous.	Efforcez-vous.
Songez qu’il eſt mon Pere.	Songez qu'il est mon Père.
Viuez, & permettez que dans tous mes malheurs Ie puiſſe à voſtre amour ne couſter que des pleurs.	Vivez, et permettez que dans tous mes malheurs Je puisse à votre amour ne coûter que des pleurs.
MONIME.	MONIME.
Ah!	Ah!
je vous ay perdu.	je vous ai perdu.
XIPHARES.	XIPHARES.
Genereuſe Monime, Ne vous imputez point le malheur qui m’opprime.	Généreux Monime, Ne vous imputez point le malheur qui m'opprime.
Joſtre ſeule bonté n’eſt point ce qui me nuit.	Jotre seule bonté n'est point ce qui me nuit.
Ie ſuis vn Malheureux que le Deſtin pourſuit.	Je suis un Malheureux que le Destin poursuit.
C’eſt luy qui m’a rauy l’amitié de mon Pere, Qui le fit mon Riual, qui reuolta ma Mere, Et vient de ſuſciter dans ce moment affreux Vn ſecret Ennemy pour nous trahir tous deux.	C'est lui qui m'a ravi l'amitié de mon Père, Qui le fit mon Rival, qui révolta ma Mère, Et vient de susciter dans ce moment affreux Un secret Ennemi pour nous trahir tous deux.
dii e doa na Me Hé quoy?	dii e oa na Me Hé quoi?
Cet Ennemy vous l’ignorez encore?	Cet Ennemi vous l'ignorez encore?
XIPHARES.	XIPHARES.
Pour ſurcroiſt de douleur, Madame, je l’ignore.	Pour surcroît de douleur, Madame, je l'ignore.
Heureux!	Heureux!
ſi je pouuois auant que m’immoler, Percer le traiſtre cœur, qui m’a pû deceler.	si je pouvais avant que m'immoler, Percer le traître cœur, qui m'a pu déceler.
MONIME.	MONIME.
Hé bien, Seigneur, il faut vous le faire connaiſtre.	Hé bien, Seigneur, il faut vous le faire connaître.
Ne cherchez point ailleurs cet Ennemy, ce Traiſtre.	Ne cherchez point ailleurs cet Ennemi, ce Traître.
Frappez.	Frappez.
Aucun reſpect ne vous doit retenir.	Aucun respect ne vous doit retenir.
deptoutrait.	déptoutrait.
Et t eſt moy que vous ueuez panir,	Et t est moi que vous ueuez panir,
Vous!	Vous!
XIPHARES.	XIPHARES.
MONIME.	MONIME.
Ah ſi vous ſçauiez, Prince, auec quelle adreſſe Le Cruel eſt venu ſurprendre ma tendreſſe!	Ah si vous savez, Prince, avec quelle adresse Le Cruel est venu surprendre ma tendresse!
Quelle amitié ſincere il affectoit pour vous !	Quelle amitié sincère il affectait pour vous !
Content, s’il vous voyoit deuenir mon Eſpoux.	Content, s'il vous voyait devenir mon Époux.
Qui n’auroit crû.	Qui n'aurait cru.
Mais non, mon amour plus timide Deuoit moins vous liurer à ſa bonté perſide.	Mais non, mon amour plus timide Deuait moins vous livrer à sa bonté persid.
Les Dieux qui m’inſpiroient, & que j’ay mal ſuiuis, M’ont fait taire trois fois par de ſecrets auis.	Les Dieux qui m'inspiraient, et que j'ai mal suivis, M'ont fait taire trois fois par de secrets avis.
I’ay dû continuer.	J'ai dû continuer.
I’ay dû dans tout le reſte.	J'ai dû dans tout le reste.
Que ſçay-je enfin?	Que sais-je enfin?
I’ay dû vous eſtre moins funeſtas I’ay dû craindre du Roy les dons empoiſonnez, Et je men puihtay nvous me pardonnez.	J'ai dû vous être moins funestas J'ai dû craindre du Roi les dons empoisonnés, Et je men puihai nvous me pardonnez.
XIPHARES.	XIPHARES.
Ouoy, Madame?	Ouvoy, Madame?
C’eſt vous, c’eſt l’amour qui m’expoMon malheur eſt party d’vne ſi belle cauſe?	C'est vous, c'est l'amour qui m'expoMon malheur est parti d'une si belle cause?
Trop d’amour a trahy nos ſecrets amoureux?	Trop d'amour a trahi nos secrets amoureux?
Et vous vous excuſez de m’auoir fait heureux?	Et vous vous excusez de m'avoir fait heureux?
Que voudrois-je de plus?	Que voudrais-je de plus?
Glorieux, & fidelle, Ie meurs.	Glorieux, et fidèle, Je meurs.
Vn autre ſoit ua trone vous appelle.	Un autre soit ua trone vous appelle.
Conſentez-y, Madame.	Consentez-y, Madame.
Et ſans plus reſiſter Acheuez vn hymen, qui vous y fait monter.	Et sans plus résister Achevez un hymen, qui vous y fait monter.
ſe!	se!
MONIME.	MONIME.
Quoy vous me demandez que j’épouſe vn Barbare, Dont l’odieux amour pour jamais nous ſepare?	Quoi vous me demandez que j'épouse un Barbare, Dont l'odieux amour pour jamais nous sépare?
AIIHARES.	ÀIIHARES.
Songez, que ce matin ſoûmiſe à ſes ſouhaits Vous deuiez l’épouſer, & ne me voir jamais.	Songez, que ce matin soumise à ses souhaits Vous deviez l'épouser, et ne me voir jamais.
MONIME.	MONIME.
Et connoiſſois-je alors toute ſa barbarie?	Et connaissais-je alors toute sa barbarie?
Ne voudriez-vous point qu’approuuant ſa furie, Apres vous auoir veû tout percé de ſes coups, Ie ſuiuiſſe à l’Autel vn tyrannique Eſpoux, Et que dans vne main de voſtre ſang fumante I’allaſſe mettre, helas!	Ne voudriez-vous point qu'approuvant sa furie, Après vous avoir vu tout percé de ses coups, Je suivisse à l'Autel un tyrannique Espoux, Et que dans une main de votre sang fumante J'allasse mettre, hélas!
la main de voſtre Amante?	la main de votre Amante?
Allez, de ſes fureurs ſongez à vous garder, Sans perdre icy le temps à me perſuader.	Allez, de ses fureurs songez à vous garder, Sans perdre ici le temps à me persuader.
Le Ciel m’inſpirera quel party je doy prendre.	Le Ciel m'inspirera quel parti je dois prendre.
Que ſeroit-ce, grãds Dieux!	Que serait-ce, grand Dieux!
s’il venoitvous ſurprédre!	s'il venaitvous surprédre!
Que dis-je?	Que dis-je?
On vient.	On vient.
Allez.	Allez.
Courez.	Courez.
Viuez enfin, Et du moins attendez quel ſera mon deſtin.	Vivez enfin, Et du moins attendez quel sera mon destin.
SCENE III.	SCÈNE III.
MONIME, PHOEDIME.	MONIME, PHONEDIME.
PHOEDIME.	PHOEDIME.
Adame, a quels perils il expoloit ia vie!	Adame, a quels périls il expolait ja vie!
NVI C’eſt le Roy.	NVI C'est le Roi.
MONIME.	MONIME.
Cours l’aider à cacher ſa ſortie.	Cours l'aider à cacher sa sortie.
Va, ne le quitte point.	Va, ne le quitte point.
Et qu’il ſe garde bien P’ordonner de ſon ſort, ſans eſtre inſtruit du mien.	Et qu'il se garde bien P'ordonner de son sort, sans être instruit du mien.
SCENE IV.	SCÈNE IV.
MTTIRIDATE, MONIME,	MTTIRIDATE, MONIME,
MITHRIDATE.	MITHRIDATE.
Llons, Madame, allons.	Llons, Madame, allons.
Vne raiſon ſecrette IYMe fait quitter ces lieux, & haſter ma retraitte.	Une raison secrète IYMe fait quitter ces lieux, et hâter ma retraite.
Tandis que mes ſoldats preſts à ſuiure leur Roy Rentrent dans mes vaiſſeaux, pour partir auec moy Venez, & qu’à l’Autel ma promeſſe accomplie Par des nœuds eternels l’vn à l’autre nous lie.	Tandis que mes soldats prêts à suivre leur Roy Entrent dans mes vaisseaux, pour partir avec moi Venez, et qu'à l'Autel ma promesse accomplie Par des nœuds éternels l'un à l'autre nous lie.
MONIME.	MONIME.
Nous, Seigneur?	Nous, Seigneur?
MITHRIDATE.	MITHRIDATE.
Quoy, Madame, olez-vous balancer?	Quoi, Madame, olez-vous balancer?
MONIME.	MONIME.
Et ne m’auez-vous pas défendu d’y penſer?	Et ne m'avez-vous pas défendu d'y penser?
MTIIRIDATE.	MTIIRIDATE.
I’eûs mes raiſons alors.	J'éus mes raisons alors.
Oublions-les, Madame.	Oublions-les, Madame.
Ne ſongez maintenant qu’à répondre à ma flamme.	Ne songez maintenant qu'à répondre à ma flamme.
Songez que voſtre cœur eſt vn bien qui m’eſt dû.	Songez que votre cœur est un bien qui m'est dû.
MONIME.	MONIME.
Hé pourquoy donc, Seigneur, me l’auez-vous rendul	Hé pourquoi donc, Seigneur, me l'avez-vous rendul
MITHRIDATE.	MITHRIDATE.
Quoy pour vn Fils ingrat toûjours préoccupée Vous cromiez.	Quoi pour un Fils ingrat toujours préoccupée Vous cromiez.
MONIME.	MONIME.
Quey, Selgneur:	Que, Selgneur:
Vous m’auriez donc trompée?	Vous m'auriez donc trompée?
MITHRIDATE.	MITHRIDATE.
Perfide!	Perfide!
Il vous ſied bien de tenir ce diſcours.	Il vous sied bien de tenir ce discours.
Vous, qui gardant au cœur d’infidelles amours, Quand je vous éleuois au comble de la gloire M’auez des trahiſons preparé la plus noire.	Vous, qui gardant au cœur d'infidèles amours, Quand je vous élevais au comble de la gloire M'avez des trahisons préparé la plus noire.
Ne vous ſouuient-il plus, cœur ingrat & ſans foy, Plus que tous les Romains conjuré contre moy, De quel rang glorieux j’ay bien voulu deſcendre, Pour vous porter au trône, où vous n’oſiez prétẽdre?	Ne vous souvient-il plus, cœur ingrat et sans foi, Plus que tous les Romains conjuré contre moi, De quel rang glorieux j'ai bien voulu descendre, Pour vous porter au trône, où vous n'osiez prétẽdre?
Ne me regardez point vaincu, perſecuté.	Ne me regardez point vaincu, persécuté.
Reuoyez-moy vainqueur, & par tout redouté.	Revoyez-moi vainqueur, et par tout redouté.
Songez de quelle ardeur dans Epheſe adorée, Aux Filles de cent Rois je vous ay preferée!	Songez de quelle ardeur dans Ephese adorée, Aux Filles de cent Rois je vous ai préférée!
Et negligeant pour vous tant d’heureux Alliez, Quelle foule d’Eſtats je mettois à vos piez.	Et négligeant pour vous tant d'heureux Alliés, Quelle foule d'États je mettais à vos pieds.
Ah!	Ah!
ſi d’vn autre amour le panchant inuincible Dés lors à mes bontez vous rendoit inſenſible, Sans chercher de ſi loin vn odieux Eſpoux, Auant que de partir, pourquoy vous taiſiez-vous?	si d'un autre amour le penchant invincible Dès lors à mes bontés vous rendait insensible, Sans chercher de si loin un odieux Époux, Avant que de partir, pourquoi vous taisiez-vous?
Attendiez-vous pour faire vn aueu ſi funeſte Que le ſort ennemy m’euſt rauy tout le reſte;	Attendiez-vous pour faire un aveu si funeste Que le sort ennemi m'eût ravi tout le reste;
Et que de toutes parts me voyant accabler, l'euſſe en vous le ſeul bien qui me puſt conſoler?	Et que de toutes parts me voyant accabler, l'eusse en vous le seul bien qui me pût consoler?
Cependant quand je veux oublier cet outrage, Eecacher à mon cœur cette funeſte image, Vous oſez à mes yeux rappeller le paſſé, Vous m’accuſez encor, quand ie ſuis offenſé.	Cependant quand je veux oublier cet outrage, Eecacher à mon cœur cette funeste image, Vous osez à mes yeux rappeler le passé, Vous m'accusez encor, quand ie suis offensé.
Ie voy que pour vn Traiſtre vn fol eſpoir vous flatte A quelle épreuue, ô Ciel!	Je vois que pour un Traître un fol espoir vous flatte À quelle épreuve, ô Ciel!
reduis-tu Mithridate!	réduis-tu Mithridate!
Par quel charme ſecret laiſſay-je retenir Ce courroux ſi ſeuere, & ſi promt à punir?	Par quel charme secret laissai-je retenir Ce courroux si sévère, et si promt à punir?
Profitez du moment que mon amour vous donne.	Profitez du moment que mon amour vous donne.
Pour la derniere fois venez, je vous l’ordonne.	Pour la dernière fois venez, je vous l'ordonne.
N’attirez point ſur vous des perils ſuperflus, Pour vn Fils inſolent que vous ne verrez plus.	N'attirez point sur vous des périls superflus, Pour un Fils insolent que vous ne verrez plus.
Sans vous parer pour luy d’vne foy qui m’eſt duë, reruer enia ilemoire, auſſi-bien que la vuë.	Sans vous parer pour lui d'une foi qui m'est due, reruer enya ilemoire, aussi-bien que la vue.
Et deſormais ſenfible à ma ſeule bonté, Meritez le pardon qui vous eſt preſenté.	Et désormais sensible à ma seule bonté, Mérités le pardon qui vous est présenté.
MONIME.	MONIME.
Ie n’ay point oublié quelle reconnoiſſance, Seigneur, m’a dû ranger ſous voſtre obeïſſance.	Je n'ai point oublié quelle reconnaissance, Seigneur, m'a dû ranger sous votre obéissance.
Quelque rang où jadis ſoient montez mes Ayeux, Leur gloire de ſi loin n’éblouït point mes yeux.	Quelque rang où jadis soient montez mes Aïeux, Leur gloire de si loin n'éblouit point mes yeux.
Ie ſonge auec reſpect de combien je ſuis née Au deſſous des grandeurs d’vn ſi noble hymenée.	Je songe avec respect de combien je suis née Au dessous des grandeurs d'un si noble hyménée.
Et malgré mon panchant, & mes premiers deſſeins Pour vn Fils, apres vous, le plus grand des humains, Du jour qu’on m’impoſa pour vous ce Diadême, Ie renonçay, Seigneur, à ce Prince, à moy-meſme.	Et malgré mon penchant, et mes premiers desseins Pour un Fils, après -vous, le plus grand des humains, Du jour qu'on m'imposa pour vous ce Diadme, Je renonçai, Seigneur, à ce Prince, à moi-même.
Tous deux d’intelligence à nous ſacrifier, Loin de moy par mon ordre il couroit m’oublier.	Tous deux d'intelligence à nous sacrifier, Loin de moi par mon ordre il courait m'oublier.
Dans l’ombre du ſecret ce feu s’alloit éteindre.	Dans l'ombre du secret ce feu s'allait éteindre.
Et meſme de mon ſort je ne pouuois me plaindre, Puiſqu’enfin aux dépens de mes vœux les plus doux, Ie faiſois le bon-heur d’vn Heros tel que vous.	Et même de mon sort je ne pouvais me plaindre, Puisqu'enfin aux dépens de mes vœux les plus doux, Je faisais le bonheur d'un Héros tel que vous.
Vous ſeul, Seigneur, vous ſeul, vous m’auez arraA cette obeïſſance, où j’eſtois attachée.	Vous seul, Seigneur, vous seul, vous m'avez arraA cette obéissance, où j'étais attachée.
[ chée Et ce fatal amour, dont j’auois triomphé, Ce feu que dans l’oubly je croyois étouffé, Dont la cauſe à jamais s’éloignoit de ma veuë, Vos détours l’ont ſurpris, & m’en ont conuaincuë, Ie vous l’ay confeſſé, je le doy ſoûtenir.	[ chée Et ce fatal amour, dont j'avais triomphé, Ce feu que dans l'oubli je croyais étouffé, Dont la cause à jamais s'éloignait de ma vue, Vos détours l'ont surpris, et m'en ont conuaincuë, Je vous l'ai confessé, je le dois soutenir.
En vain vous en pourriez perdre le ſouuenir, Et cet aueu honteux, où vous m’auez forcée Demeurera toûjours préſent à ma penſée.	En vain vous en pourriez perdre le souvenir, Et cet aveu honteux, où vous m'avez forcée Demeurera toujours présent à ma pensée.
Toûjours je vous croirois incertain de ma foy.	Toujours je vous croirais incertain de ma foi.
Et le Tombeau, Seigneur, eſt moins triſte pour moy, Que le lit d’vn Eſpoux, qui m’a fait cet outrage, Qui s’eſt acquis ſur moy ce cruel auantuge, Et qui me préparant vn éternel ennuy, M’afait rougir d’vn feu, qui n’eſtoit pas pour luy.	Et le Tombeau, Seigneur, est moins triste pour moi, Que le lit d'un Époux, qui m'a fait cet outrage, Qui s'est acquis sur moi ce cruel avantuge, Et qui me préparant un éternel ennui, M'afait rougir d'un feu, qui n'était pas pour lui.
MITHRIDATE.	MITHRIDATE.
C'eſt uonc voitre reponſe.	C'est onc voitre réponse.
Et ſans plus me complaire Vous refuſez l’honneur que je voulois vous faire.	Et sans plus me complaire Vous refusez l'honneur que je voulais vous faire.
Penſez-y bien.	Pensez-y bien.
I’attens pour me déterminer.	J'attends pour me déterminer.
MONIME.	MONIME.
Non, Seigneur, vainement vous croyez m’étonner.	Non, Seigneur, vainement vous croyez m'étonner.
Ie vous connoy.	Je vous connais.
Ie ſçay tout ce que je m’appreſte.	Je sais tout ce que je m'apprête.
Et je voy quels malheurs j’aſſemble ſur ma teſte.	Et je vois quels malheurs j'assemble sur ma tête.
Mais le deſſein eſt pris.	Mais le dessein est pris.
Rien ne peut m’ébranler, Iugez-en, puis qu’ainſi je vous oſe parler, Et m’emporte au delà de cette modeſtie Dont juſqu’à ce moment je n’eſtois point ſortie.	Rien ne peut m'ébranler, Jugez-en, puis qu'ainsi je vous ose parler, Et m'emporte au delà de cette modestie Dont jusqu'à ce moment je n'étais point sortie.
Vous vous eſtes ſeruy de ma funeſte main Pour mettre à voſtre Fils vn poignard dans le ſein.	Vous vous êtes servi de ma funeste main Pour mettre à votre Fils un poignard dans le sein.
De ſes feux innocens j’ay trahi le myſtere.	De ses feux innocents j'ai trahi le mystère.
Et quand il n’en perdroit que l’amour de ſon Pere, Il en mourra, Seigneur.	Et quand il n'en perdrait que l'amour de son Père, Il en mourra, Seigneur.
Ma foy, uy mon amour Ne ſeront point le prix d’vn ſi cruel détour.	Ma foi, ui mon amour Ne seront point le prix d'un si cruel détour.
Apres cela jugez.	Après cela jugez.
Perdez vne Rebelle.	Perdez une Rebelle.
Armez-vous du pouuoir qu’on vous donna ſur elle.	Armez-vous du pouvoir qu'on vous donna sur elle.
I’attendray mon arreſt, vous pouuez commander.	J'attendrai mon arrêt, vous pouvez commander.
Tout ce qu’en vous quittant j’oſe vous demander, Croyez (à la vertu je doy cette juſtice) Que je vous trahis ſeule, & n’ay point de complice.	Tout ce qu'en vous quittant j'ose vous demander, Croyez (à la vertu je dois cette justice) Que je vous trahis seule, et n'ai point de complice.
Et que d’vn plein effet vos vœux ſeroient ſuiuis, oi j'en cioyois, ceignieur, no redumae tortre Fils,	Et que d'un plein effet vos vœux seraient suivis, oi j'en cioyais, ceignieur, nô reduma tortre Fils,
SCENE V.	SCÈNE V.
MITHRIDATE.	MITHRIDATE.
Lle me quitte!	Lle me quitte!
Et moy dans vn laſche ſilence, LIe ſemble de ſa fuite approuuer l’inſolence?	Et moi dans un lâche silence, LIe semble de sa fuite approuver l'insolence?
Peu s’en faut que mon cœur panchant de ſon coſté Ne me condanne encor de trop de cruauté?	Peu s'en faut que mon cœur penchant de son côté Ne me condamne encor de trop de cruauté?
Qui ſuis-je?	Qui suis-je?
Eſt-ce Monime?	Est-ce Monime?
Et ſuis-je Mithridate?	Et suis-je Mithridate?
Non non, plus de pardon, plus d’amourpour l’Ingrate, Ma colere reuient, & je me reconnoîs.	Non non, plus de pardon, plus d'amourpour l'Ingrate, Ma colère revient, et je me reconnaiss.
Immolons en partant trois Ingrats à la fois.	Immolons en partant trois Ingrats à la fois.
Ie vais à Rome, & c’eſt par de tels ſacrifices Qu’il faut à ma fureur rendre les Dieux propices.	Je vais à Rome, et c'est par de tels sacrifices Qu'il faut à ma fureur rendre les Dieux propices.
Ie le doy, je le puis, ils n’ont plus de ſupport.	Je le dois, je le puis, ils n'ont plus de support.
Les plus ſeditieux ſont déja loin du bord.	Les plus séditieux sont déjà loin du bord.
Sans diſtinguer entre-eux qui je hais, ou qui j’aime, Allons, & commençons par Xipharés luy-meſme.	Sans distinguer entre-eux qui je hais, ou qui j'aime, Allons, et commençons par Xipharés avoir-même.
Mais quelle eſt ma fureur?	Mais quelle est ma fureur?
Et qu’eſt-ce que je dis?	Et qu'est-ce que je dis?
Tu vas ſacrifier, qui, mal-heureux?	Tu vas sacrifier, qui, malheureux?
ton Fils?	ton Fils?
Vn Fils que Rome craint?	Un Fils que Rome craint?
qui peut vanger ſon Pere?	qui peut venger son Père?
Pourquoy répandre vn ſang qui m’eſt ſi neceſſaire?	Pourquoi répandre un sang qui m'est si nécessaire?
Ah!	Ah!
dans l’eſtat funeſte où ma chute m’a mis, Eſt-ce que mon mal-heur m’a laiſſé trop d’amis?	dans l'état funeste où ma chute m'a mis, Est-ce que mon malheur m'a laissé trop d'amis?
Songeons plûtoſt, ſongeons à gagner ſa tendreſſe.	Songeons plutôt, songeons à gagner sa tendresse.
I’ay beſoin d’vn Vangeur, & non d’vne Maiſtreſſe.	J'ai besoin d'Han Nangeur, et non d'une Maîtresse.
Quoy?	Quoi?
Ne vaut-il pas mieux, puis qu’il faut m’en priLa ceder à ce Fils, que je veux conſeruer?	Ne vaut-il pas mieux, puis qu'il faut m'en priLa céder à ce Fils, que je veux conserver?
[uer, Cedons la.	[uer, Cédons la.
Vains efforts!	Vains efforts!
qui ne font que m’inſtruire Desfoibleſſes d’vn cœur qui cherche à ſe ſeduire!	qui ne font que m'instruire Desfoiblesses d'un cœur qui cherche à se séduire!
Ie brûle, je l’adore, & loin de la bannir.	Je brûle, je l'adore, et loin de la bannir.
Ah!	Ah!
c’eſt vn crime encor dont je la veux punir.	c'est un crime encor dont je la veux punir.
Mon amour trop long-temps tient ma gloire captiue.	Mon amour trop longtemps tient ma gloire captive.
Qn’elle periſſe ſeule, & que mon Fils:	Qu'elle périsse seule, et que mon Fils:
me ſuiue.	me suive.
Vn peu de fermeté puniſſant ſes refus Me va mettre en eſtat de ne la craindre plus.	Un peu de fermeté punissant ses refus Me va mettre en état de ne la craindre plus.
Quelle pitié retient mes ſentimens timides?	Quelle pitié retient mes sentiments timides?
N’en ay-je pas déja puny de moins perfides.	N'en ai-je pas déjà puni de moins perfides.
O Monime!	Ô Monime!
ô mon Fils!	ô mon Fils!
inutile courroux!	inutile courroux!
Et vous heureux Romains!	Et vous heureux Romains!
quel triomphe pour vous, Si vous ſçauiez ma honte, & qu’vn auis fidelle De mes laſches combats vous portaſt la nouuelle!	quel triomphe pour vous, Si vous saviez ma honte, et qu'un avis fidèle De mes lâches combats vous portât la nouvelle!
Quoy?	Quoi?
des plus cheres mains craignant les trahiſons, I’ay pris ſoin de m’armer contre tous les poiſons;	des plus chères mains craignant les trahisons, J'ai pris soin de m'armer contre tous les poisons;
I’ay ſceû par vne longue & penible induſtrie Des plus mortels venins préuenir la furie.	J'ai su par une longue et pénible industrie Des plus mortels venins prévenir la furie.
Ah!	Ah!
qu’il euſt mieux valu, plus ſage, & plus heureux, Et repouſſant les traits d’vn amour dangereux, Ne pas laiſſer remplir d’ardeurs empoiſonnées Vn cœur déja glacé par le froid des années?	qu'il eût mieux valu, plus sage, et plus heureux, Et repoussant les traits d'un amour dangereux, Ne pas laisser remplir d'ardeurs empoisonnées Un cœur déjà glacé par le froid des années?
De ce trouble fatal par où dois je ſortir?	De ce trouble fatal par où dois je sortir?
SCENE VI.	SCÈNE VI.
MITHRIDATE, ARBATE,	MITHRIDATE, ARBATE,
ARBATE.	ARBATE.
Dignour, ou ros foldats ne veulent plus partir.	Dignour, ou ros soldats ne veulent plus partir.
y Avpharnace les retient.	y Avpharnace les retient.
l'harnace leur reuele Que vous cherchez à Rome vne guerre nouuelle.	l'harnace leur révèle Que vous cherchez à Rome une guerre nouvelle.
Pharnace?	Pharnace?
MTTARIDATE.	MTTARIDATE.
ARBATE.	ARBATE.
Il a ſeduit ſes gardes les premiers, Et le ſeul nom de Rome étonne les plus fiers.	Il a séduit ses gardes les premiers, Et le seul nom de Rome étonne les plus fiers.
De mille affreux perils ils ſe forment l’image.	De mille affreux périls ils se forment l'image.
Les vns auec trauſport embraſſent le riuage.	Les uns était trausport embrassent le rivage.
Les autres qui partoient s’élancent dans les flots, Ou preſentent leurs dards aux yeux des matelots.	Les autres qui partaient s'élancent dans les flots, Ou vent leurs dards aux yeux des matelots.
Le uciorure eit par tout.	Le uciorure eit par tout.
Et ion de nous entendre Ils demandent la Paix, & parlent de ſe rendre.	Et ion de nous entendre Ils demandent la Paix, et parlent de se rendre.
Pharnace eſt à leur teſte, & flattant leurs ſouhaits De la part des Romains il leur promet la Paix.	Pharnace est à leur tête, et flattant leurs souhaits De la part des Romains il leur promet la Paix.
MITHRIDATE.	MITHRIDATE.
Ah le Traiſtre!	Ah le Traître!
Courez.	Courez.
Qu’on appelle ſon Frere.	Qu'on appelle son Frère.
Qu’il me ſuiue, qu’il vienne au ſecours de ſon Pere.	Qu'il me suive, qu'il vienne au secours de son Père.
ARBATE.	ARBATE.
I'ignore ſon deſſein.	J'ignore son dessein.
Mais vn ſoudain tranſport.	Mais un soudain transport.
L’a déja fait deſcendre, & courir vers le Port.	L'a déjà fait descendre, et courir vers le Port.
Et l’on dit que ſuiuy d’vn gros d’Amis fidelles on ruveû ſe meſler au milieu des Rebelles.	Et l'on dit que suivi d'une gros d'Amis fidèles on ruve se mêler au milieu des Rebelles.
c eit tout ce que jeniģais.	ç cit tout ce que jeniģais.
MITHRIDATE.	MITHRIDATE.
Ah!	Ah!
Qu’eſt-ce que j’entens?	Qu'est-ce que j'entends?
Perfides, ma vangeance a tardé trop long-temps.	Perfides, ma vengeance a tardé trop longtemps.
Mais je ne vous crains point.	Mais je ne vous crains point.
Malgré leur inſolence Les Mutins n’oſeroient ſoûtenir ma preſence.	Malgré leur insolence Les Mutins n'oseraient soutenir ma présence.
Ie ne veux que les voir, je ne veux qu’à leurs yeux Immoler de ma main deux Fils audacieux.	Je ne veux que les voir, je ne veux qu'à leurs yeux Immoler de ma main deux Fils audacieux.
SCENE VII.	SCÈNE VII.
MITHRIDATE, ARBATE, ARCAS.	MITHRIDATE, ARBATE, ARCAS.
ARCAS.	ARCAS.
Eigneur, tout eſt perdu.	Eigneur, tout est perdu.
Les Rebelles, Pharnace, S Les Romains ſont en foule autour de cette Place.	Les Rebelles, Pharnace, S Les Romains sont en foule autour de cette Place.
MTIHRIDATE.	MTIHRIDATE.
Les Romains!	Les Romains!
M de enS.	M de enS.
De Romains le riuage eſt chargé, Et bien toſt dans ces Murs vous eſtes aſſiegé.	De Romains le rivage est chargé, Et bien tôt dans ces Murs vous êtes assiégé.
MTIHRIDATE.	MTIHRIDATE.
224r Ciel!	224r Ciel!
Churons.	Churons.
Hoouter D a mal-heur qui me preſſe tas, Tu ne joüiras pas infidelle Princeſſe.	Hoter DAS pas malheur qui me presse tas, Tu ne jouiras pas infidèle Princesse.
