PREFACE.	PRÉFACE.
Aines.	Aines.
Et ioûtenant l’honneur de vos Ayeux, Dahs cet embraſſement receuez mes Adieux,	Et joutenant l'honneur de vos Aïeux, Dahs cet embrassement recevez mes Adieux,
Seigneur.	Seigneur.
PHARNACE.	PHARNACE.
MITHRIDATE.	MITHRIDATE.
Ma volonté, Prince, vous doit ſuffire, Obeïſſez.	Ma volonté, Prince, vous doit suffire, Obéissez.
C’eſt trop vous le faire redire.	C'est trop vous le faire redire.
PHARNACE.	PHARNACE.
Seigneur, ſi pour vous plaire il ne faut que perir, Plus ardant qu’aucun autre on m’y verra courir.	Seigneur, si pour vous plaire il ne faut que périr, Plus ardant qu'aucun autre on m'y verra courir.
Combattant à vos yeux pemmettez que je meure.	Combattant à vos yeux pemmettez que je meure.
MITHRIDATE.	MITHRIDATE.
Ie vous ay commandé de partir tout à l’heure.	Je vous ai commandé de partir tout à l'heure.
Mais apres ce moment.	Mais après ce moment.
Prince, vous m’entendez, Et vous eſtes perdu ſi vous me répondez.	Prince, vous m'entendez, Et vous êtes perdu si vous me répondez.
PHARNACE.	PHARNACE.
Seigneur, duſt-on offrir mille morts à ma veuë, Ie ne ſçaurois chercher vne Fille inconnuë.	Seigneur, dût-on offrir mille morts à ma vue, Je ne saurais chercher une Fille inconnue.
Ma vie eſt en vos mains.	Ma vie est en vos mains.
MITHRIDATE.	MITHRIDATE.
Ah!	Ah!
c’eſt où je t’attens.	c'est où je t'attends.
Tu ne ſçaurois partir, Perfide, & je t’entens.	Tu ne saurais partir, Perfide, et je t'entends.
Ie ſçay pourquoy tu fuis l’Hymen où je t’enuoye.	Je sais pourquoi tu fuis l'Hymen où je t'envoie.
Il te faſche en ces lieux d’abandonner ta proye.	Il te fâche en ces lieux d'abandonner ta proie.
Monime te retient.	Monime te retient.
Ton amour criminel Prétendoit l’arracher à l’Hymen paternel.	Ton amour criminel Prétendait l'arracher à l'Hymen paternel.
Ny l’ardeur dont tu ſçais que je l’ay recherchée, Ny déja ſur ſon front ma Couronne attachée, Ny cet azile meſme où je la fais garder, Ny mon juſte courroux n’ont pû t’intimider.	Ni l'ardeur dont tu sais que je l'ai recherchée, Ni déjà sur son front ma Couronne attachée, Ni cet asile même où je la fais garder, Ni mon juste courroux n'ont pu t'intimider.
Traiſtre, pour les Romains tes laſches complaiſances N’eſtoient pas à mes yeux d’aſſez noires offenſes.	Traître, pour les Romains tes lâches complaisances N'étaient pas à mes yeux d'assez noires offenses.
Il te manquoit encor ces perfides amours Pour eſtre le ſupplice & l’horreur de mes jours.	Il te manquait encor ces perfides amours Pour être le supplice et l'horreur de mes jours.
Loin de t’en repentir, je voy ſur ton viſage Que ta confuſion ne part que de ta rage.	Loin de t'en repentir, je vois sur ton visage Que ta confusion ne part que de ta rage.
Il te tarde déja qu’échappé de mes mains Tu ne coures me perdre, & me vendre aux Romains Mais auant que partir je me feray juſtice.	Il te tarde déjà qu'échappé de mes mains Tu ne coures me perdre, et me vendre aux Romains Mais avant que partir je me ferai justice.
Ie te l’ay dit.	Je te l'ai dit.
SCENE II.	SCÈNE II.
MITHRIDATE, PHARNACE.	MITHRIDATE, PHARNACE.
XIPHARES.	XIPHARES.
Gardes.	Gardes.
MITHRIDATE.	MITHRIDATE.
I TOla, Gardes.	I TOla, Gardes.
Ou on le ſaiſiſſe.	Ou on le saisisse.
Ouy, luy-meſme, Pharnace.	Oui, Seigneur-même, Pharnace.
Allez, & de ce pas Qu’enfermé dans la Tour on ne le quitte pas.	Allez, et de ce pas Qu'enfermé dans la Tour on ne le quitte pas.
PHARNACE.	PHARNACE.
Hé bien!	Hé bien!
Sans me parer d’vne innocence vaine, Il eſt vray mon amour merite voſtre haine.	Sans me parer d'une innocence vaine, Il est vrai mon amour mérite votre haine.
I’aime.	J'aime.
L’on vous a fait vn fidelle recit.	L'on vous a fait un fidèle récit.
Mais Xipharés, Seigneur, ne vous a pas tout dit.	Mais XXpharez, Seigneur, ne vous a pas tout dit.
C’eſt le moindre ſecret qu’il pouuoit vous apprẽdre, Et ce Fils ſi fidelle a dû vous faire entendre, Que des meſmes ardeurs dés long-temps enflammé, Il aime auſſi la Reine, & meſme en eſt aimé.	C'est le moindre secret qu'il pouvait vous apprendre, Et ce Fils si fidèle a dû vous faire entendre, Que des mêmes ardeurs dès longtemps enflammé, Il aime aussi la Reine, et même en est aimé.
SCENE III.	SCÈNE III.
MTTHRIDATE, XIPTIARES.	MTTHRIDATE, XIPTIARES.
XIPHARES.	XIPHARES.
NEigneur, le croirez-vous qu’vn deſſein ſi couS pable.	NEigneur, le croirez-vous qu'un dessein si couS pable.
MITHRIDATE.	MITHRIDATE.
Mon Fils, je ſçay dequoy voſtre Frere eſt capable.	Mon Fils, je sais dequoy votre Frère est capable.
Me preſerue le Ciel de ſoupçonner iamais, Que d’vn prix ſi cruel vous payez mes bien-faits, Qu'vn Fils, qui fut tousjours le bon-heur de ma vie, Ait pu percer ce cœur qu'vn Pere luy conne.	Me preserve le Ciel de soupçonner jamais, Que d'un prix si cruel vous payez mes bienfaits, Qu'un Fils, qui fut toujours le bonheur de ma vie, Ait pu percer ce cœur qu'un Pere lui conne.
Ie ne le croiray point.	Je ne le croirai point.
Allez.	Allez.
Loin d’y ſonger, Ie ne vas deſormais penſer qu’à nous vanger.	Loin d'y songer, Je ne vas désormais penser qu'à nous venger.
SCENE IV.	SCÈNE IV.
MIT HRIDATE.	MIT HRIDATE.
JE ne le croiray point?	JE ne le croirai point?
Vain eſpoir qui me flatte!	Vain espoir qui me flatte!
ITu ne le crois que trop, malheureux Mithridate, Xipharés mon Riual?	ITu ne le crois que trop, malheureux Mithridate, Xipharés mon Rival?
Et d’accord auec luv La Reine auroit oſé me tromper aujourd’huy?	Et d'accord avec luv La Reine aurait osé me tromper aujourd'hui?
Quoy?	Quoi?
De quelque coſté que ie tourne la veuë, La foy de tous les cœurs eſt pour moy diſparuë?	De quelque côté que ici tourne la vue, La foi de tous les cœurs est pour moi disparue?
Tout m’abandonne ailleurs?	Tout m'abandonne ailleurs?
Tout me trahit icy?	Tout me trahit ici?
Pharnace, Amis, Maiſtreſſe?	Pharnace, Amis, Maîtresse?
Et toy, mon Fils, auſſi!	Et toi, mon Fils, aussi!
Toy de qui la vertu conſolant ma diſgrace.	Toi de qui la vertu consolant ma disgrâce.
Mais ne connois-ie pas le perfide Pharnace?	Mais ne connais-je pas le perfide Pharnace?
Quelle foibleſſe à moy d’en croire vn Furieux Qu’arme contre ſon Frere vn deſſein enuieux.	Quelle faiblesse à moi d'en croire un Furieux Qu'arme contre son Frère un dessein envieux.
Ou dont le deſeſpoir me troublanr par des fables Groſſit pour ſe ſauuer le nombre des coupables?	Ou dont le désespoir me troublanr par des fables Grossit pour se sauver le nombre des coupables?
Non, ne l’en croyons point.	Non, ne l'en croyons point.
Et ſans trop nous preſſer, Voyons, examinons.	Et sans trop nous presser, Voyons, examinons.
Mais par où commencer?	Mais par où commencer?
Qui m’enéclaircira?	Qui m'enéclaircira?
Quels témoins?	Quels témoins?
Quel indice?	Quel indice?
Le Ciel en ce moment m’inſpire vn artifice.	Le Ciel en ce moment m'inspire un artifice.
Qu’on appelle la Reine.	Qu'on appelle la Reine.
Ouy, ſans aller plus loin.	Oui, sans aller plus loin.
Ie veux l’oüir.	Je veux l'ouïr.
Mon choix s’arreſte à ce témoinL’amour auidement croit tout ce qui le flatte.	Mon choix s'arrête à ce témoinL'amour avidement croit tout ce qui le flatte.
Qui peut de sõ vainqueur mieux parler que l’Ingrate?	Qui peut de son vainqueur mieux parler que l'Ingrate?
Voyons, qui ſon amour accuſera des deux, S’il n’eſt digne de moy, le piege eſt digne d’eux.	Voyons, qui son amour accusera des deux, S'il n'est digne de moi, le piège est digne d'eux.
Trompons qui nous trahit.	Trompons qui nous trahit.
Et pour connoiſtre vn Traiſtre, Il n’eſt point de moyens.	Et pour connaître un Traître, Il n'est point de moyens.
Mais ie la voy paraiſtre.	Mais ici la vois paraître.
Feignons.	Feignons.
Et de ſon cœur d’vn vain eſpoir flatté Par vn menſonge adroit tirons la verité.	Et de son cœur d'un vain espoir flatté Par un mensonge adroit tirons la vérité.
SCENE V.	SCÈNE V.
MITHRIDAIE, MONIME.	MITHRIDAIE, MONIME.
MITHRIDATE.	MITHRIDATE.
Nfin j’ouure les yeux, & je me fais juſtice.	Nfin j'ouvre les yeux, et je me fais justice.
LC’eſt faire à vos beautez vn triſte ſacrifice, Que de vous preſenter, Madame, auec ma foy Tout l’âge, & le malheur que je traiſne auec moy.	LC'est faire à vos beautés un triste sacrifice, Que de vous présenter, Madame, avec ma foi Tout l'âge, et le malheur que je traîne était moi.
Iuſqu’icy la Fortune, & la Victoire mêmes Cachoient mes cheueux blãcs ſous trente Diadêmes.	Jusqu'ici la Fortune, et la Victoire mêmes Cachaient mes cheveux blants sous trente Diadêmes.
Mais ce temps-là n’eſt plus.	Mais ce temps-là n'est plus.
Ie regnois, & je fuis.	Je régnais, et je fuis.
Mes ans ſe ſont accrus.	Mes ans se sont accrus.
Mes honneurs ſont détruis.	Mes honneurs sont détruis.
Et mon front dépoüillé d’vn ſi noble auantage Du Temps, qui l’a flétri, laiſſe voir tout l’outrage.	Et mon front dépouillé d'être si noble avantage Du Temps, qui l'a flétri, laisse voir tout l'outrage.
D’ailleurs mille deſſeins partagent mes eſprits.	D'ailleurs mille desseins partagent mes esprits.
D’vn Camp preſt à partir vous entendez les cris.	D'un Camp prêt à partir vous entendez les cris.
Sortant de mes Vaiſſeaux, il faut que j’y remonte.	Sortant de mes Vaisseaux, il faut que j'y remonte.
Quel temps pour vn Hymen, qu’vne fuite ſi pronte, Madame !	Quel temps pour un Hymen, qu'une fuite si prompte, Madame !
Et de quel front vous vnir à mon ſort, Quand je ne cherche plus que la guerre & la mort?	Et de quel front vous unir à mon sort, Quand je ne cherche plus que la guerre et la mort?
Ceſſez pourtant, ceſſez de prétendre à Pharnace.	Cessez pourtant, cessez de prétendre à Pharnace.
Quand je me fais juſtice, il faut qu’on ſe la faſſe.	Quand je me fais justice, il faut qu'on se la fasse.
Ie ne ſouffriray point que ce Fils odieux, Que je viens pour jamais de bannir de mes yeux, Poſſedant vne amour, qui me fut déniée, Vous faſſe des Romains deuenir l’Alliée.	Je ne souffrirai point que ce Fils odieux, Que je viens pour jamais de bannir de mes yeux, Possédant une amour, qui me fut déniée, Vous fasse des Romains devenir l'Alliée.
Mon Trône vous eſt dû.	Mon Trône vous est dû.
Loin de m’en repentir, le vous y place meſme, auant que de partir;	Loin de m'en repentir, le vous y place même, avant que de partir;
Pourueû que vous vouliez, qu’vne main qui m’eſt chere, Vn Fils, le digne objet de l’amour de ſon Pere, Xipharés en vn mot deuenant voſtre Eſpoux, me vange de Phamnace, & m’acquitte enuers vous.	Pourvu que vous vouliez, qu'une main qui m'est chère, Un Fils, le digne objet de l'amour de son Père, Xipharez en un mot devenant votre Époux, me venge de Phamnace, et m'acquitte envers vous.
MONIME.	MONIME.
Aipharés!	Aipharez!
Luy, Seigneur?	Lui, Seigneur?
MITHRIDATE.	MITHRIDATE.
Ouy luy-meſme, Madame.	Oui quel-même, Madame.
D’où peut naiſtre à ce nom le trouble de voſtre ame?	D'où peut naître à ce nom le trouble de votre âme?
Contre vn ſi juſte choix qui peut vous reuolter?	Contre un si juste choix qui peut vous révolter?
Eſt-ce quelque mépris qu’on ne puiſſe donter?	Est-ce quelque mépris qu'on ne puisse donter?
Ie le repete encor.	Je le répète encor.
C’eſt vn autre moy-meſme, Vn Fils victorieux, qui me cherit, que j’aime, L’Ennemy des Romains, l’Heritier, & l’appuy DvnEmplle, a d’vn Ivoi qui va renaiitre en luy.	C'est un autre moi-même, Un Fils victorieux, qui me chérit, que j'aime, L'Ennemi des Romains, l'Héritier, et l'appui DEmplle, a d'un Juvoi qui va renaiitre en lui.
Et quoy que voſtre amour ait oſé ſe promettre, Ce n’eſt qu’entre ſes mains que je puis vous remettre,	Et quoi que votre amour ait osé se promettre, Ce n'est qu'entre ses mains que je puis vous remettre,
MONIME.	MONIME.
Que dites-vous?	Que dites-vous?
O Ciel!	Ô Ciel!
Pourriez-vous approuuer.	Pourriez-vous approuver.
Pourquoy, Seigneur, pourquoy voulez-vous m’éprouuer?	Pourquoi, Seigneur, pourquoi voulez-vous m'éprouver?
Ceſſez de tourmenter vne ame infortunée.	Cessez de tourmenter une âme infortunée.
Ie ſçay que c’eſt à vous que je fus deſtinée.	Je sais que c'est à vous que je fus destinée,
Ie ſçay qu’en ce moment pour ce nœud ſolennel La Victime, Seigneur, nous attend à l’Autel.	Je sais qu'en ce moment pour ce nœud solennel La Victime, Seigneur, nous attend à l'Autel.
Venez.	Venez.
MITHRIDATE.	MITHRIDATE.
Ie le voy bien, quelque effort que je faſſe, Madame, vous voulez vous garder à Pharnace.	Je le vois bien, quelque effort que je fasse, Madame, vous voulez vous garder à Pharnace.
Ie reconnoy toûjours vos injuſtes mépris.	Je reconnais toujours vos injustes mépris.
Ils ont meſme paſſé ſur mon malheureux Fils.	Ils ont même passé sur mon malheureux Fils.
Ie le mépriſe!	Je le méprise!
MONIME.	MONIME.
MITHRIDATE.	MITHRIDATE.
Hé bien!	Hé bien!
n’en parlons plus, Madame.	n'en parlons plus, Madame.
Continüez.	Continuer.
Brûlez d’vne honteuſe flamme.	Brûlés d'une honteuse flamme.
Tandis qu’auec mon Fils je vais loin de vos yeux Chercher au bout du monde vn trépas glorieux;	Tandis qu'avec mon Fils je vais loin de vos yeux Chercher au bout du monde un trépas glorieux;
Vous cependant icy ſeruez auec ſon Frere, Et vendez aux Romains le ſang de voſtre Pere.	Vous cependant ici servez avec son Frère, Et vendez aux Romains le sang de votre Père.
Venez.	Venez.
Ie ne ſçaurois mieux punir vos dédains, Qu’envous mettãt moy-meſme en ſes ſeruiles mains.	Je ne saurais mieux punir vos dédains, Qu'envous mettãt moi-même en ses serviles mains.
Et lalis pius me chaiger uu rom de voitre gloire, Ie veux laiſſer de vous juſqu’à voſtre memoire.	Et lalis pius me chaiger u rom de voitre gloire, Je veux laisser de vous jusqu'à votre mémoire.
Allons, Madame, allons.	Allons, Madame, allons.
Ie m’en vais vous vnir.	Je m'en vais vous unir.
MONIME.	MONIME.
Plûtoſt de mille morts duſſiez-vous me punir.	Plutôt de mille morts dussiez-vous me punir.
MITHRIDATE.	MITHRIDATE.
Vous reſiſtez en vain, & j’entens voſtre fuite.	Vous résistez en vain, et j'entends votre fuite.
MONIME.	MONIME.
En quelle extremité, Seigneur, ſuis-je reduite?	En quelle extrémité, Seigneur, suis-je réduite?
Mais enfin je vous crois, & je ne puis penſer Qu’à feindre ſi long-temps vous puiſſiez vous forcer.	Mais enfin je vous crois, et je ne puis penser Qu'à feindre si longtemps vous puissiez vous forcer.
Les Dieux me ſont témoins, qu’à vous plaire bornée, Mon ame à tout ſon ſort s’eſtoit abandonnée.	Les Dieux me sont témoins, qu'à vous plaire bornée, Mon âme à tout son sort s'était abandonnée.
Mais ſi quelque foibleſſe auoit pû m’allarmer, Si de tous ſes efforts mon cœur a dû s’armer;	Mais si quelque faiblesse avait pu m'alarmer, Si de tous ses efforts mon cœur a dû s'armer;
Ne croyez point, Seigneur, qu’auteur de mes allarmes Pharnace m’ait jamais couſté les moindres larmes.	Ne croyez point, Seigneur, qu'auteur de mes alarmes Pharnace m'ait jamais coûté les moindres larmes.
Ce Fils victorieux que vous fauoriſez, Cette viuante image en qui vous vous plaiſez, Cet Ennemy de Rome, & cet autre vous-meſme Ennn ce Xipharés que vous voulez que j’aime.	Ce Fils victorieux que vous favorisez, Cette vivante image en qui vous vous plaisez, Cet Ennemi de Rome, et cet autre vous-même Enn ce Xipharez que vous voulez que j'aime.
MITHRIDATE.	MITHRIDATE.
Vous l’aimez?	Vous l'aimez?
MONIME.	MONIME.
Si le ſort ne m’euſt donnée à vous, Mon bon-heur dépendoit de l’auoir poui Eipoux;	Si le sort ne m'eût donnée à vous, Mon bonheur dépendait de l'avoir pouy Eipoux;
Auant que voſtre amour m’euſt enuoyé ce gage, Nous nous aimiõs.	Avant que votre amour m'eût envoyé ce gage, Nous nous aimiõs.
Seigneur, vous chãgez de viſage!	Seigneur, vous changgez de visage!
MITHRIDATE.	MITHRIDATE.
Non, Madame.	Non, Madame.
Il ſuffit.	Il suffit.
Ie vais vous l’enuoyer.	Je vais vous l'envoyer.
Allez.	Allez.
Le temps eſt cher.	Le temps est cher.
Il le faut employer.	Il le faut employer.
Ie voy qu’à m’obeïr vous eſtes diſpoſée, Ie ſuis vament.	Je vois qu'à m'obéir vous êtes disposée, Je suis vament.
MONIME en s’en allant.	MONIME en s'en allant.
O Ciel!	Ô Ciel!
Me ſerois-je abuſée?	Me serais-je abusée?
GN E	GN É
MITHRIDATE.	MITHRIDATE.
Ls s’aiment.	Ls s'aiment.
C’eſt ainſi qu’on ſe joüoit de nous.	C'est ainsi qu'on se jouait de nous.
IAh Fils ingrat!	IAh Fils ingrat!
Tu vas me répondre pour tous.	Tu vas me répondre pour tous.
Tu periras.	Tu périras.
Ie ſçay combien ta Renomiée, Et tes fauſſes vertus ont ſeduit mon Armée.	Je sais combien ta Renomiée, Et tes fausses vertus ont séduit mon Armée.
Perfide, je te veux porter des coups certains.	Perfide, je te veux porter des coups certains.
Il faut, pour te mieux perdre, écarter les mutins.	Il faut, pour te mieux perdre, écarter les mutins.
Et faiſant à mes yeux partir les plus Rebelles, Ne garder prés de moy que des troupes fidelles.	Et faisant à mes yeux partir les plus Rebelles, Ne garder près de moi que des troupes fidèles.
Allons.	Allons.
Mais ſans monſtrer vn viſage offenſé, Diſſimulons encor, comme j’ay commencé.	Mais sans montrer un visage offensé, Dissimulons encor, comme j'ai commencé.
Fin du troiſiéme Acte.	Fin du troisième Acte.
E ij	E ij
RCTET 2 SCENE PREMIERE.	RCTET 2 SCÈNE PREMIÈRE.
MONIME, PHOEDIME.	MONIME, PHONEDIME.
MONIME.	MONIME.
HOEDIME, au nom des Dieux, fay ce que je deſire.	HODIME, au nom des Dieux, fais ce que je désire.
Va voir ce qui ſe paſſe, & reuien me le dire.	Va voir ce qui se passe, et revien me le dire.
Ie neſçay.	Je nesçai.
Mais mon cœur ne ſe peut raſſurer.	Mais mon cœur ne se peut rassurer.
Mille ſoupçons affreux viennent me déchirer.	Mille soupçons affreux viennent me déchirer.
Que tarde Xipharés?	Que tarde XXipharez?
Et d’où vient qu’il differe A ſeconder des vœux qu’autorize ſon Pere?	Et d'où vient qu'il diffère A seconder des vœux qu'autorise son Père?
Son Pere en me quittant me l’alloit enuoyer.	Son Père en me quittant me l'allait envoyer.
Mais il feignoit peut-eſtre, il falloit tout nier.	Mais il feignait peut-être, il fallait tout nier.
Le Roy feignoit?	Le Roi feignait?
Et moy découurant ma pehſée.	Et moi découvrant ma pehsée.
O Dieux!	Ô Dieux!
En ce peril m’auriez-vous delaiſſée?	En ce péril m'auriez-vous délaissée?
Et ſe pourroit-il bien qu’à ſon reſſentiment Mon amour indiſcret euſt liuré mon Amant?	Et se pourrait-il bien qu'à son ressentiment Mon amour indiscret eût livré mon Amant?
Quoy, Prince!	Quoi, Prince!
quãd tout plein de ton amour extréme, Pour ſçauoir mon ſecret tu me preſſois toy-même, Mes refus trop cruels vingt fois te l’ont caché, Ie t’ay meſme puny de l’auoir arraché;	quand tout plein de ton amour extrême, Pour savoir mon secret tu me pressais toi-même, Mes refus trop cruels vingt fois te l'ont caché, Je t'ai même puni de l'avoir arraché;
Et quand de toy peut eſtre vn Pere ſe défie, Que dis je?	Et quand de toi peut être un Père se défie, Que dis -je?
quand peut-eſtre il y va de ta vie, le parit;	quand peut-être il y va de ta vie, le parit;
& trop facile à me laiſſer tromper, Ie luy marque le cœur où ſa main doit frapper.	et trop facile à me laisser tromper, Je lui marque le cœur où sa main doit frapper.
PHOEDIME.	PHOEDIME.
Ah!	Ah!
traitez-le, Madame, auec plus de juſtice.	traitez-le, Madame, avec plus de justice.
Vn grand Roy deſcend-il juſqu’à cet artifice?	Un grand Roi descend-il jusqu'à cet artifice?
A prendre ce détour qui l’auroit pû forcer?	À prendre ce détour qui l'aurait pu forcer?
Sans murmure, à l’Autel vous l’alliez deuancer.	Sans murmure, à l'Autel vous l'alliez devancer.
Vouloit-il perdre vn Fils qu’il aime auec tendreſſe?	Voulait-il perdre un Fils qu'il aime avec tendresse?
Iuſqu’icy les effets ſecondent ſa promeſſe.	Jusqu'ici les effets secondent sa promesse.
Madame, il vous diſoit qu’vn important deſſein Malgré luy le forçoit à vous quitter demain.	Madame, il vous disait qu'Hommes important dessein Malgré lui le forçait à vous quitter demain.
Ce ſeul deſſein l’occupe, & haſtant ſon voyage, Luy-meſme ordonne tout préſent ſur le riuage.	Ce seul dessein l'occupe, et hâtant son voyage, Lui-même ordonne tout prèsent sur le rivage.
Ses vaiſſeaux en tous lieux ſe chargent de ſoldats, Et par tout Xipharés accompagne ſes pas.	Ses vaisseaux en tous lieux se chargent de soldats, Et par tout Xipharés accompagne ses pas.
D'vn Riual en fureur eſt-ce là la conduite?	D'un Rival en fureur est-ce là la conduite?
Et voit-on ſes diſcours démentis par la ſuite?	Et voit-on ses discours démentis par la suite?
MONIME.	MONIME.
Pharnace cependant par ſon ordre arreſté Trouue en luy d’vn Riual toute la dureté.	Pharnace cependant par son ordre arrêté Trouve en était d'un Rival toute la dureté.
Phœdime, à Xipharés fera-t’il plus de grace?	Phœdime, à Xipharés fera-t-il plus de grâce?
PHOEDIME.	PHOEDIME.
C’eſt l’amy des Romains qu’il punit en Pharnace.	C'est l'ami des Romains qu'il punit en Pharnace.
L’amour a peu de part à ſes juſtes ſoupçons.	L'amour a peu de part à ses justes soupçons.
MONIME.	MONIME.
Autant que je le puis, je cede à tes raiſons.	Autant que je le puis, je cède à tes raisons.
E iij Elles calment vn peu l’ennuy qui me deuore.	 Ejà Elles calment un peu l'ennui qui me dévore.
Mais pourtant Xipharés ne paroiſt point encore.	Mais pourtant XXipharez ne paraît point encore.
PHOEDIME.	PHOEDIME.
Vaine erreur des Amans, qui pleins de leurs deſirs Voudroient que tout cedaſt au ſoin de leurs plaiſirs!	Vaine erreur des Amants, qui pleins de leurs désirs Voudraient que tout cédât au soin de leurs plaisirs!
Qui preſts à s’irriter contre le moindre obſtacle.	Qui prêts à s'irriter contre le moindre obstacle.
MONIME.	MONIME.
Ma Phœdime, & qui peut conceuoir ce miracle?	Ma Phœdime, et qui peut concevoir ce miracle?
Apres deux ans d’ennuis, dont tu ſçais tout le pois, Quoy je puis reſpirer pour la premiere fois?	Après deux ans d'ennuis, dont tu sais tout le pois, Quoi je puis respirer pour la première fois?
Quoy, cher Prince, auec toy, je me verrois vnie?	Quoi, cher Prince, avec toi, je me verrais unie?
Et loin que ma tendreſſe euſt expoſé ta vie, Tu verrois ton deuoir, je verrois ma vertu Approuuer vn amour ſi long-temps combattu?	Et loin que ma tendresse eût exposé ta vie, Tu verrais ton devoir, je verrais ma vertu Approuver un amour si longtemps combattu?
Ie pourrois tous les jours t’aſſurer que je t’aime?	Je pourrais tous les jours t'assurer que je t'aime?
Que ne viens-tu.	Que ne viens-tu.
SCENE II.	SCÈNE II.
MONIME, XIPHARES, PHOEDIME.	MONIME, XIPHARES, PHODIME.
MONIME.	MONIME.
SEigneur, je parlois de vous-meſme.	SEigneur, je parlais de vous-même.
Mon ame ſouhaittoit de vous voir en ce lieu, Pour vous.	Mon âme souhaitait de vous voir en ce lieu, Pour vous.
ATTHARES.	ATTHARES.
C’eſt maintenant qu’il faut vous dire adieu,	C'est maintenant qu'il faut vous dire adieu,
Adieu!	Adieu!
vous?	vous?
MONIME.	MONIME.
XIPHARES.	XIPHARES.
Ouy, Madame, & pour toute ma vie,	Oui, Madame, et pour toute ma vie,
MONIME.	MONIME.
Qu’entẽs-je?	Qu'entends-je?
On me diſoit.	On me disait.
Helas!	Hélas!
ils m’ont trahie.	ils m'ont trahie.
XIPHARES.	XIPHARES.
Madame, je ne ſçay quel Ennemy couuert Reuelant nos ſecrets vous trahit, & me perd.	Madame, je ne sais quel Ennemi couvert Revelant nos secrets vous trahit, et me perd.
Mais le Roy, qui tantoſt n’en croyoit point Pharnace, Maintenant dans nos cœurs ſçait tout ce qui ſe paſſe.	Mais le Roi, qui tantôt n'en croyait point Pharnace, Maintenant dans nos cœurs soupait tout ce qui se passe.
E iiij Il feint, il me careſſe, & cache ſon deſſein.	 iiij Il feint, il me caresse, et cache son dessein.
Mais moy, qui dés l’enfance éleué dans ſon fein.	Mais moi, qui dès l'enfance élevé dans son sein.
De tous ſes mouuemens ay trop d’intelligence, I’ay lû dans ſes regards ſa prochaine vangeance.	De tous ses mouvements ai trop d'intelligence, J'ai lu dans ses regards sa prochaine vengeance.
Il preſſe, il fait partir tous ceux, dont mon malheur Pourroit à la reuolte exciter la douleur.	Il presse, il fait partir tous ceux, dont mon malheur Pourrait à la révolte exciter la douleur.
De ſes fauſſes bontez j’ay connu la contrainte.	De ses fausses bontés j'ai connu la contrainte.
Vn mot meſme d’Arbate a confirmé ma crainte, Il a ſceû m’aborder, & les larmes aux yeux.	Un mot même d'Arbate a confirmé ma crainte, Il a su m'aborder, et les larmes aux yeux.
On ſçait tout, m’a-t’il dit, ſauuez-vous de ces lieux, Ce mot m’a fait fremir du peril de ma Reine.	On sais tout, m'a-t-il dit, sauvez-vous de ces lieux, Ce mot m'a fait frémir du péril de ma Reine.
Et ce cher intereſt eſt le ſeul qui m’ameine.	Et ce cher intérêt est le seul qui m'amène.
Ie vous crains pour vous-meſme, & je viens à genoux Vous prier, ma Princeſſe, & vous fléchir pour vous.	Je vous crains pour vous-même, et je viens à genoux Vous prier, ma Princesse, et vous fléchir pour vous.
Vous dépendez icy d’vne main violente, Que le ſang le plus cher rarement eſpouuante.	Vous dépendez ici d'une main violente, Que le sang le plus cher rarement épouvante.
