Vous me rendeZ touſiours aſſez de témoignage, Et de vos paßions, & de voſtre ſeruage;	Vous me rendez toujours assez de témoignage, Et de vos passions, et de votre servage;
Eſt-ce là de quel ſoing vous-vous en détacheZ?	Est-ce là de quel soing vous-vous en détachez?
diamequuuaſ ce papier?	diamquuas ce papier?
ANTHONIE.	ANTHONIE.
Quel?	Quel?
THEODORE, prenant la lettre de Beliſſaire dans la manche d’Anthonie.	THÉODORE, prenant la lettre de Bélissaire dans la manche d'Anthonie.
Que vous me cachez?	Que vous me cachez?
ANTHONIE.	ANTHONIE.
THEODORE.	THÉODORE.
Ie ſuis femme, & l’obſtacle m’anime;	Je suis femme, et l'obstacle m'anime;
Aux eſprits curieux vn refus eſt vn crime;	Aux esprits curieux un refus est un crime;
N'irritez point le mien.	N'irritez point le mien.
AN PIIUNIE.	AN PIIUNIE.
La curioſité N &i pas la paßion dont il eſt agite,	La curiosité N eti pas la passion dont il est agite,
Et quelle donc?	Et quelle donc?
THODORE.	THODORE.
ANTHONE.	ANTHONE.
L’enuie ye amrt jormtude!	L'envie ie amrt jormude!
Que tu m’eſt importune, & que ton ioug eſt rude!	Que tu m'est importune, et que ton joug est rude!
Elle s’en va en colere.	Elle s'en va en colère.
M iij	M Mijà
{.	§.
THEODORE, ſeule.	THÉODORE, seule.
E vous feray laiſſer ſur voſtre liberté, TL’honneur d'vne abſoluë & plaine authorité.	E vous ferai laisser sur votre liberté, TL'honneur d'une absolue et plaine autorité.
Enfin tu reconnois, chetiue Souueraine, Qu'außi bien que l’effet, la feinte encor t’eſt vaine;	Enfin tu reconnais, chétive Souveraine, Qu'avez bien que l'effet, la feinte encor t'est vaine;
Que ſans fruict le menſonge entreprend aujourd’huy, Ce que la verité n'a pù gaigner ſur luy;	Que sans fruit le mensonge entreprend aujourd'hui, Ce que la vérité n'a pù gagner sur lui;
Que de ce fier rocher toute approche eſt bannie, Et que ſans difference, hors celuy d’Anthonie, Il foule tous les cœurs à ſes pieds abatus, Et tient de grands mépris pour de grandes vertus:	Que de ce fier rocher toute approche est bannie, Et que sans différence, hors celui d'Antonie, Il foule tous les cœurs à ses pieds abatus, Et tient de grands mépris pour de grandes vertus:
Eſſayons toutefois vn moyen qui ſuccede, A nouuel accident trouuons nouueau remede;	Essayons toutefois un moyen qui succède, A nouvel accident trouvons nouveau remède;
Aſſeurons, en vengeans vn amour irrité, Et noſtre bonne eſtime, & noſtre authorité;	Assurons, en vengeants un amour irrité, Et notre bonne estime, et notre autorité;
Nuiſons ſans repugnance à qui nous pourroit nuire, Détruiſons vn geant, qui nous pourroit détruire;	Nuisons sans répugnance à qui nous pourrait nuire, Détruisons un géant, qui nous pourrait détruire;
I'ay dequoy triomfer de ce ſuperbe eſprit, lettre de Le ſort m’offre à propos vne arme en cét eſcrit.	J'ai dequoy triomfer de ce superbe esprit, lettre de Le sort m'offre à propos une arme en cet écrit.
Leurs plus ſecrets penſers, leur propre intelligence, Quand ie perds tout eſpoir, s'offrent à ma vengeance;	Leurs plus secrets pensers, leur propre intelligence, Quand tu perds tout espoir, s'offrent à ma vengeance;
Voicy dequoy détruire, & dequoy renuerſer Ce Coloſſe orgueilleux, ſi fort à terraſſer, Contre qui la fureur n’a que de vaines armes, Et pour qui l’Amour meſme a d’inutiles charmes:	Voici dequoy détruire, et dequoy renverser Ce Colosse orgueilleux, si fort à terrasser, Contre qui la fureur n'a que de vaines armes, Et pour qui l'Amour même a d'inutiles charmes:
Commen çons donc l’ouurage, ô mes iuſtes douleurs, Fourniſſez-moy de cris, de ſanglots & de pleurs;	Commen çons donc l'ouvrage, ô mes justes douleurs, Fournissez-moi de cris, de sanglots et de pleurs;
Intereſſez mon ſein, & mes yeux, & ma bouche, Autrefois ſi courtois à cét eſprit farouche, A venger les ſouſpirs, les regards & les vœux, Qi le phrenttaiyer tnjeatore ames ſenas Ha!	Intèressez mon sein, et mes yeux, et ma bouche, Autrefois si courtois à cet esprit farouche, A venger les soupirs, les regards et les vœux, Qi le phrentaiyer tnjeatore âmes senas Ha!
SEEIVE VT THEODORE, L’EMPEREVR, Gardes.	SEIVE VT THEODORE, L'EMPEREUR, Gardes.
L’EMPEREVR.	L'EMPEREUR.
VE vois-je, Madame, à quel torrent de larmes LaiſſeZ-vous effacer la ſplendeur de vos charmes?	VE vois-je, Madame, à quel torrent de larmes Laissez-vous effacer la splendeur de vos charmes?
Vn ſi doux ennemy par ſes abaiſſements, N'a-t'il pas eſtouffé tous vos reſſentiments?	Un si doux ennemi par ses abaissements, N'a-t'-il pas étouffé tous vos ressentiments?
THEODORE.	THÉODORE.
Ie ne ſçay dans l’ennuy dont ie me ſens confondre, Ny comment reſpirer, ny comment vous reſpondre;	Je ne sais dans l'ennui dont belle me sens confondre, Ni comment respirer, ni comment vous répondre;
Ordonnez que d’vn fer le ſein me ſoitouuert, Expoſez à vos yeux mon cœur à découuert, Il vous dira bien mieux que ne fera ma bouche, Et l’ennuy qui me tuë, & l’affrontqui vous touche:	Ordonnez que d'ennui qui me soit me soitouuert, Exposez à vos yeux mon cœur à découvert, Il vous dira bien mieux que ne fera ma bouche, Et l'ennui qui me tue, et l'affrontqui vous touche:
O Dieux!	Ô Dieux!
auoir pour luy témoigné tant d’horreur, Fait voir tant de mépris, conceu tant de fureur, Auoir par tant de gens ſa perte pourſuiuie, Et de ma propre main attenté ſur ſa vie, Tant abhorré ſon nom, perdu tant de repos, Cunt preurt, tant geuiy, tant pouße de fanglots, N'a pù vous faire oüir des oreilles de l’ame, Que ce traiſtre!	avoir pour lui témoigné tant d'horreur, Fait voir tant de mépris, conçu tant de fureur, Avoir par tant de gens sa perte poursuivie, Et de ma propre main attenté sur sa vie, Tant abhorré son nom, perdu tant de repos, Cunt preurt, tant geui, tant pousse de sanglots, N'a pu pu faire ouïrir des oreilles de l'âme, Que ce traître!
L’EMPEREVR.	L'EMPEREUR.
AttendeZ, n’acheuez pas, Madame, PeſeZ auparauant que de rien intenter, La iuſte occaſion qui vous y doit porter;	Attendez, n'achevez pas, Madame, PeseZ auparavant que de rien intenter, La juste occasion qui vous y doit porter;
Songez quel intereſt m'athentu beuqune, Qu’il m'eſt également, & cher, & neceſſaire, Et que les qualitez & de femme & d'époux, Prenant voſtre querelle, & me parlant pour vous;	Songez quel intérêt m'athentu beuqu, 'il m'est également, et cher, et nécessaire, Et que les qualités et de femme et d'époux, Prenant votre querelle, et me parlant pour vous;
L'éclat où ſa valeur maintient mon diadeſme, Parlera Parlera, d’autre part, pour cét autre moy-meſme;	L'éclat où sa valeur maintient mon diadème, Parlera Parlera, d'autre part, pour cet autre moi-même;
Qu'eſtant de mon Eſtat le plus ſolide appuy, On ne me peut heurter qu’on ne me choque en luy;	Qu'étant de mon État le plus solide appui, On ne me peut heurter qu'on ne me choque en lui;
Qu’autant que voſtre amour ſon amitié m'enflame, Et quil qrmunaney, f cons eres ma ſemmie.	Qu'autant que votre amour son amitié m'enflamme, Et quil qrmunanéi, f al eres ma semie.
THEODORE.	THÉODORE.
Quel amy, iuſte Ciel, & quel ſolide appuy, Et vous, & voſtre Eſtat, rencontrez-vous en luy?	Quel ami, juste Ciel, et quel solide appui, Et vous, et votre État, rencontrez-vous en lui?
Helas!	Hélas!
ſouhaittez-vous le débris de l’Empire, Et, s’il ſe peut encor, quelque choſe de pire, Procurez-vous ſa haine & ſon hoſtilité, Pluſtoſt qu'vne amitié de cette qualité;	souhaitez-vous le débris de l'Empire, Et, s'il se peut encor, quelque chose de pire, Procurez-vous sa haine et son hostilité, Plutôt qu'une amitié de cette qualité;
Croyez qu’il ne vous a, depuis quinze ans de guerre, ſubjugué d’ennemy, ny ſur mer, ny ſur terre, qui vous ait fait le tort qu’il vous fait aujourd’huy, Et ne vous ait eſté moins ennemy que luy;	Croyez qu'il ne vous a, depuis quinze ans de guerre, sujugué d'ennemi, Seigneur sur mer, ni sur terre, qui vous ait fait le tort qu'il vous fait aujourd'hui, Et ne vous ait été moins ennemi que lui;
L'Enfer ne peut former de ſi noire pratique, Il n’eſt tygre d’Aſie, il n’eſt lyon d’Afrique, Ny monſtre ſi funeſte, & ſi fort à dompter, Qu'au prix de cét amy, vous deuiez redouter;	L'Enfer ne peut former de si noire pratique, Il n'est tigré d'Asie, il n'est lion d'Afrique, Ni montre si funeste, et si fort à dompter, Qu'au prix de cet ami, vous deviez redouter;
I'ay trop long-temps, helas!	J'ai trop longtemps, hélas!
ſous la clef du ſilence, De cét audacieux retenu l’inſolence;	sous la cèle du silence, De cet audacieux retenu l'insolence;
Et ne pouuant, enfin, en diuertir le cours, I'en faiſois à l’effet, preceder le diſcours, Croyant qu’aux attentats qui vont à voſtre couche, La main, impunément, pûſt denoncer la bouche, Et l’exccution en preuenir l’arreſt;	Et ne pouvant, enfin, en divertir le cours, J'en faisais à l'effet, précéder le discours, Croyant qu'aux attentats qui vont à votre couche, La main, impunément, pût dénoncer la bouche, Et l'excution en prévenir l'arrêt;
Vous m’aueZ veu le bras & le poignard tout preſt;	Vous m'avez vu le bras et le poignard tout prêt;
Mais vous l'auez ſouſtrait à ma fureur extreme, Et pris ſon intereſt contre le voſtre meſme;	Mais vous l'avez soustrait à ma fureur extrême, Et pris son intérêt contre le vôtre même;
I'ay receu, pour le moins, ce fruict de mon malheur, De connoiſtre à quel prix vous mettez ma valeur, De ſçauoir quel degré i'occupe en voſtre grace, Et de quel aduantage vn vaſſal m'y ſurpaſſe;	J'ai reçu, pour le moins, ce fruit de mon malheur, De connaître à quel prix vous mettez ma valeur, De savoir quel degré j'occupe en votre grâce, Et de quel avantage un vassal m'y surpasse;
Contre toute iuſtice, & contre toute loix, Quand i’ay voulu parler, on m'a tranché la voix, Et l'on m'a refusé ce que ſans tyrannie, Aux plus noirs de forfaits iamais on ne dénie;	Contre toute justice, et contre toute lois, Quand j'ai voulu parler, on m'a tranché la voix, Et l'on m'a refusé ce que sans tyrannie, Aux plus noirs de forfaits jamais on ne dénie;
I'euſſe receu d’vn Scythe vn traittement plus doux, Et i’auois toutefois mon Iuge en mon Epoux;	J'eusse reçu d'une Scythe un traitement plus doux, Et j'avais toutefois mon Juge en mon Époux;
Voſtre ſeul intereſt me rendoit criminelle, Ie n’auois pris le fer que pour voſtre querelle, Et l’arreſt d’vn exil, des blaſmes, des mépris, Ont d’vne foy ſincere eſté le iuſte prix.	Votre seul intérêt me rendait criminelle, Je n'avais pris le fer que pour votre querelle, Et l'arrêt d'un exil, des blâmes, des mépris, Ont d'une foi sincère été le juste prix.
Elle luy donne la lettre de Beliſſaire.	Elle avait donne la lettre de Bélissaire.
Ce papier vous peut dire au deffaut de ma bouche, Si ie ſuis veritable, & ſi l’affront vous touche;	Ce papier vous peut dire au défaut de ma bouche, Si tu suis véritable, et si l'affront vous touche;
Niſe encor, que ce traiſtre a voulu ſuborner, Et par qui l’inſolent a creu me gouuerner, Peut, ſi vous l’enquerez, ioindre à ce témoignage, Combien pour vous celer vn ſi ſenſible outrage, Contre mes ſentimens i’ay long-temps combatu;	Nise encor, que ce traître a voulu suborner, Et par qui l'insolent a cru me gouverner, Peut, si vous l'enquérez, joindre à ce témoignage, Combien pour vous celer un si sensible outrage, Contre mes sentiments j'ai longtemps combattu;
Etle Ciel, cependant, va payer ma vertu, Il veut par mon trépas vous en rauir la gloire, Et luy ſeul a des prix dignes de ma victoire.	Etle Ciel, cependant, va payer ma vertu, Il veut par mon trépas vous en ravir la gloire, Et quelque seul a des prix dignes de ma victoire.
L’EMPEREVR.	L'EMPEREUR.
Que dittes-vous, Madame?	Que dites-vous, Madame?
Fne demeure, ô Cieux;	Fne demeure, ô Cieux;
Ny roſes à ſon teint, ny lumiere à ſes yeux!	Ni roses à son teint, ni lumière à ses yeux!
O funeſte cahos de deſordre et de trouble, Quand tout ſemble appaisé, c'est quand le mal redouble;	Ô funeste cahos de désordre et de trouble, Quand tout semble apaisé, c'est quand le mal redouble;
Et quand ie croy ioüir d’vn repos apparent, La querelle d’autruy deuient mon different:	Et quand ici crois ioüir d'une repos apparent, La querelle d'autrui devient mon différent:
Mais auant toute choſe, arreſtons ſa foibleſſe;	Mais avant toute chose, arrêtons sa faiblesse;
A’inoy, queiquon.	Ainroi, queiquon.
NCILIVI VTA CAMILLE, Pages, L’EMPEREVR.	NCILIVI VTA CAMILLE, Pages, L'EMPEREUR.
CAMILLE.	CAMILLE.
Eigneur.	Eigneur.
LEMPEREVR.	LEMPEREUR.
Secourez la Princeſſe, Qu'vn accident ſubit priue de mouuement.	Secourez la Princesse, Qu'un accident subit prive de mouvement.
Madame!	Madame!
CAMILLE.	CAMILLE.
L’EMPEREVR.	L'EMPEREUR.
Puſpe & ta uans fon apparement.	Puspe et ta uans son apparement.
DCLIVE VIET	DCLIVE VIET
L’EMPEREVR ſeul.	L'EMPEREUR seul.
Reuers de Portune, a mon repos contraire!	Revers de Portune, à mon repos contraire!
JI'en connois l’eſcriture, elle eſt de Beliſſaire;	II'en connais l'écriture, elle est de Bélissaire;
Et le deffaut d’adreſſe en marque le ſecret;	Et le défaut d'adresse en marque le secret;
Ie repugne à l’apprendre, & m’inſtruis à regret.	Je repugne à l'apprendre, et m'instruis à regret.
Il lit la lettre de Beliſſaire.	Il lit la lettre de Bélissaire.
Quand i’ay creu que ma mort vous deuoit eſtre chere, Et que vos belles mains oun propojoieni t'effort, Tout ce que ie poſſede, & tout ce que i'eſpere, Me ſatisfaiſoit moins qu'vne ſi belle mort.	Quand j'ai cru que ma mort vous devait être chère, Et que vos belles mains oun propojoieni t'une, Tout ce que je possède, et tout ce que j'espère, Me satisfaisait moins qu'une si belle mort.
Qu’importoit à mon cœur languiſſant dans vos chaiſnes, De mourir par les coups, ou des yeux, ou des mains;	Qu'importait à mon cœur languissant dans vos chaînes, De mourir par les coups, ou des yeux, ou des mains;
Si vos mains, en effet eſtoient mes ſouueraines, Außi bien que vos yeux eſtoient mes fouuerains.	Si vos mains, en effet étaient mes souveraines, Aussi bien que vos yeux étaient mes souverains.
BELISSAIRE.	BÉLISAIRE.
Il continuë.	Il continue.
Le foudre, ce vengeur des querelles des Cieux, Grondant à mon oreille, & tombant à mes yeux, Ny le commun débris de toute la nature, Ne m’eſtonneroit pas, comme cette aduanture;	Le foudre, ce vengeur des querelles des Cieux, Grondant à mon oreille, et tombant à mes yeux, Ni le commun débris de toute la nature, Ne m'étonnerait pas, comme cette aventure;
Quoy, celuy que iamais grandeur n'a peu tenter, Que le respect d’vn thrône empeſche d’y monter, Qui content de s’en voir la plus ferme colomne, Et ſouſtenir du bras le faix de ma Couronne, Se deffend par respect de s’en charger le front, T’a voulu, mon honneur, couurir de cét affront!	Quoi, celui que jamais grandeur n'a pu tenter, Que le respect d'un trône empêche d'y monter, Qui content de s'en voir la plus ferme colomne, Et soutenir du bras le faix de ma Couronne, Se défend par respect de s'en charger le front, T'a voulu, mon honneur, couvrir de cet affront!
Libre d'ambition, permet qu'Amour le touche, Et refuſant mon thrône, entreprend ſur ma couche;	Libre d'ambition, permet qu'Amour le touche, Et refusant mon trône, entreprend sur ma couche;
Ie dois eſtre immortel, ſi de mes triſtes iours, Ce ſenſible accident ne termine le cours;	Je dois être immortel, si de mes tristes jours, Ce sensible accident ne termine le cours;
Les deuoirs qu’il luy rend, & ſa paix qu’il reclame, Aſſez viſiblement manifeſtent ſa flame;	Les devoirs qu'il avait rend, et sa paix qu'il réclame, Assez visiblement manifestent sa flamme;
Cette ſouſmißion, ce pardon genereux, Eſt moins vne pitié, qu’vn effet amoureux;	Cette sousmion, ce pardon généreux, Est moins une pitié, qu'un effet amoureux;
L’Amour ſeul, dont le ioug tient ſon ame aſſeruie, Pardonne aux attentats qui vont iuſqu'à là vie;	L'Amour seul, dont le joug tient son âme asservie, Pardonne aux attentats qui vont jusqu'à là vie;
Luy ſeul en eſt capable, & la compaßion N'eſtend pas ſes effets iuſqu’à cette action;	Lui seul en est capable, et la compassion N'étend pas ses effets jusqu'à cette action;
Par quel caprice, helas!	Par quel caprice, hélas!
le ſort à t’il pu faire, De mon plus grand amy, mon plus grand aduerſaire, De l’objet de mes vœux celuy de mon horreur, Et d’vn bras de l’Eſtat, le fleau de l’Empereur!	le sort à t'il pu faire, De mon plus grand ami, mon plus grand adversaire, De l'objet de mes vœux celui de mon horreur, Et d'un bras de l'État, le fléau de l'Empereur!
Que de ce meſme cœur, ſi jaloux de ma gloire, Il ait pù propoſer de fleſtrir ma memoire!	Que de ce même cœur, si jaloux de ma gloire, Il ait pù proposer de flétrir ma mémoire!
Vains intereſts d’Eſtat, friuole ambition y Injuſtes conſeillers d’vne laſche indulgence, Ie n’ouure qu'aux aduis qui vont à la vengeance;	Vains intérêts d'État, frivole ambition y Injustes conseillers d'une lâche indulgence, Je n'ouvre qu'aux avis qui vont à la vengeance;
Ie vous ferme l’oreille, & de peur de pancher Du coſté du coulpable, à ſon Iuge ſi cher, Et croire la pitié qui me pourroit ſurprendre, I'éuiteray ſa veuë, & ne veux point l’entendre, Ie douterois d’vn crime amplement aueré, Et qu'aſſez, ſans ſa voix, ſa main a declaré.	Je vous ferme l'oreille, et de peur de pencher Du côté du coulpable, à son Juge si cher, Et croire la pitié qui me pourrait surprendre, J'éviterai sa vue, et ne veux point l'entendre, Je douterais d'un crime amplement avéré, Et qu'assez, sans sa voix, sa main a déclaré.
Mais il vient;	Mais il vient;
Que mon cœur ſouffre de violence!	Que mon cœur souffre de violence!
Impoſe, mon honneur, impoſe moy ſilence;	Impose, mon honneur, impose -moi silence;
Tien ferme, ma conſtance, agy ſans t'émouuoir, Ma raiſon, ma vertu, faites voſtre deuoir, Ne m’abandonnez pas en ce combat extréme, Où i’ay ſi grand beſoin de moy contre moy-meſme, Où d’vn ſi fort inſtinct ie me ſens incliner, Pour le fatal party que ie dois condamner.	Tiens ferme, ma constance, agi sans t'émouvoir, Ma raison, ma vertu, faites votre devoir, Ne m'abandonnez pas en ce combat extrême, Où j'ai si grand besoin de moi contre moi-même, Où d'un si fort instinct Se me sens incliner, Pour le fatal parti que je dois condamner.
SCLEVN IXN BELISSAIRE, L’EMPEREVR.	SCLEUN IXN BÉLISAIRE, L'EMPEREUR.
BELISSAIRE.	BÉLISAIRE.
ON attendoit, Seigneur, mais l’heure qui ſe paſſe, Priue pour au jour d’huy de l’eſpoir de la chaſſe.	ON attendait, Seigneur, mais l'heure qui se passe, Prive pour au jour d'hui de l'espoir de la chasse.
L’EMPEREVR, bas, ſe promenant ſans le regarder.	L'EMPEREUR, bas, se promenant sans le regarder.
L’ouurage de mes mains l’effort de ma grandeur!	L'ouvrage de mes mains l'effort de ma grandeur!
De ma plus chere eſtime attaquer la splendeurt Vn indigne ruiſſeau qui tient de moy ſa courſe, Cherche impunément à corrompre ſa ſource, Et le plus cher des miens diffame ma maiſon!	De ma plus chère estime attaquer la splendeurt Un indigne ruisseau qui tient de moi sa course, Cherche impunément à corrompre sa source, Et le plus cher des miens diffame ma maison!
O noire ingratitude;	Ô noire ingratitude;
ô laſche trahiſoni	ô lâche trahisoni
BELISSAIRE.	BÉLISAIRE.
Prince, honneur des Ceſars, mon Seigneur & mon Maiſtre, Helas!	Prince, honneur des Césars, mon Seigneur et mon Maître, Hélas!
qu'elle froideur me faites-vous paroiſtre?	qu'elle froideur me faites-vous paraître?
L’EMPEREVR, bas.	L'EMPEREUR, bas.
En vain tu m’attendris, inutile pitié, Einitrer de lpunnei va denant bamtise.	En vain tu m'attendris, inutile pitié, Einitrer de lpuni va denant bamtise.
BELISSAIRE.	BÉLISAIRE.
Qui m’altere, Seigneur, vne amitié ſi tendre?	Qui m'altère, Seigneur, une amitié si tendre?
Qoy, vous ſans me parler;	Qoi, vous sans me parler;
juutint cen, ſans m'entenare g En vous tant de froideur, ou tant d’auerſion!	juint cen, sans m'entenare g En vous tant de froideur, ou tant d'aversion!
LEMPEREVR.	LEMPEREUR.
Vous auez mal vsé de mon affection.	Vous avez mal usé de mon affection.
BELISSAIRE.	BÉLISAIRE.
Si de ce ſentiment mon esprit eſt capable, PrononceZ mon arreſt, Seigneur, ie ſuis coupable;	Si de ce sentiment mon esprit est capable, Prononcez mon arrêt, Seigneur, je suis coupable;
Mais le Ciel m’eſt témoin d’vne fidelité, Incapable, ou d’atteinte, ou d’inegalité, Et qui ſe maintiendroit inuiolable & pure, Dans le commun débris de toute la nature;	Mais le Ciel m'est témoin d'une fidélité, Incapable, ou d'atteinte, ou d'inégalité, Et qui se maintiendrait inviolable et pure, Dans le commun débris de toute la nature;
O Terre tu le ſçay?	Ô Terre tu le sais?
ie vous atteſte, ô Cieux?	On vous atteste, ô Cieux?
L’EMPEREVR, s’en allaut.	L'EMPEREUR, s'en allaut.
Les yeux repareront le mal qu’ont fait les yeux.	Les yeux répareront le mal qu'ont fait les yeux.
SCINE	SCINE
AOEEVE BELISSAIRE, ſeul.	AOEEVE BÉLISSAIRE, seul.
A.	A.
A	À
Cheue ton ouurage, ô diſgrace inhumaine;	Cheve ton ouvrage, ô disgrâce inhumaine;
I Me deuiens importum, on me ſouffre auec peine;	I Je deviens importum, on me souffre avec peine;
Et ie respire encor où ie ſuis odieux!	Et ici respire encor où on suis odieux!
Les yeux repareront le mal qu’ont fait les yeux?	Les yeux répareront le mal qu'ont fait les yeux?
Quel miſtere eſt caché deſſous cette menace?	Quel mystère est caché dessous cette menace?
Mais quel?	Mais quel?
ſinon qu'enfin la Fortune ſe laſſe;	sinon qu'enfin la Fortune se lasse;
Quelle eſt femme, & qu’il eſt de ſon ordre in conſtant De rebuter enfin ce qu’elle obligea tant, Et n'eſleuer perſonne au plus haut de ſa rouë.	Quelle est femme, et qu'il est de son ordre in constant De rebuter enfin ce qu'elle obligea tant, Et n'élever personne au plus haut de sa roue.
Que la fin de ſon tour ne iette dans la bouë;	Que la fin de son tour ne jette dans la boue;
Ce n'eſt point ce reuers, quoy que ſi rigoureux, Qui cauſe mon deſaſtre, & me rend malheureux, Et puiſqu'on ne peut voir cette inſtable Deeſſe, Eſleuer iamais rien qu’apres elle n’abbaiſſe, Et que c’eſt vn inſtinct qu’elle ne peut dompter, Noſtre malheur n'eſt pas de choir, mais de monter.	Ce n'est point ce revers, quoi que si rigoureux, Qui cause mon désastre, et me rend malheureux, Et puisqu'on ne peut voir cette instable Déesse, Élever jamais rien qu'après elle n'abaisse, Et que c'est un instinct qu'elle ne peut dompter, Notre malheur n'est pas de choir, mais de monter.
AUI.	AUI.
A	À
SCENEIREMIERE.	SCENEIREMIÈRE.
BELISSAIRE, ſeul.	BÉLISAIRE, seul.
DLVS ie rentre en moy-meſme, & plus ie m'exaT mine, Moins i’y puis de mon mal rencontrer l’origine;	DLUS autre rentre en moi-même, et plus beau m'exaT mine, Moins j'y puis de mon mal rencontrer l'origine;
Et moins i’y puis iuger l’ombre d’vne action, En quoy i’aye abusé de ſon affection;	Et moins j'y puis juger l'ombre d'une action, En quoi j'aie abusé de son affection;
D'oſer de quelque embuſche, ou de quelque artifice, Connoiſſant l’Empereur, taxer l’Imperatrice, C’eſt contre l’apparence & le raiſonnement, Douter de ſes bontez & de ſon iugement;	D'oser de quelque embûche, ou de quelque artifice, Connaissant l'Empereur, taxer l'Impératrice, C'est contre l'apparence et le raisonnement, Douter de ses bontés et de son jugement;
Et luy meſme ayant pris & le temps & la peine De retenir ſon bras, & reprimer ſa haine, Il eſt hors de ſoupçon, qu'elle ait pù m’impoſer Rien d’aſſez vray-ſemblable à pouuoir m’abuſer;	Et quelque même ayant pris et le temps et la peine De retenir son bras, et réprimer sa haine, Il est hors de soupçon, qu'elle ait puù m'imposer Rien d'assez vrai-semblable à pouvoir m'abuser;
Cét heur me reſte, au moins en ce malheur extreme, Que la plus forte preuue eſt celle de ſoy-meſme, Que i'ay mille témoins en m'ayant pour témoin, Et que tout me manquant, ie me reſte au be ſoin;	Cet heur me reste, au moins en ce malheur extrême, Que la plus forte preuve est celle de soi-même, Que j'ai mille témoins en m'ayant pour témoin, Et que tout me manquant, Seigneur me reste au be soin;
Dans l’aßiette où la Parque en ſa plus forte rage, Au milieu des combats a trouué mon courage;	Dans l'assiette où la Parque en sa plus forte rage, Au milieu des combats a trouvé mon courage;
Attendons, ma raiſon, le coup de ce malheur, Puiſque mon innocence égale ma valeur;	Attendons, ma raison, le coup de ce malheur, Puisque mon innocence égale ma valeur;
Que par elle à couuert du bras de la Iuſtice, Ie puis craindre l’outrage, & non pas le ſupplice, Et iue dans la tandeur ont ay iouſionrs cejci, Ie puis eſtre accusé, mais non pas conuaincu.	Que par elle à couvert du bras de la Justice, Je puis craindre l'outrage, et non pas le supplice, Et jue dans la tandeur ont ai iousionrs céjci, Je puis chang accusé, mais non pas convaincu.
ALENTE LEONSE, BELISSAIRE.	ALENTE LEONSE, BÉLISAIRE.
LEONSE.	LEONSE.
