Nous ne pouuons fans luy nons conſeruer le iour, Il faut que la nature, ou la fortune cede, L’vne nous eſt contraire, & l’autre nous ſuccede, Le malqu’on veut guerir, ne ſe doit point flatter, Ertt jont nosvourreana, que ie jai arreſier;	Nous ne pouvons fans lui nons conserver le jour, Il faut que la nature, ou la fortune cède, L'une nous est contraire, et l'autre nous succède, Le malqu'on veut guérir, ne se doit point flatter, Ertt jont nosvourreana, que sans jai arrier;
NARSE’E.	NARSE'E.
Nos Boureaux, les auteurs du iour qui nous eſclaire!	Nos Boureaux, les auteurs du jour qui nous éclaire!
SIROES.	SIROES.
Les auteurs de l’affront, qu’ils nous ont voulu faire;	Les auteurs de l'affront, qu'ils nous ont voulu faire;
RAROLE.	RAROLE.
Vn Empire, vaut-il, cette inhumanité!	Un Empire, vaut-il, cette inhumanité!
SIROES.	SIROES.
Vaut-il, nous menacer de cette indignité?	Vaut-il, nous menacer de cette indignité?
Et qu’vn pere aueuglé, destine pour victime, A ſon vſurpateur, ſon maistre legitime;	Et qu'autre père aveuglé, destine pour victime, À son usurpateur, son maître légitime;
Le pouuoir, tombe mal, en des cœurs abbattus;	Le pouvoir, tombe mal, en des cœurs abattus;
Auec le nom de Roys, prenons-en les vertus;	Avec le nom de Rois, prenons-en les vertus;
Iuſques dans nostre ſang, exterminons le crime, Mais reprimons, ſur tout, le mal qui nous opprime;	Jusque dans notre sang, exterminons le crime, Mais réprimons, sur tout, le mal qui nous opprime;
Dois-ie encor du reſpect, à qui veut m’arrester?	Dois-je encor du respect, à qui veut m'arrêter?
Et luy ſuis-ie obligé, du iour qu’il veut m’oster?	Et tu suis-je obligé, du jour qu'il veut m'ôter?
Le ſuis-ie à voſtre mere, à qui ie fais ombrage?	Le suis-je à votre mère, à qui belle fais ombrage?
Et qui met tout credit, & tout ſoing en vſage, Pour me frustrer d’vn droict, que le ſang m'a donné, Et m’en ayant exclus, voir le ſien couronné?	Et qui met tout crédit, et tout soing en usage, Pour me frustrer d'un droit, que le sang m'a donné, Et m'en ayant exclus, voir le sien couronné?
Vous eſtes ſouueraine, & Syra criminelle, Voyez, de qui des deux, vous prendreZ la querelle, D’vne mere arreſtée, ou d’vn amant tout preſt D’ouyr ſes ennemis, prononcer ſon arreſt;	Vous êtes souveraine, et Syra criminelle, Voyez, de qui des deux, vous prendrez la querelle, D'une mère arrêtée, ou d'Hannant tout prêt D'ouïr ses ennemis, prononcer son arrêt;
Er juar en ejenaſfaar, enhojendle teſte, Dont vos yeux, ont daigné d’auoüer la conqueſte.	Er juar en éjenasfaar, enhojendle tête, Dont vos yeux, ont daigné d'auoüer la conquête.
NARSE’E.	NARSE'E.
Redoutez-vous plus rien?	Redoutez-vous plus rien?
& vos ſoings prouidemts, N’ont-ils pas ſçeu préuoir, à tous les accidents, Que vous peut ſuſciter le courroux d’une femme?	et vos soins prouidemts, N'ont-ils pas su prévoir, à tous les accidents, Que vous peut susciter le courroux d'une femme?
SIROES.	SIROES.
Tel, peut eſtre, nous rit;	Tel, peut -être, nous rit;
qui nous trahit dans l’ame;	qui nous trahit dans l'âme;
Et cherche vn meſcontent, à qui preſter le bras, Pour des ſeditions, et des aſſasſinats;	Et cherche un mécontent, à qui prêter le bras, Pour des séditions, et des assassinats;
Sur quelque fondement, qu'elle ſoit appuyée, L’authorité naiſſante, eſt touſiours enuiée;	Sur quelque fondement, qu'elle soit appuyée, L'autorité naissante, est toujours enviée;
Et ſouuent à leur foy, les peuples renonçants, Aiment ceux affligeZ, qu’ils ont hays puiſſants;	Et souvent à leur foi, les peuples renonçants, Aiment ceux affligés, qu'ils ont hais puissants;
NARSEE.	NARSE.
Vne Reine en des fers, n'eſt donc pas affligée?	Une Reine en des fers, n'est donc pas affligée?
SIROES.	SIROES.
Elle n'eſt pas en lieu, d’en eſtre ſoulagée;	Elle n'est pas en lieu, d'en être soulagée;
Druuieinte uu eſige, un reſte de pouuoir Qui pourroit pratiquer leur ſeruile deuoir;	Druieinte ou vante, un reste de pouvoir Qui pourrait pratiquer leur servile devoir;
NARSE’E.	NARSE'E.
N’atten point de ſucceZ, ô priere importune!	N'atten point de succès, ô prière importune!
Ie ne ſuis plus maiſtreſſe, où regne la fortune;	Je ne suis plus maîtresse, où règne la fortune;
L’amour n’a plus d’Empire, où l’intereſt en prend, Ne conſidereZ rien, l’Eſtat vous le deffend;	L'amour n'a plus d'Empire, où l'intérêt en prend, Ne considereZ rien, l'Estat vous le défend;
Il luy faut immoler, toute voſtre famille, Du moins, auec la mere, il faut perdre la fille;	Il lui faut immoler, toute votre famille, Du moins, avec la mère, il faut perdre la fille;
Nous ne ſommes qu’vn ſang, & qu’vn cœur ſeparé, Ie pourrois acheuer, ce qu’elle a preparé, D’vn frere contre vous, eſpouſer la querelle, Dedans voſtre desbris, m'interreſſer comme elle, Sapper les fondements de voſtre autorité, Et renuerſer le troſne, où vous eſtes monté.	Nous ne sommes qu'Hommes sang, et qu'un cœur séparé, Je pourrais achever, ce qu'elle a préparé, D'un frère contre vous, épouser la querelle, Dedans votre débris, m'interresser comme elle, Sapper les fondements de votre autorité, Et renverser le trône, où vous êtes monté.
Si ces yeux vous ont plû, gardez, que de leurs charmes, Contre voſtre pouuoir, ie ne faſſe des armes, Et n’en achepte l’offre, & d’vn cœur, & d’vn bras Qui m’oZent immoler vos iours, & vos Eſtats, Preuenez, ſans égard, tout ce qui vous peut nuire,	Si ces yeux vous ont plu, gardez, que de leurs charmes, Contre votre pouvoir, pleins ne fasse des armes, Et n'en achette l'offre, et d'un cœur, et d'un bras Qui m'oSent immoler vos jours, et vos États, Prevenez, sans égard, tout ce qui vous peut nuire,
Aduerty, deſtruiſez ce qui vous peut deſtruire, Craignez l’aueuglement, d’vn amour irrité, Et ne conſidereZ, que voſtre ſeureté.	Aduerti, détruisez ce qui vous peut détruire, Craignez l'aveuglement, d'un amour irrité, Et ne considérez, que votre sûreté.
Voudriez-vous m’obliger, d’aimer mon aduerſaire, Souffrirois-ie en mon lit, l’aſſaßin de ma mere?	Voudriez-vous m'obliger, d'aimer mon adversaire, Souffrirais-je en mon lit, l'assassin de ma mère?
Pourrois-ie ſans horreur, auec ſon ennemy.	Pourrais-je sans horreur, avec son ennemi.
Partager vn pouuoir, par ſon ſang affermy?	Partager un pouvoir, par son sang affermi?
Gardes, emmeneZ-moy, ſon ſalut vous l’ordonne, SauueZ de ma fureur, ſa vie, & ſa couronne;	Gardes, emmeneZ-moi, son salut vous l'ordonne, Sauvez de ma fureur, sa vie, et sa couronne;
Helas!	Hélas!
ô quoy, Nature, obligent tes reſpects, Qu’il faille à mon amant, rendre mes vœux ſuſpects!	ô quoi, Nature, obligent tes respects, Qu'il faille à mon amant, rendre mes vœux suspects!
Et pour en obtenir, ou ma perte, ou ta grace, Contre ce que i'adore, employer la menasé?	Et pour en obtenir, ou ma perte, ou ta grâce, Contre ce que j'adore, employer la menasé?
Par ces tranſports, Seigneur, iugez de mes douleurs, I’aurois plus obtenu, du ſecours de mes pleurs;	Par ces transports, Seigneur, jugez de mes douleurs, J'aurais plus obtenu, du secours de mes pleurs;
Mais vn extreme ennuy, n’en eſt gueres prodigue.	Mais un extrême ennui, n'en est guère prodigue.
OAlcc du.	ÔAlcc du.
Gardes, ſuiueZ Madame, & cherchez Sardarigue, Qu'il obeyſſe aux loix, qu’elle luy preſcrira, Et ſur tout, qu'en ſes mains, il remette S'yra;	Gardes, suignez Madame, et cherchez Sardarigue, Qu'il obéisse aux lois, qu'elle avait prescrira, Et sur tout, qu'en ses mains, il remette S'ira;
Allez.	Allez.
NARSE’E.	NARSE'E.
Cette faueur, vous couſte trop de peine;	Cette faveur, vous coûte trop de peine;
SIROES.	SIROES.
SIROES.	SIROES.
Non, non, ie m’abandonne, aux fureurs de la Reyne, Et ne regarde plus, ny le droict qui m’eſt dû, Ny le rang que ie tiens, que comme vn bien perdu;	Non, non, Madame m'abandonne, aux fureurs de la Reine, Et ne regarde plus, ni le droit qui m'est dû, Ni le rang que je tiens, que comme un bien perdu;
Ie vous prefere aux Dieux, dont les bontez proſperes, M’ont voulu conſeruer, le troſne de mes peres;	Je vous préfère aux Dieux, dont les bontés prospères, M'ont voulu conserver, le trône de mes pères;
Vous m’en voulés priuer, il vous faut obeïr, Et d’vn reſpect aueugle, auec moy vous trahir, Ie n’ay qu’vn ſeul regret, que mon amour extréme, on nazaruant mes iours, ſe na(arde iuy mejme, Et qu’au poinct du ſuccés, dont ie flattois mes veux, L’heur de vous poſſeder, me deuienne douteux,	Vous m'en voulez priver, il vous faut obéir, Et d'un respect aveugle, avec moi vous trahir, Je n'ai qu'un seul regret, que mon amour extrême, on nazaruant mes jours, se na été jarde mejme, Et qu'au point du succès, dont j' flattois mes veux, L'heur de vous posséder, me devienne douteux,
NARSE’E.	NARSE'E.
Quoy que vous haZardiez, ie cours meſme aduanture, Nous aurons meſme couche, ou meſme ſepulture;	Quoi que vous hasardiez, on cours même aventure, Nous aurons même couche, ou même sépulture;
De vos vœux, vif, ou mort, ie vous promets le priæ.	De vos vœux, vif, ou mort, je vous promets le priæ.
L’hymen ioindra nos corps, ou la mort nos eſprits, Mais, ſi vous en daignès, croire vn amour extréme, Ie vous reſponds du iour, du troſne, & de moy-meſme, I'obſerueray la Reyne auecques tout le ſoing Qu'exigeront les lieux, le temps, & le beſoing Et i’oZe vous promettre, vn bouclier inuincible, En la garde d’vn cœur, ſurueillant, & ſenſible, ul ne coyendemys, cous parera tes conps;	L'hymen joindra nos corps, ou la mort nos esprits, Mais, si vous en daignrez, croire amour extrême, Je vous réponds du jour, du trône, et de moi-même, J'observerai la Reine avec tout le soing Qu'exigeront les lieux, le temps, et le besoin , Et j'oZe vous promettre, un bouclier invincible, En la garde d'un cœur, surveillant, et sensible, ul ne coyendemys, cous parera tes conps;
Ou qu’il faudra percer, pour aller iuſqu'a vous.	Ou qu'il faudra percer, pour aller jusqu'a vous.
SIROES s’en allant d’vn autre coſté.	SIROES s'en allant d'un autre côté.
Reglés à voſtre gré, la fortune publique, Vſes, comme il vous plaiſt, d’vn pouuoir tyrannique;	Reglez à votre gré, la fortune publique, Uses, comme il vous plaît, d' pouuoir tyrannique;
Conſommés en ce cœur, ſur qui vous l’exerces, Il le faut bien ſouffrir;	Consommès en ce cœur, sur qui vous l'exerces, Il le faut bien souffrir;
Gardes, obeyſſez.	Gardes, obéissez.
ACTE IIII.	ACTE IIII.
SCENE PREMIERE.	SCÈNE PREMIÈRE.
SIROES, ARTANASDE.	SIROES, ARTANASDE.
SIROES, liſant vn billet.	SIROES, lisant un billet.
Ce billet eſt vn gage, à voſtre Majeſté, u’elle peut auec confiance, Domer à lon porteur, vſie entiere creance, Et s’aſſeurer ſur moy, de ſa fidelité.	Ce billet est gage, vôtre Majesté, elle peut auec confiance, Domer Ce bille, est un gage, à vasseurer sur M, de a fidelité,
SYROES continüe.	SYROÊ continue.
V'est-ce Artanaſde?	V'est-ce Artanasde?
ARTANASDE.	ARTANASDE.
Hâ Sire!	Hâ Sire!
à la ſeule pensée, De ce fatal rapport, i'ay l’ame encor glacée, Pour l’execution, d’vn complot odieux, La Reyne, ſur mon bras, à pù ietter les yeux;	à la seule pensée, De ce fatal rapport, j'ai l'âme encor glacée, Pour l'exécution, d'un complot odieux, La Reine, sur mon bras, à pù jeter les yeux;
Vous croyant arreſté, cette fiere aduerſaire, M’a commis par ma ſœur, vn preſent à vous faire, Pour vous voir inmoler, à ſon reſſentiment, Ou pour voſtre refus, en eſtre l'inſtrument, Ce fer, ou ce poiſon.	Vous croyant arrêté, cette fière adversaire, M'a commis par ma sœur, un présent à vous faire, Pour vous voir inmoler, à son ressentiment, Ou pour votre refus, en être l'instrument, Ce fer, ou ce poison.
ſon.	son.
SIROES.	SIROES.
O déteſtable femme!	Ô détestable femme!
ARTANASDE.	ARTANASDE.
Dt vos iours innocens, deuoit couper la trame;	Dt vos jours innocents, devait couper la trame;
O Dieux!	Ô Dieux!
SYROES.	SYROES.
ARTANASDE.	ARTANASDE.
Et i'en ay l’ordre, à deſſein accepté, Craignant qu’vn autre bras, ne l’euſt executé;	Et j'en ai l'ordre, à dessein accepté, Craignant qu'un autre bras, ne l'eût exécuté;
Elle à preßé ma ſœur, auec toute l’inſtance, Qui pouuoit esbranler, la plus ferme constancé, Et nous deuions, pour prix de ce grand attentat Auoir ſi bonne part, aux employs de l’Eſtat, Que nous eusſions pû tout, & qu’apres ſa perſonne, Nul, n’euſt tenu de rang, plus preZ de la Couronne;	Elle à pressé ma sœur, avec toute l'instance, Qui pouvait ébranler, la plus ferme constancé, Et nous devions, pour prix de ce grand attentat Auoir si bonne part, aux emplois de l'État, Que nous eussions pu tout, et qu'après sa personne, Nul, n'eût tenu de rang, plus près de la Couronne;
Mais ma ſœur, oppoſant a cette ambition La loüable terreur, d’vne noire action, Et fremiſſant d’horreur, d’vne telle iniuſtice) N'a que pour l’abuſer, accepté cét office;	Mais ma sœur, opposant à cette ambition La louable terreur, d'une noire action, Et frémissant d'horreur, d'une telle injustice) N'a que pour l'abuser, accepté cet office;
I’ay d’vne meſme horreur, ce deſſein deteſté, Et l’aduis important à voſtre Maiesté, ( Dont ie cognois, qu’enfin, la Perſe doibt dépendre) I’ay cherché Palmyras, pour venir vous l’apprendre;	J'ai d'une homme horreur, ce dessein détesté, Et l'avis important à votre Majesté, ( Ont apprendre connais, qu'enfin, la Perse doibt dépendre) J'ai cherché Palmyras, pour venir vous l'apprendre;
AvAnis tradaittant aiueurs, il s en eſt deſjenau, Par le mot de ſa main, que ie vous ay rendu.	AvAnis tradaittant aieurs, il s en est déjenau, Par le mot de sa main, que je vous ai rendu.
YROES.	YROES.
Artanaſde, croyés, que ma recognoiſſance, Ne ceſſera iamais, qu’auecques ma puiſſance;	Artanasde, croyez, que ma reconnaissance, Ne cessera jamais, qu'avec ma puissance;
Et que ie ſçauray mieux, recognoiſtre vn bien faict, Que Syra n’a promis de payer vn forfaict;	Et que ici saurai mieux, reconnaître un bien fait, Que Scyra n'a promis de payer un forfait;
Gardés ces inſtruments, d’vne implorable hayne, Qui n’a plus de reſſource, & que nous rendrons vaine 3 Si les Dieux, ennemys, de tels perſecuteurs, Des intereſts des Roys, ſont encor protecteurs;	Gardez ces instruments, d'une implorable haine, Qui n'a plus de ressource, et que nous rendrons vaine 3 Si les Dieux, ennemis, de tels persécuteurs, Des intérêts des Rois, sont encor protecteurs;
O redoutable esprit, ô maraſtre cruelle!	Ô redoutable esprit, ô marâtre cruelle!
Trop pieuſe Narsée, & mere indigne d'elle!	Trop pieuse Narsée, et mère indigne d'elle!
ARTANASDE.	ARTANASDE.
Non pas mere, Seigneur, & i’ay ſur ce propos, Un ſecret, qui regarde encor voſtre repos;	Non pas mère, Seigneur, et j'ai sur ce propos, Secret Un, qui regarde encor vôtre repos;
IROES.	JROÊ.
Quel ſecret, Artanaſde?	Quel secret, Artanasde?
eſclaireZ-m’en, de grace;	éclairez-m'en, de grâce;
ARTANASDE.	ARTANASDE.
Puiſque le ſort de Perſe, à pris vne autre face;	Puisque le sort de Perse, à pris un autre face;
SçacheZ vn accident, heureux pour voſtre amour, Que preis dc onge doreus, nont oZe mettre au iour;	Sachez un accident, heureux pour votre amour, Que pré ç onge doreus, nont oZe mettre au jour;
Et dont la verite fera voir que Narſée, Aiu paiyy aeoyra, net point ihrerreate,	Et dont la vérité fera voir que Narsée, Aju paii ajoyra, net point ihrerreate,
O Dieux!	Ô Dieux!
SIROES.	SIROES.
ARTANASDE.	ARTANASDE.
Quand d’Abdenede, encor en ſon matin, Vne troiſieſme courſe, eut tranché le deſtin;	Quand d'Abdenede, encor en son matin, Une troisième course, eut tranché le destin;
Toſt apres, de ſa mort, la triſteſſe bannie, Feiſt penſer Coſroës, au ſceptre d’Armenie;	Tôt après, de sa mort, la tristesse bannie, Feist penser Cosroés, au sceptre d'Arménie;
Il propoſa d’armer, ſon deſſein fut conclu, De vous dire le reſte, il ſeroit ſuperflu;	Il proposa d'armer, son dessein fut conclu, De vous dire le reste, il serait superflu;
Il ſuffit qu’vn hymen, ioignit les deux couronnes, Et que l’âge, le rang, & l’eſtat des perſonnes, Treuuerent en Syra, tant de conformité, Que l’hymen, & la paix, ne furent qu'vn traité;	Il suffit qu'un hymen, joignit les deux couronnes, Et que l'âge, le rang, et l'état des personnes, Treuuerent en Syra, tant de conformité, Que l'hymen, et la paix, ne furent qu' traité;
Suffit, qu’on ſçait encor, que dans voſtre famille, La vefue de Sapor, n’apporta qu’vne fille, En ſa plus tendre enfance, et dont les iours naiſſants, A peine auoient veu poindre, & remplir ſix croiſſants.	Suffit, qu'on sait encor, que dans votre famille, La veuve de Sapor, n'apporta qu'une fille, En sa plus tendre enfance, et dont les jours naissants, À peine avaient vu poindre, et remplir six croissants.
Et qu’enfin, noſtre bonne ou mauuaiſe aduanture, Au ſoucy de ma ſœur, commiſt ſa nourriture;	Et qu'enfin, notre bonne ou mauvaise aventure, Au souci de ma sœur, commît sa nourriture;
Mais ce cher gage, à peine, en ſa garde receu, (Et voicy, du ſecret, ce qui n’eſtoit pas ſçeu;	Mais ce cher gage, à peine, en sa garde reçu, (Et voici, du secret, ce qui n'était pas su;
D'vne conuulſion, l’atteinte inopinée, De cette ieune fleur, trancha la deſtinée, Pour lors à Palmyras, le ſort m’auoit donné, Ou ma ſœur m’abordant, d’vn viſage eſtonné;	D'une convulsion, l'atteinte inopinée, De cette jeune fleur, trancha la destinée, Pour lors à Palmyras, le sort m'avait donné, Ou ma sœur m'abordant, d'un visage étonné;
Hâ mon frere, en quel lieu, (me dy-t’elle auec peine,) Me mettray-ie à couuert, du courroux de la Reine?	Hâ mon frère, en quel lieu, (me dis-t-elle était peine,) Me mettrai-je à couvert, du courroux de la Reine?
Helas, Narsée eſt morte, elle vient d’expirer, Là, Palmyras entrant, et l’oyant ſouſpirer, N’a pas ſi toſt appris le mal qui la poſſede, Qu'a l’inſtant, de ce mal, il treuue le remede;	Hélas, Narsée est morte, elle vient d'expirer, Là, Palmyras entrant, et l'oyant soupirer, N'a pas si tôt appris le mal qui la possède, Qu'a l'instant, de ce mal, il trouve le remède;
Et ſe voyant pour lors, vne fille au berceau, Eſprouuez, nous, dit-il, ſi ſon ſort ſera beau, Laiſſons faire le temps, & voyons l’aduanture, D'vn jeu, de la fortune, auecques la nature;	Et se voyant pour lors, une fille au berceau, Esprouvez, nous, dit-il, si son sort sera beau, Laissons faire le temps, et voyons l'aventure, D'un jeu, de la fortune, avec la nature;
Narsée, & Sydaris, ſe reſſembloient ſi fort, Qu'outre que leur viſage, auoient bien du rapport, La reſſemblance encor, & du poil, & de l’âge, Par bon-heur, répondoit à celle du viſage;	Narsée, et Sydaris, se ressemblaient si fort, Qu'outre que leur visage, avaient bien du rapport, La ressemblance encor, et du poil, et de l'âge, Par bonheur, répondait à celle du visage;
Pour acheuer, enfin, le ſoing de Sydaris, Sous le nom de Narsée à ma ſœur fut commis;	Pour achever, enfin, le soin de Sydaris, Sous le nom de Narsée à ma sœur fut commis;
Palmyras, d’autre part, ſous le nom de ſa fille, Inhumant la Princeſſe, abuſa ſa famille, Et voit en ce ieune aſtre éclatter des appas, Dont vingt ans, ont fait croire, & pleurer le trépas;	Palmyras, d'autre part, sous le nom de sa fille, Inhumant la Princesse, abusa sa famille, Et voit en ce jeune astre éclater des appas, Dont vingt ans, ont fait croire, et pleurer le trépas;
SIROES.	SIROES.
O Dieux, ſi ce rapport, n’abuſe mon oreille, Qu'ay-ie, à vous demander, apres cette merueille!	Ô Dieux, si ce rapport, n'abuse mon oreille, Qu'ai-je, à vous demander, après cette merveille!
Le reproche eſtoit iuſte, aux bouches de la Cour, Que le ſang de Syra, m’euſt donné de l’amour;	Le reproche était juste, aux bouches de la Cour, Que le sang de Syra, m'eût donné de l'amour;
Et ſon auerſion, pour moy ſi naturelle, Ne me pouuoit ſouffrir, d’aymer rien qui vint d’elle;	Et son aversion, pour moi si naturelle, Ne me pouvait souffrir, d'aimer rien qui vint d'elle;
Mon cœur, eſtoit trop bon, pour en eſtre ſurpris, Dans mon aueuglement, il ne s’eſt point meſpris;	Mon cœur, était trop bon, pour en être surpris, Dans mon aveuglement, il ne s'est point mépris;
Il n’a rien fait de laſche, & contre ma pensée.	Il n'a rien fait de lâche, et contre ma pensée.
N’aimoit rien de Syra, quand il aimoit Narsée, Mais ſur ce ſeul rapport, te puis-ie adjouſter foy,	N'aimait rien de Syra, quand il aimait Narsée, Mais sur ce seul rapport, te puis-je ajouter foi,
ARTANASDE.	ARTANASDE.
Si les respects, qu’on doit, aux oreilles d’vn Roy;	Si les respects, qu'on doit, aux oreilles d'un Roi;
Si la ſincerité d’vne ame aſſez loyale, Pour auoir tant veſcu, dans la maiſon Royale;	Si la sincérité d'une âme assez loyale, Pour avoir tant vécu, dans la maison Royale;
Qui d’vn injuſte joug, retire vos Eſtats;	Qui d'un injuste joug, retire vos États;
Si m’eſtre deſiſté, du party de la Reine, Dont loing d’executer, i’ay deteſté la haine;	Si m'être desisté, du parti de la Reine, Dont loing d'exécuter, j'ai détesté la haine;
Et ſi ma vie, enfin, que i’oZe haſarder, Ne ſuffiſent, Grand Prince, à vous perſuader, Sur ce debile corps, eſprouuez les tortures, Vous n'en tirereZ pas, des veriteZ plus pures;	Et si ma vie, enfin, que j'oSe hasarder, Ne suffisent, Grand Prince, à vous persuader, Sur ce débile corps, éprouvez les tortures, Vous n'en tirez pas, des vérité plus pures;
QuinZe luſtres, & plus, ont deu prouuer ma foy;	QuinZe lustres, et plus, ont de ver ma foi;
ROES.	ROES.
Quelles graces, bons Dieux!	Quelles grâces, bons Dieux!
& quel heur ie vous doy, Et toy, qui rends le calme, à noſtre amour flottante, Artanaſde, tes biens, paſſeront ton attente;	et quel heur Dieux vous dois, Et toi, qui rends le calme, à notre amour flottante, Artanasde, tes biens, passeront ton attente;
Et feront enuier, l’eſclat de ta maiſon;	Et feront envier, l'éclat de ta maison;
Allons, & garde-moy, ce fer, & ce poiſon.	Allons, et garde-moi, ce fer, et ce poison.
COSROES.	COSROES.
SCENE DEVXIESME.	SCÈNE DEUXIÈME.
ARDARYGVE, SYROES, GARDES, ARTANASDE.	ARDARYGUE, SYROES, GARDES, ARTANASDE.
SARDARIGVE.	SARDARIGUE.
Syre, voſtre grandeur, ne treuue plus d’obſtacles;	Syre, votre grandeur, ne trouve plus d'obstacles;
Chaque heure, chaque inſtant, vous produit des miracles?	Chaque heure, chaque instant, vous produit des miracles?
Et le traité de paix, qu'Emile a conſenty, Engage Heraclius, dedans voſtre party;	Et le traité de paix, qu'Émile a consenti, Engage Héraclius, dedans votre parti;
Mais vne autre nouuelle, & bien plus importante, Qui peut eſtre, Seigneur, paſſera voſtre attente, Eſt que tous les ſoldats, d’vn meſme cœur vnis, Amenent priſonniers, Coſroës, & ſon fils;	Mais une autre nouvelle, et bien plus importante, Qui peut -être, Seigneur, passera votre attente, Est que tous les soldats, d'un même cœur Tris, Amennent prisonniers, Cosroés, et son fils;
SIROES.	SIROES.
Cofroës!	Cofroés!
Dieux!	Dieux!
ie tremble!	Il tremble!
& malgré ma colere.	et malgré ma colère.
A ce malheureux nom, cognois encor mon pere;	À ce malheureux nom, connais encor mon père;
Mais, pour ſe ſaiſir d’eux, quel ordre a-t'on ſuiuy;	Mais, pour se saisir d'eux, quel ordre a-t'-on suivi;
SARDARIGVE.	SARDARIGUE.
Nul, que le Zele ardent, dont tous vous ont ſeruy;	Nul, que le Zèle ardent, dont tous vous ont servi;
A peine vn bruit confus, de quelques voix forcées, Proclamant Mardeſane, a flatté leurs pensées, Et les cœurs des ſoldats, aſſez mal expliquez, Que Sandoce, & Pacor, par mes ſoins pratiquez, Sousleuant les deux Corps, que chacun d’eux commande, Voyons, (nous ont-ils dit) le Roy, qu’on nous demande;	À peine un bruit confus, de quelques voix forcées, Proclamant Mardesane, a flatté leurs pensées, Et les cœurs des soldats, assez mal expliquez, Que Sandoce, et Pacor, par mes soins pratiquez, Souslevant les deux Corps, que chacun d'eux commande, Voyons, (nous ont-ils dit) le Roi, qu'on nous demande;
Mardeſane, à ce mot, paſle, tranſi d’effroy, A peine encor regnant, a ceſſé d’eſtre Roy, Sandoce, s’est d’abord, ſaiſi de ſa perſonne, Coſroës s’eſt eſmeu, quelque alarme ſe donne;	Mardesane, à ce mot, parle, transi d'effroi, À peine encor régnant, a cessé d'être Roi, Sandoce, s'est d'abord, saisi de sa personne, Cosroës s'est ému, quelque alarme se donne;
Mais tous deux arreſteZ, on ceſſe, & ſur le champ, n.	Mais tous deux arrête, on cesse, et sur le champ, n.
Viue Syroës, s’eſtend par tout le camp.	Vive Syroés, s'étend par out le camp.
Et teſmoignant pour vous, des ardeurs infinies, Vous à, comme les voix, les volontés vnies;	Et témoignant pour vous, des ardeurs infinies, Vous à, comme les voix, les volontés unies;
Admirez, quel bon-heur, conduit noſtre proiect?	Admirez, quel bonheur, conduit notre prois?
Deux Roys n’ont dans le camp, treuué pas vn ſuiet;	Deux Rois n'ont dans le camp, trouvé pas un sujet;
L’allarme s’est éteinte, ausſi-toſt qu’allumee, Et voſtre nom, tout ſeul, à meu toute l’armée;	L'alarme s'est éteinte, aussitôt qu'allumée, Et votre nom, tout seul, à meu toute l'armée;
